00:08:10.374170 ARP, Request who-has 10.0.0.2 tell 10.0.0.1, length 28
00:08:10.379793 ARP, Reply 10.0.0.2 is-at 06:b6:cc:e4:73:64, length 28
00:08:10.380835 IP 10.0.0.1.57048 > 10.0.0.2.5001: Flags [S], seq 2980901535, win 29200, options [mss 1460,sackOK,TS val 2291167 ecr 0,nop,wscale 9], length 0
00:08:10.385230 IP 10.0.0.2.5001 > 10.0.0.1.57048: Flags [S.], seq 3545139794, ack 2980901536, win 28960, options [mss 1460,sackOK,TS val 2291171 ecr 2291167,nop,wscale 9], length 0
00:08:10.389794 IP 10.0.0.1.57048 > 10.0.0.2.5001: Flags [.], ack 1, win 58, options [nop,nop,TS val 2291172 ecr 2291171], length 0
00:08:10.389878 IP 10.0.0.1.57048 > 10.0.0.2.5001: Flags [F.], seq 1, ack 1, win 58, options [nop,nop,TS val 2291172 ecr 2291171], length 0
00:08:10.389893 IP 10.0.0.1.57049 > 10.0.0.2.5001: Flags [S], seq 171552841, win 29200, options [mss 1460,sackOK,TS val 2291172 ecr 0,nop,wscale 9], length 0
00:08:10.404927 IP 10.0.0.2.5001 > 10.0.0.1.57048: Flags [.], ack 2, win 57, options [nop,nop,TS val 2291176 ecr 2291172], length 0
00:08:10.406079 IP 10.0.0.2.5001 > 10.0.0.1.57049: Flags [S.], seq 3915204603, ack 171552842, win 28960, options [mss 1460,sackOK,TS val 2291176 ecr 2291172,nop,wscale 9], length 0
00:08:10.406133 IP 10.0.0.2.5001 > 10.0.0.1.57048: Flags [F.], seq 1, ack 2, win 57, options [nop,nop,TS val 2291176 ecr 2291172], length 0
00:08:10.407241 IP 10.0.0.1.57049 > 10.0.0.2.5001: Flags [.], ack 1, win 58, options [nop,nop,TS val 2291177 ecr 2291176], length 0
00:08:10.407481 IP 10.0.0.1.57048 > 10.0.0.2.5001: Flags [.], ack 2, win 58, options [nop,nop,TS val 2291177 ecr 2291176], length 0
00:08:10.408323 IP 10.0.0.1.57049 > 10.0.0.2.5001: Flags [P.], seq 1:25, ack 1, win 58, options [nop,nop,TS val 2291177 ecr 2291176], length 24
00:08:10.408387 IP 10.0.0.1.57049 > 10.0.0.2.5001: Flags [.], seq 25:2921, ack 1, win 58, options [nop,nop,TS val 2291177 ecr 2291176], length 2896
00:08:10.411700 IP 10.0.0.2.5001 > 10.0.0.1.57049: Flags [.], ack 25, win 57, options [nop,nop,TS val 2291178 ecr 2291177], length 0
00:08:10.411702 IP 10.0.0.2.5001 > 10.0.0.1.57049: Flags [.], ack 2921, win 68, options [nop,nop,TS val 2291178 ecr 2291177], length 0
00:08:10.420468 IP 10.0.0.1.57049 > 10.0.0.2.5001: Flags [.], seq 2921:5817, ack 1, win 58, options [nop,nop,TS val 2291177 ecr 2291176], length 2896
00:08:10.424724 IP 10.0.0.2.5001 > 10.0.0.1.57049: Flags [.], ack 5817, win 80, options [nop,nop,TS val 2291181 ecr 2291177], length 0
00:08:10.444697 IP 10.0.0.1.57049 > 10.0.0.2.5001: Flags [.], seq 5817:8713, ack 1, win 58, options [nop,nop,TS val 2291177 ecr 2291176], length 2896
00:08:10.448156 IP 10.0.0.2.5001 > 10.0.0.1.57049: Flags [.], ack 8713, win 91, options [nop,nop,TS val 2291187 ecr 2291177], length 0
00:08:10.468967 IP 10.0.0.1.57049 > 10.0.0.2.5001: Flags [.], seq 8713:11609, ack 1, win 58, options [nop,nop,TS val 2291177 ecr 2291176], length 2896
00:08:10.472541 IP 10.0.0.2.5001 > 10.0.0.1.57049: Flags [.], ack 11609, win 102, options [nop,nop,TS val 2291193 ecr 2291177], length 0
00:08:10.493144 IP 10.0.0.1.57049 > 10.0.0.2.5001: Flags [.], seq 11609:13057, ack 1, win 58, options [nop,nop,TS val 2291177 ecr 2291176], length 1448
00:08:10.496629 IP 10.0.0.2.5001 > 10.0.0.1.57049: Flags [.], ack 13057, win 108, options [nop,nop,TS val 2291199 ecr 2291177], length 0
00:08:10.505281 IP 10.0.0.1.57049 > 10.0.0.2.5001: Flags [P.], seq 13057:15953, ack 1, win 58, options [nop,nop,TS val 2291178 ecr 2291178], length 2896
00:08:10.508654 IP 10.0.0.2.5001 > 10.0.0.1.57049: Flags [.], ack 15953, win 119, options [nop,nop,TS val 2291202 ecr 2291178], length 0
00:08:10.529498 IP 10.0.0.1.57049 > 10.0.0.2.5001: Flags [.], seq 15953:18849, ack 1, win 58, options [nop,nop,TS val 2291178 ecr 2291178], length 2896
00:08:10.533693 IP 10.0.0.2.5001 > 10.0.0.1.57049: Flags [.], ack 18849, win 131, options [nop,nop,TS val 2291208 ecr 2291178], length 0
00:08:10.553694 IP 10.0.0.1.57049 > 10.0.0.2.5001: Flags [.], seq 18849:21745, ack 1, win 58, options [nop,nop,TS val 2291178 ecr 2291178], length 2896
00:08:10.557920 IP 10.0.0.2.5001 > 10.0.0.1.57049: Flags [.], ack 21745, win 142, options [nop,nop,TS val 2291214 ecr 2291178], length 0
00:08:10.577950 IP 10.0.0.1.57049 > 10.0.0.2.5001: Flags [.], seq 21745:24641, ack 1, win 58, options [nop,nop,TS val 2291182 ecr 2291181], length 2896
00:08:10.581367 IP 10.0.0.2.5001 > 10.0.0.1.57049: Flags [.], ack 24641, win 153, options [nop,nop,TS val 2291220 ecr 2291182], length 0
00:08:10.602159 IP 10.0.0.1.57049 > 10.0.0.2.5001: Flags [.], seq 24641:27537, ack 1, win 58, options [nop,nop,TS val 2291182 ecr 2291181], length 2896
00:08:10.605607 IP 10.0.0.2.5001 > 10.0.0.1.57049: Flags [.], ack 27537, win 165, options [nop,nop,TS val 2291226 ecr 2291182], length 0
00:08:10.626369 IP 10.0.0.1.57049 > 10.0.0.2.5001: Flags [.], seq 27537:30433, ack 1, win 58, options [nop,nop,TS val 2291188 ecr 2291187], length 2896
00:08:10.629758 IP 10.0.0.2.5001 > 10.0.0.1.57049: Flags [.], ack 30433, win 176, options [nop,nop,TS val 2291232 ecr 2291188], length 0
00:08:10.650596 IP 10.0.0.1.57049 > 10.0.0.2.5001: Flags [P.], seq 30433:33329, ack 1, win 58, options [nop,nop,TS val 2291188 ecr 2291187], length 2896
00:08:10.653887 IP 10.0.0.2.5001 > 10.0.0.1.57049: Flags [.], ack 33329, win 187, options [nop,nop,TS val 2291238 ecr 2291188], length 0
00:08:10.674815 IP 10.0.0.1.57049 > 10.0.0.2.5001: Flags [.], seq 33329:36225, ack 1, win 58, options [nop,nop,TS val 2291194 ecr 2291193], length 2896
00:08:10.678153 IP 10.0.0.2.5001 > 10.0.0.1.57049: Flags [.], ack 36225, win 198, options [nop,nop,TS val 2291245 ecr 2291194], length 0
00:08:10.699046 IP 10.0.0.1.57049 > 10.0.0.2.5001: Flags [.], seq 36225:39121, ack 1, win 58, options [nop,nop,TS val 2291194 ecr 2291193], length 2896
00:08:10.702371 IP 10.0.0.2.5001 > 10.0.0.1.57049: Flags [.], ack 39121, win 210, options [nop,nop,TS val 2291251 ecr 2291194], length 0
00:08:10.723264 IP 10.0.0.1.57049 > 10.0.0.2.5001: Flags [.], seq 39121:42017, ack 1, win 58, options [nop,nop,TS val 2291200 ecr 2291199], length 2896
00:08:10.726597 IP 10.0.0.2.5001 > 10.0.0.1.57049: Flags [.], ack 42017, win 221, options [nop,nop,TS val 2291257 ecr 2291200], length 0
00:08:10.747491 IP 10.0.0.1.57049 > 10.0.0.2.5001: Flags [.], seq 42017:44913, ack 1, win 58, options [nop,nop,TS val 2291203 ecr 2291202], length 2896
00:08:10.750848 IP 10.0.0.2.5001 > 10.0.0.1.57049: Flags [.], ack 44913, win 232, options [nop,nop,TS val 2291263 ecr 2291203], length 0
00:08:10.771721 IP 10.0.0.1.57049 > 10.0.0.2.5001: Flags [.], seq 44913:47809, ack 1, win 58, options [nop,nop,TS val 2291203 ecr 2291202], length 2896
00:08:10.775056 IP 10.0.0.2.5001 > 10.0.0.1.57049: Flags [.], ack 47809, win 244, options [nop,nop,TS val 2291269 ecr 2291203], length 0
00:08:10.795935 IP 10.0.0.1.57049 > 10.0.0.2.5001: Flags [P.], seq 47809:50705, ack 1, win 58, options [nop,nop,TS val 2291209 ecr 2291208], length 2896
00:08:10.820164 IP 10.0.0.1.57049 > 10.0.0.2.5001: Flags [.], seq 50705:53601, ack 1, win 58, options [nop,nop,TS val 2291209 ecr 2291208], length 2896
00:08:10.823505 IP 10.0.0.2.5001 > 10.0.0.1.57049: Flags [.], ack 53601, win 266, options [nop,nop,TS val 2291281 ecr 2291209], length 0
00:08:10.844381 IP 10.0.0.1.57049 > 10.0.0.2.5001: Flags [.], seq 53601:56497, ack 1, win 58, options [nop,nop,TS val 2291215 ecr 2291214], length 2896
00:08:10.847762 IP 10.0.0.2.5001 > 10.0.0.1.57049: Flags [.], ack 56497, win 278, options [nop,nop,TS val 2291287 ecr 2291215], length 0
00:08:10.868607 IP 10.0.0.1.57049 > 10.0.0.2.5001: Flags [.], seq 56497:59393, ack 1, win 58, options [nop,nop,TS val 2291215 ecr 2291214], length 2896
00:08:10.871946 IP 10.0.0.2.5001 > 10.0.0.1.57049: Flags [.], ack 59393, win 289, options [nop,nop,TS val 2291293 ecr 2291215], length 0
00:08:10.892843 IP 10.0.0.1.57049 > 10.0.0.2.5001: Flags [.], seq 59393:62289, ack 1, win 58, options [nop,nop,TS val 2291221 ecr 2291220], length 2896
00:08:10.896182 IP 10.0.0.2.5001 > 10.0.0.1.57049: Flags [.], ack 62289, win 300, options [nop,nop,TS val 2291299 ecr 2291221], length 0
00:08:10.917743 IP 10.0.0.1.57049 > 10.0.0.2.5001: Flags [P.], seq 62289:65185, ack 1, win 58, options [nop,nop,TS val 2291221 ecr 2291220], length 2896
00:08:10.920872 IP 10.0.0.2.5001 > 10.0.0.1.57049: Flags [.], ack 65185, win 312, options [nop,nop,TS val 2291305 ecr 2291221], length 0
00:08:10.941295 IP 10.0.0.1.57049 > 10.0.0.2.5001: Flags [.], seq 65185:68081, ack 1, win 58, options [nop,nop,TS val 2291227 ecr 2291226], length 2896
00:08:10.944619 IP 10.0.0.2.5001 > 10.0.0.1.57049: Flags [.], ack 68081, win 323, options [nop,nop,TS val 2291311 ecr 2291227], length 0
00:08:10.965502 IP 10.0.0.1.57049 > 10.0.0.2.5001: Flags [.], seq 68081:70977, ack 1, win 58, options [nop,nop,TS val 2291227 ecr 2291226], length 2896
00:08:10.968800 IP 10.0.0.2.5001 > 10.0.0.1.57049: Flags [.], ack 70977, win 334, options [nop,nop,TS val 2291317 ecr 2291227], length 0
00:08:10.989727 IP 10.0.0.1.57049 > 10.0.0.2.5001: Flags [.], seq 70977:73873, ack 1, win 58, options [nop,nop,TS val 2291233 ecr 2291232], length 2896
00:08:10.993065 IP 10.0.0.2.5001 > 10.0.0.1.57049: Flags [.], ack 73873, win 346, options [nop,nop,TS val 2291323 ecr 2291233], length 0
00:08:11.013956 IP 10.0.0.1.57049 > 10.0.0.2.5001: Flags [.], seq 76769:79665, ack 1, win 58, options [nop,nop,TS val 2291239 ecr 2291238], length 2896
00:08:11.017284 IP 10.0.0.2.5001 > 10.0.0.1.57049: Flags [.], ack 73873, win 357, options [nop,nop,TS val 2291329 ecr 2291233,nop,nop,sack 1 {76769:79665}], length 0
00:08:11.038175 IP 10.0.0.1.57049 > 10.0.0.2.5001: Flags [.], seq 79665:82561, ack 1, win 58, options [nop,nop,TS val 2291239 ecr 2291238], length 2896
00:08:11.041550 IP 10.0.0.2.5001 > 10.0.0.1.57049: Flags [.], ack 73873, win 363, options [nop,nop,TS val 2291335 ecr 2291233,nop,nop,sack 1 {76769:82561}], length 0
00:08:11.062400 IP 10.0.0.1.57049 > 10.0.0.2.5001: Flags [.], seq 82561:85457, ack 1, win 58, options [nop,nop,TS val 2291245 ecr 2291245], length 2896
00:08:11.065728 IP 10.0.0.2.5001 > 10.0.0.1.57049: Flags [.], ack 73873, win 363, options [nop,nop,TS val 2291341 ecr 2291233,nop,nop,sack 1 {76769:85457}], length 0
00:08:11.086623 IP 10.0.0.1.57049 > 10.0.0.2.5001: Flags [.], seq 85457:88353, ack 1, win 58, options [nop,nop,TS val 2291245 ecr 2291245], length 2896
00:08:11.089977 IP 10.0.0.2.5001 > 10.0.0.1.57049: Flags [.], ack 73873, win 363, options [nop,nop,TS val 2291347 ecr 2291233,nop,nop,sack 1 {76769:88353}], length 0
00:08:11.110847 IP 10.0.0.1.57049 > 10.0.0.2.5001: Flags [P.], seq 88353:91249, ack 1, win 58, options [nop,nop,TS val 2291251 ecr 2291251], length 2896
00:08:11.114174 IP 10.0.0.2.5001 > 10.0.0.1.57049: Flags [.], ack 73873, win 363, options [nop,nop,TS val 2291354 ecr 2291233,nop,nop,sack 1 {76769:91249}], length 0
00:08:11.135078 IP 10.0.0.1.57049 > 10.0.0.2.5001: Flags [.], seq 91249:94145, ack 1, win 58, options [nop,nop,TS val 2291251 ecr 2291251], length 2896
00:08:11.138419 IP 10.0.0.2.5001 > 10.0.0.1.57049: Flags [.], ack 73873, win 363, options [nop,nop,TS val 2291360 ecr 2291233,nop,nop,sack 1 {76769:94145}], length 0
00:08:11.159296 IP 10.0.0.1.57049 > 10.0.0.2.5001: Flags [.], seq 94145:97041, ack 1, win 58, options [nop,nop,TS val 2291257 ecr 2291257], length 2896
00:08:11.162630 IP 10.0.0.2.5001 > 10.0.0.1.57049: Flags [.], ack 73873, win 363, options [nop,nop,TS val 2291366 ecr 2291233,nop,nop,sack 1 {76769:97041}], length 0
00:08:11.183523 IP 10.0.0.1.57049 > 10.0.0.2.5001: Flags [.], seq 99937:102833, ack 1, win 58, options [nop,nop,TS val 2291269 ecr 2291269], length 2896
00:08:11.186858 IP 10.0.0.2.5001 > 10.0.0.1.57049: Flags [.], ack 73873, win 363, options [nop,nop,TS val 2291372 ecr 2291233,nop,nop,sack 2 {99937:102833}{76769:97041}], length 0
00:08:11.207744 IP 10.0.0.1.57049 > 10.0.0.2.5001: Flags [.], seq 102833:105729, ack 1, win 58, options [nop,nop,TS val 2291281 ecr 2291281], length 2896
00:08:11.211081 IP 10.0.0.2.5001 > 10.0.0.1.57049: Flags [.], ack 73873, win 363, options [nop,nop,TS val 2291378 ecr 2291233,nop,nop,sack 2 {99937:105729}{76769:97041}], length 0
00:08:11.231967 IP 10.0.0.1.57049 > 10.0.0.2.5001: Flags [.], seq 105729:108625, ack 1, win 58, options [nop,nop,TS val 2291281 ecr 2291281], length 2896
00:08:11.236067 IP 10.0.0.2.5001 > 10.0.0.1.57049: Flags [.], ack 73873, win 363, options [nop,nop,TS val 2291384 ecr 2291233,nop,nop,sack 2 {99937:108625}{76769:97041}], length 0
00:08:11.256198 IP 10.0.0.1.57049 > 10.0.0.2.5001: Flags [.], seq 108625:111521, ack 1, win 58, options [nop,nop,TS val 2291287 ecr 2291287], length 2896
00:08:11.259541 IP 10.0.0.2.5001 > 10.0.0.1.57049: Flags [.], ack 73873, win 363, options [nop,nop,TS val 2291390 ecr 2291233,nop,nop,sack 2 {99937:111521}{76769:97041}], length 0
00:08:11.280414 IP 10.0.0.1.57049 > 10.0.0.2.5001: Flags [.], seq 111521:114417, ack 1, win 58, options [nop,nop,TS val 2291293 ecr 2291293], length 2896
00:08:11.283715 IP 10.0.0.2.5001 > 10.0.0.1.57049: Flags [.], ack 73873, win 363, options [nop,nop,TS val 2291396 ecr 2291233,nop,nop,sack 2 {99937:114417}{76769:97041}], length 0
00:08:11.304830 IP 10.0.0.1.57049 > 10.0.0.2.5001: Flags [.], seq 114417:117313, ack 1, win 58, options [nop,nop,TS val 2291300 ecr 2291299], length 2896
00:08:11.308257 IP 10.0.0.2.5001 > 10.0.0.1.57049: Flags [.], ack 73873, win 363, options [nop,nop,TS val 2291402 ecr 2291233,nop,nop,sack 2 {99937:117313}{76769:97041}], length 0
00:08:11.328862 IP 10.0.0.1.57049 > 10.0.0.2.5001: Flags [.], seq 117313:120209, ack 1, win 58, options [nop,nop,TS val 2291306 ecr 2291305], length 2896
00:08:11.332168 IP 10.0.0.2.5001 > 10.0.0.1.57049: Flags [.], ack 73873, win 363, options [nop,nop,TS val 2291408 ecr 2291233,nop,nop,sack 2 {99937:120209}{76769:97041}], length 0
00:08:11.353086 IP 10.0.0.1.57049 > 10.0.0.2.5001: Flags [.], seq 120209:123105, ack 1, win 58, options [nop,nop,TS val 2291312 ecr 2291311], length 2896
00:08:11.356897 IP 10.0.0.2.5001 > 10.0.0.1.57049: Flags [.], ack 73873, win 363, options [nop,nop,TS val 2291414 ecr 2291233,nop,nop,sack 2 {99937:123105}{76769:97041}], length 0
00:08:11.377311 IP 10.0.0.1.57049 > 10.0.0.2.5001: Flags [.], seq 123105:126001, ack 1, win 58, options [nop,nop,TS val 2291318 ecr 2291317], length 2896
00:08:11.380622 IP 10.0.0.2.5001 > 10.0.0.1.57049: Flags [.], ack 73873, win 363, options [nop,nop,TS val 2291420 ecr 2291233,nop,nop,sack 2 {99937:126001}{76769:97041}], length 0
00:08:11.401538 IP 10.0.0.1.57049 > 10.0.0.2.5001: Flags [.], seq 126001:128897, ack 1, win 58, options [nop,nop,TS val 2291324 ecr 2291323], length 2896
00:08:11.404843 IP 10.0.0.2.5001 > 10.0.0.1.57049: Flags [.], ack 73873, win 363, options [nop,nop,TS val 2291426 ecr 2291233,nop,nop,sack 2 {99937:128897}{76769:97041}], length 0
00:08:11.425751 IP 10.0.0.1.57049 > 10.0.0.2.5001: Flags [.], seq 128897:131793, ack 1, win 58, options [nop,nop,TS val 2291324 ecr 2291323], length 2896
00:08:11.429086 IP 10.0.0.2.5001 > 10.0.0.1.57049: Flags [.], ack 73873, win 363, options [nop,nop,TS val 2291432 ecr 2291233,nop,nop,sack 2 {99937:131793}{76769:97041}], length 0
00:08:11.449992 IP 10.0.0.1.57049 > 10.0.0.2.5001: Flags [.], seq 73873:75321, ack 1, win 58, options [nop,nop,TS val 2291330 ecr 2291329], length 1448
00:08:11.453291 IP 10.0.0.2.5001 > 10.0.0.1.57049: Flags [.], ack 75321, win 363, options [nop,nop,TS val 2291438 ecr 2291330,nop,nop,sack 2 {99937:131793}{76769:97041}], length 0
00:08:11.462098 IP 10.0.0.1.57049 > 10.0.0.2.5001: Flags [.], seq 131793:133241, ack 1, win 58, options [nop,nop,TS val 2291330 ecr 2291329], length 1448
00:08:11.465390 IP 10.0.0.2.5001 > 10.0.0.1.57049: Flags [.], ack 75321, win 363, options [nop,nop,TS val 2291441 ecr 2291330,nop,nop,sack 2 {99937:133241}{76769:97041}], length 0
00:08:11.474206 IP 10.0.0.1.57049 > 10.0.0.2.5001: Flags [.], seq 75321:76769, ack 1, win 58, options [nop,nop,TS val 2291336 ecr 2291335], length 1448
00:08:11.477541 IP 10.0.0.2.5001 > 10.0.0.1.57049: Flags [.], ack 97041, win 363, options [nop,nop,TS val 2291444 ecr 2291336,nop,nop,sack 1 {99937:133241}], length 0
00:08:11.486321 IP 10.0.0.1.57049 > 10.0.0.2.5001: Flags [.], seq 133241:134689, ack 1, win 58, options [nop,nop,TS val 2291342 ecr 2291341], length 1448
00:08:11.489625 IP 10.0.0.2.5001 > 10.0.0.1.57049: Flags [.], ack 97041, win 363, options [nop,nop,TS val 2291447 ecr 2291336,nop,nop,sack 1 {99937:134689}], length 0
00:08:11.498430 IP 10.0.0.1.57049 > 10.0.0.2.5001: Flags [.], seq 134689:136137, ack 1, win 58, options [nop,nop,TS val 2291342 ecr 2291341], length 1448
00:08:11.501737 IP 10.0.0.2.5001 > 10.0.0.1.57049: Flags [.], ack 97041, win 363, options [nop,nop,TS val 2291450 ecr 2291336,nop,nop,sack 1 {99937:136137}], length 0
00:08:11.510541 IP 10.0.0.1.57049 > 10.0.0.2.5001: Flags [.], seq 136137:137585, ack 1, win 58, options [nop,nop,TS val 2291348 ecr 2291347], length 1448
00:08:11.513854 IP 10.0.0.2.5001 > 10.0.0.1.57049: Flags [.], ack 97041, win 363, options [nop,nop,TS val 2291453 ecr 2291336,nop,nop,sack 1 {99937:137585}], length 0
00:08:11.522655 IP 10.0.0.1.57049 > 10.0.0.2.5001: Flags [.], seq 137585:139033, ack 1, win 58, options [nop,nop,TS val 2291354 ecr 2291354], length 1448
00:08:11.525963 IP 10.0.0.2.5001 > 10.0.0.1.57049: Flags [.], ack 97041, win 363, options [nop,nop,TS val 2291456 ecr 2291336,nop,nop,sack 1 {99937:139033}], length 0
00:08:11.534771 IP 10.0.0.1.57049 > 10.0.0.2.5001: Flags [.], seq 139033:140481, ack 1, win 58, options [nop,nop,TS val 2291360 ecr 2291360], length 1448
00:08:11.538059 IP 10.0.0.2.5001 > 10.0.0.1.57049: Flags [.], ack 97041, win 363, options [nop,nop,TS val 2291460 ecr 2291336,nop,nop,sack 1 {99937:140481}], length 0
00:08:11.546876 IP 10.0.0.1.57049 > 10.0.0.2.5001: Flags [.], seq 140481:141929, ack 1, win 58, options [nop,nop,TS val 2291360 ecr 2291360], length 1448
00:08:11.550218 IP 10.0.0.2.5001 > 10.0.0.1.57049: Flags [.], ack 97041, win 363, options [nop,nop,TS val 2291463 ecr 2291336,nop,nop,sack 1 {99937:141929}], length 0
00:08:11.558991 IP 10.0.0.1.57049 > 10.0.0.2.5001: Flags [.], seq 141929:143377, ack 1, win 58, options [nop,nop,TS val 2291366 ecr 2291366], length 1448
00:08:11.562284 IP 10.0.0.2.5001 > 10.0.0.1.57049: Flags [.], ack 97041, win 363, options [nop,nop,TS val 2291466 ecr 2291336,nop,nop,sack 1 {99937:143377}], length 0
00:08:11.571103 IP 10.0.0.1.57049 > 10.0.0.2.5001: Flags [.], seq 97041:98489, ack 1, win 58, options [nop,nop,TS val 2291372 ecr 2291372], length 1448
00:08:11.583213 IP 10.0.0.1.57049 > 10.0.0.2.5001: Flags [.], seq 143377:144825, ack 1, win 58, options [nop,nop,TS val 2291372 ecr 2291372], length 1448
00:08:11.586486 IP 10.0.0.2.5001 > 10.0.0.1.57049: Flags [.], ack 98489, win 363, options [nop,nop,TS val 2291472 ecr 2291372,nop,nop,sack 1 {99937:144825}], length 0
00:08:11.595330 IP 10.0.0.1.57049 > 10.0.0.2.5001: Flags [.], seq 98489:99937, ack 1, win 58, options [nop,nop,TS val 2291378 ecr 2291378], length 1448
00:08:11.598618 IP 10.0.0.2.5001 > 10.0.0.1.57049: Flags [.], ack 144825, win 363, options [nop,nop,TS val 2291475 ecr 2291378], length 0
00:08:11.607438 IP 10.0.0.1.57049 > 10.0.0.2.5001: Flags [.], seq 144825:146273, ack 1, win 58, options [nop,nop,TS val 2291385 ecr 2291384], length 1448
00:08:11.610783 IP 10.0.0.2.5001 > 10.0.0.1.57049: Flags [.], ack 146273, win 363, options [nop,nop,TS val 2291478 ecr 2291385], length 0
00:08:11.619562 IP 10.0.0.1.57049 > 10.0.0.2.5001: Flags [.], seq 146273:149169, ack 1, win 58, options [nop,nop,TS val 2291396 ecr 2291396], length 2896
00:08:11.624106 IP 10.0.0.2.5001 > 10.0.0.1.57049: Flags [.], ack 149169, win 363, options [nop,nop,TS val 2291481 ecr 2291396], length 0
00:08:11.643782 IP 10.0.0.1.57049 > 10.0.0.2.5001: Flags [.], seq 149169:152065, ack 1, win 58, options [nop,nop,TS val 2291403 ecr 2291402], length 2896
00:08:11.647307 IP 10.0.0.2.5001 > 10.0.0.1.57049: Flags [.], ack 152065, win 363, options [nop,nop,TS val 2291487 ecr 2291403], length 0
00:08:11.668020 IP 10.0.0.1.57049 > 10.0.0.2.5001: Flags [.], seq 152065:154961, ack 1, win 58, options [nop,nop,TS val 2291409 ecr 2291408], length 2896
00:08:11.671774 IP 10.0.0.2.5001 > 10.0.0.1.57049: Flags [.], ack 154961, win 363, options [nop,nop,TS val 2291493 ecr 2291409], length 0
00:08:11.692227 IP 10.0.0.1.57049 > 10.0.0.2.5001: Flags [.], seq 154961:157857, ack 1, win 58, options [nop,nop,TS val 2291415 ecr 2291414], length 2896
00:08:11.716458 IP 10.0.0.1.57049 > 10.0.0.2.5001: Flags [.], seq 157857:160753, ack 1, win 58, options [nop,nop,TS val 2291421 ecr 2291420], length 2896
00:08:11.719613 IP 10.0.0.2.5001 > 10.0.0.1.57049: Flags [.], ack 154961, win 363, options [nop,nop,TS val 2291505 ecr 2291409,nop,nop,sack 1 {157857:160753}], length 0
00:08:11.740676 IP 10.0.0.1.57049 > 10.0.0.2.5001: Flags [.], seq 160753:163649, ack 1, win 58, options [nop,nop,TS val 2291427 ecr 2291426], length 2896
00:08:11.743866 IP 10.0.0.2.5001 > 10.0.0.1.57049: Flags [.], ack 154961, win 363, options [nop,nop,TS val 2291511 ecr 2291409,nop,nop,sack 1 {157857:163649}], length 0
00:08:11.764905 IP 10.0.0.1.57049 > 10.0.0.2.5001: Flags [.], seq 163649:166545, ack 1, win 58, options [nop,nop,TS val 2291433 ecr 2291432], length 2896
00:08:11.768533 IP 10.0.0.2.5001 > 10.0.0.1.57049: Flags [.], ack 154961, win 363, options [nop,nop,TS val 2291517 ecr 2291409,nop,nop,sack 1 {157857:166545}], length 0
00:08:11.789124 IP 10.0.0.1.57049 > 10.0.0.2.5001: Flags [.], seq 166545:167993, ack 1, win 58, options [nop,nop,TS val 2291439 ecr 2291438], length 1448
00:08:11.792397 IP 10.0.0.2.5001 > 10.0.0.1.57049: Flags [.], ack 154961, win 363, options [nop,nop,TS val 2291523 ecr 2291409,nop,nop,sack 1 {157857:167993}], length 0
00:08:11.801262 IP 10.0.0.1.57049 > 10.0.0.2.5001: Flags [.], seq 167993:169441, ack 1, win 58, options [nop,nop,TS val 2291442 ecr 2291441], length 1448
00:08:11.805330 IP 10.0.0.2.5001 > 10.0.0.1.57049: Flags [.], ack 154961, win 363, options [nop,nop,TS val 2291526 ecr 2291409,nop,nop,sack 1 {157857:169441}], length 0
00:08:11.813343 IP 10.0.0.1.57049 > 10.0.0.2.5001: Flags [.], seq 169441:170889, ack 1, win 58, options [nop,nop,TS val 2291445 ecr 2291444], length 1448
00:08:11.816763 IP 10.0.0.2.5001 > 10.0.0.1.57049: Flags [.], ack 154961, win 363, options [nop,nop,TS val 2291529 ecr 2291409,nop,nop,sack 1 {157857:170889}], length 0
00:08:11.825458 IP 10.0.0.1.57049 > 10.0.0.2.5001: Flags [.], seq 170889:172337, ack 1, win 58, options [nop,nop,TS val 2291448 ecr 2291447], length 1448
00:08:11.828631 IP 10.0.0.2.5001 > 10.0.0.1.57049: Flags [.], ack 154961, win 363, options [nop,nop,TS val 2291532 ecr 2291409,nop,nop,sack 1 {157857:172337}], length 0
00:08:11.837578 IP 10.0.0.1.57049 > 10.0.0.2.5001: Flags [.], seq 172337:173785, ack 1, win 58, options [nop,nop,TS val 2291451 ecr 2291450], length 1448
00:08:11.840753 IP 10.0.0.2.5001 > 10.0.0.1.57049: Flags [.], ack 154961, win 363, options [nop,nop,TS val 2291535 ecr 2291409,nop,nop,sack 1 {157857:173785}], length 0
00:08:11.850485 IP 10.0.0.1.57049 > 10.0.0.2.5001: Flags [.], seq 173785:175233, ack 1, win 58, options [nop,nop,TS val 2291454 ecr 2291453], length 1448
00:08:11.853671 IP 10.0.0.2.5001 > 10.0.0.1.57049: Flags [.], ack 154961, win 363, options [nop,nop,TS val 2291538 ecr 2291409,nop,nop,sack 1 {157857:175233}], length 0
00:08:11.861806 IP 10.0.0.1.57049 > 10.0.0.2.5001: Flags [.], seq 175233:176681, ack 1, win 58, options [nop,nop,TS val 2291457 ecr 2291456], length 1448
00:08:11.864985 IP 10.0.0.2.5001 > 10.0.0.1.57049: Flags [.], ack 154961, win 363, options [nop,nop,TS val 2291541 ecr 2291409,nop,nop,sack 1 {157857:176681}], length 0
00:08:11.873930 IP 10.0.0.1.57049 > 10.0.0.2.5001: Flags [.], seq 176681:178129, ack 1, win 58, options [nop,nop,TS val 2291460 ecr 2291460], length 1448
00:08:11.877891 IP 10.0.0.2.5001 > 10.0.0.1.57049: Flags [.], ack 154961, win 363, options [nop,nop,TS val 2291544 ecr 2291409,nop,nop,sack 1 {157857:178129}], length 0
00:08:11.886029 IP 10.0.0.1.57049 > 10.0.0.2.5001: Flags [.], seq 178129:179577, ack 1, win 58, options [nop,nop,TS val 2291463 ecr 2291463], length 1448
00:08:11.889280 IP 10.0.0.2.5001 > 10.0.0.1.57049: Flags [.], ack 154961, win 363, options [nop,nop,TS val 2291547 ecr 2291409,nop,nop,sack 1 {157857:179577}], length 0
00:08:11.898902 IP 10.0.0.1.57049 > 10.0.0.2.5001: Flags [.], seq 179577:181025, ack 1, win 58, options [nop,nop,TS val 2291466 ecr 2291466], length 1448
00:08:11.902178 IP 10.0.0.2.5001 > 10.0.0.1.57049: Flags [.], ack 154961, win 363, options [nop,nop,TS val 2291551 ecr 2291409,nop,nop,sack 1 {157857:181025}], length 0
00:08:11.910247 IP 10.0.0.1.57049 > 10.0.0.2.5001: Flags [.], seq 181025:183921, ack 1, win 58, options [nop,nop,TS val 2291472 ecr 2291472], length 2896
00:08:11.913489 IP 10.0.0.2.5001 > 10.0.0.1.57049: Flags [.], ack 154961, win 363, options [nop,nop,TS val 2291553 ecr 2291409,nop,nop,sack 1 {157857:183921}], length 0
00:08:11.934490 IP 10.0.0.1.57049 > 10.0.0.2.5001: Flags [P.], seq 183921:186817, ack 1, win 58, options [nop,nop,TS val 2291478 ecr 2291478], length 2896
00:08:11.938601 IP 10.0.0.2.5001 > 10.0.0.1.57049: Flags [.], ack 154961, win 363, options [nop,nop,TS val 2291559 ecr 2291409,nop,nop,sack 1 {157857:186817}], length 0
00:08:11.958693 IP 10.0.0.1.57049 > 10.0.0.2.5001: Flags [.], seq 186817:189713, ack 1, win 58, options [nop,nop,TS val 2291482 ecr 2291481], length 2896
00:08:11.961971 IP 10.0.0.2.5001 > 10.0.0.1.57049: Flags [.], ack 154961, win 363, options [nop,nop,TS val 2291565 ecr 2291409,nop,nop,sack 1 {157857:189713}], length 0
00:08:11.982914 IP 10.0.0.1.57049 > 10.0.0.2.5001: Flags [.], seq 189713:192609, ack 1, win 58, options [nop,nop,TS val 2291487 ecr 2291487], length 2896
00:08:11.986083 IP 10.0.0.2.5001 > 10.0.0.1.57049: Flags [.], ack 154961, win 363, options [nop,nop,TS val 2291571 ecr 2291409,nop,nop,sack 1 {157857:192609}], length 0
00:08:12.007138 IP 10.0.0.1.57049 > 10.0.0.2.5001: Flags [.], seq 192609:195505, ack 1, win 58, options [nop,nop,TS val 2291493 ecr 2291493], length 2896
00:08:12.010296 IP 10.0.0.2.5001 > 10.0.0.1.57049: Flags [.], ack 154961, win 363, options [nop,nop,TS val 2291578 ecr 2291409,nop,nop,sack 1 {157857:195505}], length 0
00:08:12.031363 IP 10.0.0.1.57049 > 10.0.0.2.5001: Flags [.], seq 154961:156409, ack 1, win 58, options [nop,nop,TS val 2291505 ecr 2291505], length 1448
00:08:12.034723 IP 10.0.0.2.5001 > 10.0.0.1.57049: Flags [.], ack 156409, win 369, options [nop,nop,TS val 2291584 ecr 2291505,nop,nop,sack 1 {157857:195505}], length 0
00:08:12.043479 IP 10.0.0.1.57049 > 10.0.0.2.5001: Flags [.], seq 195505:196953, ack 1, win 58, options [nop,nop,TS val 2291505 ecr 2291505], length 1448
00:08:12.046646 IP 10.0.0.2.5001 > 10.0.0.1.57049: Flags [.], ack 156409, win 375, options [nop,nop,TS val 2291587 ecr 2291505,nop,nop,sack 1 {157857:196953}], length 0
00:08:12.055574 IP 10.0.0.1.57049 > 10.0.0.2.5001: Flags [.], seq 156409:157857, ack 1, win 58, options [nop,nop,TS val 2291511 ecr 2291511], length 1448
00:08:12.058748 IP 10.0.0.2.5001 > 10.0.0.1.57049: Flags [.], ack 196953, win 380, options [nop,nop,TS val 2291590 ecr 2291511], length 0
00:08:12.067702 IP 10.0.0.1.57049 > 10.0.0.2.5001: Flags [.], seq 196953:198401, ack 1, win 58, options [nop,nop,TS val 2291518 ecr 2291517], length 1448
00:08:12.070834 IP 10.0.0.2.5001 > 10.0.0.1.57049: Flags [.], ack 198401, win 386, options [nop,nop,TS val 2291593 ecr 2291518], length 0
00:08:12.079806 IP 10.0.0.1.57049 > 10.0.0.2.5001: Flags [.], seq 198401:199849, ack 1, win 58, options [nop,nop,TS val 2291518 ecr 2291517], length 1448
00:08:12.091923 IP 10.0.0.1.57049 > 10.0.0.2.5001: Flags [.], seq 199849:201297, ack 1, win 58, options [nop,nop,TS val 2291527 ecr 2291526], length 1448
00:08:12.095272 IP 10.0.0.2.5001 > 10.0.0.1.57049: Flags [.], ack 198401, win 392, options [nop,nop,TS val 2291599 ecr 2291518,nop,nop,sack 1 {199849:201297}], length 0
00:08:12.104033 IP 10.0.0.1.57049 > 10.0.0.2.5001: Flags [.], seq 201297:202745, ack 1, win 58, options [nop,nop,TS val 2291530 ecr 2291529], length 1448
00:08:12.107198 IP 10.0.0.2.5001 > 10.0.0.1.57049: Flags [.], ack 198401, win 397, options [nop,nop,TS val 2291602 ecr 2291518,nop,nop,sack 1 {199849:202745}], length 0
00:08:12.116146 IP 10.0.0.1.57049 > 10.0.0.2.5001: Flags [.], seq 202745:204193, ack 1, win 58, options [nop,nop,TS val 2291536 ecr 2291535], length 1448
00:08:12.119253 IP 10.0.0.2.5001 > 10.0.0.1.57049: Flags [.], ack 198401, win 403, options [nop,nop,TS val 2291605 ecr 2291518,nop,nop,sack 1 {199849:204193}], length 0
00:08:12.128259 IP 10.0.0.1.57049 > 10.0.0.2.5001: Flags [.], seq 204193:205641, ack 1, win 58, options [nop,nop,TS val 2291539 ecr 2291538], length 1448
00:08:12.131368 IP 10.0.0.2.5001 > 10.0.0.1.57049: Flags [.], ack 198401, win 409, options [nop,nop,TS val 2291608 ecr 2291518,nop,nop,sack 1 {199849:205641}], length 0
00:08:12.140367 IP 10.0.0.1.57049 > 10.0.0.2.5001: Flags [.], seq 205641:207089, ack 1, win 58, options [nop,nop,TS val 2291545 ecr 2291544], length 1448
00:08:12.143471 IP 10.0.0.2.5001 > 10.0.0.1.57049: Flags [.], ack 198401, win 414, options [nop,nop,TS val 2291611 ecr 2291518,nop,nop,sack 1 {199849:207089}], length 0
00:08:12.152482 IP 10.0.0.1.57049 > 10.0.0.2.5001: Flags [.], seq 207089:208537, ack 1, win 58, options [nop,nop,TS val 2291548 ecr 2291547], length 1448
00:08:12.155614 IP 10.0.0.2.5001 > 10.0.0.1.57049: Flags [.], ack 198401, win 420, options [nop,nop,TS val 2291614 ecr 2291518,nop,nop,sack 1 {199849:208537}], length 0
00:08:12.164593 IP 10.0.0.1.57049 > 10.0.0.2.5001: Flags [.], seq 208537:209985, ack 1, win 58, options [nop,nop,TS val 2291551 ecr 2291551], length 1448
00:08:12.167688 IP 10.0.0.2.5001 > 10.0.0.1.57049: Flags [.], ack 198401, win 425, options [nop,nop,TS val 2291617 ecr 2291518,nop,nop,sack 1 {199849:209985}], length 0
00:08:12.176703 IP 10.0.0.1.57049 > 10.0.0.2.5001: Flags [.], seq 209985:212881, ack 1, win 58, options [nop,nop,TS val 2291560 ecr 2291559], length 2896
00:08:12.179804 IP 10.0.0.2.5001 > 10.0.0.1.57049: Flags [.], ack 198401, win 437, options [nop,nop,TS val 2291620 ecr 2291518,nop,nop,sack 1 {199849:212881}], length 0
00:08:12.200917 IP 10.0.0.1.57049 > 10.0.0.2.5001: Flags [.], seq 212881:215777, ack 1, win 58, options [nop,nop,TS val 2291566 ecr 2291565], length 2896
00:08:12.204010 IP 10.0.0.2.5001 > 10.0.0.1.57049: Flags [.], ack 198401, win 448, options [nop,nop,TS val 2291626 ecr 2291518,nop,nop,sack 1 {199849:215777}], length 0
00:08:12.225157 IP 10.0.0.1.57049 > 10.0.0.2.5001: Flags [.], seq 215777:218673, ack 1, win 58, options [nop,nop,TS val 2291572 ecr 2291571], length 2896
00:08:12.228249 IP 10.0.0.2.5001 > 10.0.0.1.57049: Flags [.], ack 198401, win 459, options [nop,nop,TS val 2291632 ecr 2291518,nop,nop,sack 1 {199849:218673}], length 0
00:08:12.249375 IP 10.0.0.1.57049 > 10.0.0.2.5001: Flags [.], seq 218673:221569, ack 1, win 58, options [nop,nop,TS val 2291578 ecr 2291578], length 2896
00:08:12.252501 IP 10.0.0.2.5001 > 10.0.0.1.57049: Flags [.], ack 198401, win 471, options [nop,nop,TS val 2291638 ecr 2291518,nop,nop,sack 1 {199849:221569}], length 0
00:08:12.274299 IP 10.0.0.1.57049 > 10.0.0.2.5001: Flags [.], seq 221569:223017, ack 1, win 58, options [nop,nop,TS val 2291584 ecr 2291584], length 1448
00:08:12.277450 IP 10.0.0.2.5001 > 10.0.0.1.57049: Flags [.], ack 198401, win 476, options [nop,nop,TS val 2291644 ecr 2291518,nop,nop,sack 1 {199849:223017}], length 0
00:08:12.285718 IP 10.0.0.1.57049 > 10.0.0.2.5001: Flags [.], seq 223017:224465, ack 1, win 58, options [nop,nop,TS val 2291587 ecr 2291587], length 1448
00:08:12.288867 IP 10.0.0.2.5001 > 10.0.0.1.57049: Flags [.], ack 198401, win 482, options [nop,nop,TS val 2291647 ecr 2291518,nop,nop,sack 1 {199849:224465}], length 0
00:08:12.297825 IP 10.0.0.1.57049 > 10.0.0.2.5001: Flags [.], seq 224465:227361, ack 1, win 58, options [nop,nop,TS val 2291593 ecr 2291593], length 2896
00:08:12.300963 IP 10.0.0.2.5001 > 10.0.0.1.57049: Flags [.], ack 198401, win 493, options [nop,nop,TS val 2291650 ecr 2291518,nop,nop,sack 1 {199849:227361}], length 0
00:08:12.322047 IP 10.0.0.1.57049 > 10.0.0.2.5001: Flags [.], seq 227361:230257, ack 1, win 58, options [nop,nop,TS val 2291599 ecr 2291599], length 2896
00:08:12.325655 IP 10.0.0.2.5001 > 10.0.0.1.57049: Flags [.], ack 198401, win 505, options [nop,nop,TS val 2291656 ecr 2291518,nop,nop,sack 1 {199849:230257}], length 0
00:08:12.346271 IP 10.0.0.1.57049 > 10.0.0.2.5001: Flags [.], seq 230257:231705, ack 1, win 58, options [nop,nop,TS val 2291602 ecr 2291602], length 1448
00:08:12.349414 IP 10.0.0.2.5001 > 10.0.0.1.57049: Flags [.], ack 198401, win 510, options [nop,nop,TS val 2291662 ecr 2291518,nop,nop,sack 1 {199849:231705}], length 0
00:08:12.358384 IP 10.0.0.1.57049 > 10.0.0.2.5001: Flags [.], seq 198401:199849, ack 1, win 58, options [nop,nop,TS val 2291605 ecr 2291605], length 1448
00:08:12.361506 IP 10.0.0.2.5001 > 10.0.0.1.57049: Flags [.], ack 231705, win 516, options [nop,nop,TS val 2291665 ecr 2291605], length 0
00:08:12.370495 IP 10.0.0.1.57049 > 10.0.0.2.5001: Flags [.], seq 231705:233153, ack 1, win 58, options [nop,nop,TS val 2291608 ecr 2291608], length 1448
00:08:12.373609 IP 10.0.0.2.5001 > 10.0.0.1.57049: Flags [.], ack 233153, win 522, options [nop,nop,TS val 2291668 ecr 2291608], length 0
00:08:12.382607 IP 10.0.0.1.57049 > 10.0.0.2.5001: Flags [.], seq 233153:234601, ack 1, win 58, options [nop,nop,TS val 2291614 ecr 2291614], length 1448
00:08:12.385724 IP 10.0.0.2.5001 > 10.0.0.1.57049: Flags [.], ack 234601, win 527, options [nop,nop,TS val 2291671 ecr 2291614], length 0
00:08:12.394725 IP 10.0.0.1.57049 > 10.0.0.2.5001: Flags [.], seq 234601:236049, ack 1, win 58, options [nop,nop,TS val 2291617 ecr 2291617], length 1448
00:08:12.397850 IP 10.0.0.2.5001 > 10.0.0.1.57049: Flags [.], ack 236049, win 533, options [nop,nop,TS val 2291674 ecr 2291617], length 0
00:08:12.406834 IP 10.0.0.1.57049 > 10.0.0.2.5001: Flags [.], seq 236049:237497, ack 1, win 58, options [nop,nop,TS val 2291620 ecr 2291620], length 1448
00:08:12.409966 IP 10.0.0.2.5001 > 10.0.0.1.57049: Flags [.], ack 237497, win 539, options [nop,nop,TS val 2291677 ecr 2291620], length 0
00:08:12.418943 IP 10.0.0.1.57049 > 10.0.0.2.5001: Flags [.], seq 237497:238945, ack 1, win 58, options [nop,nop,TS val 2291627 ecr 2291626], length 1448
00:08:12.422103 IP 10.0.0.2.5001 > 10.0.0.1.57049: Flags [.], ack 238945, win 544, options [nop,nop,TS val 2291680 ecr 2291627], length 0
00:08:12.431058 IP 10.0.0.1.57049 > 10.0.0.2.5001: Flags [P.], seq 238945:241841, ack 1, win 58, options [nop,nop,TS val 2291633 ecr 2291632], length 2896
00:08:12.435162 IP 10.0.0.2.5001 > 10.0.0.1.57049: Flags [.], ack 241841, win 556, options [nop,nop,TS val 2291684 ecr 2291633], length 0
00:08:12.455281 IP 10.0.0.1.57049 > 10.0.0.2.5001: Flags [.], seq 241841:243289, ack 1, win 58, options [nop,nop,TS val 2291639 ecr 2291638], length 1448
00:08:12.458480 IP 10.0.0.2.5001 > 10.0.0.1.57049: Flags [.], ack 243289, win 561, options [nop,nop,TS val 2291690 ecr 2291639], length 0
00:08:12.467399 IP 10.0.0.1.57049 > 10.0.0.2.5001: Flags [.], seq 243289:244737, ack 1, win 58, options [nop,nop,TS val 2291645 ecr 2291644], length 1448
00:08:12.470579 IP 10.0.0.2.5001 > 10.0.0.1.57049: Flags [.], ack 244737, win 567, options [nop,nop,TS val 2291693 ecr 2291645], length 0
00:08:12.479503 IP 10.0.0.1.57049 > 10.0.0.2.5001: Flags [.], seq 244737:246185, ack 1, win 58, options [nop,nop,TS val 2291651 ecr 2291650], length 1448
00:08:12.482683 IP 10.0.0.2.5001 > 10.0.0.1.57049: Flags [.], ack 246185, win 573, options [nop,nop,TS val 2291696 ecr 2291651], length 0
00:08:12.491814 IP 10.0.0.1.57049 > 10.0.0.2.5001: Flags [.], seq 246185:247633, ack 1, win 58, options [nop,nop,TS val 2291657 ecr 2291656], length 1448
00:08:12.495134 IP 10.0.0.2.5001 > 10.0.0.1.57049: Flags [.], ack 247633, win 578, options [nop,nop,TS val 2291699 ecr 2291657], length 0
00:08:12.503726 IP 10.0.0.1.57049 > 10.0.0.2.5001: Flags [.], seq 247633:249081, ack 1, win 58, options [nop,nop,TS val 2291657 ecr 2291656], length 1448
00:08:12.507649 IP 10.0.0.2.5001 > 10.0.0.1.57049: Flags [.], ack 249081, win 584, options [nop,nop,TS val 2291702 ecr 2291657], length 0
00:08:12.515839 IP 10.0.0.1.57049 > 10.0.0.2.5001: Flags [.], seq 249081:250529, ack 1, win 58, options [nop,nop,TS val 2291663 ecr 2291662], length 1448
00:08:12.518962 IP 10.0.0.2.5001 > 10.0.0.1.57049: Flags [.], ack 250529, win 590, options [nop,nop,TS val 2291705 ecr 2291663], length 0
00:08:12.527951 IP 10.0.0.1.57049 > 10.0.0.2.5001: Flags [.], seq 250529:253425, ack 1, win 58, options [nop,nop,TS val 2291669 ecr 2291668], length 2896
00:08:12.531182 IP 10.0.0.2.5001 > 10.0.0.1.57049: Flags [.], ack 253425, win 601, options [nop,nop,TS val 2291708 ecr 2291669], length 0
00:08:12.553076 IP 10.0.0.1.57049 > 10.0.0.2.5001: Flags [.], seq 253425:256321, ack 1, win 58, options [nop,nop,TS val 2291672 ecr 2291671], length 2896
00:08:12.556284 IP 10.0.0.2.5001 > 10.0.0.1.57049: Flags [.], ack 256321, win 612, options [nop,nop,TS val 2291714 ecr 2291672], length 0
00:08:12.576401 IP 10.0.0.1.57049 > 10.0.0.2.5001: Flags [.], seq 256321:259217, ack 1, win 58, options [nop,nop,TS val 2291678 ecr 2291677], length 2896
00:08:12.579685 IP 10.0.0.2.5001 > 10.0.0.1.57049: Flags [.], ack 259217, win 623, options [nop,nop,TS val 2291720 ecr 2291678], length 0
00:08:12.600626 IP 10.0.0.1.57049 > 10.0.0.2.5001: Flags [.], seq 259217:262113, ack 1, win 58, options [nop,nop,TS val 2291684 ecr 2291684], length 2896
00:08:12.604722 IP 10.0.0.2.5001 > 10.0.0.1.57049: Flags [.], ack 262113, win 635, options [nop,nop,TS val 2291726 ecr 2291684], length 0
00:08:12.624848 IP 10.0.0.1.57049 > 10.0.0.2.5001: Flags [.], seq 262113:265009, ack 1, win 58, options [nop,nop,TS val 2291690 ecr 2291690], length 2896
00:08:12.628195 IP 10.0.0.2.5001 > 10.0.0.1.57049: Flags [.], ack 265009, win 646, options [nop,nop,TS val 2291732 ecr 2291690], length 0
00:08:12.649760 IP 10.0.0.1.57049 > 10.0.0.2.5001: Flags [.], seq 265009:267905, ack 1, win 58, options [nop,nop,TS val 2291696 ecr 2291696], length 2896
00:08:12.652977 IP 10.0.0.2.5001 > 10.0.0.1.57049: Flags [.], ack 267905, win 657, options [nop,nop,TS val 2291738 ecr 2291696], length 0
00:08:12.673293 IP 10.0.0.1.57049 > 10.0.0.2.5001: Flags [.], seq 267905:270801, ack 1, win 58, options [nop,nop,TS val 2291699 ecr 2291699], length 2896
00:08:12.676556 IP 10.0.0.2.5001 > 10.0.0.1.57049: Flags [.], ack 270801, win 669, options [nop,nop,TS val 2291744 ecr 2291699], length 0
00:08:12.697521 IP 10.0.0.1.57049 > 10.0.0.2.5001: Flags [.], seq 270801:273697, ack 1, win 58, options [nop,nop,TS val 2291705 ecr 2291705], length 2896
00:08:12.700659 IP 10.0.0.2.5001 > 10.0.0.1.57049: Flags [.], ack 273697, win 680, options [nop,nop,TS val 2291750 ecr 2291705], length 0
00:08:12.721762 IP 10.0.0.1.57049 > 10.0.0.2.5001: Flags [.], seq 273697:276593, ack 1, win 58, options [nop,nop,TS val 2291708 ecr 2291708], length 2896
00:08:12.724913 IP 10.0.0.2.5001 > 10.0.0.1.57049: Flags [.], ack 276593, win 691, options [nop,nop,TS val 2291756 ecr 2291708], length 0
00:08:12.745970 IP 10.0.0.1.57049 > 10.0.0.2.5001: Flags [.], seq 276593:279489, ack 1, win 58, options [nop,nop,TS val 2291715 ecr 2291714], length 2896
00:08:12.749132 IP 10.0.0.2.5001 > 10.0.0.1.57049: Flags [.], ack 279489, win 703, options [nop,nop,TS val 2291762 ecr 2291715], length 0
00:08:12.770195 IP 10.0.0.1.57049 > 10.0.0.2.5001: Flags [.], seq 279489:282385, ack 1, win 58, options [nop,nop,TS val 2291720 ecr 2291720], length 2896
00:08:12.773375 IP 10.0.0.2.5001 > 10.0.0.1.57049: Flags [.], ack 282385, win 714, options [nop,nop,TS val 2291768 ecr 2291720], length 0
