00:08:19.940580 IP 10.0.0.1.42103 > 10.0.0.2.5001: UDP, length 1470
00:08:19.940745 IP 10.0.0.1.42103 > 10.0.0.2.5001: UDP, length 1470
00:08:19.951932 IP 10.0.0.1.42103 > 10.0.0.2.5001: UDP, length 1470
00:08:19.964076 IP 10.0.0.1.42103 > 10.0.0.2.5001: UDP, length 1470
00:08:19.976152 IP 10.0.0.1.42103 > 10.0.0.2.5001: UDP, length 1470
00:08:19.988228 IP 10.0.0.1.42103 > 10.0.0.2.5001: UDP, length 1470
00:08:20.000352 IP 10.0.0.1.42103 > 10.0.0.2.5001: UDP, length 1470
00:08:20.012436 IP 10.0.0.1.42103 > 10.0.0.2.5001: UDP, length 1470
00:08:20.024537 IP 10.0.0.1.42103 > 10.0.0.2.5001: UDP, length 1470
00:08:20.038863 IP 10.0.0.1.42103 > 10.0.0.2.5001: UDP, length 1470
00:08:20.054150 IP 10.0.0.1.42103 > 10.0.0.2.5001: UDP, length 1470
00:08:20.060841 IP 10.0.0.1.42103 > 10.0.0.2.5001: UDP, length 1470
00:08:20.072935 IP 10.0.0.1.42103 > 10.0.0.2.5001: UDP, length 1470
00:08:20.085036 IP 10.0.0.1.42103 > 10.0.0.2.5001: UDP, length 1470
00:08:20.097113 IP 10.0.0.1.42103 > 10.0.0.2.5001: UDP, length 1470
00:08:20.109436 IP 10.0.0.1.42103 > 10.0.0.2.5001: UDP, length 1470
00:08:20.121592 IP 10.0.0.1.42103 > 10.0.0.2.5001: UDP, length 1470
00:08:20.133419 IP 10.0.0.1.42103 > 10.0.0.2.5001: UDP, length 1470
00:08:20.145494 IP 10.0.0.1.42103 > 10.0.0.2.5001: UDP, length 1470
00:08:20.157582 IP 10.0.0.1.42103 > 10.0.0.2.5001: UDP, length 1470
00:08:20.169701 IP 10.0.0.1.42103 > 10.0.0.2.5001: UDP, length 1470
00:08:20.181785 IP 10.0.0.1.42103 > 10.0.0.2.5001: UDP, length 1470
00:08:20.193866 IP 10.0.0.1.42103 > 10.0.0.2.5001: UDP, length 1470
00:08:20.205974 IP 10.0.0.1.42103 > 10.0.0.2.5001: UDP, length 1470
00:08:20.218138 IP 10.0.0.1.42103 > 10.0.0.2.5001: UDP, length 1470
00:08:20.230167 IP 10.0.0.1.42103 > 10.0.0.2.5001: UDP, length 1470
00:08:20.242263 IP 10.0.0.1.42103 > 10.0.0.2.5001: UDP, length 1470
00:08:20.254363 IP 10.0.0.1.42103 > 10.0.0.2.5001: UDP, length 1470
00:08:20.266547 IP 10.0.0.1.42103 > 10.0.0.2.5001: UDP, length 1470
00:08:20.278548 IP 10.0.0.1.42103 > 10.0.0.2.5001: UDP, length 1470
00:08:20.290646 IP 10.0.0.1.42103 > 10.0.0.2.5001: UDP, length 1470
00:08:20.302736 IP 10.0.0.1.42103 > 10.0.0.2.5001: UDP, length 1470
00:08:20.314845 IP 10.0.0.1.42103 > 10.0.0.2.5001: UDP, length 1470
00:08:20.326965 IP 10.0.0.1.42103 > 10.0.0.2.5001: UDP, length 1470
00:08:20.339042 IP 10.0.0.1.42103 > 10.0.0.2.5001: UDP, length 1470
00:08:20.351157 IP 10.0.0.1.42103 > 10.0.0.2.5001: UDP, length 1470
00:08:20.363293 IP 10.0.0.1.42103 > 10.0.0.2.5001: UDP, length 1470
00:08:20.375320 IP 10.0.0.1.42103 > 10.0.0.2.5001: UDP, length 1470
00:08:20.387415 IP 10.0.0.1.42103 > 10.0.0.2.5001: UDP, length 1470
00:08:20.399513 IP 10.0.0.1.42103 > 10.0.0.2.5001: UDP, length 1470
00:08:20.411611 IP 10.0.0.1.42103 > 10.0.0.2.5001: UDP, length 1470
00:08:20.423709 IP 10.0.0.1.42103 > 10.0.0.2.5001: UDP, length 1470
00:08:20.435800 IP 10.0.0.1.42103 > 10.0.0.2.5001: UDP, length 1470
00:08:20.447901 IP 10.0.0.1.42103 > 10.0.0.2.5001: UDP, length 1470
00:08:20.459992 IP 10.0.0.1.42103 > 10.0.0.2.5001: UDP, length 1470
00:08:20.472112 IP 10.0.0.1.42103 > 10.0.0.2.5001: UDP, length 1470
00:08:20.484203 IP 10.0.0.1.42103 > 10.0.0.2.5001: UDP, length 1470
00:08:20.496282 IP 10.0.0.1.42103 > 10.0.0.2.5001: UDP, length 1470
00:08:20.508387 IP 10.0.0.1.42103 > 10.0.0.2.5001: UDP, length 1470
00:08:20.521395 IP 10.0.0.1.42103 > 10.0.0.2.5001: UDP, length 1470
00:08:20.532574 IP 10.0.0.1.42103 > 10.0.0.2.5001: UDP, length 1470
00:08:20.544663 IP 10.0.0.1.42103 > 10.0.0.2.5001: UDP, length 1470
00:08:20.556765 IP 10.0.0.1.42103 > 10.0.0.2.5001: UDP, length 1470
00:08:20.568858 IP 10.0.0.1.42103 > 10.0.0.2.5001: UDP, length 1470
00:08:20.580954 IP 10.0.0.1.42103 > 10.0.0.2.5001: UDP, length 1470
00:08:20.593050 IP 10.0.0.1.42103 > 10.0.0.2.5001: UDP, length 1470
00:08:20.605141 IP 10.0.0.1.42103 > 10.0.0.2.5001: UDP, length 1470
00:08:20.617245 IP 10.0.0.1.42103 > 10.0.0.2.5001: UDP, length 1470
00:08:20.629344 IP 10.0.0.1.42103 > 10.0.0.2.5001: UDP, length 1470
00:08:20.642055 IP 10.0.0.1.42103 > 10.0.0.2.5001: UDP, length 1470
00:08:20.653522 IP 10.0.0.1.42103 > 10.0.0.2.5001: UDP, length 1470
00:08:20.665624 IP 10.0.0.1.42103 > 10.0.0.2.5001: UDP, length 1470
00:08:20.677716 IP 10.0.0.1.42103 > 10.0.0.2.5001: UDP, length 1470
00:08:20.689880 IP 10.0.0.1.42103 > 10.0.0.2.5001: UDP, length 1470
00:08:20.701959 IP 10.0.0.1.42103 > 10.0.0.2.5001: UDP, length 1470
00:08:20.714013 IP 10.0.0.1.42103 > 10.0.0.2.5001: UDP, length 1470
00:08:20.726105 IP 10.0.0.1.42103 > 10.0.0.2.5001: UDP, length 1470
00:08:20.738205 IP 10.0.0.1.42103 > 10.0.0.2.5001: UDP, length 1470
00:08:20.750300 IP 10.0.0.1.42103 > 10.0.0.2.5001: UDP, length 1470
00:08:20.762393 IP 10.0.0.1.42103 > 10.0.0.2.5001: UDP, length 1470
00:08:20.774497 IP 10.0.0.1.42103 > 10.0.0.2.5001: UDP, length 1470
00:08:20.786584 IP 10.0.0.1.42103 > 10.0.0.2.5001: UDP, length 1470
00:08:20.798699 IP 10.0.0.1.42103 > 10.0.0.2.5001: UDP, length 1470
00:08:20.810782 IP 10.0.0.1.42103 > 10.0.0.2.5001: UDP, length 1470
00:08:20.822874 IP 10.0.0.1.42103 > 10.0.0.2.5001: UDP, length 1470
00:08:20.834967 IP 10.0.0.1.42103 > 10.0.0.2.5001: UDP, length 1470
00:08:20.847065 IP 10.0.0.1.42103 > 10.0.0.2.5001: UDP, length 1470
00:08:20.859156 IP 10.0.0.1.42103 > 10.0.0.2.5001: UDP, length 1470
00:08:20.871256 IP 10.0.0.1.42103 > 10.0.0.2.5001: UDP, length 1470
00:08:20.883353 IP 10.0.0.1.42103 > 10.0.0.2.5001: UDP, length 1470
00:08:20.895445 IP 10.0.0.1.42103 > 10.0.0.2.5001: UDP, length 1470
00:08:20.907533 IP 10.0.0.1.42103 > 10.0.0.2.5001: UDP, length 1470
00:08:20.919638 IP 10.0.0.1.42103 > 10.0.0.2.5001: UDP, length 1470
00:08:20.931736 IP 10.0.0.1.42103 > 10.0.0.2.5001: UDP, length 1470
00:08:20.943839 IP 10.0.0.1.42103 > 10.0.0.2.5001: UDP, length 1470
00:08:20.955925 IP 10.0.0.1.42103 > 10.0.0.2.5001: UDP, length 1470
00:08:20.968024 IP 10.0.0.1.42103 > 10.0.0.2.5001: UDP, length 1470
00:08:20.980113 IP 10.0.0.1.42103 > 10.0.0.2.5001: UDP, length 1470
00:08:20.992209 IP 10.0.0.1.42103 > 10.0.0.2.5001: UDP, length 1470
00:08:21.004305 IP 10.0.0.1.42103 > 10.0.0.2.5001: UDP, length 1470
00:08:21.016406 IP 10.0.0.1.42103 > 10.0.0.2.5001: UDP, length 1470
00:08:21.028504 IP 10.0.0.1.42103 > 10.0.0.2.5001: UDP, length 1470
00:08:21.040592 IP 10.0.0.1.42103 > 10.0.0.2.5001: UDP, length 1470
00:08:21.052688 IP 10.0.0.1.42103 > 10.0.0.2.5001: UDP, length 1470
00:08:21.064788 IP 10.0.0.1.42103 > 10.0.0.2.5001: UDP, length 1470
00:08:21.078702 IP 10.0.0.1.42103 > 10.0.0.2.5001: UDP, length 1470
00:08:21.088985 IP 10.0.0.1.42103 > 10.0.0.2.5001: UDP, length 1470
00:08:21.101061 IP 10.0.0.1.42103 > 10.0.0.2.5001: UDP, length 1470
00:08:21.113185 IP 10.0.0.1.42103 > 10.0.0.2.5001: UDP, length 1470
00:08:21.125273 IP 10.0.0.1.42103 > 10.0.0.2.5001: UDP, length 1470
00:08:21.137377 IP 10.0.0.1.42103 > 10.0.0.2.5001: UDP, length 1470
00:08:21.149477 IP 10.0.0.1.42103 > 10.0.0.2.5001: UDP, length 1470
00:08:21.161552 IP 10.0.0.1.42103 > 10.0.0.2.5001: UDP, length 1470
00:08:21.173656 IP 10.0.0.1.42103 > 10.0.0.2.5001: UDP, length 1470
00:08:21.185750 IP 10.0.0.1.42103 > 10.0.0.2.5001: UDP, length 1470
00:08:21.197841 IP 10.0.0.1.42103 > 10.0.0.2.5001: UDP, length 1470
00:08:21.209950 IP 10.0.0.1.42103 > 10.0.0.2.5001: UDP, length 1470
00:08:21.222037 IP 10.0.0.1.42103 > 10.0.0.2.5001: UDP, length 1470
00:08:21.234130 IP 10.0.0.1.42103 > 10.0.0.2.5001: UDP, length 1470
00:08:21.246227 IP 10.0.0.1.42103 > 10.0.0.2.5001: UDP, length 1470
00:08:21.258322 IP 10.0.0.1.42103 > 10.0.0.2.5001: UDP, length 1470
00:08:21.270438 IP 10.0.0.1.42103 > 10.0.0.2.5001: UDP, length 1470
00:08:21.282518 IP 10.0.0.1.42103 > 10.0.0.2.5001: UDP, length 1470
00:08:21.294598 IP 10.0.0.1.42103 > 10.0.0.2.5001: UDP, length 1470
00:08:21.306716 IP 10.0.0.1.42103 > 10.0.0.2.5001: UDP, length 1470
00:08:21.318801 IP 10.0.0.1.42103 > 10.0.0.2.5001: UDP, length 1470
00:08:21.330900 IP 10.0.0.1.42103 > 10.0.0.2.5001: UDP, length 1470
00:08:21.343003 IP 10.0.0.1.42103 > 10.0.0.2.5001: UDP, length 1470
00:08:21.355103 IP 10.0.0.1.42103 > 10.0.0.2.5001: UDP, length 1470
00:08:21.367194 IP 10.0.0.1.42103 > 10.0.0.2.5001: UDP, length 1470
00:08:21.379288 IP 10.0.0.1.42103 > 10.0.0.2.5001: UDP, length 1470
00:08:21.391379 IP 10.0.0.1.42103 > 10.0.0.2.5001: UDP, length 1470
00:08:21.404315 IP 10.0.0.1.42103 > 10.0.0.2.5001: UDP, length 1470
00:08:21.415570 IP 10.0.0.1.42103 > 10.0.0.2.5001: UDP, length 1470
00:08:21.431541 IP 10.0.0.1.42103 > 10.0.0.2.5001: UDP, length 1470
00:08:21.439766 IP 10.0.0.1.42103 > 10.0.0.2.5001: UDP, length 1470
00:08:21.451877 IP 10.0.0.1.42103 > 10.0.0.2.5001: UDP, length 1470
00:08:21.463946 IP 10.0.0.1.42103 > 10.0.0.2.5001: UDP, length 1470
00:08:21.476043 IP 10.0.0.1.42103 > 10.0.0.2.5001: UDP, length 1470
00:08:21.488151 IP 10.0.0.1.42103 > 10.0.0.2.5001: UDP, length 1470
00:08:21.500246 IP 10.0.0.1.42103 > 10.0.0.2.5001: UDP, length 1470
00:08:21.512337 IP 10.0.0.1.42103 > 10.0.0.2.5001: UDP, length 1470
00:08:21.524433 IP 10.0.0.1.42103 > 10.0.0.2.5001: UDP, length 1470
00:08:21.536534 IP 10.0.0.1.42103 > 10.0.0.2.5001: UDP, length 1470
00:08:21.548648 IP 10.0.0.1.42103 > 10.0.0.2.5001: UDP, length 1470
00:08:21.560721 IP 10.0.0.1.42103 > 10.0.0.2.5001: UDP, length 1470
00:08:21.572830 IP 10.0.0.1.42103 > 10.0.0.2.5001: UDP, length 1470
00:08:21.584917 IP 10.0.0.1.42103 > 10.0.0.2.5001: UDP, length 1470
00:08:21.597016 IP 10.0.0.1.42103 > 10.0.0.2.5001: UDP, length 1470
00:08:21.609119 IP 10.0.0.1.42103 > 10.0.0.2.5001: UDP, length 1470
00:08:21.621220 IP 10.0.0.1.42103 > 10.0.0.2.5001: UDP, length 1470
00:08:21.633302 IP 10.0.0.1.42103 > 10.0.0.2.5001: UDP, length 1470
00:08:21.645400 IP 10.0.0.1.42103 > 10.0.0.2.5001: UDP, length 1470
00:08:21.657478 IP 10.0.0.1.42103 > 10.0.0.2.5001: UDP, length 1470
00:08:21.669630 IP 10.0.0.1.42103 > 10.0.0.2.5001: UDP, length 1470
00:08:21.681694 IP 10.0.0.1.42103 > 10.0.0.2.5001: UDP, length 1470
00:08:21.693820 IP 10.0.0.1.42103 > 10.0.0.2.5001: UDP, length 1470
00:08:21.705891 IP 10.0.0.1.42103 > 10.0.0.2.5001: UDP, length 1470
00:08:21.717977 IP 10.0.0.1.42103 > 10.0.0.2.5001: UDP, length 1470
00:08:21.730071 IP 10.0.0.1.42103 > 10.0.0.2.5001: UDP, length 1470
00:08:21.742177 IP 10.0.0.1.42103 > 10.0.0.2.5001: UDP, length 1470
00:08:21.754271 IP 10.0.0.1.42103 > 10.0.0.2.5001: UDP, length 1470
00:08:21.766370 IP 10.0.0.1.42103 > 10.0.0.2.5001: UDP, length 1470
00:08:21.778460 IP 10.0.0.1.42103 > 10.0.0.2.5001: UDP, length 1470
00:08:21.790579 IP 10.0.0.1.42103 > 10.0.0.2.5001: UDP, length 1470
00:08:21.802647 IP 10.0.0.1.42103 > 10.0.0.2.5001: UDP, length 1470
00:08:21.814762 IP 10.0.0.1.42103 > 10.0.0.2.5001: UDP, length 1470
00:08:21.827734 IP 10.0.0.1.42103 > 10.0.0.2.5001: UDP, length 1470
00:08:21.839157 IP 10.0.0.1.42103 > 10.0.0.2.5001: UDP, length 1470
00:08:21.851023 IP 10.0.0.1.42103 > 10.0.0.2.5001: UDP, length 1470
00:08:21.863144 IP 10.0.0.1.42103 > 10.0.0.2.5001: UDP, length 1470
00:08:21.875222 IP 10.0.0.1.42103 > 10.0.0.2.5001: UDP, length 1470
00:08:21.890936 IP 10.0.0.1.42103 > 10.0.0.2.5001: UDP, length 1470
00:08:21.899419 IP 10.0.0.1.42103 > 10.0.0.2.5001: UDP, length 1470
00:08:21.911510 IP 10.0.0.1.42103 > 10.0.0.2.5001: UDP, length 1470
00:08:21.923615 IP 10.0.0.1.42103 > 10.0.0.2.5001: UDP, length 1470
00:08:21.935712 IP 10.0.0.1.42103 > 10.0.0.2.5001: UDP, length 1470
00:08:21.947798 IP 10.0.0.1.42103 > 10.0.0.2.5001: UDP, length 1470
00:08:21.959892 IP 10.0.0.1.42103 > 10.0.0.2.5001: UDP, length 1470
00:08:21.971992 IP 10.0.0.1.42103 > 10.0.0.2.5001: UDP, length 1470
00:08:21.984109 IP 10.0.0.1.42103 > 10.0.0.2.5001: UDP, length 1470
00:08:21.996197 IP 10.0.0.1.42103 > 10.0.0.2.5001: UDP, length 1470
00:08:22.008280 IP 10.0.0.1.42103 > 10.0.0.2.5001: UDP, length 1470
00:08:22.020375 IP 10.0.0.1.42103 > 10.0.0.2.5001: UDP, length 1470
00:08:22.033140 IP 10.0.0.1.42103 > 10.0.0.2.5001: UDP, length 1470
00:08:22.044555 IP 10.0.0.1.42103 > 10.0.0.2.5001: UDP, length 1470
00:08:22.056667 IP 10.0.0.1.42103 > 10.0.0.2.5001: UDP, length 1470
00:08:22.069612 IP 10.0.0.1.42103 > 10.0.0.2.5001: UDP, length 1470
00:08:22.080861 IP 10.0.0.1.42103 > 10.0.0.2.5001: UDP, length 1470
00:08:22.092950 IP 10.0.0.1.42103 > 10.0.0.2.5001: UDP, length 1470
00:08:22.105929 IP 10.0.0.1.42103 > 10.0.0.2.5001: UDP, length 1470
00:08:22.117141 IP 10.0.0.1.42103 > 10.0.0.2.5001: UDP, length 1470
00:08:22.129243 IP 10.0.0.1.42103 > 10.0.0.2.5001: UDP, length 1470
00:08:22.141334 IP 10.0.0.1.42103 > 10.0.0.2.5001: UDP, length 1470
00:08:22.153429 IP 10.0.0.1.42103 > 10.0.0.2.5001: UDP, length 1470
00:08:22.165556 IP 10.0.0.1.42103 > 10.0.0.2.5001: UDP, length 1470
00:08:22.177627 IP 10.0.0.1.42103 > 10.0.0.2.5001: UDP, length 1470
00:08:22.189724 IP 10.0.0.1.42103 > 10.0.0.2.5001: UDP, length 1470
00:08:22.201803 IP 10.0.0.1.42103 > 10.0.0.2.5001: UDP, length 1470
00:08:22.213915 IP 10.0.0.1.42103 > 10.0.0.2.5001: UDP, length 1470
00:08:22.226009 IP 10.0.0.1.42103 > 10.0.0.2.5001: UDP, length 1470
00:08:22.238098 IP 10.0.0.1.42103 > 10.0.0.2.5001: UDP, length 1470
00:08:22.250201 IP 10.0.0.1.42103 > 10.0.0.2.5001: UDP, length 1470
00:08:22.262292 IP 10.0.0.1.42103 > 10.0.0.2.5001: UDP, length 1470
00:08:22.274390 IP 10.0.0.1.42103 > 10.0.0.2.5001: UDP, length 1470
00:08:22.287288 IP 10.0.0.1.42103 > 10.0.0.2.5001: UDP, length 1470
00:08:22.298580 IP 10.0.0.1.42103 > 10.0.0.2.5001: UDP, length 1470
00:08:22.310685 IP 10.0.0.1.42103 > 10.0.0.2.5001: UDP, length 1470
00:08:22.322785 IP 10.0.0.1.42103 > 10.0.0.2.5001: UDP, length 1470
00:08:22.334870 IP 10.0.0.1.42103 > 10.0.0.2.5001: UDP, length 1470
00:08:22.346969 IP 10.0.0.1.42103 > 10.0.0.2.5001: UDP, length 1470
00:08:22.359061 IP 10.0.0.1.42103 > 10.0.0.2.5001: UDP, length 1470
00:08:22.371172 IP 10.0.0.1.42103 > 10.0.0.2.5001: UDP, length 1470
00:08:22.383260 IP 10.0.0.1.42103 > 10.0.0.2.5001: UDP, length 1470
00:08:22.395362 IP 10.0.0.1.42103 > 10.0.0.2.5001: UDP, length 1470
00:08:22.407447 IP 10.0.0.1.42103 > 10.0.0.2.5001: UDP, length 1470
00:08:22.419558 IP 10.0.0.1.42103 > 10.0.0.2.5001: UDP, length 1470
00:08:22.431647 IP 10.0.0.1.42103 > 10.0.0.2.5001: UDP, length 1470
00:08:22.443767 IP 10.0.0.1.42103 > 10.0.0.2.5001: UDP, length 1470
00:08:22.455837 IP 10.0.0.1.42103 > 10.0.0.2.5001: UDP, length 1470
00:08:22.467929 IP 10.0.0.1.42103 > 10.0.0.2.5001: UDP, length 1470
00:08:22.480038 IP 10.0.0.1.42103 > 10.0.0.2.5001: UDP, length 1470
00:08:22.492127 IP 10.0.0.1.42103 > 10.0.0.2.5001: UDP, length 1470
00:08:22.504224 IP 10.0.0.1.42103 > 10.0.0.2.5001: UDP, length 1470
00:08:22.516315 IP 10.0.0.1.42103 > 10.0.0.2.5001: UDP, length 1470
00:08:22.528421 IP 10.0.0.1.42103 > 10.0.0.2.5001: UDP, length 1470
00:08:22.540511 IP 10.0.0.1.42103 > 10.0.0.2.5001: UDP, length 1470
00:08:22.552617 IP 10.0.0.1.42103 > 10.0.0.2.5001: UDP, length 1470
00:08:22.564702 IP 10.0.0.1.42103 > 10.0.0.2.5001: UDP, length 1470
00:08:22.576811 IP 10.0.0.1.42103 > 10.0.0.2.5001: UDP, length 1470
00:08:22.588892 IP 10.0.0.1.42103 > 10.0.0.2.5001: UDP, length 1470
00:08:22.601027 IP 10.0.0.1.42103 > 10.0.0.2.5001: UDP, length 1470
00:08:22.613089 IP 10.0.0.1.42103 > 10.0.0.2.5001: UDP, length 1470
00:08:22.625179 IP 10.0.0.1.42103 > 10.0.0.2.5001: UDP, length 1470
00:08:22.637276 IP 10.0.0.1.42103 > 10.0.0.2.5001: UDP, length 1470
00:08:22.649371 IP 10.0.0.1.42103 > 10.0.0.2.5001: UDP, length 1470
00:08:22.661467 IP 10.0.0.1.42103 > 10.0.0.2.5001: UDP, length 1470
00:08:22.673563 IP 10.0.0.1.42103 > 10.0.0.2.5001: UDP, length 1470
00:08:22.685661 IP 10.0.0.1.42103 > 10.0.0.2.5001: UDP, length 1470
00:08:22.697768 IP 10.0.0.1.42103 > 10.0.0.2.5001: UDP, length 1470
00:08:22.709853 IP 10.0.0.1.42103 > 10.0.0.2.5001: UDP, length 1470
00:08:22.721943 IP 10.0.0.1.42103 > 10.0.0.2.5001: UDP, length 1470
00:08:22.734044 IP 10.0.0.1.42103 > 10.0.0.2.5001: UDP, length 1470
00:08:22.746949 IP 10.0.0.1.42103 > 10.0.0.2.5001: UDP, length 1470
00:08:22.758240 IP 10.0.0.1.42103 > 10.0.0.2.5001: UDP, length 1470
00:08:22.771082 IP 10.0.0.1.42103 > 10.0.0.2.5001: UDP, length 1470
00:08:22.782429 IP 10.0.0.1.42103 > 10.0.0.2.5001: UDP, length 1470
00:08:22.794535 IP 10.0.0.1.42103 > 10.0.0.2.5001: UDP, length 1470
00:08:22.806647 IP 10.0.0.1.42103 > 10.0.0.2.5001: UDP, length 1470
00:08:22.818702 IP 10.0.0.1.42103 > 10.0.0.2.5001: UDP, length 1470
00:08:22.830800 IP 10.0.0.1.42103 > 10.0.0.2.5001: UDP, length 1470
00:08:22.842902 IP 10.0.0.1.42103 > 10.0.0.2.5001: UDP, length 1470
00:08:22.854994 IP 10.0.0.1.42103 > 10.0.0.2.5001: UDP, length 1470
00:08:22.867100 IP 10.0.0.1.42103 > 10.0.0.2.5001: UDP, length 1470
00:08:22.879195 IP 10.0.0.1.42103 > 10.0.0.2.5001: UDP, length 1470
00:08:22.891281 IP 10.0.0.1.42103 > 10.0.0.2.5001: UDP, length 1470
00:08:22.903382 IP 10.0.0.1.42103 > 10.0.0.2.5001: UDP, length 1470
00:08:22.915474 IP 10.0.0.1.42103 > 10.0.0.2.5001: UDP, length 1470
00:08:22.927581 IP 10.0.0.1.42103 > 10.0.0.2.5001: UDP, length 1470
00:08:22.939669 IP 10.0.0.1.42103 > 10.0.0.2.5001: UDP, length 1470
00:08:22.951754 IP 10.0.0.1.42103 > 10.0.0.2.5001: UDP, length 1470
00:08:22.963866 IP 10.0.0.1.42103 > 10.0.0.2.5001: UDP, length 1470
00:08:22.975977 IP 10.0.0.1.42103 > 10.0.0.2.5001: UDP, length 1470
00:08:22.988058 IP 10.0.0.1.42103 > 10.0.0.2.5001: UDP, length 1470
00:08:23.000149 IP 10.0.0.1.42103 > 10.0.0.2.5001: UDP, length 1470
00:08:23.012249 IP 10.0.0.1.42103 > 10.0.0.2.5001: UDP, length 1470
00:08:23.024339 IP 10.0.0.1.42103 > 10.0.0.2.5001: UDP, length 1470
00:08:23.036435 IP 10.0.0.1.42103 > 10.0.0.2.5001: UDP, length 1470
00:08:23.048529 IP 10.0.0.1.42103 > 10.0.0.2.5001: UDP, length 1470
00:08:23.060633 IP 10.0.0.1.42103 > 10.0.0.2.5001: UDP, length 1470
00:08:23.072722 IP 10.0.0.1.42103 > 10.0.0.2.5001: UDP, length 1470
00:08:23.084821 IP 10.0.0.1.42103 > 10.0.0.2.5001: UDP, length 1470
00:08:23.096913 IP 10.0.0.1.42103 > 10.0.0.2.5001: UDP, length 1470
00:08:23.109013 IP 10.0.0.1.42103 > 10.0.0.2.5001: UDP, length 1470
00:08:23.121107 IP 10.0.0.1.42103 > 10.0.0.2.5001: UDP, length 1470
00:08:23.133218 IP 10.0.0.1.42103 > 10.0.0.2.5001: UDP, length 1470
00:08:23.145296 IP 10.0.0.1.42103 > 10.0.0.2.5001: UDP, length 1470
00:08:23.157391 IP 10.0.0.1.42103 > 10.0.0.2.5001: UDP, length 1470
00:08:23.169491 IP 10.0.0.1.42103 > 10.0.0.2.5001: UDP, length 1470
00:08:23.181586 IP 10.0.0.1.42103 > 10.0.0.2.5001: UDP, length 1470
00:08:23.193673 IP 10.0.0.1.42103 > 10.0.0.2.5001: UDP, length 1470
00:08:23.205782 IP 10.0.0.1.42103 > 10.0.0.2.5001: UDP, length 1470
00:08:23.217881 IP 10.0.0.1.42103 > 10.0.0.2.5001: UDP, length 1470
00:08:23.229969 IP 10.0.0.1.42103 > 10.0.0.2.5001: UDP, length 1470
00:08:23.242067 IP 10.0.0.1.42103 > 10.0.0.2.5001: UDP, length 1470
00:08:23.254162 IP 10.0.0.1.42103 > 10.0.0.2.5001: UDP, length 1470
00:08:23.266261 IP 10.0.0.1.42103 > 10.0.0.2.5001: UDP, length 1470
00:08:23.278352 IP 10.0.0.1.42103 > 10.0.0.2.5001: UDP, length 1470
00:08:23.290449 IP 10.0.0.1.42103 > 10.0.0.2.5001: UDP, length 1470
00:08:23.302538 IP 10.0.0.1.42103 > 10.0.0.2.5001: UDP, length 1470
00:08:23.314642 IP 10.0.0.1.42103 > 10.0.0.2.5001: UDP, length 1470
00:08:23.326732 IP 10.0.0.1.42103 > 10.0.0.2.5001: UDP, length 1470
00:08:23.338838 IP 10.0.0.1.42103 > 10.0.0.2.5001: UDP, length 1470
00:08:23.350918 IP 10.0.0.1.42103 > 10.0.0.2.5001: UDP, length 1470
00:08:23.363026 IP 10.0.0.1.42103 > 10.0.0.2.5001: UDP, length 1470
00:08:23.375124 IP 10.0.0.1.42103 > 10.0.0.2.5001: UDP, length 1470
00:08:23.387217 IP 10.0.0.1.42103 > 10.0.0.2.5001: UDP, length 1470
00:08:23.399322 IP 10.0.0.1.42103 > 10.0.0.2.5001: UDP, length 1470
00:08:23.411416 IP 10.0.0.1.42103 > 10.0.0.2.5001: UDP, length 1470
00:08:23.423530 IP 10.0.0.1.42103 > 10.0.0.2.5001: UDP, length 1470
00:08:23.437033 IP 10.0.0.1.42103 > 10.0.0.2.5001: UDP, length 1470
00:08:23.447885 IP 10.0.0.1.42103 > 10.0.0.2.5001: UDP, length 1470
00:08:23.459815 IP 10.0.0.1.42103 > 10.0.0.2.5001: UDP, length 1470
00:08:23.471894 IP 10.0.0.1.42103 > 10.0.0.2.5001: UDP, length 1470
00:08:23.484000 IP 10.0.0.1.42103 > 10.0.0.2.5001: UDP, length 1470
00:08:23.496087 IP 10.0.0.1.42103 > 10.0.0.2.5001: UDP, length 1470
00:08:23.509121 IP 10.0.0.1.42103 > 10.0.0.2.5001: UDP, length 1470
00:08:23.520295 IP 10.0.0.1.42103 > 10.0.0.2.5001: UDP, length 1470
00:08:23.532379 IP 10.0.0.1.42103 > 10.0.0.2.5001: UDP, length 1470
00:08:23.544470 IP 10.0.0.1.42103 > 10.0.0.2.5001: UDP, length 1470
00:08:23.556561 IP 10.0.0.1.42103 > 10.0.0.2.5001: UDP, length 1470
00:08:23.568684 IP 10.0.0.1.42103 > 10.0.0.2.5001: UDP, length 1470
00:08:23.580764 IP 10.0.0.1.42103 > 10.0.0.2.5001: UDP, length 1470
00:08:23.593656 IP 10.0.0.1.42103 > 10.0.0.2.5001: UDP, length 1470
00:08:23.605016 IP 10.0.0.1.42103 > 10.0.0.2.5001: UDP, length 1470
00:08:23.617054 IP 10.0.0.1.42103 > 10.0.0.2.5001: UDP, length 1470
00:08:23.629152 IP 10.0.0.1.42103 > 10.0.0.2.5001: UDP, length 1470
00:08:23.641249 IP 10.0.0.1.42103 > 10.0.0.2.5001: UDP, length 1470
00:08:23.653393 IP 10.0.0.1.42103 > 10.0.0.2.5001: UDP, length 1470
00:08:23.665429 IP 10.0.0.1.42103 > 10.0.0.2.5001: UDP, length 1470
00:08:23.677564 IP 10.0.0.1.42103 > 10.0.0.2.5001: UDP, length 1470
00:08:23.689617 IP 10.0.0.1.42103 > 10.0.0.2.5001: UDP, length 1470
00:08:23.701757 IP 10.0.0.1.42103 > 10.0.0.2.5001: UDP, length 1470
00:08:23.713814 IP 10.0.0.1.42103 > 10.0.0.2.5001: UDP, length 1470
00:08:23.726728 IP 10.0.0.1.42103 > 10.0.0.2.5001: UDP, length 1470
00:08:23.738034 IP 10.0.0.1.42103 > 10.0.0.2.5001: UDP, length 1470
00:08:23.750112 IP 10.0.0.1.42103 > 10.0.0.2.5001: UDP, length 1470
00:08:23.762527 IP 10.0.0.1.42103 > 10.0.0.2.5001: UDP, length 1470
00:08:23.774300 IP 10.0.0.1.42103 > 10.0.0.2.5001: UDP, length 1470
00:08:23.786389 IP 10.0.0.1.42103 > 10.0.0.2.5001: UDP, length 1470
00:08:23.798517 IP 10.0.0.1.42103 > 10.0.0.2.5001: UDP, length 1470
00:08:23.810588 IP 10.0.0.1.42103 > 10.0.0.2.5001: UDP, length 1470
00:08:23.822684 IP 10.0.0.1.42103 > 10.0.0.2.5001: UDP, length 1470
00:08:23.834773 IP 10.0.0.1.42103 > 10.0.0.2.5001: UDP, length 1470
00:08:23.846878 IP 10.0.0.1.42103 > 10.0.0.2.5001: UDP, length 1470
00:08:23.858988 IP 10.0.0.1.42103 > 10.0.0.2.5001: UDP, length 1470
00:08:23.871064 IP 10.0.0.1.42103 > 10.0.0.2.5001: UDP, length 1470
00:08:23.883159 IP 10.0.0.1.42103 > 10.0.0.2.5001: UDP, length 1470
00:08:23.895257 IP 10.0.0.1.42103 > 10.0.0.2.5001: UDP, length 1470
00:08:23.907345 IP 10.0.0.1.42103 > 10.0.0.2.5001: UDP, length 1470
00:08:23.919450 IP 10.0.0.1.42103 > 10.0.0.2.5001: UDP, length 1470
00:08:23.931553 IP 10.0.0.1.42103 > 10.0.0.2.5001: UDP, length 1470
00:08:23.943635 IP 10.0.0.1.42103 > 10.0.0.2.5001: UDP, length 1470
00:08:23.955731 IP 10.0.0.1.42103 > 10.0.0.2.5001: UDP, length 1470
00:08:23.967852 IP 10.0.0.1.42103 > 10.0.0.2.5001: UDP, length 1470
00:08:23.979933 IP 10.0.0.1.42103 > 10.0.0.2.5001: UDP, length 1470
00:08:23.992025 IP 10.0.0.1.42103 > 10.0.0.2.5001: UDP, length 1470
00:08:24.004120 IP 10.0.0.1.42103 > 10.0.0.2.5001: UDP, length 1470
00:08:24.016212 IP 10.0.0.1.42103 > 10.0.0.2.5001: UDP, length 1470
00:08:24.028310 IP 10.0.0.1.42103 > 10.0.0.2.5001: UDP, length 1470
00:08:24.040411 IP 10.0.0.1.42103 > 10.0.0.2.5001: UDP, length 1470
00:08:24.052506 IP 10.0.0.1.42103 > 10.0.0.2.5001: UDP, length 1470
00:08:24.064597 IP 10.0.0.1.42103 > 10.0.0.2.5001: UDP, length 1470
00:08:24.076694 IP 10.0.0.1.42103 > 10.0.0.2.5001: UDP, length 1470
00:08:24.088790 IP 10.0.0.1.42103 > 10.0.0.2.5001: UDP, length 1470
00:08:24.100887 IP 10.0.0.1.42103 > 10.0.0.2.5001: UDP, length 1470
00:08:24.112982 IP 10.0.0.1.42103 > 10.0.0.2.5001: UDP, length 1470
00:08:24.125083 IP 10.0.0.1.42103 > 10.0.0.2.5001: UDP, length 1470
00:08:24.137190 IP 10.0.0.1.42103 > 10.0.0.2.5001: UDP, length 1470
00:08:24.149266 IP 10.0.0.1.42103 > 10.0.0.2.5001: UDP, length 1470
00:08:24.161370 IP 10.0.0.1.42103 > 10.0.0.2.5001: UDP, length 1470
00:08:24.173463 IP 10.0.0.1.42103 > 10.0.0.2.5001: UDP, length 1470
00:08:24.185560 IP 10.0.0.1.42103 > 10.0.0.2.5001: UDP, length 1470
00:08:24.197663 IP 10.0.0.1.42103 > 10.0.0.2.5001: UDP, length 1470
00:08:24.209755 IP 10.0.0.1.42103 > 10.0.0.2.5001: UDP, length 1470
00:08:24.221863 IP 10.0.0.1.42103 > 10.0.0.2.5001: UDP, length 1470
00:08:24.233955 IP 10.0.0.1.42103 > 10.0.0.2.5001: UDP, length 1470
00:08:24.246041 IP 10.0.0.1.42103 > 10.0.0.2.5001: UDP, length 1470
00:08:24.258141 IP 10.0.0.1.42103 > 10.0.0.2.5001: UDP, length 1470
00:08:24.270250 IP 10.0.0.1.42103 > 10.0.0.2.5001: UDP, length 1470
00:08:24.282335 IP 10.0.0.1.42103 > 10.0.0.2.5001: UDP, length 1470
00:08:24.294436 IP 10.0.0.1.42103 > 10.0.0.2.5001: UDP, length 1470
00:08:24.306517 IP 10.0.0.1.42103 > 10.0.0.2.5001: UDP, length 1470
00:08:24.318614 IP 10.0.0.1.42103 > 10.0.0.2.5001: UDP, length 1470
00:08:24.330706 IP 10.0.0.1.42103 > 10.0.0.2.5001: UDP, length 1470
00:08:24.342800 IP 10.0.0.1.42103 > 10.0.0.2.5001: UDP, length 1470
00:08:24.354906 IP 10.0.0.1.42103 > 10.0.0.2.5001: UDP, length 1470
00:08:24.366999 IP 10.0.0.1.42103 > 10.0.0.2.5001: UDP, length 1470
00:08:24.379093 IP 10.0.0.1.42103 > 10.0.0.2.5001: UDP, length 1470
00:08:24.391190 IP 10.0.0.1.42103 > 10.0.0.2.5001: UDP, length 1470
00:08:24.403284 IP 10.0.0.1.42103 > 10.0.0.2.5001: UDP, length 1470
00:08:24.415383 IP 10.0.0.1.42103 > 10.0.0.2.5001: UDP, length 1470
00:08:24.427471 IP 10.0.0.1.42103 > 10.0.0.2.5001: UDP, length 1470
00:08:24.439572 IP 10.0.0.1.42103 > 10.0.0.2.5001: UDP, length 1470
00:08:24.452579 IP 10.0.0.1.42103 > 10.0.0.2.5001: UDP, length 1470
00:08:24.463771 IP 10.0.0.1.42103 > 10.0.0.2.5001: UDP, length 1470
00:08:24.475859 IP 10.0.0.1.42103 > 10.0.0.2.5001: UDP, length 1470
00:08:24.487957 IP 10.0.0.1.42103 > 10.0.0.2.5001: UDP, length 1470
00:08:24.500094 IP 10.0.0.1.42103 > 10.0.0.2.5001: UDP, length 1470
00:08:24.512143 IP 10.0.0.1.42103 > 10.0.0.2.5001: UDP, length 1470
00:08:24.524252 IP 10.0.0.1.42103 > 10.0.0.2.5001: UDP, length 1470
00:08:24.536403 IP 10.0.0.1.42103 > 10.0.0.2.5001: UDP, length 1470
00:08:24.548451 IP 10.0.0.1.42103 > 10.0.0.2.5001: UDP, length 1470
00:08:24.560691 IP 10.0.0.1.42103 > 10.0.0.2.5001: UDP, length 1470
00:08:24.572648 IP 10.0.0.1.42103 > 10.0.0.2.5001: UDP, length 1470
00:08:24.584737 IP 10.0.0.1.42103 > 10.0.0.2.5001: UDP, length 1470
00:08:24.596826 IP 10.0.0.1.42103 > 10.0.0.2.5001: UDP, length 1470
00:08:24.608925 IP 10.0.0.1.42103 > 10.0.0.2.5001: UDP, length 1470
00:08:24.621020 IP 10.0.0.1.42103 > 10.0.0.2.5001: UDP, length 1470
00:08:24.633123 IP 10.0.0.1.42103 > 10.0.0.2.5001: UDP, length 1470
00:08:24.645226 IP 10.0.0.1.42103 > 10.0.0.2.5001: UDP, length 1470
00:08:24.657302 IP 10.0.0.1.42103 > 10.0.0.2.5001: UDP, length 1470
00:08:24.669394 IP 10.0.0.1.42103 > 10.0.0.2.5001: UDP, length 1470
00:08:24.681500 IP 10.0.0.1.42103 > 10.0.0.2.5001: UDP, length 1470
00:08:24.693591 IP 10.0.0.1.42103 > 10.0.0.2.5001: UDP, length 1470
00:08:24.705671 IP 10.0.0.1.42103 > 10.0.0.2.5001: UDP, length 1470
00:08:24.717766 IP 10.0.0.1.42103 > 10.0.0.2.5001: UDP, length 1470
00:08:24.729876 IP 10.0.0.1.42103 > 10.0.0.2.5001: UDP, length 1470
00:08:24.741969 IP 10.0.0.1.42103 > 10.0.0.2.5001: UDP, length 1470
00:08:24.754069 IP 10.0.0.1.42103 > 10.0.0.2.5001: UDP, length 1470
00:08:24.766164 IP 10.0.0.1.42103 > 10.0.0.2.5001: UDP, length 1470
00:08:24.778266 IP 10.0.0.1.42103 > 10.0.0.2.5001: UDP, length 1470
00:08:24.790352 IP 10.0.0.1.42103 > 10.0.0.2.5001: UDP, length 1470
00:08:24.802452 IP 10.0.0.1.42103 > 10.0.0.2.5001: UDP, length 1470
00:08:24.814547 IP 10.0.0.1.42103 > 10.0.0.2.5001: UDP, length 1470
00:08:24.826634 IP 10.0.0.1.42103 > 10.0.0.2.5001: UDP, length 1470
00:08:24.838745 IP 10.0.0.1.42103 > 10.0.0.2.5001: UDP, length 1470
00:08:24.850831 IP 10.0.0.1.42103 > 10.0.0.2.5001: UDP, length 1470
00:08:24.862938 IP 10.0.0.1.42103 > 10.0.0.2.5001: UDP, length 1470
00:08:24.875025 IP 10.0.0.1.42103 > 10.0.0.2.5001: UDP, length 1470
00:08:24.887121 IP 10.0.0.1.42103 > 10.0.0.2.5001: UDP, length 1470
00:08:24.899218 IP 10.0.0.1.42103 > 10.0.0.2.5001: UDP, length 1470
00:08:24.911311 IP 10.0.0.1.42103 > 10.0.0.2.5001: UDP, length 1470
00:08:24.923430 IP 10.0.0.1.42103 > 10.0.0.2.5001: UDP, length 1470
00:08:24.935502 IP 10.0.0.1.42103 > 10.0.0.2.5001: UDP, length 1470
00:08:24.947606 IP 10.0.0.1.42103 > 10.0.0.2.5001: UDP, length 1470
00:08:24.959698 IP 10.0.0.1.42103 > 10.0.0.2.5001: UDP, length 1470
00:08:24.971793 IP 10.0.0.1.42103 > 10.0.0.2.5001: UDP, length 1470
00:08:24.983888 IP 10.0.0.1.42103 > 10.0.0.2.5001: UDP, length 1470
00:08:24.995987 IP 10.0.0.1.42103 > 10.0.0.2.5001: UDP, length 1470
00:08:25.008073 IP 10.0.0.1.42103 > 10.0.0.2.5001: UDP, length 1470
00:08:25.020180 IP 10.0.0.1.42103 > 10.0.0.2.5001: UDP, length 1470
00:08:25.032273 IP 10.0.0.1.42103 > 10.0.0.2.5001: UDP, length 1470
00:08:25.044362 IP 10.0.0.1.42103 > 10.0.0.2.5001: UDP, length 1470
00:08:25.056465 IP 10.0.0.1.42103 > 10.0.0.2.5001: UDP, length 1470
00:08:25.068569 IP 10.0.0.1.42103 > 10.0.0.2.5001: UDP, length 1470
00:08:25.080658 IP 10.0.0.1.42103 > 10.0.0.2.5001: UDP, length 1470
00:08:25.092757 IP 10.0.0.1.42103 > 10.0.0.2.5001: UDP, length 1470
00:08:25.104852 IP 10.0.0.1.42103 > 10.0.0.2.5001: UDP, length 1470
00:08:25.116944 IP 10.0.0.1.42103 > 10.0.0.2.5001: UDP, length 1470
00:08:25.129046 IP 10.0.0.1.42103 > 10.0.0.2.5001: UDP, length 1470
00:08:25.141137 IP 10.0.0.1.42103 > 10.0.0.2.5001: UDP, length 1470
00:08:25.153230 IP 10.0.0.1.42103 > 10.0.0.2.5001: UDP, length 1470
00:08:25.165328 IP 10.0.0.1.42103 > 10.0.0.2.5001: UDP, length 1470
00:08:25.177428 IP 10.0.0.1.42103 > 10.0.0.2.5001: UDP, length 1470
00:08:25.189527 IP 10.0.0.1.42103 > 10.0.0.2.5001: UDP, length 1470
00:08:25.201609 IP 10.0.0.1.42103 > 10.0.0.2.5001: UDP, length 1470
00:08:25.213713 IP 10.0.0.1.42103 > 10.0.0.2.5001: UDP, length 1470
00:08:25.225816 IP 10.0.0.1.42103 > 10.0.0.2.5001: UDP, length 1470
00:08:25.237908 IP 10.0.0.1.42103 > 10.0.0.2.5001: UDP, length 1470
00:08:25.250012 IP 10.0.0.1.42103 > 10.0.0.2.5001: UDP, length 1470
00:08:25.262097 IP 10.0.0.1.42103 > 10.0.0.2.5001: UDP, length 1470
00:08:25.274195 IP 10.0.0.1.42103 > 10.0.0.2.5001: UDP, length 1470
00:08:25.286293 IP 10.0.0.1.42103 > 10.0.0.2.5001: UDP, length 1470
00:08:25.298390 IP 10.0.0.1.42103 > 10.0.0.2.5001: UDP, length 1470
00:08:25.310519 IP 10.0.0.1.42103 > 10.0.0.2.5001: UDP, length 1470
00:08:25.322791 IP 10.0.0.1.42103 > 10.0.0.2.5001: UDP, length 1470
00:08:25.334712 IP 10.0.0.1.42103 > 10.0.0.2.5001: UDP, length 1470
00:08:25.347641 IP 10.0.0.1.42103 > 10.0.0.2.5001: UDP, length 1470
00:08:25.358874 IP 10.0.0.1.42103 > 10.0.0.2.5001: UDP, length 1470
00:08:25.370973 IP 10.0.0.1.42103 > 10.0.0.2.5001: UDP, length 1470
00:08:25.383069 IP 10.0.0.1.42103 > 10.0.0.2.5001: UDP, length 1470
00:08:25.395163 IP 10.0.0.1.42103 > 10.0.0.2.5001: UDP, length 1470
00:08:25.407259 IP 10.0.0.1.42103 > 10.0.0.2.5001: UDP, length 1470
00:08:25.419380 IP 10.0.0.1.42103 > 10.0.0.2.5001: UDP, length 1470
00:08:25.431457 IP 10.0.0.1.42103 > 10.0.0.2.5001: UDP, length 1470
00:08:25.443565 IP 10.0.0.1.42103 > 10.0.0.2.5001: UDP, length 1470
00:08:25.455640 IP 10.0.0.1.42103 > 10.0.0.2.5001: UDP, length 1470
00:08:25.467760 IP 10.0.0.1.42103 > 10.0.0.2.5001: UDP, length 1470
00:08:25.479829 IP 10.0.0.1.42103 > 10.0.0.2.5001: UDP, length 1470
00:08:25.491928 IP 10.0.0.1.42103 > 10.0.0.2.5001: UDP, length 1470
00:08:25.504024 IP 10.0.0.1.42103 > 10.0.0.2.5001: UDP, length 1470
00:08:25.516114 IP 10.0.0.1.42103 > 10.0.0.2.5001: UDP, length 1470
00:08:25.528209 IP 10.0.0.1.42103 > 10.0.0.2.5001: UDP, length 1470
00:08:25.540311 IP 10.0.0.1.42103 > 10.0.0.2.5001: UDP, length 1470
00:08:25.552405 IP 10.0.0.1.42103 > 10.0.0.2.5001: UDP, length 1470
00:08:25.564552 IP 10.0.0.1.42103 > 10.0.0.2.5001: UDP, length 1470
00:08:25.576604 IP 10.0.0.1.42103 > 10.0.0.2.5001: UDP, length 1470
00:08:25.588696 IP 10.0.0.1.42103 > 10.0.0.2.5001: UDP, length 1470
00:08:25.600783 IP 10.0.0.1.42103 > 10.0.0.2.5001: UDP, length 1470
00:08:25.612920 IP 10.0.0.1.42103 > 10.0.0.2.5001: UDP, length 1470
00:08:25.624986 IP 10.0.0.1.42103 > 10.0.0.2.5001: UDP, length 1470
00:08:25.637076 IP 10.0.0.1.42103 > 10.0.0.2.5001: UDP, length 1470
00:08:25.649176 IP 10.0.0.1.42103 > 10.0.0.2.5001: UDP, length 1470
00:08:25.661269 IP 10.0.0.1.42103 > 10.0.0.2.5001: UDP, length 1470
00:08:25.673366 IP 10.0.0.1.42103 > 10.0.0.2.5001: UDP, length 1470
00:08:25.685455 IP 10.0.0.1.42103 > 10.0.0.2.5001: UDP, length 1470
00:08:25.697555 IP 10.0.0.1.42103 > 10.0.0.2.5001: UDP, length 1470
00:08:25.709662 IP 10.0.0.1.42103 > 10.0.0.2.5001: UDP, length 1470
00:08:25.721759 IP 10.0.0.1.42103 > 10.0.0.2.5001: UDP, length 1470
00:08:25.733851 IP 10.0.0.1.42103 > 10.0.0.2.5001: UDP, length 1470
00:08:25.745947 IP 10.0.0.1.42103 > 10.0.0.2.5001: UDP, length 1470
00:08:25.758901 IP 10.0.0.1.42103 > 10.0.0.2.5001: UDP, length 1470
00:08:25.770143 IP 10.0.0.1.42103 > 10.0.0.2.5001: UDP, length 1470
00:08:25.782239 IP 10.0.0.1.42103 > 10.0.0.2.5001: UDP, length 1470
00:08:25.794347 IP 10.0.0.1.42103 > 10.0.0.2.5001: UDP, length 1470
00:08:25.807266 IP 10.0.0.1.42103 > 10.0.0.2.5001: UDP, length 1470
00:08:25.818536 IP 10.0.0.1.42103 > 10.0.0.2.5001: UDP, length 1470
00:08:25.830638 IP 10.0.0.1.42103 > 10.0.0.2.5001: UDP, length 1470
00:08:25.842712 IP 10.0.0.1.42103 > 10.0.0.2.5001: UDP, length 1470
00:08:25.855707 IP 10.0.0.1.42103 > 10.0.0.2.5001: UDP, length 1470
00:08:25.866935 IP 10.0.0.1.42103 > 10.0.0.2.5001: UDP, length 1470
00:08:25.879017 IP 10.0.0.1.42103 > 10.0.0.2.5001: UDP, length 1470
00:08:25.891109 IP 10.0.0.1.42103 > 10.0.0.2.5001: UDP, length 1470
00:08:25.903181 IP 10.0.0.1.42103 > 10.0.0.2.5001: UDP, length 1470
00:08:25.916031 IP 10.0.0.1.42103 > 10.0.0.2.5001: UDP, length 1470
00:08:25.927405 IP 10.0.0.1.42103 > 10.0.0.2.5001: UDP, length 1470
00:08:25.939477 IP 10.0.0.1.42103 > 10.0.0.2.5001: UDP, length 1470
00:08:25.951603 IP 10.0.0.1.42103 > 10.0.0.2.5001: UDP, length 1470
00:08:25.963675 IP 10.0.0.1.42103 > 10.0.0.2.5001: UDP, length 1470
00:08:25.975773 IP 10.0.0.1.42103 > 10.0.0.2.5001: UDP, length 1470
00:08:25.987861 IP 10.0.0.1.42103 > 10.0.0.2.5001: UDP, length 1470
00:08:25.999963 IP 10.0.0.1.42103 > 10.0.0.2.5001: UDP, length 1470
00:08:26.012078 IP 10.0.0.1.42103 > 10.0.0.2.5001: UDP, length 1470
00:08:26.024163 IP 10.0.0.1.42103 > 10.0.0.2.5001: UDP, length 1470
00:08:26.036247 IP 10.0.0.1.42103 > 10.0.0.2.5001: UDP, length 1470
00:08:26.048344 IP 10.0.0.1.42103 > 10.0.0.2.5001: UDP, length 1470
00:08:26.060461 IP 10.0.0.1.42103 > 10.0.0.2.5001: UDP, length 1470
00:08:26.072539 IP 10.0.0.1.42103 > 10.0.0.2.5001: UDP, length 1470
00:08:26.084627 IP 10.0.0.1.42103 > 10.0.0.2.5001: UDP, length 1470
00:08:26.096722 IP 10.0.0.1.42103 > 10.0.0.2.5001: UDP, length 1470
00:08:26.108833 IP 10.0.0.1.42103 > 10.0.0.2.5001: UDP, length 1470
00:08:26.120944 IP 10.0.0.1.42103 > 10.0.0.2.5001: UDP, length 1470
00:08:26.133021 IP 10.0.0.1.42103 > 10.0.0.2.5001: UDP, length 1470
00:08:26.145126 IP 10.0.0.1.42103 > 10.0.0.2.5001: UDP, length 1470
00:08:26.157206 IP 10.0.0.1.42103 > 10.0.0.2.5001: UDP, length 1470
00:08:26.169324 IP 10.0.0.1.42103 > 10.0.0.2.5001: UDP, length 1470
00:08:26.181420 IP 10.0.0.1.42103 > 10.0.0.2.5001: UDP, length 1470
00:08:26.193506 IP 10.0.0.1.42103 > 10.0.0.2.5001: UDP, length 1470
00:08:26.205615 IP 10.0.0.1.42103 > 10.0.0.2.5001: UDP, length 1470
00:08:26.217685 IP 10.0.0.1.42103 > 10.0.0.2.5001: UDP, length 1470
00:08:26.229788 IP 10.0.0.1.42103 > 10.0.0.2.5001: UDP, length 1470
00:08:26.241941 IP 10.0.0.1.42103 > 10.0.0.2.5001: UDP, length 1470
00:08:26.253983 IP 10.0.0.1.42103 > 10.0.0.2.5001: UDP, length 1470
00:08:26.266093 IP 10.0.0.1.42103 > 10.0.0.2.5001: UDP, length 1470
00:08:26.279077 IP 10.0.0.1.42103 > 10.0.0.2.5001: UDP, length 1470
00:08:26.290268 IP 10.0.0.1.42103 > 10.0.0.2.5001: UDP, length 1470
00:08:26.302359 IP 10.0.0.1.42103 > 10.0.0.2.5001: UDP, length 1470
00:08:26.314463 IP 10.0.0.1.42103 > 10.0.0.2.5001: UDP, length 1470
00:08:26.326553 IP 10.0.0.1.42103 > 10.0.0.2.5001: UDP, length 1470
00:08:26.338652 IP 10.0.0.1.42103 > 10.0.0.2.5001: UDP, length 1470
00:08:26.350750 IP 10.0.0.1.42103 > 10.0.0.2.5001: UDP, length 1470
00:08:26.362838 IP 10.0.0.1.42103 > 10.0.0.2.5001: UDP, length 1470
00:08:26.374936 IP 10.0.0.1.42103 > 10.0.0.2.5001: UDP, length 1470
00:08:26.387647 IP 10.0.0.1.42103 > 10.0.0.2.5001: UDP, length 1470
00:08:26.399162 IP 10.0.0.1.42103 > 10.0.0.2.5001: UDP, length 1470
00:08:26.411235 IP 10.0.0.1.42103 > 10.0.0.2.5001: UDP, length 1470
00:08:26.423324 IP 10.0.0.1.42103 > 10.0.0.2.5001: UDP, length 1470
00:08:26.435438 IP 10.0.0.1.42103 > 10.0.0.2.5001: UDP, length 1470
00:08:26.447523 IP 10.0.0.1.42103 > 10.0.0.2.5001: UDP, length 1470
00:08:26.459633 IP 10.0.0.1.42103 > 10.0.0.2.5001: UDP, length 1470
00:08:26.471715 IP 10.0.0.1.42103 > 10.0.0.2.5001: UDP, length 1470
00:08:26.483805 IP 10.0.0.1.42103 > 10.0.0.2.5001: UDP, length 1470
00:08:26.496416 IP 10.0.0.1.42103 > 10.0.0.2.5001: UDP, length 1470
00:08:26.508013 IP 10.0.0.1.42103 > 10.0.0.2.5001: UDP, length 1470
00:08:26.520865 IP 10.0.0.1.42103 > 10.0.0.2.5001: UDP, length 1470
00:08:26.532179 IP 10.0.0.1.42103 > 10.0.0.2.5001: UDP, length 1470
00:08:26.544267 IP 10.0.0.1.42103 > 10.0.0.2.5001: UDP, length 1470
00:08:26.556379 IP 10.0.0.1.42103 > 10.0.0.2.5001: UDP, length 1470
00:08:26.568481 IP 10.0.0.1.42103 > 10.0.0.2.5001: UDP, length 1470
00:08:26.580604 IP 10.0.0.1.42103 > 10.0.0.2.5001: UDP, length 1470
00:08:26.592661 IP 10.0.0.1.42103 > 10.0.0.2.5001: UDP, length 1470
00:08:26.604761 IP 10.0.0.1.42103 > 10.0.0.2.5001: UDP, length 1470
00:08:26.616860 IP 10.0.0.1.42103 > 10.0.0.2.5001: UDP, length 1470
00:08:26.628956 IP 10.0.0.1.42103 > 10.0.0.2.5001: UDP, length 1470
00:08:26.641059 IP 10.0.0.1.42103 > 10.0.0.2.5001: UDP, length 1470
00:08:26.654072 IP 10.0.0.1.42103 > 10.0.0.2.5001: UDP, length 1470
00:08:26.665248 IP 10.0.0.1.42103 > 10.0.0.2.5001: UDP, length 1470
00:08:26.678205 IP 10.0.0.1.42103 > 10.0.0.2.5001: UDP, length 1470
00:08:26.689436 IP 10.0.0.1.42103 > 10.0.0.2.5001: UDP, length 1470
00:08:26.701526 IP 10.0.0.1.42103 > 10.0.0.2.5001: UDP, length 1470
00:08:26.713623 IP 10.0.0.1.42103 > 10.0.0.2.5001: UDP, length 1470
00:08:26.725727 IP 10.0.0.1.42103 > 10.0.0.2.5001: UDP, length 1470
00:08:26.737820 IP 10.0.0.1.42103 > 10.0.0.2.5001: UDP, length 1470
00:08:26.749913 IP 10.0.0.1.42103 > 10.0.0.2.5001: UDP, length 1470
00:08:26.762018 IP 10.0.0.1.42103 > 10.0.0.2.5001: UDP, length 1470
00:08:26.774127 IP 10.0.0.1.42103 > 10.0.0.2.5001: UDP, length 1470
00:08:26.786190 IP 10.0.0.1.42103 > 10.0.0.2.5001: UDP, length 1470
00:08:26.798301 IP 10.0.0.1.42103 > 10.0.0.2.5001: UDP, length 1470
00:08:26.810385 IP 10.0.0.1.42103 > 10.0.0.2.5001: UDP, length 1470
00:08:26.822494 IP 10.0.0.1.42103 > 10.0.0.2.5001: UDP, length 1470
00:08:26.834592 IP 10.0.0.1.42103 > 10.0.0.2.5001: UDP, length 1470
00:08:26.846683 IP 10.0.0.1.42103 > 10.0.0.2.5001: UDP, length 1470
00:08:26.858783 IP 10.0.0.1.42103 > 10.0.0.2.5001: UDP, length 1470
00:08:26.871624 IP 10.0.0.1.42103 > 10.0.0.2.5001: UDP, length 1470
00:08:26.882989 IP 10.0.0.1.42103 > 10.0.0.2.5001: UDP, length 1470
00:08:26.895067 IP 10.0.0.1.42103 > 10.0.0.2.5001: UDP, length 1470
00:08:26.907167 IP 10.0.0.1.42103 > 10.0.0.2.5001: UDP, length 1470
00:08:26.919292 IP 10.0.0.1.42103 > 10.0.0.2.5001: UDP, length 1470
00:08:26.931355 IP 10.0.0.1.42103 > 10.0.0.2.5001: UDP, length 1470
00:08:26.943471 IP 10.0.0.1.42103 > 10.0.0.2.5001: UDP, length 1470
00:08:26.955535 IP 10.0.0.1.42103 > 10.0.0.2.5001: UDP, length 1470
00:08:26.967662 IP 10.0.0.1.42103 > 10.0.0.2.5001: UDP, length 1470
00:08:26.979731 IP 10.0.0.1.42103 > 10.0.0.2.5001: UDP, length 1470
00:08:26.991837 IP 10.0.0.1.42103 > 10.0.0.2.5001: UDP, length 1470
00:08:27.003943 IP 10.0.0.1.42103 > 10.0.0.2.5001: UDP, length 1470
00:08:27.016037 IP 10.0.0.1.42103 > 10.0.0.2.5001: UDP, length 1470
00:08:27.028129 IP 10.0.0.1.42103 > 10.0.0.2.5001: UDP, length 1470
00:08:27.040229 IP 10.0.0.1.42103 > 10.0.0.2.5001: UDP, length 1470
00:08:27.052330 IP 10.0.0.1.42103 > 10.0.0.2.5001: UDP, length 1470
00:08:27.064417 IP 10.0.0.1.42103 > 10.0.0.2.5001: UDP, length 1470
00:08:27.076549 IP 10.0.0.1.42103 > 10.0.0.2.5001: UDP, length 1470
00:08:27.088605 IP 10.0.0.1.42103 > 10.0.0.2.5001: UDP, length 1470
00:08:27.100700 IP 10.0.0.1.42103 > 10.0.0.2.5001: UDP, length 1470
00:08:27.112803 IP 10.0.0.1.42103 > 10.0.0.2.5001: UDP, length 1470
00:08:27.124894 IP 10.0.0.1.42103 > 10.0.0.2.5001: UDP, length 1470
00:08:27.136999 IP 10.0.0.1.42103 > 10.0.0.2.5001: UDP, length 1470
00:08:27.149087 IP 10.0.0.1.42103 > 10.0.0.2.5001: UDP, length 1470
00:08:27.161177 IP 10.0.0.1.42103 > 10.0.0.2.5001: UDP, length 1470
00:08:27.173277 IP 10.0.0.1.42103 > 10.0.0.2.5001: UDP, length 1470
00:08:27.185375 IP 10.0.0.1.42103 > 10.0.0.2.5001: UDP, length 1470
00:08:27.197502 IP 10.0.0.1.42103 > 10.0.0.2.5001: UDP, length 1470
00:08:27.209567 IP 10.0.0.1.42103 > 10.0.0.2.5001: UDP, length 1470
00:08:27.221671 IP 10.0.0.1.42103 > 10.0.0.2.5001: UDP, length 1470
00:08:27.233776 IP 10.0.0.1.42103 > 10.0.0.2.5001: UDP, length 1470
00:08:27.245838 IP 10.0.0.1.42103 > 10.0.0.2.5001: UDP, length 1470
00:08:27.257947 IP 10.0.0.1.42103 > 10.0.0.2.5001: UDP, length 1470
00:08:27.270051 IP 10.0.0.1.42103 > 10.0.0.2.5001: UDP, length 1470
00:08:27.282141 IP 10.0.0.1.42103 > 10.0.0.2.5001: UDP, length 1470
00:08:27.294248 IP 10.0.0.1.42103 > 10.0.0.2.5001: UDP, length 1470
00:08:27.306333 IP 10.0.0.1.42103 > 10.0.0.2.5001: UDP, length 1470
00:08:27.318435 IP 10.0.0.1.42103 > 10.0.0.2.5001: UDP, length 1470
00:08:27.330546 IP 10.0.0.1.42103 > 10.0.0.2.5001: UDP, length 1470
00:08:27.342605 IP 10.0.0.1.42103 > 10.0.0.2.5001: UDP, length 1470
00:08:27.354717 IP 10.0.0.1.42103 > 10.0.0.2.5001: UDP, length 1470
00:08:27.366829 IP 10.0.0.1.42103 > 10.0.0.2.5001: UDP, length 1470
00:08:27.378919 IP 10.0.0.1.42103 > 10.0.0.2.5001: UDP, length 1470
00:08:27.391005 IP 10.0.0.1.42103 > 10.0.0.2.5001: UDP, length 1470
00:08:27.403103 IP 10.0.0.1.42103 > 10.0.0.2.5001: UDP, length 1470
00:08:27.415199 IP 10.0.0.1.42103 > 10.0.0.2.5001: UDP, length 1470
00:08:27.427293 IP 10.0.0.1.42103 > 10.0.0.2.5001: UDP, length 1470
00:08:27.439387 IP 10.0.0.1.42103 > 10.0.0.2.5001: UDP, length 1470
00:08:27.451481 IP 10.0.0.1.42103 > 10.0.0.2.5001: UDP, length 1470
00:08:27.463587 IP 10.0.0.1.42103 > 10.0.0.2.5001: UDP, length 1470
00:08:27.475668 IP 10.0.0.1.42103 > 10.0.0.2.5001: UDP, length 1470
00:08:27.487771 IP 10.0.0.1.42103 > 10.0.0.2.5001: UDP, length 1470
00:08:27.499851 IP 10.0.0.1.42103 > 10.0.0.2.5001: UDP, length 1470
00:08:27.511966 IP 10.0.0.1.42103 > 10.0.0.2.5001: UDP, length 1470
00:08:27.524047 IP 10.0.0.1.42103 > 10.0.0.2.5001: UDP, length 1470
00:08:27.536915 IP 10.0.0.1.42103 > 10.0.0.2.5001: UDP, length 1470
00:08:27.548252 IP 10.0.0.1.42103 > 10.0.0.2.5001: UDP, length 1470
00:08:27.560354 IP 10.0.0.1.42103 > 10.0.0.2.5001: UDP, length 1470
00:08:27.572458 IP 10.0.0.1.42103 > 10.0.0.2.5001: UDP, length 1470
00:08:27.585331 IP 10.0.0.1.42103 > 10.0.0.2.5001: UDP, length 1470
00:08:27.596628 IP 10.0.0.1.42103 > 10.0.0.2.5001: UDP, length 1470
00:08:27.608732 IP 10.0.0.1.42103 > 10.0.0.2.5001: UDP, length 1470
00:08:27.620818 IP 10.0.0.1.42103 > 10.0.0.2.5001: UDP, length 1470
00:08:27.632935 IP 10.0.0.1.42103 > 10.0.0.2.5001: UDP, length 1470
00:08:27.645065 IP 10.0.0.1.42103 > 10.0.0.2.5001: UDP, length 1470
00:08:27.657125 IP 10.0.0.1.42103 > 10.0.0.2.5001: UDP, length 1470
00:08:27.669232 IP 10.0.0.1.42103 > 10.0.0.2.5001: UDP, length 1470
00:08:27.681308 IP 10.0.0.1.42103 > 10.0.0.2.5001: UDP, length 1470
00:08:27.693418 IP 10.0.0.1.42103 > 10.0.0.2.5001: UDP, length 1470
00:08:27.705503 IP 10.0.0.1.42103 > 10.0.0.2.5001: UDP, length 1470
00:08:27.717590 IP 10.0.0.1.42103 > 10.0.0.2.5001: UDP, length 1470
00:08:27.729684 IP 10.0.0.1.42103 > 10.0.0.2.5001: UDP, length 1470
00:08:27.741787 IP 10.0.0.1.42103 > 10.0.0.2.5001: UDP, length 1470
00:08:27.753902 IP 10.0.0.1.42103 > 10.0.0.2.5001: UDP, length 1470
00:08:27.765988 IP 10.0.0.1.42103 > 10.0.0.2.5001: UDP, length 1470
00:08:27.778078 IP 10.0.0.1.42103 > 10.0.0.2.5001: UDP, length 1470
00:08:27.790195 IP 10.0.0.1.42103 > 10.0.0.2.5001: UDP, length 1470
00:08:27.802270 IP 10.0.0.1.42103 > 10.0.0.2.5001: UDP, length 1470
00:08:27.814386 IP 10.0.0.1.42103 > 10.0.0.2.5001: UDP, length 1470
00:08:27.826476 IP 10.0.0.1.42103 > 10.0.0.2.5001: UDP, length 1470
00:08:27.838559 IP 10.0.0.1.42103 > 10.0.0.2.5001: UDP, length 1470
00:08:27.850661 IP 10.0.0.1.42103 > 10.0.0.2.5001: UDP, length 1470
00:08:27.862747 IP 10.0.0.1.42103 > 10.0.0.2.5001: UDP, length 1470
00:08:27.874884 IP 10.0.0.1.42103 > 10.0.0.2.5001: UDP, length 1470
00:08:27.886932 IP 10.0.0.1.42103 > 10.0.0.2.5001: UDP, length 1470
00:08:27.899030 IP 10.0.0.1.42103 > 10.0.0.2.5001: UDP, length 1470
00:08:27.911132 IP 10.0.0.1.42103 > 10.0.0.2.5001: UDP, length 1470
00:08:27.923231 IP 10.0.0.1.42103 > 10.0.0.2.5001: UDP, length 1470
00:08:27.936189 IP 10.0.0.1.42103 > 10.0.0.2.5001: UDP, length 1470
00:08:27.947435 IP 10.0.0.1.42103 > 10.0.0.2.5001: UDP, length 1470
00:08:27.959513 IP 10.0.0.1.42103 > 10.0.0.2.5001: UDP, length 1470
00:08:27.971615 IP 10.0.0.1.42103 > 10.0.0.2.5001: UDP, length 1470
00:08:27.983726 IP 10.0.0.1.42103 > 10.0.0.2.5001: UDP, length 1470
00:08:27.995788 IP 10.0.0.1.42103 > 10.0.0.2.5001: UDP, length 1470
00:08:28.007946 IP 10.0.0.1.42103 > 10.0.0.2.5001: UDP, length 1470
00:08:28.019998 IP 10.0.0.1.42103 > 10.0.0.2.5001: UDP, length 1470
00:08:28.032817 IP 10.0.0.1.42103 > 10.0.0.2.5001: UDP, length 1470
00:08:28.044224 IP 10.0.0.1.42103 > 10.0.0.2.5001: UDP, length 1470
00:08:28.056275 IP 10.0.0.1.42103 > 10.0.0.2.5001: UDP, length 1470
00:08:28.068384 IP 10.0.0.1.42103 > 10.0.0.2.5001: UDP, length 1470
00:08:28.080498 IP 10.0.0.1.42103 > 10.0.0.2.5001: UDP, length 1470
00:08:28.092741 IP 10.0.0.1.42103 > 10.0.0.2.5001: UDP, length 1470
00:08:28.104699 IP 10.0.0.1.42103 > 10.0.0.2.5001: UDP, length 1470
00:08:28.116765 IP 10.0.0.1.42103 > 10.0.0.2.5001: UDP, length 1470
00:08:28.128866 IP 10.0.0.1.42103 > 10.0.0.2.5001: UDP, length 1470
00:08:28.141006 IP 10.0.0.1.42103 > 10.0.0.2.5001: UDP, length 1470
00:08:28.153043 IP 10.0.0.1.42103 > 10.0.0.2.5001: UDP, length 1470
00:08:28.165149 IP 10.0.0.1.42103 > 10.0.0.2.5001: UDP, length 1470
00:08:28.177250 IP 10.0.0.1.42103 > 10.0.0.2.5001: UDP, length 1470
00:08:28.189339 IP 10.0.0.1.42103 > 10.0.0.2.5001: UDP, length 1470
00:08:28.201427 IP 10.0.0.1.42103 > 10.0.0.2.5001: UDP, length 1470
00:08:28.213537 IP 10.0.0.1.42103 > 10.0.0.2.5001: UDP, length 1470
00:08:28.225623 IP 10.0.0.1.42103 > 10.0.0.2.5001: UDP, length 1470
00:08:28.237719 IP 10.0.0.1.42103 > 10.0.0.2.5001: UDP, length 1470
00:08:28.249820 IP 10.0.0.1.42103 > 10.0.0.2.5001: UDP, length 1470
00:08:28.261920 IP 10.0.0.1.42103 > 10.0.0.2.5001: UDP, length 1470
00:08:28.274038 IP 10.0.0.1.42103 > 10.0.0.2.5001: UDP, length 1470
00:08:28.286105 IP 10.0.0.1.42103 > 10.0.0.2.5001: UDP, length 1470
00:08:28.298214 IP 10.0.0.1.42103 > 10.0.0.2.5001: UDP, length 1470
00:08:28.310303 IP 10.0.0.1.42103 > 10.0.0.2.5001: UDP, length 1470
00:08:28.323118 IP 10.0.0.1.42103 > 10.0.0.2.5001: UDP, length 1470
00:08:28.334490 IP 10.0.0.1.42103 > 10.0.0.2.5001: UDP, length 1470
00:08:28.346587 IP 10.0.0.1.42103 > 10.0.0.2.5001: UDP, length 1470
00:08:28.358702 IP 10.0.0.1.42103 > 10.0.0.2.5001: UDP, length 1470
00:08:28.370850 IP 10.0.0.1.42103 > 10.0.0.2.5001: UDP, length 1470
00:08:28.382875 IP 10.0.0.1.42103 > 10.0.0.2.5001: UDP, length 1470
00:08:28.394976 IP 10.0.0.1.42103 > 10.0.0.2.5001: UDP, length 1470
00:08:28.407070 IP 10.0.0.1.42103 > 10.0.0.2.5001: UDP, length 1470
00:08:28.419197 IP 10.0.0.1.42103 > 10.0.0.2.5001: UDP, length 1470
00:08:28.431267 IP 10.0.0.1.42103 > 10.0.0.2.5001: UDP, length 1470
00:08:28.443353 IP 10.0.0.1.42103 > 10.0.0.2.5001: UDP, length 1470
00:08:28.455447 IP 10.0.0.1.42103 > 10.0.0.2.5001: UDP, length 1470
00:08:28.468316 IP 10.0.0.1.42103 > 10.0.0.2.5001: UDP, length 1470
00:08:28.479655 IP 10.0.0.1.42103 > 10.0.0.2.5001: UDP, length 1470
00:08:28.491741 IP 10.0.0.1.42103 > 10.0.0.2.5001: UDP, length 1470
00:08:28.503833 IP 10.0.0.1.42103 > 10.0.0.2.5001: UDP, length 1470
00:08:28.516668 IP 10.0.0.1.42103 > 10.0.0.2.5001: UDP, length 1470
00:08:28.528007 IP 10.0.0.1.42103 > 10.0.0.2.5001: UDP, length 1470
00:08:28.540126 IP 10.0.0.1.42103 > 10.0.0.2.5001: UDP, length 1470
00:08:28.552222 IP 10.0.0.1.42103 > 10.0.0.2.5001: UDP, length 1470
00:08:28.564303 IP 10.0.0.1.42103 > 10.0.0.2.5001: UDP, length 1470
00:08:28.576394 IP 10.0.0.1.42103 > 10.0.0.2.5001: UDP, length 1470
00:08:28.588499 IP 10.0.0.1.42103 > 10.0.0.2.5001: UDP, length 1470
00:08:28.600592 IP 10.0.0.1.42103 > 10.0.0.2.5001: UDP, length 1470
00:08:28.612695 IP 10.0.0.1.42103 > 10.0.0.2.5001: UDP, length 1470
00:08:28.624807 IP 10.0.0.1.42103 > 10.0.0.2.5001: UDP, length 1470
00:08:28.636888 IP 10.0.0.1.42103 > 10.0.0.2.5001: UDP, length 1470
00:08:28.648979 IP 10.0.0.1.42103 > 10.0.0.2.5001: UDP, length 1470
00:08:28.661074 IP 10.0.0.1.42103 > 10.0.0.2.5001: UDP, length 1470
00:08:28.673169 IP 10.0.0.1.42103 > 10.0.0.2.5001: UDP, length 1470
00:08:28.685275 IP 10.0.0.1.42103 > 10.0.0.2.5001: UDP, length 1470
00:08:28.697372 IP 10.0.0.1.42103 > 10.0.0.2.5001: UDP, length 1470
00:08:28.709491 IP 10.0.0.1.42103 > 10.0.0.2.5001: UDP, length 1470
00:08:28.721554 IP 10.0.0.1.42103 > 10.0.0.2.5001: UDP, length 1470
00:08:28.733660 IP 10.0.0.1.42103 > 10.0.0.2.5001: UDP, length 1470
00:08:28.745746 IP 10.0.0.1.42103 > 10.0.0.2.5001: UDP, length 1470
00:08:28.757851 IP 10.0.0.1.42103 > 10.0.0.2.5001: UDP, length 1470
00:08:28.769946 IP 10.0.0.1.42103 > 10.0.0.2.5001: UDP, length 1470
00:08:28.782048 IP 10.0.0.1.42103 > 10.0.0.2.5001: UDP, length 1470
00:08:28.794169 IP 10.0.0.1.42103 > 10.0.0.2.5001: UDP, length 1470
00:08:28.806239 IP 10.0.0.1.42103 > 10.0.0.2.5001: UDP, length 1470
00:08:28.818330 IP 10.0.0.1.42103 > 10.0.0.2.5001: UDP, length 1470
00:08:28.831387 IP 10.0.0.1.42103 > 10.0.0.2.5001: UDP, length 1470
00:08:28.842549 IP 10.0.0.1.42103 > 10.0.0.2.5001: UDP, length 1470
00:08:28.854610 IP 10.0.0.1.42103 > 10.0.0.2.5001: UDP, length 1470
00:08:28.867540 IP 10.0.0.1.42103 > 10.0.0.2.5001: UDP, length 1470
00:08:28.878815 IP 10.0.0.1.42103 > 10.0.0.2.5001: UDP, length 1470
00:08:28.890906 IP 10.0.0.1.42103 > 10.0.0.2.5001: UDP, length 1470
00:08:28.903021 IP 10.0.0.1.42103 > 10.0.0.2.5001: UDP, length 1470
00:08:28.915090 IP 10.0.0.1.42103 > 10.0.0.2.5001: UDP, length 1470
00:08:28.927199 IP 10.0.0.1.42103 > 10.0.0.2.5001: UDP, length 1470
00:08:28.940067 IP 10.0.0.1.42103 > 10.0.0.2.5001: UDP, length 1470
00:08:28.951406 IP 10.0.0.1.42103 > 10.0.0.2.5001: UDP, length 1470
00:08:28.963489 IP 10.0.0.1.42103 > 10.0.0.2.5001: UDP, length 1470
00:08:28.975574 IP 10.0.0.1.42103 > 10.0.0.2.5001: UDP, length 1470
00:08:28.987678 IP 10.0.0.1.42103 > 10.0.0.2.5001: UDP, length 1470
00:08:28.999772 IP 10.0.0.1.42103 > 10.0.0.2.5001: UDP, length 1470
00:08:29.011870 IP 10.0.0.1.42103 > 10.0.0.2.5001: UDP, length 1470
00:08:29.023958 IP 10.0.0.1.42103 > 10.0.0.2.5001: UDP, length 1470
00:08:29.036088 IP 10.0.0.1.42103 > 10.0.0.2.5001: UDP, length 1470
00:08:29.048155 IP 10.0.0.1.42103 > 10.0.0.2.5001: UDP, length 1470
00:08:29.060254 IP 10.0.0.1.42103 > 10.0.0.2.5001: UDP, length 1470
00:08:29.072349 IP 10.0.0.1.42103 > 10.0.0.2.5001: UDP, length 1470
00:08:29.084443 IP 10.0.0.1.42103 > 10.0.0.2.5001: UDP, length 1470
00:08:29.096582 IP 10.0.0.1.42103 > 10.0.0.2.5001: UDP, length 1470
00:08:29.108632 IP 10.0.0.1.42103 > 10.0.0.2.5001: UDP, length 1470
00:08:29.120725 IP 10.0.0.1.42103 > 10.0.0.2.5001: UDP, length 1470
00:08:29.132829 IP 10.0.0.1.42103 > 10.0.0.2.5001: UDP, length 1470
00:08:29.144929 IP 10.0.0.1.42103 > 10.0.0.2.5001: UDP, length 1470
00:08:29.157023 IP 10.0.0.1.42103 > 10.0.0.2.5001: UDP, length 1470
00:08:29.169904 IP 10.0.0.1.42103 > 10.0.0.2.5001: UDP, length 1470
00:08:29.181211 IP 10.0.0.1.42103 > 10.0.0.2.5001: UDP, length 1470
00:08:29.193303 IP 10.0.0.1.42103 > 10.0.0.2.5001: UDP, length 1470
00:08:29.205403 IP 10.0.0.1.42103 > 10.0.0.2.5001: UDP, length 1470
00:08:29.217503 IP 10.0.0.1.42103 > 10.0.0.2.5001: UDP, length 1470
00:08:29.229623 IP 10.0.0.1.42103 > 10.0.0.2.5001: UDP, length 1470
00:08:29.241682 IP 10.0.0.1.42103 > 10.0.0.2.5001: UDP, length 1470
00:08:29.253787 IP 10.0.0.1.42103 > 10.0.0.2.5001: UDP, length 1470
00:08:29.265891 IP 10.0.0.1.42103 > 10.0.0.2.5001: UDP, length 1470
00:08:29.277972 IP 10.0.0.1.42103 > 10.0.0.2.5001: UDP, length 1470
00:08:29.290085 IP 10.0.0.1.42103 > 10.0.0.2.5001: UDP, length 1470
00:08:29.302192 IP 10.0.0.1.42103 > 10.0.0.2.5001: UDP, length 1470
00:08:29.314272 IP 10.0.0.1.42103 > 10.0.0.2.5001: UDP, length 1470
00:08:29.326370 IP 10.0.0.1.42103 > 10.0.0.2.5001: UDP, length 1470
00:08:29.338459 IP 10.0.0.1.42103 > 10.0.0.2.5001: UDP, length 1470
00:08:29.350550 IP 10.0.0.1.42103 > 10.0.0.2.5001: UDP, length 1470
00:08:29.362675 IP 10.0.0.1.42103 > 10.0.0.2.5001: UDP, length 1470
00:08:29.374735 IP 10.0.0.1.42103 > 10.0.0.2.5001: UDP, length 1470
00:08:29.386851 IP 10.0.0.1.42103 > 10.0.0.2.5001: UDP, length 1470
00:08:29.398939 IP 10.0.0.1.42103 > 10.0.0.2.5001: UDP, length 1470
00:08:29.411034 IP 10.0.0.1.42103 > 10.0.0.2.5001: UDP, length 1470
00:08:29.423159 IP 10.0.0.1.42103 > 10.0.0.2.5001: UDP, length 1470
00:08:29.435234 IP 10.0.0.1.42103 > 10.0.0.2.5001: UDP, length 1470
00:08:29.447326 IP 10.0.0.1.42103 > 10.0.0.2.5001: UDP, length 1470
00:08:29.459414 IP 10.0.0.1.42103 > 10.0.0.2.5001: UDP, length 1470
00:08:29.471504 IP 10.0.0.1.42103 > 10.0.0.2.5001: UDP, length 1470
00:08:29.483608 IP 10.0.0.1.42103 > 10.0.0.2.5001: UDP, length 1470
00:08:29.495716 IP 10.0.0.1.42103 > 10.0.0.2.5001: UDP, length 1470
00:08:29.507807 IP 10.0.0.1.42103 > 10.0.0.2.5001: UDP, length 1470
00:08:29.519903 IP 10.0.0.1.42103 > 10.0.0.2.5001: UDP, length 1470
00:08:29.531995 IP 10.0.0.1.42103 > 10.0.0.2.5001: UDP, length 1470
00:08:29.544116 IP 10.0.0.1.42103 > 10.0.0.2.5001: UDP, length 1470
00:08:29.556202 IP 10.0.0.1.42103 > 10.0.0.2.5001: UDP, length 1470
00:08:29.568284 IP 10.0.0.1.42103 > 10.0.0.2.5001: UDP, length 1470
00:08:29.580380 IP 10.0.0.1.42103 > 10.0.0.2.5001: UDP, length 1470
00:08:29.592475 IP 10.0.0.1.42103 > 10.0.0.2.5001: UDP, length 1470
00:08:29.604573 IP 10.0.0.1.42103 > 10.0.0.2.5001: UDP, length 1470
00:08:29.616679 IP 10.0.0.1.42103 > 10.0.0.2.5001: UDP, length 1470
00:08:29.628761 IP 10.0.0.1.42103 > 10.0.0.2.5001: UDP, length 1470
00:08:29.640860 IP 10.0.0.1.42103 > 10.0.0.2.5001: UDP, length 1470
00:08:29.652957 IP 10.0.0.1.42103 > 10.0.0.2.5001: UDP, length 1470
00:08:29.665052 IP 10.0.0.1.42103 > 10.0.0.2.5001: UDP, length 1470
00:08:29.677147 IP 10.0.0.1.42103 > 10.0.0.2.5001: UDP, length 1470
00:08:29.690049 IP 10.0.0.1.42103 > 10.0.0.2.5001: UDP, length 1470
00:08:29.701359 IP 10.0.0.1.42103 > 10.0.0.2.5001: UDP, length 1470
00:08:29.713442 IP 10.0.0.1.42103 > 10.0.0.2.5001: UDP, length 1470
00:08:29.725687 IP 10.0.0.1.42103 > 10.0.0.2.5001: UDP, length 1470
00:08:29.737640 IP 10.0.0.1.42103 > 10.0.0.2.5001: UDP, length 1470
00:08:29.749735 IP 10.0.0.1.42103 > 10.0.0.2.5001: UDP, length 1470
00:08:29.761823 IP 10.0.0.1.42103 > 10.0.0.2.5001: UDP, length 1470
00:08:29.773912 IP 10.0.0.1.42103 > 10.0.0.2.5001: UDP, length 1470
00:08:29.786005 IP 10.0.0.1.42103 > 10.0.0.2.5001: UDP, length 1470
00:08:29.798127 IP 10.0.0.1.42103 > 10.0.0.2.5001: UDP, length 1470
00:08:29.810213 IP 10.0.0.1.42103 > 10.0.0.2.5001: UDP, length 1470
00:08:29.822308 IP 10.0.0.1.42103 > 10.0.0.2.5001: UDP, length 1470
00:08:29.834392 IP 10.0.0.1.42103 > 10.0.0.2.5001: UDP, length 1470
00:08:29.846488 IP 10.0.0.1.42103 > 10.0.0.2.5001: UDP, length 1470
00:08:29.858585 IP 10.0.0.1.42103 > 10.0.0.2.5001: UDP, length 1470
00:08:29.870705 IP 10.0.0.1.42103 > 10.0.0.2.5001: UDP, length 1470
00:08:29.882764 IP 10.0.0.1.42103 > 10.0.0.2.5001: UDP, length 1470
00:08:29.895642 IP 10.0.0.1.42103 > 10.0.0.2.5001: UDP, length 1470
00:08:29.906958 IP 10.0.0.1.42103 > 10.0.0.2.5001: UDP, length 1470
00:08:29.919087 IP 10.0.0.1.42103 > 10.0.0.2.5001: UDP, length 1470
00:08:29.931186 IP 10.0.0.1.42103 > 10.0.0.2.5001: UDP, length 1470
00:08:29.943260 IP 10.0.0.1.42103 > 10.0.0.2.5001: UDP, length 1470
00:08:29.955359 IP 10.0.0.1.42103 > 10.0.0.2.5001: UDP, length 1470
00:08:29.967455 IP 10.0.0.1.42103 > 10.0.0.2.5001: UDP, length 1470
00:08:29.979548 IP 10.0.0.1.42103 > 10.0.0.2.5001: UDP, length 1470
00:08:29.991637 IP 10.0.0.1.42103 > 10.0.0.2.5001: UDP, length 1470
00:08:30.004486 IP 10.0.0.1.42103 > 10.0.0.2.5001: UDP, length 1470
00:08:30.015839 IP 10.0.0.1.42103 > 10.0.0.2.5001: UDP, length 1470
00:08:30.027953 IP 10.0.0.1.42103 > 10.0.0.2.5001: UDP, length 1470
00:08:30.040026 IP 10.0.0.1.42103 > 10.0.0.2.5001: UDP, length 1470
00:08:30.052131 IP 10.0.0.1.42103 > 10.0.0.2.5001: UDP, length 1470
00:08:30.064214 IP 10.0.0.1.42103 > 10.0.0.2.5001: UDP, length 1470
00:08:30.076305 IP 10.0.0.1.42103 > 10.0.0.2.5001: UDP, length 1470
00:08:30.088401 IP 10.0.0.1.42103 > 10.0.0.2.5001: UDP, length 1470
00:08:30.100500 IP 10.0.0.1.42103 > 10.0.0.2.5001: UDP, length 1470
00:08:30.112605 IP 10.0.0.1.42103 > 10.0.0.2.5001: UDP, length 1470
00:08:30.124710 IP 10.0.0.1.42103 > 10.0.0.2.5001: UDP, length 1470
00:08:30.136809 IP 10.0.0.1.42103 > 10.0.0.2.5001: UDP, length 1470
00:08:30.149739 IP 10.0.0.1.42103 > 10.0.0.2.5001: UDP, length 1470
00:08:30.160981 IP 10.0.0.1.42103 > 10.0.0.2.5001: UDP, length 1470
00:08:30.173084 IP 10.0.0.1.42103 > 10.0.0.2.5001: UDP, length 1470
00:08:30.185173 IP 10.0.0.1.42103 > 10.0.0.2.5001: UDP, length 1470
00:08:30.197264 IP 10.0.0.1.42103 > 10.0.0.2.5001: UDP, length 1470
00:08:30.209360 IP 10.0.0.1.42103 > 10.0.0.2.5001: UDP, length 1470
00:08:30.221485 IP 10.0.0.1.42103 > 10.0.0.2.5001: UDP, length 1470
00:08:30.233563 IP 10.0.0.1.42103 > 10.0.0.2.5001: UDP, length 1470
00:08:30.245651 IP 10.0.0.1.42103 > 10.0.0.2.5001: UDP, length 1470
00:08:30.257774 IP 10.0.0.1.42103 > 10.0.0.2.5001: UDP, length 1470
00:08:30.269854 IP 10.0.0.1.42103 > 10.0.0.2.5001: UDP, length 1470
00:08:30.281949 IP 10.0.0.1.42103 > 10.0.0.2.5001: UDP, length 1470
00:08:30.294040 IP 10.0.0.1.42103 > 10.0.0.2.5001: UDP, length 1470
00:08:30.306138 IP 10.0.0.1.42103 > 10.0.0.2.5001: UDP, length 1470
00:08:30.318477 IP 10.0.0.1.42103 > 10.0.0.2.5001: UDP, length 1470
00:08:30.330343 IP 10.0.0.1.42103 > 10.0.0.2.5001: UDP, length 1470
00:08:30.342436 IP 10.0.0.1.42103 > 10.0.0.2.5001: UDP, length 1470
00:08:30.354519 IP 10.0.0.1.42103 > 10.0.0.2.5001: UDP, length 1470
00:08:30.366618 IP 10.0.0.1.42103 > 10.0.0.2.5001: UDP, length 1470
00:08:30.378701 IP 10.0.0.1.42103 > 10.0.0.2.5001: UDP, length 1470
00:08:30.390823 IP 10.0.0.1.42103 > 10.0.0.2.5001: UDP, length 1470
00:08:30.402897 IP 10.0.0.1.42103 > 10.0.0.2.5001: UDP, length 1470
00:08:30.415004 IP 10.0.0.1.42103 > 10.0.0.2.5001: UDP, length 1470
00:08:30.427088 IP 10.0.0.1.42103 > 10.0.0.2.5001: UDP, length 1470
00:08:30.439194 IP 10.0.0.1.42103 > 10.0.0.2.5001: UDP, length 1470
00:08:30.451308 IP 10.0.0.1.42103 > 10.0.0.2.5001: UDP, length 1470
00:08:30.463392 IP 10.0.0.1.42103 > 10.0.0.2.5001: UDP, length 1470
00:08:30.475480 IP 10.0.0.1.42103 > 10.0.0.2.5001: UDP, length 1470
00:08:30.487579 IP 10.0.0.1.42103 > 10.0.0.2.5001: UDP, length 1470
00:08:30.499679 IP 10.0.0.1.42103 > 10.0.0.2.5001: UDP, length 1470
00:08:30.511776 IP 10.0.0.1.42103 > 10.0.0.2.5001: UDP, length 1470
00:08:30.523863 IP 10.0.0.1.42103 > 10.0.0.2.5001: UDP, length 1470
00:08:30.535963 IP 10.0.0.1.42103 > 10.0.0.2.5001: UDP, length 1470
00:08:30.548061 IP 10.0.0.1.42103 > 10.0.0.2.5001: UDP, length 1470
00:08:30.560251 IP 10.0.0.1.42103 > 10.0.0.2.5001: UDP, length 1470
00:08:30.572634 IP 10.0.0.1.42103 > 10.0.0.2.5001: UDP, length 1470
00:08:30.584364 IP 10.0.0.1.42103 > 10.0.0.2.5001: UDP, length 1470
00:08:30.596447 IP 10.0.0.1.42103 > 10.0.0.2.5001: UDP, length 1470
00:08:30.609397 IP 10.0.0.1.42103 > 10.0.0.2.5001: UDP, length 1470
00:08:30.620640 IP 10.0.0.1.42103 > 10.0.0.2.5001: UDP, length 1470
00:08:30.633415 IP 10.0.0.1.42103 > 10.0.0.2.5001: UDP, length 1470
00:08:30.644849 IP 10.0.0.1.42103 > 10.0.0.2.5001: UDP, length 1470
00:08:30.656908 IP 10.0.0.1.42103 > 10.0.0.2.5001: UDP, length 1470
00:08:30.669797 IP 10.0.0.1.42103 > 10.0.0.2.5001: UDP, length 1470
00:08:30.681118 IP 10.0.0.1.42103 > 10.0.0.2.5001: UDP, length 1470
00:08:30.693211 IP 10.0.0.1.42103 > 10.0.0.2.5001: UDP, length 1470
00:08:30.705311 IP 10.0.0.1.42103 > 10.0.0.2.5001: UDP, length 1470
00:08:30.717405 IP 10.0.0.1.42103 > 10.0.0.2.5001: UDP, length 1470
00:08:30.729503 IP 10.0.0.1.42103 > 10.0.0.2.5001: UDP, length 1470
00:08:30.741595 IP 10.0.0.1.42103 > 10.0.0.2.5001: UDP, length 1470
00:08:30.753680 IP 10.0.0.1.42103 > 10.0.0.2.5001: UDP, length 1470
00:08:30.765775 IP 10.0.0.1.42103 > 10.0.0.2.5001: UDP, length 1470
00:08:30.777871 IP 10.0.0.1.42103 > 10.0.0.2.5001: UDP, length 1470
00:08:30.790006 IP 10.0.0.1.42103 > 10.0.0.2.5001: UDP, length 1470
00:08:30.802082 IP 10.0.0.1.42103 > 10.0.0.2.5001: UDP, length 1470
00:08:30.814173 IP 10.0.0.1.42103 > 10.0.0.2.5001: UDP, length 1470
00:08:30.826288 IP 10.0.0.1.42103 > 10.0.0.2.5001: UDP, length 1470
00:08:30.838361 IP 10.0.0.1.42103 > 10.0.0.2.5001: UDP, length 1470
00:08:30.850456 IP 10.0.0.1.42103 > 10.0.0.2.5001: UDP, length 1470
00:08:30.862560 IP 10.0.0.1.42103 > 10.0.0.2.5001: UDP, length 1470
00:08:30.874652 IP 10.0.0.1.42103 > 10.0.0.2.5001: UDP, length 1470
00:08:30.886742 IP 10.0.0.1.42103 > 10.0.0.2.5001: UDP, length 1470
00:08:30.898843 IP 10.0.0.1.42103 > 10.0.0.2.5001: UDP, length 1470
00:08:30.910958 IP 10.0.0.1.42103 > 10.0.0.2.5001: UDP, length 1470
00:08:30.923754 IP 10.0.0.1.42103 > 10.0.0.2.5001: UDP, length 1470
00:08:30.935132 IP 10.0.0.1.42103 > 10.0.0.2.5001: UDP, length 1470
00:08:30.947231 IP 10.0.0.1.42103 > 10.0.0.2.5001: UDP, length 1470
00:08:30.959328 IP 10.0.0.1.42103 > 10.0.0.2.5001: UDP, length 1470
00:08:30.971432 IP 10.0.0.1.42103 > 10.0.0.2.5001: UDP, length 1470
00:08:30.984231 IP 10.0.0.1.42103 > 10.0.0.2.5001: UDP, length 1470
00:08:30.995603 IP 10.0.0.1.42103 > 10.0.0.2.5001: UDP, length 1470
00:08:31.007911 IP 10.0.0.1.42103 > 10.0.0.2.5001: UDP, length 1470
00:08:31.019808 IP 10.0.0.1.42103 > 10.0.0.2.5001: UDP, length 1470
00:08:31.032719 IP 10.0.0.1.42103 > 10.0.0.2.5001: UDP, length 1470
00:08:31.044019 IP 10.0.0.1.42103 > 10.0.0.2.5001: UDP, length 1470
00:08:31.056092 IP 10.0.0.1.42103 > 10.0.0.2.5001: UDP, length 1470
00:08:31.068186 IP 10.0.0.1.42103 > 10.0.0.2.5001: UDP, length 1470
00:08:31.080284 IP 10.0.0.1.42103 > 10.0.0.2.5001: UDP, length 1470
00:08:31.092382 IP 10.0.0.1.42103 > 10.0.0.2.5001: UDP, length 1470
00:08:31.104503 IP 10.0.0.1.42103 > 10.0.0.2.5001: UDP, length 1470
00:08:31.116574 IP 10.0.0.1.42103 > 10.0.0.2.5001: UDP, length 1470
00:08:31.128670 IP 10.0.0.1.42103 > 10.0.0.2.5001: UDP, length 1470
00:08:31.141480 IP 10.0.0.1.42103 > 10.0.0.2.5001: UDP, length 1470
00:08:31.152860 IP 10.0.0.1.42103 > 10.0.0.2.5001: UDP, length 1470
00:08:31.164984 IP 10.0.0.1.42103 > 10.0.0.2.5001: UDP, length 1470
00:08:31.177070 IP 10.0.0.1.42103 > 10.0.0.2.5001: UDP, length 1470
00:08:31.189148 IP 10.0.0.1.42103 > 10.0.0.2.5001: UDP, length 1470
00:08:31.201274 IP 10.0.0.1.42103 > 10.0.0.2.5001: UDP, length 1470
00:08:31.213338 IP 10.0.0.1.42103 > 10.0.0.2.5001: UDP, length 1470
00:08:31.225434 IP 10.0.0.1.42103 > 10.0.0.2.5001: UDP, length 1470
00:08:31.237526 IP 10.0.0.1.42103 > 10.0.0.2.5001: UDP, length 1470
00:08:31.249629 IP 10.0.0.1.42103 > 10.0.0.2.5001: UDP, length 1470
00:08:31.261723 IP 10.0.0.1.42103 > 10.0.0.2.5001: UDP, length 1470
00:08:31.273819 IP 10.0.0.1.42103 > 10.0.0.2.5001: UDP, length 1470
00:08:31.286676 IP 10.0.0.1.42103 > 10.0.0.2.5001: UDP, length 1470
00:08:31.298011 IP 10.0.0.1.42103 > 10.0.0.2.5001: UDP, length 1470
00:08:31.310111 IP 10.0.0.1.42103 > 10.0.0.2.5001: UDP, length 1470
00:08:31.322195 IP 10.0.0.1.42103 > 10.0.0.2.5001: UDP, length 1470
00:08:31.334300 IP 10.0.0.1.42103 > 10.0.0.2.5001: UDP, length 1470
00:08:31.346392 IP 10.0.0.1.42103 > 10.0.0.2.5001: UDP, length 1470
00:08:31.358506 IP 10.0.0.1.42103 > 10.0.0.2.5001: UDP, length 1470
00:08:31.370579 IP 10.0.0.1.42103 > 10.0.0.2.5001: UDP, length 1470
00:08:31.382692 IP 10.0.0.1.42103 > 10.0.0.2.5001: UDP, length 1470
00:08:31.394784 IP 10.0.0.1.42103 > 10.0.0.2.5001: UDP, length 1470
00:08:31.406875 IP 10.0.0.1.42103 > 10.0.0.2.5001: UDP, length 1470
00:08:31.418965 IP 10.0.0.1.42103 > 10.0.0.2.5001: UDP, length 1470
00:08:31.431060 IP 10.0.0.1.42103 > 10.0.0.2.5001: UDP, length 1470
00:08:31.443159 IP 10.0.0.1.42103 > 10.0.0.2.5001: UDP, length 1470
00:08:31.455259 IP 10.0.0.1.42103 > 10.0.0.2.5001: UDP, length 1470
00:08:31.468150 IP 10.0.0.1.42103 > 10.0.0.2.5001: UDP, length 1470
00:08:31.479449 IP 10.0.0.1.42103 > 10.0.0.2.5001: UDP, length 1470
00:08:31.491560 IP 10.0.0.1.42103 > 10.0.0.2.5001: UDP, length 1470
00:08:31.503644 IP 10.0.0.1.42103 > 10.0.0.2.5001: UDP, length 1470
00:08:31.516468 IP 10.0.0.1.42103 > 10.0.0.2.5001: UDP, length 1470
00:08:31.527837 IP 10.0.0.1.42103 > 10.0.0.2.5001: UDP, length 1470
00:08:31.539914 IP 10.0.0.1.42103 > 10.0.0.2.5001: UDP, length 1470
00:08:31.552037 IP 10.0.0.1.42103 > 10.0.0.2.5001: UDP, length 1470
00:08:31.564130 IP 10.0.0.1.42103 > 10.0.0.2.5001: UDP, length 1470
00:08:31.576337 IP 10.0.0.1.42103 > 10.0.0.2.5001: UDP, length 1470
00:08:31.588315 IP 10.0.0.1.42103 > 10.0.0.2.5001: UDP, length 1470
00:08:31.600420 IP 10.0.0.1.42103 > 10.0.0.2.5001: UDP, length 1470
00:08:31.612536 IP 10.0.0.1.42103 > 10.0.0.2.5001: UDP, length 1470
00:08:31.624608 IP 10.0.0.1.42103 > 10.0.0.2.5001: UDP, length 1470
00:08:31.636711 IP 10.0.0.1.42103 > 10.0.0.2.5001: UDP, length 1470
00:08:31.648795 IP 10.0.0.1.42103 > 10.0.0.2.5001: UDP, length 1470
00:08:31.660890 IP 10.0.0.1.42103 > 10.0.0.2.5001: UDP, length 1470
00:08:31.672983 IP 10.0.0.1.42103 > 10.0.0.2.5001: UDP, length 1470

