00:08:57.171958 IP 10.0.0.1.37380 > 10.0.0.2.5001: UDP, length 1470
00:08:57.171959 IP 10.0.0.1.37380 > 10.0.0.2.5001: UDP, length 1470
00:08:57.188054 IP 10.0.0.1.37380 > 10.0.0.2.5001: UDP, length 1470
00:08:57.199754 IP 10.0.0.1.37380 > 10.0.0.2.5001: UDP, length 1470
00:08:57.207644 IP 10.0.0.1.37380 > 10.0.0.2.5001: UDP, length 1470
00:08:57.219659 IP 10.0.0.1.37380 > 10.0.0.2.5001: UDP, length 1470
00:08:57.232495 IP 10.0.0.1.37380 > 10.0.0.2.5001: UDP, length 1470
00:08:57.243886 IP 10.0.0.1.37380 > 10.0.0.2.5001: UDP, length 1470
00:08:57.255964 IP 10.0.0.1.37380 > 10.0.0.2.5001: UDP, length 1470
00:08:57.268059 IP 10.0.0.1.37380 > 10.0.0.2.5001: UDP, length 1470
00:08:57.280179 IP 10.0.0.1.37380 > 10.0.0.2.5001: UDP, length 1470
00:08:57.292254 IP 10.0.0.1.37380 > 10.0.0.2.5001: UDP, length 1470
00:08:57.304348 IP 10.0.0.1.37380 > 10.0.0.2.5001: UDP, length 1470
00:08:57.317340 IP 10.0.0.1.37380 > 10.0.0.2.5001: UDP, length 1470
00:08:57.328548 IP 10.0.0.1.37380 > 10.0.0.2.5001: UDP, length 1470
00:08:57.340646 IP 10.0.0.1.37380 > 10.0.0.2.5001: UDP, length 1470
00:08:57.352779 IP 10.0.0.1.37380 > 10.0.0.2.5001: UDP, length 1470
00:08:57.364828 IP 10.0.0.1.37380 > 10.0.0.2.5001: UDP, length 1470
00:08:57.376937 IP 10.0.0.1.37380 > 10.0.0.2.5001: UDP, length 1470
00:08:57.389001 IP 10.0.0.1.37380 > 10.0.0.2.5001: UDP, length 1470
00:08:57.401151 IP 10.0.0.1.37380 > 10.0.0.2.5001: UDP, length 1470
00:08:57.413225 IP 10.0.0.1.37380 > 10.0.0.2.5001: UDP, length 1470
00:08:57.425303 IP 10.0.0.1.37380 > 10.0.0.2.5001: UDP, length 1470
00:08:57.437407 IP 10.0.0.1.37380 > 10.0.0.2.5001: UDP, length 1470
00:08:57.449500 IP 10.0.0.1.37380 > 10.0.0.2.5001: UDP, length 1470
00:08:57.461597 IP 10.0.0.1.37380 > 10.0.0.2.5001: UDP, length 1470
00:08:57.473692 IP 10.0.0.1.37380 > 10.0.0.2.5001: UDP, length 1470
00:08:57.485788 IP 10.0.0.1.37380 > 10.0.0.2.5001: UDP, length 1470
00:08:57.497878 IP 10.0.0.1.37380 > 10.0.0.2.5001: UDP, length 1470
00:08:57.509981 IP 10.0.0.1.37380 > 10.0.0.2.5001: UDP, length 1470
00:08:57.522818 IP 10.0.0.1.37380 > 10.0.0.2.5001: UDP, length 1470
00:08:57.534166 IP 10.0.0.1.37380 > 10.0.0.2.5001: UDP, length 1470
00:08:57.546272 IP 10.0.0.1.37380 > 10.0.0.2.5001: UDP, length 1470
00:08:57.558351 IP 10.0.0.1.37380 > 10.0.0.2.5001: UDP, length 1470
00:08:57.570452 IP 10.0.0.1.37380 > 10.0.0.2.5001: UDP, length 1470
00:08:57.582557 IP 10.0.0.1.37380 > 10.0.0.2.5001: UDP, length 1470
00:08:57.594659 IP 10.0.0.1.37380 > 10.0.0.2.5001: UDP, length 1470
00:08:57.606749 IP 10.0.0.1.37380 > 10.0.0.2.5001: UDP, length 1470
00:08:57.618856 IP 10.0.0.1.37380 > 10.0.0.2.5001: UDP, length 1470
00:08:57.631677 IP 10.0.0.1.37380 > 10.0.0.2.5001: UDP, length 1470
00:08:57.643034 IP 10.0.0.1.37380 > 10.0.0.2.5001: UDP, length 1470
00:08:57.655132 IP 10.0.0.1.37380 > 10.0.0.2.5001: UDP, length 1470
00:08:57.667871 IP 10.0.0.1.37380 > 10.0.0.2.5001: UDP, length 1470
00:08:57.679351 IP 10.0.0.1.37380 > 10.0.0.2.5001: UDP, length 1470
00:08:57.691423 IP 10.0.0.1.37380 > 10.0.0.2.5001: UDP, length 1470
00:08:57.712523 IP 10.0.0.1.37380 > 10.0.0.2.5001: UDP, length 1470
00:08:57.724617 IP 10.0.0.1.37380 > 10.0.0.2.5001: UDP, length 1470
00:08:57.736691 IP 10.0.0.1.37380 > 10.0.0.2.5001: UDP, length 1470
00:08:57.749603 IP 10.0.0.1.37380 > 10.0.0.2.5001: UDP, length 1470
00:08:57.760899 IP 10.0.0.1.37380 > 10.0.0.2.5001: UDP, length 1470
00:08:57.773008 IP 10.0.0.1.37380 > 10.0.0.2.5001: UDP, length 1470
00:08:57.785101 IP 10.0.0.1.37380 > 10.0.0.2.5001: UDP, length 1470
00:08:57.797191 IP 10.0.0.1.37380 > 10.0.0.2.5001: UDP, length 1470
00:08:57.809281 IP 10.0.0.1.37380 > 10.0.0.2.5001: UDP, length 1470
00:08:57.821379 IP 10.0.0.1.37380 > 10.0.0.2.5001: UDP, length 1470
00:08:57.834170 IP 10.0.0.1.37380 > 10.0.0.2.5001: UDP, length 1470
00:08:57.845621 IP 10.0.0.1.37380 > 10.0.0.2.5001: UDP, length 1470
00:08:57.857671 IP 10.0.0.1.37380 > 10.0.0.2.5001: UDP, length 1470
00:08:57.869803 IP 10.0.0.1.37380 > 10.0.0.2.5001: UDP, length 1470
00:08:57.881865 IP 10.0.0.1.37380 > 10.0.0.2.5001: UDP, length 1470
00:08:57.893929 IP 10.0.0.1.37380 > 10.0.0.2.5001: UDP, length 1470
00:08:57.906069 IP 10.0.0.1.37380 > 10.0.0.2.5001: UDP, length 1470
00:08:57.918128 IP 10.0.0.1.37380 > 10.0.0.2.5001: UDP, length 1470
00:08:57.930208 IP 10.0.0.1.37380 > 10.0.0.2.5001: UDP, length 1470
00:08:57.942332 IP 10.0.0.1.37380 > 10.0.0.2.5001: UDP, length 1470
00:08:57.954424 IP 10.0.0.1.37380 > 10.0.0.2.5001: UDP, length 1470
00:08:57.966551 IP 10.0.0.1.37380 > 10.0.0.2.5001: UDP, length 1470
00:08:57.978640 IP 10.0.0.1.37380 > 10.0.0.2.5001: UDP, length 1470
00:08:57.990713 IP 10.0.0.1.37380 > 10.0.0.2.5001: UDP, length 1470
00:08:58.002836 IP 10.0.0.1.37380 > 10.0.0.2.5001: UDP, length 1470
00:08:58.014907 IP 10.0.0.1.37380 > 10.0.0.2.5001: UDP, length 1470
00:08:58.026981 IP 10.0.0.1.37380 > 10.0.0.2.5001: UDP, length 1470
00:08:58.039143 IP 10.0.0.1.37380 > 10.0.0.2.5001: UDP, length 1470
00:08:58.051208 IP 10.0.0.1.37380 > 10.0.0.2.5001: UDP, length 1470
00:08:58.063300 IP 10.0.0.1.37380 > 10.0.0.2.5001: UDP, length 1470
00:08:58.075361 IP 10.0.0.1.37380 > 10.0.0.2.5001: UDP, length 1470
00:08:58.087500 IP 10.0.0.1.37380 > 10.0.0.2.5001: UDP, length 1470
00:08:58.099592 IP 10.0.0.1.37380 > 10.0.0.2.5001: UDP, length 1470
00:08:58.111742 IP 10.0.0.1.37380 > 10.0.0.2.5001: UDP, length 1470
00:08:58.123793 IP 10.0.0.1.37380 > 10.0.0.2.5001: UDP, length 1470
00:08:58.135846 IP 10.0.0.1.37380 > 10.0.0.2.5001: UDP, length 1470
00:08:58.147974 IP 10.0.0.1.37380 > 10.0.0.2.5001: UDP, length 1470
00:08:58.160098 IP 10.0.0.1.37380 > 10.0.0.2.5001: UDP, length 1470
00:08:58.172185 IP 10.0.0.1.37380 > 10.0.0.2.5001: UDP, length 1470
00:08:58.184246 IP 10.0.0.1.37380 > 10.0.0.2.5001: UDP, length 1470
00:08:58.197282 IP 10.0.0.1.37380 > 10.0.0.2.5001: UDP, length 1470
00:08:58.208459 IP 10.0.0.1.37380 > 10.0.0.2.5001: UDP, length 1470
00:08:58.220602 IP 10.0.0.1.37380 > 10.0.0.2.5001: UDP, length 1470
00:08:58.232819 IP 10.0.0.1.37380 > 10.0.0.2.5001: UDP, length 1470
00:08:58.244760 IP 10.0.0.1.37380 > 10.0.0.2.5001: UDP, length 1470
00:08:58.257627 IP 10.0.0.1.37380 > 10.0.0.2.5001: UDP, length 1470
00:08:58.268947 IP 10.0.0.1.37380 > 10.0.0.2.5001: UDP, length 1470
00:08:58.281027 IP 10.0.0.1.37380 > 10.0.0.2.5001: UDP, length 1470
00:08:58.293090 IP 10.0.0.1.37380 > 10.0.0.2.5001: UDP, length 1470
00:08:58.305256 IP 10.0.0.1.37380 > 10.0.0.2.5001: UDP, length 1470
00:08:58.317313 IP 10.0.0.1.37380 > 10.0.0.2.5001: UDP, length 1470
00:08:58.329866 IP 10.0.0.1.37380 > 10.0.0.2.5001: UDP, length 1470
00:08:58.341515 IP 10.0.0.1.37380 > 10.0.0.2.5001: UDP, length 1470
00:08:58.353569 IP 10.0.0.1.37380 > 10.0.0.2.5001: UDP, length 1470
00:08:58.365746 IP 10.0.0.1.37380 > 10.0.0.2.5001: UDP, length 1470
00:08:58.377827 IP 10.0.0.1.37380 > 10.0.0.2.5001: UDP, length 1470
00:08:58.389893 IP 10.0.0.1.37380 > 10.0.0.2.5001: UDP, length 1470
00:08:58.401998 IP 10.0.0.1.37380 > 10.0.0.2.5001: UDP, length 1470
00:08:58.414102 IP 10.0.0.1.37380 > 10.0.0.2.5001: UDP, length 1470
00:08:58.426165 IP 10.0.0.1.37380 > 10.0.0.2.5001: UDP, length 1470
00:08:58.438261 IP 10.0.0.1.37380 > 10.0.0.2.5001: UDP, length 1470
00:08:58.451105 IP 10.0.0.1.37380 > 10.0.0.2.5001: UDP, length 1470
00:08:58.462497 IP 10.0.0.1.37380 > 10.0.0.2.5001: UDP, length 1470
00:08:58.474557 IP 10.0.0.1.37380 > 10.0.0.2.5001: UDP, length 1470
00:08:58.486691 IP 10.0.0.1.37380 > 10.0.0.2.5001: UDP, length 1470
00:08:58.498755 IP 10.0.0.1.37380 > 10.0.0.2.5001: UDP, length 1470
00:08:58.510869 IP 10.0.0.1.37380 > 10.0.0.2.5001: UDP, length 1470
00:08:58.522955 IP 10.0.0.1.37380 > 10.0.0.2.5001: UDP, length 1470
00:08:58.535037 IP 10.0.0.1.37380 > 10.0.0.2.5001: UDP, length 1470
00:08:58.547121 IP 10.0.0.1.37380 > 10.0.0.2.5001: UDP, length 1470
00:08:58.560003 IP 10.0.0.1.37380 > 10.0.0.2.5001: UDP, length 1470
00:08:58.571351 IP 10.0.0.1.37380 > 10.0.0.2.5001: UDP, length 1470
00:08:58.584169 IP 10.0.0.1.37380 > 10.0.0.2.5001: UDP, length 1470
00:08:58.595534 IP 10.0.0.1.37380 > 10.0.0.2.5001: UDP, length 1470
00:08:58.607618 IP 10.0.0.1.37380 > 10.0.0.2.5001: UDP, length 1470
00:08:58.619926 IP 10.0.0.1.37380 > 10.0.0.2.5001: UDP, length 1470
00:08:58.631783 IP 10.0.0.1.37380 > 10.0.0.2.5001: UDP, length 1470
00:08:58.644710 IP 10.0.0.1.37380 > 10.0.0.2.5001: UDP, length 1470
00:08:58.656015 IP 10.0.0.1.37380 > 10.0.0.2.5001: UDP, length 1470
00:08:58.668069 IP 10.0.0.1.37380 > 10.0.0.2.5001: UDP, length 1470
00:08:58.680978 IP 10.0.0.1.37380 > 10.0.0.2.5001: UDP, length 1470
00:08:58.692298 IP 10.0.0.1.37380 > 10.0.0.2.5001: UDP, length 1470
00:08:58.705145 IP 10.0.0.1.37380 > 10.0.0.2.5001: UDP, length 1470
00:08:58.716497 IP 10.0.0.1.37380 > 10.0.0.2.5001: UDP, length 1470
00:08:58.728571 IP 10.0.0.1.37380 > 10.0.0.2.5001: UDP, length 1470
00:08:58.740697 IP 10.0.0.1.37380 > 10.0.0.2.5001: UDP, length 1470
00:08:58.752806 IP 10.0.0.1.37380 > 10.0.0.2.5001: UDP, length 1470
00:08:58.764867 IP 10.0.0.1.37380 > 10.0.0.2.5001: UDP, length 1470
00:08:58.776989 IP 10.0.0.1.37380 > 10.0.0.2.5001: UDP, length 1470
00:08:58.789042 IP 10.0.0.1.37380 > 10.0.0.2.5001: UDP, length 1470
00:08:58.813214 IP 10.0.0.1.37380 > 10.0.0.2.5001: UDP, length 1470
00:08:58.826071 IP 10.0.0.1.37380 > 10.0.0.2.5001: UDP, length 1470
00:08:58.837442 IP 10.0.0.1.37380 > 10.0.0.2.5001: UDP, length 1470
00:08:58.849536 IP 10.0.0.1.37380 > 10.0.0.2.5001: UDP, length 1470
00:08:58.861654 IP 10.0.0.1.37380 > 10.0.0.2.5001: UDP, length 1470
00:08:58.873738 IP 10.0.0.1.37380 > 10.0.0.2.5001: UDP, length 1470
00:08:58.898670 IP 10.0.0.1.37380 > 10.0.0.2.5001: UDP, length 1470
00:08:58.909996 IP 10.0.0.1.37380 > 10.0.0.2.5001: UDP, length 1470
00:08:58.922069 IP 10.0.0.1.37380 > 10.0.0.2.5001: UDP, length 1470
00:08:58.934213 IP 10.0.0.1.37380 > 10.0.0.2.5001: UDP, length 1470
00:08:58.946297 IP 10.0.0.1.37380 > 10.0.0.2.5001: UDP, length 1470
00:08:58.958373 IP 10.0.0.1.37380 > 10.0.0.2.5001: UDP, length 1470
00:08:58.970523 IP 10.0.0.1.37380 > 10.0.0.2.5001: UDP, length 1470
00:08:58.982581 IP 10.0.0.1.37380 > 10.0.0.2.5001: UDP, length 1470
00:08:58.994686 IP 10.0.0.1.37380 > 10.0.0.2.5001: UDP, length 1470
00:08:59.006784 IP 10.0.0.1.37380 > 10.0.0.2.5001: UDP, length 1470
00:08:59.018919 IP 10.0.0.1.37380 > 10.0.0.2.5001: UDP, length 1470
00:08:59.030978 IP 10.0.0.1.37380 > 10.0.0.2.5001: UDP, length 1470
00:08:59.043066 IP 10.0.0.1.37380 > 10.0.0.2.5001: UDP, length 1470
00:08:59.055155 IP 10.0.0.1.37380 > 10.0.0.2.5001: UDP, length 1470
00:08:59.067266 IP 10.0.0.1.37380 > 10.0.0.2.5001: UDP, length 1470
00:08:59.079338 IP 10.0.0.1.37380 > 10.0.0.2.5001: UDP, length 1470
00:08:59.092278 IP 10.0.0.1.37380 > 10.0.0.2.5001: UDP, length 1470
00:08:59.103557 IP 10.0.0.1.37380 > 10.0.0.2.5001: UDP, length 1470
00:08:59.115627 IP 10.0.0.1.37380 > 10.0.0.2.5001: UDP, length 1470
00:08:59.128710 IP 10.0.0.1.37380 > 10.0.0.2.5001: UDP, length 1470
00:08:59.139846 IP 10.0.0.1.37380 > 10.0.0.2.5001: UDP, length 1470
00:08:59.151972 IP 10.0.0.1.37380 > 10.0.0.2.5001: UDP, length 1470
00:08:59.164022 IP 10.0.0.1.37380 > 10.0.0.2.5001: UDP, length 1470
00:08:59.176092 IP 10.0.0.1.37380 > 10.0.0.2.5001: UDP, length 1470
00:08:59.189028 IP 10.0.0.1.37380 > 10.0.0.2.5001: UDP, length 1470
00:08:59.200274 IP 10.0.0.1.37380 > 10.0.0.2.5001: UDP, length 1470
00:08:59.212423 IP 10.0.0.1.37380 > 10.0.0.2.5001: UDP, length 1470
00:08:59.224518 IP 10.0.0.1.37380 > 10.0.0.2.5001: UDP, length 1470
00:08:59.236579 IP 10.0.0.1.37380 > 10.0.0.2.5001: UDP, length 1470
00:08:59.248942 IP 10.0.0.1.37380 > 10.0.0.2.5001: UDP, length 1470
00:08:59.261579 IP 10.0.0.1.37380 > 10.0.0.2.5001: UDP, length 1470
00:08:59.272902 IP 10.0.0.1.37380 > 10.0.0.2.5001: UDP, length 1470
00:08:59.284997 IP 10.0.0.1.37380 > 10.0.0.2.5001: UDP, length 1470
00:08:59.297084 IP 10.0.0.1.37380 > 10.0.0.2.5001: UDP, length 1470
00:08:59.309217 IP 10.0.0.1.37380 > 10.0.0.2.5001: UDP, length 1470
00:08:59.321287 IP 10.0.0.1.37380 > 10.0.0.2.5001: UDP, length 1470
00:08:59.333383 IP 10.0.0.1.37380 > 10.0.0.2.5001: UDP, length 1470
00:08:59.345503 IP 10.0.0.1.37380 > 10.0.0.2.5001: UDP, length 1470
00:08:59.358238 IP 10.0.0.1.37380 > 10.0.0.2.5001: UDP, length 1470
00:08:59.369683 IP 10.0.0.1.37380 > 10.0.0.2.5001: UDP, length 1470
00:08:59.381777 IP 10.0.0.1.37380 > 10.0.0.2.5001: UDP, length 1470
00:08:59.393859 IP 10.0.0.1.37380 > 10.0.0.2.5001: UDP, length 1470
00:08:59.405956 IP 10.0.0.1.37380 > 10.0.0.2.5001: UDP, length 1470
00:08:59.418025 IP 10.0.0.1.37380 > 10.0.0.2.5001: UDP, length 1470
00:08:59.430151 IP 10.0.0.1.37380 > 10.0.0.2.5001: UDP, length 1470
00:08:59.442266 IP 10.0.0.1.37380 > 10.0.0.2.5001: UDP, length 1470
00:08:59.454369 IP 10.0.0.1.37380 > 10.0.0.2.5001: UDP, length 1470
00:08:59.466439 IP 10.0.0.1.37380 > 10.0.0.2.5001: UDP, length 1470
00:08:59.478545 IP 10.0.0.1.37380 > 10.0.0.2.5001: UDP, length 1470
00:08:59.490632 IP 10.0.0.1.37380 > 10.0.0.2.5001: UDP, length 1470
00:08:59.502702 IP 10.0.0.1.37380 > 10.0.0.2.5001: UDP, length 1470
00:08:59.515688 IP 10.0.0.1.37380 > 10.0.0.2.5001: UDP, length 1470
00:08:59.526916 IP 10.0.0.1.37380 > 10.0.0.2.5001: UDP, length 1470
00:08:59.539011 IP 10.0.0.1.37380 > 10.0.0.2.5001: UDP, length 1470
00:08:59.551708 IP 10.0.0.1.37380 > 10.0.0.2.5001: UDP, length 1470
00:08:59.563169 IP 10.0.0.1.37380 > 10.0.0.2.5001: UDP, length 1470
00:08:59.575284 IP 10.0.0.1.37380 > 10.0.0.2.5001: UDP, length 1470
00:08:59.587401 IP 10.0.0.1.37380 > 10.0.0.2.5001: UDP, length 1470
00:08:59.600266 IP 10.0.0.1.37380 > 10.0.0.2.5001: UDP, length 1470
00:08:59.611594 IP 10.0.0.1.37380 > 10.0.0.2.5001: UDP, length 1470
00:08:59.623658 IP 10.0.0.1.37380 > 10.0.0.2.5001: UDP, length 1470
00:08:59.635805 IP 10.0.0.1.37380 > 10.0.0.2.5001: UDP, length 1470
00:08:59.647864 IP 10.0.0.1.37380 > 10.0.0.2.5001: UDP, length 1470
00:08:59.659995 IP 10.0.0.1.37380 > 10.0.0.2.5001: UDP, length 1470
00:08:59.672847 IP 10.0.0.1.37380 > 10.0.0.2.5001: UDP, length 1470
00:08:59.684189 IP 10.0.0.1.37380 > 10.0.0.2.5001: UDP, length 1470
00:08:59.696252 IP 10.0.0.1.37380 > 10.0.0.2.5001: UDP, length 1470
00:08:59.708388 IP 10.0.0.1.37380 > 10.0.0.2.5001: UDP, length 1470
00:08:59.720476 IP 10.0.0.1.37380 > 10.0.0.2.5001: UDP, length 1470
00:08:59.732552 IP 10.0.0.1.37380 > 10.0.0.2.5001: UDP, length 1470
00:08:59.744704 IP 10.0.0.1.37380 > 10.0.0.2.5001: UDP, length 1470
00:08:59.756716 IP 10.0.0.1.37380 > 10.0.0.2.5001: UDP, length 1470
00:08:59.768859 IP 10.0.0.1.37380 > 10.0.0.2.5001: UDP, length 1470
00:08:59.793004 IP 10.0.0.1.37380 > 10.0.0.2.5001: UDP, length 1470
00:08:59.805131 IP 10.0.0.1.37380 > 10.0.0.2.5001: UDP, length 1470
00:08:59.817230 IP 10.0.0.1.37380 > 10.0.0.2.5001: UDP, length 1470
00:08:59.829310 IP 10.0.0.1.37380 > 10.0.0.2.5001: UDP, length 1470
00:08:59.841402 IP 10.0.0.1.37380 > 10.0.0.2.5001: UDP, length 1470
00:08:59.853517 IP 10.0.0.1.37380 > 10.0.0.2.5001: UDP, length 1470
00:08:59.865585 IP 10.0.0.1.37380 > 10.0.0.2.5001: UDP, length 1470
00:08:59.877737 IP 10.0.0.1.37380 > 10.0.0.2.5001: UDP, length 1470
00:08:59.889780 IP 10.0.0.1.37380 > 10.0.0.2.5001: UDP, length 1470
00:08:59.901844 IP 10.0.0.1.37380 > 10.0.0.2.5001: UDP, length 1470
00:08:59.913988 IP 10.0.0.1.37380 > 10.0.0.2.5001: UDP, length 1470
00:08:59.926084 IP 10.0.0.1.37380 > 10.0.0.2.5001: UDP, length 1470
00:08:59.938181 IP 10.0.0.1.37380 > 10.0.0.2.5001: UDP, length 1470
00:08:59.950238 IP 10.0.0.1.37380 > 10.0.0.2.5001: UDP, length 1470
00:08:59.962523 IP 10.0.0.1.37380 > 10.0.0.2.5001: UDP, length 1470
00:08:59.974450 IP 10.0.0.1.37380 > 10.0.0.2.5001: UDP, length 1470
00:08:59.986563 IP 10.0.0.1.37380 > 10.0.0.2.5001: UDP, length 1470
00:08:59.998655 IP 10.0.0.1.37380 > 10.0.0.2.5001: UDP, length 1470
00:09:00.011472 IP 10.0.0.1.37380 > 10.0.0.2.5001: UDP, length 1470
00:09:00.022899 IP 10.0.0.1.37380 > 10.0.0.2.5001: UDP, length 1470
00:09:00.034939 IP 10.0.0.1.37380 > 10.0.0.2.5001: UDP, length 1470
00:09:00.047820 IP 10.0.0.1.37380 > 10.0.0.2.5001: UDP, length 1470
00:09:00.059149 IP 10.0.0.1.37380 > 10.0.0.2.5001: UDP, length 1470
00:09:00.071216 IP 10.0.0.1.37380 > 10.0.0.2.5001: UDP, length 1470
00:09:00.084146 IP 10.0.0.1.37380 > 10.0.0.2.5001: UDP, length 1470
00:09:00.095822 IP 10.0.0.1.37380 > 10.0.0.2.5001: UDP, length 1470
00:09:00.108316 IP 10.0.0.1.37380 > 10.0.0.2.5001: UDP, length 1470
00:09:00.119628 IP 10.0.0.1.37380 > 10.0.0.2.5001: UDP, length 1470
00:09:00.132523 IP 10.0.0.1.37380 > 10.0.0.2.5001: UDP, length 1470
00:09:00.143794 IP 10.0.0.1.37380 > 10.0.0.2.5001: UDP, length 1470
00:09:00.155932 IP 10.0.0.1.37380 > 10.0.0.2.5001: UDP, length 1470
00:09:00.167972 IP 10.0.0.1.37380 > 10.0.0.2.5001: UDP, length 1470
00:09:00.180100 IP 10.0.0.1.37380 > 10.0.0.2.5001: UDP, length 1470
00:09:00.192178 IP 10.0.0.1.37380 > 10.0.0.2.5001: UDP, length 1470
00:09:00.216419 IP 10.0.0.1.37380 > 10.0.0.2.5001: UDP, length 1470
00:09:00.228478 IP 10.0.0.1.37380 > 10.0.0.2.5001: UDP, length 1470
00:09:00.240581 IP 10.0.0.1.37380 > 10.0.0.2.5001: UDP, length 1470
00:09:00.252698 IP 10.0.0.1.37380 > 10.0.0.2.5001: UDP, length 1470
00:09:00.264780 IP 10.0.0.1.37380 > 10.0.0.2.5001: UDP, length 1470
00:09:00.276841 IP 10.0.0.1.37380 > 10.0.0.2.5001: UDP, length 1470
00:09:00.288985 IP 10.0.0.1.37380 > 10.0.0.2.5001: UDP, length 1470
00:09:00.301049 IP 10.0.0.1.37380 > 10.0.0.2.5001: UDP, length 1470
00:09:00.313143 IP 10.0.0.1.37380 > 10.0.0.2.5001: UDP, length 1470
00:09:00.325215 IP 10.0.0.1.37380 > 10.0.0.2.5001: UDP, length 1470
00:09:00.337391 IP 10.0.0.1.37380 > 10.0.0.2.5001: UDP, length 1470
00:09:00.349475 IP 10.0.0.1.37380 > 10.0.0.2.5001: UDP, length 1470
00:09:00.361543 IP 10.0.0.1.37380 > 10.0.0.2.5001: UDP, length 1470
00:09:00.373657 IP 10.0.0.1.37380 > 10.0.0.2.5001: UDP, length 1470
00:09:00.385689 IP 10.0.0.1.37380 > 10.0.0.2.5001: UDP, length 1470
00:09:00.398701 IP 10.0.0.1.37380 > 10.0.0.2.5001: UDP, length 1470
00:09:00.409906 IP 10.0.0.1.37380 > 10.0.0.2.5001: UDP, length 1470
00:09:00.422036 IP 10.0.0.1.37380 > 10.0.0.2.5001: UDP, length 1470
00:09:00.434106 IP 10.0.0.1.37380 > 10.0.0.2.5001: UDP, length 1470
00:09:00.446944 IP 10.0.0.1.37380 > 10.0.0.2.5001: UDP, length 1470
00:09:00.458343 IP 10.0.0.1.37380 > 10.0.0.2.5001: UDP, length 1470
00:09:00.471188 IP 10.0.0.1.37380 > 10.0.0.2.5001: UDP, length 1470
00:09:00.482519 IP 10.0.0.1.37380 > 10.0.0.2.5001: UDP, length 1470
00:09:00.494606 IP 10.0.0.1.37380 > 10.0.0.2.5001: UDP, length 1470
00:09:00.506687 IP 10.0.0.1.37380 > 10.0.0.2.5001: UDP, length 1470
00:09:00.518784 IP 10.0.0.1.37380 > 10.0.0.2.5001: UDP, length 1470
00:09:00.530903 IP 10.0.0.1.37380 > 10.0.0.2.5001: UDP, length 1470
00:09:00.542979 IP 10.0.0.1.37380 > 10.0.0.2.5001: UDP, length 1470
00:09:00.555077 IP 10.0.0.1.37380 > 10.0.0.2.5001: UDP, length 1470
00:09:00.568078 IP 10.0.0.1.37380 > 10.0.0.2.5001: UDP, length 1470
00:09:00.579243 IP 10.0.0.1.37380 > 10.0.0.2.5001: UDP, length 1470
00:09:00.591388 IP 10.0.0.1.37380 > 10.0.0.2.5001: UDP, length 1470
00:09:00.603460 IP 10.0.0.1.37380 > 10.0.0.2.5001: UDP, length 1470
00:09:00.616342 IP 10.0.0.1.37380 > 10.0.0.2.5001: UDP, length 1470
00:09:00.627678 IP 10.0.0.1.37380 > 10.0.0.2.5001: UDP, length 1470
00:09:00.639723 IP 10.0.0.1.37380 > 10.0.0.2.5001: UDP, length 1470
00:09:00.651866 IP 10.0.0.1.37380 > 10.0.0.2.5001: UDP, length 1470
00:09:00.663951 IP 10.0.0.1.37380 > 10.0.0.2.5001: UDP, length 1470
00:09:00.676023 IP 10.0.0.1.37380 > 10.0.0.2.5001: UDP, length 1470
00:09:00.688161 IP 10.0.0.1.37380 > 10.0.0.2.5001: UDP, length 1470
00:09:00.700187 IP 10.0.0.1.37380 > 10.0.0.2.5001: UDP, length 1470
00:09:00.712319 IP 10.0.0.1.37380 > 10.0.0.2.5001: UDP, length 1470
00:09:00.724414 IP 10.0.0.1.37380 > 10.0.0.2.5001: UDP, length 1470
00:09:00.737315 IP 10.0.0.1.37380 > 10.0.0.2.5001: UDP, length 1470
00:09:00.748633 IP 10.0.0.1.37380 > 10.0.0.2.5001: UDP, length 1470
00:09:00.760711 IP 10.0.0.1.37380 > 10.0.0.2.5001: UDP, length 1470
00:09:00.772805 IP 10.0.0.1.37380 > 10.0.0.2.5001: UDP, length 1470
00:09:00.784915 IP 10.0.0.1.37380 > 10.0.0.2.5001: UDP, length 1470
00:09:00.796974 IP 10.0.0.1.37380 > 10.0.0.2.5001: UDP, length 1470
00:09:00.809095 IP 10.0.0.1.37380 > 10.0.0.2.5001: UDP, length 1470
00:09:00.821185 IP 10.0.0.1.37380 > 10.0.0.2.5001: UDP, length 1470
00:09:00.833470 IP 10.0.0.1.37380 > 10.0.0.2.5001: UDP, length 1470
00:09:00.846262 IP 10.0.0.1.37380 > 10.0.0.2.5001: UDP, length 1470
00:09:00.857442 IP 10.0.0.1.37380 > 10.0.0.2.5001: UDP, length 1470
00:09:00.869694 IP 10.0.0.1.37380 > 10.0.0.2.5001: UDP, length 1470
00:09:00.881612 IP 10.0.0.1.37380 > 10.0.0.2.5001: UDP, length 1470
00:09:00.893759 IP 10.0.0.1.37380 > 10.0.0.2.5001: UDP, length 1470
00:09:00.905842 IP 10.0.0.1.37380 > 10.0.0.2.5001: UDP, length 1470
00:09:00.917961 IP 10.0.0.1.37380 > 10.0.0.2.5001: UDP, length 1470
00:09:00.930077 IP 10.0.0.1.37380 > 10.0.0.2.5001: UDP, length 1470
00:09:00.942156 IP 10.0.0.1.37380 > 10.0.0.2.5001: UDP, length 1470
00:09:00.954211 IP 10.0.0.1.37380 > 10.0.0.2.5001: UDP, length 1470
00:09:00.966338 IP 10.0.0.1.37380 > 10.0.0.2.5001: UDP, length 1470
00:09:00.978419 IP 10.0.0.1.37380 > 10.0.0.2.5001: UDP, length 1470
00:09:00.990582 IP 10.0.0.1.37380 > 10.0.0.2.5001: UDP, length 1470
00:09:01.003403 IP 10.0.0.1.37380 > 10.0.0.2.5001: UDP, length 1470
00:09:01.014728 IP 10.0.0.1.37380 > 10.0.0.2.5001: UDP, length 1470
00:09:01.026816 IP 10.0.0.1.37380 > 10.0.0.2.5001: UDP, length 1470
00:09:01.038888 IP 10.0.0.1.37380 > 10.0.0.2.5001: UDP, length 1470
00:09:01.051043 IP 10.0.0.1.37380 > 10.0.0.2.5001: UDP, length 1470
00:09:01.075173 IP 10.0.0.1.37380 > 10.0.0.2.5001: UDP, length 1470
00:09:01.087298 IP 10.0.0.1.37380 > 10.0.0.2.5001: UDP, length 1470
00:09:01.099382 IP 10.0.0.1.37380 > 10.0.0.2.5001: UDP, length 1470
00:09:01.111478 IP 10.0.0.1.37380 > 10.0.0.2.5001: UDP, length 1470
00:09:01.123598 IP 10.0.0.1.37380 > 10.0.0.2.5001: UDP, length 1470
00:09:01.135692 IP 10.0.0.1.37380 > 10.0.0.2.5001: UDP, length 1470
00:09:01.147811 IP 10.0.0.1.37380 > 10.0.0.2.5001: UDP, length 1470
00:09:01.159907 IP 10.0.0.1.37380 > 10.0.0.2.5001: UDP, length 1470
00:09:01.171946 IP 10.0.0.1.37380 > 10.0.0.2.5001: UDP, length 1470
00:09:01.184871 IP 10.0.0.1.37380 > 10.0.0.2.5001: UDP, length 1470
00:09:01.196165 IP 10.0.0.1.37380 > 10.0.0.2.5001: UDP, length 1470
00:09:01.208248 IP 10.0.0.1.37380 > 10.0.0.2.5001: UDP, length 1470
00:09:01.220376 IP 10.0.0.1.37380 > 10.0.0.2.5001: UDP, length 1470
00:09:01.232454 IP 10.0.0.1.37380 > 10.0.0.2.5001: UDP, length 1470
00:09:01.244548 IP 10.0.0.1.37380 > 10.0.0.2.5001: UDP, length 1470
00:09:01.257542 IP 10.0.0.1.37380 > 10.0.0.2.5001: UDP, length 1470
00:09:01.268730 IP 10.0.0.1.37380 > 10.0.0.2.5001: UDP, length 1470
00:09:01.281018 IP 10.0.0.1.37380 > 10.0.0.2.5001: UDP, length 1470
00:09:01.292913 IP 10.0.0.1.37380 > 10.0.0.2.5001: UDP, length 1470
00:09:01.305228 IP 10.0.0.1.37380 > 10.0.0.2.5001: UDP, length 1470
00:09:01.317103 IP 10.0.0.1.37380 > 10.0.0.2.5001: UDP, length 1470
00:09:01.329218 IP 10.0.0.1.37380 > 10.0.0.2.5001: UDP, length 1470
00:09:01.342030 IP 10.0.0.1.37380 > 10.0.0.2.5001: UDP, length 1470
00:09:01.353415 IP 10.0.0.1.37380 > 10.0.0.2.5001: UDP, length 1470
00:09:01.365477 IP 10.0.0.1.37380 > 10.0.0.2.5001: UDP, length 1470
00:09:01.389667 IP 10.0.0.1.37380 > 10.0.0.2.5001: UDP, length 1470
00:09:01.401800 IP 10.0.0.1.37380 > 10.0.0.2.5001: UDP, length 1470
00:09:01.414737 IP 10.0.0.1.37380 > 10.0.0.2.5001: UDP, length 1470
00:09:01.425997 IP 10.0.0.1.37380 > 10.0.0.2.5001: UDP, length 1470
00:09:01.438097 IP 10.0.0.1.37380 > 10.0.0.2.5001: UDP, length 1470
00:09:01.450918 IP 10.0.0.1.37380 > 10.0.0.2.5001: UDP, length 1470
00:09:01.462277 IP 10.0.0.1.37380 > 10.0.0.2.5001: UDP, length 1470
00:09:01.474366 IP 10.0.0.1.37380 > 10.0.0.2.5001: UDP, length 1470
00:09:01.487192 IP 10.0.0.1.37380 > 10.0.0.2.5001: UDP, length 1470
00:09:01.498557 IP 10.0.0.1.37380 > 10.0.0.2.5001: UDP, length 1470
00:09:01.510660 IP 10.0.0.1.37380 > 10.0.0.2.5001: UDP, length 1470
00:09:01.522730 IP 10.0.0.1.37380 > 10.0.0.2.5001: UDP, length 1470
00:09:01.534851 IP 10.0.0.1.37380 > 10.0.0.2.5001: UDP, length 1470
00:09:01.546931 IP 10.0.0.1.37380 > 10.0.0.2.5001: UDP, length 1470
00:09:01.559038 IP 10.0.0.1.37380 > 10.0.0.2.5001: UDP, length 1470
00:09:01.571146 IP 10.0.0.1.37380 > 10.0.0.2.5001: UDP, length 1470
00:09:01.583230 IP 10.0.0.1.37380 > 10.0.0.2.5001: UDP, length 1470
00:09:01.595339 IP 10.0.0.1.37380 > 10.0.0.2.5001: UDP, length 1470
00:09:01.607437 IP 10.0.0.1.37380 > 10.0.0.2.5001: UDP, length 1470
00:09:01.619521 IP 10.0.0.1.37380 > 10.0.0.2.5001: UDP, length 1470
00:09:01.631591 IP 10.0.0.1.37380 > 10.0.0.2.5001: UDP, length 1470
00:09:01.643736 IP 10.0.0.1.37380 > 10.0.0.2.5001: UDP, length 1470
00:09:01.655797 IP 10.0.0.1.37380 > 10.0.0.2.5001: UDP, length 1470
00:09:01.668725 IP 10.0.0.1.37380 > 10.0.0.2.5001: UDP, length 1470
00:09:01.680041 IP 10.0.0.1.37380 > 10.0.0.2.5001: UDP, length 1470
00:09:01.692087 IP 10.0.0.1.37380 > 10.0.0.2.5001: UDP, length 1470
00:09:01.704804 IP 10.0.0.1.37380 > 10.0.0.2.5001: UDP, length 1470
00:09:01.716280 IP 10.0.0.1.37380 > 10.0.0.2.5001: UDP, length 1470
00:09:01.728398 IP 10.0.0.1.37380 > 10.0.0.2.5001: UDP, length 1470
00:09:01.741312 IP 10.0.0.1.37380 > 10.0.0.2.5001: UDP, length 1470
00:09:01.752625 IP 10.0.0.1.37380 > 10.0.0.2.5001: UDP, length 1470
00:09:01.776771 IP 10.0.0.1.37380 > 10.0.0.2.5001: UDP, length 1470
00:09:01.788862 IP 10.0.0.1.37380 > 10.0.0.2.5001: UDP, length 1470
00:09:01.800988 IP 10.0.0.1.37380 > 10.0.0.2.5001: UDP, length 1470
00:09:01.813023 IP 10.0.0.1.37380 > 10.0.0.2.5001: UDP, length 1470
00:09:01.825141 IP 10.0.0.1.37380 > 10.0.0.2.5001: UDP, length 1470
00:09:01.837251 IP 10.0.0.1.37380 > 10.0.0.2.5001: UDP, length 1470
00:09:01.849318 IP 10.0.0.1.37380 > 10.0.0.2.5001: UDP, length 1470
00:09:01.861399 IP 10.0.0.1.37380 > 10.0.0.2.5001: UDP, length 1470
00:09:01.873528 IP 10.0.0.1.37380 > 10.0.0.2.5001: UDP, length 1470
00:09:01.885598 IP 10.0.0.1.37380 > 10.0.0.2.5001: UDP, length 1470
00:09:01.897724 IP 10.0.0.1.37380 > 10.0.0.2.5001: UDP, length 1470
00:09:01.909869 IP 10.0.0.1.37380 > 10.0.0.2.5001: UDP, length 1470
00:09:01.921952 IP 10.0.0.1.37380 > 10.0.0.2.5001: UDP, length 1470
00:09:01.934021 IP 10.0.0.1.37380 > 10.0.0.2.5001: UDP, length 1470
00:09:01.946837 IP 10.0.0.1.37380 > 10.0.0.2.5001: UDP, length 1470
00:09:01.958191 IP 10.0.0.1.37380 > 10.0.0.2.5001: UDP, length 1470
00:09:01.970330 IP 10.0.0.1.37380 > 10.0.0.2.5001: UDP, length 1470
00:09:01.982389 IP 10.0.0.1.37380 > 10.0.0.2.5001: UDP, length 1470
00:09:01.994509 IP 10.0.0.1.37380 > 10.0.0.2.5001: UDP, length 1470
00:09:02.007293 IP 10.0.0.1.37380 > 10.0.0.2.5001: UDP, length 1470
00:09:02.018679 IP 10.0.0.1.37380 > 10.0.0.2.5001: UDP, length 1470
00:09:02.030792 IP 10.0.0.1.37380 > 10.0.0.2.5001: UDP, length 1470
00:09:02.042852 IP 10.0.0.1.37380 > 10.0.0.2.5001: UDP, length 1470
00:09:02.054918 IP 10.0.0.1.37380 > 10.0.0.2.5001: UDP, length 1470
00:09:02.067073 IP 10.0.0.1.37380 > 10.0.0.2.5001: UDP, length 1470
00:09:02.079556 IP 10.0.0.1.37380 > 10.0.0.2.5001: UDP, length 1470
00:09:02.091283 IP 10.0.0.1.37380 > 10.0.0.2.5001: UDP, length 1470
00:09:02.103400 IP 10.0.0.1.37380 > 10.0.0.2.5001: UDP, length 1470
00:09:02.115433 IP 10.0.0.1.37380 > 10.0.0.2.5001: UDP, length 1470
00:09:02.128356 IP 10.0.0.1.37380 > 10.0.0.2.5001: UDP, length 1470
00:09:02.139626 IP 10.0.0.1.37380 > 10.0.0.2.5001: UDP, length 1470
00:09:02.152653 IP 10.0.0.1.37380 > 10.0.0.2.5001: UDP, length 1470
00:09:02.163992 IP 10.0.0.1.37380 > 10.0.0.2.5001: UDP, length 1470
00:09:02.175943 IP 10.0.0.1.37380 > 10.0.0.2.5001: UDP, length 1470
00:09:02.188036 IP 10.0.0.1.37380 > 10.0.0.2.5001: UDP, length 1470
00:09:02.200661 IP 10.0.0.1.37380 > 10.0.0.2.5001: UDP, length 1470
00:09:02.212258 IP 10.0.0.1.37380 > 10.0.0.2.5001: UDP, length 1470
00:09:02.224316 IP 10.0.0.1.37380 > 10.0.0.2.5001: UDP, length 1470
00:09:02.237136 IP 10.0.0.1.37380 > 10.0.0.2.5001: UDP, length 1470
00:09:02.248546 IP 10.0.0.1.37380 > 10.0.0.2.5001: UDP, length 1470
00:09:02.260595 IP 10.0.0.1.37380 > 10.0.0.2.5001: UDP, length 1470
00:09:02.273500 IP 10.0.0.1.37380 > 10.0.0.2.5001: UDP, length 1470
00:09:02.284813 IP 10.0.0.1.37380 > 10.0.0.2.5001: UDP, length 1470
00:09:02.296909 IP 10.0.0.1.37380 > 10.0.0.2.5001: UDP, length 1470
00:09:02.308972 IP 10.0.0.1.37380 > 10.0.0.2.5001: UDP, length 1470
00:09:02.321062 IP 10.0.0.1.37380 > 10.0.0.2.5001: UDP, length 1470
00:09:02.333186 IP 10.0.0.1.37380 > 10.0.0.2.5001: UDP, length 1470
00:09:02.345235 IP 10.0.0.1.37380 > 10.0.0.2.5001: UDP, length 1470
00:09:02.357381 IP 10.0.0.1.37380 > 10.0.0.2.5001: UDP, length 1470
00:09:02.369474 IP 10.0.0.1.37380 > 10.0.0.2.5001: UDP, length 1470
00:09:02.381567 IP 10.0.0.1.37380 > 10.0.0.2.5001: UDP, length 1470
00:09:02.393629 IP 10.0.0.1.37380 > 10.0.0.2.5001: UDP, length 1470
00:09:02.405785 IP 10.0.0.1.37380 > 10.0.0.2.5001: UDP, length 1470
00:09:02.417836 IP 10.0.0.1.37380 > 10.0.0.2.5001: UDP, length 1470
00:09:02.430758 IP 10.0.0.1.37380 > 10.0.0.2.5001: UDP, length 1470
00:09:02.442042 IP 10.0.0.1.37380 > 10.0.0.2.5001: UDP, length 1470
00:09:02.454165 IP 10.0.0.1.37380 > 10.0.0.2.5001: UDP, length 1470
00:09:02.466239 IP 10.0.0.1.37380 > 10.0.0.2.5001: UDP, length 1470
00:09:02.478359 IP 10.0.0.1.37380 > 10.0.0.2.5001: UDP, length 1470
00:09:02.490427 IP 10.0.0.1.37380 > 10.0.0.2.5001: UDP, length 1470
00:09:02.503338 IP 10.0.0.1.37380 > 10.0.0.2.5001: UDP, length 1470
00:09:02.526774 IP 10.0.0.1.37380 > 10.0.0.2.5001: UDP, length 1470
00:09:02.538826 IP 10.0.0.1.37380 > 10.0.0.2.5001: UDP, length 1470
00:09:02.551704 IP 10.0.0.1.37380 > 10.0.0.2.5001: UDP, length 1470
00:09:02.562985 IP 10.0.0.1.37380 > 10.0.0.2.5001: UDP, length 1470
00:09:02.575076 IP 10.0.0.1.37380 > 10.0.0.2.5001: UDP, length 1470
00:09:02.588143 IP 10.0.0.1.37380 > 10.0.0.2.5001: UDP, length 1470
00:09:02.599281 IP 10.0.0.1.37380 > 10.0.0.2.5001: UDP, length 1470
00:09:02.611383 IP 10.0.0.1.37380 > 10.0.0.2.5001: UDP, length 1470
00:09:02.624385 IP 10.0.0.1.37380 > 10.0.0.2.5001: UDP, length 1470
00:09:02.635595 IP 10.0.0.1.37380 > 10.0.0.2.5001: UDP, length 1470
00:09:02.647668 IP 10.0.0.1.37380 > 10.0.0.2.5001: UDP, length 1470
00:09:02.660579 IP 10.0.0.1.37380 > 10.0.0.2.5001: UDP, length 1470
00:09:02.671865 IP 10.0.0.1.37380 > 10.0.0.2.5001: UDP, length 1470
00:09:02.683970 IP 10.0.0.1.37380 > 10.0.0.2.5001: UDP, length 1470
00:09:02.696048 IP 10.0.0.1.37380 > 10.0.0.2.5001: UDP, length 1470
00:09:02.708155 IP 10.0.0.1.37380 > 10.0.0.2.5001: UDP, length 1470
00:09:02.720310 IP 10.0.0.1.37380 > 10.0.0.2.5001: UDP, length 1470
00:09:02.733136 IP 10.0.0.1.37380 > 10.0.0.2.5001: UDP, length 1470
00:09:02.744455 IP 10.0.0.1.37380 > 10.0.0.2.5001: UDP, length 1470
00:09:02.757350 IP 10.0.0.1.37380 > 10.0.0.2.5001: UDP, length 1470
00:09:02.768608 IP 10.0.0.1.37380 > 10.0.0.2.5001: UDP, length 1470
00:09:02.780771 IP 10.0.0.1.37380 > 10.0.0.2.5001: UDP, length 1470
00:09:02.792839 IP 10.0.0.1.37380 > 10.0.0.2.5001: UDP, length 1470
00:09:02.804937 IP 10.0.0.1.37380 > 10.0.0.2.5001: UDP, length 1470
00:09:02.817035 IP 10.0.0.1.37380 > 10.0.0.2.5001: UDP, length 1470
00:09:02.829086 IP 10.0.0.1.37380 > 10.0.0.2.5001: UDP, length 1470
00:09:02.853336 IP 10.0.0.1.37380 > 10.0.0.2.5001: UDP, length 1470
00:09:02.865406 IP 10.0.0.1.37380 > 10.0.0.2.5001: UDP, length 1470
00:09:02.878275 IP 10.0.0.1.37380 > 10.0.0.2.5001: UDP, length 1470
00:09:02.889605 IP 10.0.0.1.37380 > 10.0.0.2.5001: UDP, length 1470
00:09:02.901658 IP 10.0.0.1.37380 > 10.0.0.2.5001: UDP, length 1470
00:09:02.914512 IP 10.0.0.1.37380 > 10.0.0.2.5001: UDP, length 1470
00:09:02.925876 IP 10.0.0.1.37380 > 10.0.0.2.5001: UDP, length 1470
00:09:02.938738 IP 10.0.0.1.37380 > 10.0.0.2.5001: UDP, length 1470
00:09:02.950056 IP 10.0.0.1.37380 > 10.0.0.2.5001: UDP, length 1470
00:09:02.962149 IP 10.0.0.1.37380 > 10.0.0.2.5001: UDP, length 1470
00:09:02.974284 IP 10.0.0.1.37380 > 10.0.0.2.5001: UDP, length 1470
00:09:02.987175 IP 10.0.0.1.37380 > 10.0.0.2.5001: UDP, length 1470
00:09:02.998464 IP 10.0.0.1.37380 > 10.0.0.2.5001: UDP, length 1470
00:09:03.010544 IP 10.0.0.1.37380 > 10.0.0.2.5001: UDP, length 1470
00:09:03.023415 IP 10.0.0.1.37380 > 10.0.0.2.5001: UDP, length 1470
00:09:03.034729 IP 10.0.0.1.37380 > 10.0.0.2.5001: UDP, length 1470
00:09:03.046847 IP 10.0.0.1.37380 > 10.0.0.2.5001: UDP, length 1470
00:09:03.059729 IP 10.0.0.1.37380 > 10.0.0.2.5001: UDP, length 1470
00:09:03.071052 IP 10.0.0.1.37380 > 10.0.0.2.5001: UDP, length 1470
00:09:03.083102 IP 10.0.0.1.37380 > 10.0.0.2.5001: UDP, length 1470
00:09:03.096062 IP 10.0.0.1.37380 > 10.0.0.2.5001: UDP, length 1470
00:09:03.107346 IP 10.0.0.1.37380 > 10.0.0.2.5001: UDP, length 1470
00:09:03.119419 IP 10.0.0.1.37380 > 10.0.0.2.5001: UDP, length 1470
00:09:03.131504 IP 10.0.0.1.37380 > 10.0.0.2.5001: UDP, length 1470
00:09:03.143616 IP 10.0.0.1.37380 > 10.0.0.2.5001: UDP, length 1470
00:09:03.156560 IP 10.0.0.1.37380 > 10.0.0.2.5001: UDP, length 1470
00:09:03.167836 IP 10.0.0.1.37380 > 10.0.0.2.5001: UDP, length 1470
00:09:03.179945 IP 10.0.0.1.37380 > 10.0.0.2.5001: UDP, length 1470
00:09:03.192001 IP 10.0.0.1.37380 > 10.0.0.2.5001: UDP, length 1470
00:09:03.204096 IP 10.0.0.1.37380 > 10.0.0.2.5001: UDP, length 1470
00:09:03.216206 IP 10.0.0.1.37380 > 10.0.0.2.5001: UDP, length 1470
00:09:03.240448 IP 10.0.0.1.37380 > 10.0.0.2.5001: UDP, length 1470
00:09:03.252509 IP 10.0.0.1.37380 > 10.0.0.2.5001: UDP, length 1470
00:09:03.264580 IP 10.0.0.1.37380 > 10.0.0.2.5001: UDP, length 1470
00:09:03.276691 IP 10.0.0.1.37380 > 10.0.0.2.5001: UDP, length 1470
00:09:03.288744 IP 10.0.0.1.37380 > 10.0.0.2.5001: UDP, length 1470
00:09:03.300875 IP 10.0.0.1.37380 > 10.0.0.2.5001: UDP, length 1470
00:09:03.312965 IP 10.0.0.1.37380 > 10.0.0.2.5001: UDP, length 1470
00:09:03.325039 IP 10.0.0.1.37380 > 10.0.0.2.5001: UDP, length 1470
00:09:03.337166 IP 10.0.0.1.37380 > 10.0.0.2.5001: UDP, length 1470
00:09:03.349223 IP 10.0.0.1.37380 > 10.0.0.2.5001: UDP, length 1470
00:09:03.361374 IP 10.0.0.1.37380 > 10.0.0.2.5001: UDP, length 1470
00:09:03.374203 IP 10.0.0.1.37380 > 10.0.0.2.5001: UDP, length 1470
00:09:03.385516 IP 10.0.0.1.37380 > 10.0.0.2.5001: UDP, length 1470
00:09:03.398431 IP 10.0.0.1.37380 > 10.0.0.2.5001: UDP, length 1470
00:09:03.409748 IP 10.0.0.1.37380 > 10.0.0.2.5001: UDP, length 1470
00:09:03.421856 IP 10.0.0.1.37380 > 10.0.0.2.5001: UDP, length 1470
00:09:03.433933 IP 10.0.0.1.37380 > 10.0.0.2.5001: UDP, length 1470
00:09:03.446023 IP 10.0.0.1.37380 > 10.0.0.2.5001: UDP, length 1470
00:09:03.458883 IP 10.0.0.1.37380 > 10.0.0.2.5001: UDP, length 1470
00:09:03.470465 IP 10.0.0.1.37380 > 10.0.0.2.5001: UDP, length 1470
00:09:03.482307 IP 10.0.0.1.37380 > 10.0.0.2.5001: UDP, length 1470
00:09:03.494400 IP 10.0.0.1.37380 > 10.0.0.2.5001: UDP, length 1470
00:09:03.507353 IP 10.0.0.1.37380 > 10.0.0.2.5001: UDP, length 1470
00:09:03.518594 IP 10.0.0.1.37380 > 10.0.0.2.5001: UDP, length 1470
00:09:03.530693 IP 10.0.0.1.37380 > 10.0.0.2.5001: UDP, length 1470
00:09:03.542762 IP 10.0.0.1.37380 > 10.0.0.2.5001: UDP, length 1470
00:09:03.554915 IP 10.0.0.1.37380 > 10.0.0.2.5001: UDP, length 1470
00:09:03.566976 IP 10.0.0.1.37380 > 10.0.0.2.5001: UDP, length 1470
00:09:03.579079 IP 10.0.0.1.37380 > 10.0.0.2.5001: UDP, length 1470
00:09:03.591171 IP 10.0.0.1.37380 > 10.0.0.2.5001: UDP, length 1470
00:09:03.603315 IP 10.0.0.1.37380 > 10.0.0.2.5001: UDP, length 1470
00:09:03.615377 IP 10.0.0.1.37380 > 10.0.0.2.5001: UDP, length 1470
00:09:03.627482 IP 10.0.0.1.37380 > 10.0.0.2.5001: UDP, length 1470
00:09:03.639564 IP 10.0.0.1.37380 > 10.0.0.2.5001: UDP, length 1470
00:09:03.651655 IP 10.0.0.1.37380 > 10.0.0.2.5001: UDP, length 1470
00:09:03.663752 IP 10.0.0.1.37380 > 10.0.0.2.5001: UDP, length 1470
00:09:03.675811 IP 10.0.0.1.37380 > 10.0.0.2.5001: UDP, length 1470
00:09:03.687975 IP 10.0.0.1.37380 > 10.0.0.2.5001: UDP, length 1470
00:09:03.699993 IP 10.0.0.1.37380 > 10.0.0.2.5001: UDP, length 1470
00:09:03.712144 IP 10.0.0.1.37380 > 10.0.0.2.5001: UDP, length 1470
00:09:03.724231 IP 10.0.0.1.37380 > 10.0.0.2.5001: UDP, length 1470
00:09:03.736327 IP 10.0.0.1.37380 > 10.0.0.2.5001: UDP, length 1470
00:09:03.748412 IP 10.0.0.1.37380 > 10.0.0.2.5001: UDP, length 1470
00:09:03.761319 IP 10.0.0.1.37380 > 10.0.0.2.5001: UDP, length 1470
00:09:03.772615 IP 10.0.0.1.37380 > 10.0.0.2.5001: UDP, length 1470
00:09:03.784709 IP 10.0.0.1.37380 > 10.0.0.2.5001: UDP, length 1470
00:09:03.796796 IP 10.0.0.1.37380 > 10.0.0.2.5001: UDP, length 1470
00:09:03.808850 IP 10.0.0.1.37380 > 10.0.0.2.5001: UDP, length 1470
00:09:03.820986 IP 10.0.0.1.37380 > 10.0.0.2.5001: UDP, length 1470
00:09:03.833877 IP 10.0.0.1.37380 > 10.0.0.2.5001: UDP, length 1470
00:09:03.845185 IP 10.0.0.1.37380 > 10.0.0.2.5001: UDP, length 1470
00:09:03.857250 IP 10.0.0.1.37380 > 10.0.0.2.5001: UDP, length 1470
00:09:03.869580 IP 10.0.0.1.37380 > 10.0.0.2.5001: UDP, length 1470
00:09:03.881463 IP 10.0.0.1.37380 > 10.0.0.2.5001: UDP, length 1470
00:09:03.893520 IP 10.0.0.1.37380 > 10.0.0.2.5001: UDP, length 1470
00:09:03.906536 IP 10.0.0.1.37380 > 10.0.0.2.5001: UDP, length 1470
00:09:03.917762 IP 10.0.0.1.37380 > 10.0.0.2.5001: UDP, length 1470
00:09:03.929834 IP 10.0.0.1.37380 > 10.0.0.2.5001: UDP, length 1470
00:09:03.942705 IP 10.0.0.1.37380 > 10.0.0.2.5001: UDP, length 1470
00:09:03.954062 IP 10.0.0.1.37380 > 10.0.0.2.5001: UDP, length 1470
00:09:03.966135 IP 10.0.0.1.37380 > 10.0.0.2.5001: UDP, length 1470
00:09:03.978224 IP 10.0.0.1.37380 > 10.0.0.2.5001: UDP, length 1470
00:09:03.990331 IP 10.0.0.1.37380 > 10.0.0.2.5001: UDP, length 1470
00:09:04.002475 IP 10.0.0.1.37380 > 10.0.0.2.5001: UDP, length 1470
00:09:04.014505 IP 10.0.0.1.37380 > 10.0.0.2.5001: UDP, length 1470
00:09:04.026984 IP 10.0.0.1.37380 > 10.0.0.2.5001: UDP, length 1470
00:09:04.038723 IP 10.0.0.1.37380 > 10.0.0.2.5001: UDP, length 1470
00:09:04.050788 IP 10.0.0.1.37380 > 10.0.0.2.5001: UDP, length 1470
00:09:04.062896 IP 10.0.0.1.37380 > 10.0.0.2.5001: UDP, length 1470
00:09:04.074996 IP 10.0.0.1.37380 > 10.0.0.2.5001: UDP, length 1470
00:09:04.087115 IP 10.0.0.1.37380 > 10.0.0.2.5001: UDP, length 1470
00:09:04.099201 IP 10.0.0.1.37380 > 10.0.0.2.5001: UDP, length 1470
00:09:04.111291 IP 10.0.0.1.37380 > 10.0.0.2.5001: UDP, length 1470
00:09:04.123384 IP 10.0.0.1.37380 > 10.0.0.2.5001: UDP, length 1470
00:09:04.135541 IP 10.0.0.1.37380 > 10.0.0.2.5001: UDP, length 1470
00:09:04.147580 IP 10.0.0.1.37380 > 10.0.0.2.5001: UDP, length 1470
00:09:04.159684 IP 10.0.0.1.37380 > 10.0.0.2.5001: UDP, length 1470
00:09:04.171776 IP 10.0.0.1.37380 > 10.0.0.2.5001: UDP, length 1470
00:09:04.183893 IP 10.0.0.1.37380 > 10.0.0.2.5001: UDP, length 1470
00:09:04.195960 IP 10.0.0.1.37380 > 10.0.0.2.5001: UDP, length 1470
00:09:04.208880 IP 10.0.0.1.37380 > 10.0.0.2.5001: UDP, length 1470
00:09:04.220163 IP 10.0.0.1.37380 > 10.0.0.2.5001: UDP, length 1470
00:09:04.232262 IP 10.0.0.1.37380 > 10.0.0.2.5001: UDP, length 1470
00:09:04.244605 IP 10.0.0.1.37380 > 10.0.0.2.5001: UDP, length 1470
00:09:04.256486 IP 10.0.0.1.37380 > 10.0.0.2.5001: UDP, length 1470
00:09:04.268548 IP 10.0.0.1.37380 > 10.0.0.2.5001: UDP, length 1470
00:09:04.281616 IP 10.0.0.1.37380 > 10.0.0.2.5001: UDP, length 1470
00:09:04.292756 IP 10.0.0.1.37380 > 10.0.0.2.5001: UDP, length 1470
00:09:04.305640 IP 10.0.0.1.37380 > 10.0.0.2.5001: UDP, length 1470
00:09:04.316924 IP 10.0.0.1.37380 > 10.0.0.2.5001: UDP, length 1470
00:09:04.329832 IP 10.0.0.1.37380 > 10.0.0.2.5001: UDP, length 1470
00:09:04.341124 IP 10.0.0.1.37380 > 10.0.0.2.5001: UDP, length 1470
00:09:04.353231 IP 10.0.0.1.37380 > 10.0.0.2.5001: UDP, length 1470
00:09:04.366100 IP 10.0.0.1.37380 > 10.0.0.2.5001: UDP, length 1470
00:09:04.377438 IP 10.0.0.1.37380 > 10.0.0.2.5001: UDP, length 1470
00:09:04.389538 IP 10.0.0.1.37380 > 10.0.0.2.5001: UDP, length 1470
00:09:04.401805 IP 10.0.0.1.37380 > 10.0.0.2.5001: UDP, length 1470
00:09:04.413694 IP 10.0.0.1.37380 > 10.0.0.2.5001: UDP, length 1470
00:09:04.425766 IP 10.0.0.1.37380 > 10.0.0.2.5001: UDP, length 1470
00:09:04.437846 IP 10.0.0.1.37380 > 10.0.0.2.5001: UDP, length 1470
00:09:04.449968 IP 10.0.0.1.37380 > 10.0.0.2.5001: UDP, length 1470
00:09:04.462055 IP 10.0.0.1.37380 > 10.0.0.2.5001: UDP, length 1470
00:09:04.474176 IP 10.0.0.1.37380 > 10.0.0.2.5001: UDP, length 1470
00:09:04.487044 IP 10.0.0.1.37380 > 10.0.0.2.5001: UDP, length 1470
00:09:04.498362 IP 10.0.0.1.37380 > 10.0.0.2.5001: UDP, length 1470
00:09:04.510455 IP 10.0.0.1.37380 > 10.0.0.2.5001: UDP, length 1470
00:09:04.523339 IP 10.0.0.1.37380 > 10.0.0.2.5001: UDP, length 1470
00:09:04.534670 IP 10.0.0.1.37380 > 10.0.0.2.5001: UDP, length 1470
00:09:04.547498 IP 10.0.0.1.37380 > 10.0.0.2.5001: UDP, length 1470
00:09:04.558857 IP 10.0.0.1.37380 > 10.0.0.2.5001: UDP, length 1470
00:09:04.570943 IP 10.0.0.1.37380 > 10.0.0.2.5001: UDP, length 1470
00:09:04.583070 IP 10.0.0.1.37380 > 10.0.0.2.5001: UDP, length 1470
00:09:04.595156 IP 10.0.0.1.37380 > 10.0.0.2.5001: UDP, length 1470
00:09:04.607235 IP 10.0.0.1.37380 > 10.0.0.2.5001: UDP, length 1470
00:09:04.619336 IP 10.0.0.1.37380 > 10.0.0.2.5001: UDP, length 1470
00:09:04.631418 IP 10.0.0.1.37380 > 10.0.0.2.5001: UDP, length 1470
00:09:04.643513 IP 10.0.0.1.37380 > 10.0.0.2.5001: UDP, length 1470
00:09:04.655593 IP 10.0.0.1.37380 > 10.0.0.2.5001: UDP, length 1470
00:09:04.667710 IP 10.0.0.1.37380 > 10.0.0.2.5001: UDP, length 1470
00:09:04.679823 IP 10.0.0.1.37380 > 10.0.0.2.5001: UDP, length 1470
00:09:04.691895 IP 10.0.0.1.37380 > 10.0.0.2.5001: UDP, length 1470
00:09:04.704833 IP 10.0.0.1.37380 > 10.0.0.2.5001: UDP, length 1470
00:09:04.716108 IP 10.0.0.1.37380 > 10.0.0.2.5001: UDP, length 1470
00:09:04.728180 IP 10.0.0.1.37380 > 10.0.0.2.5001: UDP, length 1470
00:09:04.752334 IP 10.0.0.1.37380 > 10.0.0.2.5001: UDP, length 1470
00:09:04.764505 IP 10.0.0.1.37380 > 10.0.0.2.5001: UDP, length 1470
00:09:04.777065 IP 10.0.0.1.37380 > 10.0.0.2.5001: UDP, length 1470
00:09:04.788650 IP 10.0.0.1.37380 > 10.0.0.2.5001: UDP, length 1470
00:09:04.800721 IP 10.0.0.1.37380 > 10.0.0.2.5001: UDP, length 1470
00:09:04.812863 IP 10.0.0.1.37380 > 10.0.0.2.5001: UDP, length 1470
00:09:04.824961 IP 10.0.0.1.37380 > 10.0.0.2.5001: UDP, length 1470
00:09:04.837029 IP 10.0.0.1.37380 > 10.0.0.2.5001: UDP, length 1470
00:09:04.849172 IP 10.0.0.1.37380 > 10.0.0.2.5001: UDP, length 1470
00:09:04.861244 IP 10.0.0.1.37380 > 10.0.0.2.5001: UDP, length 1470
00:09:04.873344 IP 10.0.0.1.37380 > 10.0.0.2.5001: UDP, length 1470
00:09:04.885442 IP 10.0.0.1.37380 > 10.0.0.2.5001: UDP, length 1470
00:09:04.897542 IP 10.0.0.1.37380 > 10.0.0.2.5001: UDP, length 1470
00:09:04.909633 IP 10.0.0.1.37380 > 10.0.0.2.5001: UDP, length 1470
00:09:04.922549 IP 10.0.0.1.37380 > 10.0.0.2.5001: UDP, length 1470
00:09:04.933996 IP 10.0.0.1.37380 > 10.0.0.2.5001: UDP, length 1470
00:09:04.945887 IP 10.0.0.1.37380 > 10.0.0.2.5001: UDP, length 1470
00:09:04.958022 IP 10.0.0.1.37380 > 10.0.0.2.5001: UDP, length 1470
00:09:04.970866 IP 10.0.0.1.37380 > 10.0.0.2.5001: UDP, length 1470
00:09:04.982194 IP 10.0.0.1.37380 > 10.0.0.2.5001: UDP, length 1470
00:09:04.994296 IP 10.0.0.1.37380 > 10.0.0.2.5001: UDP, length 1470
00:09:05.006377 IP 10.0.0.1.37380 > 10.0.0.2.5001: UDP, length 1470
00:09:05.018510 IP 10.0.0.1.37380 > 10.0.0.2.5001: UDP, length 1470
00:09:05.030622 IP 10.0.0.1.37380 > 10.0.0.2.5001: UDP, length 1470
00:09:05.042700 IP 10.0.0.1.37380 > 10.0.0.2.5001: UDP, length 1470
00:09:05.055510 IP 10.0.0.1.37380 > 10.0.0.2.5001: UDP, length 1470
00:09:05.078999 IP 10.0.0.1.37380 > 10.0.0.2.5001: UDP, length 1470
00:09:05.091082 IP 10.0.0.1.37380 > 10.0.0.2.5001: UDP, length 1470
00:09:05.103209 IP 10.0.0.1.37380 > 10.0.0.2.5001: UDP, length 1470
00:09:05.115274 IP 10.0.0.1.37380 > 10.0.0.2.5001: UDP, length 1470
00:09:05.127389 IP 10.0.0.1.37380 > 10.0.0.2.5001: UDP, length 1470

