00:09:09.597621 IP 10.0.0.1.36598 > 10.0.0.2.5001: UDP, length 1470
00:09:09.597655 IP 10.0.0.1.36598 > 10.0.0.2.5001: UDP, length 1470
00:09:09.609022 IP 10.0.0.1.36598 > 10.0.0.2.5001: UDP, length 1470
00:09:09.621116 IP 10.0.0.1.36598 > 10.0.0.2.5001: UDP, length 1470
00:09:09.633279 IP 10.0.0.1.36598 > 10.0.0.2.5001: UDP, length 1470
00:09:09.645329 IP 10.0.0.1.36598 > 10.0.0.2.5001: UDP, length 1470
00:09:09.657434 IP 10.0.0.1.36598 > 10.0.0.2.5001: UDP, length 1470
00:09:09.669536 IP 10.0.0.1.36598 > 10.0.0.2.5001: UDP, length 1470
00:09:09.681636 IP 10.0.0.1.36598 > 10.0.0.2.5001: UDP, length 1470
00:09:09.693712 IP 10.0.0.1.36598 > 10.0.0.2.5001: UDP, length 1470
00:09:09.705804 IP 10.0.0.1.36598 > 10.0.0.2.5001: UDP, length 1470
00:09:09.717914 IP 10.0.0.1.36598 > 10.0.0.2.5001: UDP, length 1470
00:09:09.729995 IP 10.0.0.1.36598 > 10.0.0.2.5001: UDP, length 1470
00:09:09.742094 IP 10.0.0.1.36598 > 10.0.0.2.5001: UDP, length 1470
00:09:09.754971 IP 10.0.0.1.36598 > 10.0.0.2.5001: UDP, length 1470
00:09:09.766271 IP 10.0.0.1.36598 > 10.0.0.2.5001: UDP, length 1470
00:09:09.778371 IP 10.0.0.1.36598 > 10.0.0.2.5001: UDP, length 1470
00:09:09.791264 IP 10.0.0.1.36598 > 10.0.0.2.5001: UDP, length 1470
00:09:09.802574 IP 10.0.0.1.36598 > 10.0.0.2.5001: UDP, length 1470
00:09:09.815560 IP 10.0.0.1.36598 > 10.0.0.2.5001: UDP, length 1470
00:09:09.826785 IP 10.0.0.1.36598 > 10.0.0.2.5001: UDP, length 1470
00:09:09.838862 IP 10.0.0.1.36598 > 10.0.0.2.5001: UDP, length 1470
00:09:09.850994 IP 10.0.0.1.36598 > 10.0.0.2.5001: UDP, length 1470
00:09:09.863073 IP 10.0.0.1.36598 > 10.0.0.2.5001: UDP, length 1470
00:09:09.875150 IP 10.0.0.1.36598 > 10.0.0.2.5001: UDP, length 1470
00:09:09.887256 IP 10.0.0.1.36598 > 10.0.0.2.5001: UDP, length 1470
00:09:09.899349 IP 10.0.0.1.36598 > 10.0.0.2.5001: UDP, length 1470
00:09:09.911458 IP 10.0.0.1.36598 > 10.0.0.2.5001: UDP, length 1470
00:09:09.923540 IP 10.0.0.1.36598 > 10.0.0.2.5001: UDP, length 1470
00:09:09.935641 IP 10.0.0.1.36598 > 10.0.0.2.5001: UDP, length 1470
00:09:09.947756 IP 10.0.0.1.36598 > 10.0.0.2.5001: UDP, length 1470
00:09:09.959834 IP 10.0.0.1.36598 > 10.0.0.2.5001: UDP, length 1470
00:09:09.971940 IP 10.0.0.1.36598 > 10.0.0.2.5001: UDP, length 1470
00:09:09.984028 IP 10.0.0.1.36598 > 10.0.0.2.5001: UDP, length 1470
00:09:09.996108 IP 10.0.0.1.36598 > 10.0.0.2.5001: UDP, length 1470
00:09:10.008222 IP 10.0.0.1.36598 > 10.0.0.2.5001: UDP, length 1470
00:09:10.020323 IP 10.0.0.1.36598 > 10.0.0.2.5001: UDP, length 1470
00:09:10.032417 IP 10.0.0.1.36598 > 10.0.0.2.5001: UDP, length 1470
00:09:10.044518 IP 10.0.0.1.36598 > 10.0.0.2.5001: UDP, length 1470
00:09:10.056600 IP 10.0.0.1.36598 > 10.0.0.2.5001: UDP, length 1470
00:09:10.068725 IP 10.0.0.1.36598 > 10.0.0.2.5001: UDP, length 1470
00:09:10.080794 IP 10.0.0.1.36598 > 10.0.0.2.5001: UDP, length 1470
00:09:10.092887 IP 10.0.0.1.36598 > 10.0.0.2.5001: UDP, length 1470
00:09:10.105005 IP 10.0.0.1.36598 > 10.0.0.2.5001: UDP, length 1470
00:09:10.117076 IP 10.0.0.1.36598 > 10.0.0.2.5001: UDP, length 1470
00:09:10.129198 IP 10.0.0.1.36598 > 10.0.0.2.5001: UDP, length 1470
00:09:10.141278 IP 10.0.0.1.36598 > 10.0.0.2.5001: UDP, length 1470
00:09:10.153353 IP 10.0.0.1.36598 > 10.0.0.2.5001: UDP, length 1470
00:09:10.165481 IP 10.0.0.1.36598 > 10.0.0.2.5001: UDP, length 1470
00:09:10.177565 IP 10.0.0.1.36598 > 10.0.0.2.5001: UDP, length 1470
00:09:10.190596 IP 10.0.0.1.36598 > 10.0.0.2.5001: UDP, length 1470
00:09:10.201762 IP 10.0.0.1.36598 > 10.0.0.2.5001: UDP, length 1470
00:09:10.214648 IP 10.0.0.1.36598 > 10.0.0.2.5001: UDP, length 1470
00:09:10.225979 IP 10.0.0.1.36598 > 10.0.0.2.5001: UDP, length 1470
00:09:10.238812 IP 10.0.0.1.36598 > 10.0.0.2.5001: UDP, length 1470
00:09:10.250142 IP 10.0.0.1.36598 > 10.0.0.2.5001: UDP, length 1470
00:09:10.262238 IP 10.0.0.1.36598 > 10.0.0.2.5001: UDP, length 1470
00:09:10.275144 IP 10.0.0.1.36598 > 10.0.0.2.5001: UDP, length 1470
00:09:10.286422 IP 10.0.0.1.36598 > 10.0.0.2.5001: UDP, length 1470
00:09:10.299293 IP 10.0.0.1.36598 > 10.0.0.2.5001: UDP, length 1470
00:09:10.310641 IP 10.0.0.1.36598 > 10.0.0.2.5001: UDP, length 1470
00:09:10.322720 IP 10.0.0.1.36598 > 10.0.0.2.5001: UDP, length 1470
00:09:10.334809 IP 10.0.0.1.36598 > 10.0.0.2.5001: UDP, length 1470
00:09:10.346903 IP 10.0.0.1.36598 > 10.0.0.2.5001: UDP, length 1470
00:09:10.359007 IP 10.0.0.1.36598 > 10.0.0.2.5001: UDP, length 1470
00:09:10.371099 IP 10.0.0.1.36598 > 10.0.0.2.5001: UDP, length 1470
00:09:10.383186 IP 10.0.0.1.36598 > 10.0.0.2.5001: UDP, length 1470
00:09:10.395283 IP 10.0.0.1.36598 > 10.0.0.2.5001: UDP, length 1470
00:09:10.407383 IP 10.0.0.1.36598 > 10.0.0.2.5001: UDP, length 1470
00:09:10.419473 IP 10.0.0.1.36598 > 10.0.0.2.5001: UDP, length 1470
00:09:10.431577 IP 10.0.0.1.36598 > 10.0.0.2.5001: UDP, length 1470
00:09:10.443699 IP 10.0.0.1.36598 > 10.0.0.2.5001: UDP, length 1470
00:09:10.455770 IP 10.0.0.1.36598 > 10.0.0.2.5001: UDP, length 1470
00:09:10.467862 IP 10.0.0.1.36598 > 10.0.0.2.5001: UDP, length 1470
00:09:10.480262 IP 10.0.0.1.36598 > 10.0.0.2.5001: UDP, length 1470
00:09:10.492074 IP 10.0.0.1.36598 > 10.0.0.2.5001: UDP, length 1470
00:09:10.504169 IP 10.0.0.1.36598 > 10.0.0.2.5001: UDP, length 1470
00:09:10.516240 IP 10.0.0.1.36598 > 10.0.0.2.5001: UDP, length 1470
00:09:10.528344 IP 10.0.0.1.36598 > 10.0.0.2.5001: UDP, length 1470
00:09:10.540443 IP 10.0.0.1.36598 > 10.0.0.2.5001: UDP, length 1470
00:09:10.552556 IP 10.0.0.1.36598 > 10.0.0.2.5001: UDP, length 1470
00:09:10.564634 IP 10.0.0.1.36598 > 10.0.0.2.5001: UDP, length 1470
00:09:10.576742 IP 10.0.0.1.36598 > 10.0.0.2.5001: UDP, length 1470
00:09:10.588826 IP 10.0.0.1.36598 > 10.0.0.2.5001: UDP, length 1470
00:09:10.600938 IP 10.0.0.1.36598 > 10.0.0.2.5001: UDP, length 1470
00:09:10.613036 IP 10.0.0.1.36598 > 10.0.0.2.5001: UDP, length 1470
00:09:10.625789 IP 10.0.0.1.36598 > 10.0.0.2.5001: UDP, length 1470
00:09:10.637231 IP 10.0.0.1.36598 > 10.0.0.2.5001: UDP, length 1470
00:09:10.650053 IP 10.0.0.1.36598 > 10.0.0.2.5001: UDP, length 1470
00:09:10.661403 IP 10.0.0.1.36598 > 10.0.0.2.5001: UDP, length 1470
00:09:10.673499 IP 10.0.0.1.36598 > 10.0.0.2.5001: UDP, length 1470
00:09:10.686429 IP 10.0.0.1.36598 > 10.0.0.2.5001: UDP, length 1470
00:09:10.697710 IP 10.0.0.1.36598 > 10.0.0.2.5001: UDP, length 1470
00:09:10.709769 IP 10.0.0.1.36598 > 10.0.0.2.5001: UDP, length 1470
00:09:10.721882 IP 10.0.0.1.36598 > 10.0.0.2.5001: UDP, length 1470
00:09:10.734002 IP 10.0.0.1.36598 > 10.0.0.2.5001: UDP, length 1470
00:09:10.746071 IP 10.0.0.1.36598 > 10.0.0.2.5001: UDP, length 1470
00:09:10.758178 IP 10.0.0.1.36598 > 10.0.0.2.5001: UDP, length 1470
00:09:10.770253 IP 10.0.0.1.36598 > 10.0.0.2.5001: UDP, length 1470
00:09:10.782362 IP 10.0.0.1.36598 > 10.0.0.2.5001: UDP, length 1470
00:09:10.794453 IP 10.0.0.1.36598 > 10.0.0.2.5001: UDP, length 1470
00:09:10.806565 IP 10.0.0.1.36598 > 10.0.0.2.5001: UDP, length 1470
00:09:10.818648 IP 10.0.0.1.36598 > 10.0.0.2.5001: UDP, length 1470
00:09:10.830741 IP 10.0.0.1.36598 > 10.0.0.2.5001: UDP, length 1470
00:09:10.842861 IP 10.0.0.1.36598 > 10.0.0.2.5001: UDP, length 1470
00:09:10.854935 IP 10.0.0.1.36598 > 10.0.0.2.5001: UDP, length 1470
00:09:10.867043 IP 10.0.0.1.36598 > 10.0.0.2.5001: UDP, length 1470
00:09:10.879135 IP 10.0.0.1.36598 > 10.0.0.2.5001: UDP, length 1470
00:09:10.891233 IP 10.0.0.1.36598 > 10.0.0.2.5001: UDP, length 1470
00:09:10.903326 IP 10.0.0.1.36598 > 10.0.0.2.5001: UDP, length 1470
00:09:10.915418 IP 10.0.0.1.36598 > 10.0.0.2.5001: UDP, length 1470
00:09:10.927508 IP 10.0.0.1.36598 > 10.0.0.2.5001: UDP, length 1470
00:09:10.939887 IP 10.0.0.1.36598 > 10.0.0.2.5001: UDP, length 1470
00:09:10.951715 IP 10.0.0.1.36598 > 10.0.0.2.5001: UDP, length 1470
00:09:10.963801 IP 10.0.0.1.36598 > 10.0.0.2.5001: UDP, length 1470
00:09:10.975958 IP 10.0.0.1.36598 > 10.0.0.2.5001: UDP, length 1470
00:09:10.987990 IP 10.0.0.1.36598 > 10.0.0.2.5001: UDP, length 1470
00:09:11.000092 IP 10.0.0.1.36598 > 10.0.0.2.5001: UDP, length 1470
00:09:11.012181 IP 10.0.0.1.36598 > 10.0.0.2.5001: UDP, length 1470
00:09:11.024280 IP 10.0.0.1.36598 > 10.0.0.2.5001: UDP, length 1470
00:09:11.036371 IP 10.0.0.1.36598 > 10.0.0.2.5001: UDP, length 1470
00:09:11.048516 IP 10.0.0.1.36598 > 10.0.0.2.5001: UDP, length 1470
00:09:11.060743 IP 10.0.0.1.36598 > 10.0.0.2.5001: UDP, length 1470
00:09:11.072659 IP 10.0.0.1.36598 > 10.0.0.2.5001: UDP, length 1470
00:09:11.084758 IP 10.0.0.1.36598 > 10.0.0.2.5001: UDP, length 1470
00:09:11.096881 IP 10.0.0.1.36598 > 10.0.0.2.5001: UDP, length 1470
00:09:11.109719 IP 10.0.0.1.36598 > 10.0.0.2.5001: UDP, length 1470
00:09:11.121042 IP 10.0.0.1.36598 > 10.0.0.2.5001: UDP, length 1470
00:09:11.133145 IP 10.0.0.1.36598 > 10.0.0.2.5001: UDP, length 1470
00:09:11.145235 IP 10.0.0.1.36598 > 10.0.0.2.5001: UDP, length 1470
00:09:11.157341 IP 10.0.0.1.36598 > 10.0.0.2.5001: UDP, length 1470
00:09:11.169459 IP 10.0.0.1.36598 > 10.0.0.2.5001: UDP, length 1470
00:09:11.181527 IP 10.0.0.1.36598 > 10.0.0.2.5001: UDP, length 1470
00:09:11.193625 IP 10.0.0.1.36598 > 10.0.0.2.5001: UDP, length 1470
00:09:11.205729 IP 10.0.0.1.36598 > 10.0.0.2.5001: UDP, length 1470
00:09:11.217818 IP 10.0.0.1.36598 > 10.0.0.2.5001: UDP, length 1470
00:09:11.229911 IP 10.0.0.1.36598 > 10.0.0.2.5001: UDP, length 1470
00:09:11.242778 IP 10.0.0.1.36598 > 10.0.0.2.5001: UDP, length 1470
00:09:11.254105 IP 10.0.0.1.36598 > 10.0.0.2.5001: UDP, length 1470
00:09:11.266215 IP 10.0.0.1.36598 > 10.0.0.2.5001: UDP, length 1470
00:09:11.279060 IP 10.0.0.1.36598 > 10.0.0.2.5001: UDP, length 1470
00:09:11.290389 IP 10.0.0.1.36598 > 10.0.0.2.5001: UDP, length 1470
00:09:11.302492 IP 10.0.0.1.36598 > 10.0.0.2.5001: UDP, length 1470
00:09:11.314581 IP 10.0.0.1.36598 > 10.0.0.2.5001: UDP, length 1470
00:09:11.326708 IP 10.0.0.1.36598 > 10.0.0.2.5001: UDP, length 1470
00:09:11.338782 IP 10.0.0.1.36598 > 10.0.0.2.5001: UDP, length 1470
00:09:11.350870 IP 10.0.0.1.36598 > 10.0.0.2.5001: UDP, length 1470
00:09:11.362966 IP 10.0.0.1.36598 > 10.0.0.2.5001: UDP, length 1470
00:09:11.375066 IP 10.0.0.1.36598 > 10.0.0.2.5001: UDP, length 1470
00:09:11.387152 IP 10.0.0.1.36598 > 10.0.0.2.5001: UDP, length 1470
00:09:11.399251 IP 10.0.0.1.36598 > 10.0.0.2.5001: UDP, length 1470
00:09:11.411352 IP 10.0.0.1.36598 > 10.0.0.2.5001: UDP, length 1470
00:09:11.423447 IP 10.0.0.1.36598 > 10.0.0.2.5001: UDP, length 1470
00:09:11.435542 IP 10.0.0.1.36598 > 10.0.0.2.5001: UDP, length 1470
00:09:11.448103 IP 10.0.0.1.36598 > 10.0.0.2.5001: UDP, length 1470
00:09:11.459750 IP 10.0.0.1.36598 > 10.0.0.2.5001: UDP, length 1470
00:09:11.471833 IP 10.0.0.1.36598 > 10.0.0.2.5001: UDP, length 1470
00:09:11.483927 IP 10.0.0.1.36598 > 10.0.0.2.5001: UDP, length 1470
00:09:11.496014 IP 10.0.0.1.36598 > 10.0.0.2.5001: UDP, length 1470
00:09:11.508117 IP 10.0.0.1.36598 > 10.0.0.2.5001: UDP, length 1470
00:09:11.520215 IP 10.0.0.1.36598 > 10.0.0.2.5001: UDP, length 1470
00:09:11.532311 IP 10.0.0.1.36598 > 10.0.0.2.5001: UDP, length 1470
00:09:11.544422 IP 10.0.0.1.36598 > 10.0.0.2.5001: UDP, length 1470
00:09:11.556503 IP 10.0.0.1.36598 > 10.0.0.2.5001: UDP, length 1470
00:09:11.568641 IP 10.0.0.1.36598 > 10.0.0.2.5001: UDP, length 1470
00:09:11.580711 IP 10.0.0.1.36598 > 10.0.0.2.5001: UDP, length 1470
00:09:11.592956 IP 10.0.0.1.36598 > 10.0.0.2.5001: UDP, length 1470
00:09:11.604890 IP 10.0.0.1.36598 > 10.0.0.2.5001: UDP, length 1470
00:09:11.616984 IP 10.0.0.1.36598 > 10.0.0.2.5001: UDP, length 1470
00:09:11.629068 IP 10.0.0.1.36598 > 10.0.0.2.5001: UDP, length 1470
00:09:11.641193 IP 10.0.0.1.36598 > 10.0.0.2.5001: UDP, length 1470
00:09:11.653263 IP 10.0.0.1.36598 > 10.0.0.2.5001: UDP, length 1470
00:09:11.665361 IP 10.0.0.1.36598 > 10.0.0.2.5001: UDP, length 1470
00:09:11.677502 IP 10.0.0.1.36598 > 10.0.0.2.5001: UDP, length 1470
00:09:11.689563 IP 10.0.0.1.36598 > 10.0.0.2.5001: UDP, length 1470
00:09:11.702412 IP 10.0.0.1.36598 > 10.0.0.2.5001: UDP, length 1470
00:09:11.713773 IP 10.0.0.1.36598 > 10.0.0.2.5001: UDP, length 1470
00:09:11.725861 IP 10.0.0.1.36598 > 10.0.0.2.5001: UDP, length 1470
00:09:11.737942 IP 10.0.0.1.36598 > 10.0.0.2.5001: UDP, length 1470
00:09:11.750036 IP 10.0.0.1.36598 > 10.0.0.2.5001: UDP, length 1470
00:09:11.762136 IP 10.0.0.1.36598 > 10.0.0.2.5001: UDP, length 1470
00:09:11.774259 IP 10.0.0.1.36598 > 10.0.0.2.5001: UDP, length 1470
00:09:11.786321 IP 10.0.0.1.36598 > 10.0.0.2.5001: UDP, length 1470
00:09:11.798424 IP 10.0.0.1.36598 > 10.0.0.2.5001: UDP, length 1470
00:09:11.810519 IP 10.0.0.1.36598 > 10.0.0.2.5001: UDP, length 1470
00:09:11.822619 IP 10.0.0.1.36598 > 10.0.0.2.5001: UDP, length 1470
00:09:11.834949 IP 10.0.0.1.36598 > 10.0.0.2.5001: UDP, length 1470
00:09:11.846812 IP 10.0.0.1.36598 > 10.0.0.2.5001: UDP, length 1470
00:09:11.858907 IP 10.0.0.1.36598 > 10.0.0.2.5001: UDP, length 1470
00:09:11.870993 IP 10.0.0.1.36598 > 10.0.0.2.5001: UDP, length 1470
00:09:11.883089 IP 10.0.0.1.36598 > 10.0.0.2.5001: UDP, length 1470
00:09:11.895192 IP 10.0.0.1.36598 > 10.0.0.2.5001: UDP, length 1470
00:09:11.907303 IP 10.0.0.1.36598 > 10.0.0.2.5001: UDP, length 1470
00:09:11.919397 IP 10.0.0.1.36598 > 10.0.0.2.5001: UDP, length 1470
00:09:11.932271 IP 10.0.0.1.36598 > 10.0.0.2.5001: UDP, length 1470
00:09:11.943589 IP 10.0.0.1.36598 > 10.0.0.2.5001: UDP, length 1470
00:09:11.956132 IP 10.0.0.1.36598 > 10.0.0.2.5001: UDP, length 1470
00:09:11.967809 IP 10.0.0.1.36598 > 10.0.0.2.5001: UDP, length 1470
00:09:11.979866 IP 10.0.0.1.36598 > 10.0.0.2.5001: UDP, length 1470
00:09:11.992754 IP 10.0.0.1.36598 > 10.0.0.2.5001: UDP, length 1470
00:09:12.004059 IP 10.0.0.1.36598 > 10.0.0.2.5001: UDP, length 1470
00:09:12.016150 IP 10.0.0.1.36598 > 10.0.0.2.5001: UDP, length 1470
00:09:12.028271 IP 10.0.0.1.36598 > 10.0.0.2.5001: UDP, length 1470
00:09:12.040338 IP 10.0.0.1.36598 > 10.0.0.2.5001: UDP, length 1470
00:09:12.053243 IP 10.0.0.1.36598 > 10.0.0.2.5001: UDP, length 1470
00:09:12.064534 IP 10.0.0.1.36598 > 10.0.0.2.5001: UDP, length 1470
00:09:12.076648 IP 10.0.0.1.36598 > 10.0.0.2.5001: UDP, length 1470
00:09:12.088752 IP 10.0.0.1.36598 > 10.0.0.2.5001: UDP, length 1470
00:09:12.100838 IP 10.0.0.1.36598 > 10.0.0.2.5001: UDP, length 1470
00:09:12.112921 IP 10.0.0.1.36598 > 10.0.0.2.5001: UDP, length 1470
00:09:12.125557 IP 10.0.0.1.36598 > 10.0.0.2.5001: UDP, length 1470
00:09:12.137112 IP 10.0.0.1.36598 > 10.0.0.2.5001: UDP, length 1470
00:09:12.149202 IP 10.0.0.1.36598 > 10.0.0.2.5001: UDP, length 1470
00:09:12.161308 IP 10.0.0.1.36598 > 10.0.0.2.5001: UDP, length 1470
00:09:12.173395 IP 10.0.0.1.36598 > 10.0.0.2.5001: UDP, length 1470
00:09:12.185490 IP 10.0.0.1.36598 > 10.0.0.2.5001: UDP, length 1470
00:09:12.197597 IP 10.0.0.1.36598 > 10.0.0.2.5001: UDP, length 1470
00:09:12.209689 IP 10.0.0.1.36598 > 10.0.0.2.5001: UDP, length 1470
00:09:12.221809 IP 10.0.0.1.36598 > 10.0.0.2.5001: UDP, length 1470
00:09:12.233869 IP 10.0.0.1.36598 > 10.0.0.2.5001: UDP, length 1470
00:09:12.245972 IP 10.0.0.1.36598 > 10.0.0.2.5001: UDP, length 1470
00:09:12.258075 IP 10.0.0.1.36598 > 10.0.0.2.5001: UDP, length 1470
00:09:12.270167 IP 10.0.0.1.36598 > 10.0.0.2.5001: UDP, length 1470
00:09:12.282256 IP 10.0.0.1.36598 > 10.0.0.2.5001: UDP, length 1470
00:09:12.294377 IP 10.0.0.1.36598 > 10.0.0.2.5001: UDP, length 1470
00:09:12.306450 IP 10.0.0.1.36598 > 10.0.0.2.5001: UDP, length 1470
00:09:12.318564 IP 10.0.0.1.36598 > 10.0.0.2.5001: UDP, length 1470
00:09:12.330649 IP 10.0.0.1.36598 > 10.0.0.2.5001: UDP, length 1470
00:09:12.342741 IP 10.0.0.1.36598 > 10.0.0.2.5001: UDP, length 1470
00:09:12.354859 IP 10.0.0.1.36598 > 10.0.0.2.5001: UDP, length 1470
00:09:12.366919 IP 10.0.0.1.36598 > 10.0.0.2.5001: UDP, length 1470
00:09:12.379027 IP 10.0.0.1.36598 > 10.0.0.2.5001: UDP, length 1470
00:09:12.391935 IP 10.0.0.1.36598 > 10.0.0.2.5001: UDP, length 1470
00:09:12.403222 IP 10.0.0.1.36598 > 10.0.0.2.5001: UDP, length 1470
00:09:12.415340 IP 10.0.0.1.36598 > 10.0.0.2.5001: UDP, length 1470
00:09:12.428338 IP 10.0.0.1.36598 > 10.0.0.2.5001: UDP, length 1470
00:09:12.439510 IP 10.0.0.1.36598 > 10.0.0.2.5001: UDP, length 1470
00:09:12.451629 IP 10.0.0.1.36598 > 10.0.0.2.5001: UDP, length 1470
00:09:12.464466 IP 10.0.0.1.36598 > 10.0.0.2.5001: UDP, length 1470
00:09:12.475818 IP 10.0.0.1.36598 > 10.0.0.2.5001: UDP, length 1470
00:09:12.487882 IP 10.0.0.1.36598 > 10.0.0.2.5001: UDP, length 1470
00:09:12.499985 IP 10.0.0.1.36598 > 10.0.0.2.5001: UDP, length 1470
00:09:12.512085 IP 10.0.0.1.36598 > 10.0.0.2.5001: UDP, length 1470
00:09:12.524181 IP 10.0.0.1.36598 > 10.0.0.2.5001: UDP, length 1470
00:09:12.536274 IP 10.0.0.1.36598 > 10.0.0.2.5001: UDP, length 1470
00:09:12.548396 IP 10.0.0.1.36598 > 10.0.0.2.5001: UDP, length 1470
00:09:12.560477 IP 10.0.0.1.36598 > 10.0.0.2.5001: UDP, length 1470
00:09:12.572567 IP 10.0.0.1.36598 > 10.0.0.2.5001: UDP, length 1470
00:09:12.584684 IP 10.0.0.1.36598 > 10.0.0.2.5001: UDP, length 1470
00:09:12.596761 IP 10.0.0.1.36598 > 10.0.0.2.5001: UDP, length 1470
00:09:12.608856 IP 10.0.0.1.36598 > 10.0.0.2.5001: UDP, length 1470
00:09:12.620948 IP 10.0.0.1.36598 > 10.0.0.2.5001: UDP, length 1470
00:09:12.633052 IP 10.0.0.1.36598 > 10.0.0.2.5001: UDP, length 1470
00:09:12.645139 IP 10.0.0.1.36598 > 10.0.0.2.5001: UDP, length 1470
00:09:12.657237 IP 10.0.0.1.36598 > 10.0.0.2.5001: UDP, length 1470
00:09:12.669335 IP 10.0.0.1.36598 > 10.0.0.2.5001: UDP, length 1470
00:09:12.681430 IP 10.0.0.1.36598 > 10.0.0.2.5001: UDP, length 1470
00:09:12.693528 IP 10.0.0.1.36598 > 10.0.0.2.5001: UDP, length 1470
00:09:12.705621 IP 10.0.0.1.36598 > 10.0.0.2.5001: UDP, length 1470
00:09:12.717724 IP 10.0.0.1.36598 > 10.0.0.2.5001: UDP, length 1470
00:09:12.729815 IP 10.0.0.1.36598 > 10.0.0.2.5001: UDP, length 1470
00:09:12.741922 IP 10.0.0.1.36598 > 10.0.0.2.5001: UDP, length 1470
00:09:12.754753 IP 10.0.0.1.36598 > 10.0.0.2.5001: UDP, length 1470
00:09:12.766095 IP 10.0.0.1.36598 > 10.0.0.2.5001: UDP, length 1470
00:09:12.778197 IP 10.0.0.1.36598 > 10.0.0.2.5001: UDP, length 1470
00:09:12.790297 IP 10.0.0.1.36598 > 10.0.0.2.5001: UDP, length 1470
00:09:12.802399 IP 10.0.0.1.36598 > 10.0.0.2.5001: UDP, length 1470
00:09:12.814491 IP 10.0.0.1.36598 > 10.0.0.2.5001: UDP, length 1470
00:09:12.827493 IP 10.0.0.1.36598 > 10.0.0.2.5001: UDP, length 1470
00:09:12.838694 IP 10.0.0.1.36598 > 10.0.0.2.5001: UDP, length 1470
00:09:12.850790 IP 10.0.0.1.36598 > 10.0.0.2.5001: UDP, length 1470
00:09:12.862883 IP 10.0.0.1.36598 > 10.0.0.2.5001: UDP, length 1470
00:09:12.874965 IP 10.0.0.1.36598 > 10.0.0.2.5001: UDP, length 1470
00:09:12.887063 IP 10.0.0.1.36598 > 10.0.0.2.5001: UDP, length 1470
00:09:12.899158 IP 10.0.0.1.36598 > 10.0.0.2.5001: UDP, length 1470
00:09:12.911254 IP 10.0.0.1.36598 > 10.0.0.2.5001: UDP, length 1470
00:09:12.923357 IP 10.0.0.1.36598 > 10.0.0.2.5001: UDP, length 1470
00:09:12.935443 IP 10.0.0.1.36598 > 10.0.0.2.5001: UDP, length 1470
00:09:12.947541 IP 10.0.0.1.36598 > 10.0.0.2.5001: UDP, length 1470
00:09:12.960306 IP 10.0.0.1.36598 > 10.0.0.2.5001: UDP, length 1470
00:09:12.971739 IP 10.0.0.1.36598 > 10.0.0.2.5001: UDP, length 1470
00:09:12.983827 IP 10.0.0.1.36598 > 10.0.0.2.5001: UDP, length 1470
00:09:12.995928 IP 10.0.0.1.36598 > 10.0.0.2.5001: UDP, length 1470
00:09:13.008019 IP 10.0.0.1.36598 > 10.0.0.2.5001: UDP, length 1470
00:09:13.020882 IP 10.0.0.1.36598 > 10.0.0.2.5001: UDP, length 1470
00:09:13.032214 IP 10.0.0.1.36598 > 10.0.0.2.5001: UDP, length 1470
00:09:13.044317 IP 10.0.0.1.36598 > 10.0.0.2.5001: UDP, length 1470
00:09:13.056412 IP 10.0.0.1.36598 > 10.0.0.2.5001: UDP, length 1470
00:09:13.068510 IP 10.0.0.1.36598 > 10.0.0.2.5001: UDP, length 1470
00:09:13.080599 IP 10.0.0.1.36598 > 10.0.0.2.5001: UDP, length 1470
00:09:13.092709 IP 10.0.0.1.36598 > 10.0.0.2.5001: UDP, length 1470
00:09:13.105546 IP 10.0.0.1.36598 > 10.0.0.2.5001: UDP, length 1470
00:09:13.116910 IP 10.0.0.1.36598 > 10.0.0.2.5001: UDP, length 1470
00:09:13.128969 IP 10.0.0.1.36598 > 10.0.0.2.5001: UDP, length 1470
00:09:13.141809 IP 10.0.0.1.36598 > 10.0.0.2.5001: UDP, length 1470
00:09:13.153167 IP 10.0.0.1.36598 > 10.0.0.2.5001: UDP, length 1470
00:09:13.165270 IP 10.0.0.1.36598 > 10.0.0.2.5001: UDP, length 1470
00:09:13.177371 IP 10.0.0.1.36598 > 10.0.0.2.5001: UDP, length 1470
00:09:13.189456 IP 10.0.0.1.36598 > 10.0.0.2.5001: UDP, length 1470
00:09:13.201559 IP 10.0.0.1.36598 > 10.0.0.2.5001: UDP, length 1470
00:09:13.213654 IP 10.0.0.1.36598 > 10.0.0.2.5001: UDP, length 1470
00:09:13.225752 IP 10.0.0.1.36598 > 10.0.0.2.5001: UDP, length 1470
00:09:13.237851 IP 10.0.0.1.36598 > 10.0.0.2.5001: UDP, length 1470
00:09:13.249945 IP 10.0.0.1.36598 > 10.0.0.2.5001: UDP, length 1470
00:09:13.262043 IP 10.0.0.1.36598 > 10.0.0.2.5001: UDP, length 1470
00:09:13.274134 IP 10.0.0.1.36598 > 10.0.0.2.5001: UDP, length 1470
00:09:13.286229 IP 10.0.0.1.36598 > 10.0.0.2.5001: UDP, length 1470
00:09:13.298354 IP 10.0.0.1.36598 > 10.0.0.2.5001: UDP, length 1470
00:09:13.310432 IP 10.0.0.1.36598 > 10.0.0.2.5001: UDP, length 1470
00:09:13.322521 IP 10.0.0.1.36598 > 10.0.0.2.5001: UDP, length 1470
00:09:13.335408 IP 10.0.0.1.36598 > 10.0.0.2.5001: UDP, length 1470
00:09:13.346713 IP 10.0.0.1.36598 > 10.0.0.2.5001: UDP, length 1470
00:09:13.358810 IP 10.0.0.1.36598 > 10.0.0.2.5001: UDP, length 1470
00:09:13.370916 IP 10.0.0.1.36598 > 10.0.0.2.5001: UDP, length 1470
00:09:13.382986 IP 10.0.0.1.36598 > 10.0.0.2.5001: UDP, length 1470
00:09:13.395103 IP 10.0.0.1.36598 > 10.0.0.2.5001: UDP, length 1470
00:09:13.407186 IP 10.0.0.1.36598 > 10.0.0.2.5001: UDP, length 1470
00:09:13.419316 IP 10.0.0.1.36598 > 10.0.0.2.5001: UDP, length 1470
00:09:13.431399 IP 10.0.0.1.36598 > 10.0.0.2.5001: UDP, length 1470
00:09:13.443484 IP 10.0.0.1.36598 > 10.0.0.2.5001: UDP, length 1470
00:09:13.455569 IP 10.0.0.1.36598 > 10.0.0.2.5001: UDP, length 1470
00:09:13.467670 IP 10.0.0.1.36598 > 10.0.0.2.5001: UDP, length 1470
00:09:13.479761 IP 10.0.0.1.36598 > 10.0.0.2.5001: UDP, length 1470
00:09:13.491880 IP 10.0.0.1.36598 > 10.0.0.2.5001: UDP, length 1470
00:09:13.503961 IP 10.0.0.1.36598 > 10.0.0.2.5001: UDP, length 1470
00:09:13.516050 IP 10.0.0.1.36598 > 10.0.0.2.5001: UDP, length 1470
00:09:13.528139 IP 10.0.0.1.36598 > 10.0.0.2.5001: UDP, length 1470
00:09:13.540883 IP 10.0.0.1.36598 > 10.0.0.2.5001: UDP, length 1470
00:09:13.552400 IP 10.0.0.1.36598 > 10.0.0.2.5001: UDP, length 1470
00:09:13.564446 IP 10.0.0.1.36598 > 10.0.0.2.5001: UDP, length 1470
00:09:13.576553 IP 10.0.0.1.36598 > 10.0.0.2.5001: UDP, length 1470
00:09:13.588630 IP 10.0.0.1.36598 > 10.0.0.2.5001: UDP, length 1470
00:09:13.601475 IP 10.0.0.1.36598 > 10.0.0.2.5001: UDP, length 1470
00:09:13.612846 IP 10.0.0.1.36598 > 10.0.0.2.5001: UDP, length 1470
00:09:13.624993 IP 10.0.0.1.36598 > 10.0.0.2.5001: UDP, length 1470
00:09:13.637014 IP 10.0.0.1.36598 > 10.0.0.2.5001: UDP, length 1470
00:09:13.649114 IP 10.0.0.1.36598 > 10.0.0.2.5001: UDP, length 1470
00:09:13.661206 IP 10.0.0.1.36598 > 10.0.0.2.5001: UDP, length 1470
00:09:13.673326 IP 10.0.0.1.36598 > 10.0.0.2.5001: UDP, length 1470
00:09:13.686210 IP 10.0.0.1.36598 > 10.0.0.2.5001: UDP, length 1470
00:09:13.697747 IP 10.0.0.1.36598 > 10.0.0.2.5001: UDP, length 1470
00:09:13.709591 IP 10.0.0.1.36598 > 10.0.0.2.5001: UDP, length 1470
00:09:13.721691 IP 10.0.0.1.36598 > 10.0.0.2.5001: UDP, length 1470
00:09:13.733802 IP 10.0.0.1.36598 > 10.0.0.2.5001: UDP, length 1470
00:09:13.745882 IP 10.0.0.1.36598 > 10.0.0.2.5001: UDP, length 1470
00:09:13.758684 IP 10.0.0.1.36598 > 10.0.0.2.5001: UDP, length 1470
00:09:13.770074 IP 10.0.0.1.36598 > 10.0.0.2.5001: UDP, length 1470
00:09:13.782164 IP 10.0.0.1.36598 > 10.0.0.2.5001: UDP, length 1470
00:09:13.794271 IP 10.0.0.1.36598 > 10.0.0.2.5001: UDP, length 1470
00:09:13.806362 IP 10.0.0.1.36598 > 10.0.0.2.5001: UDP, length 1470
00:09:13.818467 IP 10.0.0.1.36598 > 10.0.0.2.5001: UDP, length 1470
00:09:13.830542 IP 10.0.0.1.36598 > 10.0.0.2.5001: UDP, length 1470
00:09:13.842645 IP 10.0.0.1.36598 > 10.0.0.2.5001: UDP, length 1470
00:09:13.854751 IP 10.0.0.1.36598 > 10.0.0.2.5001: UDP, length 1470
00:09:13.866843 IP 10.0.0.1.36598 > 10.0.0.2.5001: UDP, length 1470
00:09:13.878936 IP 10.0.0.1.36598 > 10.0.0.2.5001: UDP, length 1470
00:09:13.891030 IP 10.0.0.1.36598 > 10.0.0.2.5001: UDP, length 1470
00:09:13.903110 IP 10.0.0.1.36598 > 10.0.0.2.5001: UDP, length 1470
00:09:13.915217 IP 10.0.0.1.36598 > 10.0.0.2.5001: UDP, length 1470
00:09:13.927324 IP 10.0.0.1.36598 > 10.0.0.2.5001: UDP, length 1470
00:09:13.939413 IP 10.0.0.1.36598 > 10.0.0.2.5001: UDP, length 1470
00:09:13.951524 IP 10.0.0.1.36598 > 10.0.0.2.5001: UDP, length 1470
00:09:13.963644 IP 10.0.0.1.36598 > 10.0.0.2.5001: UDP, length 1470
00:09:13.975705 IP 10.0.0.1.36598 > 10.0.0.2.5001: UDP, length 1470
00:09:13.987795 IP 10.0.0.1.36598 > 10.0.0.2.5001: UDP, length 1470
00:09:13.999905 IP 10.0.0.1.36598 > 10.0.0.2.5001: UDP, length 1470
00:09:14.011993 IP 10.0.0.1.36598 > 10.0.0.2.5001: UDP, length 1470
00:09:14.024086 IP 10.0.0.1.36598 > 10.0.0.2.5001: UDP, length 1470
00:09:14.036182 IP 10.0.0.1.36598 > 10.0.0.2.5001: UDP, length 1470
00:09:14.048279 IP 10.0.0.1.36598 > 10.0.0.2.5001: UDP, length 1470
00:09:14.060380 IP 10.0.0.1.36598 > 10.0.0.2.5001: UDP, length 1470
00:09:14.072473 IP 10.0.0.1.36598 > 10.0.0.2.5001: UDP, length 1470
00:09:14.084566 IP 10.0.0.1.36598 > 10.0.0.2.5001: UDP, length 1470
00:09:14.096665 IP 10.0.0.1.36598 > 10.0.0.2.5001: UDP, length 1470
00:09:14.108766 IP 10.0.0.1.36598 > 10.0.0.2.5001: UDP, length 1470
00:09:14.120875 IP 10.0.0.1.36598 > 10.0.0.2.5001: UDP, length 1470
00:09:14.133768 IP 10.0.0.1.36598 > 10.0.0.2.5001: UDP, length 1470
00:09:14.145060 IP 10.0.0.1.36598 > 10.0.0.2.5001: UDP, length 1470
00:09:14.157142 IP 10.0.0.1.36598 > 10.0.0.2.5001: UDP, length 1470
00:09:14.169256 IP 10.0.0.1.36598 > 10.0.0.2.5001: UDP, length 1470
00:09:14.181363 IP 10.0.0.1.36598 > 10.0.0.2.5001: UDP, length 1470
00:09:14.193692 IP 10.0.0.1.36598 > 10.0.0.2.5001: UDP, length 1470
00:09:14.205526 IP 10.0.0.1.36598 > 10.0.0.2.5001: UDP, length 1470
00:09:14.217621 IP 10.0.0.1.36598 > 10.0.0.2.5001: UDP, length 1470
00:09:14.229719 IP 10.0.0.1.36598 > 10.0.0.2.5001: UDP, length 1470
00:09:14.241814 IP 10.0.0.1.36598 > 10.0.0.2.5001: UDP, length 1470
00:09:14.253922 IP 10.0.0.1.36598 > 10.0.0.2.5001: UDP, length 1470
00:09:14.266136 IP 10.0.0.1.36598 > 10.0.0.2.5001: UDP, length 1470
00:09:14.278108 IP 10.0.0.1.36598 > 10.0.0.2.5001: UDP, length 1470
00:09:14.290204 IP 10.0.0.1.36598 > 10.0.0.2.5001: UDP, length 1470
00:09:14.302316 IP 10.0.0.1.36598 > 10.0.0.2.5001: UDP, length 1470
00:09:14.314397 IP 10.0.0.1.36598 > 10.0.0.2.5001: UDP, length 1470
00:09:14.326512 IP 10.0.0.1.36598 > 10.0.0.2.5001: UDP, length 1470
00:09:14.338583 IP 10.0.0.1.36598 > 10.0.0.2.5001: UDP, length 1470
00:09:14.350708 IP 10.0.0.1.36598 > 10.0.0.2.5001: UDP, length 1470
00:09:14.362772 IP 10.0.0.1.36598 > 10.0.0.2.5001: UDP, length 1470
00:09:14.374851 IP 10.0.0.1.36598 > 10.0.0.2.5001: UDP, length 1470
00:09:14.386982 IP 10.0.0.1.36598 > 10.0.0.2.5001: UDP, length 1470
00:09:14.399068 IP 10.0.0.1.36598 > 10.0.0.2.5001: UDP, length 1470
00:09:14.411156 IP 10.0.0.1.36598 > 10.0.0.2.5001: UDP, length 1470
00:09:14.423255 IP 10.0.0.1.36598 > 10.0.0.2.5001: UDP, length 1470
00:09:14.435367 IP 10.0.0.1.36598 > 10.0.0.2.5001: UDP, length 1470
00:09:14.447452 IP 10.0.0.1.36598 > 10.0.0.2.5001: UDP, length 1470
00:09:14.459539 IP 10.0.0.1.36598 > 10.0.0.2.5001: UDP, length 1470
00:09:14.471640 IP 10.0.0.1.36598 > 10.0.0.2.5001: UDP, length 1470
00:09:14.483733 IP 10.0.0.1.36598 > 10.0.0.2.5001: UDP, length 1470
00:09:14.495828 IP 10.0.0.1.36598 > 10.0.0.2.5001: UDP, length 1470
00:09:14.507921 IP 10.0.0.1.36598 > 10.0.0.2.5001: UDP, length 1470
00:09:14.520026 IP 10.0.0.1.36598 > 10.0.0.2.5001: UDP, length 1470
00:09:14.532117 IP 10.0.0.1.36598 > 10.0.0.2.5001: UDP, length 1470
00:09:14.544233 IP 10.0.0.1.36598 > 10.0.0.2.5001: UDP, length 1470
00:09:14.556293 IP 10.0.0.1.36598 > 10.0.0.2.5001: UDP, length 1470
00:09:14.568678 IP 10.0.0.1.36598 > 10.0.0.2.5001: UDP, length 1470
00:09:14.580506 IP 10.0.0.1.36598 > 10.0.0.2.5001: UDP, length 1470
00:09:14.592598 IP 10.0.0.1.36598 > 10.0.0.2.5001: UDP, length 1470
00:09:14.605645 IP 10.0.0.1.36598 > 10.0.0.2.5001: UDP, length 1470
00:09:14.616799 IP 10.0.0.1.36598 > 10.0.0.2.5001: UDP, length 1470
00:09:14.628891 IP 10.0.0.1.36598 > 10.0.0.2.5001: UDP, length 1470
00:09:14.641787 IP 10.0.0.1.36598 > 10.0.0.2.5001: UDP, length 1470
00:09:14.653068 IP 10.0.0.1.36598 > 10.0.0.2.5001: UDP, length 1470
00:09:14.665174 IP 10.0.0.1.36598 > 10.0.0.2.5001: UDP, length 1470
00:09:14.677275 IP 10.0.0.1.36598 > 10.0.0.2.5001: UDP, length 1470
00:09:14.689386 IP 10.0.0.1.36598 > 10.0.0.2.5001: UDP, length 1470
00:09:14.701479 IP 10.0.0.1.36598 > 10.0.0.2.5001: UDP, length 1470
00:09:14.713553 IP 10.0.0.1.36598 > 10.0.0.2.5001: UDP, length 1470
00:09:14.725648 IP 10.0.0.1.36598 > 10.0.0.2.5001: UDP, length 1470
00:09:14.737756 IP 10.0.0.1.36598 > 10.0.0.2.5001: UDP, length 1470
00:09:14.754551 IP 10.0.0.1.36598 > 10.0.0.2.5001: UDP, length 1470
00:09:14.761949 IP 10.0.0.1.36598 > 10.0.0.2.5001: UDP, length 1470
00:09:14.774039 IP 10.0.0.1.36598 > 10.0.0.2.5001: UDP, length 1470
00:09:14.786165 IP 10.0.0.1.36598 > 10.0.0.2.5001: UDP, length 1470
00:09:14.798217 IP 10.0.0.1.36598 > 10.0.0.2.5001: UDP, length 1470
00:09:14.810326 IP 10.0.0.1.36598 > 10.0.0.2.5001: UDP, length 1470
00:09:14.822423 IP 10.0.0.1.36598 > 10.0.0.2.5001: UDP, length 1470
00:09:14.834519 IP 10.0.0.1.36598 > 10.0.0.2.5001: UDP, length 1470
00:09:14.847407 IP 10.0.0.1.36598 > 10.0.0.2.5001: UDP, length 1470
00:09:14.858698 IP 10.0.0.1.36598 > 10.0.0.2.5001: UDP, length 1470
00:09:14.870796 IP 10.0.0.1.36598 > 10.0.0.2.5001: UDP, length 1470
00:09:14.882914 IP 10.0.0.1.36598 > 10.0.0.2.5001: UDP, length 1470
00:09:14.894999 IP 10.0.0.1.36598 > 10.0.0.2.5001: UDP, length 1470
00:09:14.907091 IP 10.0.0.1.36598 > 10.0.0.2.5001: UDP, length 1470
00:09:14.919207 IP 10.0.0.1.36598 > 10.0.0.2.5001: UDP, length 1470
00:09:14.931289 IP 10.0.0.1.36598 > 10.0.0.2.5001: UDP, length 1470
00:09:14.943386 IP 10.0.0.1.36598 > 10.0.0.2.5001: UDP, length 1470
00:09:14.955478 IP 10.0.0.1.36598 > 10.0.0.2.5001: UDP, length 1470
00:09:14.967576 IP 10.0.0.1.36598 > 10.0.0.2.5001: UDP, length 1470
00:09:14.979692 IP 10.0.0.1.36598 > 10.0.0.2.5001: UDP, length 1470
00:09:14.991962 IP 10.0.0.1.36598 > 10.0.0.2.5001: UDP, length 1470
00:09:15.003865 IP 10.0.0.1.36598 > 10.0.0.2.5001: UDP, length 1470
00:09:15.015958 IP 10.0.0.1.36598 > 10.0.0.2.5001: UDP, length 1470
00:09:15.028059 IP 10.0.0.1.36598 > 10.0.0.2.5001: UDP, length 1470
00:09:15.040173 IP 10.0.0.1.36598 > 10.0.0.2.5001: UDP, length 1470
00:09:15.052251 IP 10.0.0.1.36598 > 10.0.0.2.5001: UDP, length 1470
00:09:15.064349 IP 10.0.0.1.36598 > 10.0.0.2.5001: UDP, length 1470
00:09:15.076447 IP 10.0.0.1.36598 > 10.0.0.2.5001: UDP, length 1470
00:09:15.088533 IP 10.0.0.1.36598 > 10.0.0.2.5001: UDP, length 1470
00:09:15.100630 IP 10.0.0.1.36598 > 10.0.0.2.5001: UDP, length 1470
00:09:15.112728 IP 10.0.0.1.36598 > 10.0.0.2.5001: UDP, length 1470
00:09:15.124835 IP 10.0.0.1.36598 > 10.0.0.2.5001: UDP, length 1470
00:09:15.137744 IP 10.0.0.1.36598 > 10.0.0.2.5001: UDP, length 1470
00:09:15.149000 IP 10.0.0.1.36598 > 10.0.0.2.5001: UDP, length 1470
00:09:15.161103 IP 10.0.0.1.36598 > 10.0.0.2.5001: UDP, length 1470
00:09:15.173213 IP 10.0.0.1.36598 > 10.0.0.2.5001: UDP, length 1470
00:09:15.185302 IP 10.0.0.1.36598 > 10.0.0.2.5001: UDP, length 1470
00:09:15.197417 IP 10.0.0.1.36598 > 10.0.0.2.5001: UDP, length 1470
00:09:15.209499 IP 10.0.0.1.36598 > 10.0.0.2.5001: UDP, length 1470
00:09:15.221593 IP 10.0.0.1.36598 > 10.0.0.2.5001: UDP, length 1470
00:09:15.233697 IP 10.0.0.1.36598 > 10.0.0.2.5001: UDP, length 1470
00:09:15.245774 IP 10.0.0.1.36598 > 10.0.0.2.5001: UDP, length 1470
00:09:15.257878 IP 10.0.0.1.36598 > 10.0.0.2.5001: UDP, length 1470
00:09:15.269979 IP 10.0.0.1.36598 > 10.0.0.2.5001: UDP, length 1470
00:09:15.282069 IP 10.0.0.1.36598 > 10.0.0.2.5001: UDP, length 1470
00:09:15.294176 IP 10.0.0.1.36598 > 10.0.0.2.5001: UDP, length 1470
00:09:15.306268 IP 10.0.0.1.36598 > 10.0.0.2.5001: UDP, length 1470
00:09:15.318404 IP 10.0.0.1.36598 > 10.0.0.2.5001: UDP, length 1470
00:09:15.330452 IP 10.0.0.1.36598 > 10.0.0.2.5001: UDP, length 1470
00:09:15.342551 IP 10.0.0.1.36598 > 10.0.0.2.5001: UDP, length 1470
00:09:15.354647 IP 10.0.0.1.36598 > 10.0.0.2.5001: UDP, length 1470
00:09:15.366748 IP 10.0.0.1.36598 > 10.0.0.2.5001: UDP, length 1470
00:09:15.378846 IP 10.0.0.1.36598 > 10.0.0.2.5001: UDP, length 1470
00:09:15.390935 IP 10.0.0.1.36598 > 10.0.0.2.5001: UDP, length 1470
00:09:15.403043 IP 10.0.0.1.36598 > 10.0.0.2.5001: UDP, length 1470
00:09:15.415127 IP 10.0.0.1.36598 > 10.0.0.2.5001: UDP, length 1470
00:09:15.427245 IP 10.0.0.1.36598 > 10.0.0.2.5001: UDP, length 1470
00:09:15.440060 IP 10.0.0.1.36598 > 10.0.0.2.5001: UDP, length 1470
00:09:15.451432 IP 10.0.0.1.36598 > 10.0.0.2.5001: UDP, length 1470
00:09:15.463512 IP 10.0.0.1.36598 > 10.0.0.2.5001: UDP, length 1470
00:09:15.475600 IP 10.0.0.1.36598 > 10.0.0.2.5001: UDP, length 1470
00:09:15.487695 IP 10.0.0.1.36598 > 10.0.0.2.5001: UDP, length 1470
00:09:15.499982 IP 10.0.0.1.36598 > 10.0.0.2.5001: UDP, length 1470
00:09:15.511897 IP 10.0.0.1.36598 > 10.0.0.2.5001: UDP, length 1470
00:09:15.523993 IP 10.0.0.1.36598 > 10.0.0.2.5001: UDP, length 1470
00:09:15.536086 IP 10.0.0.1.36598 > 10.0.0.2.5001: UDP, length 1470
00:09:15.548830 IP 10.0.0.1.36598 > 10.0.0.2.5001: UDP, length 1470
00:09:15.560298 IP 10.0.0.1.36598 > 10.0.0.2.5001: UDP, length 1470
00:09:15.572379 IP 10.0.0.1.36598 > 10.0.0.2.5001: UDP, length 1470
00:09:15.584477 IP 10.0.0.1.36598 > 10.0.0.2.5001: UDP, length 1470
00:09:15.596556 IP 10.0.0.1.36598 > 10.0.0.2.5001: UDP, length 1470
00:09:15.608661 IP 10.0.0.1.36598 > 10.0.0.2.5001: UDP, length 1470
00:09:15.620782 IP 10.0.0.1.36598 > 10.0.0.2.5001: UDP, length 1470
00:09:15.632869 IP 10.0.0.1.36598 > 10.0.0.2.5001: UDP, length 1470
00:09:15.644956 IP 10.0.0.1.36598 > 10.0.0.2.5001: UDP, length 1470
00:09:15.657733 IP 10.0.0.1.36598 > 10.0.0.2.5001: UDP, length 1470
00:09:15.669170 IP 10.0.0.1.36598 > 10.0.0.2.5001: UDP, length 1470
00:09:15.681231 IP 10.0.0.1.36598 > 10.0.0.2.5001: UDP, length 1470
00:09:15.693333 IP 10.0.0.1.36598 > 10.0.0.2.5001: UDP, length 1470
00:09:15.705461 IP 10.0.0.1.36598 > 10.0.0.2.5001: UDP, length 1470
00:09:15.717525 IP 10.0.0.1.36598 > 10.0.0.2.5001: UDP, length 1470
00:09:15.729623 IP 10.0.0.1.36598 > 10.0.0.2.5001: UDP, length 1470
00:09:15.741713 IP 10.0.0.1.36598 > 10.0.0.2.5001: UDP, length 1470
00:09:15.753820 IP 10.0.0.1.36598 > 10.0.0.2.5001: UDP, length 1470
00:09:15.765912 IP 10.0.0.1.36598 > 10.0.0.2.5001: UDP, length 1470
00:09:15.777997 IP 10.0.0.1.36598 > 10.0.0.2.5001: UDP, length 1470
00:09:15.790098 IP 10.0.0.1.36598 > 10.0.0.2.5001: UDP, length 1470
00:09:15.802212 IP 10.0.0.1.36598 > 10.0.0.2.5001: UDP, length 1470
00:09:15.814288 IP 10.0.0.1.36598 > 10.0.0.2.5001: UDP, length 1470
00:09:15.826419 IP 10.0.0.1.36598 > 10.0.0.2.5001: UDP, length 1470
00:09:15.838493 IP 10.0.0.1.36598 > 10.0.0.2.5001: UDP, length 1470
00:09:15.850576 IP 10.0.0.1.36598 > 10.0.0.2.5001: UDP, length 1470
00:09:15.862672 IP 10.0.0.1.36598 > 10.0.0.2.5001: UDP, length 1470
00:09:15.874772 IP 10.0.0.1.36598 > 10.0.0.2.5001: UDP, length 1470
00:09:15.886865 IP 10.0.0.1.36598 > 10.0.0.2.5001: UDP, length 1470
00:09:15.899731 IP 10.0.0.1.36598 > 10.0.0.2.5001: UDP, length 1470
00:09:15.911062 IP 10.0.0.1.36598 > 10.0.0.2.5001: UDP, length 1470
00:09:15.923158 IP 10.0.0.1.36598 > 10.0.0.2.5001: UDP, length 1470
00:09:15.935255 IP 10.0.0.1.36598 > 10.0.0.2.5001: UDP, length 1470
00:09:15.947353 IP 10.0.0.1.36598 > 10.0.0.2.5001: UDP, length 1470
00:09:15.960305 IP 10.0.0.1.36598 > 10.0.0.2.5001: UDP, length 1470
00:09:15.971545 IP 10.0.0.1.36598 > 10.0.0.2.5001: UDP, length 1470
00:09:15.983638 IP 10.0.0.1.36598 > 10.0.0.2.5001: UDP, length 1470
00:09:15.995734 IP 10.0.0.1.36598 > 10.0.0.2.5001: UDP, length 1470
00:09:16.008631 IP 10.0.0.1.36598 > 10.0.0.2.5001: UDP, length 1470
00:09:16.019930 IP 10.0.0.1.36598 > 10.0.0.2.5001: UDP, length 1470
00:09:16.032038 IP 10.0.0.1.36598 > 10.0.0.2.5001: UDP, length 1470
00:09:16.044879 IP 10.0.0.1.36598 > 10.0.0.2.5001: UDP, length 1470
00:09:16.056217 IP 10.0.0.1.36598 > 10.0.0.2.5001: UDP, length 1470
00:09:16.068326 IP 10.0.0.1.36598 > 10.0.0.2.5001: UDP, length 1470
00:09:16.080402 IP 10.0.0.1.36598 > 10.0.0.2.5001: UDP, length 1470
00:09:16.092502 IP 10.0.0.1.36598 > 10.0.0.2.5001: UDP, length 1470
00:09:16.104600 IP 10.0.0.1.36598 > 10.0.0.2.5001: UDP, length 1470
00:09:16.116692 IP 10.0.0.1.36598 > 10.0.0.2.5001: UDP, length 1470
00:09:16.128801 IP 10.0.0.1.36598 > 10.0.0.2.5001: UDP, length 1470
00:09:16.141618 IP 10.0.0.1.36598 > 10.0.0.2.5001: UDP, length 1470
00:09:16.152973 IP 10.0.0.1.36598 > 10.0.0.2.5001: UDP, length 1470
00:09:16.165078 IP 10.0.0.1.36598 > 10.0.0.2.5001: UDP, length 1470
00:09:16.177948 IP 10.0.0.1.36598 > 10.0.0.2.5001: UDP, length 1470
00:09:16.189291 IP 10.0.0.1.36598 > 10.0.0.2.5001: UDP, length 1470
00:09:16.201358 IP 10.0.0.1.36598 > 10.0.0.2.5001: UDP, length 1470
00:09:16.213463 IP 10.0.0.1.36598 > 10.0.0.2.5001: UDP, length 1470
00:09:16.225552 IP 10.0.0.1.36598 > 10.0.0.2.5001: UDP, length 1470
00:09:16.237653 IP 10.0.0.1.36598 > 10.0.0.2.5001: UDP, length 1470
00:09:16.249761 IP 10.0.0.1.36598 > 10.0.0.2.5001: UDP, length 1470
00:09:16.261837 IP 10.0.0.1.36598 > 10.0.0.2.5001: UDP, length 1470
00:09:16.273947 IP 10.0.0.1.36598 > 10.0.0.2.5001: UDP, length 1470
00:09:16.286039 IP 10.0.0.1.36598 > 10.0.0.2.5001: UDP, length 1470
00:09:16.298134 IP 10.0.0.1.36598 > 10.0.0.2.5001: UDP, length 1470
00:09:16.310243 IP 10.0.0.1.36598 > 10.0.0.2.5001: UDP, length 1470
00:09:16.322319 IP 10.0.0.1.36598 > 10.0.0.2.5001: UDP, length 1470
00:09:16.334425 IP 10.0.0.1.36598 > 10.0.0.2.5001: UDP, length 1470
00:09:16.346520 IP 10.0.0.1.36598 > 10.0.0.2.5001: UDP, length 1470
00:09:16.358616 IP 10.0.0.1.36598 > 10.0.0.2.5001: UDP, length 1470
00:09:16.370700 IP 10.0.0.1.36598 > 10.0.0.2.5001: UDP, length 1470
00:09:16.382827 IP 10.0.0.1.36598 > 10.0.0.2.5001: UDP, length 1470
00:09:16.394905 IP 10.0.0.1.36598 > 10.0.0.2.5001: UDP, length 1470
00:09:16.407003 IP 10.0.0.1.36598 > 10.0.0.2.5001: UDP, length 1470
00:09:16.419093 IP 10.0.0.1.36598 > 10.0.0.2.5001: UDP, length 1470
00:09:16.431190 IP 10.0.0.1.36598 > 10.0.0.2.5001: UDP, length 1470
00:09:16.443279 IP 10.0.0.1.36598 > 10.0.0.2.5001: UDP, length 1470
00:09:16.455368 IP 10.0.0.1.36598 > 10.0.0.2.5001: UDP, length 1470
00:09:16.467633 IP 10.0.0.1.36598 > 10.0.0.2.5001: UDP, length 1470
00:09:16.479577 IP 10.0.0.1.36598 > 10.0.0.2.5001: UDP, length 1470
00:09:16.491669 IP 10.0.0.1.36598 > 10.0.0.2.5001: UDP, length 1470
00:09:16.503767 IP 10.0.0.1.36598 > 10.0.0.2.5001: UDP, length 1470
00:09:16.515865 IP 10.0.0.1.36598 > 10.0.0.2.5001: UDP, length 1470
00:09:16.527958 IP 10.0.0.1.36598 > 10.0.0.2.5001: UDP, length 1470
00:09:16.540078 IP 10.0.0.1.36598 > 10.0.0.2.5001: UDP, length 1470
00:09:16.552176 IP 10.0.0.1.36598 > 10.0.0.2.5001: UDP, length 1470
00:09:16.564257 IP 10.0.0.1.36598 > 10.0.0.2.5001: UDP, length 1470
00:09:16.576364 IP 10.0.0.1.36598 > 10.0.0.2.5001: UDP, length 1470
00:09:16.588440 IP 10.0.0.1.36598 > 10.0.0.2.5001: UDP, length 1470
00:09:16.600530 IP 10.0.0.1.36598 > 10.0.0.2.5001: UDP, length 1470
00:09:16.612629 IP 10.0.0.1.36598 > 10.0.0.2.5001: UDP, length 1470
00:09:16.624719 IP 10.0.0.1.36598 > 10.0.0.2.5001: UDP, length 1470
00:09:16.636847 IP 10.0.0.1.36598 > 10.0.0.2.5001: UDP, length 1470
00:09:16.648921 IP 10.0.0.1.36598 > 10.0.0.2.5001: UDP, length 1470
00:09:16.661013 IP 10.0.0.1.36598 > 10.0.0.2.5001: UDP, length 1470
00:09:16.673113 IP 10.0.0.1.36598 > 10.0.0.2.5001: UDP, length 1470
00:09:16.685204 IP 10.0.0.1.36598 > 10.0.0.2.5001: UDP, length 1470
00:09:16.697301 IP 10.0.0.1.36598 > 10.0.0.2.5001: UDP, length 1470
00:09:16.709391 IP 10.0.0.1.36598 > 10.0.0.2.5001: UDP, length 1470
00:09:16.721499 IP 10.0.0.1.36598 > 10.0.0.2.5001: UDP, length 1470
00:09:16.733589 IP 10.0.0.1.36598 > 10.0.0.2.5001: UDP, length 1470
00:09:16.745676 IP 10.0.0.1.36598 > 10.0.0.2.5001: UDP, length 1470
00:09:16.757771 IP 10.0.0.1.36598 > 10.0.0.2.5001: UDP, length 1470
00:09:16.770668 IP 10.0.0.1.36598 > 10.0.0.2.5001: UDP, length 1470
00:09:16.781973 IP 10.0.0.1.36598 > 10.0.0.2.5001: UDP, length 1470
00:09:16.794073 IP 10.0.0.1.36598 > 10.0.0.2.5001: UDP, length 1470
00:09:16.806165 IP 10.0.0.1.36598 > 10.0.0.2.5001: UDP, length 1470
00:09:16.818276 IP 10.0.0.1.36598 > 10.0.0.2.5001: UDP, length 1470
00:09:16.830365 IP 10.0.0.1.36598 > 10.0.0.2.5001: UDP, length 1470
00:09:16.842476 IP 10.0.0.1.36598 > 10.0.0.2.5001: UDP, length 1470
00:09:16.854552 IP 10.0.0.1.36598 > 10.0.0.2.5001: UDP, length 1470
00:09:16.867316 IP 10.0.0.1.36598 > 10.0.0.2.5001: UDP, length 1470
00:09:16.878737 IP 10.0.0.1.36598 > 10.0.0.2.5001: UDP, length 1470
00:09:16.890863 IP 10.0.0.1.36598 > 10.0.0.2.5001: UDP, length 1470
00:09:16.902924 IP 10.0.0.1.36598 > 10.0.0.2.5001: UDP, length 1470
00:09:16.915029 IP 10.0.0.1.36598 > 10.0.0.2.5001: UDP, length 1470
00:09:16.927131 IP 10.0.0.1.36598 > 10.0.0.2.5001: UDP, length 1470
00:09:16.939886 IP 10.0.0.1.36598 > 10.0.0.2.5001: UDP, length 1470
00:09:16.951312 IP 10.0.0.1.36598 > 10.0.0.2.5001: UDP, length 1470
00:09:16.963413 IP 10.0.0.1.36598 > 10.0.0.2.5001: UDP, length 1470
00:09:16.975505 IP 10.0.0.1.36598 > 10.0.0.2.5001: UDP, length 1470
00:09:16.987605 IP 10.0.0.1.36598 > 10.0.0.2.5001: UDP, length 1470
00:09:16.999701 IP 10.0.0.1.36598 > 10.0.0.2.5001: UDP, length 1470
00:09:17.011835 IP 10.0.0.1.36598 > 10.0.0.2.5001: UDP, length 1470
00:09:17.024664 IP 10.0.0.1.36598 > 10.0.0.2.5001: UDP, length 1470
00:09:17.035993 IP 10.0.0.1.36598 > 10.0.0.2.5001: UDP, length 1470
00:09:17.048086 IP 10.0.0.1.36598 > 10.0.0.2.5001: UDP, length 1470
00:09:17.060183 IP 10.0.0.1.36598 > 10.0.0.2.5001: UDP, length 1470
00:09:17.072279 IP 10.0.0.1.36598 > 10.0.0.2.5001: UDP, length 1470
00:09:17.084383 IP 10.0.0.1.36598 > 10.0.0.2.5001: UDP, length 1470
00:09:17.096473 IP 10.0.0.1.36598 > 10.0.0.2.5001: UDP, length 1470
00:09:17.108560 IP 10.0.0.1.36598 > 10.0.0.2.5001: UDP, length 1470
00:09:17.120654 IP 10.0.0.1.36598 > 10.0.0.2.5001: UDP, length 1470
00:09:17.133430 IP 10.0.0.1.36598 > 10.0.0.2.5001: UDP, length 1470
00:09:17.144883 IP 10.0.0.1.36598 > 10.0.0.2.5001: UDP, length 1470
00:09:17.156934 IP 10.0.0.1.36598 > 10.0.0.2.5001: UDP, length 1470
00:09:17.169079 IP 10.0.0.1.36598 > 10.0.0.2.5001: UDP, length 1470
00:09:17.181138 IP 10.0.0.1.36598 > 10.0.0.2.5001: UDP, length 1470
00:09:17.193234 IP 10.0.0.1.36598 > 10.0.0.2.5001: UDP, length 1470
00:09:17.205335 IP 10.0.0.1.36598 > 10.0.0.2.5001: UDP, length 1470
00:09:17.217456 IP 10.0.0.1.36598 > 10.0.0.2.5001: UDP, length 1470
00:09:17.229529 IP 10.0.0.1.36598 > 10.0.0.2.5001: UDP, length 1470
00:09:17.242340 IP 10.0.0.1.36598 > 10.0.0.2.5001: UDP, length 1470
00:09:17.253721 IP 10.0.0.1.36598 > 10.0.0.2.5001: UDP, length 1470
00:09:17.265806 IP 10.0.0.1.36598 > 10.0.0.2.5001: UDP, length 1470
00:09:17.277925 IP 10.0.0.1.36598 > 10.0.0.2.5001: UDP, length 1470
00:09:17.290029 IP 10.0.0.1.36598 > 10.0.0.2.5001: UDP, length 1470
00:09:17.302107 IP 10.0.0.1.36598 > 10.0.0.2.5001: UDP, length 1470
00:09:17.314901 IP 10.0.0.1.36598 > 10.0.0.2.5001: UDP, length 1470
00:09:17.326449 IP 10.0.0.1.36598 > 10.0.0.2.5001: UDP, length 1470
00:09:17.338401 IP 10.0.0.1.36598 > 10.0.0.2.5001: UDP, length 1470
00:09:17.351234 IP 10.0.0.1.36598 > 10.0.0.2.5001: UDP, length 1470
00:09:17.362598 IP 10.0.0.1.36598 > 10.0.0.2.5001: UDP, length 1470
00:09:17.374677 IP 10.0.0.1.36598 > 10.0.0.2.5001: UDP, length 1470
00:09:17.386790 IP 10.0.0.1.36598 > 10.0.0.2.5001: UDP, length 1470
00:09:17.398885 IP 10.0.0.1.36598 > 10.0.0.2.5001: UDP, length 1470
00:09:17.410955 IP 10.0.0.1.36598 > 10.0.0.2.5001: UDP, length 1470
00:09:17.423061 IP 10.0.0.1.36598 > 10.0.0.2.5001: UDP, length 1470
00:09:17.435157 IP 10.0.0.1.36598 > 10.0.0.2.5001: UDP, length 1470
00:09:17.447256 IP 10.0.0.1.36598 > 10.0.0.2.5001: UDP, length 1470
00:09:17.459366 IP 10.0.0.1.36598 > 10.0.0.2.5001: UDP, length 1470
00:09:17.471435 IP 10.0.0.1.36598 > 10.0.0.2.5001: UDP, length 1470
00:09:17.483549 IP 10.0.0.1.36598 > 10.0.0.2.5001: UDP, length 1470
00:09:17.495627 IP 10.0.0.1.36598 > 10.0.0.2.5001: UDP, length 1470
00:09:17.507734 IP 10.0.0.1.36598 > 10.0.0.2.5001: UDP, length 1470
00:09:17.519867 IP 10.0.0.1.36598 > 10.0.0.2.5001: UDP, length 1470
00:09:17.531918 IP 10.0.0.1.36598 > 10.0.0.2.5001: UDP, length 1470
00:09:17.544024 IP 10.0.0.1.36598 > 10.0.0.2.5001: UDP, length 1470
00:09:17.556135 IP 10.0.0.1.36598 > 10.0.0.2.5001: UDP, length 1470
00:09:17.568207 IP 10.0.0.1.36598 > 10.0.0.2.5001: UDP, length 1470
00:09:17.580298 IP 10.0.0.1.36598 > 10.0.0.2.5001: UDP, length 1470
00:09:17.592401 IP 10.0.0.1.36598 > 10.0.0.2.5001: UDP, length 1470
00:09:17.604491 IP 10.0.0.1.36598 > 10.0.0.2.5001: UDP, length 1470
00:09:17.616587 IP 10.0.0.1.36598 > 10.0.0.2.5001: UDP, length 1470
00:09:17.628695 IP 10.0.0.1.36598 > 10.0.0.2.5001: UDP, length 1470
00:09:17.641480 IP 10.0.0.1.36598 > 10.0.0.2.5001: UDP, length 1470
00:09:17.652910 IP 10.0.0.1.36598 > 10.0.0.2.5001: UDP, length 1470
00:09:17.664967 IP 10.0.0.1.36598 > 10.0.0.2.5001: UDP, length 1470
00:09:17.677834 IP 10.0.0.1.36598 > 10.0.0.2.5001: UDP, length 1470
00:09:17.689173 IP 10.0.0.1.36598 > 10.0.0.2.5001: UDP, length 1470
00:09:17.701291 IP 10.0.0.1.36598 > 10.0.0.2.5001: UDP, length 1470
00:09:17.713368 IP 10.0.0.1.36598 > 10.0.0.2.5001: UDP, length 1470
00:09:17.725458 IP 10.0.0.1.36598 > 10.0.0.2.5001: UDP, length 1470
00:09:17.737554 IP 10.0.0.1.36598 > 10.0.0.2.5001: UDP, length 1470
00:09:17.749652 IP 10.0.0.1.36598 > 10.0.0.2.5001: UDP, length 1470
00:09:17.762460 IP 10.0.0.1.36598 > 10.0.0.2.5001: UDP, length 1470
00:09:17.773847 IP 10.0.0.1.36598 > 10.0.0.2.5001: UDP, length 1470
00:09:17.785944 IP 10.0.0.1.36598 > 10.0.0.2.5001: UDP, length 1470
00:09:17.798039 IP 10.0.0.1.36598 > 10.0.0.2.5001: UDP, length 1470
00:09:17.810133 IP 10.0.0.1.36598 > 10.0.0.2.5001: UDP, length 1470
00:09:17.822233 IP 10.0.0.1.36598 > 10.0.0.2.5001: UDP, length 1470
00:09:17.834323 IP 10.0.0.1.36598 > 10.0.0.2.5001: UDP, length 1470
00:09:17.846423 IP 10.0.0.1.36598 > 10.0.0.2.5001: UDP, length 1470
00:09:17.858520 IP 10.0.0.1.36598 > 10.0.0.2.5001: UDP, length 1470
00:09:17.870607 IP 10.0.0.1.36598 > 10.0.0.2.5001: UDP, length 1470
00:09:17.882705 IP 10.0.0.1.36598 > 10.0.0.2.5001: UDP, length 1470
00:09:17.894803 IP 10.0.0.1.36598 > 10.0.0.2.5001: UDP, length 1470
00:09:17.906906 IP 10.0.0.1.36598 > 10.0.0.2.5001: UDP, length 1470
00:09:17.919032 IP 10.0.0.1.36598 > 10.0.0.2.5001: UDP, length 1470
00:09:17.931094 IP 10.0.0.1.36598 > 10.0.0.2.5001: UDP, length 1470
00:09:17.943190 IP 10.0.0.1.36598 > 10.0.0.2.5001: UDP, length 1470
00:09:17.955299 IP 10.0.0.1.36598 > 10.0.0.2.5001: UDP, length 1470
00:09:17.967375 IP 10.0.0.1.36598 > 10.0.0.2.5001: UDP, length 1470
00:09:17.979480 IP 10.0.0.1.36598 > 10.0.0.2.5001: UDP, length 1470
00:09:17.991573 IP 10.0.0.1.36598 > 10.0.0.2.5001: UDP, length 1470
00:09:18.003672 IP 10.0.0.1.36598 > 10.0.0.2.5001: UDP, length 1470
00:09:18.015761 IP 10.0.0.1.36598 > 10.0.0.2.5001: UDP, length 1470
00:09:18.027883 IP 10.0.0.1.36598 > 10.0.0.2.5001: UDP, length 1470
00:09:18.040700 IP 10.0.0.1.36598 > 10.0.0.2.5001: UDP, length 1470
00:09:18.052083 IP 10.0.0.1.36598 > 10.0.0.2.5001: UDP, length 1470
00:09:18.064150 IP 10.0.0.1.36598 > 10.0.0.2.5001: UDP, length 1470
00:09:18.076271 IP 10.0.0.1.36598 > 10.0.0.2.5001: UDP, length 1470
00:09:18.088498 IP 10.0.0.1.36598 > 10.0.0.2.5001: UDP, length 1470
00:09:18.100435 IP 10.0.0.1.36598 > 10.0.0.2.5001: UDP, length 1470
00:09:18.112534 IP 10.0.0.1.36598 > 10.0.0.2.5001: UDP, length 1470
00:09:18.125340 IP 10.0.0.1.36598 > 10.0.0.2.5001: UDP, length 1470
00:09:18.136725 IP 10.0.0.1.36598 > 10.0.0.2.5001: UDP, length 1470
00:09:18.149867 IP 10.0.0.1.36598 > 10.0.0.2.5001: UDP, length 1470
00:09:18.160932 IP 10.0.0.1.36598 > 10.0.0.2.5001: UDP, length 1470
00:09:18.173036 IP 10.0.0.1.36598 > 10.0.0.2.5001: UDP, length 1470
00:09:18.185113 IP 10.0.0.1.36598 > 10.0.0.2.5001: UDP, length 1470
00:09:18.197208 IP 10.0.0.1.36598 > 10.0.0.2.5001: UDP, length 1470
00:09:18.209302 IP 10.0.0.1.36598 > 10.0.0.2.5001: UDP, length 1470
00:09:18.221401 IP 10.0.0.1.36598 > 10.0.0.2.5001: UDP, length 1470
00:09:18.233505 IP 10.0.0.1.36598 > 10.0.0.2.5001: UDP, length 1470
00:09:18.245597 IP 10.0.0.1.36598 > 10.0.0.2.5001: UDP, length 1470
00:09:18.257688 IP 10.0.0.1.36598 > 10.0.0.2.5001: UDP, length 1470
00:09:18.269790 IP 10.0.0.1.36598 > 10.0.0.2.5001: UDP, length 1470
00:09:18.281876 IP 10.0.0.1.36598 > 10.0.0.2.5001: UDP, length 1470
00:09:18.293972 IP 10.0.0.1.36598 > 10.0.0.2.5001: UDP, length 1470
00:09:18.306812 IP 10.0.0.1.36598 > 10.0.0.2.5001: UDP, length 1470
00:09:18.318165 IP 10.0.0.1.36598 > 10.0.0.2.5001: UDP, length 1470
00:09:18.330263 IP 10.0.0.1.36598 > 10.0.0.2.5001: UDP, length 1470
00:09:18.342360 IP 10.0.0.1.36598 > 10.0.0.2.5001: UDP, length 1470
00:09:18.354461 IP 10.0.0.1.36598 > 10.0.0.2.5001: UDP, length 1470
00:09:18.366572 IP 10.0.0.1.36598 > 10.0.0.2.5001: UDP, length 1470
00:09:18.379396 IP 10.0.0.1.36598 > 10.0.0.2.5001: UDP, length 1470
00:09:18.390742 IP 10.0.0.1.36598 > 10.0.0.2.5001: UDP, length 1470
00:09:18.402838 IP 10.0.0.1.36598 > 10.0.0.2.5001: UDP, length 1470
00:09:18.414935 IP 10.0.0.1.36598 > 10.0.0.2.5001: UDP, length 1470
00:09:18.427044 IP 10.0.0.1.36598 > 10.0.0.2.5001: UDP, length 1470
00:09:18.439131 IP 10.0.0.1.36598 > 10.0.0.2.5001: UDP, length 1470
00:09:18.451243 IP 10.0.0.1.36598 > 10.0.0.2.5001: UDP, length 1470
00:09:18.463317 IP 10.0.0.1.36598 > 10.0.0.2.5001: UDP, length 1470
00:09:18.475411 IP 10.0.0.1.36598 > 10.0.0.2.5001: UDP, length 1470
00:09:18.487509 IP 10.0.0.1.36598 > 10.0.0.2.5001: UDP, length 1470
00:09:18.499614 IP 10.0.0.1.36598 > 10.0.0.2.5001: UDP, length 1470
00:09:18.511705 IP 10.0.0.1.36598 > 10.0.0.2.5001: UDP, length 1470
00:09:18.523794 IP 10.0.0.1.36598 > 10.0.0.2.5001: UDP, length 1470
00:09:18.535892 IP 10.0.0.1.36598 > 10.0.0.2.5001: UDP, length 1470
00:09:18.547990 IP 10.0.0.1.36598 > 10.0.0.2.5001: UDP, length 1470
00:09:18.560092 IP 10.0.0.1.36598 > 10.0.0.2.5001: UDP, length 1470
00:09:18.572184 IP 10.0.0.1.36598 > 10.0.0.2.5001: UDP, length 1470
00:09:18.585008 IP 10.0.0.1.36598 > 10.0.0.2.5001: UDP, length 1470
00:09:18.596376 IP 10.0.0.1.36598 > 10.0.0.2.5001: UDP, length 1470
00:09:18.608470 IP 10.0.0.1.36598 > 10.0.0.2.5001: UDP, length 1470
00:09:18.621357 IP 10.0.0.1.36598 > 10.0.0.2.5001: UDP, length 1470
00:09:18.632670 IP 10.0.0.1.36598 > 10.0.0.2.5001: UDP, length 1470
00:09:18.645559 IP 10.0.0.1.36598 > 10.0.0.2.5001: UDP, length 1470
00:09:18.656854 IP 10.0.0.1.36598 > 10.0.0.2.5001: UDP, length 1470
00:09:18.668974 IP 10.0.0.1.36598 > 10.0.0.2.5001: UDP, length 1470
00:09:18.681074 IP 10.0.0.1.36598 > 10.0.0.2.5001: UDP, length 1470
00:09:18.693144 IP 10.0.0.1.36598 > 10.0.0.2.5001: UDP, length 1470
00:09:18.705269 IP 10.0.0.1.36598 > 10.0.0.2.5001: UDP, length 1470
00:09:18.717334 IP 10.0.0.1.36598 > 10.0.0.2.5001: UDP, length 1470
00:09:18.729430 IP 10.0.0.1.36598 > 10.0.0.2.5001: UDP, length 1470
00:09:18.741545 IP 10.0.0.1.36598 > 10.0.0.2.5001: UDP, length 1470
00:09:18.753638 IP 10.0.0.1.36598 > 10.0.0.2.5001: UDP, length 1470
00:09:18.765713 IP 10.0.0.1.36598 > 10.0.0.2.5001: UDP, length 1470
00:09:18.777813 IP 10.0.0.1.36598 > 10.0.0.2.5001: UDP, length 1470
00:09:18.789909 IP 10.0.0.1.36598 > 10.0.0.2.5001: UDP, length 1470
00:09:18.802008 IP 10.0.0.1.36598 > 10.0.0.2.5001: UDP, length 1470
00:09:18.814137 IP 10.0.0.1.36598 > 10.0.0.2.5001: UDP, length 1470
00:09:18.826221 IP 10.0.0.1.36598 > 10.0.0.2.5001: UDP, length 1470
00:09:18.838293 IP 10.0.0.1.36598 > 10.0.0.2.5001: UDP, length 1470
00:09:18.850391 IP 10.0.0.1.36598 > 10.0.0.2.5001: UDP, length 1470
00:09:18.862493 IP 10.0.0.1.36598 > 10.0.0.2.5001: UDP, length 1470
00:09:18.874577 IP 10.0.0.1.36598 > 10.0.0.2.5001: UDP, length 1470
00:09:18.886685 IP 10.0.0.1.36598 > 10.0.0.2.5001: UDP, length 1470
00:09:18.898784 IP 10.0.0.1.36598 > 10.0.0.2.5001: UDP, length 1470
00:09:18.911716 IP 10.0.0.1.36598 > 10.0.0.2.5001: UDP, length 1470
00:09:18.922972 IP 10.0.0.1.36598 > 10.0.0.2.5001: UDP, length 1470
00:09:18.935063 IP 10.0.0.1.36598 > 10.0.0.2.5001: UDP, length 1470
00:09:18.947950 IP 10.0.0.1.36598 > 10.0.0.2.5001: UDP, length 1470
00:09:18.959258 IP 10.0.0.1.36598 > 10.0.0.2.5001: UDP, length 1470
00:09:18.971338 IP 10.0.0.1.36598 > 10.0.0.2.5001: UDP, length 1470
00:09:18.983440 IP 10.0.0.1.36598 > 10.0.0.2.5001: UDP, length 1470
00:09:18.995539 IP 10.0.0.1.36598 > 10.0.0.2.5001: UDP, length 1470
00:09:19.007647 IP 10.0.0.1.36598 > 10.0.0.2.5001: UDP, length 1470
00:09:19.019741 IP 10.0.0.1.36598 > 10.0.0.2.5001: UDP, length 1470
00:09:19.031829 IP 10.0.0.1.36598 > 10.0.0.2.5001: UDP, length 1470
00:09:19.043929 IP 10.0.0.1.36598 > 10.0.0.2.5001: UDP, length 1470
00:09:19.056022 IP 10.0.0.1.36598 > 10.0.0.2.5001: UDP, length 1470
00:09:19.068137 IP 10.0.0.1.36598 > 10.0.0.2.5001: UDP, length 1470
00:09:19.080210 IP 10.0.0.1.36598 > 10.0.0.2.5001: UDP, length 1470
00:09:19.092310 IP 10.0.0.1.36598 > 10.0.0.2.5001: UDP, length 1470
00:09:19.104409 IP 10.0.0.1.36598 > 10.0.0.2.5001: UDP, length 1470
00:09:19.117151 IP 10.0.0.1.36598 > 10.0.0.2.5001: UDP, length 1470
00:09:19.128598 IP 10.0.0.1.36598 > 10.0.0.2.5001: UDP, length 1470
00:09:19.140690 IP 10.0.0.1.36598 > 10.0.0.2.5001: UDP, length 1470
00:09:19.152798 IP 10.0.0.1.36598 > 10.0.0.2.5001: UDP, length 1470
00:09:19.164893 IP 10.0.0.1.36598 > 10.0.0.2.5001: UDP, length 1470
00:09:19.176994 IP 10.0.0.1.36598 > 10.0.0.2.5001: UDP, length 1470
00:09:19.189074 IP 10.0.0.1.36598 > 10.0.0.2.5001: UDP, length 1470
00:09:19.201196 IP 10.0.0.1.36598 > 10.0.0.2.5001: UDP, length 1470
00:09:19.213264 IP 10.0.0.1.36598 > 10.0.0.2.5001: UDP, length 1470
00:09:19.225363 IP 10.0.0.1.36598 > 10.0.0.2.5001: UDP, length 1470
00:09:19.237461 IP 10.0.0.1.36598 > 10.0.0.2.5001: UDP, length 1470
00:09:19.249557 IP 10.0.0.1.36598 > 10.0.0.2.5001: UDP, length 1470
00:09:19.261663 IP 10.0.0.1.36598 > 10.0.0.2.5001: UDP, length 1470
00:09:19.273752 IP 10.0.0.1.36598 > 10.0.0.2.5001: UDP, length 1470
00:09:19.285847 IP 10.0.0.1.36598 > 10.0.0.2.5001: UDP, length 1470
00:09:19.297941 IP 10.0.0.1.36598 > 10.0.0.2.5001: UDP, length 1470
00:09:19.310041 IP 10.0.0.1.36598 > 10.0.0.2.5001: UDP, length 1470
00:09:19.322146 IP 10.0.0.1.36598 > 10.0.0.2.5001: UDP, length 1470
00:09:19.334228 IP 10.0.0.1.36598 > 10.0.0.2.5001: UDP, length 1470
00:09:19.346333 IP 10.0.0.1.36598 > 10.0.0.2.5001: UDP, length 1470
00:09:19.358422 IP 10.0.0.1.36598 > 10.0.0.2.5001: UDP, length 1470
00:09:19.371378 IP 10.0.0.1.36598 > 10.0.0.2.5001: UDP, length 1470
00:09:19.382633 IP 10.0.0.1.36598 > 10.0.0.2.5001: UDP, length 1470
00:09:19.394748 IP 10.0.0.1.36598 > 10.0.0.2.5001: UDP, length 1470
00:09:19.406806 IP 10.0.0.1.36598 > 10.0.0.2.5001: UDP, length 1470
00:09:19.419678 IP 10.0.0.1.36598 > 10.0.0.2.5001: UDP, length 1470
00:09:19.430985 IP 10.0.0.1.36598 > 10.0.0.2.5001: UDP, length 1470
00:09:19.443837 IP 10.0.0.1.36598 > 10.0.0.2.5001: UDP, length 1470
00:09:19.455181 IP 10.0.0.1.36598 > 10.0.0.2.5001: UDP, length 1470
00:09:19.467285 IP 10.0.0.1.36598 > 10.0.0.2.5001: UDP, length 1470
00:09:19.480293 IP 10.0.0.1.36598 > 10.0.0.2.5001: UDP, length 1470
00:09:19.491473 IP 10.0.0.1.36598 > 10.0.0.2.5001: UDP, length 1470
00:09:19.503574 IP 10.0.0.1.36598 > 10.0.0.2.5001: UDP, length 1470
00:09:19.515661 IP 10.0.0.1.36598 > 10.0.0.2.5001: UDP, length 1470
00:09:19.527758 IP 10.0.0.1.36598 > 10.0.0.2.5001: UDP, length 1470
00:09:19.539862 IP 10.0.0.1.36598 > 10.0.0.2.5001: UDP, length 1470
00:09:19.552745 IP 10.0.0.1.36598 > 10.0.0.2.5001: UDP, length 1470
00:09:19.564057 IP 10.0.0.1.36598 > 10.0.0.2.5001: UDP, length 1470
00:09:19.576176 IP 10.0.0.1.36598 > 10.0.0.2.5001: UDP, length 1470
00:09:19.588248 IP 10.0.0.1.36598 > 10.0.0.2.5001: UDP, length 1470
00:09:19.600340 IP 10.0.0.1.36598 > 10.0.0.2.5001: UDP, length 1470
00:09:19.612437 IP 10.0.0.1.36598 > 10.0.0.2.5001: UDP, length 1470
00:09:19.624538 IP 10.0.0.1.36598 > 10.0.0.2.5001: UDP, length 1470
00:09:19.636642 IP 10.0.0.1.36598 > 10.0.0.2.5001: UDP, length 1470
00:09:19.648729 IP 10.0.0.1.36598 > 10.0.0.2.5001: UDP, length 1470
00:09:19.660825 IP 10.0.0.1.36598 > 10.0.0.2.5001: UDP, length 1470
00:09:19.672918 IP 10.0.0.1.36598 > 10.0.0.2.5001: UDP, length 1470
00:09:19.685014 IP 10.0.0.1.36598 > 10.0.0.2.5001: UDP, length 1470
00:09:19.697097 IP 10.0.0.1.36598 > 10.0.0.2.5001: UDP, length 1470
00:09:19.709216 IP 10.0.0.1.36598 > 10.0.0.2.5001: UDP, length 1470
00:09:19.721305 IP 10.0.0.1.36598 > 10.0.0.2.5001: UDP, length 1470
00:09:19.733402 IP 10.0.0.1.36598 > 10.0.0.2.5001: UDP, length 1470
00:09:19.745489 IP 10.0.0.1.36598 > 10.0.0.2.5001: UDP, length 1470
00:09:19.757589 IP 10.0.0.1.36598 > 10.0.0.2.5001: UDP, length 1470
00:09:19.769696 IP 10.0.0.1.36598 > 10.0.0.2.5001: UDP, length 1470
00:09:19.781784 IP 10.0.0.1.36598 > 10.0.0.2.5001: UDP, length 1470
00:09:19.794703 IP 10.0.0.1.36598 > 10.0.0.2.5001: UDP, length 1470
00:09:19.805979 IP 10.0.0.1.36598 > 10.0.0.2.5001: UDP, length 1470
00:09:19.818071 IP 10.0.0.1.36598 > 10.0.0.2.5001: UDP, length 1470
00:09:19.830232 IP 10.0.0.1.36598 > 10.0.0.2.5001: UDP, length 1470
00:09:19.842266 IP 10.0.0.1.36598 > 10.0.0.2.5001: UDP, length 1470
00:09:19.854355 IP 10.0.0.1.36598 > 10.0.0.2.5001: UDP, length 1470
00:09:19.866453 IP 10.0.0.1.36598 > 10.0.0.2.5001: UDP, length 1470
00:09:19.879309 IP 10.0.0.1.36598 > 10.0.0.2.5001: UDP, length 1470
00:09:19.890666 IP 10.0.0.1.36598 > 10.0.0.2.5001: UDP, length 1470
00:09:19.902747 IP 10.0.0.1.36598 > 10.0.0.2.5001: UDP, length 1470
00:09:19.914842 IP 10.0.0.1.36598 > 10.0.0.2.5001: UDP, length 1470
00:09:19.926942 IP 10.0.0.1.36598 > 10.0.0.2.5001: UDP, length 1470
00:09:19.939029 IP 10.0.0.1.36598 > 10.0.0.2.5001: UDP, length 1470
00:09:19.951139 IP 10.0.0.1.36598 > 10.0.0.2.5001: UDP, length 1470
00:09:19.963217 IP 10.0.0.1.36598 > 10.0.0.2.5001: UDP, length 1470
00:09:19.975316 IP 10.0.0.1.36598 > 10.0.0.2.5001: UDP, length 1470
00:09:19.988242 IP 10.0.0.1.36598 > 10.0.0.2.5001: UDP, length 1470
00:09:19.999509 IP 10.0.0.1.36598 > 10.0.0.2.5001: UDP, length 1470
00:09:20.011603 IP 10.0.0.1.36598 > 10.0.0.2.5001: UDP, length 1470
00:09:20.023702 IP 10.0.0.1.36598 > 10.0.0.2.5001: UDP, length 1470
00:09:20.035793 IP 10.0.0.1.36598 > 10.0.0.2.5001: UDP, length 1470
00:09:20.047896 IP 10.0.0.1.36598 > 10.0.0.2.5001: UDP, length 1470
00:09:20.059985 IP 10.0.0.1.36598 > 10.0.0.2.5001: UDP, length 1470
00:09:20.072087 IP 10.0.0.1.36598 > 10.0.0.2.5001: UDP, length 1470
00:09:20.084186 IP 10.0.0.1.36598 > 10.0.0.2.5001: UDP, length 1470
00:09:20.096282 IP 10.0.0.1.36598 > 10.0.0.2.5001: UDP, length 1470
00:09:20.108379 IP 10.0.0.1.36598 > 10.0.0.2.5001: UDP, length 1470
00:09:20.120469 IP 10.0.0.1.36598 > 10.0.0.2.5001: UDP, length 1470
00:09:20.132563 IP 10.0.0.1.36598 > 10.0.0.2.5001: UDP, length 1470
00:09:20.144677 IP 10.0.0.1.36598 > 10.0.0.2.5001: UDP, length 1470
00:09:20.156764 IP 10.0.0.1.36598 > 10.0.0.2.5001: UDP, length 1470
00:09:20.168863 IP 10.0.0.1.36598 > 10.0.0.2.5001: UDP, length 1470
00:09:20.180950 IP 10.0.0.1.36598 > 10.0.0.2.5001: UDP, length 1470
00:09:20.193046 IP 10.0.0.1.36598 > 10.0.0.2.5001: UDP, length 1470
00:09:20.205156 IP 10.0.0.1.36598 > 10.0.0.2.5001: UDP, length 1470
00:09:20.217242 IP 10.0.0.1.36598 > 10.0.0.2.5001: UDP, length 1470
00:09:20.230245 IP 10.0.0.1.36598 > 10.0.0.2.5001: UDP, length 1470
00:09:20.241518 IP 10.0.0.1.36598 > 10.0.0.2.5001: UDP, length 1470
00:09:20.253532 IP 10.0.0.1.36598 > 10.0.0.2.5001: UDP, length 1470
00:09:20.265651 IP 10.0.0.1.36598 > 10.0.0.2.5001: UDP, length 1470
00:09:20.277714 IP 10.0.0.1.36598 > 10.0.0.2.5001: UDP, length 1470
00:09:20.289822 IP 10.0.0.1.36598 > 10.0.0.2.5001: UDP, length 1470
00:09:20.301929 IP 10.0.0.1.36598 > 10.0.0.2.5001: UDP, length 1470
00:09:20.314005 IP 10.0.0.1.36598 > 10.0.0.2.5001: UDP, length 1470
00:09:20.326125 IP 10.0.0.1.36598 > 10.0.0.2.5001: UDP, length 1470
00:09:20.338184 IP 10.0.0.1.36598 > 10.0.0.2.5001: UDP, length 1470
00:09:20.350285 IP 10.0.0.1.36598 > 10.0.0.2.5001: UDP, length 1470
00:09:20.362388 IP 10.0.0.1.36598 > 10.0.0.2.5001: UDP, length 1470
00:09:20.374485 IP 10.0.0.1.36598 > 10.0.0.2.5001: UDP, length 1470
00:09:20.386608 IP 10.0.0.1.36598 > 10.0.0.2.5001: UDP, length 1470
00:09:20.398670 IP 10.0.0.1.36598 > 10.0.0.2.5001: UDP, length 1470
00:09:20.410776 IP 10.0.0.1.36598 > 10.0.0.2.5001: UDP, length 1470
00:09:20.422873 IP 10.0.0.1.36598 > 10.0.0.2.5001: UDP, length 1470
00:09:20.435663 IP 10.0.0.1.36598 > 10.0.0.2.5001: UDP, length 1470
00:09:20.447065 IP 10.0.0.1.36598 > 10.0.0.2.5001: UDP, length 1470
00:09:20.459164 IP 10.0.0.1.36598 > 10.0.0.2.5001: UDP, length 1470
00:09:20.471246 IP 10.0.0.1.36598 > 10.0.0.2.5001: UDP, length 1470
00:09:20.483344 IP 10.0.0.1.36598 > 10.0.0.2.5001: UDP, length 1470
00:09:20.495439 IP 10.0.0.1.36598 > 10.0.0.2.5001: UDP, length 1470
00:09:20.507544 IP 10.0.0.1.36598 > 10.0.0.2.5001: UDP, length 1470
00:09:20.519649 IP 10.0.0.1.36598 > 10.0.0.2.5001: UDP, length 1470
00:09:20.531723 IP 10.0.0.1.36598 > 10.0.0.2.5001: UDP, length 1470
00:09:20.543852 IP 10.0.0.1.36598 > 10.0.0.2.5001: UDP, length 1470
00:09:20.555929 IP 10.0.0.1.36598 > 10.0.0.2.5001: UDP, length 1470
00:09:20.568022 IP 10.0.0.1.36598 > 10.0.0.2.5001: UDP, length 1470
00:09:20.580121 IP 10.0.0.1.36598 > 10.0.0.2.5001: UDP, length 1470
00:09:20.592206 IP 10.0.0.1.36598 > 10.0.0.2.5001: UDP, length 1470
00:09:20.604297 IP 10.0.0.1.36598 > 10.0.0.2.5001: UDP, length 1470
00:09:20.616406 IP 10.0.0.1.36598 > 10.0.0.2.5001: UDP, length 1470
00:09:20.628508 IP 10.0.0.1.36598 > 10.0.0.2.5001: UDP, length 1470
00:09:20.640605 IP 10.0.0.1.36598 > 10.0.0.2.5001: UDP, length 1470
00:09:20.653626 IP 10.0.0.1.36598 > 10.0.0.2.5001: UDP, length 1470
00:09:20.664780 IP 10.0.0.1.36598 > 10.0.0.2.5001: UDP, length 1470
00:09:20.676892 IP 10.0.0.1.36598 > 10.0.0.2.5001: UDP, length 1470
00:09:20.688975 IP 10.0.0.1.36598 > 10.0.0.2.5001: UDP, length 1470
00:09:20.701086 IP 10.0.0.1.36598 > 10.0.0.2.5001: UDP, length 1470
00:09:20.713182 IP 10.0.0.1.36598 > 10.0.0.2.5001: UDP, length 1470
00:09:20.725266 IP 10.0.0.1.36598 > 10.0.0.2.5001: UDP, length 1470
00:09:20.737366 IP 10.0.0.1.36598 > 10.0.0.2.5001: UDP, length 1470
00:09:20.749460 IP 10.0.0.1.36598 > 10.0.0.2.5001: UDP, length 1470
00:09:20.762281 IP 10.0.0.1.36598 > 10.0.0.2.5001: UDP, length 1470
00:09:20.773653 IP 10.0.0.1.36598 > 10.0.0.2.5001: UDP, length 1470
00:09:20.785763 IP 10.0.0.1.36598 > 10.0.0.2.5001: UDP, length 1470
00:09:20.797845 IP 10.0.0.1.36598 > 10.0.0.2.5001: UDP, length 1470
00:09:20.809941 IP 10.0.0.1.36598 > 10.0.0.2.5001: UDP, length 1470
00:09:20.822196 IP 10.0.0.1.36598 > 10.0.0.2.5001: UDP, length 1470
00:09:20.834138 IP 10.0.0.1.36598 > 10.0.0.2.5001: UDP, length 1470
00:09:20.846229 IP 10.0.0.1.36598 > 10.0.0.2.5001: UDP, length 1470
00:09:20.858328 IP 10.0.0.1.36598 > 10.0.0.2.5001: UDP, length 1470
00:09:20.870433 IP 10.0.0.1.36598 > 10.0.0.2.5001: UDP, length 1470
00:09:20.882517 IP 10.0.0.1.36598 > 10.0.0.2.5001: UDP, length 1470
00:09:20.894620 IP 10.0.0.1.36598 > 10.0.0.2.5001: UDP, length 1470
00:09:20.906707 IP 10.0.0.1.36598 > 10.0.0.2.5001: UDP, length 1470
00:09:20.918840 IP 10.0.0.1.36598 > 10.0.0.2.5001: UDP, length 1470
00:09:20.930901 IP 10.0.0.1.36598 > 10.0.0.2.5001: UDP, length 1470
00:09:20.943575 IP 10.0.0.1.36598 > 10.0.0.2.5001: UDP, length 1470
00:09:20.955090 IP 10.0.0.1.36598 > 10.0.0.2.5001: UDP, length 1470
00:09:20.967190 IP 10.0.0.1.36598 > 10.0.0.2.5001: UDP, length 1470
00:09:20.979277 IP 10.0.0.1.36598 > 10.0.0.2.5001: UDP, length 1470
00:09:20.991381 IP 10.0.0.1.36598 > 10.0.0.2.5001: UDP, length 1470
00:09:21.003480 IP 10.0.0.1.36598 > 10.0.0.2.5001: UDP, length 1470
00:09:21.015582 IP 10.0.0.1.36598 > 10.0.0.2.5001: UDP, length 1470
00:09:21.027675 IP 10.0.0.1.36598 > 10.0.0.2.5001: UDP, length 1470
00:09:21.039773 IP 10.0.0.1.36598 > 10.0.0.2.5001: UDP, length 1470
00:09:21.051870 IP 10.0.0.1.36598 > 10.0.0.2.5001: UDP, length 1470
00:09:21.063959 IP 10.0.0.1.36598 > 10.0.0.2.5001: UDP, length 1470
00:09:21.076105 IP 10.0.0.1.36598 > 10.0.0.2.5001: UDP, length 1470
00:09:21.088160 IP 10.0.0.1.36598 > 10.0.0.2.5001: UDP, length 1470
00:09:21.100239 IP 10.0.0.1.36598 > 10.0.0.2.5001: UDP, length 1470
00:09:21.112344 IP 10.0.0.1.36598 > 10.0.0.2.5001: UDP, length 1470
00:09:21.125235 IP 10.0.0.1.36598 > 10.0.0.2.5001: UDP, length 1470
00:09:21.136532 IP 10.0.0.1.36598 > 10.0.0.2.5001: UDP, length 1470
00:09:21.148675 IP 10.0.0.1.36598 > 10.0.0.2.5001: UDP, length 1470
00:09:21.161557 IP 10.0.0.1.36598 > 10.0.0.2.5001: UDP, length 1470
00:09:21.172825 IP 10.0.0.1.36598 > 10.0.0.2.5001: UDP, length 1470
00:09:21.184930 IP 10.0.0.1.36598 > 10.0.0.2.5001: UDP, length 1470
00:09:21.197016 IP 10.0.0.1.36598 > 10.0.0.2.5001: UDP, length 1470
00:09:21.209116 IP 10.0.0.1.36598 > 10.0.0.2.5001: UDP, length 1470
00:09:21.221203 IP 10.0.0.1.36598 > 10.0.0.2.5001: UDP, length 1470
00:09:21.233304 IP 10.0.0.1.36598 > 10.0.0.2.5001: UDP, length 1470
00:09:21.245405 IP 10.0.0.1.36598 > 10.0.0.2.5001: UDP, length 1470
00:09:21.258275 IP 10.0.0.1.36598 > 10.0.0.2.5001: UDP, length 1470
00:09:21.269610 IP 10.0.0.1.36598 > 10.0.0.2.5001: UDP, length 1470
00:09:21.281698 IP 10.0.0.1.36598 > 10.0.0.2.5001: UDP, length 1470
00:09:21.293808 IP 10.0.0.1.36598 > 10.0.0.2.5001: UDP, length 1470
00:09:21.305881 IP 10.0.0.1.36598 > 10.0.0.2.5001: UDP, length 1470
00:09:21.317967 IP 10.0.0.1.36598 > 10.0.0.2.5001: UDP, length 1470
00:09:21.330075 IP 10.0.0.1.36598 > 10.0.0.2.5001: UDP, length 1470

