00:08:44.774362 IP 10.0.0.1.53967 > 10.0.0.2.5001: UDP, length 1470
00:08:44.774429 IP 10.0.0.1.53967 > 10.0.0.2.5001: UDP, length 1470
00:08:44.785764 IP 10.0.0.1.53967 > 10.0.0.2.5001: UDP, length 1470
00:08:44.797854 IP 10.0.0.1.53967 > 10.0.0.2.5001: UDP, length 1470
00:08:44.809962 IP 10.0.0.1.53967 > 10.0.0.2.5001: UDP, length 1470
00:08:44.822293 IP 10.0.0.1.53967 > 10.0.0.2.5001: UDP, length 1470
00:08:44.834151 IP 10.0.0.1.53967 > 10.0.0.2.5001: UDP, length 1470
00:08:44.846260 IP 10.0.0.1.53967 > 10.0.0.2.5001: UDP, length 1470
00:08:44.858369 IP 10.0.0.1.53967 > 10.0.0.2.5001: UDP, length 1470
00:08:44.870459 IP 10.0.0.1.53967 > 10.0.0.2.5001: UDP, length 1470
00:08:44.883363 IP 10.0.0.1.53967 > 10.0.0.2.5001: UDP, length 1470
00:08:44.894687 IP 10.0.0.1.53967 > 10.0.0.2.5001: UDP, length 1470
00:08:44.906734 IP 10.0.0.1.53967 > 10.0.0.2.5001: UDP, length 1470
00:08:44.918867 IP 10.0.0.1.53967 > 10.0.0.2.5001: UDP, length 1470
00:08:44.930945 IP 10.0.0.1.53967 > 10.0.0.2.5001: UDP, length 1470
00:08:44.943052 IP 10.0.0.1.53967 > 10.0.0.2.5001: UDP, length 1470
00:08:44.955162 IP 10.0.0.1.53967 > 10.0.0.2.5001: UDP, length 1470
00:08:44.967220 IP 10.0.0.1.53967 > 10.0.0.2.5001: UDP, length 1470
00:08:44.980070 IP 10.0.0.1.53967 > 10.0.0.2.5001: UDP, length 1470
00:08:44.991429 IP 10.0.0.1.53967 > 10.0.0.2.5001: UDP, length 1470
00:08:45.003512 IP 10.0.0.1.53967 > 10.0.0.2.5001: UDP, length 1470
00:08:45.015721 IP 10.0.0.1.53967 > 10.0.0.2.5001: UDP, length 1470
00:08:45.027723 IP 10.0.0.1.53967 > 10.0.0.2.5001: UDP, length 1470
00:08:45.039805 IP 10.0.0.1.53967 > 10.0.0.2.5001: UDP, length 1470
00:08:45.051923 IP 10.0.0.1.53967 > 10.0.0.2.5001: UDP, length 1470
00:08:45.063982 IP 10.0.0.1.53967 > 10.0.0.2.5001: UDP, length 1470
00:08:45.076905 IP 10.0.0.1.53967 > 10.0.0.2.5001: UDP, length 1470
00:08:45.088214 IP 10.0.0.1.53967 > 10.0.0.2.5001: UDP, length 1470
00:08:45.100278 IP 10.0.0.1.53967 > 10.0.0.2.5001: UDP, length 1470
00:08:45.112384 IP 10.0.0.1.53967 > 10.0.0.2.5001: UDP, length 1470
00:08:45.124482 IP 10.0.0.1.53967 > 10.0.0.2.5001: UDP, length 1470
00:08:45.136577 IP 10.0.0.1.53967 > 10.0.0.2.5001: UDP, length 1470
00:08:45.149094 IP 10.0.0.1.53967 > 10.0.0.2.5001: UDP, length 1470
00:08:45.160784 IP 10.0.0.1.53967 > 10.0.0.2.5001: UDP, length 1470
00:08:45.172856 IP 10.0.0.1.53967 > 10.0.0.2.5001: UDP, length 1470
00:08:45.184949 IP 10.0.0.1.53967 > 10.0.0.2.5001: UDP, length 1470
00:08:45.197079 IP 10.0.0.1.53967 > 10.0.0.2.5001: UDP, length 1470
00:08:45.209153 IP 10.0.0.1.53967 > 10.0.0.2.5001: UDP, length 1470
00:08:45.221267 IP 10.0.0.1.53967 > 10.0.0.2.5001: UDP, length 1470
00:08:45.233351 IP 10.0.0.1.53967 > 10.0.0.2.5001: UDP, length 1470
00:08:45.245445 IP 10.0.0.1.53967 > 10.0.0.2.5001: UDP, length 1470
00:08:45.257529 IP 10.0.0.1.53967 > 10.0.0.2.5001: UDP, length 1470
00:08:45.269642 IP 10.0.0.1.53967 > 10.0.0.2.5001: UDP, length 1470
00:08:45.281733 IP 10.0.0.1.53967 > 10.0.0.2.5001: UDP, length 1470
00:08:45.293846 IP 10.0.0.1.53967 > 10.0.0.2.5001: UDP, length 1470
00:08:45.305915 IP 10.0.0.1.53967 > 10.0.0.2.5001: UDP, length 1470
00:08:45.318019 IP 10.0.0.1.53967 > 10.0.0.2.5001: UDP, length 1470
00:08:45.330115 IP 10.0.0.1.53967 > 10.0.0.2.5001: UDP, length 1470
00:08:45.342209 IP 10.0.0.1.53967 > 10.0.0.2.5001: UDP, length 1470
00:08:45.354306 IP 10.0.0.1.53967 > 10.0.0.2.5001: UDP, length 1470
00:08:45.366409 IP 10.0.0.1.53967 > 10.0.0.2.5001: UDP, length 1470
00:08:45.378657 IP 10.0.0.1.53967 > 10.0.0.2.5001: UDP, length 1470
00:08:45.390594 IP 10.0.0.1.53967 > 10.0.0.2.5001: UDP, length 1470
00:08:45.402679 IP 10.0.0.1.53967 > 10.0.0.2.5001: UDP, length 1470
00:08:45.414785 IP 10.0.0.1.53967 > 10.0.0.2.5001: UDP, length 1470
00:08:45.426872 IP 10.0.0.1.53967 > 10.0.0.2.5001: UDP, length 1470
00:08:45.439818 IP 10.0.0.1.53967 > 10.0.0.2.5001: UDP, length 1470
00:08:45.451095 IP 10.0.0.1.53967 > 10.0.0.2.5001: UDP, length 1470
00:08:45.463169 IP 10.0.0.1.53967 > 10.0.0.2.5001: UDP, length 1470
00:08:45.475256 IP 10.0.0.1.53967 > 10.0.0.2.5001: UDP, length 1470
00:08:45.487385 IP 10.0.0.1.53967 > 10.0.0.2.5001: UDP, length 1470
00:08:45.499458 IP 10.0.0.1.53967 > 10.0.0.2.5001: UDP, length 1470
00:08:45.511551 IP 10.0.0.1.53967 > 10.0.0.2.5001: UDP, length 1470
00:08:45.523634 IP 10.0.0.1.53967 > 10.0.0.2.5001: UDP, length 1470
00:08:45.535742 IP 10.0.0.1.53967 > 10.0.0.2.5001: UDP, length 1470
00:08:45.547845 IP 10.0.0.1.53967 > 10.0.0.2.5001: UDP, length 1470
00:08:45.559938 IP 10.0.0.1.53967 > 10.0.0.2.5001: UDP, length 1470
00:08:45.572035 IP 10.0.0.1.53967 > 10.0.0.2.5001: UDP, length 1470
00:08:45.584128 IP 10.0.0.1.53967 > 10.0.0.2.5001: UDP, length 1470
00:08:45.596216 IP 10.0.0.1.53967 > 10.0.0.2.5001: UDP, length 1470
00:08:45.608315 IP 10.0.0.1.53967 > 10.0.0.2.5001: UDP, length 1470
00:08:45.620412 IP 10.0.0.1.53967 > 10.0.0.2.5001: UDP, length 1470
00:08:45.632519 IP 10.0.0.1.53967 > 10.0.0.2.5001: UDP, length 1470
00:08:45.644615 IP 10.0.0.1.53967 > 10.0.0.2.5001: UDP, length 1470
00:08:45.656702 IP 10.0.0.1.53967 > 10.0.0.2.5001: UDP, length 1470
00:08:45.668824 IP 10.0.0.1.53967 > 10.0.0.2.5001: UDP, length 1470
00:08:45.680915 IP 10.0.0.1.53967 > 10.0.0.2.5001: UDP, length 1470
00:08:45.692984 IP 10.0.0.1.53967 > 10.0.0.2.5001: UDP, length 1470
00:08:45.705090 IP 10.0.0.1.53967 > 10.0.0.2.5001: UDP, length 1470
00:08:45.717180 IP 10.0.0.1.53967 > 10.0.0.2.5001: UDP, length 1470
00:08:45.729281 IP 10.0.0.1.53967 > 10.0.0.2.5001: UDP, length 1470
00:08:45.741380 IP 10.0.0.1.53967 > 10.0.0.2.5001: UDP, length 1470
00:08:45.753487 IP 10.0.0.1.53967 > 10.0.0.2.5001: UDP, length 1470
00:08:45.765566 IP 10.0.0.1.53967 > 10.0.0.2.5001: UDP, length 1470
00:08:45.777659 IP 10.0.0.1.53967 > 10.0.0.2.5001: UDP, length 1470
00:08:45.789756 IP 10.0.0.1.53967 > 10.0.0.2.5001: UDP, length 1470
00:08:45.801855 IP 10.0.0.1.53967 > 10.0.0.2.5001: UDP, length 1470
00:08:45.813950 IP 10.0.0.1.53967 > 10.0.0.2.5001: UDP, length 1470
00:08:45.826827 IP 10.0.0.1.53967 > 10.0.0.2.5001: UDP, length 1470
00:08:45.838142 IP 10.0.0.1.53967 > 10.0.0.2.5001: UDP, length 1470
00:08:45.850232 IP 10.0.0.1.53967 > 10.0.0.2.5001: UDP, length 1470
00:08:45.862649 IP 10.0.0.1.53967 > 10.0.0.2.5001: UDP, length 1470
00:08:45.874442 IP 10.0.0.1.53967 > 10.0.0.2.5001: UDP, length 1470
00:08:45.886528 IP 10.0.0.1.53967 > 10.0.0.2.5001: UDP, length 1470
00:08:45.899333 IP 10.0.0.1.53967 > 10.0.0.2.5001: UDP, length 1470
00:08:45.910717 IP 10.0.0.1.53967 > 10.0.0.2.5001: UDP, length 1470
00:08:45.922816 IP 10.0.0.1.53967 > 10.0.0.2.5001: UDP, length 1470
00:08:45.934924 IP 10.0.0.1.53967 > 10.0.0.2.5001: UDP, length 1470
00:08:45.946994 IP 10.0.0.1.53967 > 10.0.0.2.5001: UDP, length 1470
00:08:45.959853 IP 10.0.0.1.53967 > 10.0.0.2.5001: UDP, length 1470
00:08:45.971206 IP 10.0.0.1.53967 > 10.0.0.2.5001: UDP, length 1470
00:08:45.983929 IP 10.0.0.1.53967 > 10.0.0.2.5001: UDP, length 1470
00:08:45.995423 IP 10.0.0.1.53967 > 10.0.0.2.5001: UDP, length 1470
00:08:46.007494 IP 10.0.0.1.53967 > 10.0.0.2.5001: UDP, length 1470
00:08:46.019595 IP 10.0.0.1.53967 > 10.0.0.2.5001: UDP, length 1470
00:08:46.031674 IP 10.0.0.1.53967 > 10.0.0.2.5001: UDP, length 1470
00:08:46.043776 IP 10.0.0.1.53967 > 10.0.0.2.5001: UDP, length 1470
00:08:46.055894 IP 10.0.0.1.53967 > 10.0.0.2.5001: UDP, length 1470
00:08:46.067959 IP 10.0.0.1.53967 > 10.0.0.2.5001: UDP, length 1470
00:08:46.080064 IP 10.0.0.1.53967 > 10.0.0.2.5001: UDP, length 1470
00:08:46.092155 IP 10.0.0.1.53967 > 10.0.0.2.5001: UDP, length 1470
00:08:46.104251 IP 10.0.0.1.53967 > 10.0.0.2.5001: UDP, length 1470
00:08:46.116349 IP 10.0.0.1.53967 > 10.0.0.2.5001: UDP, length 1470
00:08:46.128454 IP 10.0.0.1.53967 > 10.0.0.2.5001: UDP, length 1470
00:08:46.140540 IP 10.0.0.1.53967 > 10.0.0.2.5001: UDP, length 1470
00:08:46.152625 IP 10.0.0.1.53967 > 10.0.0.2.5001: UDP, length 1470
00:08:46.164739 IP 10.0.0.1.53967 > 10.0.0.2.5001: UDP, length 1470
00:08:46.176843 IP 10.0.0.1.53967 > 10.0.0.2.5001: UDP, length 1470
00:08:46.188925 IP 10.0.0.1.53967 > 10.0.0.2.5001: UDP, length 1470
00:08:46.201047 IP 10.0.0.1.53967 > 10.0.0.2.5001: UDP, length 1470
00:08:46.213120 IP 10.0.0.1.53967 > 10.0.0.2.5001: UDP, length 1470
00:08:46.225207 IP 10.0.0.1.53967 > 10.0.0.2.5001: UDP, length 1470
00:08:46.237308 IP 10.0.0.1.53967 > 10.0.0.2.5001: UDP, length 1470
00:08:46.249405 IP 10.0.0.1.53967 > 10.0.0.2.5001: UDP, length 1470
00:08:46.261517 IP 10.0.0.1.53967 > 10.0.0.2.5001: UDP, length 1470
00:08:46.273620 IP 10.0.0.1.53967 > 10.0.0.2.5001: UDP, length 1470
00:08:46.285680 IP 10.0.0.1.53967 > 10.0.0.2.5001: UDP, length 1470
00:08:46.298586 IP 10.0.0.1.53967 > 10.0.0.2.5001: UDP, length 1470
00:08:46.309888 IP 10.0.0.1.53967 > 10.0.0.2.5001: UDP, length 1470
00:08:46.321985 IP 10.0.0.1.53967 > 10.0.0.2.5001: UDP, length 1470
00:08:46.334108 IP 10.0.0.1.53967 > 10.0.0.2.5001: UDP, length 1470
00:08:46.346180 IP 10.0.0.1.53967 > 10.0.0.2.5001: UDP, length 1470
00:08:46.359020 IP 10.0.0.1.53967 > 10.0.0.2.5001: UDP, length 1470
00:08:46.370363 IP 10.0.0.1.53967 > 10.0.0.2.5001: UDP, length 1470
00:08:46.382461 IP 10.0.0.1.53967 > 10.0.0.2.5001: UDP, length 1470
00:08:46.394567 IP 10.0.0.1.53967 > 10.0.0.2.5001: UDP, length 1470
00:08:46.406662 IP 10.0.0.1.53967 > 10.0.0.2.5001: UDP, length 1470
00:08:46.418751 IP 10.0.0.1.53967 > 10.0.0.2.5001: UDP, length 1470
00:08:46.430836 IP 10.0.0.1.53967 > 10.0.0.2.5001: UDP, length 1470
00:08:46.442936 IP 10.0.0.1.53967 > 10.0.0.2.5001: UDP, length 1470
00:08:46.455038 IP 10.0.0.1.53967 > 10.0.0.2.5001: UDP, length 1470
00:08:46.467132 IP 10.0.0.1.53967 > 10.0.0.2.5001: UDP, length 1470
00:08:46.479231 IP 10.0.0.1.53967 > 10.0.0.2.5001: UDP, length 1470
00:08:46.491328 IP 10.0.0.1.53967 > 10.0.0.2.5001: UDP, length 1470
00:08:46.503425 IP 10.0.0.1.53967 > 10.0.0.2.5001: UDP, length 1470
00:08:46.516248 IP 10.0.0.1.53967 > 10.0.0.2.5001: UDP, length 1470
00:08:46.527613 IP 10.0.0.1.53967 > 10.0.0.2.5001: UDP, length 1470
00:08:46.539726 IP 10.0.0.1.53967 > 10.0.0.2.5001: UDP, length 1470
00:08:46.552603 IP 10.0.0.1.53967 > 10.0.0.2.5001: UDP, length 1470
00:08:46.563898 IP 10.0.0.1.53967 > 10.0.0.2.5001: UDP, length 1470
00:08:46.576025 IP 10.0.0.1.53967 > 10.0.0.2.5001: UDP, length 1470
00:08:46.588093 IP 10.0.0.1.53967 > 10.0.0.2.5001: UDP, length 1470
00:08:46.600188 IP 10.0.0.1.53967 > 10.0.0.2.5001: UDP, length 1470
00:08:46.612295 IP 10.0.0.1.53967 > 10.0.0.2.5001: UDP, length 1470
00:08:46.624381 IP 10.0.0.1.53967 > 10.0.0.2.5001: UDP, length 1470
00:08:46.636473 IP 10.0.0.1.53967 > 10.0.0.2.5001: UDP, length 1470
00:08:46.648575 IP 10.0.0.1.53967 > 10.0.0.2.5001: UDP, length 1470
00:08:46.660695 IP 10.0.0.1.53967 > 10.0.0.2.5001: UDP, length 1470
00:08:46.672768 IP 10.0.0.1.53967 > 10.0.0.2.5001: UDP, length 1470
00:08:46.684862 IP 10.0.0.1.53967 > 10.0.0.2.5001: UDP, length 1470
00:08:46.697763 IP 10.0.0.1.53967 > 10.0.0.2.5001: UDP, length 1470
00:08:46.709053 IP 10.0.0.1.53967 > 10.0.0.2.5001: UDP, length 1470
00:08:46.721177 IP 10.0.0.1.53967 > 10.0.0.2.5001: UDP, length 1470
00:08:46.733988 IP 10.0.0.1.53967 > 10.0.0.2.5001: UDP, length 1470
00:08:46.745341 IP 10.0.0.1.53967 > 10.0.0.2.5001: UDP, length 1470
00:08:46.757437 IP 10.0.0.1.53967 > 10.0.0.2.5001: UDP, length 1470
00:08:46.769537 IP 10.0.0.1.53967 > 10.0.0.2.5001: UDP, length 1470
00:08:46.781628 IP 10.0.0.1.53967 > 10.0.0.2.5001: UDP, length 1470
00:08:46.793735 IP 10.0.0.1.53967 > 10.0.0.2.5001: UDP, length 1470
00:08:46.805822 IP 10.0.0.1.53967 > 10.0.0.2.5001: UDP, length 1470
00:08:46.817914 IP 10.0.0.1.53967 > 10.0.0.2.5001: UDP, length 1470
00:08:46.830796 IP 10.0.0.1.53967 > 10.0.0.2.5001: UDP, length 1470
00:08:46.842127 IP 10.0.0.1.53967 > 10.0.0.2.5001: UDP, length 1470
00:08:46.854348 IP 10.0.0.1.53967 > 10.0.0.2.5001: UDP, length 1470
00:08:46.866303 IP 10.0.0.1.53967 > 10.0.0.2.5001: UDP, length 1470
00:08:46.878445 IP 10.0.0.1.53967 > 10.0.0.2.5001: UDP, length 1470
00:08:46.890493 IP 10.0.0.1.53967 > 10.0.0.2.5001: UDP, length 1470
00:08:46.902589 IP 10.0.0.1.53967 > 10.0.0.2.5001: UDP, length 1470
00:08:46.914698 IP 10.0.0.1.53967 > 10.0.0.2.5001: UDP, length 1470
00:08:46.926802 IP 10.0.0.1.53967 > 10.0.0.2.5001: UDP, length 1470
00:08:46.938883 IP 10.0.0.1.53967 > 10.0.0.2.5001: UDP, length 1470
00:08:46.950984 IP 10.0.0.1.53967 > 10.0.0.2.5001: UDP, length 1470
00:08:46.963069 IP 10.0.0.1.53967 > 10.0.0.2.5001: UDP, length 1470
00:08:46.975183 IP 10.0.0.1.53967 > 10.0.0.2.5001: UDP, length 1470
00:08:46.987268 IP 10.0.0.1.53967 > 10.0.0.2.5001: UDP, length 1470
00:08:46.999362 IP 10.0.0.1.53967 > 10.0.0.2.5001: UDP, length 1470
00:08:47.011454 IP 10.0.0.1.53967 > 10.0.0.2.5001: UDP, length 1470
00:08:47.023553 IP 10.0.0.1.53967 > 10.0.0.2.5001: UDP, length 1470
00:08:47.035648 IP 10.0.0.1.53967 > 10.0.0.2.5001: UDP, length 1470
00:08:47.047748 IP 10.0.0.1.53967 > 10.0.0.2.5001: UDP, length 1470
00:08:47.059842 IP 10.0.0.1.53967 > 10.0.0.2.5001: UDP, length 1470
00:08:47.071937 IP 10.0.0.1.53967 > 10.0.0.2.5001: UDP, length 1470
00:08:47.084029 IP 10.0.0.1.53967 > 10.0.0.2.5001: UDP, length 1470
00:08:47.096119 IP 10.0.0.1.53967 > 10.0.0.2.5001: UDP, length 1470
00:08:47.108232 IP 10.0.0.1.53967 > 10.0.0.2.5001: UDP, length 1470
00:08:47.120317 IP 10.0.0.1.53967 > 10.0.0.2.5001: UDP, length 1470
00:08:47.132971 IP 10.0.0.1.53967 > 10.0.0.2.5001: UDP, length 1470
00:08:47.145321 IP 10.0.0.1.53967 > 10.0.0.2.5001: UDP, length 1470
00:08:47.156606 IP 10.0.0.1.53967 > 10.0.0.2.5001: UDP, length 1470
00:08:47.168721 IP 10.0.0.1.53967 > 10.0.0.2.5001: UDP, length 1470
00:08:47.181662 IP 10.0.0.1.53967 > 10.0.0.2.5001: UDP, length 1470
00:08:47.192887 IP 10.0.0.1.53967 > 10.0.0.2.5001: UDP, length 1470
00:08:47.204990 IP 10.0.0.1.53967 > 10.0.0.2.5001: UDP, length 1470
00:08:47.217758 IP 10.0.0.1.53967 > 10.0.0.2.5001: UDP, length 1470
00:08:47.229204 IP 10.0.0.1.53967 > 10.0.0.2.5001: UDP, length 1470
00:08:47.241280 IP 10.0.0.1.53967 > 10.0.0.2.5001: UDP, length 1470
00:08:47.253371 IP 10.0.0.1.53967 > 10.0.0.2.5001: UDP, length 1470
00:08:47.265469 IP 10.0.0.1.53967 > 10.0.0.2.5001: UDP, length 1470
00:08:47.277564 IP 10.0.0.1.53967 > 10.0.0.2.5001: UDP, length 1470
00:08:47.289688 IP 10.0.0.1.53967 > 10.0.0.2.5001: UDP, length 1470
00:08:47.301769 IP 10.0.0.1.53967 > 10.0.0.2.5001: UDP, length 1470
00:08:47.313855 IP 10.0.0.1.53967 > 10.0.0.2.5001: UDP, length 1470
00:08:47.325954 IP 10.0.0.1.53967 > 10.0.0.2.5001: UDP, length 1470
00:08:47.338045 IP 10.0.0.1.53967 > 10.0.0.2.5001: UDP, length 1470
00:08:47.350134 IP 10.0.0.1.53967 > 10.0.0.2.5001: UDP, length 1470
00:08:47.362230 IP 10.0.0.1.53967 > 10.0.0.2.5001: UDP, length 1470
00:08:47.374339 IP 10.0.0.1.53967 > 10.0.0.2.5001: UDP, length 1470
00:08:47.386456 IP 10.0.0.1.53967 > 10.0.0.2.5001: UDP, length 1470
00:08:47.398528 IP 10.0.0.1.53967 > 10.0.0.2.5001: UDP, length 1470
00:08:47.410615 IP 10.0.0.1.53967 > 10.0.0.2.5001: UDP, length 1470
00:08:47.422713 IP 10.0.0.1.53967 > 10.0.0.2.5001: UDP, length 1470
00:08:47.434814 IP 10.0.0.1.53967 > 10.0.0.2.5001: UDP, length 1470
00:08:47.446902 IP 10.0.0.1.53967 > 10.0.0.2.5001: UDP, length 1470
00:08:47.459005 IP 10.0.0.1.53967 > 10.0.0.2.5001: UDP, length 1470
00:08:47.471110 IP 10.0.0.1.53967 > 10.0.0.2.5001: UDP, length 1470
00:08:47.483216 IP 10.0.0.1.53967 > 10.0.0.2.5001: UDP, length 1470
00:08:47.495292 IP 10.0.0.1.53967 > 10.0.0.2.5001: UDP, length 1470
00:08:47.507390 IP 10.0.0.1.53967 > 10.0.0.2.5001: UDP, length 1470
00:08:47.519509 IP 10.0.0.1.53967 > 10.0.0.2.5001: UDP, length 1470
00:08:47.531584 IP 10.0.0.1.53967 > 10.0.0.2.5001: UDP, length 1470
00:08:47.543674 IP 10.0.0.1.53967 > 10.0.0.2.5001: UDP, length 1470
00:08:47.555777 IP 10.0.0.1.53967 > 10.0.0.2.5001: UDP, length 1470
00:08:47.567866 IP 10.0.0.1.53967 > 10.0.0.2.5001: UDP, length 1470
00:08:47.579963 IP 10.0.0.1.53967 > 10.0.0.2.5001: UDP, length 1470
00:08:47.592061 IP 10.0.0.1.53967 > 10.0.0.2.5001: UDP, length 1470
00:08:47.604155 IP 10.0.0.1.53967 > 10.0.0.2.5001: UDP, length 1470
00:08:47.616252 IP 10.0.0.1.53967 > 10.0.0.2.5001: UDP, length 1470
00:08:47.629088 IP 10.0.0.1.53967 > 10.0.0.2.5001: UDP, length 1470
00:08:47.640440 IP 10.0.0.1.53967 > 10.0.0.2.5001: UDP, length 1470
00:08:47.652681 IP 10.0.0.1.53967 > 10.0.0.2.5001: UDP, length 1470
00:08:47.664629 IP 10.0.0.1.53967 > 10.0.0.2.5001: UDP, length 1470
00:08:47.676752 IP 10.0.0.1.53967 > 10.0.0.2.5001: UDP, length 1470
00:08:47.688833 IP 10.0.0.1.53967 > 10.0.0.2.5001: UDP, length 1470
00:08:47.700985 IP 10.0.0.1.53967 > 10.0.0.2.5001: UDP, length 1470
00:08:47.713023 IP 10.0.0.1.53967 > 10.0.0.2.5001: UDP, length 1470
00:08:47.725121 IP 10.0.0.1.53967 > 10.0.0.2.5001: UDP, length 1470
00:08:47.737232 IP 10.0.0.1.53967 > 10.0.0.2.5001: UDP, length 1470
00:08:47.749309 IP 10.0.0.1.53967 > 10.0.0.2.5001: UDP, length 1470
00:08:47.761409 IP 10.0.0.1.53967 > 10.0.0.2.5001: UDP, length 1470
00:08:47.773592 IP 10.0.0.1.53967 > 10.0.0.2.5001: UDP, length 1470
00:08:47.785597 IP 10.0.0.1.53967 > 10.0.0.2.5001: UDP, length 1470
00:08:47.797695 IP 10.0.0.1.53967 > 10.0.0.2.5001: UDP, length 1470
00:08:47.809797 IP 10.0.0.1.53967 > 10.0.0.2.5001: UDP, length 1470
00:08:47.821889 IP 10.0.0.1.53967 > 10.0.0.2.5001: UDP, length 1470
00:08:47.833981 IP 10.0.0.1.53967 > 10.0.0.2.5001: UDP, length 1470
00:08:47.846075 IP 10.0.0.1.53967 > 10.0.0.2.5001: UDP, length 1470
00:08:47.858173 IP 10.0.0.1.53967 > 10.0.0.2.5001: UDP, length 1470
00:08:47.870271 IP 10.0.0.1.53967 > 10.0.0.2.5001: UDP, length 1470
00:08:47.882368 IP 10.0.0.1.53967 > 10.0.0.2.5001: UDP, length 1470
00:08:47.894473 IP 10.0.0.1.53967 > 10.0.0.2.5001: UDP, length 1470
00:08:47.906562 IP 10.0.0.1.53967 > 10.0.0.2.5001: UDP, length 1470
00:08:47.918649 IP 10.0.0.1.53967 > 10.0.0.2.5001: UDP, length 1470
00:08:47.930754 IP 10.0.0.1.53967 > 10.0.0.2.5001: UDP, length 1470
00:08:47.942839 IP 10.0.0.1.53967 > 10.0.0.2.5001: UDP, length 1470
00:08:47.954943 IP 10.0.0.1.53967 > 10.0.0.2.5001: UDP, length 1470
00:08:47.967054 IP 10.0.0.1.53967 > 10.0.0.2.5001: UDP, length 1470
00:08:47.979142 IP 10.0.0.1.53967 > 10.0.0.2.5001: UDP, length 1470
00:08:47.991225 IP 10.0.0.1.53967 > 10.0.0.2.5001: UDP, length 1470
00:08:48.003324 IP 10.0.0.1.53967 > 10.0.0.2.5001: UDP, length 1470
00:08:48.016169 IP 10.0.0.1.53967 > 10.0.0.2.5001: UDP, length 1470
00:08:48.027515 IP 10.0.0.1.53967 > 10.0.0.2.5001: UDP, length 1470
00:08:48.039614 IP 10.0.0.1.53967 > 10.0.0.2.5001: UDP, length 1470
00:08:48.051695 IP 10.0.0.1.53967 > 10.0.0.2.5001: UDP, length 1470
00:08:48.063821 IP 10.0.0.1.53967 > 10.0.0.2.5001: UDP, length 1470
00:08:48.075912 IP 10.0.0.1.53967 > 10.0.0.2.5001: UDP, length 1470
00:08:48.087997 IP 10.0.0.1.53967 > 10.0.0.2.5001: UDP, length 1470
00:08:48.100096 IP 10.0.0.1.53967 > 10.0.0.2.5001: UDP, length 1470
00:08:48.112189 IP 10.0.0.1.53967 > 10.0.0.2.5001: UDP, length 1470
00:08:48.124302 IP 10.0.0.1.53967 > 10.0.0.2.5001: UDP, length 1470
00:08:48.136372 IP 10.0.0.1.53967 > 10.0.0.2.5001: UDP, length 1470
00:08:48.149196 IP 10.0.0.1.53967 > 10.0.0.2.5001: UDP, length 1470
00:08:48.160569 IP 10.0.0.1.53967 > 10.0.0.2.5001: UDP, length 1470
00:08:48.172670 IP 10.0.0.1.53967 > 10.0.0.2.5001: UDP, length 1470
00:08:48.184816 IP 10.0.0.1.53967 > 10.0.0.2.5001: UDP, length 1470
00:08:48.196862 IP 10.0.0.1.53967 > 10.0.0.2.5001: UDP, length 1470
00:08:48.208957 IP 10.0.0.1.53967 > 10.0.0.2.5001: UDP, length 1470
00:08:48.221788 IP 10.0.0.1.53967 > 10.0.0.2.5001: UDP, length 1470
00:08:48.233149 IP 10.0.0.1.53967 > 10.0.0.2.5001: UDP, length 1470
00:08:48.245274 IP 10.0.0.1.53967 > 10.0.0.2.5001: UDP, length 1470
00:08:48.257334 IP 10.0.0.1.53967 > 10.0.0.2.5001: UDP, length 1470
00:08:48.269454 IP 10.0.0.1.53967 > 10.0.0.2.5001: UDP, length 1470
00:08:48.281533 IP 10.0.0.1.53967 > 10.0.0.2.5001: UDP, length 1470
00:08:48.293627 IP 10.0.0.1.53967 > 10.0.0.2.5001: UDP, length 1470
00:08:48.305730 IP 10.0.0.1.53967 > 10.0.0.2.5001: UDP, length 1470
00:08:48.317822 IP 10.0.0.1.53967 > 10.0.0.2.5001: UDP, length 1470
00:08:48.329926 IP 10.0.0.1.53967 > 10.0.0.2.5001: UDP, length 1470
00:08:48.342014 IP 10.0.0.1.53967 > 10.0.0.2.5001: UDP, length 1470
00:08:48.354112 IP 10.0.0.1.53967 > 10.0.0.2.5001: UDP, length 1470
00:08:48.366207 IP 10.0.0.1.53967 > 10.0.0.2.5001: UDP, length 1470
00:08:48.378299 IP 10.0.0.1.53967 > 10.0.0.2.5001: UDP, length 1470
00:08:48.390400 IP 10.0.0.1.53967 > 10.0.0.2.5001: UDP, length 1470
00:08:48.402492 IP 10.0.0.1.53967 > 10.0.0.2.5001: UDP, length 1470
00:08:48.414590 IP 10.0.0.1.53967 > 10.0.0.2.5001: UDP, length 1470
00:08:48.427545 IP 10.0.0.1.53967 > 10.0.0.2.5001: UDP, length 1470
00:08:48.438777 IP 10.0.0.1.53967 > 10.0.0.2.5001: UDP, length 1470
00:08:48.450919 IP 10.0.0.1.53967 > 10.0.0.2.5001: UDP, length 1470
00:08:48.463798 IP 10.0.0.1.53967 > 10.0.0.2.5001: UDP, length 1470
00:08:48.475071 IP 10.0.0.1.53967 > 10.0.0.2.5001: UDP, length 1470
00:08:48.487174 IP 10.0.0.1.53967 > 10.0.0.2.5001: UDP, length 1470
00:08:48.500144 IP 10.0.0.1.53967 > 10.0.0.2.5001: UDP, length 1470
00:08:48.511381 IP 10.0.0.1.53967 > 10.0.0.2.5001: UDP, length 1470
00:08:48.523451 IP 10.0.0.1.53967 > 10.0.0.2.5001: UDP, length 1470
00:08:48.536344 IP 10.0.0.1.53967 > 10.0.0.2.5001: UDP, length 1470
00:08:48.547646 IP 10.0.0.1.53967 > 10.0.0.2.5001: UDP, length 1470
00:08:48.559741 IP 10.0.0.1.53967 > 10.0.0.2.5001: UDP, length 1470
00:08:48.571839 IP 10.0.0.1.53967 > 10.0.0.2.5001: UDP, length 1470
00:08:48.583940 IP 10.0.0.1.53967 > 10.0.0.2.5001: UDP, length 1470
00:08:48.596026 IP 10.0.0.1.53967 > 10.0.0.2.5001: UDP, length 1470
00:08:48.608126 IP 10.0.0.1.53967 > 10.0.0.2.5001: UDP, length 1470
00:08:48.620222 IP 10.0.0.1.53967 > 10.0.0.2.5001: UDP, length 1470
00:08:48.632318 IP 10.0.0.1.53967 > 10.0.0.2.5001: UDP, length 1470
00:08:48.644406 IP 10.0.0.1.53967 > 10.0.0.2.5001: UDP, length 1470
00:08:48.657260 IP 10.0.0.1.53967 > 10.0.0.2.5001: UDP, length 1470
00:08:48.668635 IP 10.0.0.1.53967 > 10.0.0.2.5001: UDP, length 1470
00:08:48.680703 IP 10.0.0.1.53967 > 10.0.0.2.5001: UDP, length 1470
00:08:48.692804 IP 10.0.0.1.53967 > 10.0.0.2.5001: UDP, length 1470
00:08:48.704920 IP 10.0.0.1.53967 > 10.0.0.2.5001: UDP, length 1470
00:08:48.716976 IP 10.0.0.1.53967 > 10.0.0.2.5001: UDP, length 1470
00:08:48.729093 IP 10.0.0.1.53967 > 10.0.0.2.5001: UDP, length 1470
00:08:48.741181 IP 10.0.0.1.53967 > 10.0.0.2.5001: UDP, length 1470
00:08:48.753265 IP 10.0.0.1.53967 > 10.0.0.2.5001: UDP, length 1470
00:08:48.765383 IP 10.0.0.1.53967 > 10.0.0.2.5001: UDP, length 1470
00:08:48.777470 IP 10.0.0.1.53967 > 10.0.0.2.5001: UDP, length 1470
00:08:48.789566 IP 10.0.0.1.53967 > 10.0.0.2.5001: UDP, length 1470
00:08:48.801673 IP 10.0.0.1.53967 > 10.0.0.2.5001: UDP, length 1470
00:08:48.813754 IP 10.0.0.1.53967 > 10.0.0.2.5001: UDP, length 1470
00:08:48.825871 IP 10.0.0.1.53967 > 10.0.0.2.5001: UDP, length 1470
00:08:48.837942 IP 10.0.0.1.53967 > 10.0.0.2.5001: UDP, length 1470
00:08:48.850060 IP 10.0.0.1.53967 > 10.0.0.2.5001: UDP, length 1470
00:08:48.862141 IP 10.0.0.1.53967 > 10.0.0.2.5001: UDP, length 1470
00:08:48.875068 IP 10.0.0.1.53967 > 10.0.0.2.5001: UDP, length 1470
00:08:48.886335 IP 10.0.0.1.53967 > 10.0.0.2.5001: UDP, length 1470
00:08:48.898426 IP 10.0.0.1.53967 > 10.0.0.2.5001: UDP, length 1470
00:08:48.910526 IP 10.0.0.1.53967 > 10.0.0.2.5001: UDP, length 1470
00:08:48.922628 IP 10.0.0.1.53967 > 10.0.0.2.5001: UDP, length 1470
00:08:48.934712 IP 10.0.0.1.53967 > 10.0.0.2.5001: UDP, length 1470
00:08:48.946823 IP 10.0.0.1.53967 > 10.0.0.2.5001: UDP, length 1470
00:08:48.959086 IP 10.0.0.1.53967 > 10.0.0.2.5001: UDP, length 1470
00:08:48.971882 IP 10.0.0.1.53967 > 10.0.0.2.5001: UDP, length 1470
00:08:48.983101 IP 10.0.0.1.53967 > 10.0.0.2.5001: UDP, length 1470
00:08:48.995194 IP 10.0.0.1.53967 > 10.0.0.2.5001: UDP, length 1470
00:08:49.007294 IP 10.0.0.1.53967 > 10.0.0.2.5001: UDP, length 1470
00:08:49.019402 IP 10.0.0.1.53967 > 10.0.0.2.5001: UDP, length 1470
00:08:49.031473 IP 10.0.0.1.53967 > 10.0.0.2.5001: UDP, length 1470
00:08:49.043599 IP 10.0.0.1.53967 > 10.0.0.2.5001: UDP, length 1470
00:08:49.055677 IP 10.0.0.1.53967 > 10.0.0.2.5001: UDP, length 1470
00:08:49.067773 IP 10.0.0.1.53967 > 10.0.0.2.5001: UDP, length 1470
00:08:49.079896 IP 10.0.0.1.53967 > 10.0.0.2.5001: UDP, length 1470
00:08:49.091955 IP 10.0.0.1.53967 > 10.0.0.2.5001: UDP, length 1470
00:08:49.104217 IP 10.0.0.1.53967 > 10.0.0.2.5001: UDP, length 1470
00:08:49.116156 IP 10.0.0.1.53967 > 10.0.0.2.5001: UDP, length 1470
00:08:49.128239 IP 10.0.0.1.53967 > 10.0.0.2.5001: UDP, length 1470
00:08:49.140363 IP 10.0.0.1.53967 > 10.0.0.2.5001: UDP, length 1470
00:08:49.152463 IP 10.0.0.1.53967 > 10.0.0.2.5001: UDP, length 1470
00:08:49.164544 IP 10.0.0.1.53967 > 10.0.0.2.5001: UDP, length 1470
00:08:49.176654 IP 10.0.0.1.53967 > 10.0.0.2.5001: UDP, length 1470
00:08:49.188732 IP 10.0.0.1.53967 > 10.0.0.2.5001: UDP, length 1470
00:08:49.200829 IP 10.0.0.1.53967 > 10.0.0.2.5001: UDP, length 1470
00:08:49.212933 IP 10.0.0.1.53967 > 10.0.0.2.5001: UDP, length 1470
00:08:49.225018 IP 10.0.0.1.53967 > 10.0.0.2.5001: UDP, length 1470
00:08:49.237117 IP 10.0.0.1.53967 > 10.0.0.2.5001: UDP, length 1470
00:08:49.249207 IP 10.0.0.1.53967 > 10.0.0.2.5001: UDP, length 1470
00:08:49.261312 IP 10.0.0.1.53967 > 10.0.0.2.5001: UDP, length 1470
00:08:49.273418 IP 10.0.0.1.53967 > 10.0.0.2.5001: UDP, length 1470
00:08:49.285505 IP 10.0.0.1.53967 > 10.0.0.2.5001: UDP, length 1470
00:08:49.297592 IP 10.0.0.1.53967 > 10.0.0.2.5001: UDP, length 1470
00:08:49.309699 IP 10.0.0.1.53967 > 10.0.0.2.5001: UDP, length 1470
00:08:49.321793 IP 10.0.0.1.53967 > 10.0.0.2.5001: UDP, length 1470
00:08:49.334741 IP 10.0.0.1.53967 > 10.0.0.2.5001: UDP, length 1470
00:08:49.345966 IP 10.0.0.1.53967 > 10.0.0.2.5001: UDP, length 1470
00:08:49.358077 IP 10.0.0.1.53967 > 10.0.0.2.5001: UDP, length 1470
00:08:49.370179 IP 10.0.0.1.53967 > 10.0.0.2.5001: UDP, length 1470
00:08:49.382269 IP 10.0.0.1.53967 > 10.0.0.2.5001: UDP, length 1470
00:08:49.394382 IP 10.0.0.1.53967 > 10.0.0.2.5001: UDP, length 1470
00:08:49.406464 IP 10.0.0.1.53967 > 10.0.0.2.5001: UDP, length 1470
00:08:49.418586 IP 10.0.0.1.53967 > 10.0.0.2.5001: UDP, length 1470
00:08:49.430649 IP 10.0.0.1.53967 > 10.0.0.2.5001: UDP, length 1470
00:08:49.442752 IP 10.0.0.1.53967 > 10.0.0.2.5001: UDP, length 1470
00:08:49.454867 IP 10.0.0.1.53967 > 10.0.0.2.5001: UDP, length 1470
00:08:49.466930 IP 10.0.0.1.53967 > 10.0.0.2.5001: UDP, length 1470
00:08:49.479034 IP 10.0.0.1.53967 > 10.0.0.2.5001: UDP, length 1470
00:08:49.491133 IP 10.0.0.1.53967 > 10.0.0.2.5001: UDP, length 1470
00:08:49.503238 IP 10.0.0.1.53967 > 10.0.0.2.5001: UDP, length 1470
00:08:49.515361 IP 10.0.0.1.53967 > 10.0.0.2.5001: UDP, length 1470
00:08:49.527426 IP 10.0.0.1.53967 > 10.0.0.2.5001: UDP, length 1470
00:08:49.539519 IP 10.0.0.1.53967 > 10.0.0.2.5001: UDP, length 1470
00:08:49.551629 IP 10.0.0.1.53967 > 10.0.0.2.5001: UDP, length 1470
00:08:49.563709 IP 10.0.0.1.53967 > 10.0.0.2.5001: UDP, length 1470
00:08:49.575817 IP 10.0.0.1.53967 > 10.0.0.2.5001: UDP, length 1470
00:08:49.587905 IP 10.0.0.1.53967 > 10.0.0.2.5001: UDP, length 1470
00:08:49.599995 IP 10.0.0.1.53967 > 10.0.0.2.5001: UDP, length 1470
00:08:49.612096 IP 10.0.0.1.53967 > 10.0.0.2.5001: UDP, length 1470
00:08:49.624193 IP 10.0.0.1.53967 > 10.0.0.2.5001: UDP, length 1470
00:08:49.636284 IP 10.0.0.1.53967 > 10.0.0.2.5001: UDP, length 1470
00:08:49.648382 IP 10.0.0.1.53967 > 10.0.0.2.5001: UDP, length 1470
00:08:49.660497 IP 10.0.0.1.53967 > 10.0.0.2.5001: UDP, length 1470
00:08:49.672570 IP 10.0.0.1.53967 > 10.0.0.2.5001: UDP, length 1470
00:08:49.684669 IP 10.0.0.1.53967 > 10.0.0.2.5001: UDP, length 1470
00:08:49.696780 IP 10.0.0.1.53967 > 10.0.0.2.5001: UDP, length 1470
00:08:49.708861 IP 10.0.0.1.53967 > 10.0.0.2.5001: UDP, length 1470
00:08:49.720958 IP 10.0.0.1.53967 > 10.0.0.2.5001: UDP, length 1470
00:08:49.733084 IP 10.0.0.1.53967 > 10.0.0.2.5001: UDP, length 1470
00:08:49.745152 IP 10.0.0.1.53967 > 10.0.0.2.5001: UDP, length 1470
00:08:49.757265 IP 10.0.0.1.53967 > 10.0.0.2.5001: UDP, length 1470
00:08:49.769359 IP 10.0.0.1.53967 > 10.0.0.2.5001: UDP, length 1470
00:08:49.781434 IP 10.0.0.1.53967 > 10.0.0.2.5001: UDP, length 1470
00:08:49.793549 IP 10.0.0.1.53967 > 10.0.0.2.5001: UDP, length 1470
00:08:49.805636 IP 10.0.0.1.53967 > 10.0.0.2.5001: UDP, length 1470
00:08:49.818495 IP 10.0.0.1.53967 > 10.0.0.2.5001: UDP, length 1470
00:08:49.829832 IP 10.0.0.1.53967 > 10.0.0.2.5001: UDP, length 1470
00:08:49.841919 IP 10.0.0.1.53967 > 10.0.0.2.5001: UDP, length 1470
00:08:49.854033 IP 10.0.0.1.53967 > 10.0.0.2.5001: UDP, length 1470
00:08:49.866101 IP 10.0.0.1.53967 > 10.0.0.2.5001: UDP, length 1470
00:08:49.878200 IP 10.0.0.1.53967 > 10.0.0.2.5001: UDP, length 1470
00:08:49.890303 IP 10.0.0.1.53967 > 10.0.0.2.5001: UDP, length 1470
00:08:49.902397 IP 10.0.0.1.53967 > 10.0.0.2.5001: UDP, length 1470
00:08:49.914511 IP 10.0.0.1.53967 > 10.0.0.2.5001: UDP, length 1470
00:08:49.926604 IP 10.0.0.1.53967 > 10.0.0.2.5001: UDP, length 1470
00:08:49.938691 IP 10.0.0.1.53967 > 10.0.0.2.5001: UDP, length 1470
00:08:49.950785 IP 10.0.0.1.53967 > 10.0.0.2.5001: UDP, length 1470
00:08:49.962877 IP 10.0.0.1.53967 > 10.0.0.2.5001: UDP, length 1470
00:08:49.974968 IP 10.0.0.1.53967 > 10.0.0.2.5001: UDP, length 1470
00:08:49.987085 IP 10.0.0.1.53967 > 10.0.0.2.5001: UDP, length 1470
00:08:49.999902 IP 10.0.0.1.53967 > 10.0.0.2.5001: UDP, length 1470
00:08:50.011260 IP 10.0.0.1.53967 > 10.0.0.2.5001: UDP, length 1470
00:08:50.023357 IP 10.0.0.1.53967 > 10.0.0.2.5001: UDP, length 1470
00:08:50.035453 IP 10.0.0.1.53967 > 10.0.0.2.5001: UDP, length 1470
00:08:50.047557 IP 10.0.0.1.53967 > 10.0.0.2.5001: UDP, length 1470
00:08:50.060395 IP 10.0.0.1.53967 > 10.0.0.2.5001: UDP, length 1470
00:08:50.071749 IP 10.0.0.1.53967 > 10.0.0.2.5001: UDP, length 1470
00:08:50.083838 IP 10.0.0.1.53967 > 10.0.0.2.5001: UDP, length 1470
00:08:50.095927 IP 10.0.0.1.53967 > 10.0.0.2.5001: UDP, length 1470
00:08:50.108024 IP 10.0.0.1.53967 > 10.0.0.2.5001: UDP, length 1470
00:08:50.120143 IP 10.0.0.1.53967 > 10.0.0.2.5001: UDP, length 1470
00:08:50.132220 IP 10.0.0.1.53967 > 10.0.0.2.5001: UDP, length 1470
00:08:50.144353 IP 10.0.0.1.53967 > 10.0.0.2.5001: UDP, length 1470
00:08:50.156408 IP 10.0.0.1.53967 > 10.0.0.2.5001: UDP, length 1470
00:08:50.168504 IP 10.0.0.1.53967 > 10.0.0.2.5001: UDP, length 1470
00:08:50.180599 IP 10.0.0.1.53967 > 10.0.0.2.5001: UDP, length 1470
00:08:50.192722 IP 10.0.0.1.53967 > 10.0.0.2.5001: UDP, length 1470
00:08:50.204797 IP 10.0.0.1.53967 > 10.0.0.2.5001: UDP, length 1470
00:08:50.216896 IP 10.0.0.1.53967 > 10.0.0.2.5001: UDP, length 1470
00:08:50.228995 IP 10.0.0.1.53967 > 10.0.0.2.5001: UDP, length 1470
00:08:50.241246 IP 10.0.0.1.53967 > 10.0.0.2.5001: UDP, length 1470
00:08:50.253968 IP 10.0.0.1.53967 > 10.0.0.2.5001: UDP, length 1470
00:08:50.265276 IP 10.0.0.1.53967 > 10.0.0.2.5001: UDP, length 1470
00:08:50.277372 IP 10.0.0.1.53967 > 10.0.0.2.5001: UDP, length 1470
00:08:50.289483 IP 10.0.0.1.53967 > 10.0.0.2.5001: UDP, length 1470
00:08:50.301595 IP 10.0.0.1.53967 > 10.0.0.2.5001: UDP, length 1470
00:08:50.313663 IP 10.0.0.1.53967 > 10.0.0.2.5001: UDP, length 1470
00:08:50.325761 IP 10.0.0.1.53967 > 10.0.0.2.5001: UDP, length 1470
00:08:50.337851 IP 10.0.0.1.53967 > 10.0.0.2.5001: UDP, length 1470
00:08:50.350674 IP 10.0.0.1.53967 > 10.0.0.2.5001: UDP, length 1470
00:08:50.362065 IP 10.0.0.1.53967 > 10.0.0.2.5001: UDP, length 1470
00:08:50.374127 IP 10.0.0.1.53967 > 10.0.0.2.5001: UDP, length 1470
00:08:50.386264 IP 10.0.0.1.53967 > 10.0.0.2.5001: UDP, length 1470
00:08:50.398338 IP 10.0.0.1.53967 > 10.0.0.2.5001: UDP, length 1470
00:08:50.410432 IP 10.0.0.1.53967 > 10.0.0.2.5001: UDP, length 1470
00:08:50.422525 IP 10.0.0.1.53967 > 10.0.0.2.5001: UDP, length 1470
00:08:50.434621 IP 10.0.0.1.53967 > 10.0.0.2.5001: UDP, length 1470
00:08:50.446720 IP 10.0.0.1.53967 > 10.0.0.2.5001: UDP, length 1470
00:08:50.458808 IP 10.0.0.1.53967 > 10.0.0.2.5001: UDP, length 1470
00:08:50.470896 IP 10.0.0.1.53967 > 10.0.0.2.5001: UDP, length 1470
00:08:50.483099 IP 10.0.0.1.53967 > 10.0.0.2.5001: UDP, length 1470
00:08:50.495115 IP 10.0.0.1.53967 > 10.0.0.2.5001: UDP, length 1470
00:08:50.507937 IP 10.0.0.1.53967 > 10.0.0.2.5001: UDP, length 1470
00:08:50.519309 IP 10.0.0.1.53967 > 10.0.0.2.5001: UDP, length 1470
00:08:50.531393 IP 10.0.0.1.53967 > 10.0.0.2.5001: UDP, length 1470
00:08:50.543505 IP 10.0.0.1.53967 > 10.0.0.2.5001: UDP, length 1470
00:08:50.555594 IP 10.0.0.1.53967 > 10.0.0.2.5001: UDP, length 1470
00:08:50.567668 IP 10.0.0.1.53967 > 10.0.0.2.5001: UDP, length 1470
00:08:50.579774 IP 10.0.0.1.53967 > 10.0.0.2.5001: UDP, length 1470
00:08:50.591863 IP 10.0.0.1.53967 > 10.0.0.2.5001: UDP, length 1470
00:08:50.603968 IP 10.0.0.1.53967 > 10.0.0.2.5001: UDP, length 1470
00:08:50.616067 IP 10.0.0.1.53967 > 10.0.0.2.5001: UDP, length 1470
00:08:50.628158 IP 10.0.0.1.53967 > 10.0.0.2.5001: UDP, length 1470
00:08:50.640257 IP 10.0.0.1.53967 > 10.0.0.2.5001: UDP, length 1470
00:08:50.652353 IP 10.0.0.1.53967 > 10.0.0.2.5001: UDP, length 1470
00:08:50.665196 IP 10.0.0.1.53967 > 10.0.0.2.5001: UDP, length 1470
00:08:50.676581 IP 10.0.0.1.53967 > 10.0.0.2.5001: UDP, length 1470
00:08:50.688818 IP 10.0.0.1.53967 > 10.0.0.2.5001: UDP, length 1470
00:08:50.700741 IP 10.0.0.1.53967 > 10.0.0.2.5001: UDP, length 1470
00:08:50.712830 IP 10.0.0.1.53967 > 10.0.0.2.5001: UDP, length 1470
00:08:50.724921 IP 10.0.0.1.53967 > 10.0.0.2.5001: UDP, length 1470
00:08:50.737699 IP 10.0.0.1.53967 > 10.0.0.2.5001: UDP, length 1470
00:08:50.749138 IP 10.0.0.1.53967 > 10.0.0.2.5001: UDP, length 1470
00:08:50.761235 IP 10.0.0.1.53967 > 10.0.0.2.5001: UDP, length 1470
00:08:50.773309 IP 10.0.0.1.53967 > 10.0.0.2.5001: UDP, length 1470
00:08:50.785404 IP 10.0.0.1.53967 > 10.0.0.2.5001: UDP, length 1470
00:08:50.797502 IP 10.0.0.1.53967 > 10.0.0.2.5001: UDP, length 1470
00:08:50.809595 IP 10.0.0.1.53967 > 10.0.0.2.5001: UDP, length 1470
00:08:50.821684 IP 10.0.0.1.53967 > 10.0.0.2.5001: UDP, length 1470
00:08:50.833789 IP 10.0.0.1.53967 > 10.0.0.2.5001: UDP, length 1470
00:08:50.845873 IP 10.0.0.1.53967 > 10.0.0.2.5001: UDP, length 1470
00:08:50.857980 IP 10.0.0.1.53967 > 10.0.0.2.5001: UDP, length 1470
00:08:50.870062 IP 10.0.0.1.53967 > 10.0.0.2.5001: UDP, length 1470
00:08:50.882161 IP 10.0.0.1.53967 > 10.0.0.2.5001: UDP, length 1470
00:08:50.894258 IP 10.0.0.1.53967 > 10.0.0.2.5001: UDP, length 1470
00:08:50.906354 IP 10.0.0.1.53967 > 10.0.0.2.5001: UDP, length 1470
00:08:50.918477 IP 10.0.0.1.53967 > 10.0.0.2.5001: UDP, length 1470
00:08:50.930577 IP 10.0.0.1.53967 > 10.0.0.2.5001: UDP, length 1470
00:08:50.942647 IP 10.0.0.1.53967 > 10.0.0.2.5001: UDP, length 1470
00:08:50.954754 IP 10.0.0.1.53967 > 10.0.0.2.5001: UDP, length 1470
00:08:50.966846 IP 10.0.0.1.53967 > 10.0.0.2.5001: UDP, length 1470
00:08:50.978939 IP 10.0.0.1.53967 > 10.0.0.2.5001: UDP, length 1470
00:08:50.991033 IP 10.0.0.1.53967 > 10.0.0.2.5001: UDP, length 1470
00:08:51.003139 IP 10.0.0.1.53967 > 10.0.0.2.5001: UDP, length 1470
00:08:51.015228 IP 10.0.0.1.53967 > 10.0.0.2.5001: UDP, length 1470
00:08:51.027342 IP 10.0.0.1.53967 > 10.0.0.2.5001: UDP, length 1470
00:08:51.039427 IP 10.0.0.1.53967 > 10.0.0.2.5001: UDP, length 1470
00:08:51.051535 IP 10.0.0.1.53967 > 10.0.0.2.5001: UDP, length 1470
00:08:51.063607 IP 10.0.0.1.53967 > 10.0.0.2.5001: UDP, length 1470
00:08:51.075707 IP 10.0.0.1.53967 > 10.0.0.2.5001: UDP, length 1470
00:08:51.087799 IP 10.0.0.1.53967 > 10.0.0.2.5001: UDP, length 1470
00:08:51.100597 IP 10.0.0.1.53967 > 10.0.0.2.5001: UDP, length 1470
00:08:51.111996 IP 10.0.0.1.53967 > 10.0.0.2.5001: UDP, length 1470
00:08:51.124116 IP 10.0.0.1.53967 > 10.0.0.2.5001: UDP, length 1470
00:08:51.136950 IP 10.0.0.1.53967 > 10.0.0.2.5001: UDP, length 1470
00:08:51.148287 IP 10.0.0.1.53967 > 10.0.0.2.5001: UDP, length 1470
00:08:51.160384 IP 10.0.0.1.53967 > 10.0.0.2.5001: UDP, length 1470
00:08:51.173278 IP 10.0.0.1.53967 > 10.0.0.2.5001: UDP, length 1470
00:08:51.184598 IP 10.0.0.1.53967 > 10.0.0.2.5001: UDP, length 1470
00:08:51.196659 IP 10.0.0.1.53967 > 10.0.0.2.5001: UDP, length 1470
00:08:51.209526 IP 10.0.0.1.53967 > 10.0.0.2.5001: UDP, length 1470
00:08:51.220845 IP 10.0.0.1.53967 > 10.0.0.2.5001: UDP, length 1470
00:08:51.232957 IP 10.0.0.1.53967 > 10.0.0.2.5001: UDP, length 1470
00:08:51.245069 IP 10.0.0.1.53967 > 10.0.0.2.5001: UDP, length 1470
00:08:51.257141 IP 10.0.0.1.53967 > 10.0.0.2.5001: UDP, length 1470
00:08:51.269272 IP 10.0.0.1.53967 > 10.0.0.2.5001: UDP, length 1470
00:08:51.281469 IP 10.0.0.1.53967 > 10.0.0.2.5001: UDP, length 1470
00:08:51.293442 IP 10.0.0.1.53967 > 10.0.0.2.5001: UDP, length 1470
00:08:51.305537 IP 10.0.0.1.53967 > 10.0.0.2.5001: UDP, length 1470
00:08:51.317634 IP 10.0.0.1.53967 > 10.0.0.2.5001: UDP, length 1470
00:08:51.329738 IP 10.0.0.1.53967 > 10.0.0.2.5001: UDP, length 1470
00:08:51.342525 IP 10.0.0.1.53967 > 10.0.0.2.5001: UDP, length 1470
00:08:51.353928 IP 10.0.0.1.53967 > 10.0.0.2.5001: UDP, length 1470
00:08:51.366020 IP 10.0.0.1.53967 > 10.0.0.2.5001: UDP, length 1470
00:08:51.378115 IP 10.0.0.1.53967 > 10.0.0.2.5001: UDP, length 1470
00:08:51.390203 IP 10.0.0.1.53967 > 10.0.0.2.5001: UDP, length 1470
00:08:51.402305 IP 10.0.0.1.53967 > 10.0.0.2.5001: UDP, length 1470
00:08:51.414400 IP 10.0.0.1.53967 > 10.0.0.2.5001: UDP, length 1470
00:08:51.426509 IP 10.0.0.1.53967 > 10.0.0.2.5001: UDP, length 1470
00:08:51.438617 IP 10.0.0.1.53967 > 10.0.0.2.5001: UDP, length 1470
00:08:51.450894 IP 10.0.0.1.53967 > 10.0.0.2.5001: UDP, length 1470
00:08:51.462782 IP 10.0.0.1.53967 > 10.0.0.2.5001: UDP, length 1470
00:08:51.474899 IP 10.0.0.1.53967 > 10.0.0.2.5001: UDP, length 1470
00:08:51.486973 IP 10.0.0.1.53967 > 10.0.0.2.5001: UDP, length 1470
00:08:51.499072 IP 10.0.0.1.53967 > 10.0.0.2.5001: UDP, length 1470
00:08:51.511933 IP 10.0.0.1.53967 > 10.0.0.2.5001: UDP, length 1470
00:08:51.523261 IP 10.0.0.1.53967 > 10.0.0.2.5001: UDP, length 1470
00:08:51.535358 IP 10.0.0.1.53967 > 10.0.0.2.5001: UDP, length 1470
00:08:51.548315 IP 10.0.0.1.53967 > 10.0.0.2.5001: UDP, length 1470
00:08:51.559545 IP 10.0.0.1.53967 > 10.0.0.2.5001: UDP, length 1470
00:08:51.571643 IP 10.0.0.1.53967 > 10.0.0.2.5001: UDP, length 1470
00:08:51.583736 IP 10.0.0.1.53967 > 10.0.0.2.5001: UDP, length 1470
00:08:51.595822 IP 10.0.0.1.53967 > 10.0.0.2.5001: UDP, length 1470
00:08:51.607933 IP 10.0.0.1.53967 > 10.0.0.2.5001: UDP, length 1470
00:08:51.620031 IP 10.0.0.1.53967 > 10.0.0.2.5001: UDP, length 1470
00:08:51.632137 IP 10.0.0.1.53967 > 10.0.0.2.5001: UDP, length 1470
00:08:51.644257 IP 10.0.0.1.53967 > 10.0.0.2.5001: UDP, length 1470
00:08:51.656318 IP 10.0.0.1.53967 > 10.0.0.2.5001: UDP, length 1470
00:08:51.668486 IP 10.0.0.1.53967 > 10.0.0.2.5001: UDP, length 1470
00:08:51.680545 IP 10.0.0.1.53967 > 10.0.0.2.5001: UDP, length 1470
00:08:51.692622 IP 10.0.0.1.53967 > 10.0.0.2.5001: UDP, length 1470
00:08:51.704705 IP 10.0.0.1.53967 > 10.0.0.2.5001: UDP, length 1470
00:08:51.716798 IP 10.0.0.1.53967 > 10.0.0.2.5001: UDP, length 1470
00:08:51.728900 IP 10.0.0.1.53967 > 10.0.0.2.5001: UDP, length 1470
00:08:51.740985 IP 10.0.0.1.53967 > 10.0.0.2.5001: UDP, length 1470
00:08:51.753071 IP 10.0.0.1.53967 > 10.0.0.2.5001: UDP, length 1470
00:08:51.765193 IP 10.0.0.1.53967 > 10.0.0.2.5001: UDP, length 1470
00:08:51.777286 IP 10.0.0.1.53967 > 10.0.0.2.5001: UDP, length 1470
00:08:51.789389 IP 10.0.0.1.53967 > 10.0.0.2.5001: UDP, length 1470
00:08:51.801485 IP 10.0.0.1.53967 > 10.0.0.2.5001: UDP, length 1470
00:08:51.813560 IP 10.0.0.1.53967 > 10.0.0.2.5001: UDP, length 1470
00:08:51.825658 IP 10.0.0.1.53967 > 10.0.0.2.5001: UDP, length 1470
00:08:51.837760 IP 10.0.0.1.53967 > 10.0.0.2.5001: UDP, length 1470
00:08:51.849856 IP 10.0.0.1.53967 > 10.0.0.2.5001: UDP, length 1470
00:08:51.861948 IP 10.0.0.1.53967 > 10.0.0.2.5001: UDP, length 1470
00:08:51.874041 IP 10.0.0.1.53967 > 10.0.0.2.5001: UDP, length 1470
00:08:51.886143 IP 10.0.0.1.53967 > 10.0.0.2.5001: UDP, length 1470
00:08:51.898244 IP 10.0.0.1.53967 > 10.0.0.2.5001: UDP, length 1470
00:08:51.910328 IP 10.0.0.1.53967 > 10.0.0.2.5001: UDP, length 1470
00:08:51.922416 IP 10.0.0.1.53967 > 10.0.0.2.5001: UDP, length 1470
00:08:51.934532 IP 10.0.0.1.53967 > 10.0.0.2.5001: UDP, length 1470
00:08:51.946999 IP 10.0.0.1.53967 > 10.0.0.2.5001: UDP, length 1470
00:08:51.959522 IP 10.0.0.1.53967 > 10.0.0.2.5001: UDP, length 1470
00:08:51.970806 IP 10.0.0.1.53967 > 10.0.0.2.5001: UDP, length 1470
00:08:51.982909 IP 10.0.0.1.53967 > 10.0.0.2.5001: UDP, length 1470
00:08:51.995819 IP 10.0.0.1.53967 > 10.0.0.2.5001: UDP, length 1470
00:08:52.007122 IP 10.0.0.1.53967 > 10.0.0.2.5001: UDP, length 1470
00:08:52.019216 IP 10.0.0.1.53967 > 10.0.0.2.5001: UDP, length 1470
00:08:52.031296 IP 10.0.0.1.53967 > 10.0.0.2.5001: UDP, length 1470
00:08:52.043404 IP 10.0.0.1.53967 > 10.0.0.2.5001: UDP, length 1470
00:08:52.056201 IP 10.0.0.1.53967 > 10.0.0.2.5001: UDP, length 1470
00:08:52.067577 IP 10.0.0.1.53967 > 10.0.0.2.5001: UDP, length 1470
00:08:52.079703 IP 10.0.0.1.53967 > 10.0.0.2.5001: UDP, length 1470
00:08:52.091774 IP 10.0.0.1.53967 > 10.0.0.2.5001: UDP, length 1470
00:08:52.103877 IP 10.0.0.1.53967 > 10.0.0.2.5001: UDP, length 1470
00:08:52.115965 IP 10.0.0.1.53967 > 10.0.0.2.5001: UDP, length 1470
00:08:52.128055 IP 10.0.0.1.53967 > 10.0.0.2.5001: UDP, length 1470
00:08:52.140150 IP 10.0.0.1.53967 > 10.0.0.2.5001: UDP, length 1470
00:08:52.152234 IP 10.0.0.1.53967 > 10.0.0.2.5001: UDP, length 1470
00:08:52.164338 IP 10.0.0.1.53967 > 10.0.0.2.5001: UDP, length 1470
00:08:52.176432 IP 10.0.0.1.53967 > 10.0.0.2.5001: UDP, length 1470
00:08:52.188534 IP 10.0.0.1.53967 > 10.0.0.2.5001: UDP, length 1470
00:08:52.200631 IP 10.0.0.1.53967 > 10.0.0.2.5001: UDP, length 1470
00:08:52.212738 IP 10.0.0.1.53967 > 10.0.0.2.5001: UDP, length 1470
00:08:52.224840 IP 10.0.0.1.53967 > 10.0.0.2.5001: UDP, length 1470
00:08:52.236919 IP 10.0.0.1.53967 > 10.0.0.2.5001: UDP, length 1470
00:08:52.249022 IP 10.0.0.1.53967 > 10.0.0.2.5001: UDP, length 1470
00:08:52.261113 IP 10.0.0.1.53967 > 10.0.0.2.5001: UDP, length 1470
00:08:52.273214 IP 10.0.0.1.53967 > 10.0.0.2.5001: UDP, length 1470
00:08:52.286013 IP 10.0.0.1.53967 > 10.0.0.2.5001: UDP, length 1470
00:08:52.297406 IP 10.0.0.1.53967 > 10.0.0.2.5001: UDP, length 1470
00:08:52.309527 IP 10.0.0.1.53967 > 10.0.0.2.5001: UDP, length 1470
00:08:52.321584 IP 10.0.0.1.53967 > 10.0.0.2.5001: UDP, length 1470
00:08:52.333703 IP 10.0.0.1.53967 > 10.0.0.2.5001: UDP, length 1470
00:08:52.345778 IP 10.0.0.1.53967 > 10.0.0.2.5001: UDP, length 1470
00:08:52.357889 IP 10.0.0.1.53967 > 10.0.0.2.5001: UDP, length 1470
00:08:52.369986 IP 10.0.0.1.53967 > 10.0.0.2.5001: UDP, length 1470
00:08:52.383018 IP 10.0.0.1.53967 > 10.0.0.2.5001: UDP, length 1470
00:08:52.394157 IP 10.0.0.1.53967 > 10.0.0.2.5001: UDP, length 1470
00:08:52.406258 IP 10.0.0.1.53967 > 10.0.0.2.5001: UDP, length 1470
00:08:52.418656 IP 10.0.0.1.53967 > 10.0.0.2.5001: UDP, length 1470
00:08:52.430468 IP 10.0.0.1.53967 > 10.0.0.2.5001: UDP, length 1470
00:08:52.442556 IP 10.0.0.1.53967 > 10.0.0.2.5001: UDP, length 1470
00:08:52.454655 IP 10.0.0.1.53967 > 10.0.0.2.5001: UDP, length 1470
00:08:52.466755 IP 10.0.0.1.53967 > 10.0.0.2.5001: UDP, length 1470
00:08:52.478848 IP 10.0.0.1.53967 > 10.0.0.2.5001: UDP, length 1470
00:08:52.490936 IP 10.0.0.1.53967 > 10.0.0.2.5001: UDP, length 1470
00:08:52.503810 IP 10.0.0.1.53967 > 10.0.0.2.5001: UDP, length 1470
00:08:52.515152 IP 10.0.0.1.53967 > 10.0.0.2.5001: UDP, length 1470
00:08:52.527233 IP 10.0.0.1.53967 > 10.0.0.2.5001: UDP, length 1470
00:08:52.540063 IP 10.0.0.1.53967 > 10.0.0.2.5001: UDP, length 1470
00:08:52.551441 IP 10.0.0.1.53967 > 10.0.0.2.5001: UDP, length 1470
00:08:52.563518 IP 10.0.0.1.53967 > 10.0.0.2.5001: UDP, length 1470
00:08:52.575608 IP 10.0.0.1.53967 > 10.0.0.2.5001: UDP, length 1470
00:08:52.587715 IP 10.0.0.1.53967 > 10.0.0.2.5001: UDP, length 1470
00:08:52.599790 IP 10.0.0.1.53967 > 10.0.0.2.5001: UDP, length 1470
00:08:52.611902 IP 10.0.0.1.53967 > 10.0.0.2.5001: UDP, length 1470
00:08:52.624001 IP 10.0.0.1.53967 > 10.0.0.2.5001: UDP, length 1470
00:08:52.636109 IP 10.0.0.1.53967 > 10.0.0.2.5001: UDP, length 1470
00:08:52.648190 IP 10.0.0.1.53967 > 10.0.0.2.5001: UDP, length 1470
00:08:52.660293 IP 10.0.0.1.53967 > 10.0.0.2.5001: UDP, length 1470
00:08:52.672368 IP 10.0.0.1.53967 > 10.0.0.2.5001: UDP, length 1470
00:08:52.684478 IP 10.0.0.1.53967 > 10.0.0.2.5001: UDP, length 1470
00:08:52.696576 IP 10.0.0.1.53967 > 10.0.0.2.5001: UDP, length 1470
00:08:52.708666 IP 10.0.0.1.53967 > 10.0.0.2.5001: UDP, length 1470
00:08:52.720774 IP 10.0.0.1.53967 > 10.0.0.2.5001: UDP, length 1470
00:08:52.732864 IP 10.0.0.1.53967 > 10.0.0.2.5001: UDP, length 1470
00:08:52.744963 IP 10.0.0.1.53967 > 10.0.0.2.5001: UDP, length 1470
00:08:52.757053 IP 10.0.0.1.53967 > 10.0.0.2.5001: UDP, length 1470
00:08:52.769168 IP 10.0.0.1.53967 > 10.0.0.2.5001: UDP, length 1470
00:08:52.781263 IP 10.0.0.1.53967 > 10.0.0.2.5001: UDP, length 1470
00:08:52.793353 IP 10.0.0.1.53967 > 10.0.0.2.5001: UDP, length 1470
00:08:52.805433 IP 10.0.0.1.53967 > 10.0.0.2.5001: UDP, length 1470
00:08:52.818311 IP 10.0.0.1.53967 > 10.0.0.2.5001: UDP, length 1470
00:08:52.829646 IP 10.0.0.1.53967 > 10.0.0.2.5001: UDP, length 1470
00:08:52.841736 IP 10.0.0.1.53967 > 10.0.0.2.5001: UDP, length 1470
00:08:52.854553 IP 10.0.0.1.53967 > 10.0.0.2.5001: UDP, length 1470
00:08:52.865917 IP 10.0.0.1.53967 > 10.0.0.2.5001: UDP, length 1470
00:08:52.878004 IP 10.0.0.1.53967 > 10.0.0.2.5001: UDP, length 1470
00:08:52.890108 IP 10.0.0.1.53967 > 10.0.0.2.5001: UDP, length 1470
00:08:52.902233 IP 10.0.0.1.53967 > 10.0.0.2.5001: UDP, length 1470
00:08:52.914293 IP 10.0.0.1.53967 > 10.0.0.2.5001: UDP, length 1470
00:08:52.926415 IP 10.0.0.1.53967 > 10.0.0.2.5001: UDP, length 1470
00:08:52.939276 IP 10.0.0.1.53967 > 10.0.0.2.5001: UDP, length 1470
00:08:52.950595 IP 10.0.0.1.53967 > 10.0.0.2.5001: UDP, length 1470
00:08:52.962704 IP 10.0.0.1.53967 > 10.0.0.2.5001: UDP, length 1470
00:08:52.974792 IP 10.0.0.1.53967 > 10.0.0.2.5001: UDP, length 1470
00:08:52.986881 IP 10.0.0.1.53967 > 10.0.0.2.5001: UDP, length 1470
00:08:52.998968 IP 10.0.0.1.53967 > 10.0.0.2.5001: UDP, length 1470
00:08:53.011068 IP 10.0.0.1.53967 > 10.0.0.2.5001: UDP, length 1470
00:08:53.023174 IP 10.0.0.1.53967 > 10.0.0.2.5001: UDP, length 1470
00:08:53.035261 IP 10.0.0.1.53967 > 10.0.0.2.5001: UDP, length 1470
00:08:53.047373 IP 10.0.0.1.53967 > 10.0.0.2.5001: UDP, length 1470
00:08:53.059450 IP 10.0.0.1.53967 > 10.0.0.2.5001: UDP, length 1470
00:08:53.071552 IP 10.0.0.1.53967 > 10.0.0.2.5001: UDP, length 1470
00:08:53.083645 IP 10.0.0.1.53967 > 10.0.0.2.5001: UDP, length 1470
00:08:53.095742 IP 10.0.0.1.53967 > 10.0.0.2.5001: UDP, length 1470
00:08:53.107837 IP 10.0.0.1.53967 > 10.0.0.2.5001: UDP, length 1470
00:08:53.119947 IP 10.0.0.1.53967 > 10.0.0.2.5001: UDP, length 1470
00:08:53.132035 IP 10.0.0.1.53967 > 10.0.0.2.5001: UDP, length 1470
00:08:53.144156 IP 10.0.0.1.53967 > 10.0.0.2.5001: UDP, length 1470
00:08:53.156223 IP 10.0.0.1.53967 > 10.0.0.2.5001: UDP, length 1470
00:08:53.168322 IP 10.0.0.1.53967 > 10.0.0.2.5001: UDP, length 1470
00:08:53.180433 IP 10.0.0.1.53967 > 10.0.0.2.5001: UDP, length 1470
00:08:53.192506 IP 10.0.0.1.53967 > 10.0.0.2.5001: UDP, length 1470
00:08:53.204606 IP 10.0.0.1.53967 > 10.0.0.2.5001: UDP, length 1470
00:08:53.216707 IP 10.0.0.1.53967 > 10.0.0.2.5001: UDP, length 1470
00:08:53.228801 IP 10.0.0.1.53967 > 10.0.0.2.5001: UDP, length 1470
00:08:53.240912 IP 10.0.0.1.53967 > 10.0.0.2.5001: UDP, length 1470
00:08:53.253796 IP 10.0.0.1.53967 > 10.0.0.2.5001: UDP, length 1470
00:08:53.265080 IP 10.0.0.1.53967 > 10.0.0.2.5001: UDP, length 1470
00:08:53.277189 IP 10.0.0.1.53967 > 10.0.0.2.5001: UDP, length 1470
00:08:53.289296 IP 10.0.0.1.53967 > 10.0.0.2.5001: UDP, length 1470
00:08:53.301374 IP 10.0.0.1.53967 > 10.0.0.2.5001: UDP, length 1470
00:08:53.313468 IP 10.0.0.1.53967 > 10.0.0.2.5001: UDP, length 1470
00:08:53.325560 IP 10.0.0.1.53967 > 10.0.0.2.5001: UDP, length 1470
00:08:53.337664 IP 10.0.0.1.53967 > 10.0.0.2.5001: UDP, length 1470
00:08:53.349787 IP 10.0.0.1.53967 > 10.0.0.2.5001: UDP, length 1470
00:08:53.362543 IP 10.0.0.1.53967 > 10.0.0.2.5001: UDP, length 1470
00:08:53.373949 IP 10.0.0.1.53967 > 10.0.0.2.5001: UDP, length 1470
00:08:53.386046 IP 10.0.0.1.53967 > 10.0.0.2.5001: UDP, length 1470
00:08:53.398183 IP 10.0.0.1.53967 > 10.0.0.2.5001: UDP, length 1470
00:08:53.410407 IP 10.0.0.1.53967 > 10.0.0.2.5001: UDP, length 1470
00:08:53.422338 IP 10.0.0.1.53967 > 10.0.0.2.5001: UDP, length 1470
00:08:53.435289 IP 10.0.0.1.53967 > 10.0.0.2.5001: UDP, length 1470
00:08:53.446522 IP 10.0.0.1.53967 > 10.0.0.2.5001: UDP, length 1470
00:08:53.458617 IP 10.0.0.1.53967 > 10.0.0.2.5001: UDP, length 1470
00:08:53.470709 IP 10.0.0.1.53967 > 10.0.0.2.5001: UDP, length 1470
00:08:53.482813 IP 10.0.0.1.53967 > 10.0.0.2.5001: UDP, length 1470
00:08:53.494940 IP 10.0.0.1.53967 > 10.0.0.2.5001: UDP, length 1470
00:08:53.507004 IP 10.0.0.1.53967 > 10.0.0.2.5001: UDP, length 1470
00:08:53.519107 IP 10.0.0.1.53967 > 10.0.0.2.5001: UDP, length 1470
00:08:53.531185 IP 10.0.0.1.53967 > 10.0.0.2.5001: UDP, length 1470
00:08:53.543291 IP 10.0.0.1.53967 > 10.0.0.2.5001: UDP, length 1470
00:08:53.555391 IP 10.0.0.1.53967 > 10.0.0.2.5001: UDP, length 1470
00:08:53.567486 IP 10.0.0.1.53967 > 10.0.0.2.5001: UDP, length 1470
00:08:53.579608 IP 10.0.0.1.53967 > 10.0.0.2.5001: UDP, length 1470
00:08:53.591671 IP 10.0.0.1.53967 > 10.0.0.2.5001: UDP, length 1470
00:08:53.603777 IP 10.0.0.1.53967 > 10.0.0.2.5001: UDP, length 1470
00:08:53.615869 IP 10.0.0.1.53967 > 10.0.0.2.5001: UDP, length 1470
00:08:53.627954 IP 10.0.0.1.53967 > 10.0.0.2.5001: UDP, length 1470
00:08:53.640060 IP 10.0.0.1.53967 > 10.0.0.2.5001: UDP, length 1470
00:08:53.652169 IP 10.0.0.1.53967 > 10.0.0.2.5001: UDP, length 1470
00:08:53.664257 IP 10.0.0.1.53967 > 10.0.0.2.5001: UDP, length 1470
00:08:53.676343 IP 10.0.0.1.53967 > 10.0.0.2.5001: UDP, length 1470
00:08:53.689207 IP 10.0.0.1.53967 > 10.0.0.2.5001: UDP, length 1470
00:08:53.700541 IP 10.0.0.1.53967 > 10.0.0.2.5001: UDP, length 1470
00:08:53.712655 IP 10.0.0.1.53967 > 10.0.0.2.5001: UDP, length 1470
00:08:53.725472 IP 10.0.0.1.53967 > 10.0.0.2.5001: UDP, length 1470
00:08:53.736830 IP 10.0.0.1.53967 > 10.0.0.2.5001: UDP, length 1470
00:08:53.748926 IP 10.0.0.1.53967 > 10.0.0.2.5001: UDP, length 1470
00:08:53.761709 IP 10.0.0.1.53967 > 10.0.0.2.5001: UDP, length 1470
00:08:53.773139 IP 10.0.0.1.53967 > 10.0.0.2.5001: UDP, length 1470
00:08:53.785204 IP 10.0.0.1.53967 > 10.0.0.2.5001: UDP, length 1470
00:08:53.798022 IP 10.0.0.1.53967 > 10.0.0.2.5001: UDP, length 1470
00:08:53.809420 IP 10.0.0.1.53967 > 10.0.0.2.5001: UDP, length 1470
00:08:53.822238 IP 10.0.0.1.53967 > 10.0.0.2.5001: UDP, length 1470
00:08:53.833620 IP 10.0.0.1.53967 > 10.0.0.2.5001: UDP, length 1470
00:08:53.845685 IP 10.0.0.1.53967 > 10.0.0.2.5001: UDP, length 1470
00:08:53.857791 IP 10.0.0.1.53967 > 10.0.0.2.5001: UDP, length 1470
00:08:53.869891 IP 10.0.0.1.53967 > 10.0.0.2.5001: UDP, length 1470
00:08:53.882798 IP 10.0.0.1.53967 > 10.0.0.2.5001: UDP, length 1470
00:08:53.894103 IP 10.0.0.1.53967 > 10.0.0.2.5001: UDP, length 1470
00:08:53.906401 IP 10.0.0.1.53967 > 10.0.0.2.5001: UDP, length 1470
00:08:53.918264 IP 10.0.0.1.53967 > 10.0.0.2.5001: UDP, length 1470
00:08:53.930366 IP 10.0.0.1.53967 > 10.0.0.2.5001: UDP, length 1470
00:08:53.942460 IP 10.0.0.1.53967 > 10.0.0.2.5001: UDP, length 1470
00:08:53.954572 IP 10.0.0.1.53967 > 10.0.0.2.5001: UDP, length 1470
00:08:53.966652 IP 10.0.0.1.53967 > 10.0.0.2.5001: UDP, length 1470
00:08:53.978753 IP 10.0.0.1.53967 > 10.0.0.2.5001: UDP, length 1470
00:08:53.990848 IP 10.0.0.1.53967 > 10.0.0.2.5001: UDP, length 1470
00:08:54.002943 IP 10.0.0.1.53967 > 10.0.0.2.5001: UDP, length 1470
00:08:54.015034 IP 10.0.0.1.53967 > 10.0.0.2.5001: UDP, length 1470
00:08:54.027145 IP 10.0.0.1.53967 > 10.0.0.2.5001: UDP, length 1470
00:08:54.039233 IP 10.0.0.1.53967 > 10.0.0.2.5001: UDP, length 1470
00:08:54.051345 IP 10.0.0.1.53967 > 10.0.0.2.5001: UDP, length 1470
00:08:54.063430 IP 10.0.0.1.53967 > 10.0.0.2.5001: UDP, length 1470
00:08:54.075512 IP 10.0.0.1.53967 > 10.0.0.2.5001: UDP, length 1470
00:08:54.087641 IP 10.0.0.1.53967 > 10.0.0.2.5001: UDP, length 1470
00:08:54.099712 IP 10.0.0.1.53967 > 10.0.0.2.5001: UDP, length 1470
00:08:54.111806 IP 10.0.0.1.53967 > 10.0.0.2.5001: UDP, length 1470
00:08:54.123895 IP 10.0.0.1.53967 > 10.0.0.2.5001: UDP, length 1470
00:08:54.135993 IP 10.0.0.1.53967 > 10.0.0.2.5001: UDP, length 1470
00:08:54.148339 IP 10.0.0.1.53967 > 10.0.0.2.5001: UDP, length 1470
00:08:54.160202 IP 10.0.0.1.53967 > 10.0.0.2.5001: UDP, length 1470
00:08:54.172289 IP 10.0.0.1.53967 > 10.0.0.2.5001: UDP, length 1470
00:08:54.184382 IP 10.0.0.1.53967 > 10.0.0.2.5001: UDP, length 1470
00:08:54.196481 IP 10.0.0.1.53967 > 10.0.0.2.5001: UDP, length 1470
00:08:54.209342 IP 10.0.0.1.53967 > 10.0.0.2.5001: UDP, length 1470
00:08:54.220694 IP 10.0.0.1.53967 > 10.0.0.2.5001: UDP, length 1470
00:08:54.232752 IP 10.0.0.1.53967 > 10.0.0.2.5001: UDP, length 1470
00:08:54.244895 IP 10.0.0.1.53967 > 10.0.0.2.5001: UDP, length 1470
00:08:54.256956 IP 10.0.0.1.53967 > 10.0.0.2.5001: UDP, length 1470
00:08:54.269084 IP 10.0.0.1.53967 > 10.0.0.2.5001: UDP, length 1470
00:08:54.281173 IP 10.0.0.1.53967 > 10.0.0.2.5001: UDP, length 1470
00:08:54.293243 IP 10.0.0.1.53967 > 10.0.0.2.5001: UDP, length 1470
00:08:54.305342 IP 10.0.0.1.53967 > 10.0.0.2.5001: UDP, length 1470
00:08:54.318205 IP 10.0.0.1.53967 > 10.0.0.2.5001: UDP, length 1470
00:08:54.329533 IP 10.0.0.1.53967 > 10.0.0.2.5001: UDP, length 1470
00:08:54.341655 IP 10.0.0.1.53967 > 10.0.0.2.5001: UDP, length 1470
00:08:54.353717 IP 10.0.0.1.53967 > 10.0.0.2.5001: UDP, length 1470
00:08:54.365823 IP 10.0.0.1.53967 > 10.0.0.2.5001: UDP, length 1470
00:08:54.378667 IP 10.0.0.1.53967 > 10.0.0.2.5001: UDP, length 1470
00:08:54.390018 IP 10.0.0.1.53967 > 10.0.0.2.5001: UDP, length 1470
00:08:54.402113 IP 10.0.0.1.53967 > 10.0.0.2.5001: UDP, length 1470
00:08:54.414215 IP 10.0.0.1.53967 > 10.0.0.2.5001: UDP, length 1470
00:08:54.426321 IP 10.0.0.1.53967 > 10.0.0.2.5001: UDP, length 1470
00:08:54.438396 IP 10.0.0.1.53967 > 10.0.0.2.5001: UDP, length 1470
00:08:54.450491 IP 10.0.0.1.53967 > 10.0.0.2.5001: UDP, length 1470
00:08:54.462597 IP 10.0.0.1.53967 > 10.0.0.2.5001: UDP, length 1470
00:08:54.474699 IP 10.0.0.1.53967 > 10.0.0.2.5001: UDP, length 1470
00:08:54.486773 IP 10.0.0.1.53967 > 10.0.0.2.5001: UDP, length 1470
00:08:54.498882 IP 10.0.0.1.53967 > 10.0.0.2.5001: UDP, length 1470
00:08:54.510973 IP 10.0.0.1.53967 > 10.0.0.2.5001: UDP, length 1470
00:08:54.523069 IP 10.0.0.1.53967 > 10.0.0.2.5001: UDP, length 1470
00:08:54.535161 IP 10.0.0.1.53967 > 10.0.0.2.5001: UDP, length 1470
00:08:54.548112 IP 10.0.0.1.53967 > 10.0.0.2.5001: UDP, length 1470
00:08:54.559361 IP 10.0.0.1.53967 > 10.0.0.2.5001: UDP, length 1470
00:08:54.571456 IP 10.0.0.1.53967 > 10.0.0.2.5001: UDP, length 1470
00:08:54.583550 IP 10.0.0.1.53967 > 10.0.0.2.5001: UDP, length 1470
00:08:54.595646 IP 10.0.0.1.53967 > 10.0.0.2.5001: UDP, length 1470
00:08:54.608564 IP 10.0.0.1.53967 > 10.0.0.2.5001: UDP, length 1470
00:08:54.619842 IP 10.0.0.1.53967 > 10.0.0.2.5001: UDP, length 1470
00:08:54.631935 IP 10.0.0.1.53967 > 10.0.0.2.5001: UDP, length 1470
00:08:54.644030 IP 10.0.0.1.53967 > 10.0.0.2.5001: UDP, length 1470
00:08:54.656123 IP 10.0.0.1.53967 > 10.0.0.2.5001: UDP, length 1470
00:08:54.668222 IP 10.0.0.1.53967 > 10.0.0.2.5001: UDP, length 1470
00:08:54.681180 IP 10.0.0.1.53967 > 10.0.0.2.5001: UDP, length 1470
00:08:54.692412 IP 10.0.0.1.53967 > 10.0.0.2.5001: UDP, length 1470
00:08:54.704507 IP 10.0.0.1.53967 > 10.0.0.2.5001: UDP, length 1470
00:08:54.717150 IP 10.0.0.1.53967 > 10.0.0.2.5001: UDP, length 1470
00:08:54.728722 IP 10.0.0.1.53967 > 10.0.0.2.5001: UDP, length 1470
00:08:54.742821 IP 10.0.0.1.53967 > 10.0.0.2.5001: UDP, length 1470
00:08:54.752880 IP 10.0.0.1.53967 > 10.0.0.2.5001: UDP, length 1470
00:08:54.764998 IP 10.0.0.1.53967 > 10.0.0.2.5001: UDP, length 1470
00:08:54.777099 IP 10.0.0.1.53967 > 10.0.0.2.5001: UDP, length 1470
00:08:54.789184 IP 10.0.0.1.53967 > 10.0.0.2.5001: UDP, length 1470
00:08:54.801296 IP 10.0.0.1.53967 > 10.0.0.2.5001: UDP, length 1470
00:08:54.813371 IP 10.0.0.1.53967 > 10.0.0.2.5001: UDP, length 1470
00:08:54.825466 IP 10.0.0.1.53967 > 10.0.0.2.5001: UDP, length 1470
00:08:54.837562 IP 10.0.0.1.53967 > 10.0.0.2.5001: UDP, length 1470
00:08:54.849657 IP 10.0.0.1.53967 > 10.0.0.2.5001: UDP, length 1470
00:08:54.861755 IP 10.0.0.1.53967 > 10.0.0.2.5001: UDP, length 1470
00:08:54.873854 IP 10.0.0.1.53967 > 10.0.0.2.5001: UDP, length 1470
00:08:54.885976 IP 10.0.0.1.53967 > 10.0.0.2.5001: UDP, length 1470
00:08:54.898048 IP 10.0.0.1.53967 > 10.0.0.2.5001: UDP, length 1470
00:08:54.910156 IP 10.0.0.1.53967 > 10.0.0.2.5001: UDP, length 1470
00:08:54.922230 IP 10.0.0.1.53967 > 10.0.0.2.5001: UDP, length 1470
00:08:54.934334 IP 10.0.0.1.53967 > 10.0.0.2.5001: UDP, length 1470
00:08:54.946434 IP 10.0.0.1.53967 > 10.0.0.2.5001: UDP, length 1470
00:08:54.958526 IP 10.0.0.1.53967 > 10.0.0.2.5001: UDP, length 1470
00:08:54.970615 IP 10.0.0.1.53967 > 10.0.0.2.5001: UDP, length 1470
00:08:54.982721 IP 10.0.0.1.53967 > 10.0.0.2.5001: UDP, length 1470
00:08:54.994807 IP 10.0.0.1.53967 > 10.0.0.2.5001: UDP, length 1470
00:08:55.006910 IP 10.0.0.1.53967 > 10.0.0.2.5001: UDP, length 1470
00:08:55.019027 IP 10.0.0.1.53967 > 10.0.0.2.5001: UDP, length 1470
00:08:55.031980 IP 10.0.0.1.53967 > 10.0.0.2.5001: UDP, length 1470
00:08:55.043196 IP 10.0.0.1.53967 > 10.0.0.2.5001: UDP, length 1470
00:08:55.055293 IP 10.0.0.1.53967 > 10.0.0.2.5001: UDP, length 1470
00:08:55.067393 IP 10.0.0.1.53967 > 10.0.0.2.5001: UDP, length 1470
00:08:55.079512 IP 10.0.0.1.53967 > 10.0.0.2.5001: UDP, length 1470
00:08:55.091566 IP 10.0.0.1.53967 > 10.0.0.2.5001: UDP, length 1470
00:08:55.103679 IP 10.0.0.1.53967 > 10.0.0.2.5001: UDP, length 1470
00:08:55.115769 IP 10.0.0.1.53967 > 10.0.0.2.5001: UDP, length 1470
00:08:55.127871 IP 10.0.0.1.53967 > 10.0.0.2.5001: UDP, length 1470
00:08:55.139959 IP 10.0.0.1.53967 > 10.0.0.2.5001: UDP, length 1470
00:08:55.152070 IP 10.0.0.1.53967 > 10.0.0.2.5001: UDP, length 1470
00:08:55.164160 IP 10.0.0.1.53967 > 10.0.0.2.5001: UDP, length 1470
00:08:55.176299 IP 10.0.0.1.53967 > 10.0.0.2.5001: UDP, length 1470
00:08:55.188348 IP 10.0.0.1.53967 > 10.0.0.2.5001: UDP, length 1470
00:08:55.200443 IP 10.0.0.1.53967 > 10.0.0.2.5001: UDP, length 1470
00:08:55.212565 IP 10.0.0.1.53967 > 10.0.0.2.5001: UDP, length 1470
00:08:55.225393 IP 10.0.0.1.53967 > 10.0.0.2.5001: UDP, length 1470
00:08:55.236732 IP 10.0.0.1.53967 > 10.0.0.2.5001: UDP, length 1470
00:08:55.248831 IP 10.0.0.1.53967 > 10.0.0.2.5001: UDP, length 1470
00:08:55.260928 IP 10.0.0.1.53967 > 10.0.0.2.5001: UDP, length 1470
00:08:55.273024 IP 10.0.0.1.53967 > 10.0.0.2.5001: UDP, length 1470
00:08:55.285122 IP 10.0.0.1.53967 > 10.0.0.2.5001: UDP, length 1470
00:08:55.297217 IP 10.0.0.1.53967 > 10.0.0.2.5001: UDP, length 1470
00:08:55.309303 IP 10.0.0.1.53967 > 10.0.0.2.5001: UDP, length 1470
00:08:55.321391 IP 10.0.0.1.53967 > 10.0.0.2.5001: UDP, length 1470
00:08:55.333501 IP 10.0.0.1.53967 > 10.0.0.2.5001: UDP, length 1470
00:08:55.345596 IP 10.0.0.1.53967 > 10.0.0.2.5001: UDP, length 1470
00:08:55.357703 IP 10.0.0.1.53967 > 10.0.0.2.5001: UDP, length 1470
00:08:55.369793 IP 10.0.0.1.53967 > 10.0.0.2.5001: UDP, length 1470
00:08:55.381884 IP 10.0.0.1.53967 > 10.0.0.2.5001: UDP, length 1470
00:08:55.394002 IP 10.0.0.1.53967 > 10.0.0.2.5001: UDP, length 1470
00:08:55.406079 IP 10.0.0.1.53967 > 10.0.0.2.5001: UDP, length 1470
00:08:55.418175 IP 10.0.0.1.53967 > 10.0.0.2.5001: UDP, length 1470
00:08:55.431182 IP 10.0.0.1.53967 > 10.0.0.2.5001: UDP, length 1470
00:08:55.442366 IP 10.0.0.1.53967 > 10.0.0.2.5001: UDP, length 1470
00:08:55.454471 IP 10.0.0.1.53967 > 10.0.0.2.5001: UDP, length 1470
00:08:55.467245 IP 10.0.0.1.53967 > 10.0.0.2.5001: UDP, length 1470
00:08:55.478677 IP 10.0.0.1.53967 > 10.0.0.2.5001: UDP, length 1470
00:08:55.490744 IP 10.0.0.1.53967 > 10.0.0.2.5001: UDP, length 1470
00:08:55.502841 IP 10.0.0.1.53967 > 10.0.0.2.5001: UDP, length 1470
00:08:55.514942 IP 10.0.0.1.53967 > 10.0.0.2.5001: UDP, length 1470
00:08:55.527043 IP 10.0.0.1.53967 > 10.0.0.2.5001: UDP, length 1470
00:08:55.539135 IP 10.0.0.1.53967 > 10.0.0.2.5001: UDP, length 1470
00:08:55.551251 IP 10.0.0.1.53967 > 10.0.0.2.5001: UDP, length 1470
00:08:55.563331 IP 10.0.0.1.53967 > 10.0.0.2.5001: UDP, length 1470
00:08:55.575418 IP 10.0.0.1.53967 > 10.0.0.2.5001: UDP, length 1470
00:08:55.587516 IP 10.0.0.1.53967 > 10.0.0.2.5001: UDP, length 1470
00:08:55.599612 IP 10.0.0.1.53967 > 10.0.0.2.5001: UDP, length 1470
00:08:55.611721 IP 10.0.0.1.53967 > 10.0.0.2.5001: UDP, length 1470
00:08:55.623798 IP 10.0.0.1.53967 > 10.0.0.2.5001: UDP, length 1470
00:08:55.635901 IP 10.0.0.1.53967 > 10.0.0.2.5001: UDP, length 1470
00:08:55.647998 IP 10.0.0.1.53967 > 10.0.0.2.5001: UDP, length 1470
00:08:55.660092 IP 10.0.0.1.53967 > 10.0.0.2.5001: UDP, length 1470
00:08:55.672188 IP 10.0.0.1.53967 > 10.0.0.2.5001: UDP, length 1470
00:08:55.684291 IP 10.0.0.1.53967 > 10.0.0.2.5001: UDP, length 1470
00:08:55.696384 IP 10.0.0.1.53967 > 10.0.0.2.5001: UDP, length 1470
00:08:55.708477 IP 10.0.0.1.53967 > 10.0.0.2.5001: UDP, length 1470
00:08:55.720566 IP 10.0.0.1.53967 > 10.0.0.2.5001: UDP, length 1470
00:08:55.732667 IP 10.0.0.1.53967 > 10.0.0.2.5001: UDP, length 1470
00:08:55.744773 IP 10.0.0.1.53967 > 10.0.0.2.5001: UDP, length 1470
00:08:55.756863 IP 10.0.0.1.53967 > 10.0.0.2.5001: UDP, length 1470
00:08:55.768981 IP 10.0.0.1.53967 > 10.0.0.2.5001: UDP, length 1470
00:08:55.781052 IP 10.0.0.1.53967 > 10.0.0.2.5001: UDP, length 1470
00:08:55.793147 IP 10.0.0.1.53967 > 10.0.0.2.5001: UDP, length 1470
00:08:55.805247 IP 10.0.0.1.53967 > 10.0.0.2.5001: UDP, length 1470
00:08:55.817338 IP 10.0.0.1.53967 > 10.0.0.2.5001: UDP, length 1470
00:08:55.829436 IP 10.0.0.1.53967 > 10.0.0.2.5001: UDP, length 1470
00:08:55.841535 IP 10.0.0.1.53967 > 10.0.0.2.5001: UDP, length 1470
00:08:55.854517 IP 10.0.0.1.53967 > 10.0.0.2.5001: UDP, length 1470
00:08:55.865724 IP 10.0.0.1.53967 > 10.0.0.2.5001: UDP, length 1470
00:08:55.877822 IP 10.0.0.1.53967 > 10.0.0.2.5001: UDP, length 1470
00:08:55.890684 IP 10.0.0.1.53967 > 10.0.0.2.5001: UDP, length 1470
00:08:55.902034 IP 10.0.0.1.53967 > 10.0.0.2.5001: UDP, length 1470
00:08:55.914739 IP 10.0.0.1.53967 > 10.0.0.2.5001: UDP, length 1470
00:08:55.926202 IP 10.0.0.1.53967 > 10.0.0.2.5001: UDP, length 1470
00:08:55.938306 IP 10.0.0.1.53967 > 10.0.0.2.5001: UDP, length 1470
00:08:55.950723 IP 10.0.0.1.53967 > 10.0.0.2.5001: UDP, length 1470
00:08:55.962491 IP 10.0.0.1.53967 > 10.0.0.2.5001: UDP, length 1470
00:08:55.974581 IP 10.0.0.1.53967 > 10.0.0.2.5001: UDP, length 1470
00:08:55.986693 IP 10.0.0.1.53967 > 10.0.0.2.5001: UDP, length 1470
00:08:55.998790 IP 10.0.0.1.53967 > 10.0.0.2.5001: UDP, length 1470
00:08:56.010872 IP 10.0.0.1.53967 > 10.0.0.2.5001: UDP, length 1470
00:08:56.022973 IP 10.0.0.1.53967 > 10.0.0.2.5001: UDP, length 1470
00:08:56.035068 IP 10.0.0.1.53967 > 10.0.0.2.5001: UDP, length 1470
00:08:56.047167 IP 10.0.0.1.53967 > 10.0.0.2.5001: UDP, length 1470
00:08:56.059309 IP 10.0.0.1.53967 > 10.0.0.2.5001: UDP, length 1470
00:08:56.071364 IP 10.0.0.1.53967 > 10.0.0.2.5001: UDP, length 1470
00:08:56.083453 IP 10.0.0.1.53967 > 10.0.0.2.5001: UDP, length 1470
00:08:56.095557 IP 10.0.0.1.53967 > 10.0.0.2.5001: UDP, length 1470
00:08:56.107644 IP 10.0.0.1.53967 > 10.0.0.2.5001: UDP, length 1470
00:08:56.119768 IP 10.0.0.1.53967 > 10.0.0.2.5001: UDP, length 1470
00:08:56.131828 IP 10.0.0.1.53967 > 10.0.0.2.5001: UDP, length 1470
00:08:56.143953 IP 10.0.0.1.53967 > 10.0.0.2.5001: UDP, length 1470
00:08:56.156029 IP 10.0.0.1.53967 > 10.0.0.2.5001: UDP, length 1470
00:08:56.168578 IP 10.0.0.1.53967 > 10.0.0.2.5001: UDP, length 1470
00:08:56.180227 IP 10.0.0.1.53967 > 10.0.0.2.5001: UDP, length 1470
00:08:56.192310 IP 10.0.0.1.53967 > 10.0.0.2.5001: UDP, length 1470
00:08:56.204407 IP 10.0.0.1.53967 > 10.0.0.2.5001: UDP, length 1470
00:08:56.216513 IP 10.0.0.1.53967 > 10.0.0.2.5001: UDP, length 1470
00:08:56.228608 IP 10.0.0.1.53967 > 10.0.0.2.5001: UDP, length 1470
00:08:56.240694 IP 10.0.0.1.53967 > 10.0.0.2.5001: UDP, length 1470
00:08:56.252810 IP 10.0.0.1.53967 > 10.0.0.2.5001: UDP, length 1470
00:08:56.264895 IP 10.0.0.1.53967 > 10.0.0.2.5001: UDP, length 1470
00:08:56.276999 IP 10.0.0.1.53967 > 10.0.0.2.5001: UDP, length 1470
00:08:56.289106 IP 10.0.0.1.53967 > 10.0.0.2.5001: UDP, length 1470
00:08:56.301202 IP 10.0.0.1.53967 > 10.0.0.2.5001: UDP, length 1470
00:08:56.314092 IP 10.0.0.1.53967 > 10.0.0.2.5001: UDP, length 1470
00:08:56.325371 IP 10.0.0.1.53967 > 10.0.0.2.5001: UDP, length 1470
00:08:56.337469 IP 10.0.0.1.53967 > 10.0.0.2.5001: UDP, length 1470
00:08:56.349559 IP 10.0.0.1.53967 > 10.0.0.2.5001: UDP, length 1470
00:08:56.361658 IP 10.0.0.1.53967 > 10.0.0.2.5001: UDP, length 1470
00:08:56.373775 IP 10.0.0.1.53967 > 10.0.0.2.5001: UDP, length 1470
00:08:56.385853 IP 10.0.0.1.53967 > 10.0.0.2.5001: UDP, length 1470
00:08:56.397943 IP 10.0.0.1.53967 > 10.0.0.2.5001: UDP, length 1470
00:08:56.410822 IP 10.0.0.1.53967 > 10.0.0.2.5001: UDP, length 1470
00:08:56.422143 IP 10.0.0.1.53967 > 10.0.0.2.5001: UDP, length 1470
00:08:56.434270 IP 10.0.0.1.53967 > 10.0.0.2.5001: UDP, length 1470
00:08:56.446324 IP 10.0.0.1.53967 > 10.0.0.2.5001: UDP, length 1470
00:08:56.458429 IP 10.0.0.1.53967 > 10.0.0.2.5001: UDP, length 1470
00:08:56.470518 IP 10.0.0.1.53967 > 10.0.0.2.5001: UDP, length 1470
00:08:56.482619 IP 10.0.0.1.53967 > 10.0.0.2.5001: UDP, length 1470
00:08:56.494723 IP 10.0.0.1.53967 > 10.0.0.2.5001: UDP, length 1470
00:08:56.506822 IP 10.0.0.1.53967 > 10.0.0.2.5001: UDP, length 1470

