00:09:34.412660 IP 10.0.0.1.46263 > 10.0.0.2.5001: UDP, length 1470
00:09:34.412825 IP 10.0.0.1.46263 > 10.0.0.2.5001: UDP, length 1470
00:09:34.424121 IP 10.0.0.1.46263 > 10.0.0.2.5001: UDP, length 1470
00:09:34.436153 IP 10.0.0.1.46263 > 10.0.0.2.5001: UDP, length 1470
00:09:34.448268 IP 10.0.0.1.46263 > 10.0.0.2.5001: UDP, length 1470
00:09:34.460378 IP 10.0.0.1.46263 > 10.0.0.2.5001: UDP, length 1470
00:09:34.472460 IP 10.0.0.1.46263 > 10.0.0.2.5001: UDP, length 1470
00:09:34.484564 IP 10.0.0.1.46263 > 10.0.0.2.5001: UDP, length 1470
00:09:34.496665 IP 10.0.0.1.46263 > 10.0.0.2.5001: UDP, length 1470
00:09:34.508753 IP 10.0.0.1.46263 > 10.0.0.2.5001: UDP, length 1470
00:09:34.520852 IP 10.0.0.1.46263 > 10.0.0.2.5001: UDP, length 1470
00:09:34.532949 IP 10.0.0.1.46263 > 10.0.0.2.5001: UDP, length 1470
00:09:34.545035 IP 10.0.0.1.46263 > 10.0.0.2.5001: UDP, length 1470
00:09:34.557135 IP 10.0.0.1.46263 > 10.0.0.2.5001: UDP, length 1470
00:09:34.569234 IP 10.0.0.1.46263 > 10.0.0.2.5001: UDP, length 1470
00:09:34.581332 IP 10.0.0.1.46263 > 10.0.0.2.5001: UDP, length 1470
00:09:34.593427 IP 10.0.0.1.46263 > 10.0.0.2.5001: UDP, length 1470
00:09:34.605555 IP 10.0.0.1.46263 > 10.0.0.2.5001: UDP, length 1470
00:09:34.618322 IP 10.0.0.1.46263 > 10.0.0.2.5001: UDP, length 1470
00:09:34.629718 IP 10.0.0.1.46263 > 10.0.0.2.5001: UDP, length 1470
00:09:34.641815 IP 10.0.0.1.46263 > 10.0.0.2.5001: UDP, length 1470
00:09:34.653918 IP 10.0.0.1.46263 > 10.0.0.2.5001: UDP, length 1470
00:09:34.666005 IP 10.0.0.1.46263 > 10.0.0.2.5001: UDP, length 1470
00:09:34.678091 IP 10.0.0.1.46263 > 10.0.0.2.5001: UDP, length 1470
00:09:34.690197 IP 10.0.0.1.46263 > 10.0.0.2.5001: UDP, length 1470
00:09:34.702327 IP 10.0.0.1.46263 > 10.0.0.2.5001: UDP, length 1470
00:09:34.714393 IP 10.0.0.1.46263 > 10.0.0.2.5001: UDP, length 1470
00:09:34.726513 IP 10.0.0.1.46263 > 10.0.0.2.5001: UDP, length 1470
00:09:34.738575 IP 10.0.0.1.46263 > 10.0.0.2.5001: UDP, length 1470
00:09:34.750669 IP 10.0.0.1.46263 > 10.0.0.2.5001: UDP, length 1470
00:09:34.763262 IP 10.0.0.1.46263 > 10.0.0.2.5001: UDP, length 1470
00:09:34.774876 IP 10.0.0.1.46263 > 10.0.0.2.5001: UDP, length 1470
00:09:34.786981 IP 10.0.0.1.46263 > 10.0.0.2.5001: UDP, length 1470
00:09:34.799067 IP 10.0.0.1.46263 > 10.0.0.2.5001: UDP, length 1470
00:09:34.811157 IP 10.0.0.1.46263 > 10.0.0.2.5001: UDP, length 1470
00:09:34.823254 IP 10.0.0.1.46263 > 10.0.0.2.5001: UDP, length 1470
00:09:34.835347 IP 10.0.0.1.46263 > 10.0.0.2.5001: UDP, length 1470
00:09:34.847466 IP 10.0.0.1.46263 > 10.0.0.2.5001: UDP, length 1470
00:09:34.859529 IP 10.0.0.1.46263 > 10.0.0.2.5001: UDP, length 1470
00:09:34.872408 IP 10.0.0.1.46263 > 10.0.0.2.5001: UDP, length 1470
00:09:34.883733 IP 10.0.0.1.46263 > 10.0.0.2.5001: UDP, length 1470
00:09:34.896479 IP 10.0.0.1.46263 > 10.0.0.2.5001: UDP, length 1470
00:09:34.907937 IP 10.0.0.1.46263 > 10.0.0.2.5001: UDP, length 1470
00:09:34.920014 IP 10.0.0.1.46263 > 10.0.0.2.5001: UDP, length 1470
00:09:34.932895 IP 10.0.0.1.46263 > 10.0.0.2.5001: UDP, length 1470
00:09:34.944232 IP 10.0.0.1.46263 > 10.0.0.2.5001: UDP, length 1470
00:09:34.957067 IP 10.0.0.1.46263 > 10.0.0.2.5001: UDP, length 1470
00:09:34.968409 IP 10.0.0.1.46263 > 10.0.0.2.5001: UDP, length 1470
00:09:34.980511 IP 10.0.0.1.46263 > 10.0.0.2.5001: UDP, length 1470
00:09:34.993374 IP 10.0.0.1.46263 > 10.0.0.2.5001: UDP, length 1470
00:09:35.004693 IP 10.0.0.1.46263 > 10.0.0.2.5001: UDP, length 1470
00:09:35.016788 IP 10.0.0.1.46263 > 10.0.0.2.5001: UDP, length 1470
00:09:35.028879 IP 10.0.0.1.46263 > 10.0.0.2.5001: UDP, length 1470
00:09:35.040981 IP 10.0.0.1.46263 > 10.0.0.2.5001: UDP, length 1470
00:09:35.053080 IP 10.0.0.1.46263 > 10.0.0.2.5001: UDP, length 1470
00:09:35.065173 IP 10.0.0.1.46263 > 10.0.0.2.5001: UDP, length 1470
00:09:35.077277 IP 10.0.0.1.46263 > 10.0.0.2.5001: UDP, length 1470
00:09:35.090012 IP 10.0.0.1.46263 > 10.0.0.2.5001: UDP, length 1470
00:09:35.101478 IP 10.0.0.1.46263 > 10.0.0.2.5001: UDP, length 1470
00:09:35.113550 IP 10.0.0.1.46263 > 10.0.0.2.5001: UDP, length 1470
00:09:35.125645 IP 10.0.0.1.46263 > 10.0.0.2.5001: UDP, length 1470
00:09:35.137748 IP 10.0.0.1.46263 > 10.0.0.2.5001: UDP, length 1470
00:09:35.149854 IP 10.0.0.1.46263 > 10.0.0.2.5001: UDP, length 1470
00:09:35.161952 IP 10.0.0.1.46263 > 10.0.0.2.5001: UDP, length 1470
00:09:35.174046 IP 10.0.0.1.46263 > 10.0.0.2.5001: UDP, length 1470
00:09:35.186142 IP 10.0.0.1.46263 > 10.0.0.2.5001: UDP, length 1470
00:09:35.198215 IP 10.0.0.1.46263 > 10.0.0.2.5001: UDP, length 1470
00:09:35.210318 IP 10.0.0.1.46263 > 10.0.0.2.5001: UDP, length 1470
00:09:35.222893 IP 10.0.0.1.46263 > 10.0.0.2.5001: UDP, length 1470
00:09:35.234532 IP 10.0.0.1.46263 > 10.0.0.2.5001: UDP, length 1470
00:09:35.246615 IP 10.0.0.1.46263 > 10.0.0.2.5001: UDP, length 1470
00:09:35.258710 IP 10.0.0.1.46263 > 10.0.0.2.5001: UDP, length 1470
00:09:35.270795 IP 10.0.0.1.46263 > 10.0.0.2.5001: UDP, length 1470
00:09:35.282901 IP 10.0.0.1.46263 > 10.0.0.2.5001: UDP, length 1470
00:09:35.295016 IP 10.0.0.1.46263 > 10.0.0.2.5001: UDP, length 1470
00:09:35.308035 IP 10.0.0.1.46263 > 10.0.0.2.5001: UDP, length 1470
00:09:35.319193 IP 10.0.0.1.46263 > 10.0.0.2.5001: UDP, length 1470
00:09:35.332052 IP 10.0.0.1.46263 > 10.0.0.2.5001: UDP, length 1470
00:09:35.343377 IP 10.0.0.1.46263 > 10.0.0.2.5001: UDP, length 1470
00:09:35.355501 IP 10.0.0.1.46263 > 10.0.0.2.5001: UDP, length 1470
00:09:35.367580 IP 10.0.0.1.46263 > 10.0.0.2.5001: UDP, length 1470
00:09:35.379669 IP 10.0.0.1.46263 > 10.0.0.2.5001: UDP, length 1470
00:09:35.391764 IP 10.0.0.1.46263 > 10.0.0.2.5001: UDP, length 1470
00:09:35.404686 IP 10.0.0.1.46263 > 10.0.0.2.5001: UDP, length 1470
00:09:35.415980 IP 10.0.0.1.46263 > 10.0.0.2.5001: UDP, length 1470
00:09:35.428049 IP 10.0.0.1.46263 > 10.0.0.2.5001: UDP, length 1470
00:09:35.440927 IP 10.0.0.1.46263 > 10.0.0.2.5001: UDP, length 1470
00:09:35.452259 IP 10.0.0.1.46263 > 10.0.0.2.5001: UDP, length 1470
00:09:35.464340 IP 10.0.0.1.46263 > 10.0.0.2.5001: UDP, length 1470
00:09:35.476436 IP 10.0.0.1.46263 > 10.0.0.2.5001: UDP, length 1470
00:09:35.488555 IP 10.0.0.1.46263 > 10.0.0.2.5001: UDP, length 1470
00:09:35.500622 IP 10.0.0.1.46263 > 10.0.0.2.5001: UDP, length 1470
00:09:35.512725 IP 10.0.0.1.46263 > 10.0.0.2.5001: UDP, length 1470
00:09:35.524815 IP 10.0.0.1.46263 > 10.0.0.2.5001: UDP, length 1470
00:09:35.536909 IP 10.0.0.1.46263 > 10.0.0.2.5001: UDP, length 1470
00:09:35.549036 IP 10.0.0.1.46263 > 10.0.0.2.5001: UDP, length 1470
00:09:35.561097 IP 10.0.0.1.46263 > 10.0.0.2.5001: UDP, length 1470
00:09:35.573199 IP 10.0.0.1.46263 > 10.0.0.2.5001: UDP, length 1470
00:09:35.585300 IP 10.0.0.1.46263 > 10.0.0.2.5001: UDP, length 1470
00:09:35.597384 IP 10.0.0.1.46263 > 10.0.0.2.5001: UDP, length 1470
00:09:35.609520 IP 10.0.0.1.46263 > 10.0.0.2.5001: UDP, length 1470
00:09:35.621612 IP 10.0.0.1.46263 > 10.0.0.2.5001: UDP, length 1470
00:09:35.633685 IP 10.0.0.1.46263 > 10.0.0.2.5001: UDP, length 1470
00:09:35.645782 IP 10.0.0.1.46263 > 10.0.0.2.5001: UDP, length 1470
00:09:35.657879 IP 10.0.0.1.46263 > 10.0.0.2.5001: UDP, length 1470
00:09:35.669979 IP 10.0.0.1.46263 > 10.0.0.2.5001: UDP, length 1470
00:09:35.682073 IP 10.0.0.1.46263 > 10.0.0.2.5001: UDP, length 1470
00:09:35.694181 IP 10.0.0.1.46263 > 10.0.0.2.5001: UDP, length 1470
00:09:35.706260 IP 10.0.0.1.46263 > 10.0.0.2.5001: UDP, length 1470
00:09:35.718354 IP 10.0.0.1.46263 > 10.0.0.2.5001: UDP, length 1470
00:09:35.730597 IP 10.0.0.1.46263 > 10.0.0.2.5001: UDP, length 1470
00:09:35.742543 IP 10.0.0.1.46263 > 10.0.0.2.5001: UDP, length 1470
00:09:35.754645 IP 10.0.0.1.46263 > 10.0.0.2.5001: UDP, length 1470
00:09:35.767432 IP 10.0.0.1.46263 > 10.0.0.2.5001: UDP, length 1470
00:09:35.778839 IP 10.0.0.1.46263 > 10.0.0.2.5001: UDP, length 1470
00:09:35.790930 IP 10.0.0.1.46263 > 10.0.0.2.5001: UDP, length 1470
00:09:35.803025 IP 10.0.0.1.46263 > 10.0.0.2.5001: UDP, length 1470
00:09:35.815165 IP 10.0.0.1.46263 > 10.0.0.2.5001: UDP, length 1470
00:09:35.827223 IP 10.0.0.1.46263 > 10.0.0.2.5001: UDP, length 1470
00:09:35.839310 IP 10.0.0.1.46263 > 10.0.0.2.5001: UDP, length 1470
00:09:35.851410 IP 10.0.0.1.46263 > 10.0.0.2.5001: UDP, length 1470
00:09:35.863510 IP 10.0.0.1.46263 > 10.0.0.2.5001: UDP, length 1470
00:09:35.875601 IP 10.0.0.1.46263 > 10.0.0.2.5001: UDP, length 1470
00:09:35.887696 IP 10.0.0.1.46263 > 10.0.0.2.5001: UDP, length 1470
00:09:35.899799 IP 10.0.0.1.46263 > 10.0.0.2.5001: UDP, length 1470
00:09:35.911892 IP 10.0.0.1.46263 > 10.0.0.2.5001: UDP, length 1470
00:09:35.924002 IP 10.0.0.1.46263 > 10.0.0.2.5001: UDP, length 1470
00:09:35.936088 IP 10.0.0.1.46263 > 10.0.0.2.5001: UDP, length 1470
00:09:35.948882 IP 10.0.0.1.46263 > 10.0.0.2.5001: UDP, length 1470
00:09:35.960276 IP 10.0.0.1.46263 > 10.0.0.2.5001: UDP, length 1470
00:09:35.972374 IP 10.0.0.1.46263 > 10.0.0.2.5001: UDP, length 1470
00:09:35.984482 IP 10.0.0.1.46263 > 10.0.0.2.5001: UDP, length 1470
00:09:35.996563 IP 10.0.0.1.46263 > 10.0.0.2.5001: UDP, length 1470
00:09:36.008661 IP 10.0.0.1.46263 > 10.0.0.2.5001: UDP, length 1470
00:09:36.020748 IP 10.0.0.1.46263 > 10.0.0.2.5001: UDP, length 1470
00:09:36.032852 IP 10.0.0.1.46263 > 10.0.0.2.5001: UDP, length 1470
00:09:36.044977 IP 10.0.0.1.46263 > 10.0.0.2.5001: UDP, length 1470
00:09:36.057815 IP 10.0.0.1.46263 > 10.0.0.2.5001: UDP, length 1470
00:09:36.069161 IP 10.0.0.1.46263 > 10.0.0.2.5001: UDP, length 1470
00:09:36.081237 IP 10.0.0.1.46263 > 10.0.0.2.5001: UDP, length 1470
00:09:36.093330 IP 10.0.0.1.46263 > 10.0.0.2.5001: UDP, length 1470
00:09:36.105433 IP 10.0.0.1.46263 > 10.0.0.2.5001: UDP, length 1470
00:09:36.117516 IP 10.0.0.1.46263 > 10.0.0.2.5001: UDP, length 1470
00:09:36.130330 IP 10.0.0.1.46263 > 10.0.0.2.5001: UDP, length 1470
00:09:36.141717 IP 10.0.0.1.46263 > 10.0.0.2.5001: UDP, length 1470
00:09:36.154612 IP 10.0.0.1.46263 > 10.0.0.2.5001: UDP, length 1470
00:09:36.165911 IP 10.0.0.1.46263 > 10.0.0.2.5001: UDP, length 1470
00:09:36.177997 IP 10.0.0.1.46263 > 10.0.0.2.5001: UDP, length 1470
00:09:36.190104 IP 10.0.0.1.46263 > 10.0.0.2.5001: UDP, length 1470
00:09:36.203012 IP 10.0.0.1.46263 > 10.0.0.2.5001: UDP, length 1470
00:09:36.214291 IP 10.0.0.1.46263 > 10.0.0.2.5001: UDP, length 1470
00:09:36.226410 IP 10.0.0.1.46263 > 10.0.0.2.5001: UDP, length 1470
00:09:36.238490 IP 10.0.0.1.46263 > 10.0.0.2.5001: UDP, length 1470
00:09:36.250779 IP 10.0.0.1.46263 > 10.0.0.2.5001: UDP, length 1470
00:09:36.262677 IP 10.0.0.1.46263 > 10.0.0.2.5001: UDP, length 1470
00:09:36.274772 IP 10.0.0.1.46263 > 10.0.0.2.5001: UDP, length 1470
00:09:36.286867 IP 10.0.0.1.46263 > 10.0.0.2.5001: UDP, length 1470
00:09:36.298974 IP 10.0.0.1.46263 > 10.0.0.2.5001: UDP, length 1470
00:09:36.311064 IP 10.0.0.1.46263 > 10.0.0.2.5001: UDP, length 1470
00:09:36.323881 IP 10.0.0.1.46263 > 10.0.0.2.5001: UDP, length 1470
00:09:36.335254 IP 10.0.0.1.46263 > 10.0.0.2.5001: UDP, length 1470
00:09:36.347351 IP 10.0.0.1.46263 > 10.0.0.2.5001: UDP, length 1470
00:09:36.359461 IP 10.0.0.1.46263 > 10.0.0.2.5001: UDP, length 1470
00:09:36.371728 IP 10.0.0.1.46263 > 10.0.0.2.5001: UDP, length 1470
00:09:36.383625 IP 10.0.0.1.46263 > 10.0.0.2.5001: UDP, length 1470
00:09:36.395731 IP 10.0.0.1.46263 > 10.0.0.2.5001: UDP, length 1470
00:09:36.408603 IP 10.0.0.1.46263 > 10.0.0.2.5001: UDP, length 1470
00:09:36.419938 IP 10.0.0.1.46263 > 10.0.0.2.5001: UDP, length 1470
00:09:36.432804 IP 10.0.0.1.46263 > 10.0.0.2.5001: UDP, length 1470
00:09:36.444119 IP 10.0.0.1.46263 > 10.0.0.2.5001: UDP, length 1470
00:09:36.456212 IP 10.0.0.1.46263 > 10.0.0.2.5001: UDP, length 1470
00:09:36.468575 IP 10.0.0.1.46263 > 10.0.0.2.5001: UDP, length 1470
00:09:36.480408 IP 10.0.0.1.46263 > 10.0.0.2.5001: UDP, length 1470
00:09:36.492497 IP 10.0.0.1.46263 > 10.0.0.2.5001: UDP, length 1470
00:09:36.504591 IP 10.0.0.1.46263 > 10.0.0.2.5001: UDP, length 1470
00:09:36.516692 IP 10.0.0.1.46263 > 10.0.0.2.5001: UDP, length 1470
00:09:36.528787 IP 10.0.0.1.46263 > 10.0.0.2.5001: UDP, length 1470
00:09:36.540883 IP 10.0.0.1.46263 > 10.0.0.2.5001: UDP, length 1470
00:09:36.553770 IP 10.0.0.1.46263 > 10.0.0.2.5001: UDP, length 1470
00:09:36.565064 IP 10.0.0.1.46263 > 10.0.0.2.5001: UDP, length 1470
00:09:36.577179 IP 10.0.0.1.46263 > 10.0.0.2.5001: UDP, length 1470
00:09:36.589267 IP 10.0.0.1.46263 > 10.0.0.2.5001: UDP, length 1470
00:09:36.601384 IP 10.0.0.1.46263 > 10.0.0.2.5001: UDP, length 1470
00:09:36.614463 IP 10.0.0.1.46263 > 10.0.0.2.5001: UDP, length 1470
00:09:36.625553 IP 10.0.0.1.46263 > 10.0.0.2.5001: UDP, length 1470
00:09:36.637653 IP 10.0.0.1.46263 > 10.0.0.2.5001: UDP, length 1470
00:09:36.649752 IP 10.0.0.1.46263 > 10.0.0.2.5001: UDP, length 1470
00:09:36.661844 IP 10.0.0.1.46263 > 10.0.0.2.5001: UDP, length 1470
00:09:36.673933 IP 10.0.0.1.46263 > 10.0.0.2.5001: UDP, length 1470
00:09:36.686045 IP 10.0.0.1.46263 > 10.0.0.2.5001: UDP, length 1470
00:09:36.698127 IP 10.0.0.1.46263 > 10.0.0.2.5001: UDP, length 1470
00:09:36.710998 IP 10.0.0.1.46263 > 10.0.0.2.5001: UDP, length 1470
00:09:36.722326 IP 10.0.0.1.46263 > 10.0.0.2.5001: UDP, length 1470
00:09:36.734416 IP 10.0.0.1.46263 > 10.0.0.2.5001: UDP, length 1470
00:09:36.746516 IP 10.0.0.1.46263 > 10.0.0.2.5001: UDP, length 1470
00:09:36.758776 IP 10.0.0.1.46263 > 10.0.0.2.5001: UDP, length 1470
00:09:36.770699 IP 10.0.0.1.46263 > 10.0.0.2.5001: UDP, length 1470
00:09:36.782804 IP 10.0.0.1.46263 > 10.0.0.2.5001: UDP, length 1470
00:09:36.794912 IP 10.0.0.1.46263 > 10.0.0.2.5001: UDP, length 1470
00:09:36.807016 IP 10.0.0.1.46263 > 10.0.0.2.5001: UDP, length 1470
00:09:36.819113 IP 10.0.0.1.46263 > 10.0.0.2.5001: UDP, length 1470
00:09:36.831173 IP 10.0.0.1.46263 > 10.0.0.2.5001: UDP, length 1470
00:09:36.843285 IP 10.0.0.1.46263 > 10.0.0.2.5001: UDP, length 1470
00:09:36.855383 IP 10.0.0.1.46263 > 10.0.0.2.5001: UDP, length 1470
00:09:36.867478 IP 10.0.0.1.46263 > 10.0.0.2.5001: UDP, length 1470
00:09:36.879594 IP 10.0.0.1.46263 > 10.0.0.2.5001: UDP, length 1470
00:09:36.891675 IP 10.0.0.1.46263 > 10.0.0.2.5001: UDP, length 1470
00:09:36.903766 IP 10.0.0.1.46263 > 10.0.0.2.5001: UDP, length 1470
00:09:36.915864 IP 10.0.0.1.46263 > 10.0.0.2.5001: UDP, length 1470
00:09:36.927946 IP 10.0.0.1.46263 > 10.0.0.2.5001: UDP, length 1470
00:09:36.940052 IP 10.0.0.1.46263 > 10.0.0.2.5001: UDP, length 1470
00:09:36.952156 IP 10.0.0.1.46263 > 10.0.0.2.5001: UDP, length 1470
00:09:36.964244 IP 10.0.0.1.46263 > 10.0.0.2.5001: UDP, length 1470
00:09:36.976365 IP 10.0.0.1.46263 > 10.0.0.2.5001: UDP, length 1470
00:09:36.988439 IP 10.0.0.1.46263 > 10.0.0.2.5001: UDP, length 1470
00:09:37.000534 IP 10.0.0.1.46263 > 10.0.0.2.5001: UDP, length 1470
00:09:37.012649 IP 10.0.0.1.46263 > 10.0.0.2.5001: UDP, length 1470
00:09:37.024711 IP 10.0.0.1.46263 > 10.0.0.2.5001: UDP, length 1470
00:09:37.037005 IP 10.0.0.1.46263 > 10.0.0.2.5001: UDP, length 1470
00:09:37.048917 IP 10.0.0.1.46263 > 10.0.0.2.5001: UDP, length 1470
00:09:37.061012 IP 10.0.0.1.46263 > 10.0.0.2.5001: UDP, length 1470
00:09:37.073134 IP 10.0.0.1.46263 > 10.0.0.2.5001: UDP, length 1470
00:09:37.085194 IP 10.0.0.1.46263 > 10.0.0.2.5001: UDP, length 1470
00:09:37.097298 IP 10.0.0.1.46263 > 10.0.0.2.5001: UDP, length 1470
00:09:37.110091 IP 10.0.0.1.46263 > 10.0.0.2.5001: UDP, length 1470
00:09:37.121495 IP 10.0.0.1.46263 > 10.0.0.2.5001: UDP, length 1470
00:09:37.133591 IP 10.0.0.1.46263 > 10.0.0.2.5001: UDP, length 1470
00:09:37.145703 IP 10.0.0.1.46263 > 10.0.0.2.5001: UDP, length 1470
00:09:37.157776 IP 10.0.0.1.46263 > 10.0.0.2.5001: UDP, length 1470
00:09:37.169896 IP 10.0.0.1.46263 > 10.0.0.2.5001: UDP, length 1470
00:09:37.181964 IP 10.0.0.1.46263 > 10.0.0.2.5001: UDP, length 1470
00:09:37.194090 IP 10.0.0.1.46263 > 10.0.0.2.5001: UDP, length 1470
00:09:37.206183 IP 10.0.0.1.46263 > 10.0.0.2.5001: UDP, length 1470
00:09:37.218260 IP 10.0.0.1.46263 > 10.0.0.2.5001: UDP, length 1470
00:09:37.230356 IP 10.0.0.1.46263 > 10.0.0.2.5001: UDP, length 1470
00:09:37.243108 IP 10.0.0.1.46263 > 10.0.0.2.5001: UDP, length 1470
00:09:37.254552 IP 10.0.0.1.46263 > 10.0.0.2.5001: UDP, length 1470
00:09:37.266663 IP 10.0.0.1.46263 > 10.0.0.2.5001: UDP, length 1470
00:09:37.279493 IP 10.0.0.1.46263 > 10.0.0.2.5001: UDP, length 1470
00:09:37.290840 IP 10.0.0.1.46263 > 10.0.0.2.5001: UDP, length 1470
00:09:37.302923 IP 10.0.0.1.46263 > 10.0.0.2.5001: UDP, length 1470
00:09:37.315031 IP 10.0.0.1.46263 > 10.0.0.2.5001: UDP, length 1470
00:09:37.327146 IP 10.0.0.1.46263 > 10.0.0.2.5001: UDP, length 1470
00:09:37.339228 IP 10.0.0.1.46263 > 10.0.0.2.5001: UDP, length 1470
00:09:37.351338 IP 10.0.0.1.46263 > 10.0.0.2.5001: UDP, length 1470
00:09:37.363407 IP 10.0.0.1.46263 > 10.0.0.2.5001: UDP, length 1470
00:09:37.375504 IP 10.0.0.1.46263 > 10.0.0.2.5001: UDP, length 1470
00:09:37.387614 IP 10.0.0.1.46263 > 10.0.0.2.5001: UDP, length 1470
00:09:37.399702 IP 10.0.0.1.46263 > 10.0.0.2.5001: UDP, length 1470
00:09:37.411799 IP 10.0.0.1.46263 > 10.0.0.2.5001: UDP, length 1470
00:09:37.423893 IP 10.0.0.1.46263 > 10.0.0.2.5001: UDP, length 1470
00:09:37.436701 IP 10.0.0.1.46263 > 10.0.0.2.5001: UDP, length 1470
00:09:37.448110 IP 10.0.0.1.46263 > 10.0.0.2.5001: UDP, length 1470
00:09:37.460190 IP 10.0.0.1.46263 > 10.0.0.2.5001: UDP, length 1470
00:09:37.472294 IP 10.0.0.1.46263 > 10.0.0.2.5001: UDP, length 1470
00:09:37.484369 IP 10.0.0.1.46263 > 10.0.0.2.5001: UDP, length 1470
00:09:37.496476 IP 10.0.0.1.46263 > 10.0.0.2.5001: UDP, length 1470
00:09:37.508564 IP 10.0.0.1.46263 > 10.0.0.2.5001: UDP, length 1470
00:09:37.520645 IP 10.0.0.1.46263 > 10.0.0.2.5001: UDP, length 1470
00:09:37.532760 IP 10.0.0.1.46263 > 10.0.0.2.5001: UDP, length 1470
00:09:37.544860 IP 10.0.0.1.46263 > 10.0.0.2.5001: UDP, length 1470
00:09:37.556948 IP 10.0.0.1.46263 > 10.0.0.2.5001: UDP, length 1470
00:09:37.569067 IP 10.0.0.1.46263 > 10.0.0.2.5001: UDP, length 1470
00:09:37.581165 IP 10.0.0.1.46263 > 10.0.0.2.5001: UDP, length 1470
00:09:37.593238 IP 10.0.0.1.46263 > 10.0.0.2.5001: UDP, length 1470
00:09:37.605333 IP 10.0.0.1.46263 > 10.0.0.2.5001: UDP, length 1470
00:09:37.617429 IP 10.0.0.1.46263 > 10.0.0.2.5001: UDP, length 1470
00:09:37.629524 IP 10.0.0.1.46263 > 10.0.0.2.5001: UDP, length 1470
00:09:37.641647 IP 10.0.0.1.46263 > 10.0.0.2.5001: UDP, length 1470
00:09:37.653710 IP 10.0.0.1.46263 > 10.0.0.2.5001: UDP, length 1470
00:09:37.665815 IP 10.0.0.1.46263 > 10.0.0.2.5001: UDP, length 1470
00:09:37.677902 IP 10.0.0.1.46263 > 10.0.0.2.5001: UDP, length 1470
00:09:37.690004 IP 10.0.0.1.46263 > 10.0.0.2.5001: UDP, length 1470
00:09:37.702124 IP 10.0.0.1.46263 > 10.0.0.2.5001: UDP, length 1470
00:09:37.714203 IP 10.0.0.1.46263 > 10.0.0.2.5001: UDP, length 1470
00:09:37.727128 IP 10.0.0.1.46263 > 10.0.0.2.5001: UDP, length 1470
00:09:37.738391 IP 10.0.0.1.46263 > 10.0.0.2.5001: UDP, length 1470
00:09:37.750481 IP 10.0.0.1.46263 > 10.0.0.2.5001: UDP, length 1470
00:09:37.762582 IP 10.0.0.1.46263 > 10.0.0.2.5001: UDP, length 1470
00:09:37.775546 IP 10.0.0.1.46263 > 10.0.0.2.5001: UDP, length 1470
00:09:37.786776 IP 10.0.0.1.46263 > 10.0.0.2.5001: UDP, length 1470
00:09:37.798869 IP 10.0.0.1.46263 > 10.0.0.2.5001: UDP, length 1470
00:09:37.810963 IP 10.0.0.1.46263 > 10.0.0.2.5001: UDP, length 1470
00:09:37.823064 IP 10.0.0.1.46263 > 10.0.0.2.5001: UDP, length 1470
00:09:37.835186 IP 10.0.0.1.46263 > 10.0.0.2.5001: UDP, length 1470
00:09:37.847244 IP 10.0.0.1.46263 > 10.0.0.2.5001: UDP, length 1470
00:09:37.859356 IP 10.0.0.1.46263 > 10.0.0.2.5001: UDP, length 1470
00:09:37.871448 IP 10.0.0.1.46263 > 10.0.0.2.5001: UDP, length 1470
00:09:37.883545 IP 10.0.0.1.46263 > 10.0.0.2.5001: UDP, length 1470
00:09:37.895639 IP 10.0.0.1.46263 > 10.0.0.2.5001: UDP, length 1470
00:09:37.908526 IP 10.0.0.1.46263 > 10.0.0.2.5001: UDP, length 1470
00:09:37.919934 IP 10.0.0.1.46263 > 10.0.0.2.5001: UDP, length 1470
00:09:37.931923 IP 10.0.0.1.46263 > 10.0.0.2.5001: UDP, length 1470
00:09:37.944021 IP 10.0.0.1.46263 > 10.0.0.2.5001: UDP, length 1470
00:09:37.956110 IP 10.0.0.1.46263 > 10.0.0.2.5001: UDP, length 1470
00:09:37.968215 IP 10.0.0.1.46263 > 10.0.0.2.5001: UDP, length 1470
00:09:37.980312 IP 10.0.0.1.46263 > 10.0.0.2.5001: UDP, length 1470
00:09:37.992402 IP 10.0.0.1.46263 > 10.0.0.2.5001: UDP, length 1470
00:09:38.004507 IP 10.0.0.1.46263 > 10.0.0.2.5001: UDP, length 1470
00:09:38.016606 IP 10.0.0.1.46263 > 10.0.0.2.5001: UDP, length 1470
00:09:38.028702 IP 10.0.0.1.46263 > 10.0.0.2.5001: UDP, length 1470
00:09:38.040794 IP 10.0.0.1.46263 > 10.0.0.2.5001: UDP, length 1470
00:09:38.052891 IP 10.0.0.1.46263 > 10.0.0.2.5001: UDP, length 1470
00:09:38.064980 IP 10.0.0.1.46263 > 10.0.0.2.5001: UDP, length 1470
00:09:38.077097 IP 10.0.0.1.46263 > 10.0.0.2.5001: UDP, length 1470
00:09:38.089187 IP 10.0.0.1.46263 > 10.0.0.2.5001: UDP, length 1470
00:09:38.101290 IP 10.0.0.1.46263 > 10.0.0.2.5001: UDP, length 1470
00:09:38.113365 IP 10.0.0.1.46263 > 10.0.0.2.5001: UDP, length 1470
00:09:38.125457 IP 10.0.0.1.46263 > 10.0.0.2.5001: UDP, length 1470
00:09:38.137555 IP 10.0.0.1.46263 > 10.0.0.2.5001: UDP, length 1470
00:09:38.149652 IP 10.0.0.1.46263 > 10.0.0.2.5001: UDP, length 1470
00:09:38.161746 IP 10.0.0.1.46263 > 10.0.0.2.5001: UDP, length 1470
00:09:38.173849 IP 10.0.0.1.46263 > 10.0.0.2.5001: UDP, length 1470
00:09:38.185947 IP 10.0.0.1.46263 > 10.0.0.2.5001: UDP, length 1470
00:09:38.198037 IP 10.0.0.1.46263 > 10.0.0.2.5001: UDP, length 1470
00:09:38.210132 IP 10.0.0.1.46263 > 10.0.0.2.5001: UDP, length 1470
00:09:38.222260 IP 10.0.0.1.46263 > 10.0.0.2.5001: UDP, length 1470
00:09:38.234310 IP 10.0.0.1.46263 > 10.0.0.2.5001: UDP, length 1470
00:09:38.246424 IP 10.0.0.1.46263 > 10.0.0.2.5001: UDP, length 1470
00:09:38.258512 IP 10.0.0.1.46263 > 10.0.0.2.5001: UDP, length 1470
00:09:38.270601 IP 10.0.0.1.46263 > 10.0.0.2.5001: UDP, length 1470
00:09:38.282739 IP 10.0.0.1.46263 > 10.0.0.2.5001: UDP, length 1470
00:09:38.294811 IP 10.0.0.1.46263 > 10.0.0.2.5001: UDP, length 1470
00:09:38.306901 IP 10.0.0.1.46263 > 10.0.0.2.5001: UDP, length 1470
00:09:38.319016 IP 10.0.0.1.46263 > 10.0.0.2.5001: UDP, length 1470
00:09:38.331077 IP 10.0.0.1.46263 > 10.0.0.2.5001: UDP, length 1470
00:09:38.343187 IP 10.0.0.1.46263 > 10.0.0.2.5001: UDP, length 1470
00:09:38.355281 IP 10.0.0.1.46263 > 10.0.0.2.5001: UDP, length 1470
00:09:38.367376 IP 10.0.0.1.46263 > 10.0.0.2.5001: UDP, length 1470
00:09:38.380369 IP 10.0.0.1.46263 > 10.0.0.2.5001: UDP, length 1470
00:09:38.391573 IP 10.0.0.1.46263 > 10.0.0.2.5001: UDP, length 1470
00:09:38.403693 IP 10.0.0.1.46263 > 10.0.0.2.5001: UDP, length 1470
00:09:38.416545 IP 10.0.0.1.46263 > 10.0.0.2.5001: UDP, length 1470
00:09:38.427851 IP 10.0.0.1.46263 > 10.0.0.2.5001: UDP, length 1470
00:09:38.439957 IP 10.0.0.1.46263 > 10.0.0.2.5001: UDP, length 1470
00:09:38.452062 IP 10.0.0.1.46263 > 10.0.0.2.5001: UDP, length 1470
00:09:38.464179 IP 10.0.0.1.46263 > 10.0.0.2.5001: UDP, length 1470
00:09:38.476282 IP 10.0.0.1.46263 > 10.0.0.2.5001: UDP, length 1470
00:09:38.488343 IP 10.0.0.1.46263 > 10.0.0.2.5001: UDP, length 1470
00:09:38.501183 IP 10.0.0.1.46263 > 10.0.0.2.5001: UDP, length 1470
00:09:38.512527 IP 10.0.0.1.46263 > 10.0.0.2.5001: UDP, length 1470
00:09:38.524627 IP 10.0.0.1.46263 > 10.0.0.2.5001: UDP, length 1470
00:09:38.536734 IP 10.0.0.1.46263 > 10.0.0.2.5001: UDP, length 1470
00:09:38.548825 IP 10.0.0.1.46263 > 10.0.0.2.5001: UDP, length 1470
00:09:38.560917 IP 10.0.0.1.46263 > 10.0.0.2.5001: UDP, length 1470
00:09:38.573012 IP 10.0.0.1.46263 > 10.0.0.2.5001: UDP, length 1470
00:09:38.585108 IP 10.0.0.1.46263 > 10.0.0.2.5001: UDP, length 1470
00:09:38.597208 IP 10.0.0.1.46263 > 10.0.0.2.5001: UDP, length 1470
00:09:38.609304 IP 10.0.0.1.46263 > 10.0.0.2.5001: UDP, length 1470
00:09:38.621380 IP 10.0.0.1.46263 > 10.0.0.2.5001: UDP, length 1470
00:09:38.633493 IP 10.0.0.1.46263 > 10.0.0.2.5001: UDP, length 1470
00:09:38.645582 IP 10.0.0.1.46263 > 10.0.0.2.5001: UDP, length 1470
00:09:38.657681 IP 10.0.0.1.46263 > 10.0.0.2.5001: UDP, length 1470
00:09:38.669789 IP 10.0.0.1.46263 > 10.0.0.2.5001: UDP, length 1470
00:09:38.681882 IP 10.0.0.1.46263 > 10.0.0.2.5001: UDP, length 1470
00:09:38.694039 IP 10.0.0.1.46263 > 10.0.0.2.5001: UDP, length 1470
00:09:38.706065 IP 10.0.0.1.46263 > 10.0.0.2.5001: UDP, length 1470
00:09:38.718164 IP 10.0.0.1.46263 > 10.0.0.2.5001: UDP, length 1470
00:09:38.730270 IP 10.0.0.1.46263 > 10.0.0.2.5001: UDP, length 1470
00:09:38.742359 IP 10.0.0.1.46263 > 10.0.0.2.5001: UDP, length 1470
00:09:38.754456 IP 10.0.0.1.46263 > 10.0.0.2.5001: UDP, length 1470
00:09:38.766548 IP 10.0.0.1.46263 > 10.0.0.2.5001: UDP, length 1470
00:09:38.778652 IP 10.0.0.1.46263 > 10.0.0.2.5001: UDP, length 1470
00:09:38.790749 IP 10.0.0.1.46263 > 10.0.0.2.5001: UDP, length 1470
00:09:38.802830 IP 10.0.0.1.46263 > 10.0.0.2.5001: UDP, length 1470
00:09:38.814943 IP 10.0.0.1.46263 > 10.0.0.2.5001: UDP, length 1470
00:09:38.827045 IP 10.0.0.1.46263 > 10.0.0.2.5001: UDP, length 1470
00:09:38.839123 IP 10.0.0.1.46263 > 10.0.0.2.5001: UDP, length 1470
00:09:38.851243 IP 10.0.0.1.46263 > 10.0.0.2.5001: UDP, length 1470
00:09:38.863321 IP 10.0.0.1.46263 > 10.0.0.2.5001: UDP, length 1470
00:09:38.875411 IP 10.0.0.1.46263 > 10.0.0.2.5001: UDP, length 1470
00:09:38.887508 IP 10.0.0.1.46263 > 10.0.0.2.5001: UDP, length 1470
00:09:38.899620 IP 10.0.0.1.46263 > 10.0.0.2.5001: UDP, length 1470
00:09:38.911741 IP 10.0.0.1.46263 > 10.0.0.2.5001: UDP, length 1470
00:09:38.923789 IP 10.0.0.1.46263 > 10.0.0.2.5001: UDP, length 1470
00:09:38.936664 IP 10.0.0.1.46263 > 10.0.0.2.5001: UDP, length 1470
00:09:38.947989 IP 10.0.0.1.46263 > 10.0.0.2.5001: UDP, length 1470
00:09:38.960083 IP 10.0.0.1.46263 > 10.0.0.2.5001: UDP, length 1470
00:09:38.972981 IP 10.0.0.1.46263 > 10.0.0.2.5001: UDP, length 1470
00:09:38.984286 IP 10.0.0.1.46263 > 10.0.0.2.5001: UDP, length 1470
00:09:38.996375 IP 10.0.0.1.46263 > 10.0.0.2.5001: UDP, length 1470
00:09:39.008467 IP 10.0.0.1.46263 > 10.0.0.2.5001: UDP, length 1470
00:09:39.020575 IP 10.0.0.1.46263 > 10.0.0.2.5001: UDP, length 1470
00:09:39.032680 IP 10.0.0.1.46263 > 10.0.0.2.5001: UDP, length 1470
00:09:39.044767 IP 10.0.0.1.46263 > 10.0.0.2.5001: UDP, length 1470
00:09:39.056857 IP 10.0.0.1.46263 > 10.0.0.2.5001: UDP, length 1470
00:09:39.068972 IP 10.0.0.1.46263 > 10.0.0.2.5001: UDP, length 1470
00:09:39.081040 IP 10.0.0.1.46263 > 10.0.0.2.5001: UDP, length 1470
00:09:39.093138 IP 10.0.0.1.46263 > 10.0.0.2.5001: UDP, length 1470
00:09:39.105243 IP 10.0.0.1.46263 > 10.0.0.2.5001: UDP, length 1470
00:09:39.118096 IP 10.0.0.1.46263 > 10.0.0.2.5001: UDP, length 1470
00:09:39.129422 IP 10.0.0.1.46263 > 10.0.0.2.5001: UDP, length 1470
00:09:39.141516 IP 10.0.0.1.46263 > 10.0.0.2.5001: UDP, length 1470
00:09:39.153618 IP 10.0.0.1.46263 > 10.0.0.2.5001: UDP, length 1470
00:09:39.165712 IP 10.0.0.1.46263 > 10.0.0.2.5001: UDP, length 1470
00:09:39.177806 IP 10.0.0.1.46263 > 10.0.0.2.5001: UDP, length 1470
00:09:39.189908 IP 10.0.0.1.46263 > 10.0.0.2.5001: UDP, length 1470
00:09:39.202007 IP 10.0.0.1.46263 > 10.0.0.2.5001: UDP, length 1470
00:09:39.214095 IP 10.0.0.1.46263 > 10.0.0.2.5001: UDP, length 1470
00:09:39.226203 IP 10.0.0.1.46263 > 10.0.0.2.5001: UDP, length 1470
00:09:39.238295 IP 10.0.0.1.46263 > 10.0.0.2.5001: UDP, length 1470
00:09:39.250403 IP 10.0.0.1.46263 > 10.0.0.2.5001: UDP, length 1470
00:09:39.262488 IP 10.0.0.1.46263 > 10.0.0.2.5001: UDP, length 1470
00:09:39.274582 IP 10.0.0.1.46263 > 10.0.0.2.5001: UDP, length 1470
00:09:39.286681 IP 10.0.0.1.46263 > 10.0.0.2.5001: UDP, length 1470
00:09:39.298774 IP 10.0.0.1.46263 > 10.0.0.2.5001: UDP, length 1470
00:09:39.311672 IP 10.0.0.1.46263 > 10.0.0.2.5001: UDP, length 1470
00:09:39.322965 IP 10.0.0.1.46263 > 10.0.0.2.5001: UDP, length 1470
00:09:39.335066 IP 10.0.0.1.46263 > 10.0.0.2.5001: UDP, length 1470
00:09:39.347164 IP 10.0.0.1.46263 > 10.0.0.2.5001: UDP, length 1470
00:09:39.359256 IP 10.0.0.1.46263 > 10.0.0.2.5001: UDP, length 1470
00:09:39.371352 IP 10.0.0.1.46263 > 10.0.0.2.5001: UDP, length 1470
00:09:39.384149 IP 10.0.0.1.46263 > 10.0.0.2.5001: UDP, length 1470
00:09:39.395531 IP 10.0.0.1.46263 > 10.0.0.2.5001: UDP, length 1470
00:09:39.407654 IP 10.0.0.1.46263 > 10.0.0.2.5001: UDP, length 1470
00:09:39.419741 IP 10.0.0.1.46263 > 10.0.0.2.5001: UDP, length 1470
00:09:39.431833 IP 10.0.0.1.46263 > 10.0.0.2.5001: UDP, length 1470
00:09:39.443918 IP 10.0.0.1.46263 > 10.0.0.2.5001: UDP, length 1470
00:09:39.456025 IP 10.0.0.1.46263 > 10.0.0.2.5001: UDP, length 1470
00:09:39.468127 IP 10.0.0.1.46263 > 10.0.0.2.5001: UDP, length 1470
00:09:39.480209 IP 10.0.0.1.46263 > 10.0.0.2.5001: UDP, length 1470
00:09:39.492318 IP 10.0.0.1.46263 > 10.0.0.2.5001: UDP, length 1470
00:09:39.504408 IP 10.0.0.1.46263 > 10.0.0.2.5001: UDP, length 1470
00:09:39.516590 IP 10.0.0.1.46263 > 10.0.0.2.5001: UDP, length 1470
00:09:39.528594 IP 10.0.0.1.46263 > 10.0.0.2.5001: UDP, length 1470
00:09:39.540710 IP 10.0.0.1.46263 > 10.0.0.2.5001: UDP, length 1470
00:09:39.552789 IP 10.0.0.1.46263 > 10.0.0.2.5001: UDP, length 1470
00:09:39.564885 IP 10.0.0.1.46263 > 10.0.0.2.5001: UDP, length 1470
00:09:39.576992 IP 10.0.0.1.46263 > 10.0.0.2.5001: UDP, length 1470
00:09:39.589075 IP 10.0.0.1.46263 > 10.0.0.2.5001: UDP, length 1470
00:09:39.601195 IP 10.0.0.1.46263 > 10.0.0.2.5001: UDP, length 1470
00:09:39.613280 IP 10.0.0.1.46263 > 10.0.0.2.5001: UDP, length 1470
00:09:39.625363 IP 10.0.0.1.46263 > 10.0.0.2.5001: UDP, length 1470
00:09:39.637462 IP 10.0.0.1.46263 > 10.0.0.2.5001: UDP, length 1470
00:09:39.650298 IP 10.0.0.1.46263 > 10.0.0.2.5001: UDP, length 1470
00:09:39.661694 IP 10.0.0.1.46263 > 10.0.0.2.5001: UDP, length 1470
00:09:39.673744 IP 10.0.0.1.46263 > 10.0.0.2.5001: UDP, length 1470
00:09:39.685847 IP 10.0.0.1.46263 > 10.0.0.2.5001: UDP, length 1470
00:09:39.697940 IP 10.0.0.1.46263 > 10.0.0.2.5001: UDP, length 1470
00:09:39.710730 IP 10.0.0.1.46263 > 10.0.0.2.5001: UDP, length 1470
00:09:39.722168 IP 10.0.0.1.46263 > 10.0.0.2.5001: UDP, length 1470
00:09:39.734217 IP 10.0.0.1.46263 > 10.0.0.2.5001: UDP, length 1470
00:09:39.747072 IP 10.0.0.1.46263 > 10.0.0.2.5001: UDP, length 1470
00:09:39.758419 IP 10.0.0.1.46263 > 10.0.0.2.5001: UDP, length 1470
00:09:39.770510 IP 10.0.0.1.46263 > 10.0.0.2.5001: UDP, length 1470
00:09:39.782638 IP 10.0.0.1.46263 > 10.0.0.2.5001: UDP, length 1470
00:09:39.794716 IP 10.0.0.1.46263 > 10.0.0.2.5001: UDP, length 1470
00:09:39.806805 IP 10.0.0.1.46263 > 10.0.0.2.5001: UDP, length 1470
00:09:39.818910 IP 10.0.0.1.46263 > 10.0.0.2.5001: UDP, length 1470
00:09:39.830984 IP 10.0.0.1.46263 > 10.0.0.2.5001: UDP, length 1470
00:09:39.843090 IP 10.0.0.1.46263 > 10.0.0.2.5001: UDP, length 1470
00:09:39.855191 IP 10.0.0.1.46263 > 10.0.0.2.5001: UDP, length 1470
00:09:39.867285 IP 10.0.0.1.46263 > 10.0.0.2.5001: UDP, length 1470
00:09:39.879384 IP 10.0.0.1.46263 > 10.0.0.2.5001: UDP, length 1470
00:09:39.891474 IP 10.0.0.1.46263 > 10.0.0.2.5001: UDP, length 1470
00:09:39.903578 IP 10.0.0.1.46263 > 10.0.0.2.5001: UDP, length 1470
00:09:39.915676 IP 10.0.0.1.46263 > 10.0.0.2.5001: UDP, length 1470
00:09:39.927757 IP 10.0.0.1.46263 > 10.0.0.2.5001: UDP, length 1470
00:09:39.939860 IP 10.0.0.1.46263 > 10.0.0.2.5001: UDP, length 1470
00:09:39.951963 IP 10.0.0.1.46263 > 10.0.0.2.5001: UDP, length 1470
00:09:39.964051 IP 10.0.0.1.46263 > 10.0.0.2.5001: UDP, length 1470
00:09:39.976174 IP 10.0.0.1.46263 > 10.0.0.2.5001: UDP, length 1470
00:09:39.988231 IP 10.0.0.1.46263 > 10.0.0.2.5001: UDP, length 1470
00:09:40.000339 IP 10.0.0.1.46263 > 10.0.0.2.5001: UDP, length 1470
00:09:40.012436 IP 10.0.0.1.46263 > 10.0.0.2.5001: UDP, length 1470
00:09:40.024533 IP 10.0.0.1.46263 > 10.0.0.2.5001: UDP, length 1470
00:09:40.036628 IP 10.0.0.1.46263 > 10.0.0.2.5001: UDP, length 1470
00:09:40.048728 IP 10.0.0.1.46263 > 10.0.0.2.5001: UDP, length 1470
00:09:40.060824 IP 10.0.0.1.46263 > 10.0.0.2.5001: UDP, length 1470
00:09:40.072916 IP 10.0.0.1.46263 > 10.0.0.2.5001: UDP, length 1470
00:09:40.085012 IP 10.0.0.1.46263 > 10.0.0.2.5001: UDP, length 1470
00:09:40.097900 IP 10.0.0.1.46263 > 10.0.0.2.5001: UDP, length 1470
00:09:40.109196 IP 10.0.0.1.46263 > 10.0.0.2.5001: UDP, length 1470
00:09:40.121285 IP 10.0.0.1.46263 > 10.0.0.2.5001: UDP, length 1470
00:09:40.133413 IP 10.0.0.1.46263 > 10.0.0.2.5001: UDP, length 1470
00:09:40.146387 IP 10.0.0.1.46263 > 10.0.0.2.5001: UDP, length 1470
00:09:40.157593 IP 10.0.0.1.46263 > 10.0.0.2.5001: UDP, length 1470
00:09:40.169708 IP 10.0.0.1.46263 > 10.0.0.2.5001: UDP, length 1470
00:09:40.182711 IP 10.0.0.1.46263 > 10.0.0.2.5001: UDP, length 1470
00:09:40.193904 IP 10.0.0.1.46263 > 10.0.0.2.5001: UDP, length 1470
00:09:40.205984 IP 10.0.0.1.46263 > 10.0.0.2.5001: UDP, length 1470
00:09:40.218069 IP 10.0.0.1.46263 > 10.0.0.2.5001: UDP, length 1470
00:09:40.230190 IP 10.0.0.1.46263 > 10.0.0.2.5001: UDP, length 1470
00:09:40.242251 IP 10.0.0.1.46263 > 10.0.0.2.5001: UDP, length 1470
00:09:40.254360 IP 10.0.0.1.46263 > 10.0.0.2.5001: UDP, length 1470
00:09:40.266455 IP 10.0.0.1.46263 > 10.0.0.2.5001: UDP, length 1470
00:09:40.278535 IP 10.0.0.1.46263 > 10.0.0.2.5001: UDP, length 1470
00:09:40.290662 IP 10.0.0.1.46263 > 10.0.0.2.5001: UDP, length 1470
00:09:40.302745 IP 10.0.0.1.46263 > 10.0.0.2.5001: UDP, length 1470
00:09:40.314840 IP 10.0.0.1.46263 > 10.0.0.2.5001: UDP, length 1470
00:09:40.326940 IP 10.0.0.1.46263 > 10.0.0.2.5001: UDP, length 1470
00:09:40.339028 IP 10.0.0.1.46263 > 10.0.0.2.5001: UDP, length 1470
00:09:40.351147 IP 10.0.0.1.46263 > 10.0.0.2.5001: UDP, length 1470
00:09:40.363243 IP 10.0.0.1.46263 > 10.0.0.2.5001: UDP, length 1470
00:09:40.375896 IP 10.0.0.1.46263 > 10.0.0.2.5001: UDP, length 1470
00:09:40.387419 IP 10.0.0.1.46263 > 10.0.0.2.5001: UDP, length 1470
00:09:40.399508 IP 10.0.0.1.46263 > 10.0.0.2.5001: UDP, length 1470
00:09:40.411603 IP 10.0.0.1.46263 > 10.0.0.2.5001: UDP, length 1470
00:09:40.423701 IP 10.0.0.1.46263 > 10.0.0.2.5001: UDP, length 1470
00:09:40.435796 IP 10.0.0.1.46263 > 10.0.0.2.5001: UDP, length 1470
00:09:40.447890 IP 10.0.0.1.46263 > 10.0.0.2.5001: UDP, length 1470
00:09:40.459989 IP 10.0.0.1.46263 > 10.0.0.2.5001: UDP, length 1470
00:09:40.472087 IP 10.0.0.1.46263 > 10.0.0.2.5001: UDP, length 1470
00:09:40.484176 IP 10.0.0.1.46263 > 10.0.0.2.5001: UDP, length 1470
00:09:40.496282 IP 10.0.0.1.46263 > 10.0.0.2.5001: UDP, length 1470
00:09:40.508375 IP 10.0.0.1.46263 > 10.0.0.2.5001: UDP, length 1470
00:09:40.520460 IP 10.0.0.1.46263 > 10.0.0.2.5001: UDP, length 1470
00:09:40.532565 IP 10.0.0.1.46263 > 10.0.0.2.5001: UDP, length 1470
00:09:40.545508 IP 10.0.0.1.46263 > 10.0.0.2.5001: UDP, length 1470
00:09:40.556791 IP 10.0.0.1.46263 > 10.0.0.2.5001: UDP, length 1470
00:09:40.568866 IP 10.0.0.1.46263 > 10.0.0.2.5001: UDP, length 1470
00:09:40.580948 IP 10.0.0.1.46263 > 10.0.0.2.5001: UDP, length 1470
00:09:40.593046 IP 10.0.0.1.46263 > 10.0.0.2.5001: UDP, length 1470
00:09:40.605846 IP 10.0.0.1.46263 > 10.0.0.2.5001: UDP, length 1470
00:09:40.617261 IP 10.0.0.1.46263 > 10.0.0.2.5001: UDP, length 1470
00:09:40.629323 IP 10.0.0.1.46263 > 10.0.0.2.5001: UDP, length 1470
00:09:40.641429 IP 10.0.0.1.46263 > 10.0.0.2.5001: UDP, length 1470
00:09:40.653533 IP 10.0.0.1.46263 > 10.0.0.2.5001: UDP, length 1470
00:09:40.665619 IP 10.0.0.1.46263 > 10.0.0.2.5001: UDP, length 1470
00:09:40.677722 IP 10.0.0.1.46263 > 10.0.0.2.5001: UDP, length 1470
00:09:40.689820 IP 10.0.0.1.46263 > 10.0.0.2.5001: UDP, length 1470
00:09:40.702687 IP 10.0.0.1.46263 > 10.0.0.2.5001: UDP, length 1470
00:09:40.714004 IP 10.0.0.1.46263 > 10.0.0.2.5001: UDP, length 1470
00:09:40.726106 IP 10.0.0.1.46263 > 10.0.0.2.5001: UDP, length 1470
00:09:40.738197 IP 10.0.0.1.46263 > 10.0.0.2.5001: UDP, length 1470
00:09:40.750630 IP 10.0.0.1.46263 > 10.0.0.2.5001: UDP, length 1470
00:09:40.762394 IP 10.0.0.1.46263 > 10.0.0.2.5001: UDP, length 1470
00:09:40.774484 IP 10.0.0.1.46263 > 10.0.0.2.5001: UDP, length 1470
00:09:40.787283 IP 10.0.0.1.46263 > 10.0.0.2.5001: UDP, length 1470
00:09:40.798676 IP 10.0.0.1.46263 > 10.0.0.2.5001: UDP, length 1470
00:09:40.810784 IP 10.0.0.1.46263 > 10.0.0.2.5001: UDP, length 1470
00:09:40.823620 IP 10.0.0.1.46263 > 10.0.0.2.5001: UDP, length 1470
00:09:40.834964 IP 10.0.0.1.46263 > 10.0.0.2.5001: UDP, length 1470
00:09:40.847066 IP 10.0.0.1.46263 > 10.0.0.2.5001: UDP, length 1470
00:09:40.859155 IP 10.0.0.1.46263 > 10.0.0.2.5001: UDP, length 1470
00:09:40.871265 IP 10.0.0.1.46263 > 10.0.0.2.5001: UDP, length 1470
00:09:40.883340 IP 10.0.0.1.46263 > 10.0.0.2.5001: UDP, length 1470
00:09:40.895447 IP 10.0.0.1.46263 > 10.0.0.2.5001: UDP, length 1470
00:09:40.907541 IP 10.0.0.1.46263 > 10.0.0.2.5001: UDP, length 1470
00:09:40.919647 IP 10.0.0.1.46263 > 10.0.0.2.5001: UDP, length 1470
00:09:40.931733 IP 10.0.0.1.46263 > 10.0.0.2.5001: UDP, length 1470
00:09:40.943836 IP 10.0.0.1.46263 > 10.0.0.2.5001: UDP, length 1470
00:09:40.955910 IP 10.0.0.1.46263 > 10.0.0.2.5001: UDP, length 1470
00:09:40.968023 IP 10.0.0.1.46263 > 10.0.0.2.5001: UDP, length 1470
00:09:40.980118 IP 10.0.0.1.46263 > 10.0.0.2.5001: UDP, length 1470
00:09:40.992989 IP 10.0.0.1.46263 > 10.0.0.2.5001: UDP, length 1470
00:09:41.004516 IP 10.0.0.1.46263 > 10.0.0.2.5001: UDP, length 1470
00:09:41.016391 IP 10.0.0.1.46263 > 10.0.0.2.5001: UDP, length 1470
00:09:41.029280 IP 10.0.0.1.46263 > 10.0.0.2.5001: UDP, length 1470
00:09:41.040592 IP 10.0.0.1.46263 > 10.0.0.2.5001: UDP, length 1470
00:09:41.052690 IP 10.0.0.1.46263 > 10.0.0.2.5001: UDP, length 1470
00:09:41.065589 IP 10.0.0.1.46263 > 10.0.0.2.5001: UDP, length 1470
00:09:41.076908 IP 10.0.0.1.46263 > 10.0.0.2.5001: UDP, length 1470
00:09:41.088975 IP 10.0.0.1.46263 > 10.0.0.2.5001: UDP, length 1470
00:09:41.101101 IP 10.0.0.1.46263 > 10.0.0.2.5001: UDP, length 1470
00:09:41.113172 IP 10.0.0.1.46263 > 10.0.0.2.5001: UDP, length 1470
00:09:41.125397 IP 10.0.0.1.46263 > 10.0.0.2.5001: UDP, length 1470
00:09:41.137376 IP 10.0.0.1.46263 > 10.0.0.2.5001: UDP, length 1470
00:09:41.149464 IP 10.0.0.1.46263 > 10.0.0.2.5001: UDP, length 1470
00:09:41.161556 IP 10.0.0.1.46263 > 10.0.0.2.5001: UDP, length 1470
00:09:41.173652 IP 10.0.0.1.46263 > 10.0.0.2.5001: UDP, length 1470
00:09:41.185757 IP 10.0.0.1.46263 > 10.0.0.2.5001: UDP, length 1470
00:09:41.198619 IP 10.0.0.1.46263 > 10.0.0.2.5001: UDP, length 1470
00:09:41.209943 IP 10.0.0.1.46263 > 10.0.0.2.5001: UDP, length 1470
00:09:41.222039 IP 10.0.0.1.46263 > 10.0.0.2.5001: UDP, length 1470
00:09:41.234137 IP 10.0.0.1.46263 > 10.0.0.2.5001: UDP, length 1470
00:09:41.246230 IP 10.0.0.1.46263 > 10.0.0.2.5001: UDP, length 1470
00:09:41.258329 IP 10.0.0.1.46263 > 10.0.0.2.5001: UDP, length 1470
00:09:41.270421 IP 10.0.0.1.46263 > 10.0.0.2.5001: UDP, length 1470
00:09:41.282511 IP 10.0.0.1.46263 > 10.0.0.2.5001: UDP, length 1470
00:09:41.294621 IP 10.0.0.1.46263 > 10.0.0.2.5001: UDP, length 1470
00:09:41.306708 IP 10.0.0.1.46263 > 10.0.0.2.5001: UDP, length 1470
00:09:41.318797 IP 10.0.0.1.46263 > 10.0.0.2.5001: UDP, length 1470
00:09:41.330905 IP 10.0.0.1.46263 > 10.0.0.2.5001: UDP, length 1470
00:09:41.342989 IP 10.0.0.1.46263 > 10.0.0.2.5001: UDP, length 1470
00:09:41.355093 IP 10.0.0.1.46263 > 10.0.0.2.5001: UDP, length 1470
00:09:41.367189 IP 10.0.0.1.46263 > 10.0.0.2.5001: UDP, length 1470
00:09:41.379302 IP 10.0.0.1.46263 > 10.0.0.2.5001: UDP, length 1470
00:09:41.391399 IP 10.0.0.1.46263 > 10.0.0.2.5001: UDP, length 1470
00:09:41.403478 IP 10.0.0.1.46263 > 10.0.0.2.5001: UDP, length 1470
00:09:41.415573 IP 10.0.0.1.46263 > 10.0.0.2.5001: UDP, length 1470
00:09:41.427662 IP 10.0.0.1.46263 > 10.0.0.2.5001: UDP, length 1470
00:09:41.439764 IP 10.0.0.1.46263 > 10.0.0.2.5001: UDP, length 1470
00:09:41.451863 IP 10.0.0.1.46263 > 10.0.0.2.5001: UDP, length 1470
00:09:41.463949 IP 10.0.0.1.46263 > 10.0.0.2.5001: UDP, length 1470
00:09:41.476052 IP 10.0.0.1.46263 > 10.0.0.2.5001: UDP, length 1470
00:09:41.488148 IP 10.0.0.1.46263 > 10.0.0.2.5001: UDP, length 1470
00:09:41.500237 IP 10.0.0.1.46263 > 10.0.0.2.5001: UDP, length 1470
00:09:41.512366 IP 10.0.0.1.46263 > 10.0.0.2.5001: UDP, length 1470
00:09:41.524450 IP 10.0.0.1.46263 > 10.0.0.2.5001: UDP, length 1470
00:09:41.536526 IP 10.0.0.1.46263 > 10.0.0.2.5001: UDP, length 1470
00:09:41.548631 IP 10.0.0.1.46263 > 10.0.0.2.5001: UDP, length 1470
00:09:41.561470 IP 10.0.0.1.46263 > 10.0.0.2.5001: UDP, length 1470
00:09:41.572843 IP 10.0.0.1.46263 > 10.0.0.2.5001: UDP, length 1470
00:09:41.584923 IP 10.0.0.1.46263 > 10.0.0.2.5001: UDP, length 1470
00:09:41.597010 IP 10.0.0.1.46263 > 10.0.0.2.5001: UDP, length 1470
00:09:41.609108 IP 10.0.0.1.46263 > 10.0.0.2.5001: UDP, length 1470
00:09:41.621203 IP 10.0.0.1.46263 > 10.0.0.2.5001: UDP, length 1470
00:09:41.633294 IP 10.0.0.1.46263 > 10.0.0.2.5001: UDP, length 1470
00:09:41.645394 IP 10.0.0.1.46263 > 10.0.0.2.5001: UDP, length 1470
00:09:41.657495 IP 10.0.0.1.46263 > 10.0.0.2.5001: UDP, length 1470
00:09:41.669600 IP 10.0.0.1.46263 > 10.0.0.2.5001: UDP, length 1470
00:09:41.681686 IP 10.0.0.1.46263 > 10.0.0.2.5001: UDP, length 1470
00:09:41.693803 IP 10.0.0.1.46263 > 10.0.0.2.5001: UDP, length 1470
00:09:41.706661 IP 10.0.0.1.46263 > 10.0.0.2.5001: UDP, length 1470
00:09:41.717971 IP 10.0.0.1.46263 > 10.0.0.2.5001: UDP, length 1470
00:09:41.730061 IP 10.0.0.1.46263 > 10.0.0.2.5001: UDP, length 1470
00:09:41.742167 IP 10.0.0.1.46263 > 10.0.0.2.5001: UDP, length 1470
00:09:41.754263 IP 10.0.0.1.46263 > 10.0.0.2.5001: UDP, length 1470
00:09:41.766353 IP 10.0.0.1.46263 > 10.0.0.2.5001: UDP, length 1470
00:09:41.778461 IP 10.0.0.1.46263 > 10.0.0.2.5001: UDP, length 1470
00:09:41.790560 IP 10.0.0.1.46263 > 10.0.0.2.5001: UDP, length 1470
00:09:41.802639 IP 10.0.0.1.46263 > 10.0.0.2.5001: UDP, length 1470
00:09:41.814735 IP 10.0.0.1.46263 > 10.0.0.2.5001: UDP, length 1470
00:09:41.826845 IP 10.0.0.1.46263 > 10.0.0.2.5001: UDP, length 1470
00:09:41.839704 IP 10.0.0.1.46263 > 10.0.0.2.5001: UDP, length 1470
00:09:41.851040 IP 10.0.0.1.46263 > 10.0.0.2.5001: UDP, length 1470
00:09:41.864018 IP 10.0.0.1.46263 > 10.0.0.2.5001: UDP, length 1470
00:09:41.875214 IP 10.0.0.1.46263 > 10.0.0.2.5001: UDP, length 1470
00:09:41.887315 IP 10.0.0.1.46263 > 10.0.0.2.5001: UDP, length 1470
00:09:41.899416 IP 10.0.0.1.46263 > 10.0.0.2.5001: UDP, length 1470
00:09:41.911534 IP 10.0.0.1.46263 > 10.0.0.2.5001: UDP, length 1470
00:09:41.923604 IP 10.0.0.1.46263 > 10.0.0.2.5001: UDP, length 1470
00:09:41.935700 IP 10.0.0.1.46263 > 10.0.0.2.5001: UDP, length 1470
00:09:41.947795 IP 10.0.0.1.46263 > 10.0.0.2.5001: UDP, length 1470
00:09:41.959890 IP 10.0.0.1.46263 > 10.0.0.2.5001: UDP, length 1470
00:09:41.971993 IP 10.0.0.1.46263 > 10.0.0.2.5001: UDP, length 1470
00:09:41.984092 IP 10.0.0.1.46263 > 10.0.0.2.5001: UDP, length 1470
00:09:41.996173 IP 10.0.0.1.46263 > 10.0.0.2.5001: UDP, length 1470
00:09:42.008279 IP 10.0.0.1.46263 > 10.0.0.2.5001: UDP, length 1470
00:09:42.020370 IP 10.0.0.1.46263 > 10.0.0.2.5001: UDP, length 1470
00:09:42.032461 IP 10.0.0.1.46263 > 10.0.0.2.5001: UDP, length 1470
00:09:42.044576 IP 10.0.0.1.46263 > 10.0.0.2.5001: UDP, length 1470
00:09:42.056662 IP 10.0.0.1.46263 > 10.0.0.2.5001: UDP, length 1470
00:09:42.068808 IP 10.0.0.1.46263 > 10.0.0.2.5001: UDP, length 1470
00:09:42.080852 IP 10.0.0.1.46263 > 10.0.0.2.5001: UDP, length 1470
00:09:42.092944 IP 10.0.0.1.46263 > 10.0.0.2.5001: UDP, length 1470
00:09:42.105852 IP 10.0.0.1.46263 > 10.0.0.2.5001: UDP, length 1470
00:09:42.117147 IP 10.0.0.1.46263 > 10.0.0.2.5001: UDP, length 1470
00:09:42.129957 IP 10.0.0.1.46263 > 10.0.0.2.5001: UDP, length 1470
00:09:42.141332 IP 10.0.0.1.46263 > 10.0.0.2.5001: UDP, length 1470
00:09:42.153435 IP 10.0.0.1.46263 > 10.0.0.2.5001: UDP, length 1470
00:09:42.165558 IP 10.0.0.1.46263 > 10.0.0.2.5001: UDP, length 1470
00:09:42.177634 IP 10.0.0.1.46263 > 10.0.0.2.5001: UDP, length 1470
00:09:42.189716 IP 10.0.0.1.46263 > 10.0.0.2.5001: UDP, length 1470
00:09:42.201825 IP 10.0.0.1.46263 > 10.0.0.2.5001: UDP, length 1470
00:09:42.213914 IP 10.0.0.1.46263 > 10.0.0.2.5001: UDP, length 1470
00:09:42.226030 IP 10.0.0.1.46263 > 10.0.0.2.5001: UDP, length 1470
00:09:42.238094 IP 10.0.0.1.46263 > 10.0.0.2.5001: UDP, length 1470
00:09:42.250191 IP 10.0.0.1.46263 > 10.0.0.2.5001: UDP, length 1470
00:09:42.262291 IP 10.0.0.1.46263 > 10.0.0.2.5001: UDP, length 1470
00:09:42.274385 IP 10.0.0.1.46263 > 10.0.0.2.5001: UDP, length 1470
00:09:42.286482 IP 10.0.0.1.46263 > 10.0.0.2.5001: UDP, length 1470
00:09:42.298587 IP 10.0.0.1.46263 > 10.0.0.2.5001: UDP, length 1470
00:09:42.310678 IP 10.0.0.1.46263 > 10.0.0.2.5001: UDP, length 1470
00:09:42.322772 IP 10.0.0.1.46263 > 10.0.0.2.5001: UDP, length 1470
00:09:42.334879 IP 10.0.0.1.46263 > 10.0.0.2.5001: UDP, length 1470
00:09:42.346974 IP 10.0.0.1.46263 > 10.0.0.2.5001: UDP, length 1470
00:09:42.359060 IP 10.0.0.1.46263 > 10.0.0.2.5001: UDP, length 1470
00:09:42.371164 IP 10.0.0.1.46263 > 10.0.0.2.5001: UDP, length 1470
00:09:42.383252 IP 10.0.0.1.46263 > 10.0.0.2.5001: UDP, length 1470
00:09:42.395339 IP 10.0.0.1.46263 > 10.0.0.2.5001: UDP, length 1470
00:09:42.407443 IP 10.0.0.1.46263 > 10.0.0.2.5001: UDP, length 1470
00:09:42.419548 IP 10.0.0.1.46263 > 10.0.0.2.5001: UDP, length 1470
00:09:42.432372 IP 10.0.0.1.46263 > 10.0.0.2.5001: UDP, length 1470
00:09:42.443767 IP 10.0.0.1.46263 > 10.0.0.2.5001: UDP, length 1470
00:09:42.455832 IP 10.0.0.1.46263 > 10.0.0.2.5001: UDP, length 1470
00:09:42.468440 IP 10.0.0.1.46263 > 10.0.0.2.5001: UDP, length 1470
00:09:42.480041 IP 10.0.0.1.46263 > 10.0.0.2.5001: UDP, length 1470
00:09:42.492119 IP 10.0.0.1.46263 > 10.0.0.2.5001: UDP, length 1470
00:09:42.504215 IP 10.0.0.1.46263 > 10.0.0.2.5001: UDP, length 1470
00:09:42.516394 IP 10.0.0.1.46263 > 10.0.0.2.5001: UDP, length 1470
00:09:42.528390 IP 10.0.0.1.46263 > 10.0.0.2.5001: UDP, length 1470
00:09:42.540837 IP 10.0.0.1.46263 > 10.0.0.2.5001: UDP, length 1470
00:09:42.552613 IP 10.0.0.1.46263 > 10.0.0.2.5001: UDP, length 1470
00:09:42.564695 IP 10.0.0.1.46263 > 10.0.0.2.5001: UDP, length 1470
00:09:42.576812 IP 10.0.0.1.46263 > 10.0.0.2.5001: UDP, length 1470
00:09:42.588882 IP 10.0.0.1.46263 > 10.0.0.2.5001: UDP, length 1470
00:09:42.600980 IP 10.0.0.1.46263 > 10.0.0.2.5001: UDP, length 1470
00:09:42.613075 IP 10.0.0.1.46263 > 10.0.0.2.5001: UDP, length 1470
00:09:42.625178 IP 10.0.0.1.46263 > 10.0.0.2.5001: UDP, length 1470
00:09:42.637270 IP 10.0.0.1.46263 > 10.0.0.2.5001: UDP, length 1470
00:09:42.649366 IP 10.0.0.1.46263 > 10.0.0.2.5001: UDP, length 1470
00:09:42.661454 IP 10.0.0.1.46263 > 10.0.0.2.5001: UDP, length 1470
00:09:42.673556 IP 10.0.0.1.46263 > 10.0.0.2.5001: UDP, length 1470
00:09:42.685664 IP 10.0.0.1.46263 > 10.0.0.2.5001: UDP, length 1470
00:09:42.697759 IP 10.0.0.1.46263 > 10.0.0.2.5001: UDP, length 1470
00:09:42.709846 IP 10.0.0.1.46263 > 10.0.0.2.5001: UDP, length 1470
00:09:42.721944 IP 10.0.0.1.46263 > 10.0.0.2.5001: UDP, length 1470
00:09:42.734779 IP 10.0.0.1.46263 > 10.0.0.2.5001: UDP, length 1470
00:09:42.746154 IP 10.0.0.1.46263 > 10.0.0.2.5001: UDP, length 1470
00:09:42.758215 IP 10.0.0.1.46263 > 10.0.0.2.5001: UDP, length 1470
00:09:42.770320 IP 10.0.0.1.46263 > 10.0.0.2.5001: UDP, length 1470
00:09:42.782414 IP 10.0.0.1.46263 > 10.0.0.2.5001: UDP, length 1470
00:09:42.794527 IP 10.0.0.1.46263 > 10.0.0.2.5001: UDP, length 1470
00:09:42.806634 IP 10.0.0.1.46263 > 10.0.0.2.5001: UDP, length 1470
00:09:42.818722 IP 10.0.0.1.46263 > 10.0.0.2.5001: UDP, length 1470
00:09:42.830794 IP 10.0.0.1.46263 > 10.0.0.2.5001: UDP, length 1470
00:09:42.842895 IP 10.0.0.1.46263 > 10.0.0.2.5001: UDP, length 1470
00:09:42.854993 IP 10.0.0.1.46263 > 10.0.0.2.5001: UDP, length 1470
00:09:42.867095 IP 10.0.0.1.46263 > 10.0.0.2.5001: UDP, length 1470
00:09:42.879178 IP 10.0.0.1.46263 > 10.0.0.2.5001: UDP, length 1470
00:09:42.891285 IP 10.0.0.1.46263 > 10.0.0.2.5001: UDP, length 1470
00:09:42.903376 IP 10.0.0.1.46263 > 10.0.0.2.5001: UDP, length 1470
00:09:42.915480 IP 10.0.0.1.46263 > 10.0.0.2.5001: UDP, length 1470
00:09:42.927566 IP 10.0.0.1.46263 > 10.0.0.2.5001: UDP, length 1470
00:09:42.939663 IP 10.0.0.1.46263 > 10.0.0.2.5001: UDP, length 1470
00:09:42.951777 IP 10.0.0.1.46263 > 10.0.0.2.5001: UDP, length 1470
00:09:42.963859 IP 10.0.0.1.46263 > 10.0.0.2.5001: UDP, length 1470
00:09:42.975989 IP 10.0.0.1.46263 > 10.0.0.2.5001: UDP, length 1470
00:09:42.988051 IP 10.0.0.1.46263 > 10.0.0.2.5001: UDP, length 1470
00:09:43.000141 IP 10.0.0.1.46263 > 10.0.0.2.5001: UDP, length 1470
00:09:43.012259 IP 10.0.0.1.46263 > 10.0.0.2.5001: UDP, length 1470
00:09:43.024336 IP 10.0.0.1.46263 > 10.0.0.2.5001: UDP, length 1470
00:09:43.036435 IP 10.0.0.1.46263 > 10.0.0.2.5001: UDP, length 1470
00:09:43.048666 IP 10.0.0.1.46263 > 10.0.0.2.5001: UDP, length 1470
00:09:43.060629 IP 10.0.0.1.46263 > 10.0.0.2.5001: UDP, length 1470
00:09:43.072730 IP 10.0.0.1.46263 > 10.0.0.2.5001: UDP, length 1470
00:09:43.084814 IP 10.0.0.1.46263 > 10.0.0.2.5001: UDP, length 1470
00:09:43.096919 IP 10.0.0.1.46263 > 10.0.0.2.5001: UDP, length 1470
00:09:43.109012 IP 10.0.0.1.46263 > 10.0.0.2.5001: UDP, length 1470
00:09:43.121092 IP 10.0.0.1.46263 > 10.0.0.2.5001: UDP, length 1470
00:09:43.133204 IP 10.0.0.1.46263 > 10.0.0.2.5001: UDP, length 1470
00:09:43.145512 IP 10.0.0.1.46263 > 10.0.0.2.5001: UDP, length 1470
00:09:43.158115 IP 10.0.0.1.46263 > 10.0.0.2.5001: UDP, length 1470
00:09:43.169503 IP 10.0.0.1.46263 > 10.0.0.2.5001: UDP, length 1470
00:09:43.181588 IP 10.0.0.1.46263 > 10.0.0.2.5001: UDP, length 1470
00:09:43.193685 IP 10.0.0.1.46263 > 10.0.0.2.5001: UDP, length 1470
00:09:43.205794 IP 10.0.0.1.46263 > 10.0.0.2.5001: UDP, length 1470
00:09:43.217878 IP 10.0.0.1.46263 > 10.0.0.2.5001: UDP, length 1470
00:09:43.230707 IP 10.0.0.1.46263 > 10.0.0.2.5001: UDP, length 1470
00:09:43.242060 IP 10.0.0.1.46263 > 10.0.0.2.5001: UDP, length 1470
00:09:43.254157 IP 10.0.0.1.46263 > 10.0.0.2.5001: UDP, length 1470
00:09:43.266243 IP 10.0.0.1.46263 > 10.0.0.2.5001: UDP, length 1470
00:09:43.278344 IP 10.0.0.1.46263 > 10.0.0.2.5001: UDP, length 1470
00:09:43.290452 IP 10.0.0.1.46263 > 10.0.0.2.5001: UDP, length 1470
00:09:43.302538 IP 10.0.0.1.46263 > 10.0.0.2.5001: UDP, length 1470
00:09:43.314635 IP 10.0.0.1.46263 > 10.0.0.2.5001: UDP, length 1470
00:09:43.326739 IP 10.0.0.1.46263 > 10.0.0.2.5001: UDP, length 1470
00:09:43.338826 IP 10.0.0.1.46263 > 10.0.0.2.5001: UDP, length 1470
00:09:43.350916 IP 10.0.0.1.46263 > 10.0.0.2.5001: UDP, length 1470
00:09:43.363015 IP 10.0.0.1.46263 > 10.0.0.2.5001: UDP, length 1470
00:09:43.375141 IP 10.0.0.1.46263 > 10.0.0.2.5001: UDP, length 1470
00:09:43.387204 IP 10.0.0.1.46263 > 10.0.0.2.5001: UDP, length 1470
00:09:43.399306 IP 10.0.0.1.46263 > 10.0.0.2.5001: UDP, length 1470
00:09:43.411402 IP 10.0.0.1.46263 > 10.0.0.2.5001: UDP, length 1470
00:09:43.423494 IP 10.0.0.1.46263 > 10.0.0.2.5001: UDP, length 1470
00:09:43.435595 IP 10.0.0.1.46263 > 10.0.0.2.5001: UDP, length 1470
00:09:43.447690 IP 10.0.0.1.46263 > 10.0.0.2.5001: UDP, length 1470
00:09:43.459784 IP 10.0.0.1.46263 > 10.0.0.2.5001: UDP, length 1470
00:09:43.471883 IP 10.0.0.1.46263 > 10.0.0.2.5001: UDP, length 1470
00:09:43.483977 IP 10.0.0.1.46263 > 10.0.0.2.5001: UDP, length 1470
00:09:43.496071 IP 10.0.0.1.46263 > 10.0.0.2.5001: UDP, length 1470
00:09:43.508174 IP 10.0.0.1.46263 > 10.0.0.2.5001: UDP, length 1470
00:09:43.520266 IP 10.0.0.1.46263 > 10.0.0.2.5001: UDP, length 1470
00:09:43.532358 IP 10.0.0.1.46263 > 10.0.0.2.5001: UDP, length 1470
00:09:43.544458 IP 10.0.0.1.46263 > 10.0.0.2.5001: UDP, length 1470
00:09:43.556551 IP 10.0.0.1.46263 > 10.0.0.2.5001: UDP, length 1470
00:09:43.568651 IP 10.0.0.1.46263 > 10.0.0.2.5001: UDP, length 1470
00:09:43.580743 IP 10.0.0.1.46263 > 10.0.0.2.5001: UDP, length 1470
00:09:43.592841 IP 10.0.0.1.46263 > 10.0.0.2.5001: UDP, length 1470
00:09:43.604935 IP 10.0.0.1.46263 > 10.0.0.2.5001: UDP, length 1470
00:09:43.617032 IP 10.0.0.1.46263 > 10.0.0.2.5001: UDP, length 1470
00:09:43.629135 IP 10.0.0.1.46263 > 10.0.0.2.5001: UDP, length 1470
00:09:43.641964 IP 10.0.0.1.46263 > 10.0.0.2.5001: UDP, length 1470
00:09:43.653319 IP 10.0.0.1.46263 > 10.0.0.2.5001: UDP, length 1470
00:09:43.665418 IP 10.0.0.1.46263 > 10.0.0.2.5001: UDP, length 1470
00:09:43.677524 IP 10.0.0.1.46263 > 10.0.0.2.5001: UDP, length 1470
00:09:43.689616 IP 10.0.0.1.46263 > 10.0.0.2.5001: UDP, length 1470
00:09:43.701727 IP 10.0.0.1.46263 > 10.0.0.2.5001: UDP, length 1470
00:09:43.713803 IP 10.0.0.1.46263 > 10.0.0.2.5001: UDP, length 1470
00:09:43.725935 IP 10.0.0.1.46263 > 10.0.0.2.5001: UDP, length 1470
00:09:43.738014 IP 10.0.0.1.46263 > 10.0.0.2.5001: UDP, length 1470
00:09:43.750099 IP 10.0.0.1.46263 > 10.0.0.2.5001: UDP, length 1470
00:09:43.762233 IP 10.0.0.1.46263 > 10.0.0.2.5001: UDP, length 1470
00:09:43.774290 IP 10.0.0.1.46263 > 10.0.0.2.5001: UDP, length 1470
00:09:43.786376 IP 10.0.0.1.46263 > 10.0.0.2.5001: UDP, length 1470
00:09:43.798475 IP 10.0.0.1.46263 > 10.0.0.2.5001: UDP, length 1470
00:09:43.810569 IP 10.0.0.1.46263 > 10.0.0.2.5001: UDP, length 1470
00:09:43.822664 IP 10.0.0.1.46263 > 10.0.0.2.5001: UDP, length 1470
00:09:43.834772 IP 10.0.0.1.46263 > 10.0.0.2.5001: UDP, length 1470
00:09:43.846856 IP 10.0.0.1.46263 > 10.0.0.2.5001: UDP, length 1470
00:09:43.858956 IP 10.0.0.1.46263 > 10.0.0.2.5001: UDP, length 1470
00:09:43.871051 IP 10.0.0.1.46263 > 10.0.0.2.5001: UDP, length 1470
00:09:43.883144 IP 10.0.0.1.46263 > 10.0.0.2.5001: UDP, length 1470
00:09:43.895242 IP 10.0.0.1.46263 > 10.0.0.2.5001: UDP, length 1470
00:09:43.907345 IP 10.0.0.1.46263 > 10.0.0.2.5001: UDP, length 1470
00:09:43.919432 IP 10.0.0.1.46263 > 10.0.0.2.5001: UDP, length 1470
00:09:43.931531 IP 10.0.0.1.46263 > 10.0.0.2.5001: UDP, length 1470
00:09:43.943617 IP 10.0.0.1.46263 > 10.0.0.2.5001: UDP, length 1470
00:09:43.955719 IP 10.0.0.1.46263 > 10.0.0.2.5001: UDP, length 1470
00:09:43.967826 IP 10.0.0.1.46263 > 10.0.0.2.5001: UDP, length 1470
00:09:43.979910 IP 10.0.0.1.46263 > 10.0.0.2.5001: UDP, length 1470
00:09:43.992007 IP 10.0.0.1.46263 > 10.0.0.2.5001: UDP, length 1470
00:09:44.004103 IP 10.0.0.1.46263 > 10.0.0.2.5001: UDP, length 1470
00:09:44.016198 IP 10.0.0.1.46263 > 10.0.0.2.5001: UDP, length 1470
00:09:44.028310 IP 10.0.0.1.46263 > 10.0.0.2.5001: UDP, length 1470
00:09:44.040396 IP 10.0.0.1.46263 > 10.0.0.2.5001: UDP, length 1470
00:09:44.052502 IP 10.0.0.1.46263 > 10.0.0.2.5001: UDP, length 1470
00:09:44.064596 IP 10.0.0.1.46263 > 10.0.0.2.5001: UDP, length 1470
00:09:44.076708 IP 10.0.0.1.46263 > 10.0.0.2.5001: UDP, length 1470
00:09:44.088782 IP 10.0.0.1.46263 > 10.0.0.2.5001: UDP, length 1470
00:09:44.100869 IP 10.0.0.1.46263 > 10.0.0.2.5001: UDP, length 1470
00:09:44.112973 IP 10.0.0.1.46263 > 10.0.0.2.5001: UDP, length 1470
00:09:44.125070 IP 10.0.0.1.46263 > 10.0.0.2.5001: UDP, length 1470
00:09:44.137161 IP 10.0.0.1.46263 > 10.0.0.2.5001: UDP, length 1470
00:09:44.149257 IP 10.0.0.1.46263 > 10.0.0.2.5001: UDP, length 1470
00:09:44.161357 IP 10.0.0.1.46263 > 10.0.0.2.5001: UDP, length 1470
00:09:44.173458 IP 10.0.0.1.46263 > 10.0.0.2.5001: UDP, length 1470
00:09:44.185545 IP 10.0.0.1.46263 > 10.0.0.2.5001: UDP, length 1470
00:09:44.197644 IP 10.0.0.1.46263 > 10.0.0.2.5001: UDP, length 1470
00:09:44.209738 IP 10.0.0.1.46263 > 10.0.0.2.5001: UDP, length 1470
00:09:44.221834 IP 10.0.0.1.46263 > 10.0.0.2.5001: UDP, length 1470
00:09:44.233932 IP 10.0.0.1.46263 > 10.0.0.2.5001: UDP, length 1470
00:09:44.246029 IP 10.0.0.1.46263 > 10.0.0.2.5001: UDP, length 1470
00:09:44.258123 IP 10.0.0.1.46263 > 10.0.0.2.5001: UDP, length 1470
00:09:44.270223 IP 10.0.0.1.46263 > 10.0.0.2.5001: UDP, length 1470
00:09:44.282318 IP 10.0.0.1.46263 > 10.0.0.2.5001: UDP, length 1470
00:09:44.294399 IP 10.0.0.1.46263 > 10.0.0.2.5001: UDP, length 1470
00:09:44.306498 IP 10.0.0.1.46263 > 10.0.0.2.5001: UDP, length 1470
00:09:44.318606 IP 10.0.0.1.46263 > 10.0.0.2.5001: UDP, length 1470
00:09:44.330702 IP 10.0.0.1.46263 > 10.0.0.2.5001: UDP, length 1470
00:09:44.342796 IP 10.0.0.1.46263 > 10.0.0.2.5001: UDP, length 1470
00:09:44.354894 IP 10.0.0.1.46263 > 10.0.0.2.5001: UDP, length 1470
00:09:44.366992 IP 10.0.0.1.46263 > 10.0.0.2.5001: UDP, length 1470
00:09:44.379081 IP 10.0.0.1.46263 > 10.0.0.2.5001: UDP, length 1470
00:09:44.391176 IP 10.0.0.1.46263 > 10.0.0.2.5001: UDP, length 1470
00:09:44.403277 IP 10.0.0.1.46263 > 10.0.0.2.5001: UDP, length 1470
00:09:44.415380 IP 10.0.0.1.46263 > 10.0.0.2.5001: UDP, length 1470
00:09:44.427462 IP 10.0.0.1.46263 > 10.0.0.2.5001: UDP, length 1470
00:09:44.439564 IP 10.0.0.1.46263 > 10.0.0.2.5001: UDP, length 1470
00:09:44.451659 IP 10.0.0.1.46263 > 10.0.0.2.5001: UDP, length 1470
00:09:44.463768 IP 10.0.0.1.46263 > 10.0.0.2.5001: UDP, length 1470
00:09:44.475848 IP 10.0.0.1.46263 > 10.0.0.2.5001: UDP, length 1470
00:09:44.487946 IP 10.0.0.1.46263 > 10.0.0.2.5001: UDP, length 1470
00:09:44.500055 IP 10.0.0.1.46263 > 10.0.0.2.5001: UDP, length 1470
00:09:44.512135 IP 10.0.0.1.46263 > 10.0.0.2.5001: UDP, length 1470
00:09:44.524230 IP 10.0.0.1.46263 > 10.0.0.2.5001: UDP, length 1470
00:09:44.536330 IP 10.0.0.1.46263 > 10.0.0.2.5001: UDP, length 1470
00:09:44.548423 IP 10.0.0.1.46263 > 10.0.0.2.5001: UDP, length 1470
00:09:44.560526 IP 10.0.0.1.46263 > 10.0.0.2.5001: UDP, length 1470
00:09:44.572615 IP 10.0.0.1.46263 > 10.0.0.2.5001: UDP, length 1470
00:09:44.584711 IP 10.0.0.1.46263 > 10.0.0.2.5001: UDP, length 1470
00:09:44.596808 IP 10.0.0.1.46263 > 10.0.0.2.5001: UDP, length 1470
00:09:44.608906 IP 10.0.0.1.46263 > 10.0.0.2.5001: UDP, length 1470
00:09:44.621000 IP 10.0.0.1.46263 > 10.0.0.2.5001: UDP, length 1470
00:09:44.633102 IP 10.0.0.1.46263 > 10.0.0.2.5001: UDP, length 1470
00:09:44.645201 IP 10.0.0.1.46263 > 10.0.0.2.5001: UDP, length 1470
00:09:44.657286 IP 10.0.0.1.46263 > 10.0.0.2.5001: UDP, length 1470
00:09:44.669373 IP 10.0.0.1.46263 > 10.0.0.2.5001: UDP, length 1470
00:09:44.681479 IP 10.0.0.1.46263 > 10.0.0.2.5001: UDP, length 1470
00:09:44.693566 IP 10.0.0.1.46263 > 10.0.0.2.5001: UDP, length 1470
00:09:44.705683 IP 10.0.0.1.46263 > 10.0.0.2.5001: UDP, length 1470
00:09:44.717778 IP 10.0.0.1.46263 > 10.0.0.2.5001: UDP, length 1470
00:09:44.729898 IP 10.0.0.1.46263 > 10.0.0.2.5001: UDP, length 1470
00:09:44.741965 IP 10.0.0.1.46263 > 10.0.0.2.5001: UDP, length 1470
00:09:44.754070 IP 10.0.0.1.46263 > 10.0.0.2.5001: UDP, length 1470
00:09:44.770062 IP 10.0.0.1.46263 > 10.0.0.2.5001: UDP, length 1470
00:09:44.778286 IP 10.0.0.1.46263 > 10.0.0.2.5001: UDP, length 1470
00:09:44.790354 IP 10.0.0.1.46263 > 10.0.0.2.5001: UDP, length 1470
00:09:44.803223 IP 10.0.0.1.46263 > 10.0.0.2.5001: UDP, length 1470
00:09:44.814545 IP 10.0.0.1.46263 > 10.0.0.2.5001: UDP, length 1470
00:09:44.826656 IP 10.0.0.1.46263 > 10.0.0.2.5001: UDP, length 1470
00:09:44.838743 IP 10.0.0.1.46263 > 10.0.0.2.5001: UDP, length 1470
00:09:44.850836 IP 10.0.0.1.46263 > 10.0.0.2.5001: UDP, length 1470
00:09:44.862930 IP 10.0.0.1.46263 > 10.0.0.2.5001: UDP, length 1470
00:09:44.875022 IP 10.0.0.1.46263 > 10.0.0.2.5001: UDP, length 1470
00:09:44.887986 IP 10.0.0.1.46263 > 10.0.0.2.5001: UDP, length 1470
00:09:44.899239 IP 10.0.0.1.46263 > 10.0.0.2.5001: UDP, length 1470
00:09:44.911310 IP 10.0.0.1.46263 > 10.0.0.2.5001: UDP, length 1470
00:09:44.923413 IP 10.0.0.1.46263 > 10.0.0.2.5001: UDP, length 1470
00:09:44.935500 IP 10.0.0.1.46263 > 10.0.0.2.5001: UDP, length 1470
00:09:44.947602 IP 10.0.0.1.46263 > 10.0.0.2.5001: UDP, length 1470
00:09:44.959695 IP 10.0.0.1.46263 > 10.0.0.2.5001: UDP, length 1470
00:09:44.971798 IP 10.0.0.1.46263 > 10.0.0.2.5001: UDP, length 1470
00:09:44.984622 IP 10.0.0.1.46263 > 10.0.0.2.5001: UDP, length 1470
00:09:44.995980 IP 10.0.0.1.46263 > 10.0.0.2.5001: UDP, length 1470
00:09:45.008089 IP 10.0.0.1.46263 > 10.0.0.2.5001: UDP, length 1470
00:09:45.020160 IP 10.0.0.1.46263 > 10.0.0.2.5001: UDP, length 1470
00:09:45.032271 IP 10.0.0.1.46263 > 10.0.0.2.5001: UDP, length 1470
00:09:45.044387 IP 10.0.0.1.46263 > 10.0.0.2.5001: UDP, length 1470
00:09:45.056467 IP 10.0.0.1.46263 > 10.0.0.2.5001: UDP, length 1470
00:09:45.068578 IP 10.0.0.1.46263 > 10.0.0.2.5001: UDP, length 1470
00:09:45.081472 IP 10.0.0.1.46263 > 10.0.0.2.5001: UDP, length 1470
00:09:45.092756 IP 10.0.0.1.46263 > 10.0.0.2.5001: UDP, length 1470
00:09:45.104850 IP 10.0.0.1.46263 > 10.0.0.2.5001: UDP, length 1470
00:09:45.116950 IP 10.0.0.1.46263 > 10.0.0.2.5001: UDP, length 1470
00:09:45.129047 IP 10.0.0.1.46263 > 10.0.0.2.5001: UDP, length 1470
00:09:45.141141 IP 10.0.0.1.46263 > 10.0.0.2.5001: UDP, length 1470
00:09:45.153227 IP 10.0.0.1.46263 > 10.0.0.2.5001: UDP, length 1470
00:09:45.165329 IP 10.0.0.1.46263 > 10.0.0.2.5001: UDP, length 1470
00:09:45.177429 IP 10.0.0.1.46263 > 10.0.0.2.5001: UDP, length 1470
00:09:45.189522 IP 10.0.0.1.46263 > 10.0.0.2.5001: UDP, length 1470
00:09:45.201626 IP 10.0.0.1.46263 > 10.0.0.2.5001: UDP, length 1470
00:09:45.213710 IP 10.0.0.1.46263 > 10.0.0.2.5001: UDP, length 1470
00:09:45.225812 IP 10.0.0.1.46263 > 10.0.0.2.5001: UDP, length 1470
00:09:45.237911 IP 10.0.0.1.46263 > 10.0.0.2.5001: UDP, length 1470
00:09:45.249997 IP 10.0.0.1.46263 > 10.0.0.2.5001: UDP, length 1470
00:09:45.262105 IP 10.0.0.1.46263 > 10.0.0.2.5001: UDP, length 1470
00:09:45.274210 IP 10.0.0.1.46263 > 10.0.0.2.5001: UDP, length 1470
00:09:45.286282 IP 10.0.0.1.46263 > 10.0.0.2.5001: UDP, length 1470
00:09:45.298386 IP 10.0.0.1.46263 > 10.0.0.2.5001: UDP, length 1470
00:09:45.310482 IP 10.0.0.1.46263 > 10.0.0.2.5001: UDP, length 1470
00:09:45.323411 IP 10.0.0.1.46263 > 10.0.0.2.5001: UDP, length 1470
00:09:45.334671 IP 10.0.0.1.46263 > 10.0.0.2.5001: UDP, length 1470
00:09:45.346758 IP 10.0.0.1.46263 > 10.0.0.2.5001: UDP, length 1470
00:09:45.358866 IP 10.0.0.1.46263 > 10.0.0.2.5001: UDP, length 1470
00:09:45.370947 IP 10.0.0.1.46263 > 10.0.0.2.5001: UDP, length 1470
00:09:45.383058 IP 10.0.0.1.46263 > 10.0.0.2.5001: UDP, length 1470
00:09:45.395175 IP 10.0.0.1.46263 > 10.0.0.2.5001: UDP, length 1470
00:09:45.407253 IP 10.0.0.1.46263 > 10.0.0.2.5001: UDP, length 1470
00:09:45.419360 IP 10.0.0.1.46263 > 10.0.0.2.5001: UDP, length 1470
00:09:45.431443 IP 10.0.0.1.46263 > 10.0.0.2.5001: UDP, length 1470
00:09:45.443556 IP 10.0.0.1.46263 > 10.0.0.2.5001: UDP, length 1470
00:09:45.455644 IP 10.0.0.1.46263 > 10.0.0.2.5001: UDP, length 1470
00:09:45.467744 IP 10.0.0.1.46263 > 10.0.0.2.5001: UDP, length 1470
00:09:45.479831 IP 10.0.0.1.46263 > 10.0.0.2.5001: UDP, length 1470
00:09:45.491923 IP 10.0.0.1.46263 > 10.0.0.2.5001: UDP, length 1470
00:09:45.504024 IP 10.0.0.1.46263 > 10.0.0.2.5001: UDP, length 1470
00:09:45.516119 IP 10.0.0.1.46263 > 10.0.0.2.5001: UDP, length 1470
00:09:45.528226 IP 10.0.0.1.46263 > 10.0.0.2.5001: UDP, length 1470
00:09:45.540302 IP 10.0.0.1.46263 > 10.0.0.2.5001: UDP, length 1470
00:09:45.552405 IP 10.0.0.1.46263 > 10.0.0.2.5001: UDP, length 1470
00:09:45.564498 IP 10.0.0.1.46263 > 10.0.0.2.5001: UDP, length 1470
00:09:45.576613 IP 10.0.0.1.46263 > 10.0.0.2.5001: UDP, length 1470
00:09:45.588696 IP 10.0.0.1.46263 > 10.0.0.2.5001: UDP, length 1470
00:09:45.600804 IP 10.0.0.1.46263 > 10.0.0.2.5001: UDP, length 1470
00:09:45.612888 IP 10.0.0.1.46263 > 10.0.0.2.5001: UDP, length 1470
00:09:45.624980 IP 10.0.0.1.46263 > 10.0.0.2.5001: UDP, length 1470
00:09:45.637076 IP 10.0.0.1.46263 > 10.0.0.2.5001: UDP, length 1470
00:09:45.649167 IP 10.0.0.1.46263 > 10.0.0.2.5001: UDP, length 1470
00:09:45.661272 IP 10.0.0.1.46263 > 10.0.0.2.5001: UDP, length 1470
00:09:45.673367 IP 10.0.0.1.46263 > 10.0.0.2.5001: UDP, length 1470
00:09:45.685459 IP 10.0.0.1.46263 > 10.0.0.2.5001: UDP, length 1470
00:09:45.697556 IP 10.0.0.1.46263 > 10.0.0.2.5001: UDP, length 1470
00:09:45.709652 IP 10.0.0.1.46263 > 10.0.0.2.5001: UDP, length 1470
00:09:45.721773 IP 10.0.0.1.46263 > 10.0.0.2.5001: UDP, length 1470
00:09:45.733832 IP 10.0.0.1.46263 > 10.0.0.2.5001: UDP, length 1470
00:09:45.745968 IP 10.0.0.1.46263 > 10.0.0.2.5001: UDP, length 1470
00:09:45.758029 IP 10.0.0.1.46263 > 10.0.0.2.5001: UDP, length 1470
00:09:45.770965 IP 10.0.0.1.46263 > 10.0.0.2.5001: UDP, length 1470
00:09:45.782219 IP 10.0.0.1.46263 > 10.0.0.2.5001: UDP, length 1470
00:09:45.794348 IP 10.0.0.1.46263 > 10.0.0.2.5001: UDP, length 1470
00:09:45.806414 IP 10.0.0.1.46263 > 10.0.0.2.5001: UDP, length 1470
00:09:45.818530 IP 10.0.0.1.46263 > 10.0.0.2.5001: UDP, length 1470
00:09:45.831479 IP 10.0.0.1.46263 > 10.0.0.2.5001: UDP, length 1470
00:09:45.842712 IP 10.0.0.1.46263 > 10.0.0.2.5001: UDP, length 1470
00:09:45.854802 IP 10.0.0.1.46263 > 10.0.0.2.5001: UDP, length 1470
00:09:45.866900 IP 10.0.0.1.46263 > 10.0.0.2.5001: UDP, length 1470
00:09:45.878998 IP 10.0.0.1.46263 > 10.0.0.2.5001: UDP, length 1470
00:09:45.891090 IP 10.0.0.1.46263 > 10.0.0.2.5001: UDP, length 1470
00:09:45.903189 IP 10.0.0.1.46263 > 10.0.0.2.5001: UDP, length 1470
00:09:45.915271 IP 10.0.0.1.46263 > 10.0.0.2.5001: UDP, length 1470
00:09:45.927389 IP 10.0.0.1.46263 > 10.0.0.2.5001: UDP, length 1470
00:09:45.939475 IP 10.0.0.1.46263 > 10.0.0.2.5001: UDP, length 1470
00:09:45.951586 IP 10.0.0.1.46263 > 10.0.0.2.5001: UDP, length 1470
00:09:45.964096 IP 10.0.0.1.46263 > 10.0.0.2.5001: UDP, length 1470
00:09:45.975764 IP 10.0.0.1.46263 > 10.0.0.2.5001: UDP, length 1470
00:09:45.987854 IP 10.0.0.1.46263 > 10.0.0.2.5001: UDP, length 1470
00:09:45.999950 IP 10.0.0.1.46263 > 10.0.0.2.5001: UDP, length 1470
00:09:46.012040 IP 10.0.0.1.46263 > 10.0.0.2.5001: UDP, length 1470
00:09:46.024147 IP 10.0.0.1.46263 > 10.0.0.2.5001: UDP, length 1470
00:09:46.036260 IP 10.0.0.1.46263 > 10.0.0.2.5001: UDP, length 1470
00:09:46.048328 IP 10.0.0.1.46263 > 10.0.0.2.5001: UDP, length 1470
00:09:46.060435 IP 10.0.0.1.46263 > 10.0.0.2.5001: UDP, length 1470
00:09:46.072526 IP 10.0.0.1.46263 > 10.0.0.2.5001: UDP, length 1470
00:09:46.084627 IP 10.0.0.1.46263 > 10.0.0.2.5001: UDP, length 1470
00:09:46.096747 IP 10.0.0.1.46263 > 10.0.0.2.5001: UDP, length 1470
00:09:46.108805 IP 10.0.0.1.46263 > 10.0.0.2.5001: UDP, length 1470
00:09:46.120903 IP 10.0.0.1.46263 > 10.0.0.2.5001: UDP, length 1470
00:09:46.133010 IP 10.0.0.1.46263 > 10.0.0.2.5001: UDP, length 1470
00:09:46.145110 IP 10.0.0.1.46263 > 10.0.0.2.5001: UDP, length 1470

