00:08:19.942873 IP 10.0.0.1.42103 > 10.0.0.2.5001: UDP, length 1470
00:08:19.955815 IP 10.0.0.1.42103 > 10.0.0.2.5001: UDP, length 1470
00:08:19.967896 IP 10.0.0.1.42103 > 10.0.0.2.5001: UDP, length 1470
00:08:19.977187 IP 10.0.0.1.42103 > 10.0.0.2.5001: UDP, length 1470
00:08:19.989749 IP 10.0.0.1.42103 > 10.0.0.2.5001: UDP, length 1470
00:08:20.001413 IP 10.0.0.1.42103 > 10.0.0.2.5001: UDP, length 1470
00:08:20.013492 IP 10.0.0.1.42103 > 10.0.0.2.5001: UDP, length 1470
00:08:20.025589 IP 10.0.0.1.42103 > 10.0.0.2.5001: UDP, length 1470
00:08:20.040245 IP 10.0.0.1.42103 > 10.0.0.2.5001: UDP, length 1470
00:08:20.055408 IP 10.0.0.1.42103 > 10.0.0.2.5001: UDP, length 1470
00:08:20.061950 IP 10.0.0.1.42103 > 10.0.0.2.5001: UDP, length 1470
00:08:20.074006 IP 10.0.0.1.42103 > 10.0.0.2.5001: UDP, length 1470
00:08:20.092969 IP 10.0.0.1.42103 > 10.0.0.2.5001: UDP, length 1470
00:08:20.098168 IP 10.0.0.1.42103 > 10.0.0.2.5001: UDP, length 1470
00:08:20.110703 IP 10.0.0.1.42103 > 10.0.0.2.5001: UDP, length 1470
00:08:20.122970 IP 10.0.0.1.42103 > 10.0.0.2.5001: UDP, length 1470
00:08:20.134510 IP 10.0.0.1.42103 > 10.0.0.2.5001: UDP, length 1470
00:08:20.146541 IP 10.0.0.1.42103 > 10.0.0.2.5001: UDP, length 1470
00:08:20.158627 IP 10.0.0.1.42103 > 10.0.0.2.5001: UDP, length 1470
00:08:20.170751 IP 10.0.0.1.42103 > 10.0.0.2.5001: UDP, length 1470
00:08:20.182839 IP 10.0.0.1.42103 > 10.0.0.2.5001: UDP, length 1470
00:08:20.194906 IP 10.0.0.1.42103 > 10.0.0.2.5001: UDP, length 1470
00:08:20.207020 IP 10.0.0.1.42103 > 10.0.0.2.5001: UDP, length 1470
00:08:20.219266 IP 10.0.0.1.42103 > 10.0.0.2.5001: UDP, length 1470
00:08:20.231273 IP 10.0.0.1.42103 > 10.0.0.2.5001: UDP, length 1470
00:08:20.243317 IP 10.0.0.1.42103 > 10.0.0.2.5001: UDP, length 1470
00:08:20.256182 IP 10.0.0.1.42103 > 10.0.0.2.5001: UDP, length 1470
00:08:20.267704 IP 10.0.0.1.42103 > 10.0.0.2.5001: UDP, length 1470
00:08:20.279607 IP 10.0.0.1.42103 > 10.0.0.2.5001: UDP, length 1470
00:08:20.291692 IP 10.0.0.1.42103 > 10.0.0.2.5001: UDP, length 1470
00:08:20.303767 IP 10.0.0.1.42103 > 10.0.0.2.5001: UDP, length 1470
00:08:20.315939 IP 10.0.0.1.42103 > 10.0.0.2.5001: UDP, length 1470
00:08:20.328052 IP 10.0.0.1.42103 > 10.0.0.2.5001: UDP, length 1470
00:08:20.340100 IP 10.0.0.1.42103 > 10.0.0.2.5001: UDP, length 1470
00:08:20.352248 IP 10.0.0.1.42103 > 10.0.0.2.5001: UDP, length 1470
00:08:20.364394 IP 10.0.0.1.42103 > 10.0.0.2.5001: UDP, length 1470
00:08:20.376388 IP 10.0.0.1.42103 > 10.0.0.2.5001: UDP, length 1470
00:08:20.388456 IP 10.0.0.1.42103 > 10.0.0.2.5001: UDP, length 1470
00:08:20.400563 IP 10.0.0.1.42103 > 10.0.0.2.5001: UDP, length 1470
00:08:20.412673 IP 10.0.0.1.42103 > 10.0.0.2.5001: UDP, length 1470
00:08:20.424806 IP 10.0.0.1.42103 > 10.0.0.2.5001: UDP, length 1470
00:08:20.436895 IP 10.0.0.1.42103 > 10.0.0.2.5001: UDP, length 1470
00:08:20.448968 IP 10.0.0.1.42103 > 10.0.0.2.5001: UDP, length 1470
00:08:20.461045 IP 10.0.0.1.42103 > 10.0.0.2.5001: UDP, length 1470
00:08:20.473205 IP 10.0.0.1.42103 > 10.0.0.2.5001: UDP, length 1470
00:08:20.486089 IP 10.0.0.1.42103 > 10.0.0.2.5001: UDP, length 1470
00:08:20.497338 IP 10.0.0.1.42103 > 10.0.0.2.5001: UDP, length 1470
00:08:20.509480 IP 10.0.0.1.42103 > 10.0.0.2.5001: UDP, length 1470
00:08:20.522487 IP 10.0.0.1.42103 > 10.0.0.2.5001: UDP, length 1470
00:08:20.545705 IP 10.0.0.1.42103 > 10.0.0.2.5001: UDP, length 1470
00:08:20.557821 IP 10.0.0.1.42103 > 10.0.0.2.5001: UDP, length 1470
00:08:20.569901 IP 10.0.0.1.42103 > 10.0.0.2.5001: UDP, length 1470
00:08:20.582024 IP 10.0.0.1.42103 > 10.0.0.2.5001: UDP, length 1470
00:08:20.594104 IP 10.0.0.1.42103 > 10.0.0.2.5001: UDP, length 1470
00:08:20.606233 IP 10.0.0.1.42103 > 10.0.0.2.5001: UDP, length 1470
00:08:20.618300 IP 10.0.0.1.42103 > 10.0.0.2.5001: UDP, length 1470
00:08:20.630448 IP 10.0.0.1.42103 > 10.0.0.2.5001: UDP, length 1470
00:08:20.643110 IP 10.0.0.1.42103 > 10.0.0.2.5001: UDP, length 1470
00:08:20.655769 IP 10.0.0.1.42103 > 10.0.0.2.5001: UDP, length 1470
00:08:20.666665 IP 10.0.0.1.42103 > 10.0.0.2.5001: UDP, length 1470
00:08:20.678756 IP 10.0.0.1.42103 > 10.0.0.2.5001: UDP, length 1470
00:08:20.690958 IP 10.0.0.1.42103 > 10.0.0.2.5001: UDP, length 1470
00:08:20.703016 IP 10.0.0.1.42103 > 10.0.0.2.5001: UDP, length 1470
00:08:20.715069 IP 10.0.0.1.42103 > 10.0.0.2.5001: UDP, length 1470
00:08:20.727162 IP 10.0.0.1.42103 > 10.0.0.2.5001: UDP, length 1470
00:08:20.739254 IP 10.0.0.1.42103 > 10.0.0.2.5001: UDP, length 1470
00:08:20.751346 IP 10.0.0.1.42103 > 10.0.0.2.5001: UDP, length 1470
00:08:20.763447 IP 10.0.0.1.42103 > 10.0.0.2.5001: UDP, length 1470
00:08:20.787648 IP 10.0.0.1.42103 > 10.0.0.2.5001: UDP, length 1470
00:08:20.799811 IP 10.0.0.1.42103 > 10.0.0.2.5001: UDP, length 1470
00:08:20.811855 IP 10.0.0.1.42103 > 10.0.0.2.5001: UDP, length 1470
00:08:20.823922 IP 10.0.0.1.42103 > 10.0.0.2.5001: UDP, length 1470
00:08:20.836021 IP 10.0.0.1.42103 > 10.0.0.2.5001: UDP, length 1470
00:08:20.848147 IP 10.0.0.1.42103 > 10.0.0.2.5001: UDP, length 1470
00:08:20.860197 IP 10.0.0.1.42103 > 10.0.0.2.5001: UDP, length 1470
00:08:20.872323 IP 10.0.0.1.42103 > 10.0.0.2.5001: UDP, length 1470
00:08:20.884418 IP 10.0.0.1.42103 > 10.0.0.2.5001: UDP, length 1470
00:08:20.896497 IP 10.0.0.1.42103 > 10.0.0.2.5001: UDP, length 1470
00:08:20.908594 IP 10.0.0.1.42103 > 10.0.0.2.5001: UDP, length 1470
00:08:20.920686 IP 10.0.0.1.42103 > 10.0.0.2.5001: UDP, length 1470
00:08:20.933641 IP 10.0.0.1.42103 > 10.0.0.2.5001: UDP, length 1470
00:08:20.944887 IP 10.0.0.1.42103 > 10.0.0.2.5001: UDP, length 1470
00:08:20.956978 IP 10.0.0.1.42103 > 10.0.0.2.5001: UDP, length 1470
00:08:20.969060 IP 10.0.0.1.42103 > 10.0.0.2.5001: UDP, length 1470
00:08:20.981159 IP 10.0.0.1.42103 > 10.0.0.2.5001: UDP, length 1470
00:08:20.993245 IP 10.0.0.1.42103 > 10.0.0.2.5001: UDP, length 1470
00:08:21.005332 IP 10.0.0.1.42103 > 10.0.0.2.5001: UDP, length 1470
00:08:21.017445 IP 10.0.0.1.42103 > 10.0.0.2.5001: UDP, length 1470
00:08:21.029539 IP 10.0.0.1.42103 > 10.0.0.2.5001: UDP, length 1470
00:08:21.041627 IP 10.0.0.1.42103 > 10.0.0.2.5001: UDP, length 1470
00:08:21.053722 IP 10.0.0.1.42103 > 10.0.0.2.5001: UDP, length 1470
00:08:21.065829 IP 10.0.0.1.42103 > 10.0.0.2.5001: UDP, length 1470
00:08:21.079741 IP 10.0.0.1.42103 > 10.0.0.2.5001: UDP, length 1470
00:08:21.090030 IP 10.0.0.1.42103 > 10.0.0.2.5001: UDP, length 1470
00:08:21.102099 IP 10.0.0.1.42103 > 10.0.0.2.5001: UDP, length 1470
00:08:21.114228 IP 10.0.0.1.42103 > 10.0.0.2.5001: UDP, length 1470
00:08:21.126334 IP 10.0.0.1.42103 > 10.0.0.2.5001: UDP, length 1470
00:08:21.138452 IP 10.0.0.1.42103 > 10.0.0.2.5001: UDP, length 1470
00:08:21.150541 IP 10.0.0.1.42103 > 10.0.0.2.5001: UDP, length 1470
00:08:21.162605 IP 10.0.0.1.42103 > 10.0.0.2.5001: UDP, length 1470
00:08:21.174697 IP 10.0.0.1.42103 > 10.0.0.2.5001: UDP, length 1470
00:08:21.186782 IP 10.0.0.1.42103 > 10.0.0.2.5001: UDP, length 1470
00:08:21.198872 IP 10.0.0.1.42103 > 10.0.0.2.5001: UDP, length 1470
00:08:21.210998 IP 10.0.0.1.42103 > 10.0.0.2.5001: UDP, length 1470
00:08:21.223091 IP 10.0.0.1.42103 > 10.0.0.2.5001: UDP, length 1470
00:08:21.235175 IP 10.0.0.1.42103 > 10.0.0.2.5001: UDP, length 1470
00:08:21.247275 IP 10.0.0.1.42103 > 10.0.0.2.5001: UDP, length 1470
00:08:21.259388 IP 10.0.0.1.42103 > 10.0.0.2.5001: UDP, length 1470
00:08:21.271496 IP 10.0.0.1.42103 > 10.0.0.2.5001: UDP, length 1470
00:08:21.283569 IP 10.0.0.1.42103 > 10.0.0.2.5001: UDP, length 1470
00:08:21.295646 IP 10.0.0.1.42103 > 10.0.0.2.5001: UDP, length 1470
00:08:21.307776 IP 10.0.0.1.42103 > 10.0.0.2.5001: UDP, length 1470
00:08:21.319849 IP 10.0.0.1.42103 > 10.0.0.2.5001: UDP, length 1470
00:08:21.331938 IP 10.0.0.1.42103 > 10.0.0.2.5001: UDP, length 1470
00:08:21.344065 IP 10.0.0.1.42103 > 10.0.0.2.5001: UDP, length 1470
00:08:21.357001 IP 10.0.0.1.42103 > 10.0.0.2.5001: UDP, length 1470
00:08:21.368267 IP 10.0.0.1.42103 > 10.0.0.2.5001: UDP, length 1470
00:08:21.380341 IP 10.0.0.1.42103 > 10.0.0.2.5001: UDP, length 1470
00:08:21.392436 IP 10.0.0.1.42103 > 10.0.0.2.5001: UDP, length 1470
00:08:21.405363 IP 10.0.0.1.42103 > 10.0.0.2.5001: UDP, length 1470
00:08:21.416631 IP 10.0.0.1.42103 > 10.0.0.2.5001: UDP, length 1470
00:08:21.432647 IP 10.0.0.1.42103 > 10.0.0.2.5001: UDP, length 1470
00:08:21.440828 IP 10.0.0.1.42103 > 10.0.0.2.5001: UDP, length 1470
00:08:21.452941 IP 10.0.0.1.42103 > 10.0.0.2.5001: UDP, length 1470
00:08:21.464998 IP 10.0.0.1.42103 > 10.0.0.2.5001: UDP, length 1470
00:08:21.477839 IP 10.0.0.1.42103 > 10.0.0.2.5001: UDP, length 1470
00:08:21.489201 IP 10.0.0.1.42103 > 10.0.0.2.5001: UDP, length 1470
00:08:21.501283 IP 10.0.0.1.42103 > 10.0.0.2.5001: UDP, length 1470
00:08:21.513629 IP 10.0.0.1.42103 > 10.0.0.2.5001: UDP, length 1470
00:08:21.525481 IP 10.0.0.1.42103 > 10.0.0.2.5001: UDP, length 1470
00:08:21.537586 IP 10.0.0.1.42103 > 10.0.0.2.5001: UDP, length 1470
00:08:21.549710 IP 10.0.0.1.42103 > 10.0.0.2.5001: UDP, length 1470
00:08:21.561757 IP 10.0.0.1.42103 > 10.0.0.2.5001: UDP, length 1470
00:08:21.573881 IP 10.0.0.1.42103 > 10.0.0.2.5001: UDP, length 1470
00:08:21.585971 IP 10.0.0.1.42103 > 10.0.0.2.5001: UDP, length 1470
00:08:21.598109 IP 10.0.0.1.42103 > 10.0.0.2.5001: UDP, length 1470
00:08:21.610212 IP 10.0.0.1.42103 > 10.0.0.2.5001: UDP, length 1470
00:08:21.622321 IP 10.0.0.1.42103 > 10.0.0.2.5001: UDP, length 1470
00:08:21.634341 IP 10.0.0.1.42103 > 10.0.0.2.5001: UDP, length 1470
00:08:21.646456 IP 10.0.0.1.42103 > 10.0.0.2.5001: UDP, length 1470
00:08:21.658525 IP 10.0.0.1.42103 > 10.0.0.2.5001: UDP, length 1470
00:08:21.670711 IP 10.0.0.1.42103 > 10.0.0.2.5001: UDP, length 1470
00:08:21.682768 IP 10.0.0.1.42103 > 10.0.0.2.5001: UDP, length 1470
00:08:21.694934 IP 10.0.0.1.42103 > 10.0.0.2.5001: UDP, length 1470
00:08:21.706985 IP 10.0.0.1.42103 > 10.0.0.2.5001: UDP, length 1470
00:08:21.719065 IP 10.0.0.1.42103 > 10.0.0.2.5001: UDP, length 1470
00:08:21.731137 IP 10.0.0.1.42103 > 10.0.0.2.5001: UDP, length 1470
00:08:21.743240 IP 10.0.0.1.42103 > 10.0.0.2.5001: UDP, length 1470
00:08:21.755364 IP 10.0.0.1.42103 > 10.0.0.2.5001: UDP, length 1470
00:08:21.767471 IP 10.0.0.1.42103 > 10.0.0.2.5001: UDP, length 1470
00:08:21.779521 IP 10.0.0.1.42103 > 10.0.0.2.5001: UDP, length 1470
00:08:21.791676 IP 10.0.0.1.42103 > 10.0.0.2.5001: UDP, length 1470
00:08:21.803735 IP 10.0.0.1.42103 > 10.0.0.2.5001: UDP, length 1470
00:08:21.815836 IP 10.0.0.1.42103 > 10.0.0.2.5001: UDP, length 1470
00:08:21.828847 IP 10.0.0.1.42103 > 10.0.0.2.5001: UDP, length 1470
00:08:21.840260 IP 10.0.0.1.42103 > 10.0.0.2.5001: UDP, length 1470
00:08:21.852112 IP 10.0.0.1.42103 > 10.0.0.2.5001: UDP, length 1470
00:08:21.876272 IP 10.0.0.1.42103 > 10.0.0.2.5001: UDP, length 1470
00:08:21.892018 IP 10.0.0.1.42103 > 10.0.0.2.5001: UDP, length 1470
00:08:21.900477 IP 10.0.0.1.42103 > 10.0.0.2.5001: UDP, length 1470
00:08:21.912600 IP 10.0.0.1.42103 > 10.0.0.2.5001: UDP, length 1470
00:08:21.925494 IP 10.0.0.1.42103 > 10.0.0.2.5001: UDP, length 1470
00:08:21.936785 IP 10.0.0.1.42103 > 10.0.0.2.5001: UDP, length 1470
00:08:21.948860 IP 10.0.0.1.42103 > 10.0.0.2.5001: UDP, length 1470
00:08:21.960941 IP 10.0.0.1.42103 > 10.0.0.2.5001: UDP, length 1470
00:08:21.973781 IP 10.0.0.1.42103 > 10.0.0.2.5001: UDP, length 1470
00:08:21.985179 IP 10.0.0.1.42103 > 10.0.0.2.5001: UDP, length 1470
00:08:21.997266 IP 10.0.0.1.42103 > 10.0.0.2.5001: UDP, length 1470
00:08:22.009350 IP 10.0.0.1.42103 > 10.0.0.2.5001: UDP, length 1470
00:08:22.021428 IP 10.0.0.1.42103 > 10.0.0.2.5001: UDP, length 1470
00:08:22.034188 IP 10.0.0.1.42103 > 10.0.0.2.5001: UDP, length 1470
00:08:22.045645 IP 10.0.0.1.42103 > 10.0.0.2.5001: UDP, length 1470
00:08:22.057763 IP 10.0.0.1.42103 > 10.0.0.2.5001: UDP, length 1470
00:08:22.070723 IP 10.0.0.1.42103 > 10.0.0.2.5001: UDP, length 1470
00:08:22.081953 IP 10.0.0.1.42103 > 10.0.0.2.5001: UDP, length 1470
00:08:22.094007 IP 10.0.0.1.42103 > 10.0.0.2.5001: UDP, length 1470
00:08:22.107029 IP 10.0.0.1.42103 > 10.0.0.2.5001: UDP, length 1470
00:08:22.118193 IP 10.0.0.1.42103 > 10.0.0.2.5001: UDP, length 1470
00:08:22.130336 IP 10.0.0.1.42103 > 10.0.0.2.5001: UDP, length 1470
00:08:22.142419 IP 10.0.0.1.42103 > 10.0.0.2.5001: UDP, length 1470
00:08:22.154499 IP 10.0.0.1.42103 > 10.0.0.2.5001: UDP, length 1470
00:08:22.166658 IP 10.0.0.1.42103 > 10.0.0.2.5001: UDP, length 1470
00:08:22.178711 IP 10.0.0.1.42103 > 10.0.0.2.5001: UDP, length 1470
00:08:22.190832 IP 10.0.0.1.42103 > 10.0.0.2.5001: UDP, length 1470
00:08:22.202859 IP 10.0.0.1.42103 > 10.0.0.2.5001: UDP, length 1470
00:08:22.215015 IP 10.0.0.1.42103 > 10.0.0.2.5001: UDP, length 1470
00:08:22.227065 IP 10.0.0.1.42103 > 10.0.0.2.5001: UDP, length 1470
00:08:22.240061 IP 10.0.0.1.42103 > 10.0.0.2.5001: UDP, length 1470
00:08:22.251255 IP 10.0.0.1.42103 > 10.0.0.2.5001: UDP, length 1470
00:08:22.263353 IP 10.0.0.1.42103 > 10.0.0.2.5001: UDP, length 1470
00:08:22.275448 IP 10.0.0.1.42103 > 10.0.0.2.5001: UDP, length 1470
00:08:22.288393 IP 10.0.0.1.42103 > 10.0.0.2.5001: UDP, length 1470
00:08:22.299628 IP 10.0.0.1.42103 > 10.0.0.2.5001: UDP, length 1470
00:08:22.311781 IP 10.0.0.1.42103 > 10.0.0.2.5001: UDP, length 1470
00:08:22.324654 IP 10.0.0.1.42103 > 10.0.0.2.5001: UDP, length 1470
00:08:22.335931 IP 10.0.0.1.42103 > 10.0.0.2.5001: UDP, length 1470
00:08:22.348047 IP 10.0.0.1.42103 > 10.0.0.2.5001: UDP, length 1470
00:08:22.360161 IP 10.0.0.1.42103 > 10.0.0.2.5001: UDP, length 1470
00:08:22.373066 IP 10.0.0.1.42103 > 10.0.0.2.5001: UDP, length 1470
00:08:22.384358 IP 10.0.0.1.42103 > 10.0.0.2.5001: UDP, length 1470
00:08:22.397233 IP 10.0.0.1.42103 > 10.0.0.2.5001: UDP, length 1470
00:08:22.408539 IP 10.0.0.1.42103 > 10.0.0.2.5001: UDP, length 1470
00:08:22.420659 IP 10.0.0.1.42103 > 10.0.0.2.5001: UDP, length 1470
00:08:22.433483 IP 10.0.0.1.42103 > 10.0.0.2.5001: UDP, length 1470
00:08:22.444878 IP 10.0.0.1.42103 > 10.0.0.2.5001: UDP, length 1470
00:08:22.456943 IP 10.0.0.1.42103 > 10.0.0.2.5001: UDP, length 1470
00:08:22.469017 IP 10.0.0.1.42103 > 10.0.0.2.5001: UDP, length 1470
00:08:22.481136 IP 10.0.0.1.42103 > 10.0.0.2.5001: UDP, length 1470
00:08:22.493187 IP 10.0.0.1.42103 > 10.0.0.2.5001: UDP, length 1470
00:08:22.505303 IP 10.0.0.1.42103 > 10.0.0.2.5001: UDP, length 1470
00:08:22.517404 IP 10.0.0.1.42103 > 10.0.0.2.5001: UDP, length 1470
00:08:22.529490 IP 10.0.0.1.42103 > 10.0.0.2.5001: UDP, length 1470
00:08:22.541594 IP 10.0.0.1.42103 > 10.0.0.2.5001: UDP, length 1470
00:08:22.553720 IP 10.0.0.1.42103 > 10.0.0.2.5001: UDP, length 1470
00:08:22.565793 IP 10.0.0.1.42103 > 10.0.0.2.5001: UDP, length 1470
00:08:22.589981 IP 10.0.0.1.42103 > 10.0.0.2.5001: UDP, length 1470
00:08:22.602091 IP 10.0.0.1.42103 > 10.0.0.2.5001: UDP, length 1470
00:08:22.614148 IP 10.0.0.1.42103 > 10.0.0.2.5001: UDP, length 1470
00:08:22.626224 IP 10.0.0.1.42103 > 10.0.0.2.5001: UDP, length 1470
00:08:22.638422 IP 10.0.0.1.42103 > 10.0.0.2.5001: UDP, length 1470
00:08:22.650431 IP 10.0.0.1.42103 > 10.0.0.2.5001: UDP, length 1470
00:08:22.662525 IP 10.0.0.1.42103 > 10.0.0.2.5001: UDP, length 1470
00:08:22.675484 IP 10.0.0.1.42103 > 10.0.0.2.5001: UDP, length 1470
00:08:22.686759 IP 10.0.0.1.42103 > 10.0.0.2.5001: UDP, length 1470
00:08:22.698837 IP 10.0.0.1.42103 > 10.0.0.2.5001: UDP, length 1470
00:08:22.710944 IP 10.0.0.1.42103 > 10.0.0.2.5001: UDP, length 1470
00:08:22.723047 IP 10.0.0.1.42103 > 10.0.0.2.5001: UDP, length 1470
00:08:22.748047 IP 10.0.0.1.42103 > 10.0.0.2.5001: UDP, length 1470
00:08:22.759334 IP 10.0.0.1.42103 > 10.0.0.2.5001: UDP, length 1470
00:08:22.772193 IP 10.0.0.1.42103 > 10.0.0.2.5001: UDP, length 1470
00:08:22.783528 IP 10.0.0.1.42103 > 10.0.0.2.5001: UDP, length 1470
00:08:22.795593 IP 10.0.0.1.42103 > 10.0.0.2.5001: UDP, length 1470
00:08:22.807707 IP 10.0.0.1.42103 > 10.0.0.2.5001: UDP, length 1470
00:08:22.819760 IP 10.0.0.1.42103 > 10.0.0.2.5001: UDP, length 1470
00:08:22.831834 IP 10.0.0.1.42103 > 10.0.0.2.5001: UDP, length 1470
00:08:22.843955 IP 10.0.0.1.42103 > 10.0.0.2.5001: UDP, length 1470
00:08:22.856058 IP 10.0.0.1.42103 > 10.0.0.2.5001: UDP, length 1470
00:08:22.868158 IP 10.0.0.1.42103 > 10.0.0.2.5001: UDP, length 1470
00:08:22.880253 IP 10.0.0.1.42103 > 10.0.0.2.5001: UDP, length 1470
00:08:22.892330 IP 10.0.0.1.42103 > 10.0.0.2.5001: UDP, length 1470
00:08:22.904428 IP 10.0.0.1.42103 > 10.0.0.2.5001: UDP, length 1470
00:08:22.916520 IP 10.0.0.1.42103 > 10.0.0.2.5001: UDP, length 1470
00:08:22.928651 IP 10.0.0.1.42103 > 10.0.0.2.5001: UDP, length 1470
00:08:22.940723 IP 10.0.0.1.42103 > 10.0.0.2.5001: UDP, length 1470
00:08:22.952813 IP 10.0.0.1.42103 > 10.0.0.2.5001: UDP, length 1470
00:08:22.964937 IP 10.0.0.1.42103 > 10.0.0.2.5001: UDP, length 1470
00:08:22.977035 IP 10.0.0.1.42103 > 10.0.0.2.5001: UDP, length 1470
00:08:22.989112 IP 10.0.0.1.42103 > 10.0.0.2.5001: UDP, length 1470
00:08:23.001198 IP 10.0.0.1.42103 > 10.0.0.2.5001: UDP, length 1470
00:08:23.025387 IP 10.0.0.1.42103 > 10.0.0.2.5001: UDP, length 1470
00:08:23.037465 IP 10.0.0.1.42103 > 10.0.0.2.5001: UDP, length 1470
00:08:23.049564 IP 10.0.0.1.42103 > 10.0.0.2.5001: UDP, length 1470
00:08:23.061679 IP 10.0.0.1.42103 > 10.0.0.2.5001: UDP, length 1470
00:08:23.073771 IP 10.0.0.1.42103 > 10.0.0.2.5001: UDP, length 1470
00:08:23.085890 IP 10.0.0.1.42103 > 10.0.0.2.5001: UDP, length 1470
00:08:23.097955 IP 10.0.0.1.42103 > 10.0.0.2.5001: UDP, length 1470
00:08:23.110052 IP 10.0.0.1.42103 > 10.0.0.2.5001: UDP, length 1470
00:08:23.122141 IP 10.0.0.1.42103 > 10.0.0.2.5001: UDP, length 1470
00:08:23.134438 IP 10.0.0.1.42103 > 10.0.0.2.5001: UDP, length 1470
00:08:23.146365 IP 10.0.0.1.42103 > 10.0.0.2.5001: UDP, length 1470
00:08:23.158419 IP 10.0.0.1.42103 > 10.0.0.2.5001: UDP, length 1470
00:08:23.170521 IP 10.0.0.1.42103 > 10.0.0.2.5001: UDP, length 1470
00:08:23.182616 IP 10.0.0.1.42103 > 10.0.0.2.5001: UDP, length 1470
00:08:23.194705 IP 10.0.0.1.42103 > 10.0.0.2.5001: UDP, length 1470
00:08:23.206825 IP 10.0.0.1.42103 > 10.0.0.2.5001: UDP, length 1470
00:08:23.218911 IP 10.0.0.1.42103 > 10.0.0.2.5001: UDP, length 1470
00:08:23.231016 IP 10.0.0.1.42103 > 10.0.0.2.5001: UDP, length 1470
00:08:23.243107 IP 10.0.0.1.42103 > 10.0.0.2.5001: UDP, length 1470
00:08:23.255194 IP 10.0.0.1.42103 > 10.0.0.2.5001: UDP, length 1470
00:08:23.267288 IP 10.0.0.1.42103 > 10.0.0.2.5001: UDP, length 1470
00:08:23.279389 IP 10.0.0.1.42103 > 10.0.0.2.5001: UDP, length 1470
00:08:23.291484 IP 10.0.0.1.42103 > 10.0.0.2.5001: UDP, length 1470
00:08:23.303587 IP 10.0.0.1.42103 > 10.0.0.2.5001: UDP, length 1470
00:08:23.315693 IP 10.0.0.1.42103 > 10.0.0.2.5001: UDP, length 1470
00:08:23.327787 IP 10.0.0.1.42103 > 10.0.0.2.5001: UDP, length 1470
00:08:23.339877 IP 10.0.0.1.42103 > 10.0.0.2.5001: UDP, length 1470
00:08:23.351963 IP 10.0.0.1.42103 > 10.0.0.2.5001: UDP, length 1470
00:08:23.364057 IP 10.0.0.1.42103 > 10.0.0.2.5001: UDP, length 1470
00:08:23.376151 IP 10.0.0.1.42103 > 10.0.0.2.5001: UDP, length 1470
00:08:23.388252 IP 10.0.0.1.42103 > 10.0.0.2.5001: UDP, length 1470
00:08:23.400385 IP 10.0.0.1.42103 > 10.0.0.2.5001: UDP, length 1470
00:08:23.412472 IP 10.0.0.1.42103 > 10.0.0.2.5001: UDP, length 1470
00:08:23.424804 IP 10.0.0.1.42103 > 10.0.0.2.5001: UDP, length 1470
00:08:23.438210 IP 10.0.0.1.42103 > 10.0.0.2.5001: UDP, length 1470
00:08:23.449126 IP 10.0.0.1.42103 > 10.0.0.2.5001: UDP, length 1470
00:08:23.460921 IP 10.0.0.1.42103 > 10.0.0.2.5001: UDP, length 1470
00:08:23.472985 IP 10.0.0.1.42103 > 10.0.0.2.5001: UDP, length 1470
00:08:23.485058 IP 10.0.0.1.42103 > 10.0.0.2.5001: UDP, length 1470
00:08:23.497171 IP 10.0.0.1.42103 > 10.0.0.2.5001: UDP, length 1470
00:08:23.510262 IP 10.0.0.1.42103 > 10.0.0.2.5001: UDP, length 1470
00:08:23.521358 IP 10.0.0.1.42103 > 10.0.0.2.5001: UDP, length 1470
00:08:23.533446 IP 10.0.0.1.42103 > 10.0.0.2.5001: UDP, length 1470
00:08:23.545525 IP 10.0.0.1.42103 > 10.0.0.2.5001: UDP, length 1470
00:08:23.558492 IP 10.0.0.1.42103 > 10.0.0.2.5001: UDP, length 1470
00:08:23.569760 IP 10.0.0.1.42103 > 10.0.0.2.5001: UDP, length 1470
00:08:23.581838 IP 10.0.0.1.42103 > 10.0.0.2.5001: UDP, length 1470
00:08:23.594738 IP 10.0.0.1.42103 > 10.0.0.2.5001: UDP, length 1470
00:08:23.606198 IP 10.0.0.1.42103 > 10.0.0.2.5001: UDP, length 1470
00:08:23.618118 IP 10.0.0.1.42103 > 10.0.0.2.5001: UDP, length 1470
00:08:23.631045 IP 10.0.0.1.42103 > 10.0.0.2.5001: UDP, length 1470
00:08:23.642344 IP 10.0.0.1.42103 > 10.0.0.2.5001: UDP, length 1470
00:08:23.654491 IP 10.0.0.1.42103 > 10.0.0.2.5001: UDP, length 1470
00:08:23.666515 IP 10.0.0.1.42103 > 10.0.0.2.5001: UDP, length 1470
00:08:23.678631 IP 10.0.0.1.42103 > 10.0.0.2.5001: UDP, length 1470
00:08:23.690721 IP 10.0.0.1.42103 > 10.0.0.2.5001: UDP, length 1470
00:08:23.702850 IP 10.0.0.1.42103 > 10.0.0.2.5001: UDP, length 1470
00:08:23.714906 IP 10.0.0.1.42103 > 10.0.0.2.5001: UDP, length 1470
00:08:23.727780 IP 10.0.0.1.42103 > 10.0.0.2.5001: UDP, length 1470
00:08:23.739143 IP 10.0.0.1.42103 > 10.0.0.2.5001: UDP, length 1470
00:08:23.751175 IP 10.0.0.1.42103 > 10.0.0.2.5001: UDP, length 1470
00:08:23.763691 IP 10.0.0.1.42103 > 10.0.0.2.5001: UDP, length 1470
00:08:23.776116 IP 10.0.0.1.42103 > 10.0.0.2.5001: UDP, length 1470
00:08:23.787459 IP 10.0.0.1.42103 > 10.0.0.2.5001: UDP, length 1470
00:08:23.799620 IP 10.0.0.1.42103 > 10.0.0.2.5001: UDP, length 1470
00:08:23.823808 IP 10.0.0.1.42103 > 10.0.0.2.5001: UDP, length 1470
00:08:23.835865 IP 10.0.0.1.42103 > 10.0.0.2.5001: UDP, length 1470
00:08:23.847942 IP 10.0.0.1.42103 > 10.0.0.2.5001: UDP, length 1470
00:08:23.860080 IP 10.0.0.1.42103 > 10.0.0.2.5001: UDP, length 1470
00:08:23.872122 IP 10.0.0.1.42103 > 10.0.0.2.5001: UDP, length 1470
00:08:23.884223 IP 10.0.0.1.42103 > 10.0.0.2.5001: UDP, length 1470
00:08:23.896321 IP 10.0.0.1.42103 > 10.0.0.2.5001: UDP, length 1470
00:08:23.908403 IP 10.0.0.1.42103 > 10.0.0.2.5001: UDP, length 1470
00:08:23.920515 IP 10.0.0.1.42103 > 10.0.0.2.5001: UDP, length 1470
00:08:23.932636 IP 10.0.0.1.42103 > 10.0.0.2.5001: UDP, length 1470
00:08:23.944684 IP 10.0.0.1.42103 > 10.0.0.2.5001: UDP, length 1470
00:08:23.956788 IP 10.0.0.1.42103 > 10.0.0.2.5001: UDP, length 1470
00:08:23.968910 IP 10.0.0.1.42103 > 10.0.0.2.5001: UDP, length 1470
00:08:23.980992 IP 10.0.0.1.42103 > 10.0.0.2.5001: UDP, length 1470
00:08:23.993080 IP 10.0.0.1.42103 > 10.0.0.2.5001: UDP, length 1470
00:08:24.005173 IP 10.0.0.1.42103 > 10.0.0.2.5001: UDP, length 1470
00:08:24.017459 IP 10.0.0.1.42103 > 10.0.0.2.5001: UDP, length 1470
00:08:24.029370 IP 10.0.0.1.42103 > 10.0.0.2.5001: UDP, length 1470
00:08:24.041460 IP 10.0.0.1.42103 > 10.0.0.2.5001: UDP, length 1470
00:08:24.053559 IP 10.0.0.1.42103 > 10.0.0.2.5001: UDP, length 1470
00:08:24.065648 IP 10.0.0.1.42103 > 10.0.0.2.5001: UDP, length 1470
00:08:24.077789 IP 10.0.0.1.42103 > 10.0.0.2.5001: UDP, length 1470
00:08:24.089885 IP 10.0.0.1.42103 > 10.0.0.2.5001: UDP, length 1470
00:08:24.101967 IP 10.0.0.1.42103 > 10.0.0.2.5001: UDP, length 1470
00:08:24.114027 IP 10.0.0.1.42103 > 10.0.0.2.5001: UDP, length 1470
00:08:24.126134 IP 10.0.0.1.42103 > 10.0.0.2.5001: UDP, length 1470
00:08:24.138278 IP 10.0.0.1.42103 > 10.0.0.2.5001: UDP, length 1470
00:08:24.150353 IP 10.0.0.1.42103 > 10.0.0.2.5001: UDP, length 1470
00:08:24.162426 IP 10.0.0.1.42103 > 10.0.0.2.5001: UDP, length 1470
00:08:24.174514 IP 10.0.0.1.42103 > 10.0.0.2.5001: UDP, length 1470
00:08:24.186636 IP 10.0.0.1.42103 > 10.0.0.2.5001: UDP, length 1470
00:08:24.198770 IP 10.0.0.1.42103 > 10.0.0.2.5001: UDP, length 1470
00:08:24.210845 IP 10.0.0.1.42103 > 10.0.0.2.5001: UDP, length 1470
00:08:24.222952 IP 10.0.0.1.42103 > 10.0.0.2.5001: UDP, length 1470
00:08:24.235066 IP 10.0.0.1.42103 > 10.0.0.2.5001: UDP, length 1470
00:08:24.247143 IP 10.0.0.1.42103 > 10.0.0.2.5001: UDP, length 1470
00:08:24.259241 IP 10.0.0.1.42103 > 10.0.0.2.5001: UDP, length 1470
00:08:24.271345 IP 10.0.0.1.42103 > 10.0.0.2.5001: UDP, length 1470
00:08:24.283423 IP 10.0.0.1.42103 > 10.0.0.2.5001: UDP, length 1470
00:08:24.295528 IP 10.0.0.1.42103 > 10.0.0.2.5001: UDP, length 1470
00:08:24.307558 IP 10.0.0.1.42103 > 10.0.0.2.5001: UDP, length 1470
00:08:24.319662 IP 10.0.0.1.42103 > 10.0.0.2.5001: UDP, length 1470
00:08:24.331756 IP 10.0.0.1.42103 > 10.0.0.2.5001: UDP, length 1470
00:08:24.343864 IP 10.0.0.1.42103 > 10.0.0.2.5001: UDP, length 1470
00:08:24.356063 IP 10.0.0.1.42103 > 10.0.0.2.5001: UDP, length 1470
00:08:24.368056 IP 10.0.0.1.42103 > 10.0.0.2.5001: UDP, length 1470
00:08:24.380144 IP 10.0.0.1.42103 > 10.0.0.2.5001: UDP, length 1470
00:08:24.392249 IP 10.0.0.1.42103 > 10.0.0.2.5001: UDP, length 1470
00:08:24.404347 IP 10.0.0.1.42103 > 10.0.0.2.5001: UDP, length 1470
00:08:24.416430 IP 10.0.0.1.42103 > 10.0.0.2.5001: UDP, length 1470
00:08:24.428516 IP 10.0.0.1.42103 > 10.0.0.2.5001: UDP, length 1470
00:08:24.440628 IP 10.0.0.1.42103 > 10.0.0.2.5001: UDP, length 1470
00:08:24.453722 IP 10.0.0.1.42103 > 10.0.0.2.5001: UDP, length 1470
00:08:24.464817 IP 10.0.0.1.42103 > 10.0.0.2.5001: UDP, length 1470
00:08:24.476901 IP 10.0.0.1.42103 > 10.0.0.2.5001: UDP, length 1470
00:08:24.489006 IP 10.0.0.1.42103 > 10.0.0.2.5001: UDP, length 1470
00:08:24.501192 IP 10.0.0.1.42103 > 10.0.0.2.5001: UDP, length 1470
00:08:24.513177 IP 10.0.0.1.42103 > 10.0.0.2.5001: UDP, length 1470
00:08:24.525308 IP 10.0.0.1.42103 > 10.0.0.2.5001: UDP, length 1470
00:08:24.537475 IP 10.0.0.1.42103 > 10.0.0.2.5001: UDP, length 1470
00:08:24.550343 IP 10.0.0.1.42103 > 10.0.0.2.5001: UDP, length 1470
00:08:24.561811 IP 10.0.0.1.42103 > 10.0.0.2.5001: UDP, length 1470
00:08:24.573725 IP 10.0.0.1.42103 > 10.0.0.2.5001: UDP, length 1470
00:08:24.585905 IP 10.0.0.1.42103 > 10.0.0.2.5001: UDP, length 1470
00:08:24.597888 IP 10.0.0.1.42103 > 10.0.0.2.5001: UDP, length 1470
00:08:24.609985 IP 10.0.0.1.42103 > 10.0.0.2.5001: UDP, length 1470
00:08:24.622888 IP 10.0.0.1.42103 > 10.0.0.2.5001: UDP, length 1470
00:08:24.634210 IP 10.0.0.1.42103 > 10.0.0.2.5001: UDP, length 1470
00:08:24.646324 IP 10.0.0.1.42103 > 10.0.0.2.5001: UDP, length 1470
00:08:24.658361 IP 10.0.0.1.42103 > 10.0.0.2.5001: UDP, length 1470
00:08:24.670442 IP 10.0.0.1.42103 > 10.0.0.2.5001: UDP, length 1470
00:08:24.682547 IP 10.0.0.1.42103 > 10.0.0.2.5001: UDP, length 1470
00:08:24.694640 IP 10.0.0.1.42103 > 10.0.0.2.5001: UDP, length 1470
00:08:24.706721 IP 10.0.0.1.42103 > 10.0.0.2.5001: UDP, length 1470
00:08:24.722831 IP 10.0.0.1.42103 > 10.0.0.2.5001: UDP, length 1470
00:08:24.730919 IP 10.0.0.1.42103 > 10.0.0.2.5001: UDP, length 1470
00:08:24.743014 IP 10.0.0.1.42103 > 10.0.0.2.5001: UDP, length 1470
00:08:24.755114 IP 10.0.0.1.42103 > 10.0.0.2.5001: UDP, length 1470
00:08:24.767207 IP 10.0.0.1.42103 > 10.0.0.2.5001: UDP, length 1470
00:08:24.779323 IP 10.0.0.1.42103 > 10.0.0.2.5001: UDP, length 1470
00:08:24.791400 IP 10.0.0.1.42103 > 10.0.0.2.5001: UDP, length 1470
00:08:24.803506 IP 10.0.0.1.42103 > 10.0.0.2.5001: UDP, length 1470
00:08:24.815592 IP 10.0.0.1.42103 > 10.0.0.2.5001: UDP, length 1470
00:08:24.827677 IP 10.0.0.1.42103 > 10.0.0.2.5001: UDP, length 1470
00:08:24.839814 IP 10.0.0.1.42103 > 10.0.0.2.5001: UDP, length 1470
00:08:24.851869 IP 10.0.0.1.42103 > 10.0.0.2.5001: UDP, length 1470
00:08:24.864008 IP 10.0.0.1.42103 > 10.0.0.2.5001: UDP, length 1470
00:08:24.876067 IP 10.0.0.1.42103 > 10.0.0.2.5001: UDP, length 1470
00:08:24.888153 IP 10.0.0.1.42103 > 10.0.0.2.5001: UDP, length 1470
00:08:24.900257 IP 10.0.0.1.42103 > 10.0.0.2.5001: UDP, length 1470
00:08:24.912343 IP 10.0.0.1.42103 > 10.0.0.2.5001: UDP, length 1470
00:08:24.924493 IP 10.0.0.1.42103 > 10.0.0.2.5001: UDP, length 1470
00:08:24.936559 IP 10.0.0.1.42103 > 10.0.0.2.5001: UDP, length 1470
00:08:24.949402 IP 10.0.0.1.42103 > 10.0.0.2.5001: UDP, length 1470
00:08:24.960747 IP 10.0.0.1.42103 > 10.0.0.2.5001: UDP, length 1470
00:08:24.972842 IP 10.0.0.1.42103 > 10.0.0.2.5001: UDP, length 1470
00:08:24.984941 IP 10.0.0.1.42103 > 10.0.0.2.5001: UDP, length 1470
00:08:24.997036 IP 10.0.0.1.42103 > 10.0.0.2.5001: UDP, length 1470
00:08:25.009118 IP 10.0.0.1.42103 > 10.0.0.2.5001: UDP, length 1470
00:08:25.021227 IP 10.0.0.1.42103 > 10.0.0.2.5001: UDP, length 1470
00:08:25.033320 IP 10.0.0.1.42103 > 10.0.0.2.5001: UDP, length 1470
00:08:25.045412 IP 10.0.0.1.42103 > 10.0.0.2.5001: UDP, length 1470
00:08:25.057513 IP 10.0.0.1.42103 > 10.0.0.2.5001: UDP, length 1470
00:08:25.069617 IP 10.0.0.1.42103 > 10.0.0.2.5001: UDP, length 1470
00:08:25.081704 IP 10.0.0.1.42103 > 10.0.0.2.5001: UDP, length 1470
00:08:25.094361 IP 10.0.0.1.42103 > 10.0.0.2.5001: UDP, length 1470
00:08:25.105901 IP 10.0.0.1.42103 > 10.0.0.2.5001: UDP, length 1470
00:08:25.117993 IP 10.0.0.1.42103 > 10.0.0.2.5001: UDP, length 1470
00:08:25.130087 IP 10.0.0.1.42103 > 10.0.0.2.5001: UDP, length 1470
00:08:25.142179 IP 10.0.0.1.42103 > 10.0.0.2.5001: UDP, length 1470
00:08:25.154277 IP 10.0.0.1.42103 > 10.0.0.2.5001: UDP, length 1470
00:08:25.166356 IP 10.0.0.1.42103 > 10.0.0.2.5001: UDP, length 1470
00:08:25.178473 IP 10.0.0.1.42103 > 10.0.0.2.5001: UDP, length 1470
00:08:25.190574 IP 10.0.0.1.42103 > 10.0.0.2.5001: UDP, length 1470
00:08:25.202665 IP 10.0.0.1.42103 > 10.0.0.2.5001: UDP, length 1470
00:08:25.214759 IP 10.0.0.1.42103 > 10.0.0.2.5001: UDP, length 1470
00:08:25.226863 IP 10.0.0.1.42103 > 10.0.0.2.5001: UDP, length 1470
00:08:25.251046 IP 10.0.0.1.42103 > 10.0.0.2.5001: UDP, length 1470
00:08:25.263136 IP 10.0.0.1.42103 > 10.0.0.2.5001: UDP, length 1470
00:08:25.275240 IP 10.0.0.1.42103 > 10.0.0.2.5001: UDP, length 1470
00:08:25.287371 IP 10.0.0.1.42103 > 10.0.0.2.5001: UDP, length 1470
00:08:25.299444 IP 10.0.0.1.42103 > 10.0.0.2.5001: UDP, length 1470
00:08:25.311599 IP 10.0.0.1.42103 > 10.0.0.2.5001: UDP, length 1470
00:08:25.323853 IP 10.0.0.1.42103 > 10.0.0.2.5001: UDP, length 1470
00:08:25.335819 IP 10.0.0.1.42103 > 10.0.0.2.5001: UDP, length 1470
00:08:25.348694 IP 10.0.0.1.42103 > 10.0.0.2.5001: UDP, length 1470
00:08:25.359927 IP 10.0.0.1.42103 > 10.0.0.2.5001: UDP, length 1470
00:08:25.372067 IP 10.0.0.1.42103 > 10.0.0.2.5001: UDP, length 1470
00:08:25.384908 IP 10.0.0.1.42103 > 10.0.0.2.5001: UDP, length 1470
00:08:25.396276 IP 10.0.0.1.42103 > 10.0.0.2.5001: UDP, length 1470
00:08:25.408355 IP 10.0.0.1.42103 > 10.0.0.2.5001: UDP, length 1470
00:08:25.421288 IP 10.0.0.1.42103 > 10.0.0.2.5001: UDP, length 1470
00:08:25.432547 IP 10.0.0.1.42103 > 10.0.0.2.5001: UDP, length 1470
00:08:25.444665 IP 10.0.0.1.42103 > 10.0.0.2.5001: UDP, length 1470
00:08:25.456732 IP 10.0.0.1.42103 > 10.0.0.2.5001: UDP, length 1470
00:08:25.468852 IP 10.0.0.1.42103 > 10.0.0.2.5001: UDP, length 1470
00:08:25.480871 IP 10.0.0.1.42103 > 10.0.0.2.5001: UDP, length 1470
00:08:25.492987 IP 10.0.0.1.42103 > 10.0.0.2.5001: UDP, length 1470
00:08:25.505074 IP 10.0.0.1.42103 > 10.0.0.2.5001: UDP, length 1470
00:08:25.517153 IP 10.0.0.1.42103 > 10.0.0.2.5001: UDP, length 1470
00:08:25.529256 IP 10.0.0.1.42103 > 10.0.0.2.5001: UDP, length 1470
00:08:25.541368 IP 10.0.0.1.42103 > 10.0.0.2.5001: UDP, length 1470
00:08:25.553462 IP 10.0.0.1.42103 > 10.0.0.2.5001: UDP, length 1470
00:08:25.565687 IP 10.0.0.1.42103 > 10.0.0.2.5001: UDP, length 1470
00:08:25.577687 IP 10.0.0.1.42103 > 10.0.0.2.5001: UDP, length 1470
00:08:25.589744 IP 10.0.0.1.42103 > 10.0.0.2.5001: UDP, length 1470
00:08:25.601819 IP 10.0.0.1.42103 > 10.0.0.2.5001: UDP, length 1470
00:08:25.614071 IP 10.0.0.1.42103 > 10.0.0.2.5001: UDP, length 1470
00:08:25.626023 IP 10.0.0.1.42103 > 10.0.0.2.5001: UDP, length 1470
00:08:25.638121 IP 10.0.0.1.42103 > 10.0.0.2.5001: UDP, length 1470
00:08:25.650225 IP 10.0.0.1.42103 > 10.0.0.2.5001: UDP, length 1470
00:08:25.662318 IP 10.0.0.1.42103 > 10.0.0.2.5001: UDP, length 1470
00:08:25.674421 IP 10.0.0.1.42103 > 10.0.0.2.5001: UDP, length 1470
00:08:25.686485 IP 10.0.0.1.42103 > 10.0.0.2.5001: UDP, length 1470
00:08:25.698600 IP 10.0.0.1.42103 > 10.0.0.2.5001: UDP, length 1470
00:08:25.710795 IP 10.0.0.1.42103 > 10.0.0.2.5001: UDP, length 1470
00:08:25.723817 IP 10.0.0.1.42103 > 10.0.0.2.5001: UDP, length 1470
00:08:25.747034 IP 10.0.0.1.42103 > 10.0.0.2.5001: UDP, length 1470
00:08:25.759999 IP 10.0.0.1.42103 > 10.0.0.2.5001: UDP, length 1470
00:08:25.771255 IP 10.0.0.1.42103 > 10.0.0.2.5001: UDP, length 1470
00:08:25.784093 IP 10.0.0.1.42103 > 10.0.0.2.5001: UDP, length 1470
00:08:25.795439 IP 10.0.0.1.42103 > 10.0.0.2.5001: UDP, length 1470
00:08:25.808374 IP 10.0.0.1.42103 > 10.0.0.2.5001: UDP, length 1470
00:08:25.819627 IP 10.0.0.1.42103 > 10.0.0.2.5001: UDP, length 1470
00:08:25.831737 IP 10.0.0.1.42103 > 10.0.0.2.5001: UDP, length 1470
00:08:25.843805 IP 10.0.0.1.42103 > 10.0.0.2.5001: UDP, length 1470
00:08:25.856803 IP 10.0.0.1.42103 > 10.0.0.2.5001: UDP, length 1470
00:08:25.868013 IP 10.0.0.1.42103 > 10.0.0.2.5001: UDP, length 1470
00:08:25.880127 IP 10.0.0.1.42103 > 10.0.0.2.5001: UDP, length 1470
00:08:25.892202 IP 10.0.0.1.42103 > 10.0.0.2.5001: UDP, length 1470
00:08:25.904311 IP 10.0.0.1.42103 > 10.0.0.2.5001: UDP, length 1470
00:08:25.917100 IP 10.0.0.1.42103 > 10.0.0.2.5001: UDP, length 1470
00:08:25.928479 IP 10.0.0.1.42103 > 10.0.0.2.5001: UDP, length 1470
00:08:25.940546 IP 10.0.0.1.42103 > 10.0.0.2.5001: UDP, length 1470
00:08:25.953436 IP 10.0.0.1.42103 > 10.0.0.2.5001: UDP, length 1470
00:08:25.964771 IP 10.0.0.1.42103 > 10.0.0.2.5001: UDP, length 1470
00:08:25.977654 IP 10.0.0.1.42103 > 10.0.0.2.5001: UDP, length 1470
00:08:25.988947 IP 10.0.0.1.42103 > 10.0.0.2.5001: UDP, length 1470
00:08:26.001035 IP 10.0.0.1.42103 > 10.0.0.2.5001: UDP, length 1470
00:08:26.013182 IP 10.0.0.1.42103 > 10.0.0.2.5001: UDP, length 1470
00:08:26.025224 IP 10.0.0.1.42103 > 10.0.0.2.5001: UDP, length 1470
00:08:26.037344 IP 10.0.0.1.42103 > 10.0.0.2.5001: UDP, length 1470
00:08:26.049418 IP 10.0.0.1.42103 > 10.0.0.2.5001: UDP, length 1470
00:08:26.061556 IP 10.0.0.1.42103 > 10.0.0.2.5001: UDP, length 1470
00:08:26.074394 IP 10.0.0.1.42103 > 10.0.0.2.5001: UDP, length 1470
00:08:26.097754 IP 10.0.0.1.42103 > 10.0.0.2.5001: UDP, length 1470
00:08:26.109891 IP 10.0.0.1.42103 > 10.0.0.2.5001: UDP, length 1470
00:08:26.122043 IP 10.0.0.1.42103 > 10.0.0.2.5001: UDP, length 1470
00:08:26.134852 IP 10.0.0.1.42103 > 10.0.0.2.5001: UDP, length 1470
00:08:26.146242 IP 10.0.0.1.42103 > 10.0.0.2.5001: UDP, length 1470
00:08:26.159085 IP 10.0.0.1.42103 > 10.0.0.2.5001: UDP, length 1470
00:08:26.170387 IP 10.0.0.1.42103 > 10.0.0.2.5001: UDP, length 1470
00:08:26.182526 IP 10.0.0.1.42103 > 10.0.0.2.5001: UDP, length 1470
00:08:26.194557 IP 10.0.0.1.42103 > 10.0.0.2.5001: UDP, length 1470
00:08:26.207490 IP 10.0.0.1.42103 > 10.0.0.2.5001: UDP, length 1470
00:08:26.218774 IP 10.0.0.1.42103 > 10.0.0.2.5001: UDP, length 1470
00:08:26.230851 IP 10.0.0.1.42103 > 10.0.0.2.5001: UDP, length 1470
00:08:26.243003 IP 10.0.0.1.42103 > 10.0.0.2.5001: UDP, length 1470
00:08:26.255045 IP 10.0.0.1.42103 > 10.0.0.2.5001: UDP, length 1470
00:08:26.267188 IP 10.0.0.1.42103 > 10.0.0.2.5001: UDP, length 1470
00:08:26.280184 IP 10.0.0.1.42103 > 10.0.0.2.5001: UDP, length 1470
00:08:26.291367 IP 10.0.0.1.42103 > 10.0.0.2.5001: UDP, length 1470
00:08:26.303445 IP 10.0.0.1.42103 > 10.0.0.2.5001: UDP, length 1470
00:08:26.315562 IP 10.0.0.1.42103 > 10.0.0.2.5001: UDP, length 1470
00:08:26.328428 IP 10.0.0.1.42103 > 10.0.0.2.5001: UDP, length 1470
00:08:26.339749 IP 10.0.0.1.42103 > 10.0.0.2.5001: UDP, length 1470
00:08:26.352635 IP 10.0.0.1.42103 > 10.0.0.2.5001: UDP, length 1470
00:08:26.363922 IP 10.0.0.1.42103 > 10.0.0.2.5001: UDP, length 1470
00:08:26.376004 IP 10.0.0.1.42103 > 10.0.0.2.5001: UDP, length 1470
00:08:26.388743 IP 10.0.0.1.42103 > 10.0.0.2.5001: UDP, length 1470
00:08:26.400224 IP 10.0.0.1.42103 > 10.0.0.2.5001: UDP, length 1470
00:08:26.412343 IP 10.0.0.1.42103 > 10.0.0.2.5001: UDP, length 1470
00:08:26.424407 IP 10.0.0.1.42103 > 10.0.0.2.5001: UDP, length 1470
00:08:26.436541 IP 10.0.0.1.42103 > 10.0.0.2.5001: UDP, length 1470
00:08:26.448603 IP 10.0.0.1.42103 > 10.0.0.2.5001: UDP, length 1470
00:08:26.460734 IP 10.0.0.1.42103 > 10.0.0.2.5001: UDP, length 1470
00:08:26.472813 IP 10.0.0.1.42103 > 10.0.0.2.5001: UDP, length 1470
00:08:26.484915 IP 10.0.0.1.42103 > 10.0.0.2.5001: UDP, length 1470
00:08:26.497519 IP 10.0.0.1.42103 > 10.0.0.2.5001: UDP, length 1470
00:08:26.509081 IP 10.0.0.1.42103 > 10.0.0.2.5001: UDP, length 1470
00:08:26.521968 IP 10.0.0.1.42103 > 10.0.0.2.5001: UDP, length 1470
00:08:26.533278 IP 10.0.0.1.42103 > 10.0.0.2.5001: UDP, length 1470
00:08:26.545444 IP 10.0.0.1.42103 > 10.0.0.2.5001: UDP, length 1470
00:08:26.557774 IP 10.0.0.1.42103 > 10.0.0.2.5001: UDP, length 1470
00:08:26.569572 IP 10.0.0.1.42103 > 10.0.0.2.5001: UDP, length 1470
00:08:26.581687 IP 10.0.0.1.42103 > 10.0.0.2.5001: UDP, length 1470
00:08:26.594617 IP 10.0.0.1.42103 > 10.0.0.2.5001: UDP, length 1470
00:08:26.605861 IP 10.0.0.1.42103 > 10.0.0.2.5001: UDP, length 1470
00:08:26.617931 IP 10.0.0.1.42103 > 10.0.0.2.5001: UDP, length 1470
00:08:26.630040 IP 10.0.0.1.42103 > 10.0.0.2.5001: UDP, length 1470
00:08:26.642149 IP 10.0.0.1.42103 > 10.0.0.2.5001: UDP, length 1470
00:08:26.655184 IP 10.0.0.1.42103 > 10.0.0.2.5001: UDP, length 1470
00:08:26.666342 IP 10.0.0.1.42103 > 10.0.0.2.5001: UDP, length 1470
00:08:26.679282 IP 10.0.0.1.42103 > 10.0.0.2.5001: UDP, length 1470
00:08:26.690520 IP 10.0.0.1.42103 > 10.0.0.2.5001: UDP, length 1470
00:08:26.702610 IP 10.0.0.1.42103 > 10.0.0.2.5001: UDP, length 1470
00:08:26.714729 IP 10.0.0.1.42103 > 10.0.0.2.5001: UDP, length 1470
00:08:26.727578 IP 10.0.0.1.42103 > 10.0.0.2.5001: UDP, length 1470
00:08:26.738916 IP 10.0.0.1.42103 > 10.0.0.2.5001: UDP, length 1470
00:08:26.750997 IP 10.0.0.1.42103 > 10.0.0.2.5001: UDP, length 1470
00:08:26.763082 IP 10.0.0.1.42103 > 10.0.0.2.5001: UDP, length 1470
00:08:26.775191 IP 10.0.0.1.42103 > 10.0.0.2.5001: UDP, length 1470
00:08:26.787304 IP 10.0.0.1.42103 > 10.0.0.2.5001: UDP, length 1470
00:08:26.799365 IP 10.0.0.1.42103 > 10.0.0.2.5001: UDP, length 1470
00:08:26.811457 IP 10.0.0.1.42103 > 10.0.0.2.5001: UDP, length 1470
00:08:26.823589 IP 10.0.0.1.42103 > 10.0.0.2.5001: UDP, length 1470
00:08:26.835683 IP 10.0.0.1.42103 > 10.0.0.2.5001: UDP, length 1470
00:08:26.848546 IP 10.0.0.1.42103 > 10.0.0.2.5001: UDP, length 1470
00:08:26.859882 IP 10.0.0.1.42103 > 10.0.0.2.5001: UDP, length 1470
00:08:26.872726 IP 10.0.0.1.42103 > 10.0.0.2.5001: UDP, length 1470
00:08:26.884101 IP 10.0.0.1.42103 > 10.0.0.2.5001: UDP, length 1470
00:08:26.896160 IP 10.0.0.1.42103 > 10.0.0.2.5001: UDP, length 1470
00:08:26.908277 IP 10.0.0.1.42103 > 10.0.0.2.5001: UDP, length 1470
00:08:26.920373 IP 10.0.0.1.42103 > 10.0.0.2.5001: UDP, length 1470
00:08:26.932425 IP 10.0.0.1.42103 > 10.0.0.2.5001: UDP, length 1470
00:08:26.944537 IP 10.0.0.1.42103 > 10.0.0.2.5001: UDP, length 1470
00:08:26.957370 IP 10.0.0.1.42103 > 10.0.0.2.5001: UDP, length 1470
00:08:26.968729 IP 10.0.0.1.42103 > 10.0.0.2.5001: UDP, length 1470
00:08:26.980836 IP 10.0.0.1.42103 > 10.0.0.2.5001: UDP, length 1470
00:08:26.992918 IP 10.0.0.1.42103 > 10.0.0.2.5001: UDP, length 1470
00:08:27.005027 IP 10.0.0.1.42103 > 10.0.0.2.5001: UDP, length 1470
00:08:27.017145 IP 10.0.0.1.42103 > 10.0.0.2.5001: UDP, length 1470
00:08:27.029222 IP 10.0.0.1.42103 > 10.0.0.2.5001: UDP, length 1470
00:08:27.042293 IP 10.0.0.1.42103 > 10.0.0.2.5001: UDP, length 1470
00:08:27.053390 IP 10.0.0.1.42103 > 10.0.0.2.5001: UDP, length 1470
00:08:27.065528 IP 10.0.0.1.42103 > 10.0.0.2.5001: UDP, length 1470
00:08:27.077801 IP 10.0.0.1.42103 > 10.0.0.2.5001: UDP, length 1470
00:08:27.089662 IP 10.0.0.1.42103 > 10.0.0.2.5001: UDP, length 1470
00:08:27.101836 IP 10.0.0.1.42103 > 10.0.0.2.5001: UDP, length 1470
00:08:27.113900 IP 10.0.0.1.42103 > 10.0.0.2.5001: UDP, length 1470
00:08:27.125942 IP 10.0.0.1.42103 > 10.0.0.2.5001: UDP, length 1470
00:08:27.138099 IP 10.0.0.1.42103 > 10.0.0.2.5001: UDP, length 1470
00:08:27.150906 IP 10.0.0.1.42103 > 10.0.0.2.5001: UDP, length 1470
00:08:27.162264 IP 10.0.0.1.42103 > 10.0.0.2.5001: UDP, length 1470
00:08:27.174372 IP 10.0.0.1.42103 > 10.0.0.2.5001: UDP, length 1470
00:08:27.186437 IP 10.0.0.1.42103 > 10.0.0.2.5001: UDP, length 1470
00:08:27.198598 IP 10.0.0.1.42103 > 10.0.0.2.5001: UDP, length 1470
00:08:27.210634 IP 10.0.0.1.42103 > 10.0.0.2.5001: UDP, length 1470
00:08:27.222777 IP 10.0.0.1.42103 > 10.0.0.2.5001: UDP, length 1470
00:08:27.234878 IP 10.0.0.1.42103 > 10.0.0.2.5001: UDP, length 1470
00:08:27.246936 IP 10.0.0.1.42103 > 10.0.0.2.5001: UDP, length 1470
00:08:27.259002 IP 10.0.0.1.42103 > 10.0.0.2.5001: UDP, length 1470
00:08:27.271148 IP 10.0.0.1.42103 > 10.0.0.2.5001: UDP, length 1470
00:08:27.283237 IP 10.0.0.1.42103 > 10.0.0.2.5001: UDP, length 1470
00:08:27.295353 IP 10.0.0.1.42103 > 10.0.0.2.5001: UDP, length 1470
00:08:27.307434 IP 10.0.0.1.42103 > 10.0.0.2.5001: UDP, length 1470
00:08:27.319511 IP 10.0.0.1.42103 > 10.0.0.2.5001: UDP, length 1470
00:08:27.331643 IP 10.0.0.1.42103 > 10.0.0.2.5001: UDP, length 1470
00:08:27.343700 IP 10.0.0.1.42103 > 10.0.0.2.5001: UDP, length 1470
00:08:27.355784 IP 10.0.0.1.42103 > 10.0.0.2.5001: UDP, length 1470
00:08:27.367907 IP 10.0.0.1.42103 > 10.0.0.2.5001: UDP, length 1470
00:08:27.379997 IP 10.0.0.1.42103 > 10.0.0.2.5001: UDP, length 1470
00:08:27.392053 IP 10.0.0.1.42103 > 10.0.0.2.5001: UDP, length 1470
00:08:27.404204 IP 10.0.0.1.42103 > 10.0.0.2.5001: UDP, length 1470
00:08:27.416296 IP 10.0.0.1.42103 > 10.0.0.2.5001: UDP, length 1470
00:08:27.428357 IP 10.0.0.1.42103 > 10.0.0.2.5001: UDP, length 1470
00:08:27.440483 IP 10.0.0.1.42103 > 10.0.0.2.5001: UDP, length 1470
00:08:27.452791 IP 10.0.0.1.42103 > 10.0.0.2.5001: UDP, length 1470
00:08:27.464689 IP 10.0.0.1.42103 > 10.0.0.2.5001: UDP, length 1470
00:08:27.477579 IP 10.0.0.1.42103 > 10.0.0.2.5001: UDP, length 1470
00:08:27.488856 IP 10.0.0.1.42103 > 10.0.0.2.5001: UDP, length 1470
00:08:27.500989 IP 10.0.0.1.42103 > 10.0.0.2.5001: UDP, length 1470
00:08:27.513038 IP 10.0.0.1.42103 > 10.0.0.2.5001: UDP, length 1470
00:08:27.525105 IP 10.0.0.1.42103 > 10.0.0.2.5001: UDP, length 1470
00:08:27.537983 IP 10.0.0.1.42103 > 10.0.0.2.5001: UDP, length 1470
00:08:27.549344 IP 10.0.0.1.42103 > 10.0.0.2.5001: UDP, length 1470
00:08:27.561439 IP 10.0.0.1.42103 > 10.0.0.2.5001: UDP, length 1470
00:08:27.573576 IP 10.0.0.1.42103 > 10.0.0.2.5001: UDP, length 1470
00:08:27.586428 IP 10.0.0.1.42103 > 10.0.0.2.5001: UDP, length 1470
00:08:27.597732 IP 10.0.0.1.42103 > 10.0.0.2.5001: UDP, length 1470
00:08:27.609793 IP 10.0.0.1.42103 > 10.0.0.2.5001: UDP, length 1470
00:08:27.621912 IP 10.0.0.1.42103 > 10.0.0.2.5001: UDP, length 1470
00:08:27.634034 IP 10.0.0.1.42103 > 10.0.0.2.5001: UDP, length 1470
00:08:27.646171 IP 10.0.0.1.42103 > 10.0.0.2.5001: UDP, length 1470
00:08:27.658226 IP 10.0.0.1.42103 > 10.0.0.2.5001: UDP, length 1470
00:08:27.670325 IP 10.0.0.1.42103 > 10.0.0.2.5001: UDP, length 1470
00:08:27.682362 IP 10.0.0.1.42103 > 10.0.0.2.5001: UDP, length 1470
00:08:27.694519 IP 10.0.0.1.42103 > 10.0.0.2.5001: UDP, length 1470
00:08:27.706570 IP 10.0.0.1.42103 > 10.0.0.2.5001: UDP, length 1470
00:08:27.718673 IP 10.0.0.1.42103 > 10.0.0.2.5001: UDP, length 1470
00:08:27.730783 IP 10.0.0.1.42103 > 10.0.0.2.5001: UDP, length 1470
00:08:27.742847 IP 10.0.0.1.42103 > 10.0.0.2.5001: UDP, length 1470
00:08:27.755011 IP 10.0.0.1.42103 > 10.0.0.2.5001: UDP, length 1470
00:08:27.767085 IP 10.0.0.1.42103 > 10.0.0.2.5001: UDP, length 1470
00:08:27.779151 IP 10.0.0.1.42103 > 10.0.0.2.5001: UDP, length 1470
00:08:27.791306 IP 10.0.0.1.42103 > 10.0.0.2.5001: UDP, length 1470
00:08:27.803334 IP 10.0.0.1.42103 > 10.0.0.2.5001: UDP, length 1470
00:08:27.815481 IP 10.0.0.1.42103 > 10.0.0.2.5001: UDP, length 1470
00:08:27.827570 IP 10.0.0.1.42103 > 10.0.0.2.5001: UDP, length 1470
00:08:27.839626 IP 10.0.0.1.42103 > 10.0.0.2.5001: UDP, length 1470
00:08:27.851736 IP 10.0.0.1.42103 > 10.0.0.2.5001: UDP, length 1470
00:08:27.863875 IP 10.0.0.1.42103 > 10.0.0.2.5001: UDP, length 1470
00:08:27.876786 IP 10.0.0.1.42103 > 10.0.0.2.5001: UDP, length 1470
00:08:27.888048 IP 10.0.0.1.42103 > 10.0.0.2.5001: UDP, length 1470

