00:08:32.345687 IP 10.0.0.1.54396 > 10.0.0.2.5001: UDP, length 1470
00:08:32.345898 IP 10.0.0.1.54396 > 10.0.0.2.5001: UDP, length 1470
00:08:32.357017 IP 10.0.0.1.54396 > 10.0.0.2.5001: UDP, length 1470
00:08:32.369109 IP 10.0.0.1.54396 > 10.0.0.2.5001: UDP, length 1470
00:08:32.381226 IP 10.0.0.1.54396 > 10.0.0.2.5001: UDP, length 1470
00:08:32.393324 IP 10.0.0.1.54396 > 10.0.0.2.5001: UDP, length 1470
00:08:32.405438 IP 10.0.0.1.54396 > 10.0.0.2.5001: UDP, length 1470
00:08:32.417537 IP 10.0.0.1.54396 > 10.0.0.2.5001: UDP, length 1470
00:08:32.429723 IP 10.0.0.1.54396 > 10.0.0.2.5001: UDP, length 1470
00:08:32.441714 IP 10.0.0.1.54396 > 10.0.0.2.5001: UDP, length 1470
00:08:32.453812 IP 10.0.0.1.54396 > 10.0.0.2.5001: UDP, length 1470
00:08:32.465897 IP 10.0.0.1.54396 > 10.0.0.2.5001: UDP, length 1470
00:08:32.478002 IP 10.0.0.1.54396 > 10.0.0.2.5001: UDP, length 1470
00:08:32.490102 IP 10.0.0.1.54396 > 10.0.0.2.5001: UDP, length 1470
00:08:32.502193 IP 10.0.0.1.54396 > 10.0.0.2.5001: UDP, length 1470
00:08:32.514309 IP 10.0.0.1.54396 > 10.0.0.2.5001: UDP, length 1470
00:08:32.526382 IP 10.0.0.1.54396 > 10.0.0.2.5001: UDP, length 1470
00:08:32.538942 IP 10.0.0.1.54396 > 10.0.0.2.5001: UDP, length 1470
00:08:32.550571 IP 10.0.0.1.54396 > 10.0.0.2.5001: UDP, length 1470
00:08:32.562665 IP 10.0.0.1.54396 > 10.0.0.2.5001: UDP, length 1470
00:08:32.574769 IP 10.0.0.1.54396 > 10.0.0.2.5001: UDP, length 1470
00:08:32.586870 IP 10.0.0.1.54396 > 10.0.0.2.5001: UDP, length 1470
00:08:32.598973 IP 10.0.0.1.54396 > 10.0.0.2.5001: UDP, length 1470
00:08:32.611079 IP 10.0.0.1.54396 > 10.0.0.2.5001: UDP, length 1470
00:08:32.623145 IP 10.0.0.1.54396 > 10.0.0.2.5001: UDP, length 1470
00:08:32.635249 IP 10.0.0.1.54396 > 10.0.0.2.5001: UDP, length 1470
00:08:32.647352 IP 10.0.0.1.54396 > 10.0.0.2.5001: UDP, length 1470
00:08:32.659440 IP 10.0.0.1.54396 > 10.0.0.2.5001: UDP, length 1470
00:08:32.672330 IP 10.0.0.1.54396 > 10.0.0.2.5001: UDP, length 1470
00:08:32.683623 IP 10.0.0.1.54396 > 10.0.0.2.5001: UDP, length 1470
00:08:32.695749 IP 10.0.0.1.54396 > 10.0.0.2.5001: UDP, length 1470
00:08:32.707825 IP 10.0.0.1.54396 > 10.0.0.2.5001: UDP, length 1470
00:08:32.719927 IP 10.0.0.1.54396 > 10.0.0.2.5001: UDP, length 1470
00:08:32.732019 IP 10.0.0.1.54396 > 10.0.0.2.5001: UDP, length 1470
00:08:32.744134 IP 10.0.0.1.54396 > 10.0.0.2.5001: UDP, length 1470
00:08:32.756211 IP 10.0.0.1.54396 > 10.0.0.2.5001: UDP, length 1470
00:08:32.768303 IP 10.0.0.1.54396 > 10.0.0.2.5001: UDP, length 1470
00:08:32.780396 IP 10.0.0.1.54396 > 10.0.0.2.5001: UDP, length 1470
00:08:32.792503 IP 10.0.0.1.54396 > 10.0.0.2.5001: UDP, length 1470
00:08:32.804606 IP 10.0.0.1.54396 > 10.0.0.2.5001: UDP, length 1470
00:08:32.816698 IP 10.0.0.1.54396 > 10.0.0.2.5001: UDP, length 1470
00:08:32.828814 IP 10.0.0.1.54396 > 10.0.0.2.5001: UDP, length 1470
00:08:32.840886 IP 10.0.0.1.54396 > 10.0.0.2.5001: UDP, length 1470
00:08:32.852978 IP 10.0.0.1.54396 > 10.0.0.2.5001: UDP, length 1470
00:08:32.865099 IP 10.0.0.1.54396 > 10.0.0.2.5001: UDP, length 1470
00:08:32.877176 IP 10.0.0.1.54396 > 10.0.0.2.5001: UDP, length 1470
00:08:32.889265 IP 10.0.0.1.54396 > 10.0.0.2.5001: UDP, length 1470
00:08:32.901380 IP 10.0.0.1.54396 > 10.0.0.2.5001: UDP, length 1470
00:08:32.913460 IP 10.0.0.1.54396 > 10.0.0.2.5001: UDP, length 1470
00:08:32.925547 IP 10.0.0.1.54396 > 10.0.0.2.5001: UDP, length 1470
00:08:32.938364 IP 10.0.0.1.54396 > 10.0.0.2.5001: UDP, length 1470
00:08:32.949745 IP 10.0.0.1.54396 > 10.0.0.2.5001: UDP, length 1470
00:08:32.961840 IP 10.0.0.1.54396 > 10.0.0.2.5001: UDP, length 1470
00:08:32.974792 IP 10.0.0.1.54396 > 10.0.0.2.5001: UDP, length 1470
00:08:32.986031 IP 10.0.0.1.54396 > 10.0.0.2.5001: UDP, length 1470
00:08:32.998128 IP 10.0.0.1.54396 > 10.0.0.2.5001: UDP, length 1470
00:08:33.010226 IP 10.0.0.1.54396 > 10.0.0.2.5001: UDP, length 1470
00:08:33.022323 IP 10.0.0.1.54396 > 10.0.0.2.5001: UDP, length 1470
00:08:33.034416 IP 10.0.0.1.54396 > 10.0.0.2.5001: UDP, length 1470
00:08:33.046950 IP 10.0.0.1.54396 > 10.0.0.2.5001: UDP, length 1470
00:08:33.058624 IP 10.0.0.1.54396 > 10.0.0.2.5001: UDP, length 1470
00:08:33.070696 IP 10.0.0.1.54396 > 10.0.0.2.5001: UDP, length 1470
00:08:33.082802 IP 10.0.0.1.54396 > 10.0.0.2.5001: UDP, length 1470
00:08:33.094918 IP 10.0.0.1.54396 > 10.0.0.2.5001: UDP, length 1470
00:08:33.106993 IP 10.0.0.1.54396 > 10.0.0.2.5001: UDP, length 1470
00:08:33.119108 IP 10.0.0.1.54396 > 10.0.0.2.5001: UDP, length 1470
00:08:33.131171 IP 10.0.0.1.54396 > 10.0.0.2.5001: UDP, length 1470
00:08:33.143275 IP 10.0.0.1.54396 > 10.0.0.2.5001: UDP, length 1470
00:08:33.155377 IP 10.0.0.1.54396 > 10.0.0.2.5001: UDP, length 1470
00:08:33.168140 IP 10.0.0.1.54396 > 10.0.0.2.5001: UDP, length 1470
00:08:33.179592 IP 10.0.0.1.54396 > 10.0.0.2.5001: UDP, length 1470
00:08:33.191672 IP 10.0.0.1.54396 > 10.0.0.2.5001: UDP, length 1470
00:08:33.203764 IP 10.0.0.1.54396 > 10.0.0.2.5001: UDP, length 1470
00:08:33.215858 IP 10.0.0.1.54396 > 10.0.0.2.5001: UDP, length 1470
00:08:33.227955 IP 10.0.0.1.54396 > 10.0.0.2.5001: UDP, length 1470
00:08:33.240043 IP 10.0.0.1.54396 > 10.0.0.2.5001: UDP, length 1470
00:08:33.252162 IP 10.0.0.1.54396 > 10.0.0.2.5001: UDP, length 1470
00:08:33.264241 IP 10.0.0.1.54396 > 10.0.0.2.5001: UDP, length 1470
00:08:33.277170 IP 10.0.0.1.54396 > 10.0.0.2.5001: UDP, length 1470
00:08:33.288432 IP 10.0.0.1.54396 > 10.0.0.2.5001: UDP, length 1470
00:08:33.300526 IP 10.0.0.1.54396 > 10.0.0.2.5001: UDP, length 1470
00:08:33.313389 IP 10.0.0.1.54396 > 10.0.0.2.5001: UDP, length 1470
00:08:33.324723 IP 10.0.0.1.54396 > 10.0.0.2.5001: UDP, length 1470
00:08:33.336817 IP 10.0.0.1.54396 > 10.0.0.2.5001: UDP, length 1470
00:08:33.348913 IP 10.0.0.1.54396 > 10.0.0.2.5001: UDP, length 1470
00:08:33.361012 IP 10.0.0.1.54396 > 10.0.0.2.5001: UDP, length 1470
00:08:33.373122 IP 10.0.0.1.54396 > 10.0.0.2.5001: UDP, length 1470
00:08:33.385204 IP 10.0.0.1.54396 > 10.0.0.2.5001: UDP, length 1470
00:08:33.397299 IP 10.0.0.1.54396 > 10.0.0.2.5001: UDP, length 1470
00:08:33.409403 IP 10.0.0.1.54396 > 10.0.0.2.5001: UDP, length 1470
00:08:33.422346 IP 10.0.0.1.54396 > 10.0.0.2.5001: UDP, length 1470
00:08:33.433609 IP 10.0.0.1.54396 > 10.0.0.2.5001: UDP, length 1470
00:08:33.445671 IP 10.0.0.1.54396 > 10.0.0.2.5001: UDP, length 1470
00:08:33.458632 IP 10.0.0.1.54396 > 10.0.0.2.5001: UDP, length 1470
00:08:33.469874 IP 10.0.0.1.54396 > 10.0.0.2.5001: UDP, length 1470
00:08:33.481969 IP 10.0.0.1.54396 > 10.0.0.2.5001: UDP, length 1470
00:08:33.494064 IP 10.0.0.1.54396 > 10.0.0.2.5001: UDP, length 1470
00:08:33.506159 IP 10.0.0.1.54396 > 10.0.0.2.5001: UDP, length 1470
00:08:33.518254 IP 10.0.0.1.54396 > 10.0.0.2.5001: UDP, length 1470
00:08:33.530355 IP 10.0.0.1.54396 > 10.0.0.2.5001: UDP, length 1470
00:08:33.542449 IP 10.0.0.1.54396 > 10.0.0.2.5001: UDP, length 1470
00:08:33.554548 IP 10.0.0.1.54396 > 10.0.0.2.5001: UDP, length 1470
00:08:33.566652 IP 10.0.0.1.54396 > 10.0.0.2.5001: UDP, length 1470
00:08:33.578738 IP 10.0.0.1.54396 > 10.0.0.2.5001: UDP, length 1470
00:08:33.590837 IP 10.0.0.1.54396 > 10.0.0.2.5001: UDP, length 1470
00:08:33.602919 IP 10.0.0.1.54396 > 10.0.0.2.5001: UDP, length 1470
00:08:33.615026 IP 10.0.0.1.54396 > 10.0.0.2.5001: UDP, length 1470
00:08:33.627124 IP 10.0.0.1.54396 > 10.0.0.2.5001: UDP, length 1470
00:08:33.639218 IP 10.0.0.1.54396 > 10.0.0.2.5001: UDP, length 1470
00:08:33.651333 IP 10.0.0.1.54396 > 10.0.0.2.5001: UDP, length 1470
00:08:33.663430 IP 10.0.0.1.54396 > 10.0.0.2.5001: UDP, length 1470
00:08:33.675500 IP 10.0.0.1.54396 > 10.0.0.2.5001: UDP, length 1470
00:08:33.687606 IP 10.0.0.1.54396 > 10.0.0.2.5001: UDP, length 1470
00:08:33.699728 IP 10.0.0.1.54396 > 10.0.0.2.5001: UDP, length 1470
00:08:33.711801 IP 10.0.0.1.54396 > 10.0.0.2.5001: UDP, length 1470
00:08:33.723888 IP 10.0.0.1.54396 > 10.0.0.2.5001: UDP, length 1470
00:08:33.735981 IP 10.0.0.1.54396 > 10.0.0.2.5001: UDP, length 1470
00:08:33.748081 IP 10.0.0.1.54396 > 10.0.0.2.5001: UDP, length 1470
00:08:33.760206 IP 10.0.0.1.54396 > 10.0.0.2.5001: UDP, length 1470
00:08:33.772275 IP 10.0.0.1.54396 > 10.0.0.2.5001: UDP, length 1470
00:08:33.784373 IP 10.0.0.1.54396 > 10.0.0.2.5001: UDP, length 1470
00:08:33.796468 IP 10.0.0.1.54396 > 10.0.0.2.5001: UDP, length 1470
00:08:33.808559 IP 10.0.0.1.54396 > 10.0.0.2.5001: UDP, length 1470
00:08:33.820658 IP 10.0.0.1.54396 > 10.0.0.2.5001: UDP, length 1470
00:08:33.832765 IP 10.0.0.1.54396 > 10.0.0.2.5001: UDP, length 1470
00:08:33.844865 IP 10.0.0.1.54396 > 10.0.0.2.5001: UDP, length 1470
00:08:33.856949 IP 10.0.0.1.54396 > 10.0.0.2.5001: UDP, length 1470
00:08:33.869062 IP 10.0.0.1.54396 > 10.0.0.2.5001: UDP, length 1470
00:08:33.881766 IP 10.0.0.1.54396 > 10.0.0.2.5001: UDP, length 1470
00:08:33.893238 IP 10.0.0.1.54396 > 10.0.0.2.5001: UDP, length 1470
00:08:33.905332 IP 10.0.0.1.54396 > 10.0.0.2.5001: UDP, length 1470
00:08:33.917425 IP 10.0.0.1.54396 > 10.0.0.2.5001: UDP, length 1470
00:08:33.929524 IP 10.0.0.1.54396 > 10.0.0.2.5001: UDP, length 1470
00:08:33.941617 IP 10.0.0.1.54396 > 10.0.0.2.5001: UDP, length 1470
00:08:33.953716 IP 10.0.0.1.54396 > 10.0.0.2.5001: UDP, length 1470
00:08:33.965811 IP 10.0.0.1.54396 > 10.0.0.2.5001: UDP, length 1470
00:08:33.977899 IP 10.0.0.1.54396 > 10.0.0.2.5001: UDP, length 1470
00:08:33.990001 IP 10.0.0.1.54396 > 10.0.0.2.5001: UDP, length 1470
00:08:34.002103 IP 10.0.0.1.54396 > 10.0.0.2.5001: UDP, length 1470
00:08:34.014191 IP 10.0.0.1.54396 > 10.0.0.2.5001: UDP, length 1470
00:08:34.026281 IP 10.0.0.1.54396 > 10.0.0.2.5001: UDP, length 1470
00:08:34.038391 IP 10.0.0.1.54396 > 10.0.0.2.5001: UDP, length 1470
00:08:34.050477 IP 10.0.0.1.54396 > 10.0.0.2.5001: UDP, length 1470
00:08:34.062576 IP 10.0.0.1.54396 > 10.0.0.2.5001: UDP, length 1470
00:08:34.074672 IP 10.0.0.1.54396 > 10.0.0.2.5001: UDP, length 1470
00:08:34.086790 IP 10.0.0.1.54396 > 10.0.0.2.5001: UDP, length 1470
00:08:34.098862 IP 10.0.0.1.54396 > 10.0.0.2.5001: UDP, length 1470
00:08:34.110961 IP 10.0.0.1.54396 > 10.0.0.2.5001: UDP, length 1470
00:08:34.123052 IP 10.0.0.1.54396 > 10.0.0.2.5001: UDP, length 1470
00:08:34.135156 IP 10.0.0.1.54396 > 10.0.0.2.5001: UDP, length 1470
00:08:34.147272 IP 10.0.0.1.54396 > 10.0.0.2.5001: UDP, length 1470
00:08:34.159337 IP 10.0.0.1.54396 > 10.0.0.2.5001: UDP, length 1470
00:08:34.171431 IP 10.0.0.1.54396 > 10.0.0.2.5001: UDP, length 1470
00:08:34.183538 IP 10.0.0.1.54396 > 10.0.0.2.5001: UDP, length 1470
00:08:34.195623 IP 10.0.0.1.54396 > 10.0.0.2.5001: UDP, length 1470
00:08:34.207725 IP 10.0.0.1.54396 > 10.0.0.2.5001: UDP, length 1470
00:08:34.219829 IP 10.0.0.1.54396 > 10.0.0.2.5001: UDP, length 1470
00:08:34.231924 IP 10.0.0.1.54396 > 10.0.0.2.5001: UDP, length 1470
00:08:34.244039 IP 10.0.0.1.54396 > 10.0.0.2.5001: UDP, length 1470
00:08:34.256111 IP 10.0.0.1.54396 > 10.0.0.2.5001: UDP, length 1470
00:08:34.268616 IP 10.0.0.1.54396 > 10.0.0.2.5001: UDP, length 1470
00:08:34.280322 IP 10.0.0.1.54396 > 10.0.0.2.5001: UDP, length 1470
00:08:34.292388 IP 10.0.0.1.54396 > 10.0.0.2.5001: UDP, length 1470
00:08:34.304495 IP 10.0.0.1.54396 > 10.0.0.2.5001: UDP, length 1470
00:08:34.316593 IP 10.0.0.1.54396 > 10.0.0.2.5001: UDP, length 1470
00:08:34.328704 IP 10.0.0.1.54396 > 10.0.0.2.5001: UDP, length 1470
00:08:34.340807 IP 10.0.0.1.54396 > 10.0.0.2.5001: UDP, length 1470
00:08:34.352890 IP 10.0.0.1.54396 > 10.0.0.2.5001: UDP, length 1470
00:08:34.364979 IP 10.0.0.1.54396 > 10.0.0.2.5001: UDP, length 1470
00:08:34.377093 IP 10.0.0.1.54396 > 10.0.0.2.5001: UDP, length 1470
00:08:34.389176 IP 10.0.0.1.54396 > 10.0.0.2.5001: UDP, length 1470
00:08:34.401255 IP 10.0.0.1.54396 > 10.0.0.2.5001: UDP, length 1470
00:08:34.413371 IP 10.0.0.1.54396 > 10.0.0.2.5001: UDP, length 1470
00:08:34.425453 IP 10.0.0.1.54396 > 10.0.0.2.5001: UDP, length 1470
00:08:34.437556 IP 10.0.0.1.54396 > 10.0.0.2.5001: UDP, length 1470
00:08:34.449651 IP 10.0.0.1.54396 > 10.0.0.2.5001: UDP, length 1470
00:08:34.461738 IP 10.0.0.1.54396 > 10.0.0.2.5001: UDP, length 1470
00:08:34.473839 IP 10.0.0.1.54396 > 10.0.0.2.5001: UDP, length 1470
00:08:34.485928 IP 10.0.0.1.54396 > 10.0.0.2.5001: UDP, length 1470
00:08:34.498036 IP 10.0.0.1.54396 > 10.0.0.2.5001: UDP, length 1470
00:08:34.510123 IP 10.0.0.1.54396 > 10.0.0.2.5001: UDP, length 1470
00:08:34.522231 IP 10.0.0.1.54396 > 10.0.0.2.5001: UDP, length 1470
00:08:34.534320 IP 10.0.0.1.54396 > 10.0.0.2.5001: UDP, length 1470
00:08:34.546451 IP 10.0.0.1.54396 > 10.0.0.2.5001: UDP, length 1470
00:08:34.558508 IP 10.0.0.1.54396 > 10.0.0.2.5001: UDP, length 1470
00:08:34.570601 IP 10.0.0.1.54396 > 10.0.0.2.5001: UDP, length 1470
00:08:34.582711 IP 10.0.0.1.54396 > 10.0.0.2.5001: UDP, length 1470
00:08:34.594808 IP 10.0.0.1.54396 > 10.0.0.2.5001: UDP, length 1470
00:08:34.606921 IP 10.0.0.1.54396 > 10.0.0.2.5001: UDP, length 1470
00:08:34.619014 IP 10.0.0.1.54396 > 10.0.0.2.5001: UDP, length 1470
00:08:34.631090 IP 10.0.0.1.54396 > 10.0.0.2.5001: UDP, length 1470
00:08:34.643183 IP 10.0.0.1.54396 > 10.0.0.2.5001: UDP, length 1470
00:08:34.655285 IP 10.0.0.1.54396 > 10.0.0.2.5001: UDP, length 1470
00:08:34.667394 IP 10.0.0.1.54396 > 10.0.0.2.5001: UDP, length 1470
00:08:34.679664 IP 10.0.0.1.54396 > 10.0.0.2.5001: UDP, length 1470
00:08:34.692307 IP 10.0.0.1.54396 > 10.0.0.2.5001: UDP, length 1470
00:08:34.703668 IP 10.0.0.1.54396 > 10.0.0.2.5001: UDP, length 1470
00:08:34.715760 IP 10.0.0.1.54396 > 10.0.0.2.5001: UDP, length 1470
00:08:34.730695 IP 10.0.0.1.54396 > 10.0.0.2.5001: UDP, length 1470
00:08:34.739969 IP 10.0.0.1.54396 > 10.0.0.2.5001: UDP, length 1470
00:08:34.752838 IP 10.0.0.1.54396 > 10.0.0.2.5001: UDP, length 1470
00:08:34.764144 IP 10.0.0.1.54396 > 10.0.0.2.5001: UDP, length 1470
00:08:34.776265 IP 10.0.0.1.54396 > 10.0.0.2.5001: UDP, length 1470
00:08:34.788337 IP 10.0.0.1.54396 > 10.0.0.2.5001: UDP, length 1470
00:08:34.800440 IP 10.0.0.1.54396 > 10.0.0.2.5001: UDP, length 1470
00:08:34.812536 IP 10.0.0.1.54396 > 10.0.0.2.5001: UDP, length 1470
00:08:34.824619 IP 10.0.0.1.54396 > 10.0.0.2.5001: UDP, length 1470
00:08:34.836720 IP 10.0.0.1.54396 > 10.0.0.2.5001: UDP, length 1470
00:08:34.849573 IP 10.0.0.1.54396 > 10.0.0.2.5001: UDP, length 1470
00:08:34.860936 IP 10.0.0.1.54396 > 10.0.0.2.5001: UDP, length 1470
00:08:34.873019 IP 10.0.0.1.54396 > 10.0.0.2.5001: UDP, length 1470
00:08:34.885107 IP 10.0.0.1.54396 > 10.0.0.2.5001: UDP, length 1470
00:08:34.897203 IP 10.0.0.1.54396 > 10.0.0.2.5001: UDP, length 1470
00:08:34.909296 IP 10.0.0.1.54396 > 10.0.0.2.5001: UDP, length 1470
00:08:34.921399 IP 10.0.0.1.54396 > 10.0.0.2.5001: UDP, length 1470
00:08:34.933500 IP 10.0.0.1.54396 > 10.0.0.2.5001: UDP, length 1470
00:08:34.945580 IP 10.0.0.1.54396 > 10.0.0.2.5001: UDP, length 1470
00:08:34.957681 IP 10.0.0.1.54396 > 10.0.0.2.5001: UDP, length 1470
00:08:34.969785 IP 10.0.0.1.54396 > 10.0.0.2.5001: UDP, length 1470
00:08:34.981875 IP 10.0.0.1.54396 > 10.0.0.2.5001: UDP, length 1470
00:08:34.993988 IP 10.0.0.1.54396 > 10.0.0.2.5001: UDP, length 1470
00:08:35.006061 IP 10.0.0.1.54396 > 10.0.0.2.5001: UDP, length 1470
00:08:35.018192 IP 10.0.0.1.54396 > 10.0.0.2.5001: UDP, length 1470
00:08:35.030273 IP 10.0.0.1.54396 > 10.0.0.2.5001: UDP, length 1470
00:08:35.042352 IP 10.0.0.1.54396 > 10.0.0.2.5001: UDP, length 1470
00:08:35.054455 IP 10.0.0.1.54396 > 10.0.0.2.5001: UDP, length 1470
00:08:35.066562 IP 10.0.0.1.54396 > 10.0.0.2.5001: UDP, length 1470
00:08:35.078643 IP 10.0.0.1.54396 > 10.0.0.2.5001: UDP, length 1470
00:08:35.090737 IP 10.0.0.1.54396 > 10.0.0.2.5001: UDP, length 1470
00:08:35.102823 IP 10.0.0.1.54396 > 10.0.0.2.5001: UDP, length 1470
00:08:35.114931 IP 10.0.0.1.54396 > 10.0.0.2.5001: UDP, length 1470
00:08:35.127918 IP 10.0.0.1.54396 > 10.0.0.2.5001: UDP, length 1470
00:08:35.139123 IP 10.0.0.1.54396 > 10.0.0.2.5001: UDP, length 1470
00:08:35.152024 IP 10.0.0.1.54396 > 10.0.0.2.5001: UDP, length 1470
00:08:35.163312 IP 10.0.0.1.54396 > 10.0.0.2.5001: UDP, length 1470
00:08:35.175405 IP 10.0.0.1.54396 > 10.0.0.2.5001: UDP, length 1470
00:08:35.187548 IP 10.0.0.1.54396 > 10.0.0.2.5001: UDP, length 1470
00:08:35.199586 IP 10.0.0.1.54396 > 10.0.0.2.5001: UDP, length 1470
00:08:35.211696 IP 10.0.0.1.54396 > 10.0.0.2.5001: UDP, length 1470
00:08:35.224583 IP 10.0.0.1.54396 > 10.0.0.2.5001: UDP, length 1470
00:08:35.235889 IP 10.0.0.1.54396 > 10.0.0.2.5001: UDP, length 1470
00:08:35.248011 IP 10.0.0.1.54396 > 10.0.0.2.5001: UDP, length 1470
00:08:35.260078 IP 10.0.0.1.54396 > 10.0.0.2.5001: UDP, length 1470
00:08:35.272930 IP 10.0.0.1.54396 > 10.0.0.2.5001: UDP, length 1470
00:08:35.284272 IP 10.0.0.1.54396 > 10.0.0.2.5001: UDP, length 1470
00:08:35.296371 IP 10.0.0.1.54396 > 10.0.0.2.5001: UDP, length 1470
00:08:35.308494 IP 10.0.0.1.54396 > 10.0.0.2.5001: UDP, length 1470
00:08:35.320554 IP 10.0.0.1.54396 > 10.0.0.2.5001: UDP, length 1470
00:08:35.332675 IP 10.0.0.1.54396 > 10.0.0.2.5001: UDP, length 1470
00:08:35.344773 IP 10.0.0.1.54396 > 10.0.0.2.5001: UDP, length 1470
00:08:35.356848 IP 10.0.0.1.54396 > 10.0.0.2.5001: UDP, length 1470
00:08:35.368951 IP 10.0.0.1.54396 > 10.0.0.2.5001: UDP, length 1470
00:08:35.381035 IP 10.0.0.1.54396 > 10.0.0.2.5001: UDP, length 1470
00:08:35.393136 IP 10.0.0.1.54396 > 10.0.0.2.5001: UDP, length 1470
00:08:35.405232 IP 10.0.0.1.54396 > 10.0.0.2.5001: UDP, length 1470
00:08:35.417328 IP 10.0.0.1.54396 > 10.0.0.2.5001: UDP, length 1470
00:08:35.429430 IP 10.0.0.1.54396 > 10.0.0.2.5001: UDP, length 1470
00:08:35.441533 IP 10.0.0.1.54396 > 10.0.0.2.5001: UDP, length 1470
00:08:35.453620 IP 10.0.0.1.54396 > 10.0.0.2.5001: UDP, length 1470
00:08:35.465712 IP 10.0.0.1.54396 > 10.0.0.2.5001: UDP, length 1470
00:08:35.477803 IP 10.0.0.1.54396 > 10.0.0.2.5001: UDP, length 1470
00:08:35.489903 IP 10.0.0.1.54396 > 10.0.0.2.5001: UDP, length 1470
00:08:35.502020 IP 10.0.0.1.54396 > 10.0.0.2.5001: UDP, length 1470
00:08:35.514859 IP 10.0.0.1.54396 > 10.0.0.2.5001: UDP, length 1470
00:08:35.526214 IP 10.0.0.1.54396 > 10.0.0.2.5001: UDP, length 1470
00:08:35.538310 IP 10.0.0.1.54396 > 10.0.0.2.5001: UDP, length 1470
00:08:35.550382 IP 10.0.0.1.54396 > 10.0.0.2.5001: UDP, length 1470
00:08:35.563399 IP 10.0.0.1.54396 > 10.0.0.2.5001: UDP, length 1470
00:08:35.574574 IP 10.0.0.1.54396 > 10.0.0.2.5001: UDP, length 1470
00:08:35.586682 IP 10.0.0.1.54396 > 10.0.0.2.5001: UDP, length 1470
00:08:35.598769 IP 10.0.0.1.54396 > 10.0.0.2.5001: UDP, length 1470
00:08:35.610863 IP 10.0.0.1.54396 > 10.0.0.2.5001: UDP, length 1470
00:08:35.623731 IP 10.0.0.1.54396 > 10.0.0.2.5001: UDP, length 1470
00:08:35.635055 IP 10.0.0.1.54396 > 10.0.0.2.5001: UDP, length 1470
00:08:35.647155 IP 10.0.0.1.54396 > 10.0.0.2.5001: UDP, length 1470
00:08:35.659248 IP 10.0.0.1.54396 > 10.0.0.2.5001: UDP, length 1470
00:08:35.671334 IP 10.0.0.1.54396 > 10.0.0.2.5001: UDP, length 1470
00:08:35.683817 IP 10.0.0.1.54396 > 10.0.0.2.5001: UDP, length 1470
00:08:35.695549 IP 10.0.0.1.54396 > 10.0.0.2.5001: UDP, length 1470
00:08:35.707635 IP 10.0.0.1.54396 > 10.0.0.2.5001: UDP, length 1470
00:08:35.719768 IP 10.0.0.1.54396 > 10.0.0.2.5001: UDP, length 1470
00:08:35.731823 IP 10.0.0.1.54396 > 10.0.0.2.5001: UDP, length 1470
00:08:35.743943 IP 10.0.0.1.54396 > 10.0.0.2.5001: UDP, length 1470
00:08:35.756048 IP 10.0.0.1.54396 > 10.0.0.2.5001: UDP, length 1470
00:08:35.768116 IP 10.0.0.1.54396 > 10.0.0.2.5001: UDP, length 1470
00:08:35.780208 IP 10.0.0.1.54396 > 10.0.0.2.5001: UDP, length 1470
00:08:35.793033 IP 10.0.0.1.54396 > 10.0.0.2.5001: UDP, length 1470
00:08:35.804403 IP 10.0.0.1.54396 > 10.0.0.2.5001: UDP, length 1470
00:08:35.816501 IP 10.0.0.1.54396 > 10.0.0.2.5001: UDP, length 1470
00:08:35.828590 IP 10.0.0.1.54396 > 10.0.0.2.5001: UDP, length 1470
00:08:35.840687 IP 10.0.0.1.54396 > 10.0.0.2.5001: UDP, length 1470
00:08:35.852771 IP 10.0.0.1.54396 > 10.0.0.2.5001: UDP, length 1470
00:08:35.864880 IP 10.0.0.1.54396 > 10.0.0.2.5001: UDP, length 1470
00:08:35.876997 IP 10.0.0.1.54396 > 10.0.0.2.5001: UDP, length 1470
00:08:35.889137 IP 10.0.0.1.54396 > 10.0.0.2.5001: UDP, length 1470
00:08:35.901192 IP 10.0.0.1.54396 > 10.0.0.2.5001: UDP, length 1470
00:08:35.913259 IP 10.0.0.1.54396 > 10.0.0.2.5001: UDP, length 1470
00:08:35.925358 IP 10.0.0.1.54396 > 10.0.0.2.5001: UDP, length 1470
00:08:35.937456 IP 10.0.0.1.54396 > 10.0.0.2.5001: UDP, length 1470
00:08:35.949567 IP 10.0.0.1.54396 > 10.0.0.2.5001: UDP, length 1470
00:08:35.961652 IP 10.0.0.1.54396 > 10.0.0.2.5001: UDP, length 1470
00:08:35.973744 IP 10.0.0.1.54396 > 10.0.0.2.5001: UDP, length 1470
00:08:35.985843 IP 10.0.0.1.54396 > 10.0.0.2.5001: UDP, length 1470
00:08:35.998721 IP 10.0.0.1.54396 > 10.0.0.2.5001: UDP, length 1470
00:08:36.010062 IP 10.0.0.1.54396 > 10.0.0.2.5001: UDP, length 1470
00:08:36.022115 IP 10.0.0.1.54396 > 10.0.0.2.5001: UDP, length 1470
00:08:36.034958 IP 10.0.0.1.54396 > 10.0.0.2.5001: UDP, length 1470
00:08:36.046324 IP 10.0.0.1.54396 > 10.0.0.2.5001: UDP, length 1470
00:08:36.058415 IP 10.0.0.1.54396 > 10.0.0.2.5001: UDP, length 1470
00:08:36.070521 IP 10.0.0.1.54396 > 10.0.0.2.5001: UDP, length 1470
00:08:36.082768 IP 10.0.0.1.54396 > 10.0.0.2.5001: UDP, length 1470
00:08:36.094712 IP 10.0.0.1.54396 > 10.0.0.2.5001: UDP, length 1470
00:08:36.107583 IP 10.0.0.1.54396 > 10.0.0.2.5001: UDP, length 1470
00:08:36.118919 IP 10.0.0.1.54396 > 10.0.0.2.5001: UDP, length 1470
00:08:36.130991 IP 10.0.0.1.54396 > 10.0.0.2.5001: UDP, length 1470
00:08:36.143093 IP 10.0.0.1.54396 > 10.0.0.2.5001: UDP, length 1470
00:08:36.155186 IP 10.0.0.1.54396 > 10.0.0.2.5001: UDP, length 1470
00:08:36.168027 IP 10.0.0.1.54396 > 10.0.0.2.5001: UDP, length 1470
00:08:36.179379 IP 10.0.0.1.54396 > 10.0.0.2.5001: UDP, length 1470
00:08:36.191470 IP 10.0.0.1.54396 > 10.0.0.2.5001: UDP, length 1470
00:08:36.203594 IP 10.0.0.1.54396 > 10.0.0.2.5001: UDP, length 1470
00:08:36.215650 IP 10.0.0.1.54396 > 10.0.0.2.5001: UDP, length 1470
00:08:36.227753 IP 10.0.0.1.54396 > 10.0.0.2.5001: UDP, length 1470
00:08:36.239857 IP 10.0.0.1.54396 > 10.0.0.2.5001: UDP, length 1470
00:08:36.251960 IP 10.0.0.1.54396 > 10.0.0.2.5001: UDP, length 1470
00:08:36.264055 IP 10.0.0.1.54396 > 10.0.0.2.5001: UDP, length 1470
00:08:36.276170 IP 10.0.0.1.54396 > 10.0.0.2.5001: UDP, length 1470
00:08:36.288237 IP 10.0.0.1.54396 > 10.0.0.2.5001: UDP, length 1470
00:08:36.300335 IP 10.0.0.1.54396 > 10.0.0.2.5001: UDP, length 1470
00:08:36.312431 IP 10.0.0.1.54396 > 10.0.0.2.5001: UDP, length 1470
00:08:36.324563 IP 10.0.0.1.54396 > 10.0.0.2.5001: UDP, length 1470
00:08:36.336633 IP 10.0.0.1.54396 > 10.0.0.2.5001: UDP, length 1470
00:08:36.348728 IP 10.0.0.1.54396 > 10.0.0.2.5001: UDP, length 1470
00:08:36.360813 IP 10.0.0.1.54396 > 10.0.0.2.5001: UDP, length 1470
00:08:36.372939 IP 10.0.0.1.54396 > 10.0.0.2.5001: UDP, length 1470
00:08:36.385005 IP 10.0.0.1.54396 > 10.0.0.2.5001: UDP, length 1470
00:08:36.397129 IP 10.0.0.1.54396 > 10.0.0.2.5001: UDP, length 1470
00:08:36.409186 IP 10.0.0.1.54396 > 10.0.0.2.5001: UDP, length 1470
00:08:36.421303 IP 10.0.0.1.54396 > 10.0.0.2.5001: UDP, length 1470
00:08:36.433392 IP 10.0.0.1.54396 > 10.0.0.2.5001: UDP, length 1470
00:08:36.445490 IP 10.0.0.1.54396 > 10.0.0.2.5001: UDP, length 1470
00:08:36.457586 IP 10.0.0.1.54396 > 10.0.0.2.5001: UDP, length 1470
00:08:36.470492 IP 10.0.0.1.54396 > 10.0.0.2.5001: UDP, length 1470
00:08:36.481783 IP 10.0.0.1.54396 > 10.0.0.2.5001: UDP, length 1470
00:08:36.493895 IP 10.0.0.1.54396 > 10.0.0.2.5001: UDP, length 1470
00:08:36.505968 IP 10.0.0.1.54396 > 10.0.0.2.5001: UDP, length 1470
00:08:36.518058 IP 10.0.0.1.54396 > 10.0.0.2.5001: UDP, length 1470
00:08:36.530165 IP 10.0.0.1.54396 > 10.0.0.2.5001: UDP, length 1470
00:08:36.542260 IP 10.0.0.1.54396 > 10.0.0.2.5001: UDP, length 1470
00:08:36.554355 IP 10.0.0.1.54396 > 10.0.0.2.5001: UDP, length 1470
00:08:36.566441 IP 10.0.0.1.54396 > 10.0.0.2.5001: UDP, length 1470
00:08:36.578552 IP 10.0.0.1.54396 > 10.0.0.2.5001: UDP, length 1470
00:08:36.590649 IP 10.0.0.1.54396 > 10.0.0.2.5001: UDP, length 1470
00:08:36.603506 IP 10.0.0.1.54396 > 10.0.0.2.5001: UDP, length 1470
00:08:36.614833 IP 10.0.0.1.54396 > 10.0.0.2.5001: UDP, length 1470
00:08:36.626935 IP 10.0.0.1.54396 > 10.0.0.2.5001: UDP, length 1470
00:08:36.639023 IP 10.0.0.1.54396 > 10.0.0.2.5001: UDP, length 1470
00:08:36.651146 IP 10.0.0.1.54396 > 10.0.0.2.5001: UDP, length 1470
00:08:36.663206 IP 10.0.0.1.54396 > 10.0.0.2.5001: UDP, length 1470
00:08:36.675308 IP 10.0.0.1.54396 > 10.0.0.2.5001: UDP, length 1470
00:08:36.687411 IP 10.0.0.1.54396 > 10.0.0.2.5001: UDP, length 1470
00:08:36.699501 IP 10.0.0.1.54396 > 10.0.0.2.5001: UDP, length 1470
00:08:36.711613 IP 10.0.0.1.54396 > 10.0.0.2.5001: UDP, length 1470
00:08:36.723705 IP 10.0.0.1.54396 > 10.0.0.2.5001: UDP, length 1470
00:08:36.735792 IP 10.0.0.1.54396 > 10.0.0.2.5001: UDP, length 1470
00:08:36.747888 IP 10.0.0.1.54396 > 10.0.0.2.5001: UDP, length 1470
00:08:36.759986 IP 10.0.0.1.54396 > 10.0.0.2.5001: UDP, length 1470
00:08:36.772075 IP 10.0.0.1.54396 > 10.0.0.2.5001: UDP, length 1470
00:08:36.784189 IP 10.0.0.1.54396 > 10.0.0.2.5001: UDP, length 1470
00:08:36.796270 IP 10.0.0.1.54396 > 10.0.0.2.5001: UDP, length 1470
00:08:36.808368 IP 10.0.0.1.54396 > 10.0.0.2.5001: UDP, length 1470
00:08:36.820458 IP 10.0.0.1.54396 > 10.0.0.2.5001: UDP, length 1470
00:08:36.832561 IP 10.0.0.1.54396 > 10.0.0.2.5001: UDP, length 1470
00:08:36.844672 IP 10.0.0.1.54396 > 10.0.0.2.5001: UDP, length 1470
00:08:36.856751 IP 10.0.0.1.54396 > 10.0.0.2.5001: UDP, length 1470
00:08:36.869737 IP 10.0.0.1.54396 > 10.0.0.2.5001: UDP, length 1470
00:08:36.880944 IP 10.0.0.1.54396 > 10.0.0.2.5001: UDP, length 1470
00:08:36.893043 IP 10.0.0.1.54396 > 10.0.0.2.5001: UDP, length 1470
00:08:36.905157 IP 10.0.0.1.54396 > 10.0.0.2.5001: UDP, length 1470
00:08:36.917239 IP 10.0.0.1.54396 > 10.0.0.2.5001: UDP, length 1470
00:08:36.929334 IP 10.0.0.1.54396 > 10.0.0.2.5001: UDP, length 1470
00:08:36.941423 IP 10.0.0.1.54396 > 10.0.0.2.5001: UDP, length 1470
00:08:36.953517 IP 10.0.0.1.54396 > 10.0.0.2.5001: UDP, length 1470
00:08:36.965611 IP 10.0.0.1.54396 > 10.0.0.2.5001: UDP, length 1470
00:08:36.977721 IP 10.0.0.1.54396 > 10.0.0.2.5001: UDP, length 1470
00:08:36.989811 IP 10.0.0.1.54396 > 10.0.0.2.5001: UDP, length 1470
00:08:37.001912 IP 10.0.0.1.54396 > 10.0.0.2.5001: UDP, length 1470
00:08:37.013999 IP 10.0.0.1.54396 > 10.0.0.2.5001: UDP, length 1470
00:08:37.026119 IP 10.0.0.1.54396 > 10.0.0.2.5001: UDP, length 1470
00:08:37.038200 IP 10.0.0.1.54396 > 10.0.0.2.5001: UDP, length 1470
00:08:37.050281 IP 10.0.0.1.54396 > 10.0.0.2.5001: UDP, length 1470
00:08:37.062384 IP 10.0.0.1.54396 > 10.0.0.2.5001: UDP, length 1470
00:08:37.074480 IP 10.0.0.1.54396 > 10.0.0.2.5001: UDP, length 1470
00:08:37.086575 IP 10.0.0.1.54396 > 10.0.0.2.5001: UDP, length 1470
00:08:37.098684 IP 10.0.0.1.54396 > 10.0.0.2.5001: UDP, length 1470
00:08:37.110772 IP 10.0.0.1.54396 > 10.0.0.2.5001: UDP, length 1470
00:08:37.122866 IP 10.0.0.1.54396 > 10.0.0.2.5001: UDP, length 1470
00:08:37.134959 IP 10.0.0.1.54396 > 10.0.0.2.5001: UDP, length 1470
00:08:37.147059 IP 10.0.0.1.54396 > 10.0.0.2.5001: UDP, length 1470
00:08:37.159165 IP 10.0.0.1.54396 > 10.0.0.2.5001: UDP, length 1470
00:08:37.171270 IP 10.0.0.1.54396 > 10.0.0.2.5001: UDP, length 1470
00:08:37.183344 IP 10.0.0.1.54396 > 10.0.0.2.5001: UDP, length 1470
00:08:37.195443 IP 10.0.0.1.54396 > 10.0.0.2.5001: UDP, length 1470
00:08:37.207553 IP 10.0.0.1.54396 > 10.0.0.2.5001: UDP, length 1470
00:08:37.219646 IP 10.0.0.1.54396 > 10.0.0.2.5001: UDP, length 1470
00:08:37.231723 IP 10.0.0.1.54396 > 10.0.0.2.5001: UDP, length 1470
00:08:37.243847 IP 10.0.0.1.54396 > 10.0.0.2.5001: UDP, length 1470
00:08:37.255919 IP 10.0.0.1.54396 > 10.0.0.2.5001: UDP, length 1470
00:08:37.268549 IP 10.0.0.1.54396 > 10.0.0.2.5001: UDP, length 1470
00:08:37.280110 IP 10.0.0.1.54396 > 10.0.0.2.5001: UDP, length 1470
00:08:37.292214 IP 10.0.0.1.54396 > 10.0.0.2.5001: UDP, length 1470
00:08:37.305095 IP 10.0.0.1.54396 > 10.0.0.2.5001: UDP, length 1470
00:08:37.316399 IP 10.0.0.1.54396 > 10.0.0.2.5001: UDP, length 1470
00:08:37.328497 IP 10.0.0.1.54396 > 10.0.0.2.5001: UDP, length 1470
00:08:37.340902 IP 10.0.0.1.54396 > 10.0.0.2.5001: UDP, length 1470
00:08:37.352702 IP 10.0.0.1.54396 > 10.0.0.2.5001: UDP, length 1470
00:08:37.364779 IP 10.0.0.1.54396 > 10.0.0.2.5001: UDP, length 1470
00:08:37.376905 IP 10.0.0.1.54396 > 10.0.0.2.5001: UDP, length 1470
00:08:37.388979 IP 10.0.0.1.54396 > 10.0.0.2.5001: UDP, length 1470
00:08:37.401085 IP 10.0.0.1.54396 > 10.0.0.2.5001: UDP, length 1470
00:08:37.413185 IP 10.0.0.1.54396 > 10.0.0.2.5001: UDP, length 1470
00:08:37.425257 IP 10.0.0.1.54396 > 10.0.0.2.5001: UDP, length 1470
00:08:37.437359 IP 10.0.0.1.54396 > 10.0.0.2.5001: UDP, length 1470
00:08:37.449456 IP 10.0.0.1.54396 > 10.0.0.2.5001: UDP, length 1470
00:08:37.461551 IP 10.0.0.1.54396 > 10.0.0.2.5001: UDP, length 1470
00:08:37.473667 IP 10.0.0.1.54396 > 10.0.0.2.5001: UDP, length 1470
00:08:37.485733 IP 10.0.0.1.54396 > 10.0.0.2.5001: UDP, length 1470
00:08:37.497970 IP 10.0.0.1.54396 > 10.0.0.2.5001: UDP, length 1470
00:08:37.509931 IP 10.0.0.1.54396 > 10.0.0.2.5001: UDP, length 1470
00:08:37.522033 IP 10.0.0.1.54396 > 10.0.0.2.5001: UDP, length 1470
00:08:37.534124 IP 10.0.0.1.54396 > 10.0.0.2.5001: UDP, length 1470
00:08:37.546221 IP 10.0.0.1.54396 > 10.0.0.2.5001: UDP, length 1470
00:08:37.558324 IP 10.0.0.1.54396 > 10.0.0.2.5001: UDP, length 1470
00:08:37.571167 IP 10.0.0.1.54396 > 10.0.0.2.5001: UDP, length 1470
00:08:37.582627 IP 10.0.0.1.54396 > 10.0.0.2.5001: UDP, length 1470
00:08:37.594607 IP 10.0.0.1.54396 > 10.0.0.2.5001: UDP, length 1470
00:08:37.606705 IP 10.0.0.1.54396 > 10.0.0.2.5001: UDP, length 1470
00:08:37.618825 IP 10.0.0.1.54396 > 10.0.0.2.5001: UDP, length 1470
00:08:37.630897 IP 10.0.0.1.54396 > 10.0.0.2.5001: UDP, length 1470
00:08:37.642992 IP 10.0.0.1.54396 > 10.0.0.2.5001: UDP, length 1470
00:08:37.655101 IP 10.0.0.1.54396 > 10.0.0.2.5001: UDP, length 1470
00:08:37.667188 IP 10.0.0.1.54396 > 10.0.0.2.5001: UDP, length 1470
00:08:37.680054 IP 10.0.0.1.54396 > 10.0.0.2.5001: UDP, length 1470
00:08:37.691371 IP 10.0.0.1.54396 > 10.0.0.2.5001: UDP, length 1470
00:08:37.703475 IP 10.0.0.1.54396 > 10.0.0.2.5001: UDP, length 1470
00:08:37.715569 IP 10.0.0.1.54396 > 10.0.0.2.5001: UDP, length 1470
00:08:37.727659 IP 10.0.0.1.54396 > 10.0.0.2.5001: UDP, length 1470
00:08:37.740591 IP 10.0.0.1.54396 > 10.0.0.2.5001: UDP, length 1470
00:08:37.751866 IP 10.0.0.1.54396 > 10.0.0.2.5001: UDP, length 1470
00:08:37.763953 IP 10.0.0.1.54396 > 10.0.0.2.5001: UDP, length 1470
00:08:37.776046 IP 10.0.0.1.54396 > 10.0.0.2.5001: UDP, length 1470
00:08:37.788143 IP 10.0.0.1.54396 > 10.0.0.2.5001: UDP, length 1470
00:08:37.800899 IP 10.0.0.1.54396 > 10.0.0.2.5001: UDP, length 1470
00:08:37.812326 IP 10.0.0.1.54396 > 10.0.0.2.5001: UDP, length 1470
00:08:37.824433 IP 10.0.0.1.54396 > 10.0.0.2.5001: UDP, length 1470
00:08:37.836528 IP 10.0.0.1.54396 > 10.0.0.2.5001: UDP, length 1470
00:08:37.848625 IP 10.0.0.1.54396 > 10.0.0.2.5001: UDP, length 1470
00:08:37.860722 IP 10.0.0.1.54396 > 10.0.0.2.5001: UDP, length 1470
00:08:37.872824 IP 10.0.0.1.54396 > 10.0.0.2.5001: UDP, length 1470
00:08:37.884933 IP 10.0.0.1.54396 > 10.0.0.2.5001: UDP, length 1470
00:08:37.897015 IP 10.0.0.1.54396 > 10.0.0.2.5001: UDP, length 1470
00:08:37.909103 IP 10.0.0.1.54396 > 10.0.0.2.5001: UDP, length 1470
00:08:37.921185 IP 10.0.0.1.54396 > 10.0.0.2.5001: UDP, length 1470
00:08:37.933306 IP 10.0.0.1.54396 > 10.0.0.2.5001: UDP, length 1470
00:08:37.945391 IP 10.0.0.1.54396 > 10.0.0.2.5001: UDP, length 1470
00:08:37.957491 IP 10.0.0.1.54396 > 10.0.0.2.5001: UDP, length 1470
00:08:37.969608 IP 10.0.0.1.54396 > 10.0.0.2.5001: UDP, length 1470
00:08:37.981680 IP 10.0.0.1.54396 > 10.0.0.2.5001: UDP, length 1470
00:08:37.993801 IP 10.0.0.1.54396 > 10.0.0.2.5001: UDP, length 1470
00:08:38.005877 IP 10.0.0.1.54396 > 10.0.0.2.5001: UDP, length 1470
00:08:38.017962 IP 10.0.0.1.54396 > 10.0.0.2.5001: UDP, length 1470
00:08:38.030064 IP 10.0.0.1.54396 > 10.0.0.2.5001: UDP, length 1470
00:08:38.042160 IP 10.0.0.1.54396 > 10.0.0.2.5001: UDP, length 1470
00:08:38.054269 IP 10.0.0.1.54396 > 10.0.0.2.5001: UDP, length 1470
00:08:38.066373 IP 10.0.0.1.54396 > 10.0.0.2.5001: UDP, length 1470
00:08:38.078432 IP 10.0.0.1.54396 > 10.0.0.2.5001: UDP, length 1470
00:08:38.090539 IP 10.0.0.1.54396 > 10.0.0.2.5001: UDP, length 1470
00:08:38.102635 IP 10.0.0.1.54396 > 10.0.0.2.5001: UDP, length 1470
00:08:38.114734 IP 10.0.0.1.54396 > 10.0.0.2.5001: UDP, length 1470
00:08:38.126853 IP 10.0.0.1.54396 > 10.0.0.2.5001: UDP, length 1470
00:08:38.138915 IP 10.0.0.1.54396 > 10.0.0.2.5001: UDP, length 1470
00:08:38.151042 IP 10.0.0.1.54396 > 10.0.0.2.5001: UDP, length 1470
00:08:38.163119 IP 10.0.0.1.54396 > 10.0.0.2.5001: UDP, length 1470
00:08:38.175210 IP 10.0.0.1.54396 > 10.0.0.2.5001: UDP, length 1470
00:08:38.187337 IP 10.0.0.1.54396 > 10.0.0.2.5001: UDP, length 1470
00:08:38.199402 IP 10.0.0.1.54396 > 10.0.0.2.5001: UDP, length 1470
00:08:38.211511 IP 10.0.0.1.54396 > 10.0.0.2.5001: UDP, length 1470
00:08:38.223599 IP 10.0.0.1.54396 > 10.0.0.2.5001: UDP, length 1470
00:08:38.236393 IP 10.0.0.1.54396 > 10.0.0.2.5001: UDP, length 1470
00:08:38.247816 IP 10.0.0.1.54396 > 10.0.0.2.5001: UDP, length 1470
00:08:38.259876 IP 10.0.0.1.54396 > 10.0.0.2.5001: UDP, length 1470
00:08:38.272841 IP 10.0.0.1.54396 > 10.0.0.2.5001: UDP, length 1470
00:08:38.284085 IP 10.0.0.1.54396 > 10.0.0.2.5001: UDP, length 1470
00:08:38.296170 IP 10.0.0.1.54396 > 10.0.0.2.5001: UDP, length 1470
00:08:38.308258 IP 10.0.0.1.54396 > 10.0.0.2.5001: UDP, length 1470
00:08:38.320363 IP 10.0.0.1.54396 > 10.0.0.2.5001: UDP, length 1470
00:08:38.332483 IP 10.0.0.1.54396 > 10.0.0.2.5001: UDP, length 1470
00:08:38.344572 IP 10.0.0.1.54396 > 10.0.0.2.5001: UDP, length 1470
00:08:38.356656 IP 10.0.0.1.54396 > 10.0.0.2.5001: UDP, length 1470
00:08:38.368754 IP 10.0.0.1.54396 > 10.0.0.2.5001: UDP, length 1470
00:08:38.380863 IP 10.0.0.1.54396 > 10.0.0.2.5001: UDP, length 1470
00:08:38.392937 IP 10.0.0.1.54396 > 10.0.0.2.5001: UDP, length 1470
00:08:38.405035 IP 10.0.0.1.54396 > 10.0.0.2.5001: UDP, length 1470
00:08:38.417136 IP 10.0.0.1.54396 > 10.0.0.2.5001: UDP, length 1470
00:08:38.429262 IP 10.0.0.1.54396 > 10.0.0.2.5001: UDP, length 1470
00:08:38.441342 IP 10.0.0.1.54396 > 10.0.0.2.5001: UDP, length 1470
00:08:38.453416 IP 10.0.0.1.54396 > 10.0.0.2.5001: UDP, length 1470
00:08:38.465506 IP 10.0.0.1.54396 > 10.0.0.2.5001: UDP, length 1470
00:08:38.477602 IP 10.0.0.1.54396 > 10.0.0.2.5001: UDP, length 1470
00:08:38.489711 IP 10.0.0.1.54396 > 10.0.0.2.5001: UDP, length 1470
00:08:38.501821 IP 10.0.0.1.54396 > 10.0.0.2.5001: UDP, length 1470
00:08:38.513907 IP 10.0.0.1.54396 > 10.0.0.2.5001: UDP, length 1470
00:08:38.526027 IP 10.0.0.1.54396 > 10.0.0.2.5001: UDP, length 1470
00:08:38.538096 IP 10.0.0.1.54396 > 10.0.0.2.5001: UDP, length 1470
00:08:38.550189 IP 10.0.0.1.54396 > 10.0.0.2.5001: UDP, length 1470
00:08:38.562303 IP 10.0.0.1.54396 > 10.0.0.2.5001: UDP, length 1470
00:08:38.574389 IP 10.0.0.1.54396 > 10.0.0.2.5001: UDP, length 1470
00:08:38.586480 IP 10.0.0.1.54396 > 10.0.0.2.5001: UDP, length 1470
00:08:38.598575 IP 10.0.0.1.54396 > 10.0.0.2.5001: UDP, length 1470
00:08:38.610697 IP 10.0.0.1.54396 > 10.0.0.2.5001: UDP, length 1470
00:08:38.622925 IP 10.0.0.1.54396 > 10.0.0.2.5001: UDP, length 1470
00:08:38.634871 IP 10.0.0.1.54396 > 10.0.0.2.5001: UDP, length 1470
00:08:38.646963 IP 10.0.0.1.54396 > 10.0.0.2.5001: UDP, length 1470
00:08:38.659055 IP 10.0.0.1.54396 > 10.0.0.2.5001: UDP, length 1470
00:08:38.671139 IP 10.0.0.1.54396 > 10.0.0.2.5001: UDP, length 1470
00:08:38.683254 IP 10.0.0.1.54396 > 10.0.0.2.5001: UDP, length 1470
00:08:38.695348 IP 10.0.0.1.54396 > 10.0.0.2.5001: UDP, length 1470
00:08:38.707440 IP 10.0.0.1.54396 > 10.0.0.2.5001: UDP, length 1470
00:08:38.719564 IP 10.0.0.1.54396 > 10.0.0.2.5001: UDP, length 1470
00:08:38.731632 IP 10.0.0.1.54396 > 10.0.0.2.5001: UDP, length 1470
00:08:38.743731 IP 10.0.0.1.54396 > 10.0.0.2.5001: UDP, length 1470
00:08:38.755819 IP 10.0.0.1.54396 > 10.0.0.2.5001: UDP, length 1470
00:08:38.767917 IP 10.0.0.1.54396 > 10.0.0.2.5001: UDP, length 1470
00:08:38.780020 IP 10.0.0.1.54396 > 10.0.0.2.5001: UDP, length 1470
00:08:38.792112 IP 10.0.0.1.54396 > 10.0.0.2.5001: UDP, length 1470
00:08:38.804211 IP 10.0.0.1.54396 > 10.0.0.2.5001: UDP, length 1470
00:08:38.816340 IP 10.0.0.1.54396 > 10.0.0.2.5001: UDP, length 1470
00:08:38.828402 IP 10.0.0.1.54396 > 10.0.0.2.5001: UDP, length 1470
00:08:38.840496 IP 10.0.0.1.54396 > 10.0.0.2.5001: UDP, length 1470
00:08:38.852614 IP 10.0.0.1.54396 > 10.0.0.2.5001: UDP, length 1470
00:08:38.864688 IP 10.0.0.1.54396 > 10.0.0.2.5001: UDP, length 1470
00:08:38.877541 IP 10.0.0.1.54396 > 10.0.0.2.5001: UDP, length 1470
00:08:38.888882 IP 10.0.0.1.54396 > 10.0.0.2.5001: UDP, length 1470
00:08:38.901010 IP 10.0.0.1.54396 > 10.0.0.2.5001: UDP, length 1470
00:08:38.913072 IP 10.0.0.1.54396 > 10.0.0.2.5001: UDP, length 1470
00:08:38.925174 IP 10.0.0.1.54396 > 10.0.0.2.5001: UDP, length 1470
00:08:38.937266 IP 10.0.0.1.54396 > 10.0.0.2.5001: UDP, length 1470
00:08:38.949357 IP 10.0.0.1.54396 > 10.0.0.2.5001: UDP, length 1470
00:08:38.961456 IP 10.0.0.1.54396 > 10.0.0.2.5001: UDP, length 1470
00:08:38.973547 IP 10.0.0.1.54396 > 10.0.0.2.5001: UDP, length 1470
00:08:38.985647 IP 10.0.0.1.54396 > 10.0.0.2.5001: UDP, length 1470
00:08:38.997743 IP 10.0.0.1.54396 > 10.0.0.2.5001: UDP, length 1470
00:08:39.009839 IP 10.0.0.1.54396 > 10.0.0.2.5001: UDP, length 1470
00:08:39.021943 IP 10.0.0.1.54396 > 10.0.0.2.5001: UDP, length 1470
00:08:39.034031 IP 10.0.0.1.54396 > 10.0.0.2.5001: UDP, length 1470
00:08:39.046136 IP 10.0.0.1.54396 > 10.0.0.2.5001: UDP, length 1470
00:08:39.058218 IP 10.0.0.1.54396 > 10.0.0.2.5001: UDP, length 1470
00:08:39.071111 IP 10.0.0.1.54396 > 10.0.0.2.5001: UDP, length 1470
00:08:39.082419 IP 10.0.0.1.54396 > 10.0.0.2.5001: UDP, length 1470
00:08:39.094523 IP 10.0.0.1.54396 > 10.0.0.2.5001: UDP, length 1470
00:08:39.106608 IP 10.0.0.1.54396 > 10.0.0.2.5001: UDP, length 1470
00:08:39.118729 IP 10.0.0.1.54396 > 10.0.0.2.5001: UDP, length 1470
00:08:39.130802 IP 10.0.0.1.54396 > 10.0.0.2.5001: UDP, length 1470
00:08:39.142895 IP 10.0.0.1.54396 > 10.0.0.2.5001: UDP, length 1470
00:08:39.154992 IP 10.0.0.1.54396 > 10.0.0.2.5001: UDP, length 1470
00:08:39.167088 IP 10.0.0.1.54396 > 10.0.0.2.5001: UDP, length 1470
00:08:39.179189 IP 10.0.0.1.54396 > 10.0.0.2.5001: UDP, length 1470
00:08:39.191284 IP 10.0.0.1.54396 > 10.0.0.2.5001: UDP, length 1470
00:08:39.203390 IP 10.0.0.1.54396 > 10.0.0.2.5001: UDP, length 1470
00:08:39.215467 IP 10.0.0.1.54396 > 10.0.0.2.5001: UDP, length 1470
00:08:39.228344 IP 10.0.0.1.54396 > 10.0.0.2.5001: UDP, length 1470
00:08:39.239663 IP 10.0.0.1.54396 > 10.0.0.2.5001: UDP, length 1470
00:08:39.251772 IP 10.0.0.1.54396 > 10.0.0.2.5001: UDP, length 1470
00:08:39.263869 IP 10.0.0.1.54396 > 10.0.0.2.5001: UDP, length 1470
00:08:39.275964 IP 10.0.0.1.54396 > 10.0.0.2.5001: UDP, length 1470
00:08:39.288056 IP 10.0.0.1.54396 > 10.0.0.2.5001: UDP, length 1470
00:08:39.300141 IP 10.0.0.1.54396 > 10.0.0.2.5001: UDP, length 1470
00:08:39.312239 IP 10.0.0.1.54396 > 10.0.0.2.5001: UDP, length 1470
00:08:39.324332 IP 10.0.0.1.54396 > 10.0.0.2.5001: UDP, length 1470
00:08:39.336428 IP 10.0.0.1.54396 > 10.0.0.2.5001: UDP, length 1470
00:08:39.348530 IP 10.0.0.1.54396 > 10.0.0.2.5001: UDP, length 1470
00:08:39.360618 IP 10.0.0.1.54396 > 10.0.0.2.5001: UDP, length 1470
00:08:39.372716 IP 10.0.0.1.54396 > 10.0.0.2.5001: UDP, length 1470
00:08:39.384826 IP 10.0.0.1.54396 > 10.0.0.2.5001: UDP, length 1470
00:08:39.396911 IP 10.0.0.1.54396 > 10.0.0.2.5001: UDP, length 1470
00:08:39.409008 IP 10.0.0.1.54396 > 10.0.0.2.5001: UDP, length 1470
00:08:39.421112 IP 10.0.0.1.54396 > 10.0.0.2.5001: UDP, length 1470
00:08:39.433200 IP 10.0.0.1.54396 > 10.0.0.2.5001: UDP, length 1470
00:08:39.445298 IP 10.0.0.1.54396 > 10.0.0.2.5001: UDP, length 1470
00:08:39.457394 IP 10.0.0.1.54396 > 10.0.0.2.5001: UDP, length 1470
00:08:39.469512 IP 10.0.0.1.54396 > 10.0.0.2.5001: UDP, length 1470
00:08:39.481584 IP 10.0.0.1.54396 > 10.0.0.2.5001: UDP, length 1470
00:08:39.493683 IP 10.0.0.1.54396 > 10.0.0.2.5001: UDP, length 1470
00:08:39.505773 IP 10.0.0.1.54396 > 10.0.0.2.5001: UDP, length 1470
00:08:39.518733 IP 10.0.0.1.54396 > 10.0.0.2.5001: UDP, length 1470
00:08:39.529971 IP 10.0.0.1.54396 > 10.0.0.2.5001: UDP, length 1470
00:08:39.542063 IP 10.0.0.1.54396 > 10.0.0.2.5001: UDP, length 1470
00:08:39.554168 IP 10.0.0.1.54396 > 10.0.0.2.5001: UDP, length 1470
00:08:39.566255 IP 10.0.0.1.54396 > 10.0.0.2.5001: UDP, length 1470
00:08:39.578374 IP 10.0.0.1.54396 > 10.0.0.2.5001: UDP, length 1470
00:08:39.590452 IP 10.0.0.1.54396 > 10.0.0.2.5001: UDP, length 1470
00:08:39.602550 IP 10.0.0.1.54396 > 10.0.0.2.5001: UDP, length 1470
00:08:39.615444 IP 10.0.0.1.54396 > 10.0.0.2.5001: UDP, length 1470
00:08:39.626759 IP 10.0.0.1.54396 > 10.0.0.2.5001: UDP, length 1470
00:08:39.638850 IP 10.0.0.1.54396 > 10.0.0.2.5001: UDP, length 1470
00:08:39.650941 IP 10.0.0.1.54396 > 10.0.0.2.5001: UDP, length 1470
00:08:39.663143 IP 10.0.0.1.54396 > 10.0.0.2.5001: UDP, length 1470
00:08:39.675125 IP 10.0.0.1.54396 > 10.0.0.2.5001: UDP, length 1470
00:08:39.687845 IP 10.0.0.1.54396 > 10.0.0.2.5001: UDP, length 1470
00:08:39.699311 IP 10.0.0.1.54396 > 10.0.0.2.5001: UDP, length 1470
00:08:39.711409 IP 10.0.0.1.54396 > 10.0.0.2.5001: UDP, length 1470
00:08:39.723508 IP 10.0.0.1.54396 > 10.0.0.2.5001: UDP, length 1470
00:08:39.735600 IP 10.0.0.1.54396 > 10.0.0.2.5001: UDP, length 1470
00:08:39.747700 IP 10.0.0.1.54396 > 10.0.0.2.5001: UDP, length 1470
00:08:39.759791 IP 10.0.0.1.54396 > 10.0.0.2.5001: UDP, length 1470
00:08:39.771912 IP 10.0.0.1.54396 > 10.0.0.2.5001: UDP, length 1470
00:08:39.783993 IP 10.0.0.1.54396 > 10.0.0.2.5001: UDP, length 1470
00:08:39.796065 IP 10.0.0.1.54396 > 10.0.0.2.5001: UDP, length 1470
00:08:39.808175 IP 10.0.0.1.54396 > 10.0.0.2.5001: UDP, length 1470
00:08:39.820290 IP 10.0.0.1.54396 > 10.0.0.2.5001: UDP, length 1470
00:08:39.832370 IP 10.0.0.1.54396 > 10.0.0.2.5001: UDP, length 1470
00:08:39.844478 IP 10.0.0.1.54396 > 10.0.0.2.5001: UDP, length 1470
00:08:39.856555 IP 10.0.0.1.54396 > 10.0.0.2.5001: UDP, length 1470
00:08:39.868686 IP 10.0.0.1.54396 > 10.0.0.2.5001: UDP, length 1470
00:08:39.880753 IP 10.0.0.1.54396 > 10.0.0.2.5001: UDP, length 1470
00:08:39.892870 IP 10.0.0.1.54396 > 10.0.0.2.5001: UDP, length 1470
00:08:39.904949 IP 10.0.0.1.54396 > 10.0.0.2.5001: UDP, length 1470
00:08:39.917043 IP 10.0.0.1.54396 > 10.0.0.2.5001: UDP, length 1470
00:08:39.929136 IP 10.0.0.1.54396 > 10.0.0.2.5001: UDP, length 1470
00:08:39.941434 IP 10.0.0.1.54396 > 10.0.0.2.5001: UDP, length 1470
00:08:39.953314 IP 10.0.0.1.54396 > 10.0.0.2.5001: UDP, length 1470
00:08:39.965682 IP 10.0.0.1.54396 > 10.0.0.2.5001: UDP, length 1470
00:08:39.978386 IP 10.0.0.1.54396 > 10.0.0.2.5001: UDP, length 1470
00:08:39.989617 IP 10.0.0.1.54396 > 10.0.0.2.5001: UDP, length 1470
00:08:40.002495 IP 10.0.0.1.54396 > 10.0.0.2.5001: UDP, length 1470
00:08:40.013812 IP 10.0.0.1.54396 > 10.0.0.2.5001: UDP, length 1470
00:08:40.025933 IP 10.0.0.1.54396 > 10.0.0.2.5001: UDP, length 1470
00:08:40.037991 IP 10.0.0.1.54396 > 10.0.0.2.5001: UDP, length 1470
00:08:40.050589 IP 10.0.0.1.54396 > 10.0.0.2.5001: UDP, length 1470
00:08:40.062198 IP 10.0.0.1.54396 > 10.0.0.2.5001: UDP, length 1470
00:08:40.074287 IP 10.0.0.1.54396 > 10.0.0.2.5001: UDP, length 1470
00:08:40.086387 IP 10.0.0.1.54396 > 10.0.0.2.5001: UDP, length 1470
00:08:40.098494 IP 10.0.0.1.54396 > 10.0.0.2.5001: UDP, length 1470
00:08:40.110599 IP 10.0.0.1.54396 > 10.0.0.2.5001: UDP, length 1470
00:08:40.122676 IP 10.0.0.1.54396 > 10.0.0.2.5001: UDP, length 1470
00:08:40.134768 IP 10.0.0.1.54396 > 10.0.0.2.5001: UDP, length 1470
00:08:40.146877 IP 10.0.0.1.54396 > 10.0.0.2.5001: UDP, length 1470
00:08:40.158967 IP 10.0.0.1.54396 > 10.0.0.2.5001: UDP, length 1470
00:08:40.171042 IP 10.0.0.1.54396 > 10.0.0.2.5001: UDP, length 1470
00:08:40.183154 IP 10.0.0.1.54396 > 10.0.0.2.5001: UDP, length 1470
00:08:40.195253 IP 10.0.0.1.54396 > 10.0.0.2.5001: UDP, length 1470
00:08:40.207346 IP 10.0.0.1.54396 > 10.0.0.2.5001: UDP, length 1470
00:08:40.219463 IP 10.0.0.1.54396 > 10.0.0.2.5001: UDP, length 1470
00:08:40.231523 IP 10.0.0.1.54396 > 10.0.0.2.5001: UDP, length 1470
00:08:40.243659 IP 10.0.0.1.54396 > 10.0.0.2.5001: UDP, length 1470
00:08:40.255727 IP 10.0.0.1.54396 > 10.0.0.2.5001: UDP, length 1470
00:08:40.288632 IP 10.0.0.1.54396 > 10.0.0.2.5001: UDP, length 1470
00:08:40.288719 IP 10.0.0.1.54396 > 10.0.0.2.5001: UDP, length 1470
00:08:40.300040 IP 10.0.0.1.54396 > 10.0.0.2.5001: UDP, length 1470
00:08:40.312130 IP 10.0.0.1.54396 > 10.0.0.2.5001: UDP, length 1470
00:08:40.324225 IP 10.0.0.1.54396 > 10.0.0.2.5001: UDP, length 1470
00:08:40.336330 IP 10.0.0.1.54396 > 10.0.0.2.5001: UDP, length 1470
00:08:40.348416 IP 10.0.0.1.54396 > 10.0.0.2.5001: UDP, length 1470
00:08:40.360518 IP 10.0.0.1.54396 > 10.0.0.2.5001: UDP, length 1470
00:08:40.372607 IP 10.0.0.1.54396 > 10.0.0.2.5001: UDP, length 1470
00:08:40.384717 IP 10.0.0.1.54396 > 10.0.0.2.5001: UDP, length 1470
00:08:40.396815 IP 10.0.0.1.54396 > 10.0.0.2.5001: UDP, length 1470
00:08:40.408911 IP 10.0.0.1.54396 > 10.0.0.2.5001: UDP, length 1470
00:08:40.421000 IP 10.0.0.1.54396 > 10.0.0.2.5001: UDP, length 1470
00:08:40.433091 IP 10.0.0.1.54396 > 10.0.0.2.5001: UDP, length 1470
00:08:40.445188 IP 10.0.0.1.54396 > 10.0.0.2.5001: UDP, length 1470
00:08:40.457278 IP 10.0.0.1.54396 > 10.0.0.2.5001: UDP, length 1470
00:08:40.469379 IP 10.0.0.1.54396 > 10.0.0.2.5001: UDP, length 1470
00:08:40.481472 IP 10.0.0.1.54396 > 10.0.0.2.5001: UDP, length 1470
00:08:40.493567 IP 10.0.0.1.54396 > 10.0.0.2.5001: UDP, length 1470
00:08:40.505653 IP 10.0.0.1.54396 > 10.0.0.2.5001: UDP, length 1470
00:08:40.517760 IP 10.0.0.1.54396 > 10.0.0.2.5001: UDP, length 1470
00:08:40.529856 IP 10.0.0.1.54396 > 10.0.0.2.5001: UDP, length 1470
00:08:40.541950 IP 10.0.0.1.54396 > 10.0.0.2.5001: UDP, length 1470
00:08:40.554048 IP 10.0.0.1.54396 > 10.0.0.2.5001: UDP, length 1470
00:08:40.566146 IP 10.0.0.1.54396 > 10.0.0.2.5001: UDP, length 1470
00:08:40.578246 IP 10.0.0.1.54396 > 10.0.0.2.5001: UDP, length 1470
00:08:40.590349 IP 10.0.0.1.54396 > 10.0.0.2.5001: UDP, length 1470
00:08:40.602439 IP 10.0.0.1.54396 > 10.0.0.2.5001: UDP, length 1470
00:08:40.614539 IP 10.0.0.1.54396 > 10.0.0.2.5001: UDP, length 1470
00:08:40.626626 IP 10.0.0.1.54396 > 10.0.0.2.5001: UDP, length 1470
00:08:40.638722 IP 10.0.0.1.54396 > 10.0.0.2.5001: UDP, length 1470
00:08:40.650825 IP 10.0.0.1.54396 > 10.0.0.2.5001: UDP, length 1470
00:08:40.662926 IP 10.0.0.1.54396 > 10.0.0.2.5001: UDP, length 1470
00:08:40.675013 IP 10.0.0.1.54396 > 10.0.0.2.5001: UDP, length 1470
00:08:40.687112 IP 10.0.0.1.54396 > 10.0.0.2.5001: UDP, length 1470
00:08:40.699221 IP 10.0.0.1.54396 > 10.0.0.2.5001: UDP, length 1470
00:08:40.711311 IP 10.0.0.1.54396 > 10.0.0.2.5001: UDP, length 1470
00:08:40.723405 IP 10.0.0.1.54396 > 10.0.0.2.5001: UDP, length 1470
00:08:40.735499 IP 10.0.0.1.54396 > 10.0.0.2.5001: UDP, length 1470
00:08:40.747596 IP 10.0.0.1.54396 > 10.0.0.2.5001: UDP, length 1470
00:08:40.759707 IP 10.0.0.1.54396 > 10.0.0.2.5001: UDP, length 1470
00:08:40.771790 IP 10.0.0.1.54396 > 10.0.0.2.5001: UDP, length 1470
00:08:40.783884 IP 10.0.0.1.54396 > 10.0.0.2.5001: UDP, length 1470
00:08:40.795977 IP 10.0.0.1.54396 > 10.0.0.2.5001: UDP, length 1470
00:08:40.808076 IP 10.0.0.1.54396 > 10.0.0.2.5001: UDP, length 1470
00:08:40.820186 IP 10.0.0.1.54396 > 10.0.0.2.5001: UDP, length 1470
00:08:40.832264 IP 10.0.0.1.54396 > 10.0.0.2.5001: UDP, length 1470
00:08:40.844355 IP 10.0.0.1.54396 > 10.0.0.2.5001: UDP, length 1470
00:08:40.856478 IP 10.0.0.1.54396 > 10.0.0.2.5001: UDP, length 1470
00:08:40.868559 IP 10.0.0.1.54396 > 10.0.0.2.5001: UDP, length 1470
00:08:40.880659 IP 10.0.0.1.54396 > 10.0.0.2.5001: UDP, length 1470
00:08:40.893915 IP 10.0.0.1.54396 > 10.0.0.2.5001: UDP, length 1470
00:08:40.904841 IP 10.0.0.1.54396 > 10.0.0.2.5001: UDP, length 1470
00:08:40.916933 IP 10.0.0.1.54396 > 10.0.0.2.5001: UDP, length 1470
00:08:40.929038 IP 10.0.0.1.54396 > 10.0.0.2.5001: UDP, length 1470
00:08:40.941125 IP 10.0.0.1.54396 > 10.0.0.2.5001: UDP, length 1470
00:08:40.953218 IP 10.0.0.1.54396 > 10.0.0.2.5001: UDP, length 1470
00:08:40.966137 IP 10.0.0.1.54396 > 10.0.0.2.5001: UDP, length 1470
00:08:40.977411 IP 10.0.0.1.54396 > 10.0.0.2.5001: UDP, length 1470
00:08:40.989511 IP 10.0.0.1.54396 > 10.0.0.2.5001: UDP, length 1470
00:08:41.001596 IP 10.0.0.1.54396 > 10.0.0.2.5001: UDP, length 1470
00:08:41.013699 IP 10.0.0.1.54396 > 10.0.0.2.5001: UDP, length 1470
00:08:41.028890 IP 10.0.0.1.54396 > 10.0.0.2.5001: UDP, length 1470
00:08:41.037891 IP 10.0.0.1.54396 > 10.0.0.2.5001: UDP, length 1470
00:08:41.049986 IP 10.0.0.1.54396 > 10.0.0.2.5001: UDP, length 1470
00:08:41.062252 IP 10.0.0.1.54396 > 10.0.0.2.5001: UDP, length 1470
00:08:41.074176 IP 10.0.0.1.54396 > 10.0.0.2.5001: UDP, length 1470
00:08:41.086274 IP 10.0.0.1.54396 > 10.0.0.2.5001: UDP, length 1470
00:08:41.098417 IP 10.0.0.1.54396 > 10.0.0.2.5001: UDP, length 1470
00:08:41.110474 IP 10.0.0.1.54396 > 10.0.0.2.5001: UDP, length 1470
00:08:41.122561 IP 10.0.0.1.54396 > 10.0.0.2.5001: UDP, length 1470
00:08:41.134671 IP 10.0.0.1.54396 > 10.0.0.2.5001: UDP, length 1470
00:08:41.146757 IP 10.0.0.1.54396 > 10.0.0.2.5001: UDP, length 1470
00:08:41.158847 IP 10.0.0.1.54396 > 10.0.0.2.5001: UDP, length 1470
00:08:41.170949 IP 10.0.0.1.54396 > 10.0.0.2.5001: UDP, length 1470
00:08:41.183055 IP 10.0.0.1.54396 > 10.0.0.2.5001: UDP, length 1470
00:08:41.195198 IP 10.0.0.1.54396 > 10.0.0.2.5001: UDP, length 1470
00:08:41.207251 IP 10.0.0.1.54396 > 10.0.0.2.5001: UDP, length 1470
00:08:41.219355 IP 10.0.0.1.54396 > 10.0.0.2.5001: UDP, length 1470
00:08:41.231436 IP 10.0.0.1.54396 > 10.0.0.2.5001: UDP, length 1470
00:08:41.243528 IP 10.0.0.1.54396 > 10.0.0.2.5001: UDP, length 1470
00:08:41.255623 IP 10.0.0.1.54396 > 10.0.0.2.5001: UDP, length 1470
00:08:41.267717 IP 10.0.0.1.54396 > 10.0.0.2.5001: UDP, length 1470
00:08:41.279823 IP 10.0.0.1.54396 > 10.0.0.2.5001: UDP, length 1470
00:08:41.291909 IP 10.0.0.1.54396 > 10.0.0.2.5001: UDP, length 1470
00:08:41.304002 IP 10.0.0.1.54396 > 10.0.0.2.5001: UDP, length 1470
00:08:41.316857 IP 10.0.0.1.54396 > 10.0.0.2.5001: UDP, length 1470
00:08:41.328202 IP 10.0.0.1.54396 > 10.0.0.2.5001: UDP, length 1470
00:08:41.340306 IP 10.0.0.1.54396 > 10.0.0.2.5001: UDP, length 1470
00:08:41.352398 IP 10.0.0.1.54396 > 10.0.0.2.5001: UDP, length 1470
00:08:41.364491 IP 10.0.0.1.54396 > 10.0.0.2.5001: UDP, length 1470
00:08:41.377336 IP 10.0.0.1.54396 > 10.0.0.2.5001: UDP, length 1470
00:08:41.388676 IP 10.0.0.1.54396 > 10.0.0.2.5001: UDP, length 1470
00:08:41.400773 IP 10.0.0.1.54396 > 10.0.0.2.5001: UDP, length 1470
00:08:41.416920 IP 10.0.0.1.54396 > 10.0.0.2.5001: UDP, length 1470
00:08:41.424962 IP 10.0.0.1.54396 > 10.0.0.2.5001: UDP, length 1470
00:08:41.440084 IP 10.0.0.1.54396 > 10.0.0.2.5001: UDP, length 1470
00:08:41.449159 IP 10.0.0.1.54396 > 10.0.0.2.5001: UDP, length 1470
00:08:41.461253 IP 10.0.0.1.54396 > 10.0.0.2.5001: UDP, length 1470
00:08:41.473349 IP 10.0.0.1.54396 > 10.0.0.2.5001: UDP, length 1470
00:08:41.486220 IP 10.0.0.1.54396 > 10.0.0.2.5001: UDP, length 1470
00:08:41.497548 IP 10.0.0.1.54396 > 10.0.0.2.5001: UDP, length 1470
00:08:41.509642 IP 10.0.0.1.54396 > 10.0.0.2.5001: UDP, length 1470
00:08:41.521755 IP 10.0.0.1.54396 > 10.0.0.2.5001: UDP, length 1470
00:08:41.533831 IP 10.0.0.1.54396 > 10.0.0.2.5001: UDP, length 1470
00:08:41.545919 IP 10.0.0.1.54396 > 10.0.0.2.5001: UDP, length 1470
00:08:41.558028 IP 10.0.0.1.54396 > 10.0.0.2.5001: UDP, length 1470
00:08:41.570124 IP 10.0.0.1.54396 > 10.0.0.2.5001: UDP, length 1470
00:08:41.582214 IP 10.0.0.1.54396 > 10.0.0.2.5001: UDP, length 1470
00:08:41.594306 IP 10.0.0.1.54396 > 10.0.0.2.5001: UDP, length 1470
00:08:41.606409 IP 10.0.0.1.54396 > 10.0.0.2.5001: UDP, length 1470
00:08:41.618498 IP 10.0.0.1.54396 > 10.0.0.2.5001: UDP, length 1470
00:08:41.630597 IP 10.0.0.1.54396 > 10.0.0.2.5001: UDP, length 1470
00:08:41.642702 IP 10.0.0.1.54396 > 10.0.0.2.5001: UDP, length 1470
00:08:41.654809 IP 10.0.0.1.54396 > 10.0.0.2.5001: UDP, length 1470
00:08:41.666883 IP 10.0.0.1.54396 > 10.0.0.2.5001: UDP, length 1470
00:08:41.678977 IP 10.0.0.1.54396 > 10.0.0.2.5001: UDP, length 1470
00:08:41.691089 IP 10.0.0.1.54396 > 10.0.0.2.5001: UDP, length 1470
00:08:41.703175 IP 10.0.0.1.54396 > 10.0.0.2.5001: UDP, length 1470
00:08:41.715265 IP 10.0.0.1.54396 > 10.0.0.2.5001: UDP, length 1470
00:08:41.727362 IP 10.0.0.1.54396 > 10.0.0.2.5001: UDP, length 1470
00:08:41.739455 IP 10.0.0.1.54396 > 10.0.0.2.5001: UDP, length 1470
00:08:41.751558 IP 10.0.0.1.54396 > 10.0.0.2.5001: UDP, length 1470
00:08:41.763651 IP 10.0.0.1.54396 > 10.0.0.2.5001: UDP, length 1470
00:08:41.775755 IP 10.0.0.1.54396 > 10.0.0.2.5001: UDP, length 1470
00:08:41.787850 IP 10.0.0.1.54396 > 10.0.0.2.5001: UDP, length 1470
00:08:41.799940 IP 10.0.0.1.54396 > 10.0.0.2.5001: UDP, length 1470
00:08:41.812037 IP 10.0.0.1.54396 > 10.0.0.2.5001: UDP, length 1470
00:08:41.824872 IP 10.0.0.1.54396 > 10.0.0.2.5001: UDP, length 1470
00:08:41.836216 IP 10.0.0.1.54396 > 10.0.0.2.5001: UDP, length 1470
00:08:41.848319 IP 10.0.0.1.54396 > 10.0.0.2.5001: UDP, length 1470
00:08:41.860427 IP 10.0.0.1.54396 > 10.0.0.2.5001: UDP, length 1470
00:08:41.872515 IP 10.0.0.1.54396 > 10.0.0.2.5001: UDP, length 1470
00:08:41.884619 IP 10.0.0.1.54396 > 10.0.0.2.5001: UDP, length 1470
00:08:41.896705 IP 10.0.0.1.54396 > 10.0.0.2.5001: UDP, length 1470
00:08:41.909653 IP 10.0.0.1.54396 > 10.0.0.2.5001: UDP, length 1470
00:08:41.920896 IP 10.0.0.1.54396 > 10.0.0.2.5001: UDP, length 1470
00:08:41.932997 IP 10.0.0.1.54396 > 10.0.0.2.5001: UDP, length 1470
00:08:41.945091 IP 10.0.0.1.54396 > 10.0.0.2.5001: UDP, length 1470
00:08:41.957188 IP 10.0.0.1.54396 > 10.0.0.2.5001: UDP, length 1470
00:08:41.969285 IP 10.0.0.1.54396 > 10.0.0.2.5001: UDP, length 1470
00:08:41.981469 IP 10.0.0.1.54396 > 10.0.0.2.5001: UDP, length 1470
00:08:41.993485 IP 10.0.0.1.54396 > 10.0.0.2.5001: UDP, length 1470
00:08:42.005573 IP 10.0.0.1.54396 > 10.0.0.2.5001: UDP, length 1470
00:08:42.017679 IP 10.0.0.1.54396 > 10.0.0.2.5001: UDP, length 1470
00:08:42.029772 IP 10.0.0.1.54396 > 10.0.0.2.5001: UDP, length 1470
00:08:42.041859 IP 10.0.0.1.54396 > 10.0.0.2.5001: UDP, length 1470
00:08:42.053951 IP 10.0.0.1.54396 > 10.0.0.2.5001: UDP, length 1470
00:08:42.066051 IP 10.0.0.1.54396 > 10.0.0.2.5001: UDP, length 1470
00:08:42.078153 IP 10.0.0.1.54396 > 10.0.0.2.5001: UDP, length 1470
00:08:42.090258 IP 10.0.0.1.54396 > 10.0.0.2.5001: UDP, length 1470
00:08:42.102342 IP 10.0.0.1.54396 > 10.0.0.2.5001: UDP, length 1470
00:08:42.114438 IP 10.0.0.1.54396 > 10.0.0.2.5001: UDP, length 1470
00:08:42.126555 IP 10.0.0.1.54396 > 10.0.0.2.5001: UDP, length 1470
00:08:42.138727 IP 10.0.0.1.54396 > 10.0.0.2.5001: UDP, length 1470
00:08:42.150730 IP 10.0.0.1.54396 > 10.0.0.2.5001: UDP, length 1470
00:08:42.162835 IP 10.0.0.1.54396 > 10.0.0.2.5001: UDP, length 1470
00:08:42.174921 IP 10.0.0.1.54396 > 10.0.0.2.5001: UDP, length 1470
00:08:42.187019 IP 10.0.0.1.54396 > 10.0.0.2.5001: UDP, length 1470
00:08:42.199118 IP 10.0.0.1.54396 > 10.0.0.2.5001: UDP, length 1470
00:08:42.211211 IP 10.0.0.1.54396 > 10.0.0.2.5001: UDP, length 1470
00:08:42.223310 IP 10.0.0.1.54396 > 10.0.0.2.5001: UDP, length 1470
00:08:42.235421 IP 10.0.0.1.54396 > 10.0.0.2.5001: UDP, length 1470
00:08:42.247490 IP 10.0.0.1.54396 > 10.0.0.2.5001: UDP, length 1470
00:08:42.259591 IP 10.0.0.1.54396 > 10.0.0.2.5001: UDP, length 1470
00:08:42.271867 IP 10.0.0.1.54396 > 10.0.0.2.5001: UDP, length 1470
00:08:42.283781 IP 10.0.0.1.54396 > 10.0.0.2.5001: UDP, length 1470
00:08:42.295890 IP 10.0.0.1.54396 > 10.0.0.2.5001: UDP, length 1470
00:08:42.307974 IP 10.0.0.1.54396 > 10.0.0.2.5001: UDP, length 1470
00:08:42.320070 IP 10.0.0.1.54396 > 10.0.0.2.5001: UDP, length 1470
00:08:42.332175 IP 10.0.0.1.54396 > 10.0.0.2.5001: UDP, length 1470
00:08:42.344285 IP 10.0.0.1.54396 > 10.0.0.2.5001: UDP, length 1470
00:08:42.356371 IP 10.0.0.1.54396 > 10.0.0.2.5001: UDP, length 1470
00:08:42.368456 IP 10.0.0.1.54396 > 10.0.0.2.5001: UDP, length 1470
00:08:42.380549 IP 10.0.0.1.54396 > 10.0.0.2.5001: UDP, length 1470
00:08:42.392646 IP 10.0.0.1.54396 > 10.0.0.2.5001: UDP, length 1470
00:08:42.404748 IP 10.0.0.1.54396 > 10.0.0.2.5001: UDP, length 1470
00:08:42.416841 IP 10.0.0.1.54396 > 10.0.0.2.5001: UDP, length 1470
00:08:42.428944 IP 10.0.0.1.54396 > 10.0.0.2.5001: UDP, length 1470
00:08:42.441035 IP 10.0.0.1.54396 > 10.0.0.2.5001: UDP, length 1470
00:08:42.453144 IP 10.0.0.1.54396 > 10.0.0.2.5001: UDP, length 1470
00:08:42.465225 IP 10.0.0.1.54396 > 10.0.0.2.5001: UDP, length 1470
00:08:42.477354 IP 10.0.0.1.54396 > 10.0.0.2.5001: UDP, length 1470
00:08:42.489420 IP 10.0.0.1.54396 > 10.0.0.2.5001: UDP, length 1470
00:08:42.501540 IP 10.0.0.1.54396 > 10.0.0.2.5001: UDP, length 1470
00:08:42.513615 IP 10.0.0.1.54396 > 10.0.0.2.5001: UDP, length 1470
00:08:42.525697 IP 10.0.0.1.54396 > 10.0.0.2.5001: UDP, length 1470
00:08:42.537793 IP 10.0.0.1.54396 > 10.0.0.2.5001: UDP, length 1470
00:08:42.549905 IP 10.0.0.1.54396 > 10.0.0.2.5001: UDP, length 1470
00:08:42.561981 IP 10.0.0.1.54396 > 10.0.0.2.5001: UDP, length 1470
00:08:42.574078 IP 10.0.0.1.54396 > 10.0.0.2.5001: UDP, length 1470
00:08:42.586176 IP 10.0.0.1.54396 > 10.0.0.2.5001: UDP, length 1470
00:08:42.598305 IP 10.0.0.1.54396 > 10.0.0.2.5001: UDP, length 1470
00:08:42.610373 IP 10.0.0.1.54396 > 10.0.0.2.5001: UDP, length 1470
00:08:42.623219 IP 10.0.0.1.54396 > 10.0.0.2.5001: UDP, length 1470
00:08:42.634571 IP 10.0.0.1.54396 > 10.0.0.2.5001: UDP, length 1470
00:08:42.646671 IP 10.0.0.1.54396 > 10.0.0.2.5001: UDP, length 1470
00:08:42.658772 IP 10.0.0.1.54396 > 10.0.0.2.5001: UDP, length 1470
00:08:42.670865 IP 10.0.0.1.54396 > 10.0.0.2.5001: UDP, length 1470
00:08:42.683834 IP 10.0.0.1.54396 > 10.0.0.2.5001: UDP, length 1470
00:08:42.695053 IP 10.0.0.1.54396 > 10.0.0.2.5001: UDP, length 1470
00:08:42.707147 IP 10.0.0.1.54396 > 10.0.0.2.5001: UDP, length 1470
00:08:42.720012 IP 10.0.0.1.54396 > 10.0.0.2.5001: UDP, length 1470
00:08:42.731360 IP 10.0.0.1.54396 > 10.0.0.2.5001: UDP, length 1470
00:08:42.743443 IP 10.0.0.1.54396 > 10.0.0.2.5001: UDP, length 1470
00:08:42.756367 IP 10.0.0.1.54396 > 10.0.0.2.5001: UDP, length 1470
00:08:42.767617 IP 10.0.0.1.54396 > 10.0.0.2.5001: UDP, length 1470
00:08:42.779712 IP 10.0.0.1.54396 > 10.0.0.2.5001: UDP, length 1470
00:08:42.791808 IP 10.0.0.1.54396 > 10.0.0.2.5001: UDP, length 1470
00:08:42.803905 IP 10.0.0.1.54396 > 10.0.0.2.5001: UDP, length 1470
00:08:42.816000 IP 10.0.0.1.54396 > 10.0.0.2.5001: UDP, length 1470
00:08:42.828099 IP 10.0.0.1.54396 > 10.0.0.2.5001: UDP, length 1470
00:08:42.840209 IP 10.0.0.1.54396 > 10.0.0.2.5001: UDP, length 1470
00:08:42.852322 IP 10.0.0.1.54396 > 10.0.0.2.5001: UDP, length 1470
00:08:42.864386 IP 10.0.0.1.54396 > 10.0.0.2.5001: UDP, length 1470
00:08:42.876483 IP 10.0.0.1.54396 > 10.0.0.2.5001: UDP, length 1470
00:08:42.888587 IP 10.0.0.1.54396 > 10.0.0.2.5001: UDP, length 1470
00:08:42.900675 IP 10.0.0.1.54396 > 10.0.0.2.5001: UDP, length 1470
00:08:42.913422 IP 10.0.0.1.54396 > 10.0.0.2.5001: UDP, length 1470
00:08:42.924877 IP 10.0.0.1.54396 > 10.0.0.2.5001: UDP, length 1470
00:08:42.936981 IP 10.0.0.1.54396 > 10.0.0.2.5001: UDP, length 1470
00:08:42.949067 IP 10.0.0.1.54396 > 10.0.0.2.5001: UDP, length 1470
00:08:42.961162 IP 10.0.0.1.54396 > 10.0.0.2.5001: UDP, length 1470
00:08:42.973258 IP 10.0.0.1.54396 > 10.0.0.2.5001: UDP, length 1470
00:08:42.985356 IP 10.0.0.1.54396 > 10.0.0.2.5001: UDP, length 1470
00:08:42.997454 IP 10.0.0.1.54396 > 10.0.0.2.5001: UDP, length 1470
00:08:43.009550 IP 10.0.0.1.54396 > 10.0.0.2.5001: UDP, length 1470
00:08:43.021646 IP 10.0.0.1.54396 > 10.0.0.2.5001: UDP, length 1470
00:08:43.033738 IP 10.0.0.1.54396 > 10.0.0.2.5001: UDP, length 1470
00:08:43.045837 IP 10.0.0.1.54396 > 10.0.0.2.5001: UDP, length 1470
00:08:43.057932 IP 10.0.0.1.54396 > 10.0.0.2.5001: UDP, length 1470
00:08:43.070031 IP 10.0.0.1.54396 > 10.0.0.2.5001: UDP, length 1470
00:08:43.082124 IP 10.0.0.1.54396 > 10.0.0.2.5001: UDP, length 1470
00:08:43.094234 IP 10.0.0.1.54396 > 10.0.0.2.5001: UDP, length 1470
00:08:43.106315 IP 10.0.0.1.54396 > 10.0.0.2.5001: UDP, length 1470
00:08:43.118413 IP 10.0.0.1.54396 > 10.0.0.2.5001: UDP, length 1470
00:08:43.130493 IP 10.0.0.1.54396 > 10.0.0.2.5001: UDP, length 1470
00:08:43.143407 IP 10.0.0.1.54396 > 10.0.0.2.5001: UDP, length 1470
00:08:43.154700 IP 10.0.0.1.54396 > 10.0.0.2.5001: UDP, length 1470
00:08:43.166794 IP 10.0.0.1.54396 > 10.0.0.2.5001: UDP, length 1470
00:08:43.178895 IP 10.0.0.1.54396 > 10.0.0.2.5001: UDP, length 1470
00:08:43.190995 IP 10.0.0.1.54396 > 10.0.0.2.5001: UDP, length 1470
00:08:43.203069 IP 10.0.0.1.54396 > 10.0.0.2.5001: UDP, length 1470
00:08:43.215867 IP 10.0.0.1.54396 > 10.0.0.2.5001: UDP, length 1470
00:08:43.227282 IP 10.0.0.1.54396 > 10.0.0.2.5001: UDP, length 1470
00:08:43.239376 IP 10.0.0.1.54396 > 10.0.0.2.5001: UDP, length 1470
00:08:43.251485 IP 10.0.0.1.54396 > 10.0.0.2.5001: UDP, length 1470
00:08:43.263550 IP 10.0.0.1.54396 > 10.0.0.2.5001: UDP, length 1470
00:08:43.275654 IP 10.0.0.1.54396 > 10.0.0.2.5001: UDP, length 1470
00:08:43.287756 IP 10.0.0.1.54396 > 10.0.0.2.5001: UDP, length 1470
00:08:43.299856 IP 10.0.0.1.54396 > 10.0.0.2.5001: UDP, length 1470
00:08:43.311974 IP 10.0.0.1.54396 > 10.0.0.2.5001: UDP, length 1470
00:08:43.324053 IP 10.0.0.1.54396 > 10.0.0.2.5001: UDP, length 1470
00:08:43.336143 IP 10.0.0.1.54396 > 10.0.0.2.5001: UDP, length 1470
00:08:43.348236 IP 10.0.0.1.54396 > 10.0.0.2.5001: UDP, length 1470
00:08:43.360331 IP 10.0.0.1.54396 > 10.0.0.2.5001: UDP, length 1470
00:08:43.372428 IP 10.0.0.1.54396 > 10.0.0.2.5001: UDP, length 1470
00:08:43.384551 IP 10.0.0.1.54396 > 10.0.0.2.5001: UDP, length 1470
00:08:43.396611 IP 10.0.0.1.54396 > 10.0.0.2.5001: UDP, length 1470
00:08:43.408718 IP 10.0.0.1.54396 > 10.0.0.2.5001: UDP, length 1470
00:08:43.420822 IP 10.0.0.1.54396 > 10.0.0.2.5001: UDP, length 1470
00:08:43.432908 IP 10.0.0.1.54396 > 10.0.0.2.5001: UDP, length 1470
00:08:43.445010 IP 10.0.0.1.54396 > 10.0.0.2.5001: UDP, length 1470
00:08:43.457108 IP 10.0.0.1.54396 > 10.0.0.2.5001: UDP, length 1470
00:08:43.469978 IP 10.0.0.1.54396 > 10.0.0.2.5001: UDP, length 1470
00:08:43.481291 IP 10.0.0.1.54396 > 10.0.0.2.5001: UDP, length 1470
00:08:43.493392 IP 10.0.0.1.54396 > 10.0.0.2.5001: UDP, length 1470
00:08:43.505482 IP 10.0.0.1.54396 > 10.0.0.2.5001: UDP, length 1470
00:08:43.517627 IP 10.0.0.1.54396 > 10.0.0.2.5001: UDP, length 1470
00:08:43.529662 IP 10.0.0.1.54396 > 10.0.0.2.5001: UDP, length 1470
00:08:43.541776 IP 10.0.0.1.54396 > 10.0.0.2.5001: UDP, length 1470
00:08:43.553870 IP 10.0.0.1.54396 > 10.0.0.2.5001: UDP, length 1470
00:08:43.566731 IP 10.0.0.1.54396 > 10.0.0.2.5001: UDP, length 1470
00:08:43.578059 IP 10.0.0.1.54396 > 10.0.0.2.5001: UDP, length 1470
00:08:43.590142 IP 10.0.0.1.54396 > 10.0.0.2.5001: UDP, length 1470
00:08:43.603246 IP 10.0.0.1.54396 > 10.0.0.2.5001: UDP, length 1470
00:08:43.614342 IP 10.0.0.1.54396 > 10.0.0.2.5001: UDP, length 1470
00:08:43.626461 IP 10.0.0.1.54396 > 10.0.0.2.5001: UDP, length 1470
00:08:43.638569 IP 10.0.0.1.54396 > 10.0.0.2.5001: UDP, length 1470
00:08:43.650823 IP 10.0.0.1.54396 > 10.0.0.2.5001: UDP, length 1470
00:08:43.662732 IP 10.0.0.1.54396 > 10.0.0.2.5001: UDP, length 1470
00:08:43.674835 IP 10.0.0.1.54396 > 10.0.0.2.5001: UDP, length 1470
00:08:43.686925 IP 10.0.0.1.54396 > 10.0.0.2.5001: UDP, length 1470
00:08:43.699006 IP 10.0.0.1.54396 > 10.0.0.2.5001: UDP, length 1470
00:08:43.711130 IP 10.0.0.1.54396 > 10.0.0.2.5001: UDP, length 1470
00:08:43.723218 IP 10.0.0.1.54396 > 10.0.0.2.5001: UDP, length 1470
00:08:43.736103 IP 10.0.0.1.54396 > 10.0.0.2.5001: UDP, length 1470
00:08:43.747403 IP 10.0.0.1.54396 > 10.0.0.2.5001: UDP, length 1470
00:08:43.759519 IP 10.0.0.1.54396 > 10.0.0.2.5001: UDP, length 1470
00:08:43.771606 IP 10.0.0.1.54396 > 10.0.0.2.5001: UDP, length 1470
00:08:43.783694 IP 10.0.0.1.54396 > 10.0.0.2.5001: UDP, length 1470
00:08:43.795781 IP 10.0.0.1.54396 > 10.0.0.2.5001: UDP, length 1470
00:08:43.807882 IP 10.0.0.1.54396 > 10.0.0.2.5001: UDP, length 1470
00:08:43.819990 IP 10.0.0.1.54396 > 10.0.0.2.5001: UDP, length 1470
00:08:43.832103 IP 10.0.0.1.54396 > 10.0.0.2.5001: UDP, length 1470
00:08:43.844210 IP 10.0.0.1.54396 > 10.0.0.2.5001: UDP, length 1470
00:08:43.856262 IP 10.0.0.1.54396 > 10.0.0.2.5001: UDP, length 1470
00:08:43.868361 IP 10.0.0.1.54396 > 10.0.0.2.5001: UDP, length 1470
00:08:43.880459 IP 10.0.0.1.54396 > 10.0.0.2.5001: UDP, length 1470
00:08:43.892564 IP 10.0.0.1.54396 > 10.0.0.2.5001: UDP, length 1470
00:08:43.904661 IP 10.0.0.1.54396 > 10.0.0.2.5001: UDP, length 1470
00:08:43.916735 IP 10.0.0.1.54396 > 10.0.0.2.5001: UDP, length 1470
00:08:43.928849 IP 10.0.0.1.54396 > 10.0.0.2.5001: UDP, length 1470
00:08:43.940943 IP 10.0.0.1.54396 > 10.0.0.2.5001: UDP, length 1470
00:08:43.953026 IP 10.0.0.1.54396 > 10.0.0.2.5001: UDP, length 1470
00:08:43.965141 IP 10.0.0.1.54396 > 10.0.0.2.5001: UDP, length 1470
00:08:43.977232 IP 10.0.0.1.54396 > 10.0.0.2.5001: UDP, length 1470
00:08:43.989323 IP 10.0.0.1.54396 > 10.0.0.2.5001: UDP, length 1470
00:08:44.002363 IP 10.0.0.1.54396 > 10.0.0.2.5001: UDP, length 1470
00:08:44.013522 IP 10.0.0.1.54396 > 10.0.0.2.5001: UDP, length 1470
00:08:44.025605 IP 10.0.0.1.54396 > 10.0.0.2.5001: UDP, length 1470
00:08:44.038582 IP 10.0.0.1.54396 > 10.0.0.2.5001: UDP, length 1470
00:08:44.049806 IP 10.0.0.1.54396 > 10.0.0.2.5001: UDP, length 1470
00:08:44.061899 IP 10.0.0.1.54396 > 10.0.0.2.5001: UDP, length 1470
00:08:44.073999 IP 10.0.0.1.54396 > 10.0.0.2.5001: UDP, length 1470
00:08:44.086088 IP 10.0.0.1.54396 > 10.0.0.2.5001: UDP, length 1470

