00:08:32.365133 IP 10.0.0.1.54396 > 10.0.0.2.5001: UDP, length 1470
00:08:32.365148 IP 10.0.0.1.54396 > 10.0.0.2.5001: UDP, length 1470
00:08:32.378242 IP 10.0.0.1.54396 > 10.0.0.2.5001: UDP, length 1470
00:08:32.388657 IP 10.0.0.1.54396 > 10.0.0.2.5001: UDP, length 1470
00:08:32.400738 IP 10.0.0.1.54396 > 10.0.0.2.5001: UDP, length 1470
00:08:32.412849 IP 10.0.0.1.54396 > 10.0.0.2.5001: UDP, length 1470
00:08:32.424949 IP 10.0.0.1.54396 > 10.0.0.2.5001: UDP, length 1470
00:08:32.437031 IP 10.0.0.1.54396 > 10.0.0.2.5001: UDP, length 1470
00:08:32.449153 IP 10.0.0.1.54396 > 10.0.0.2.5001: UDP, length 1470
00:08:32.461280 IP 10.0.0.1.54396 > 10.0.0.2.5001: UDP, length 1470
00:08:32.473309 IP 10.0.0.1.54396 > 10.0.0.2.5001: UDP, length 1470
00:08:32.485417 IP 10.0.0.1.54396 > 10.0.0.2.5001: UDP, length 1470
00:08:32.497531 IP 10.0.0.1.54396 > 10.0.0.2.5001: UDP, length 1470
00:08:32.509632 IP 10.0.0.1.54396 > 10.0.0.2.5001: UDP, length 1470
00:08:32.521709 IP 10.0.0.1.54396 > 10.0.0.2.5001: UDP, length 1470
00:08:32.533802 IP 10.0.0.1.54396 > 10.0.0.2.5001: UDP, length 1470
00:08:32.545886 IP 10.0.0.1.54396 > 10.0.0.2.5001: UDP, length 1470
00:08:32.557986 IP 10.0.0.1.54396 > 10.0.0.2.5001: UDP, length 1470
00:08:32.570099 IP 10.0.0.1.54396 > 10.0.0.2.5001: UDP, length 1470
00:08:32.588091 IP 10.0.0.1.54396 > 10.0.0.2.5001: UDP, length 1470
00:08:32.600045 IP 10.0.0.1.54396 > 10.0.0.2.5001: UDP, length 1470
00:08:32.612180 IP 10.0.0.1.54396 > 10.0.0.2.5001: UDP, length 1470
00:08:32.624192 IP 10.0.0.1.54396 > 10.0.0.2.5001: UDP, length 1470
00:08:32.637114 IP 10.0.0.1.54396 > 10.0.0.2.5001: UDP, length 1470
00:08:32.648451 IP 10.0.0.1.54396 > 10.0.0.2.5001: UDP, length 1470
00:08:32.660504 IP 10.0.0.1.54396 > 10.0.0.2.5001: UDP, length 1470
00:08:32.673424 IP 10.0.0.1.54396 > 10.0.0.2.5001: UDP, length 1470
00:08:32.684723 IP 10.0.0.1.54396 > 10.0.0.2.5001: UDP, length 1470
00:08:32.696856 IP 10.0.0.1.54396 > 10.0.0.2.5001: UDP, length 1470
00:08:32.708903 IP 10.0.0.1.54396 > 10.0.0.2.5001: UDP, length 1470
00:08:32.721032 IP 10.0.0.1.54396 > 10.0.0.2.5001: UDP, length 1470
00:08:32.733108 IP 10.0.0.1.54396 > 10.0.0.2.5001: UDP, length 1470
00:08:32.745229 IP 10.0.0.1.54396 > 10.0.0.2.5001: UDP, length 1470
00:08:32.757316 IP 10.0.0.1.54396 > 10.0.0.2.5001: UDP, length 1470
00:08:32.769386 IP 10.0.0.1.54396 > 10.0.0.2.5001: UDP, length 1470
00:08:32.781453 IP 10.0.0.1.54396 > 10.0.0.2.5001: UDP, length 1470
00:08:32.793576 IP 10.0.0.1.54396 > 10.0.0.2.5001: UDP, length 1470
00:08:32.805687 IP 10.0.0.1.54396 > 10.0.0.2.5001: UDP, length 1470
00:08:32.818577 IP 10.0.0.1.54396 > 10.0.0.2.5001: UDP, length 1470
00:08:32.829918 IP 10.0.0.1.54396 > 10.0.0.2.5001: UDP, length 1470
00:08:32.841980 IP 10.0.0.1.54396 > 10.0.0.2.5001: UDP, length 1470
00:08:32.854081 IP 10.0.0.1.54396 > 10.0.0.2.5001: UDP, length 1470
00:08:32.866193 IP 10.0.0.1.54396 > 10.0.0.2.5001: UDP, length 1470
00:08:32.878276 IP 10.0.0.1.54396 > 10.0.0.2.5001: UDP, length 1470
00:08:32.890359 IP 10.0.0.1.54396 > 10.0.0.2.5001: UDP, length 1470
00:08:32.903312 IP 10.0.0.1.54396 > 10.0.0.2.5001: UDP, length 1470
00:08:32.914555 IP 10.0.0.1.54396 > 10.0.0.2.5001: UDP, length 1470
00:08:32.926633 IP 10.0.0.1.54396 > 10.0.0.2.5001: UDP, length 1470
00:08:32.939421 IP 10.0.0.1.54396 > 10.0.0.2.5001: UDP, length 1470
00:08:32.950867 IP 10.0.0.1.54396 > 10.0.0.2.5001: UDP, length 1470
00:08:32.962933 IP 10.0.0.1.54396 > 10.0.0.2.5001: UDP, length 1470
00:08:32.975851 IP 10.0.0.1.54396 > 10.0.0.2.5001: UDP, length 1470
00:08:32.987120 IP 10.0.0.1.54396 > 10.0.0.2.5001: UDP, length 1470
00:08:32.999221 IP 10.0.0.1.54396 > 10.0.0.2.5001: UDP, length 1470
00:08:33.012081 IP 10.0.0.1.54396 > 10.0.0.2.5001: UDP, length 1470
00:08:33.023415 IP 10.0.0.1.54396 > 10.0.0.2.5001: UDP, length 1470
00:08:33.035510 IP 10.0.0.1.54396 > 10.0.0.2.5001: UDP, length 1470
00:08:33.048042 IP 10.0.0.1.54396 > 10.0.0.2.5001: UDP, length 1470
00:08:33.059716 IP 10.0.0.1.54396 > 10.0.0.2.5001: UDP, length 1470
00:08:33.071794 IP 10.0.0.1.54396 > 10.0.0.2.5001: UDP, length 1470
00:08:33.083895 IP 10.0.0.1.54396 > 10.0.0.2.5001: UDP, length 1470
00:08:33.096020 IP 10.0.0.1.54396 > 10.0.0.2.5001: UDP, length 1470
00:08:33.108067 IP 10.0.0.1.54396 > 10.0.0.2.5001: UDP, length 1470
00:08:33.120209 IP 10.0.0.1.54396 > 10.0.0.2.5001: UDP, length 1470
00:08:33.133052 IP 10.0.0.1.54396 > 10.0.0.2.5001: UDP, length 1470
00:08:33.144367 IP 10.0.0.1.54396 > 10.0.0.2.5001: UDP, length 1470
00:08:33.156475 IP 10.0.0.1.54396 > 10.0.0.2.5001: UDP, length 1470
00:08:33.169259 IP 10.0.0.1.54396 > 10.0.0.2.5001: UDP, length 1470
00:08:33.180694 IP 10.0.0.1.54396 > 10.0.0.2.5001: UDP, length 1470
00:08:33.192780 IP 10.0.0.1.54396 > 10.0.0.2.5001: UDP, length 1470
00:08:33.204862 IP 10.0.0.1.54396 > 10.0.0.2.5001: UDP, length 1470
00:08:33.216956 IP 10.0.0.1.54396 > 10.0.0.2.5001: UDP, length 1470
00:08:33.229026 IP 10.0.0.1.54396 > 10.0.0.2.5001: UDP, length 1470
00:08:33.241094 IP 10.0.0.1.54396 > 10.0.0.2.5001: UDP, length 1470
00:08:33.253264 IP 10.0.0.1.54396 > 10.0.0.2.5001: UDP, length 1470
00:08:33.265291 IP 10.0.0.1.54396 > 10.0.0.2.5001: UDP, length 1470
00:08:33.278274 IP 10.0.0.1.54396 > 10.0.0.2.5001: UDP, length 1470
00:08:33.289522 IP 10.0.0.1.54396 > 10.0.0.2.5001: UDP, length 1470
00:08:33.301612 IP 10.0.0.1.54396 > 10.0.0.2.5001: UDP, length 1470
00:08:33.314459 IP 10.0.0.1.54396 > 10.0.0.2.5001: UDP, length 1470
00:08:33.325802 IP 10.0.0.1.54396 > 10.0.0.2.5001: UDP, length 1470
00:08:33.338813 IP 10.0.0.1.54396 > 10.0.0.2.5001: UDP, length 1470
00:08:33.350179 IP 10.0.0.1.54396 > 10.0.0.2.5001: UDP, length 1470
00:08:33.362075 IP 10.0.0.1.54396 > 10.0.0.2.5001: UDP, length 1470
00:08:33.374967 IP 10.0.0.1.54396 > 10.0.0.2.5001: UDP, length 1470
00:08:33.386296 IP 10.0.0.1.54396 > 10.0.0.2.5001: UDP, length 1470
00:08:33.398387 IP 10.0.0.1.54396 > 10.0.0.2.5001: UDP, length 1470
00:08:33.410557 IP 10.0.0.1.54396 > 10.0.0.2.5001: UDP, length 1470
00:08:33.423452 IP 10.0.0.1.54396 > 10.0.0.2.5001: UDP, length 1470
00:08:33.434736 IP 10.0.0.1.54396 > 10.0.0.2.5001: UDP, length 1470
00:08:33.446770 IP 10.0.0.1.54396 > 10.0.0.2.5001: UDP, length 1470
00:08:33.459730 IP 10.0.0.1.54396 > 10.0.0.2.5001: UDP, length 1470
00:08:33.470974 IP 10.0.0.1.54396 > 10.0.0.2.5001: UDP, length 1470
00:08:33.483059 IP 10.0.0.1.54396 > 10.0.0.2.5001: UDP, length 1470
00:08:33.495151 IP 10.0.0.1.54396 > 10.0.0.2.5001: UDP, length 1470
00:08:33.507259 IP 10.0.0.1.54396 > 10.0.0.2.5001: UDP, length 1470
00:08:33.519357 IP 10.0.0.1.54396 > 10.0.0.2.5001: UDP, length 1470
00:08:33.531468 IP 10.0.0.1.54396 > 10.0.0.2.5001: UDP, length 1470
00:08:33.543528 IP 10.0.0.1.54396 > 10.0.0.2.5001: UDP, length 1470
00:08:33.555630 IP 10.0.0.1.54396 > 10.0.0.2.5001: UDP, length 1470
00:08:33.567745 IP 10.0.0.1.54396 > 10.0.0.2.5001: UDP, length 1470
00:08:33.579806 IP 10.0.0.1.54396 > 10.0.0.2.5001: UDP, length 1470
00:08:33.591936 IP 10.0.0.1.54396 > 10.0.0.2.5001: UDP, length 1470
00:08:33.604019 IP 10.0.0.1.54396 > 10.0.0.2.5001: UDP, length 1470
00:08:33.616128 IP 10.0.0.1.54396 > 10.0.0.2.5001: UDP, length 1470
00:08:33.628182 IP 10.0.0.1.54396 > 10.0.0.2.5001: UDP, length 1470
00:08:33.640320 IP 10.0.0.1.54396 > 10.0.0.2.5001: UDP, length 1470
00:08:33.652436 IP 10.0.0.1.54396 > 10.0.0.2.5001: UDP, length 1470
00:08:33.664536 IP 10.0.0.1.54396 > 10.0.0.2.5001: UDP, length 1470
00:08:33.676626 IP 10.0.0.1.54396 > 10.0.0.2.5001: UDP, length 1470
00:08:33.688672 IP 10.0.0.1.54396 > 10.0.0.2.5001: UDP, length 1470
00:08:33.700799 IP 10.0.0.1.54396 > 10.0.0.2.5001: UDP, length 1470
00:08:33.712898 IP 10.0.0.1.54396 > 10.0.0.2.5001: UDP, length 1470
00:08:33.725678 IP 10.0.0.1.54396 > 10.0.0.2.5001: UDP, length 1470
00:08:33.737076 IP 10.0.0.1.54396 > 10.0.0.2.5001: UDP, length 1470
00:08:33.749173 IP 10.0.0.1.54396 > 10.0.0.2.5001: UDP, length 1470
00:08:33.761303 IP 10.0.0.1.54396 > 10.0.0.2.5001: UDP, length 1470
00:08:33.773373 IP 10.0.0.1.54396 > 10.0.0.2.5001: UDP, length 1470
00:08:33.786454 IP 10.0.0.1.54396 > 10.0.0.2.5001: UDP, length 1470
00:08:33.797558 IP 10.0.0.1.54396 > 10.0.0.2.5001: UDP, length 1470
00:08:33.809649 IP 10.0.0.1.54396 > 10.0.0.2.5001: UDP, length 1470
00:08:33.822520 IP 10.0.0.1.54396 > 10.0.0.2.5001: UDP, length 1470
00:08:33.833882 IP 10.0.0.1.54396 > 10.0.0.2.5001: UDP, length 1470
00:08:33.845962 IP 10.0.0.1.54396 > 10.0.0.2.5001: UDP, length 1470
00:08:33.858048 IP 10.0.0.1.54396 > 10.0.0.2.5001: UDP, length 1470
00:08:33.870156 IP 10.0.0.1.54396 > 10.0.0.2.5001: UDP, length 1470
00:08:33.882858 IP 10.0.0.1.54396 > 10.0.0.2.5001: UDP, length 1470
00:08:33.894326 IP 10.0.0.1.54396 > 10.0.0.2.5001: UDP, length 1470
00:08:33.906429 IP 10.0.0.1.54396 > 10.0.0.2.5001: UDP, length 1470
00:08:33.918503 IP 10.0.0.1.54396 > 10.0.0.2.5001: UDP, length 1470
00:08:33.930628 IP 10.0.0.1.54396 > 10.0.0.2.5001: UDP, length 1470
00:08:33.942681 IP 10.0.0.1.54396 > 10.0.0.2.5001: UDP, length 1470
00:08:33.954803 IP 10.0.0.1.54396 > 10.0.0.2.5001: UDP, length 1470
00:08:33.966914 IP 10.0.0.1.54396 > 10.0.0.2.5001: UDP, length 1470
00:08:33.979761 IP 10.0.0.1.54396 > 10.0.0.2.5001: UDP, length 1470
00:08:33.991100 IP 10.0.0.1.54396 > 10.0.0.2.5001: UDP, length 1470
00:08:34.003203 IP 10.0.0.1.54396 > 10.0.0.2.5001: UDP, length 1470
00:08:34.015279 IP 10.0.0.1.54396 > 10.0.0.2.5001: UDP, length 1470
00:08:34.027370 IP 10.0.0.1.54396 > 10.0.0.2.5001: UDP, length 1470
00:08:34.039487 IP 10.0.0.1.54396 > 10.0.0.2.5001: UDP, length 1470
00:08:34.052364 IP 10.0.0.1.54396 > 10.0.0.2.5001: UDP, length 1470
00:08:34.063672 IP 10.0.0.1.54396 > 10.0.0.2.5001: UDP, length 1470
00:08:34.075733 IP 10.0.0.1.54396 > 10.0.0.2.5001: UDP, length 1470
00:08:34.087888 IP 10.0.0.1.54396 > 10.0.0.2.5001: UDP, length 1470
00:08:34.112059 IP 10.0.0.1.54396 > 10.0.0.2.5001: UDP, length 1470
00:08:34.124116 IP 10.0.0.1.54396 > 10.0.0.2.5001: UDP, length 1470
00:08:34.136215 IP 10.0.0.1.54396 > 10.0.0.2.5001: UDP, length 1470
00:08:34.148346 IP 10.0.0.1.54396 > 10.0.0.2.5001: UDP, length 1470
00:08:34.160444 IP 10.0.0.1.54396 > 10.0.0.2.5001: UDP, length 1470
00:08:34.172533 IP 10.0.0.1.54396 > 10.0.0.2.5001: UDP, length 1470
00:08:34.184640 IP 10.0.0.1.54396 > 10.0.0.2.5001: UDP, length 1470
00:08:34.197463 IP 10.0.0.1.54396 > 10.0.0.2.5001: UDP, length 1470
00:08:34.208826 IP 10.0.0.1.54396 > 10.0.0.2.5001: UDP, length 1470
00:08:34.220934 IP 10.0.0.1.54396 > 10.0.0.2.5001: UDP, length 1470
00:08:34.233782 IP 10.0.0.1.54396 > 10.0.0.2.5001: UDP, length 1470
00:08:34.245133 IP 10.0.0.1.54396 > 10.0.0.2.5001: UDP, length 1470
00:08:34.257200 IP 10.0.0.1.54396 > 10.0.0.2.5001: UDP, length 1470
00:08:34.269735 IP 10.0.0.1.54396 > 10.0.0.2.5001: UDP, length 1470
00:08:34.281421 IP 10.0.0.1.54396 > 10.0.0.2.5001: UDP, length 1470
00:08:34.293460 IP 10.0.0.1.54396 > 10.0.0.2.5001: UDP, length 1470
00:08:34.305588 IP 10.0.0.1.54396 > 10.0.0.2.5001: UDP, length 1470
00:08:34.317686 IP 10.0.0.1.54396 > 10.0.0.2.5001: UDP, length 1470
00:08:34.329798 IP 10.0.0.1.54396 > 10.0.0.2.5001: UDP, length 1470
00:08:34.353978 IP 10.0.0.1.54396 > 10.0.0.2.5001: UDP, length 1470
00:08:34.366070 IP 10.0.0.1.54396 > 10.0.0.2.5001: UDP, length 1470
00:08:34.378190 IP 10.0.0.1.54396 > 10.0.0.2.5001: UDP, length 1470
00:08:34.390244 IP 10.0.0.1.54396 > 10.0.0.2.5001: UDP, length 1470
00:08:34.402321 IP 10.0.0.1.54396 > 10.0.0.2.5001: UDP, length 1470
00:08:34.414470 IP 10.0.0.1.54396 > 10.0.0.2.5001: UDP, length 1470
00:08:34.426546 IP 10.0.0.1.54396 > 10.0.0.2.5001: UDP, length 1470
00:08:34.438651 IP 10.0.0.1.54396 > 10.0.0.2.5001: UDP, length 1470
00:08:34.450721 IP 10.0.0.1.54396 > 10.0.0.2.5001: UDP, length 1470
00:08:34.462838 IP 10.0.0.1.54396 > 10.0.0.2.5001: UDP, length 1470
00:08:34.474890 IP 10.0.0.1.54396 > 10.0.0.2.5001: UDP, length 1470
00:08:34.499135 IP 10.0.0.1.54396 > 10.0.0.2.5001: UDP, length 1470
00:08:34.511184 IP 10.0.0.1.54396 > 10.0.0.2.5001: UDP, length 1470
00:08:34.523326 IP 10.0.0.1.54396 > 10.0.0.2.5001: UDP, length 1470
00:08:34.535407 IP 10.0.0.1.54396 > 10.0.0.2.5001: UDP, length 1470
00:08:34.547555 IP 10.0.0.1.54396 > 10.0.0.2.5001: UDP, length 1470
00:08:34.559619 IP 10.0.0.1.54396 > 10.0.0.2.5001: UDP, length 1470
00:08:34.571699 IP 10.0.0.1.54396 > 10.0.0.2.5001: UDP, length 1470
00:08:34.583811 IP 10.0.0.1.54396 > 10.0.0.2.5001: UDP, length 1470
00:08:34.595883 IP 10.0.0.1.54396 > 10.0.0.2.5001: UDP, length 1470
00:08:34.608021 IP 10.0.0.1.54396 > 10.0.0.2.5001: UDP, length 1470
00:08:34.620893 IP 10.0.0.1.54396 > 10.0.0.2.5001: UDP, length 1470
00:08:34.632189 IP 10.0.0.1.54396 > 10.0.0.2.5001: UDP, length 1470
00:08:34.645064 IP 10.0.0.1.54396 > 10.0.0.2.5001: UDP, length 1470
00:08:34.656391 IP 10.0.0.1.54396 > 10.0.0.2.5001: UDP, length 1470
00:08:34.668637 IP 10.0.0.1.54396 > 10.0.0.2.5001: UDP, length 1470
00:08:34.680765 IP 10.0.0.1.54396 > 10.0.0.2.5001: UDP, length 1470
00:08:34.693376 IP 10.0.0.1.54396 > 10.0.0.2.5001: UDP, length 1470
00:08:34.704769 IP 10.0.0.1.54396 > 10.0.0.2.5001: UDP, length 1470
00:08:34.716829 IP 10.0.0.1.54396 > 10.0.0.2.5001: UDP, length 1470
00:08:34.731855 IP 10.0.0.1.54396 > 10.0.0.2.5001: UDP, length 1470
00:08:34.741063 IP 10.0.0.1.54396 > 10.0.0.2.5001: UDP, length 1470
00:08:34.753937 IP 10.0.0.1.54396 > 10.0.0.2.5001: UDP, length 1470
00:08:34.765234 IP 10.0.0.1.54396 > 10.0.0.2.5001: UDP, length 1470
00:08:34.778134 IP 10.0.0.1.54396 > 10.0.0.2.5001: UDP, length 1470
00:08:34.789400 IP 10.0.0.1.54396 > 10.0.0.2.5001: UDP, length 1470
00:08:34.801535 IP 10.0.0.1.54396 > 10.0.0.2.5001: UDP, length 1470
00:08:34.814394 IP 10.0.0.1.54396 > 10.0.0.2.5001: UDP, length 1470
00:08:34.825673 IP 10.0.0.1.54396 > 10.0.0.2.5001: UDP, length 1470
00:08:34.837810 IP 10.0.0.1.54396 > 10.0.0.2.5001: UDP, length 1470
00:08:34.850636 IP 10.0.0.1.54396 > 10.0.0.2.5001: UDP, length 1470
00:08:34.862034 IP 10.0.0.1.54396 > 10.0.0.2.5001: UDP, length 1470
00:08:34.874114 IP 10.0.0.1.54396 > 10.0.0.2.5001: UDP, length 1470
00:08:34.886203 IP 10.0.0.1.54396 > 10.0.0.2.5001: UDP, length 1470
00:08:34.898304 IP 10.0.0.1.54396 > 10.0.0.2.5001: UDP, length 1470
00:08:34.910384 IP 10.0.0.1.54396 > 10.0.0.2.5001: UDP, length 1470
00:08:34.922497 IP 10.0.0.1.54396 > 10.0.0.2.5001: UDP, length 1470
00:08:34.934621 IP 10.0.0.1.54396 > 10.0.0.2.5001: UDP, length 1470
00:08:34.947426 IP 10.0.0.1.54396 > 10.0.0.2.5001: UDP, length 1470
00:08:34.958774 IP 10.0.0.1.54396 > 10.0.0.2.5001: UDP, length 1470
00:08:34.970898 IP 10.0.0.1.54396 > 10.0.0.2.5001: UDP, length 1470
00:08:34.982954 IP 10.0.0.1.54396 > 10.0.0.2.5001: UDP, length 1470
00:08:34.995058 IP 10.0.0.1.54396 > 10.0.0.2.5001: UDP, length 1470
00:08:35.007123 IP 10.0.0.1.54396 > 10.0.0.2.5001: UDP, length 1470
00:08:35.019281 IP 10.0.0.1.54396 > 10.0.0.2.5001: UDP, length 1470
00:08:35.031378 IP 10.0.0.1.54396 > 10.0.0.2.5001: UDP, length 1470
00:08:35.043421 IP 10.0.0.1.54396 > 10.0.0.2.5001: UDP, length 1470
00:08:35.055550 IP 10.0.0.1.54396 > 10.0.0.2.5001: UDP, length 1470
00:08:35.067662 IP 10.0.0.1.54396 > 10.0.0.2.5001: UDP, length 1470
00:08:35.079738 IP 10.0.0.1.54396 > 10.0.0.2.5001: UDP, length 1470
00:08:35.091831 IP 10.0.0.1.54396 > 10.0.0.2.5001: UDP, length 1470
00:08:35.103921 IP 10.0.0.1.54396 > 10.0.0.2.5001: UDP, length 1470
00:08:35.116024 IP 10.0.0.1.54396 > 10.0.0.2.5001: UDP, length 1470
00:08:35.128984 IP 10.0.0.1.54396 > 10.0.0.2.5001: UDP, length 1470
00:08:35.140221 IP 10.0.0.1.54396 > 10.0.0.2.5001: UDP, length 1470
00:08:35.153121 IP 10.0.0.1.54396 > 10.0.0.2.5001: UDP, length 1470
00:08:35.164422 IP 10.0.0.1.54396 > 10.0.0.2.5001: UDP, length 1470
00:08:35.176484 IP 10.0.0.1.54396 > 10.0.0.2.5001: UDP, length 1470
00:08:35.188657 IP 10.0.0.1.54396 > 10.0.0.2.5001: UDP, length 1470
00:08:35.200644 IP 10.0.0.1.54396 > 10.0.0.2.5001: UDP, length 1470
00:08:35.225641 IP 10.0.0.1.54396 > 10.0.0.2.5001: UDP, length 1470
00:08:35.236956 IP 10.0.0.1.54396 > 10.0.0.2.5001: UDP, length 1470
00:08:35.249105 IP 10.0.0.1.54396 > 10.0.0.2.5001: UDP, length 1470
00:08:35.261180 IP 10.0.0.1.54396 > 10.0.0.2.5001: UDP, length 1470
00:08:35.274021 IP 10.0.0.1.54396 > 10.0.0.2.5001: UDP, length 1470
00:08:35.285389 IP 10.0.0.1.54396 > 10.0.0.2.5001: UDP, length 1470
00:08:35.297469 IP 10.0.0.1.54396 > 10.0.0.2.5001: UDP, length 1470
00:08:35.309593 IP 10.0.0.1.54396 > 10.0.0.2.5001: UDP, length 1470
00:08:35.333772 IP 10.0.0.1.54396 > 10.0.0.2.5001: UDP, length 1470
00:08:35.345864 IP 10.0.0.1.54396 > 10.0.0.2.5001: UDP, length 1470
00:08:35.357949 IP 10.0.0.1.54396 > 10.0.0.2.5001: UDP, length 1470
00:08:35.370014 IP 10.0.0.1.54396 > 10.0.0.2.5001: UDP, length 1470
00:08:35.382108 IP 10.0.0.1.54396 > 10.0.0.2.5001: UDP, length 1470
00:08:35.394192 IP 10.0.0.1.54396 > 10.0.0.2.5001: UDP, length 1470
00:08:35.406325 IP 10.0.0.1.54396 > 10.0.0.2.5001: UDP, length 1470
00:08:35.418382 IP 10.0.0.1.54396 > 10.0.0.2.5001: UDP, length 1470
00:08:35.442626 IP 10.0.0.1.54396 > 10.0.0.2.5001: UDP, length 1470
00:08:35.454718 IP 10.0.0.1.54396 > 10.0.0.2.5001: UDP, length 1470
00:08:35.466802 IP 10.0.0.1.54396 > 10.0.0.2.5001: UDP, length 1470
00:08:35.478901 IP 10.0.0.1.54396 > 10.0.0.2.5001: UDP, length 1470
00:08:35.490993 IP 10.0.0.1.54396 > 10.0.0.2.5001: UDP, length 1470
00:08:35.503122 IP 10.0.0.1.54396 > 10.0.0.2.5001: UDP, length 1470
00:08:35.515956 IP 10.0.0.1.54396 > 10.0.0.2.5001: UDP, length 1470
00:08:35.528085 IP 10.0.0.1.54396 > 10.0.0.2.5001: UDP, length 1470
00:08:35.539403 IP 10.0.0.1.54396 > 10.0.0.2.5001: UDP, length 1470
00:08:35.551450 IP 10.0.0.1.54396 > 10.0.0.2.5001: UDP, length 1470
00:08:35.564490 IP 10.0.0.1.54396 > 10.0.0.2.5001: UDP, length 1470
00:08:35.575631 IP 10.0.0.1.54396 > 10.0.0.2.5001: UDP, length 1470
00:08:35.588581 IP 10.0.0.1.54396 > 10.0.0.2.5001: UDP, length 1470
00:08:35.599851 IP 10.0.0.1.54396 > 10.0.0.2.5001: UDP, length 1470
00:08:35.611958 IP 10.0.0.1.54396 > 10.0.0.2.5001: UDP, length 1470
00:08:35.624822 IP 10.0.0.1.54396 > 10.0.0.2.5001: UDP, length 1470
00:08:35.636128 IP 10.0.0.1.54396 > 10.0.0.2.5001: UDP, length 1470
00:08:35.648254 IP 10.0.0.1.54396 > 10.0.0.2.5001: UDP, length 1470
00:08:35.660351 IP 10.0.0.1.54396 > 10.0.0.2.5001: UDP, length 1470
00:08:35.672440 IP 10.0.0.1.54396 > 10.0.0.2.5001: UDP, length 1470
00:08:35.684943 IP 10.0.0.1.54396 > 10.0.0.2.5001: UDP, length 1470
00:08:35.696649 IP 10.0.0.1.54396 > 10.0.0.2.5001: UDP, length 1470
00:08:35.708734 IP 10.0.0.1.54396 > 10.0.0.2.5001: UDP, length 1470
00:08:35.720860 IP 10.0.0.1.54396 > 10.0.0.2.5001: UDP, length 1470
00:08:35.732883 IP 10.0.0.1.54396 > 10.0.0.2.5001: UDP, length 1470
00:08:35.745018 IP 10.0.0.1.54396 > 10.0.0.2.5001: UDP, length 1470
00:08:35.757146 IP 10.0.0.1.54396 > 10.0.0.2.5001: UDP, length 1470
00:08:35.769211 IP 10.0.0.1.54396 > 10.0.0.2.5001: UDP, length 1470
00:08:35.781302 IP 10.0.0.1.54396 > 10.0.0.2.5001: UDP, length 1470
00:08:35.794149 IP 10.0.0.1.54396 > 10.0.0.2.5001: UDP, length 1470
00:08:35.805483 IP 10.0.0.1.54396 > 10.0.0.2.5001: UDP, length 1470
00:08:35.817554 IP 10.0.0.1.54396 > 10.0.0.2.5001: UDP, length 1470
00:08:35.829683 IP 10.0.0.1.54396 > 10.0.0.2.5001: UDP, length 1470
00:08:35.841761 IP 10.0.0.1.54396 > 10.0.0.2.5001: UDP, length 1470
00:08:35.853868 IP 10.0.0.1.54396 > 10.0.0.2.5001: UDP, length 1470
00:08:35.865943 IP 10.0.0.1.54396 > 10.0.0.2.5001: UDP, length 1470
00:08:35.878086 IP 10.0.0.1.54396 > 10.0.0.2.5001: UDP, length 1470
00:08:35.890239 IP 10.0.0.1.54396 > 10.0.0.2.5001: UDP, length 1470
00:08:35.902291 IP 10.0.0.1.54396 > 10.0.0.2.5001: UDP, length 1470
00:08:35.914353 IP 10.0.0.1.54396 > 10.0.0.2.5001: UDP, length 1470
00:08:35.927216 IP 10.0.0.1.54396 > 10.0.0.2.5001: UDP, length 1470
00:08:35.938534 IP 10.0.0.1.54396 > 10.0.0.2.5001: UDP, length 1470
00:08:35.951394 IP 10.0.0.1.54396 > 10.0.0.2.5001: UDP, length 1470
00:08:35.962730 IP 10.0.0.1.54396 > 10.0.0.2.5001: UDP, length 1470
00:08:35.974844 IP 10.0.0.1.54396 > 10.0.0.2.5001: UDP, length 1470
00:08:35.986908 IP 10.0.0.1.54396 > 10.0.0.2.5001: UDP, length 1470
00:08:35.999808 IP 10.0.0.1.54396 > 10.0.0.2.5001: UDP, length 1470
00:08:36.011176 IP 10.0.0.1.54396 > 10.0.0.2.5001: UDP, length 1470
00:08:36.023189 IP 10.0.0.1.54396 > 10.0.0.2.5001: UDP, length 1470
00:08:36.036060 IP 10.0.0.1.54396 > 10.0.0.2.5001: UDP, length 1470
00:08:36.047419 IP 10.0.0.1.54396 > 10.0.0.2.5001: UDP, length 1470
00:08:36.059508 IP 10.0.0.1.54396 > 10.0.0.2.5001: UDP, length 1470
00:08:36.071608 IP 10.0.0.1.54396 > 10.0.0.2.5001: UDP, length 1470
00:08:36.083863 IP 10.0.0.1.54396 > 10.0.0.2.5001: UDP, length 1470
00:08:36.095822 IP 10.0.0.1.54396 > 10.0.0.2.5001: UDP, length 1470
00:08:36.108685 IP 10.0.0.1.54396 > 10.0.0.2.5001: UDP, length 1470
00:08:36.120024 IP 10.0.0.1.54396 > 10.0.0.2.5001: UDP, length 1470
00:08:36.132086 IP 10.0.0.1.54396 > 10.0.0.2.5001: UDP, length 1470
00:08:36.144186 IP 10.0.0.1.54396 > 10.0.0.2.5001: UDP, length 1470
00:08:36.156284 IP 10.0.0.1.54396 > 10.0.0.2.5001: UDP, length 1470
00:08:36.169148 IP 10.0.0.1.54396 > 10.0.0.2.5001: UDP, length 1470
00:08:36.192542 IP 10.0.0.1.54396 > 10.0.0.2.5001: UDP, length 1470
00:08:36.205446 IP 10.0.0.1.54396 > 10.0.0.2.5001: UDP, length 1470
00:08:36.216752 IP 10.0.0.1.54396 > 10.0.0.2.5001: UDP, length 1470
00:08:36.228857 IP 10.0.0.1.54396 > 10.0.0.2.5001: UDP, length 1470
00:08:36.240968 IP 10.0.0.1.54396 > 10.0.0.2.5001: UDP, length 1470
00:08:36.253041 IP 10.0.0.1.54396 > 10.0.0.2.5001: UDP, length 1470
00:08:36.265136 IP 10.0.0.1.54396 > 10.0.0.2.5001: UDP, length 1470
00:08:36.277271 IP 10.0.0.1.54396 > 10.0.0.2.5001: UDP, length 1470
00:08:36.289341 IP 10.0.0.1.54396 > 10.0.0.2.5001: UDP, length 1470
00:08:36.301424 IP 10.0.0.1.54396 > 10.0.0.2.5001: UDP, length 1470
00:08:36.313522 IP 10.0.0.1.54396 > 10.0.0.2.5001: UDP, length 1470
00:08:36.325618 IP 10.0.0.1.54396 > 10.0.0.2.5001: UDP, length 1470
00:08:36.337732 IP 10.0.0.1.54396 > 10.0.0.2.5001: UDP, length 1470
00:08:36.349795 IP 10.0.0.1.54396 > 10.0.0.2.5001: UDP, length 1470
00:08:36.361906 IP 10.0.0.1.54396 > 10.0.0.2.5001: UDP, length 1470
00:08:36.374028 IP 10.0.0.1.54396 > 10.0.0.2.5001: UDP, length 1470
00:08:36.386063 IP 10.0.0.1.54396 > 10.0.0.2.5001: UDP, length 1470
00:08:36.398223 IP 10.0.0.1.54396 > 10.0.0.2.5001: UDP, length 1470
00:08:36.411196 IP 10.0.0.1.54396 > 10.0.0.2.5001: UDP, length 1470
00:08:36.422368 IP 10.0.0.1.54396 > 10.0.0.2.5001: UDP, length 1470
00:08:36.434475 IP 10.0.0.1.54396 > 10.0.0.2.5001: UDP, length 1470
00:08:36.446583 IP 10.0.0.1.54396 > 10.0.0.2.5001: UDP, length 1470
00:08:36.458681 IP 10.0.0.1.54396 > 10.0.0.2.5001: UDP, length 1470
00:08:36.471588 IP 10.0.0.1.54396 > 10.0.0.2.5001: UDP, length 1470
00:08:36.482877 IP 10.0.0.1.54396 > 10.0.0.2.5001: UDP, length 1470
00:08:36.495756 IP 10.0.0.1.54396 > 10.0.0.2.5001: UDP, length 1470
00:08:36.507059 IP 10.0.0.1.54396 > 10.0.0.2.5001: UDP, length 1470
00:08:36.519142 IP 10.0.0.1.54396 > 10.0.0.2.5001: UDP, length 1470
00:08:36.532006 IP 10.0.0.1.54396 > 10.0.0.2.5001: UDP, length 1470
00:08:36.543321 IP 10.0.0.1.54396 > 10.0.0.2.5001: UDP, length 1470
00:08:36.555449 IP 10.0.0.1.54396 > 10.0.0.2.5001: UDP, length 1470
00:08:36.567529 IP 10.0.0.1.54396 > 10.0.0.2.5001: UDP, length 1470
00:08:36.579643 IP 10.0.0.1.54396 > 10.0.0.2.5001: UDP, length 1470
00:08:36.591745 IP 10.0.0.1.54396 > 10.0.0.2.5001: UDP, length 1470
00:08:36.604608 IP 10.0.0.1.54396 > 10.0.0.2.5001: UDP, length 1470
00:08:36.615914 IP 10.0.0.1.54396 > 10.0.0.2.5001: UDP, length 1470
00:08:36.628032 IP 10.0.0.1.54396 > 10.0.0.2.5001: UDP, length 1470
00:08:36.640133 IP 10.0.0.1.54396 > 10.0.0.2.5001: UDP, length 1470
00:08:36.652231 IP 10.0.0.1.54396 > 10.0.0.2.5001: UDP, length 1470
00:08:36.664294 IP 10.0.0.1.54396 > 10.0.0.2.5001: UDP, length 1470
00:08:36.676404 IP 10.0.0.1.54396 > 10.0.0.2.5001: UDP, length 1470
00:08:36.688508 IP 10.0.0.1.54396 > 10.0.0.2.5001: UDP, length 1470
00:08:36.700561 IP 10.0.0.1.54396 > 10.0.0.2.5001: UDP, length 1470
00:08:36.712712 IP 10.0.0.1.54396 > 10.0.0.2.5001: UDP, length 1470
00:08:36.724808 IP 10.0.0.1.54396 > 10.0.0.2.5001: UDP, length 1470
00:08:36.736909 IP 10.0.0.1.54396 > 10.0.0.2.5001: UDP, length 1470
00:08:36.749776 IP 10.0.0.1.54396 > 10.0.0.2.5001: UDP, length 1470
00:08:36.761079 IP 10.0.0.1.54396 > 10.0.0.2.5001: UDP, length 1470
00:08:36.773141 IP 10.0.0.1.54396 > 10.0.0.2.5001: UDP, length 1470
00:08:36.785288 IP 10.0.0.1.54396 > 10.0.0.2.5001: UDP, length 1470
00:08:36.797329 IP 10.0.0.1.54396 > 10.0.0.2.5001: UDP, length 1470
00:08:36.809457 IP 10.0.0.1.54396 > 10.0.0.2.5001: UDP, length 1470
00:08:36.834445 IP 10.0.0.1.54396 > 10.0.0.2.5001: UDP, length 1470
00:08:36.845762 IP 10.0.0.1.54396 > 10.0.0.2.5001: UDP, length 1470
00:08:36.857854 IP 10.0.0.1.54396 > 10.0.0.2.5001: UDP, length 1470
00:08:36.870828 IP 10.0.0.1.54396 > 10.0.0.2.5001: UDP, length 1470
00:08:36.882038 IP 10.0.0.1.54396 > 10.0.0.2.5001: UDP, length 1470
00:08:36.894106 IP 10.0.0.1.54396 > 10.0.0.2.5001: UDP, length 1470
00:08:36.907011 IP 10.0.0.1.54396 > 10.0.0.2.5001: UDP, length 1470
00:08:36.930432 IP 10.0.0.1.54396 > 10.0.0.2.5001: UDP, length 1470
00:08:36.942512 IP 10.0.0.1.54396 > 10.0.0.2.5001: UDP, length 1470
00:08:36.954606 IP 10.0.0.1.54396 > 10.0.0.2.5001: UDP, length 1470
00:08:36.966703 IP 10.0.0.1.54396 > 10.0.0.2.5001: UDP, length 1470
00:08:36.978819 IP 10.0.0.1.54396 > 10.0.0.2.5001: UDP, length 1470
00:08:36.990911 IP 10.0.0.1.54396 > 10.0.0.2.5001: UDP, length 1470
00:08:37.003770 IP 10.0.0.1.54396 > 10.0.0.2.5001: UDP, length 1470
00:08:37.015093 IP 10.0.0.1.54396 > 10.0.0.2.5001: UDP, length 1470
00:08:37.027199 IP 10.0.0.1.54396 > 10.0.0.2.5001: UDP, length 1470
00:08:37.039309 IP 10.0.0.1.54396 > 10.0.0.2.5001: UDP, length 1470
00:08:37.051356 IP 10.0.0.1.54396 > 10.0.0.2.5001: UDP, length 1470
00:08:37.063478 IP 10.0.0.1.54396 > 10.0.0.2.5001: UDP, length 1470
00:08:37.075536 IP 10.0.0.1.54396 > 10.0.0.2.5001: UDP, length 1470
00:08:37.087672 IP 10.0.0.1.54396 > 10.0.0.2.5001: UDP, length 1470
00:08:37.099777 IP 10.0.0.1.54396 > 10.0.0.2.5001: UDP, length 1470
00:08:37.111866 IP 10.0.0.1.54396 > 10.0.0.2.5001: UDP, length 1470
00:08:37.124736 IP 10.0.0.1.54396 > 10.0.0.2.5001: UDP, length 1470
00:08:37.136064 IP 10.0.0.1.54396 > 10.0.0.2.5001: UDP, length 1470
00:08:37.148140 IP 10.0.0.1.54396 > 10.0.0.2.5001: UDP, length 1470
00:08:37.161029 IP 10.0.0.1.54396 > 10.0.0.2.5001: UDP, length 1470
00:08:37.172371 IP 10.0.0.1.54396 > 10.0.0.2.5001: UDP, length 1470
00:08:37.184445 IP 10.0.0.1.54396 > 10.0.0.2.5001: UDP, length 1470
00:08:37.197312 IP 10.0.0.1.54396 > 10.0.0.2.5001: UDP, length 1470
00:08:37.208628 IP 10.0.0.1.54396 > 10.0.0.2.5001: UDP, length 1470
00:08:37.220749 IP 10.0.0.1.54396 > 10.0.0.2.5001: UDP, length 1470
00:08:37.232831 IP 10.0.0.1.54396 > 10.0.0.2.5001: UDP, length 1470
00:08:37.244950 IP 10.0.0.1.54396 > 10.0.0.2.5001: UDP, length 1470
00:08:37.257023 IP 10.0.0.1.54396 > 10.0.0.2.5001: UDP, length 1470
00:08:37.269654 IP 10.0.0.1.54396 > 10.0.0.2.5001: UDP, length 1470
00:08:37.281195 IP 10.0.0.1.54396 > 10.0.0.2.5001: UDP, length 1470
00:08:37.293282 IP 10.0.0.1.54396 > 10.0.0.2.5001: UDP, length 1470
00:08:37.306220 IP 10.0.0.1.54396 > 10.0.0.2.5001: UDP, length 1470
00:08:37.317712 IP 10.0.0.1.54396 > 10.0.0.2.5001: UDP, length 1470
00:08:37.329563 IP 10.0.0.1.54396 > 10.0.0.2.5001: UDP, length 1470
00:08:37.341963 IP 10.0.0.1.54396 > 10.0.0.2.5001: UDP, length 1470
00:08:37.353802 IP 10.0.0.1.54396 > 10.0.0.2.5001: UDP, length 1470
00:08:37.365874 IP 10.0.0.1.54396 > 10.0.0.2.5001: UDP, length 1470
00:08:37.378014 IP 10.0.0.1.54396 > 10.0.0.2.5001: UDP, length 1470
00:08:37.390074 IP 10.0.0.1.54396 > 10.0.0.2.5001: UDP, length 1470
00:08:37.402134 IP 10.0.0.1.54396 > 10.0.0.2.5001: UDP, length 1470
00:08:37.414292 IP 10.0.0.1.54396 > 10.0.0.2.5001: UDP, length 1470
00:08:37.426342 IP 10.0.0.1.54396 > 10.0.0.2.5001: UDP, length 1470
00:08:37.439234 IP 10.0.0.1.54396 > 10.0.0.2.5001: UDP, length 1470
00:08:37.450515 IP 10.0.0.1.54396 > 10.0.0.2.5001: UDP, length 1470
00:08:37.462626 IP 10.0.0.1.54396 > 10.0.0.2.5001: UDP, length 1470
00:08:37.475556 IP 10.0.0.1.54396 > 10.0.0.2.5001: UDP, length 1470
00:08:37.486831 IP 10.0.0.1.54396 > 10.0.0.2.5001: UDP, length 1470
00:08:37.499106 IP 10.0.0.1.54396 > 10.0.0.2.5001: UDP, length 1470
00:08:37.511029 IP 10.0.0.1.54396 > 10.0.0.2.5001: UDP, length 1470
00:08:37.523540 IP 10.0.0.1.54396 > 10.0.0.2.5001: UDP, length 1470
00:08:37.535179 IP 10.0.0.1.54396 > 10.0.0.2.5001: UDP, length 1470
00:08:37.547307 IP 10.0.0.1.54396 > 10.0.0.2.5001: UDP, length 1470
00:08:37.559428 IP 10.0.0.1.54396 > 10.0.0.2.5001: UDP, length 1470
00:08:37.572266 IP 10.0.0.1.54396 > 10.0.0.2.5001: UDP, length 1470
00:08:37.583736 IP 10.0.0.1.54396 > 10.0.0.2.5001: UDP, length 1470
00:08:37.595676 IP 10.0.0.1.54396 > 10.0.0.2.5001: UDP, length 1470
00:08:37.607763 IP 10.0.0.1.54396 > 10.0.0.2.5001: UDP, length 1470
00:08:37.619936 IP 10.0.0.1.54396 > 10.0.0.2.5001: UDP, length 1470
00:08:37.631990 IP 10.0.0.1.54396 > 10.0.0.2.5001: UDP, length 1470
00:08:37.644070 IP 10.0.0.1.54396 > 10.0.0.2.5001: UDP, length 1470
00:08:37.656201 IP 10.0.0.1.54396 > 10.0.0.2.5001: UDP, length 1470
00:08:37.668242 IP 10.0.0.1.54396 > 10.0.0.2.5001: UDP, length 1470
00:08:37.692464 IP 10.0.0.1.54396 > 10.0.0.2.5001: UDP, length 1470
00:08:37.704575 IP 10.0.0.1.54396 > 10.0.0.2.5001: UDP, length 1470
00:08:37.716666 IP 10.0.0.1.54396 > 10.0.0.2.5001: UDP, length 1470
00:08:37.728724 IP 10.0.0.1.54396 > 10.0.0.2.5001: UDP, length 1470
00:08:37.741682 IP 10.0.0.1.54396 > 10.0.0.2.5001: UDP, length 1470
00:08:37.752950 IP 10.0.0.1.54396 > 10.0.0.2.5001: UDP, length 1470
00:08:37.765027 IP 10.0.0.1.54396 > 10.0.0.2.5001: UDP, length 1470
00:08:37.777115 IP 10.0.0.1.54396 > 10.0.0.2.5001: UDP, length 1470
00:08:37.789248 IP 10.0.0.1.54396 > 10.0.0.2.5001: UDP, length 1470
00:08:37.801984 IP 10.0.0.1.54396 > 10.0.0.2.5001: UDP, length 1470
00:08:37.813431 IP 10.0.0.1.54396 > 10.0.0.2.5001: UDP, length 1470
00:08:37.825492 IP 10.0.0.1.54396 > 10.0.0.2.5001: UDP, length 1470
00:08:37.837631 IP 10.0.0.1.54396 > 10.0.0.2.5001: UDP, length 1470
00:08:37.849714 IP 10.0.0.1.54396 > 10.0.0.2.5001: UDP, length 1470
00:08:37.861818 IP 10.0.0.1.54396 > 10.0.0.2.5001: UDP, length 1470
00:08:37.873918 IP 10.0.0.1.54396 > 10.0.0.2.5001: UDP, length 1470
00:08:37.886027 IP 10.0.0.1.54396 > 10.0.0.2.5001: UDP, length 1470
00:08:37.898104 IP 10.0.0.1.54396 > 10.0.0.2.5001: UDP, length 1470
00:08:37.910194 IP 10.0.0.1.54396 > 10.0.0.2.5001: UDP, length 1470
00:08:37.923080 IP 10.0.0.1.54396 > 10.0.0.2.5001: UDP, length 1470
00:08:37.934392 IP 10.0.0.1.54396 > 10.0.0.2.5001: UDP, length 1470
00:08:37.946488 IP 10.0.0.1.54396 > 10.0.0.2.5001: UDP, length 1470
00:08:37.958587 IP 10.0.0.1.54396 > 10.0.0.2.5001: UDP, length 1470
00:08:37.970710 IP 10.0.0.1.54396 > 10.0.0.2.5001: UDP, length 1470
00:08:37.982797 IP 10.0.0.1.54396 > 10.0.0.2.5001: UDP, length 1470
00:08:37.994900 IP 10.0.0.1.54396 > 10.0.0.2.5001: UDP, length 1470
00:08:38.006977 IP 10.0.0.1.54396 > 10.0.0.2.5001: UDP, length 1470
00:08:38.019049 IP 10.0.0.1.54396 > 10.0.0.2.5001: UDP, length 1470
00:08:38.031128 IP 10.0.0.1.54396 > 10.0.0.2.5001: UDP, length 1470
00:08:38.043219 IP 10.0.0.1.54396 > 10.0.0.2.5001: UDP, length 1470
00:08:38.055355 IP 10.0.0.1.54396 > 10.0.0.2.5001: UDP, length 1470
00:08:38.067466 IP 10.0.0.1.54396 > 10.0.0.2.5001: UDP, length 1470
00:08:38.079529 IP 10.0.0.1.54396 > 10.0.0.2.5001: UDP, length 1470
00:08:38.091631 IP 10.0.0.1.54396 > 10.0.0.2.5001: UDP, length 1470
00:08:38.103733 IP 10.0.0.1.54396 > 10.0.0.2.5001: UDP, length 1470
00:08:38.115798 IP 10.0.0.1.54396 > 10.0.0.2.5001: UDP, length 1470
00:08:38.128837 IP 10.0.0.1.54396 > 10.0.0.2.5001: UDP, length 1470
00:08:38.140014 IP 10.0.0.1.54396 > 10.0.0.2.5001: UDP, length 1470
00:08:38.152124 IP 10.0.0.1.54396 > 10.0.0.2.5001: UDP, length 1470
00:08:38.165080 IP 10.0.0.1.54396 > 10.0.0.2.5001: UDP, length 1470
00:08:38.176279 IP 10.0.0.1.54396 > 10.0.0.2.5001: UDP, length 1470
00:08:38.188449 IP 10.0.0.1.54396 > 10.0.0.2.5001: UDP, length 1470
00:08:38.200616 IP 10.0.0.1.54396 > 10.0.0.2.5001: UDP, length 1470
00:08:38.224696 IP 10.0.0.1.54396 > 10.0.0.2.5001: UDP, length 1470
00:08:38.237462 IP 10.0.0.1.54396 > 10.0.0.2.5001: UDP, length 1470
00:08:38.248917 IP 10.0.0.1.54396 > 10.0.0.2.5001: UDP, length 1470
00:08:38.260984 IP 10.0.0.1.54396 > 10.0.0.2.5001: UDP, length 1470
00:08:38.273922 IP 10.0.0.1.54396 > 10.0.0.2.5001: UDP, length 1470
00:08:38.285177 IP 10.0.0.1.54396 > 10.0.0.2.5001: UDP, length 1470
00:08:38.297239 IP 10.0.0.1.54396 > 10.0.0.2.5001: UDP, length 1470
00:08:38.309299 IP 10.0.0.1.54396 > 10.0.0.2.5001: UDP, length 1470
00:08:38.321432 IP 10.0.0.1.54396 > 10.0.0.2.5001: UDP, length 1470
00:08:38.333585 IP 10.0.0.1.54396 > 10.0.0.2.5001: UDP, length 1470
00:08:38.346379 IP 10.0.0.1.54396 > 10.0.0.2.5001: UDP, length 1470
00:08:38.357744 IP 10.0.0.1.54396 > 10.0.0.2.5001: UDP, length 1470
00:08:38.369836 IP 10.0.0.1.54396 > 10.0.0.2.5001: UDP, length 1470
00:08:38.381961 IP 10.0.0.1.54396 > 10.0.0.2.5001: UDP, length 1470
00:08:38.394022 IP 10.0.0.1.54396 > 10.0.0.2.5001: UDP, length 1470
00:08:38.406127 IP 10.0.0.1.54396 > 10.0.0.2.5001: UDP, length 1470
00:08:38.418199 IP 10.0.0.1.54396 > 10.0.0.2.5001: UDP, length 1470
00:08:38.430359 IP 10.0.0.1.54396 > 10.0.0.2.5001: UDP, length 1470
00:08:38.442420 IP 10.0.0.1.54396 > 10.0.0.2.5001: UDP, length 1470
00:08:38.454459 IP 10.0.0.1.54396 > 10.0.0.2.5001: UDP, length 1470
00:08:38.466535 IP 10.0.0.1.54396 > 10.0.0.2.5001: UDP, length 1470
00:08:38.478667 IP 10.0.0.1.54396 > 10.0.0.2.5001: UDP, length 1470
00:08:38.490766 IP 10.0.0.1.54396 > 10.0.0.2.5001: UDP, length 1470
00:08:38.502897 IP 10.0.0.1.54396 > 10.0.0.2.5001: UDP, length 1470
00:08:38.515009 IP 10.0.0.1.54396 > 10.0.0.2.5001: UDP, length 1470
00:08:38.527127 IP 10.0.0.1.54396 > 10.0.0.2.5001: UDP, length 1470
00:08:38.539197 IP 10.0.0.1.54396 > 10.0.0.2.5001: UDP, length 1470
00:08:38.551234 IP 10.0.0.1.54396 > 10.0.0.2.5001: UDP, length 1470
00:08:38.563402 IP 10.0.0.1.54396 > 10.0.0.2.5001: UDP, length 1470
00:08:38.575453 IP 10.0.0.1.54396 > 10.0.0.2.5001: UDP, length 1470
00:08:38.587575 IP 10.0.0.1.54396 > 10.0.0.2.5001: UDP, length 1470
00:08:38.599646 IP 10.0.0.1.54396 > 10.0.0.2.5001: UDP, length 1470
00:08:38.611764 IP 10.0.0.1.54396 > 10.0.0.2.5001: UDP, length 1470
00:08:38.624011 IP 10.0.0.1.54396 > 10.0.0.2.5001: UDP, length 1470
00:08:38.635933 IP 10.0.0.1.54396 > 10.0.0.2.5001: UDP, length 1470
00:08:38.648062 IP 10.0.0.1.54396 > 10.0.0.2.5001: UDP, length 1470
00:08:38.660133 IP 10.0.0.1.54396 > 10.0.0.2.5001: UDP, length 1470
00:08:38.672204 IP 10.0.0.1.54396 > 10.0.0.2.5001: UDP, length 1470
00:08:38.684347 IP 10.0.0.1.54396 > 10.0.0.2.5001: UDP, length 1470
00:08:38.696414 IP 10.0.0.1.54396 > 10.0.0.2.5001: UDP, length 1470
00:08:38.708550 IP 10.0.0.1.54396 > 10.0.0.2.5001: UDP, length 1470
00:08:38.720731 IP 10.0.0.1.54396 > 10.0.0.2.5001: UDP, length 1470
00:08:38.732730 IP 10.0.0.1.54396 > 10.0.0.2.5001: UDP, length 1470
00:08:38.744794 IP 10.0.0.1.54396 > 10.0.0.2.5001: UDP, length 1470
00:08:38.756867 IP 10.0.0.1.54396 > 10.0.0.2.5001: UDP, length 1470
00:08:38.769008 IP 10.0.0.1.54396 > 10.0.0.2.5001: UDP, length 1470
00:08:38.781118 IP 10.0.0.1.54396 > 10.0.0.2.5001: UDP, length 1470
00:08:38.793172 IP 10.0.0.1.54396 > 10.0.0.2.5001: UDP, length 1470
00:08:38.805279 IP 10.0.0.1.54396 > 10.0.0.2.5001: UDP, length 1470
00:08:38.817430 IP 10.0.0.1.54396 > 10.0.0.2.5001: UDP, length 1470
00:08:38.829494 IP 10.0.0.1.54396 > 10.0.0.2.5001: UDP, length 1470
00:08:38.841587 IP 10.0.0.1.54396 > 10.0.0.2.5001: UDP, length 1470
00:08:38.853706 IP 10.0.0.1.54396 > 10.0.0.2.5001: UDP, length 1470
00:08:38.865764 IP 10.0.0.1.54396 > 10.0.0.2.5001: UDP, length 1470
00:08:38.878640 IP 10.0.0.1.54396 > 10.0.0.2.5001: UDP, length 1470
00:08:38.889983 IP 10.0.0.1.54396 > 10.0.0.2.5001: UDP, length 1470
00:08:38.902113 IP 10.0.0.1.54396 > 10.0.0.2.5001: UDP, length 1470
00:08:38.914150 IP 10.0.0.1.54396 > 10.0.0.2.5001: UDP, length 1470
00:08:38.926255 IP 10.0.0.1.54396 > 10.0.0.2.5001: UDP, length 1470
00:08:38.938355 IP 10.0.0.1.54396 > 10.0.0.2.5001: UDP, length 1470
00:08:38.950418 IP 10.0.0.1.54396 > 10.0.0.2.5001: UDP, length 1470
00:08:38.963329 IP 10.0.0.1.54396 > 10.0.0.2.5001: UDP, length 1470
00:08:38.974636 IP 10.0.0.1.54396 > 10.0.0.2.5001: UDP, length 1470
00:08:38.986746 IP 10.0.0.1.54396 > 10.0.0.2.5001: UDP, length 1470
00:08:38.999855 IP 10.0.0.1.54396 > 10.0.0.2.5001: UDP, length 1470
00:08:39.010938 IP 10.0.0.1.54396 > 10.0.0.2.5001: UDP, length 1470
00:08:39.023011 IP 10.0.0.1.54396 > 10.0.0.2.5001: UDP, length 1470
00:08:39.035125 IP 10.0.0.1.54396 > 10.0.0.2.5001: UDP, length 1470
00:08:39.047235 IP 10.0.0.1.54396 > 10.0.0.2.5001: UDP, length 1470
00:08:39.059306 IP 10.0.0.1.54396 > 10.0.0.2.5001: UDP, length 1470
00:08:39.072197 IP 10.0.0.1.54396 > 10.0.0.2.5001: UDP, length 1470
00:08:39.083516 IP 10.0.0.1.54396 > 10.0.0.2.5001: UDP, length 1470
00:08:39.096437 IP 10.0.0.1.54396 > 10.0.0.2.5001: UDP, length 1470
00:08:39.107684 IP 10.0.0.1.54396 > 10.0.0.2.5001: UDP, length 1470
00:08:39.119798 IP 10.0.0.1.54396 > 10.0.0.2.5001: UDP, length 1470
00:08:39.131891 IP 10.0.0.1.54396 > 10.0.0.2.5001: UDP, length 1470
00:08:39.143982 IP 10.0.0.1.54396 > 10.0.0.2.5001: UDP, length 1470
00:08:39.156090 IP 10.0.0.1.54396 > 10.0.0.2.5001: UDP, length 1470
00:08:39.168151 IP 10.0.0.1.54396 > 10.0.0.2.5001: UDP, length 1470
00:08:39.180290 IP 10.0.0.1.54396 > 10.0.0.2.5001: UDP, length 1470
00:08:39.192382 IP 10.0.0.1.54396 > 10.0.0.2.5001: UDP, length 1470
00:08:39.204493 IP 10.0.0.1.54396 > 10.0.0.2.5001: UDP, length 1470
00:08:39.216564 IP 10.0.0.1.54396 > 10.0.0.2.5001: UDP, length 1470
00:08:39.229441 IP 10.0.0.1.54396 > 10.0.0.2.5001: UDP, length 1470
00:08:39.240761 IP 10.0.0.1.54396 > 10.0.0.2.5001: UDP, length 1470
00:08:39.252860 IP 10.0.0.1.54396 > 10.0.0.2.5001: UDP, length 1470
00:08:39.264961 IP 10.0.0.1.54396 > 10.0.0.2.5001: UDP, length 1470
00:08:39.277053 IP 10.0.0.1.54396 > 10.0.0.2.5001: UDP, length 1470
00:08:39.289127 IP 10.0.0.1.54396 > 10.0.0.2.5001: UDP, length 1470
00:08:39.313300 IP 10.0.0.1.54396 > 10.0.0.2.5001: UDP, length 1470
00:08:39.325386 IP 10.0.0.1.54396 > 10.0.0.2.5001: UDP, length 1470
00:08:39.337504 IP 10.0.0.1.54396 > 10.0.0.2.5001: UDP, length 1470
00:08:39.349626 IP 10.0.0.1.54396 > 10.0.0.2.5001: UDP, length 1470
00:08:39.361680 IP 10.0.0.1.54396 > 10.0.0.2.5001: UDP, length 1470
00:08:39.373774 IP 10.0.0.1.54396 > 10.0.0.2.5001: UDP, length 1470
00:08:39.385875 IP 10.0.0.1.54396 > 10.0.0.2.5001: UDP, length 1470
00:08:39.398786 IP 10.0.0.1.54396 > 10.0.0.2.5001: UDP, length 1470
00:08:39.410102 IP 10.0.0.1.54396 > 10.0.0.2.5001: UDP, length 1470
00:08:39.422205 IP 10.0.0.1.54396 > 10.0.0.2.5001: UDP, length 1470
00:08:39.434290 IP 10.0.0.1.54396 > 10.0.0.2.5001: UDP, length 1470
00:08:39.446387 IP 10.0.0.1.54396 > 10.0.0.2.5001: UDP, length 1470
00:08:39.458494 IP 10.0.0.1.54396 > 10.0.0.2.5001: UDP, length 1470
00:08:39.471418 IP 10.0.0.1.54396 > 10.0.0.2.5001: UDP, length 1470
00:08:39.482637 IP 10.0.0.1.54396 > 10.0.0.2.5001: UDP, length 1470
00:08:39.494991 IP 10.0.0.1.54396 > 10.0.0.2.5001: UDP, length 1470
00:08:39.506863 IP 10.0.0.1.54396 > 10.0.0.2.5001: UDP, length 1470
00:08:39.519838 IP 10.0.0.1.54396 > 10.0.0.2.5001: UDP, length 1470
00:08:39.531071 IP 10.0.0.1.54396 > 10.0.0.2.5001: UDP, length 1470
00:08:39.543139 IP 10.0.0.1.54396 > 10.0.0.2.5001: UDP, length 1470
00:08:39.555230 IP 10.0.0.1.54396 > 10.0.0.2.5001: UDP, length 1470
00:08:39.567337 IP 10.0.0.1.54396 > 10.0.0.2.5001: UDP, length 1470
00:08:39.579462 IP 10.0.0.1.54396 > 10.0.0.2.5001: UDP, length 1470
00:08:39.591537 IP 10.0.0.1.54396 > 10.0.0.2.5001: UDP, length 1470
00:08:39.603622 IP 10.0.0.1.54396 > 10.0.0.2.5001: UDP, length 1470
00:08:39.616573 IP 10.0.0.1.54396 > 10.0.0.2.5001: UDP, length 1470
00:08:39.627821 IP 10.0.0.1.54396 > 10.0.0.2.5001: UDP, length 1470
00:08:39.639967 IP 10.0.0.1.54396 > 10.0.0.2.5001: UDP, length 1470
00:08:39.652034 IP 10.0.0.1.54396 > 10.0.0.2.5001: UDP, length 1470
00:08:39.664253 IP 10.0.0.1.54396 > 10.0.0.2.5001: UDP, length 1470
00:08:39.676215 IP 10.0.0.1.54396 > 10.0.0.2.5001: UDP, length 1470
00:08:39.688922 IP 10.0.0.1.54396 > 10.0.0.2.5001: UDP, length 1470
00:08:39.700368 IP 10.0.0.1.54396 > 10.0.0.2.5001: UDP, length 1470
00:08:39.712513 IP 10.0.0.1.54396 > 10.0.0.2.5001: UDP, length 1470
00:08:39.724614 IP 10.0.0.1.54396 > 10.0.0.2.5001: UDP, length 1470
00:08:39.736712 IP 10.0.0.1.54396 > 10.0.0.2.5001: UDP, length 1470
00:08:39.748802 IP 10.0.0.1.54396 > 10.0.0.2.5001: UDP, length 1470
00:08:39.760888 IP 10.0.0.1.54396 > 10.0.0.2.5001: UDP, length 1470
00:08:39.785090 IP 10.0.0.1.54396 > 10.0.0.2.5001: UDP, length 1470
00:08:39.797173 IP 10.0.0.1.54396 > 10.0.0.2.5001: UDP, length 1470
00:08:39.809251 IP 10.0.0.1.54396 > 10.0.0.2.5001: UDP, length 1470
00:08:39.821372 IP 10.0.0.1.54396 > 10.0.0.2.5001: UDP, length 1470
00:08:39.833457 IP 10.0.0.1.54396 > 10.0.0.2.5001: UDP, length 1470
00:08:39.845587 IP 10.0.0.1.54396 > 10.0.0.2.5001: UDP, length 1470
00:08:39.857648 IP 10.0.0.1.54396 > 10.0.0.2.5001: UDP, length 1470
00:08:39.869783 IP 10.0.0.1.54396 > 10.0.0.2.5001: UDP, length 1470
00:08:39.881844 IP 10.0.0.1.54396 > 10.0.0.2.5001: UDP, length 1470
00:08:39.893945 IP 10.0.0.1.54396 > 10.0.0.2.5001: UDP, length 1470
00:08:39.906852 IP 10.0.0.1.54396 > 10.0.0.2.5001: UDP, length 1470
00:08:39.918105 IP 10.0.0.1.54396 > 10.0.0.2.5001: UDP, length 1470
00:08:39.930198 IP 10.0.0.1.54396 > 10.0.0.2.5001: UDP, length 1470
00:08:39.942524 IP 10.0.0.1.54396 > 10.0.0.2.5001: UDP, length 1470
00:08:39.954378 IP 10.0.0.1.54396 > 10.0.0.2.5001: UDP, length 1470
00:08:39.966780 IP 10.0.0.1.54396 > 10.0.0.2.5001: UDP, length 1470
00:08:39.979483 IP 10.0.0.1.54396 > 10.0.0.2.5001: UDP, length 1470
00:08:39.990713 IP 10.0.0.1.54396 > 10.0.0.2.5001: UDP, length 1470
00:08:40.003590 IP 10.0.0.1.54396 > 10.0.0.2.5001: UDP, length 1470
00:08:40.014890 IP 10.0.0.1.54396 > 10.0.0.2.5001: UDP, length 1470
00:08:40.027037 IP 10.0.0.1.54396 > 10.0.0.2.5001: UDP, length 1470
00:08:40.039119 IP 10.0.0.1.54396 > 10.0.0.2.5001: UDP, length 1470
00:08:40.051720 IP 10.0.0.1.54396 > 10.0.0.2.5001: UDP, length 1470
00:08:40.063294 IP 10.0.0.1.54396 > 10.0.0.2.5001: UDP, length 1470
00:08:40.075347 IP 10.0.0.1.54396 > 10.0.0.2.5001: UDP, length 1470
00:08:40.087491 IP 10.0.0.1.54396 > 10.0.0.2.5001: UDP, length 1470
00:08:40.099591 IP 10.0.0.1.54396 > 10.0.0.2.5001: UDP, length 1470
00:08:40.111697 IP 10.0.0.1.54396 > 10.0.0.2.5001: UDP, length 1470
00:08:40.123770 IP 10.0.0.1.54396 > 10.0.0.2.5001: UDP, length 1470
00:08:40.135862 IP 10.0.0.1.54396 > 10.0.0.2.5001: UDP, length 1470
00:08:40.147969 IP 10.0.0.1.54396 > 10.0.0.2.5001: UDP, length 1470
00:08:40.160074 IP 10.0.0.1.54396 > 10.0.0.2.5001: UDP, length 1470
00:08:40.172158 IP 10.0.0.1.54396 > 10.0.0.2.5001: UDP, length 1470
00:08:40.184256 IP 10.0.0.1.54396 > 10.0.0.2.5001: UDP, length 1470
00:08:40.196317 IP 10.0.0.1.54396 > 10.0.0.2.5001: UDP, length 1470
00:08:40.208423 IP 10.0.0.1.54396 > 10.0.0.2.5001: UDP, length 1470
00:08:40.220571 IP 10.0.0.1.54396 > 10.0.0.2.5001: UDP, length 1470
00:08:40.232624 IP 10.0.0.1.54396 > 10.0.0.2.5001: UDP, length 1470
00:08:40.244762 IP 10.0.0.1.54396 > 10.0.0.2.5001: UDP, length 1470
00:08:40.256823 IP 10.0.0.1.54396 > 10.0.0.2.5001: UDP, length 1470
00:08:40.290638 IP 10.0.0.1.54396 > 10.0.0.2.5001: UDP, length 1470
00:08:40.290727 IP 10.0.0.1.54396 > 10.0.0.2.5001: UDP, length 1470
00:08:40.302094 IP 10.0.0.1.54396 > 10.0.0.2.5001: UDP, length 1470
00:08:40.314071 IP 10.0.0.1.54396 > 10.0.0.2.5001: UDP, length 1470

