00:08:57.167770 IP 10.0.0.1.37380 > 10.0.0.2.5001: UDP, length 1470
00:08:57.167792 IP 10.0.0.1.37380 > 10.0.0.2.5001: UDP, length 1470
00:08:57.179209 IP 10.0.0.1.37380 > 10.0.0.2.5001: UDP, length 1470
00:08:57.191272 IP 10.0.0.1.37380 > 10.0.0.2.5001: UDP, length 1470
00:08:57.203414 IP 10.0.0.1.37380 > 10.0.0.2.5001: UDP, length 1470
00:08:57.215480 IP 10.0.0.1.37380 > 10.0.0.2.5001: UDP, length 1470
00:08:57.227576 IP 10.0.0.1.37380 > 10.0.0.2.5001: UDP, length 1470
00:08:57.239657 IP 10.0.0.1.37380 > 10.0.0.2.5001: UDP, length 1470
00:08:57.251809 IP 10.0.0.1.37380 > 10.0.0.2.5001: UDP, length 1470
00:08:57.263874 IP 10.0.0.1.37380 > 10.0.0.2.5001: UDP, length 1470
00:08:57.276747 IP 10.0.0.1.37380 > 10.0.0.2.5001: UDP, length 1470
00:08:57.288075 IP 10.0.0.1.37380 > 10.0.0.2.5001: UDP, length 1470
00:08:57.300141 IP 10.0.0.1.37380 > 10.0.0.2.5001: UDP, length 1470
00:08:57.312284 IP 10.0.0.1.37380 > 10.0.0.2.5001: UDP, length 1470
00:08:57.324352 IP 10.0.0.1.37380 > 10.0.0.2.5001: UDP, length 1470
00:08:57.336444 IP 10.0.0.1.37380 > 10.0.0.2.5001: UDP, length 1470
00:08:57.348536 IP 10.0.0.1.37380 > 10.0.0.2.5001: UDP, length 1470
00:08:57.360819 IP 10.0.0.1.37380 > 10.0.0.2.5001: UDP, length 1470
00:08:57.372750 IP 10.0.0.1.37380 > 10.0.0.2.5001: UDP, length 1470
00:08:57.385689 IP 10.0.0.1.37380 > 10.0.0.2.5001: UDP, length 1470
00:08:57.396929 IP 10.0.0.1.37380 > 10.0.0.2.5001: UDP, length 1470
00:08:57.409021 IP 10.0.0.1.37380 > 10.0.0.2.5001: UDP, length 1470
00:08:57.422052 IP 10.0.0.1.37380 > 10.0.0.2.5001: UDP, length 1470
00:08:57.433223 IP 10.0.0.1.37380 > 10.0.0.2.5001: UDP, length 1470
00:08:57.445306 IP 10.0.0.1.37380 > 10.0.0.2.5001: UDP, length 1470
00:08:57.457410 IP 10.0.0.1.37380 > 10.0.0.2.5001: UDP, length 1470
00:08:57.469510 IP 10.0.0.1.37380 > 10.0.0.2.5001: UDP, length 1470
00:08:57.481592 IP 10.0.0.1.37380 > 10.0.0.2.5001: UDP, length 1470
00:08:57.493697 IP 10.0.0.1.37380 > 10.0.0.2.5001: UDP, length 1470
00:08:57.505796 IP 10.0.0.1.37380 > 10.0.0.2.5001: UDP, length 1470
00:08:57.517883 IP 10.0.0.1.37380 > 10.0.0.2.5001: UDP, length 1470
00:08:57.529987 IP 10.0.0.1.37380 > 10.0.0.2.5001: UDP, length 1470
00:08:57.542077 IP 10.0.0.1.37380 > 10.0.0.2.5001: UDP, length 1470
00:08:57.554909 IP 10.0.0.1.37380 > 10.0.0.2.5001: UDP, length 1470
00:08:57.566260 IP 10.0.0.1.37380 > 10.0.0.2.5001: UDP, length 1470
00:08:57.578351 IP 10.0.0.1.37380 > 10.0.0.2.5001: UDP, length 1470
00:08:57.590465 IP 10.0.0.1.37380 > 10.0.0.2.5001: UDP, length 1470
00:08:57.602555 IP 10.0.0.1.37380 > 10.0.0.2.5001: UDP, length 1470
00:08:57.614652 IP 10.0.0.1.37380 > 10.0.0.2.5001: UDP, length 1470
00:08:57.626744 IP 10.0.0.1.37380 > 10.0.0.2.5001: UDP, length 1470
00:08:57.638837 IP 10.0.0.1.37380 > 10.0.0.2.5001: UDP, length 1470
00:08:57.650940 IP 10.0.0.1.37380 > 10.0.0.2.5001: UDP, length 1470
00:08:57.663032 IP 10.0.0.1.37380 > 10.0.0.2.5001: UDP, length 1470
00:08:57.675136 IP 10.0.0.1.37380 > 10.0.0.2.5001: UDP, length 1470
00:08:57.687229 IP 10.0.0.1.37380 > 10.0.0.2.5001: UDP, length 1470
00:08:57.699347 IP 10.0.0.1.37380 > 10.0.0.2.5001: UDP, length 1470
00:08:57.711425 IP 10.0.0.1.37380 > 10.0.0.2.5001: UDP, length 1470
00:08:57.723520 IP 10.0.0.1.37380 > 10.0.0.2.5001: UDP, length 1470
00:08:57.735613 IP 10.0.0.1.37380 > 10.0.0.2.5001: UDP, length 1470
00:08:57.747714 IP 10.0.0.1.37380 > 10.0.0.2.5001: UDP, length 1470
00:08:57.759811 IP 10.0.0.1.37380 > 10.0.0.2.5001: UDP, length 1470
00:08:57.771907 IP 10.0.0.1.37380 > 10.0.0.2.5001: UDP, length 1470
00:08:57.784005 IP 10.0.0.1.37380 > 10.0.0.2.5001: UDP, length 1470
00:08:57.796100 IP 10.0.0.1.37380 > 10.0.0.2.5001: UDP, length 1470
00:08:57.808188 IP 10.0.0.1.37380 > 10.0.0.2.5001: UDP, length 1470
00:08:57.820285 IP 10.0.0.1.37380 > 10.0.0.2.5001: UDP, length 1470
00:08:57.832976 IP 10.0.0.1.37380 > 10.0.0.2.5001: UDP, length 1470
00:08:57.844525 IP 10.0.0.1.37380 > 10.0.0.2.5001: UDP, length 1470
00:08:57.856568 IP 10.0.0.1.37380 > 10.0.0.2.5001: UDP, length 1470
00:08:57.868679 IP 10.0.0.1.37380 > 10.0.0.2.5001: UDP, length 1470
00:08:57.880771 IP 10.0.0.1.37380 > 10.0.0.2.5001: UDP, length 1470
00:08:57.892863 IP 10.0.0.1.37380 > 10.0.0.2.5001: UDP, length 1470
00:08:57.904963 IP 10.0.0.1.37380 > 10.0.0.2.5001: UDP, length 1470
00:08:57.917058 IP 10.0.0.1.37380 > 10.0.0.2.5001: UDP, length 1470
00:08:57.929149 IP 10.0.0.1.37380 > 10.0.0.2.5001: UDP, length 1470
00:08:57.941240 IP 10.0.0.1.37380 > 10.0.0.2.5001: UDP, length 1470
00:08:57.953330 IP 10.0.0.1.37380 > 10.0.0.2.5001: UDP, length 1470
00:08:57.965449 IP 10.0.0.1.37380 > 10.0.0.2.5001: UDP, length 1470
00:08:57.977543 IP 10.0.0.1.37380 > 10.0.0.2.5001: UDP, length 1470
00:08:57.989617 IP 10.0.0.1.37380 > 10.0.0.2.5001: UDP, length 1470
00:08:58.001739 IP 10.0.0.1.37380 > 10.0.0.2.5001: UDP, length 1470
00:08:58.013816 IP 10.0.0.1.37380 > 10.0.0.2.5001: UDP, length 1470
00:08:58.025921 IP 10.0.0.1.37380 > 10.0.0.2.5001: UDP, length 1470
00:08:58.038040 IP 10.0.0.1.37380 > 10.0.0.2.5001: UDP, length 1470
00:08:58.050120 IP 10.0.0.1.37380 > 10.0.0.2.5001: UDP, length 1470
00:08:58.062206 IP 10.0.0.1.37380 > 10.0.0.2.5001: UDP, length 1470
00:08:58.074301 IP 10.0.0.1.37380 > 10.0.0.2.5001: UDP, length 1470
00:08:58.086397 IP 10.0.0.1.37380 > 10.0.0.2.5001: UDP, length 1470
00:08:58.098494 IP 10.0.0.1.37380 > 10.0.0.2.5001: UDP, length 1470
00:08:58.110618 IP 10.0.0.1.37380 > 10.0.0.2.5001: UDP, length 1470
00:08:58.122690 IP 10.0.0.1.37380 > 10.0.0.2.5001: UDP, length 1470
00:08:58.134782 IP 10.0.0.1.37380 > 10.0.0.2.5001: UDP, length 1470
00:08:58.146881 IP 10.0.0.1.37380 > 10.0.0.2.5001: UDP, length 1470
00:08:58.158998 IP 10.0.0.1.37380 > 10.0.0.2.5001: UDP, length 1470
00:08:58.171096 IP 10.0.0.1.37380 > 10.0.0.2.5001: UDP, length 1470
00:08:58.183155 IP 10.0.0.1.37380 > 10.0.0.2.5001: UDP, length 1470
00:08:58.195271 IP 10.0.0.1.37380 > 10.0.0.2.5001: UDP, length 1470
00:08:58.207357 IP 10.0.0.1.37380 > 10.0.0.2.5001: UDP, length 1470
00:08:58.219486 IP 10.0.0.1.37380 > 10.0.0.2.5001: UDP, length 1470
00:08:58.231562 IP 10.0.0.1.37380 > 10.0.0.2.5001: UDP, length 1470
00:08:58.243659 IP 10.0.0.1.37380 > 10.0.0.2.5001: UDP, length 1470
00:08:58.256531 IP 10.0.0.1.37380 > 10.0.0.2.5001: UDP, length 1470
00:08:58.267858 IP 10.0.0.1.37380 > 10.0.0.2.5001: UDP, length 1470
00:08:58.279936 IP 10.0.0.1.37380 > 10.0.0.2.5001: UDP, length 1470
00:08:58.292035 IP 10.0.0.1.37380 > 10.0.0.2.5001: UDP, length 1470
00:08:58.304154 IP 10.0.0.1.37380 > 10.0.0.2.5001: UDP, length 1470
00:08:58.316225 IP 10.0.0.1.37380 > 10.0.0.2.5001: UDP, length 1470
00:08:58.328775 IP 10.0.0.1.37380 > 10.0.0.2.5001: UDP, length 1470
00:08:58.340415 IP 10.0.0.1.37380 > 10.0.0.2.5001: UDP, length 1470
00:08:58.352510 IP 10.0.0.1.37380 > 10.0.0.2.5001: UDP, length 1470
00:08:58.364652 IP 10.0.0.1.37380 > 10.0.0.2.5001: UDP, length 1470
00:08:58.376718 IP 10.0.0.1.37380 > 10.0.0.2.5001: UDP, length 1470
00:08:58.388797 IP 10.0.0.1.37380 > 10.0.0.2.5001: UDP, length 1470
00:08:58.400922 IP 10.0.0.1.37380 > 10.0.0.2.5001: UDP, length 1470
00:08:58.412999 IP 10.0.0.1.37380 > 10.0.0.2.5001: UDP, length 1470
00:08:58.425086 IP 10.0.0.1.37380 > 10.0.0.2.5001: UDP, length 1470
00:08:58.437173 IP 10.0.0.1.37380 > 10.0.0.2.5001: UDP, length 1470
00:08:58.449282 IP 10.0.0.1.37380 > 10.0.0.2.5001: UDP, length 1470
00:08:58.461374 IP 10.0.0.1.37380 > 10.0.0.2.5001: UDP, length 1470
00:08:58.473470 IP 10.0.0.1.37380 > 10.0.0.2.5001: UDP, length 1470
00:08:58.485594 IP 10.0.0.1.37380 > 10.0.0.2.5001: UDP, length 1470
00:08:58.497657 IP 10.0.0.1.37380 > 10.0.0.2.5001: UDP, length 1470
00:08:58.509775 IP 10.0.0.1.37380 > 10.0.0.2.5001: UDP, length 1470
00:08:58.521858 IP 10.0.0.1.37380 > 10.0.0.2.5001: UDP, length 1470
00:08:58.533948 IP 10.0.0.1.37380 > 10.0.0.2.5001: UDP, length 1470
00:08:58.546051 IP 10.0.0.1.37380 > 10.0.0.2.5001: UDP, length 1470
00:08:58.558896 IP 10.0.0.1.37380 > 10.0.0.2.5001: UDP, length 1470
00:08:58.570242 IP 10.0.0.1.37380 > 10.0.0.2.5001: UDP, length 1470
00:08:58.582333 IP 10.0.0.1.37380 > 10.0.0.2.5001: UDP, length 1470
00:08:58.594442 IP 10.0.0.1.37380 > 10.0.0.2.5001: UDP, length 1470
00:08:58.606530 IP 10.0.0.1.37380 > 10.0.0.2.5001: UDP, length 1470
00:08:58.618650 IP 10.0.0.1.37380 > 10.0.0.2.5001: UDP, length 1470
00:08:58.630721 IP 10.0.0.1.37380 > 10.0.0.2.5001: UDP, length 1470
00:08:58.642807 IP 10.0.0.1.37380 > 10.0.0.2.5001: UDP, length 1470
00:08:58.654910 IP 10.0.0.1.37380 > 10.0.0.2.5001: UDP, length 1470
00:08:58.667004 IP 10.0.0.1.37380 > 10.0.0.2.5001: UDP, length 1470
00:08:58.679878 IP 10.0.0.1.37380 > 10.0.0.2.5001: UDP, length 1470
00:08:58.691200 IP 10.0.0.1.37380 > 10.0.0.2.5001: UDP, length 1470
00:08:58.704055 IP 10.0.0.1.37380 > 10.0.0.2.5001: UDP, length 1470
00:08:58.715389 IP 10.0.0.1.37380 > 10.0.0.2.5001: UDP, length 1470
00:08:58.727480 IP 10.0.0.1.37380 > 10.0.0.2.5001: UDP, length 1470
00:08:58.739593 IP 10.0.0.1.37380 > 10.0.0.2.5001: UDP, length 1470
00:08:58.751698 IP 10.0.0.1.37380 > 10.0.0.2.5001: UDP, length 1470
00:08:58.763771 IP 10.0.0.1.37380 > 10.0.0.2.5001: UDP, length 1470
00:08:58.775883 IP 10.0.0.1.37380 > 10.0.0.2.5001: UDP, length 1470
00:08:58.787969 IP 10.0.0.1.37380 > 10.0.0.2.5001: UDP, length 1470
00:08:58.800061 IP 10.0.0.1.37380 > 10.0.0.2.5001: UDP, length 1470
00:08:58.812161 IP 10.0.0.1.37380 > 10.0.0.2.5001: UDP, length 1470
00:08:58.825015 IP 10.0.0.1.37380 > 10.0.0.2.5001: UDP, length 1470
00:08:58.836353 IP 10.0.0.1.37380 > 10.0.0.2.5001: UDP, length 1470
00:08:58.848446 IP 10.0.0.1.37380 > 10.0.0.2.5001: UDP, length 1470
00:08:58.860557 IP 10.0.0.1.37380 > 10.0.0.2.5001: UDP, length 1470
00:08:58.872635 IP 10.0.0.1.37380 > 10.0.0.2.5001: UDP, length 1470
00:08:58.884737 IP 10.0.0.1.37380 > 10.0.0.2.5001: UDP, length 1470
00:08:58.897567 IP 10.0.0.1.37380 > 10.0.0.2.5001: UDP, length 1470
00:08:58.908923 IP 10.0.0.1.37380 > 10.0.0.2.5001: UDP, length 1470
00:08:58.921013 IP 10.0.0.1.37380 > 10.0.0.2.5001: UDP, length 1470
00:08:58.933113 IP 10.0.0.1.37380 > 10.0.0.2.5001: UDP, length 1470
00:08:58.945202 IP 10.0.0.1.37380 > 10.0.0.2.5001: UDP, length 1470
00:08:58.957309 IP 10.0.0.1.37380 > 10.0.0.2.5001: UDP, length 1470
00:08:58.969426 IP 10.0.0.1.37380 > 10.0.0.2.5001: UDP, length 1470
00:08:58.981501 IP 10.0.0.1.37380 > 10.0.0.2.5001: UDP, length 1470
00:08:58.993596 IP 10.0.0.1.37380 > 10.0.0.2.5001: UDP, length 1470
00:08:59.005687 IP 10.0.0.1.37380 > 10.0.0.2.5001: UDP, length 1470
00:08:59.017802 IP 10.0.0.1.37380 > 10.0.0.2.5001: UDP, length 1470
00:08:59.029885 IP 10.0.0.1.37380 > 10.0.0.2.5001: UDP, length 1470
00:08:59.041995 IP 10.0.0.1.37380 > 10.0.0.2.5001: UDP, length 1470
00:08:59.054062 IP 10.0.0.1.37380 > 10.0.0.2.5001: UDP, length 1470
00:08:59.066184 IP 10.0.0.1.37380 > 10.0.0.2.5001: UDP, length 1470
00:08:59.078260 IP 10.0.0.1.37380 > 10.0.0.2.5001: UDP, length 1470
00:08:59.091179 IP 10.0.0.1.37380 > 10.0.0.2.5001: UDP, length 1470
00:08:59.102459 IP 10.0.0.1.37380 > 10.0.0.2.5001: UDP, length 1470
00:08:59.114557 IP 10.0.0.1.37380 > 10.0.0.2.5001: UDP, length 1470
00:08:59.127606 IP 10.0.0.1.37380 > 10.0.0.2.5001: UDP, length 1470
00:08:59.138752 IP 10.0.0.1.37380 > 10.0.0.2.5001: UDP, length 1470
00:08:59.150885 IP 10.0.0.1.37380 > 10.0.0.2.5001: UDP, length 1470
00:08:59.162942 IP 10.0.0.1.37380 > 10.0.0.2.5001: UDP, length 1470
00:08:59.175035 IP 10.0.0.1.37380 > 10.0.0.2.5001: UDP, length 1470
00:08:59.187153 IP 10.0.0.1.37380 > 10.0.0.2.5001: UDP, length 1470
00:08:59.199226 IP 10.0.0.1.37380 > 10.0.0.2.5001: UDP, length 1470
00:08:59.211325 IP 10.0.0.1.37380 > 10.0.0.2.5001: UDP, length 1470
00:08:59.223420 IP 10.0.0.1.37380 > 10.0.0.2.5001: UDP, length 1470
00:08:59.235514 IP 10.0.0.1.37380 > 10.0.0.2.5001: UDP, length 1470
00:08:59.247648 IP 10.0.0.1.37380 > 10.0.0.2.5001: UDP, length 1470
00:08:59.259703 IP 10.0.0.1.37380 > 10.0.0.2.5001: UDP, length 1470
00:08:59.271807 IP 10.0.0.1.37380 > 10.0.0.2.5001: UDP, length 1470
00:08:59.283901 IP 10.0.0.1.37380 > 10.0.0.2.5001: UDP, length 1470
00:08:59.296013 IP 10.0.0.1.37380 > 10.0.0.2.5001: UDP, length 1470
00:08:59.308119 IP 10.0.0.1.37380 > 10.0.0.2.5001: UDP, length 1470
00:08:59.320191 IP 10.0.0.1.37380 > 10.0.0.2.5001: UDP, length 1470
00:08:59.332289 IP 10.0.0.1.37380 > 10.0.0.2.5001: UDP, length 1470
00:08:59.344405 IP 10.0.0.1.37380 > 10.0.0.2.5001: UDP, length 1470
00:08:59.357147 IP 10.0.0.1.37380 > 10.0.0.2.5001: UDP, length 1470
00:08:59.368590 IP 10.0.0.1.37380 > 10.0.0.2.5001: UDP, length 1470
00:08:59.380680 IP 10.0.0.1.37380 > 10.0.0.2.5001: UDP, length 1470
00:08:59.392769 IP 10.0.0.1.37380 > 10.0.0.2.5001: UDP, length 1470
00:08:59.404862 IP 10.0.0.1.37380 > 10.0.0.2.5001: UDP, length 1470
00:08:59.416957 IP 10.0.0.1.37380 > 10.0.0.2.5001: UDP, length 1470
00:08:59.429055 IP 10.0.0.1.37380 > 10.0.0.2.5001: UDP, length 1470
00:08:59.441175 IP 10.0.0.1.37380 > 10.0.0.2.5001: UDP, length 1470
00:08:59.453265 IP 10.0.0.1.37380 > 10.0.0.2.5001: UDP, length 1470
00:08:59.465342 IP 10.0.0.1.37380 > 10.0.0.2.5001: UDP, length 1470
00:08:59.477440 IP 10.0.0.1.37380 > 10.0.0.2.5001: UDP, length 1470
00:08:59.489535 IP 10.0.0.1.37380 > 10.0.0.2.5001: UDP, length 1470
00:08:59.501644 IP 10.0.0.1.37380 > 10.0.0.2.5001: UDP, length 1470
00:08:59.513741 IP 10.0.0.1.37380 > 10.0.0.2.5001: UDP, length 1470
00:08:59.525836 IP 10.0.0.1.37380 > 10.0.0.2.5001: UDP, length 1470
00:08:59.537918 IP 10.0.0.1.37380 > 10.0.0.2.5001: UDP, length 1470
00:08:59.550585 IP 10.0.0.1.37380 > 10.0.0.2.5001: UDP, length 1470
00:08:59.562109 IP 10.0.0.1.37380 > 10.0.0.2.5001: UDP, length 1470
00:08:59.574226 IP 10.0.0.1.37380 > 10.0.0.2.5001: UDP, length 1470
00:08:59.586308 IP 10.0.0.1.37380 > 10.0.0.2.5001: UDP, length 1470
00:08:59.599205 IP 10.0.0.1.37380 > 10.0.0.2.5001: UDP, length 1470
00:08:59.610497 IP 10.0.0.1.37380 > 10.0.0.2.5001: UDP, length 1470
00:08:59.622590 IP 10.0.0.1.37380 > 10.0.0.2.5001: UDP, length 1470
00:08:59.634707 IP 10.0.0.1.37380 > 10.0.0.2.5001: UDP, length 1470
00:08:59.646782 IP 10.0.0.1.37380 > 10.0.0.2.5001: UDP, length 1470
00:08:59.658888 IP 10.0.0.1.37380 > 10.0.0.2.5001: UDP, length 1470
00:08:59.670971 IP 10.0.0.1.37380 > 10.0.0.2.5001: UDP, length 1470
00:08:59.683072 IP 10.0.0.1.37380 > 10.0.0.2.5001: UDP, length 1470
00:08:59.695163 IP 10.0.0.1.37380 > 10.0.0.2.5001: UDP, length 1470
00:08:59.707281 IP 10.0.0.1.37380 > 10.0.0.2.5001: UDP, length 1470
00:08:59.719373 IP 10.0.0.1.37380 > 10.0.0.2.5001: UDP, length 1470
00:08:59.731454 IP 10.0.0.1.37380 > 10.0.0.2.5001: UDP, length 1470
00:08:59.743582 IP 10.0.0.1.37380 > 10.0.0.2.5001: UDP, length 1470
00:08:59.755646 IP 10.0.0.1.37380 > 10.0.0.2.5001: UDP, length 1470
00:08:59.767764 IP 10.0.0.1.37380 > 10.0.0.2.5001: UDP, length 1470
00:08:59.779825 IP 10.0.0.1.37380 > 10.0.0.2.5001: UDP, length 1470
00:08:59.791934 IP 10.0.0.1.37380 > 10.0.0.2.5001: UDP, length 1470
00:08:59.804039 IP 10.0.0.1.37380 > 10.0.0.2.5001: UDP, length 1470
00:08:59.816126 IP 10.0.0.1.37380 > 10.0.0.2.5001: UDP, length 1470
00:08:59.828220 IP 10.0.0.1.37380 > 10.0.0.2.5001: UDP, length 1470
00:08:59.840309 IP 10.0.0.1.37380 > 10.0.0.2.5001: UDP, length 1470
00:08:59.852416 IP 10.0.0.1.37380 > 10.0.0.2.5001: UDP, length 1470
00:08:59.864509 IP 10.0.0.1.37380 > 10.0.0.2.5001: UDP, length 1470
00:08:59.876631 IP 10.0.0.1.37380 > 10.0.0.2.5001: UDP, length 1470
00:08:59.888698 IP 10.0.0.1.37380 > 10.0.0.2.5001: UDP, length 1470
00:08:59.900789 IP 10.0.0.1.37380 > 10.0.0.2.5001: UDP, length 1470
00:08:59.912894 IP 10.0.0.1.37380 > 10.0.0.2.5001: UDP, length 1470
00:08:59.924990 IP 10.0.0.1.37380 > 10.0.0.2.5001: UDP, length 1470
00:08:59.937087 IP 10.0.0.1.37380 > 10.0.0.2.5001: UDP, length 1470
00:08:59.949182 IP 10.0.0.1.37380 > 10.0.0.2.5001: UDP, length 1470
00:08:59.961289 IP 10.0.0.1.37380 > 10.0.0.2.5001: UDP, length 1470
00:08:59.973369 IP 10.0.0.1.37380 > 10.0.0.2.5001: UDP, length 1470
00:08:59.985470 IP 10.0.0.1.37380 > 10.0.0.2.5001: UDP, length 1470
00:08:59.997566 IP 10.0.0.1.37380 > 10.0.0.2.5001: UDP, length 1470
00:09:00.010378 IP 10.0.0.1.37380 > 10.0.0.2.5001: UDP, length 1470
00:09:00.021803 IP 10.0.0.1.37380 > 10.0.0.2.5001: UDP, length 1470
00:09:00.033838 IP 10.0.0.1.37380 > 10.0.0.2.5001: UDP, length 1470
00:09:00.046722 IP 10.0.0.1.37380 > 10.0.0.2.5001: UDP, length 1470
00:09:00.058045 IP 10.0.0.1.37380 > 10.0.0.2.5001: UDP, length 1470
00:09:00.070141 IP 10.0.0.1.37380 > 10.0.0.2.5001: UDP, length 1470
00:09:00.082259 IP 10.0.0.1.37380 > 10.0.0.2.5001: UDP, length 1470
00:09:00.094784 IP 10.0.0.1.37380 > 10.0.0.2.5001: UDP, length 1470
00:09:00.107206 IP 10.0.0.1.37380 > 10.0.0.2.5001: UDP, length 1470
00:09:00.118519 IP 10.0.0.1.37380 > 10.0.0.2.5001: UDP, length 1470
00:09:00.130619 IP 10.0.0.1.37380 > 10.0.0.2.5001: UDP, length 1470
00:09:00.142720 IP 10.0.0.1.37380 > 10.0.0.2.5001: UDP, length 1470
00:09:00.154828 IP 10.0.0.1.37380 > 10.0.0.2.5001: UDP, length 1470
00:09:00.166906 IP 10.0.0.1.37380 > 10.0.0.2.5001: UDP, length 1470
00:09:00.179000 IP 10.0.0.1.37380 > 10.0.0.2.5001: UDP, length 1470
00:09:00.191100 IP 10.0.0.1.37380 > 10.0.0.2.5001: UDP, length 1470
00:09:00.203190 IP 10.0.0.1.37380 > 10.0.0.2.5001: UDP, length 1470
00:09:00.215303 IP 10.0.0.1.37380 > 10.0.0.2.5001: UDP, length 1470
00:09:00.227393 IP 10.0.0.1.37380 > 10.0.0.2.5001: UDP, length 1470
00:09:00.239485 IP 10.0.0.1.37380 > 10.0.0.2.5001: UDP, length 1470
00:09:00.251596 IP 10.0.0.1.37380 > 10.0.0.2.5001: UDP, length 1470
00:09:00.263689 IP 10.0.0.1.37380 > 10.0.0.2.5001: UDP, length 1470
00:09:00.275776 IP 10.0.0.1.37380 > 10.0.0.2.5001: UDP, length 1470
00:09:00.287888 IP 10.0.0.1.37380 > 10.0.0.2.5001: UDP, length 1470
00:09:00.299961 IP 10.0.0.1.37380 > 10.0.0.2.5001: UDP, length 1470
00:09:00.312060 IP 10.0.0.1.37380 > 10.0.0.2.5001: UDP, length 1470
00:09:00.324157 IP 10.0.0.1.37380 > 10.0.0.2.5001: UDP, length 1470
00:09:00.336286 IP 10.0.0.1.37380 > 10.0.0.2.5001: UDP, length 1470
00:09:00.348383 IP 10.0.0.1.37380 > 10.0.0.2.5001: UDP, length 1470
00:09:00.360439 IP 10.0.0.1.37380 > 10.0.0.2.5001: UDP, length 1470
00:09:00.372547 IP 10.0.0.1.37380 > 10.0.0.2.5001: UDP, length 1470
00:09:00.384637 IP 10.0.0.1.37380 > 10.0.0.2.5001: UDP, length 1470
00:09:00.397608 IP 10.0.0.1.37380 > 10.0.0.2.5001: UDP, length 1470
00:09:00.408820 IP 10.0.0.1.37380 > 10.0.0.2.5001: UDP, length 1470
00:09:00.420937 IP 10.0.0.1.37380 > 10.0.0.2.5001: UDP, length 1470
00:09:00.433025 IP 10.0.0.1.37380 > 10.0.0.2.5001: UDP, length 1470
00:09:00.445876 IP 10.0.0.1.37380 > 10.0.0.2.5001: UDP, length 1470
00:09:00.457244 IP 10.0.0.1.37380 > 10.0.0.2.5001: UDP, length 1470
00:09:00.469328 IP 10.0.0.1.37380 > 10.0.0.2.5001: UDP, length 1470
00:09:00.481422 IP 10.0.0.1.37380 > 10.0.0.2.5001: UDP, length 1470
00:09:00.493517 IP 10.0.0.1.37380 > 10.0.0.2.5001: UDP, length 1470
00:09:00.505597 IP 10.0.0.1.37380 > 10.0.0.2.5001: UDP, length 1470
00:09:00.517699 IP 10.0.0.1.37380 > 10.0.0.2.5001: UDP, length 1470
00:09:00.529801 IP 10.0.0.1.37380 > 10.0.0.2.5001: UDP, length 1470
00:09:00.541907 IP 10.0.0.1.37380 > 10.0.0.2.5001: UDP, length 1470
00:09:00.553977 IP 10.0.0.1.37380 > 10.0.0.2.5001: UDP, length 1470
00:09:00.566215 IP 10.0.0.1.37380 > 10.0.0.2.5001: UDP, length 1470
00:09:00.578160 IP 10.0.0.1.37380 > 10.0.0.2.5001: UDP, length 1470
00:09:00.590296 IP 10.0.0.1.37380 > 10.0.0.2.5001: UDP, length 1470
00:09:00.602365 IP 10.0.0.1.37380 > 10.0.0.2.5001: UDP, length 1470
00:09:00.615242 IP 10.0.0.1.37380 > 10.0.0.2.5001: UDP, length 1470
00:09:00.626575 IP 10.0.0.1.37380 > 10.0.0.2.5001: UDP, length 1470
00:09:00.638657 IP 10.0.0.1.37380 > 10.0.0.2.5001: UDP, length 1470
00:09:00.650751 IP 10.0.0.1.37380 > 10.0.0.2.5001: UDP, length 1470
00:09:00.662848 IP 10.0.0.1.37380 > 10.0.0.2.5001: UDP, length 1470
00:09:00.674935 IP 10.0.0.1.37380 > 10.0.0.2.5001: UDP, length 1470
00:09:00.687047 IP 10.0.0.1.37380 > 10.0.0.2.5001: UDP, length 1470
00:09:00.699128 IP 10.0.0.1.37380 > 10.0.0.2.5001: UDP, length 1470
00:09:00.711235 IP 10.0.0.1.37380 > 10.0.0.2.5001: UDP, length 1470
00:09:00.723319 IP 10.0.0.1.37380 > 10.0.0.2.5001: UDP, length 1470
00:09:00.735435 IP 10.0.0.1.37380 > 10.0.0.2.5001: UDP, length 1470
00:09:00.747544 IP 10.0.0.1.37380 > 10.0.0.2.5001: UDP, length 1470
00:09:00.759615 IP 10.0.0.1.37380 > 10.0.0.2.5001: UDP, length 1470
00:09:00.771711 IP 10.0.0.1.37380 > 10.0.0.2.5001: UDP, length 1470
00:09:00.783819 IP 10.0.0.1.37380 > 10.0.0.2.5001: UDP, length 1470
00:09:00.795886 IP 10.0.0.1.37380 > 10.0.0.2.5001: UDP, length 1470
00:09:00.808013 IP 10.0.0.1.37380 > 10.0.0.2.5001: UDP, length 1470
00:09:00.820097 IP 10.0.0.1.37380 > 10.0.0.2.5001: UDP, length 1470
00:09:00.832204 IP 10.0.0.1.37380 > 10.0.0.2.5001: UDP, length 1470
00:09:00.845186 IP 10.0.0.1.37380 > 10.0.0.2.5001: UDP, length 1470
00:09:00.856375 IP 10.0.0.1.37380 > 10.0.0.2.5001: UDP, length 1470
00:09:00.868622 IP 10.0.0.1.37380 > 10.0.0.2.5001: UDP, length 1470
00:09:00.880566 IP 10.0.0.1.37380 > 10.0.0.2.5001: UDP, length 1470
00:09:00.892668 IP 10.0.0.1.37380 > 10.0.0.2.5001: UDP, length 1470
00:09:00.904767 IP 10.0.0.1.37380 > 10.0.0.2.5001: UDP, length 1470
00:09:00.916901 IP 10.0.0.1.37380 > 10.0.0.2.5001: UDP, length 1470
00:09:00.928973 IP 10.0.0.1.37380 > 10.0.0.2.5001: UDP, length 1470
00:09:00.941060 IP 10.0.0.1.37380 > 10.0.0.2.5001: UDP, length 1470
00:09:00.953134 IP 10.0.0.1.37380 > 10.0.0.2.5001: UDP, length 1470
00:09:00.965244 IP 10.0.0.1.37380 > 10.0.0.2.5001: UDP, length 1470
00:09:00.977350 IP 10.0.0.1.37380 > 10.0.0.2.5001: UDP, length 1470
00:09:00.989445 IP 10.0.0.1.37380 > 10.0.0.2.5001: UDP, length 1470
00:09:01.002331 IP 10.0.0.1.37380 > 10.0.0.2.5001: UDP, length 1470
00:09:01.013629 IP 10.0.0.1.37380 > 10.0.0.2.5001: UDP, length 1470
00:09:01.025728 IP 10.0.0.1.37380 > 10.0.0.2.5001: UDP, length 1470
00:09:01.037822 IP 10.0.0.1.37380 > 10.0.0.2.5001: UDP, length 1470
00:09:01.049955 IP 10.0.0.1.37380 > 10.0.0.2.5001: UDP, length 1470
00:09:01.061999 IP 10.0.0.1.37380 > 10.0.0.2.5001: UDP, length 1470
00:09:01.074110 IP 10.0.0.1.37380 > 10.0.0.2.5001: UDP, length 1470
00:09:01.086205 IP 10.0.0.1.37380 > 10.0.0.2.5001: UDP, length 1470
00:09:01.098301 IP 10.0.0.1.37380 > 10.0.0.2.5001: UDP, length 1470
00:09:01.110403 IP 10.0.0.1.37380 > 10.0.0.2.5001: UDP, length 1470
00:09:01.122502 IP 10.0.0.1.37380 > 10.0.0.2.5001: UDP, length 1470
00:09:01.134584 IP 10.0.0.1.37380 > 10.0.0.2.5001: UDP, length 1470
00:09:01.146699 IP 10.0.0.1.37380 > 10.0.0.2.5001: UDP, length 1470
00:09:01.158792 IP 10.0.0.1.37380 > 10.0.0.2.5001: UDP, length 1470
00:09:01.170863 IP 10.0.0.1.37380 > 10.0.0.2.5001: UDP, length 1470
00:09:01.183762 IP 10.0.0.1.37380 > 10.0.0.2.5001: UDP, length 1470
00:09:01.195066 IP 10.0.0.1.37380 > 10.0.0.2.5001: UDP, length 1470
00:09:01.207166 IP 10.0.0.1.37380 > 10.0.0.2.5001: UDP, length 1470
00:09:01.219268 IP 10.0.0.1.37380 > 10.0.0.2.5001: UDP, length 1470
00:09:01.231357 IP 10.0.0.1.37380 > 10.0.0.2.5001: UDP, length 1470
00:09:01.243456 IP 10.0.0.1.37380 > 10.0.0.2.5001: UDP, length 1470
00:09:01.255543 IP 10.0.0.1.37380 > 10.0.0.2.5001: UDP, length 1470
00:09:01.267646 IP 10.0.0.1.37380 > 10.0.0.2.5001: UDP, length 1470
00:09:01.279922 IP 10.0.0.1.37380 > 10.0.0.2.5001: UDP, length 1470
00:09:01.291840 IP 10.0.0.1.37380 > 10.0.0.2.5001: UDP, length 1470
00:09:01.304130 IP 10.0.0.1.37380 > 10.0.0.2.5001: UDP, length 1470
00:09:01.316041 IP 10.0.0.1.37380 > 10.0.0.2.5001: UDP, length 1470
00:09:01.328125 IP 10.0.0.1.37380 > 10.0.0.2.5001: UDP, length 1470
00:09:01.340938 IP 10.0.0.1.37380 > 10.0.0.2.5001: UDP, length 1470
00:09:01.352321 IP 10.0.0.1.37380 > 10.0.0.2.5001: UDP, length 1470
00:09:01.364412 IP 10.0.0.1.37380 > 10.0.0.2.5001: UDP, length 1470
00:09:01.376538 IP 10.0.0.1.37380 > 10.0.0.2.5001: UDP, length 1470
00:09:01.388596 IP 10.0.0.1.37380 > 10.0.0.2.5001: UDP, length 1470
00:09:01.400704 IP 10.0.0.1.37380 > 10.0.0.2.5001: UDP, length 1470
00:09:01.413621 IP 10.0.0.1.37380 > 10.0.0.2.5001: UDP, length 1470
00:09:01.424902 IP 10.0.0.1.37380 > 10.0.0.2.5001: UDP, length 1470
00:09:01.437001 IP 10.0.0.1.37380 > 10.0.0.2.5001: UDP, length 1470
00:09:01.449821 IP 10.0.0.1.37380 > 10.0.0.2.5001: UDP, length 1470
00:09:01.461182 IP 10.0.0.1.37380 > 10.0.0.2.5001: UDP, length 1470
00:09:01.473277 IP 10.0.0.1.37380 > 10.0.0.2.5001: UDP, length 1470
00:09:01.486117 IP 10.0.0.1.37380 > 10.0.0.2.5001: UDP, length 1470
00:09:01.497472 IP 10.0.0.1.37380 > 10.0.0.2.5001: UDP, length 1470
00:09:01.509564 IP 10.0.0.1.37380 > 10.0.0.2.5001: UDP, length 1470
00:09:01.521665 IP 10.0.0.1.37380 > 10.0.0.2.5001: UDP, length 1470
00:09:01.533757 IP 10.0.0.1.37380 > 10.0.0.2.5001: UDP, length 1470
00:09:01.545844 IP 10.0.0.1.37380 > 10.0.0.2.5001: UDP, length 1470
00:09:01.557948 IP 10.0.0.1.37380 > 10.0.0.2.5001: UDP, length 1470
00:09:01.570062 IP 10.0.0.1.37380 > 10.0.0.2.5001: UDP, length 1470
00:09:01.582134 IP 10.0.0.1.37380 > 10.0.0.2.5001: UDP, length 1470
00:09:01.594244 IP 10.0.0.1.37380 > 10.0.0.2.5001: UDP, length 1470
00:09:01.606333 IP 10.0.0.1.37380 > 10.0.0.2.5001: UDP, length 1470
00:09:01.618433 IP 10.0.0.1.37380 > 10.0.0.2.5001: UDP, length 1470
00:09:01.630526 IP 10.0.0.1.37380 > 10.0.0.2.5001: UDP, length 1470
00:09:01.642642 IP 10.0.0.1.37380 > 10.0.0.2.5001: UDP, length 1470
00:09:01.654713 IP 10.0.0.1.37380 > 10.0.0.2.5001: UDP, length 1470
00:09:01.666813 IP 10.0.0.1.37380 > 10.0.0.2.5001: UDP, length 1470
00:09:01.678912 IP 10.0.0.1.37380 > 10.0.0.2.5001: UDP, length 1470
00:09:01.691003 IP 10.0.0.1.37380 > 10.0.0.2.5001: UDP, length 1470
00:09:01.703114 IP 10.0.0.1.37380 > 10.0.0.2.5001: UDP, length 1470
00:09:01.715196 IP 10.0.0.1.37380 > 10.0.0.2.5001: UDP, length 1470
00:09:01.727295 IP 10.0.0.1.37380 > 10.0.0.2.5001: UDP, length 1470
00:09:01.740218 IP 10.0.0.1.37380 > 10.0.0.2.5001: UDP, length 1470
00:09:01.751512 IP 10.0.0.1.37380 > 10.0.0.2.5001: UDP, length 1470
00:09:01.763584 IP 10.0.0.1.37380 > 10.0.0.2.5001: UDP, length 1470
00:09:01.775680 IP 10.0.0.1.37380 > 10.0.0.2.5001: UDP, length 1470
00:09:01.787769 IP 10.0.0.1.37380 > 10.0.0.2.5001: UDP, length 1470
00:09:01.799899 IP 10.0.0.1.37380 > 10.0.0.2.5001: UDP, length 1470
00:09:01.811966 IP 10.0.0.1.37380 > 10.0.0.2.5001: UDP, length 1470
00:09:01.824056 IP 10.0.0.1.37380 > 10.0.0.2.5001: UDP, length 1470
00:09:01.836169 IP 10.0.0.1.37380 > 10.0.0.2.5001: UDP, length 1470
00:09:01.848256 IP 10.0.0.1.37380 > 10.0.0.2.5001: UDP, length 1470
00:09:01.860342 IP 10.0.0.1.37380 > 10.0.0.2.5001: UDP, length 1470
00:09:01.872440 IP 10.0.0.1.37380 > 10.0.0.2.5001: UDP, length 1470
00:09:01.884540 IP 10.0.0.1.37380 > 10.0.0.2.5001: UDP, length 1470
00:09:01.896657 IP 10.0.0.1.37380 > 10.0.0.2.5001: UDP, length 1470
00:09:01.908772 IP 10.0.0.1.37380 > 10.0.0.2.5001: UDP, length 1470
00:09:01.920852 IP 10.0.0.1.37380 > 10.0.0.2.5001: UDP, length 1470
00:09:01.932928 IP 10.0.0.1.37380 > 10.0.0.2.5001: UDP, length 1470
00:09:01.945771 IP 10.0.0.1.37380 > 10.0.0.2.5001: UDP, length 1470
00:09:01.957121 IP 10.0.0.1.37380 > 10.0.0.2.5001: UDP, length 1470
00:09:01.969232 IP 10.0.0.1.37380 > 10.0.0.2.5001: UDP, length 1470
00:09:01.981310 IP 10.0.0.1.37380 > 10.0.0.2.5001: UDP, length 1470
00:09:01.993411 IP 10.0.0.1.37380 > 10.0.0.2.5001: UDP, length 1470
00:09:02.006215 IP 10.0.0.1.37380 > 10.0.0.2.5001: UDP, length 1470
00:09:02.017594 IP 10.0.0.1.37380 > 10.0.0.2.5001: UDP, length 1470
00:09:02.029693 IP 10.0.0.1.37380 > 10.0.0.2.5001: UDP, length 1470
00:09:02.041783 IP 10.0.0.1.37380 > 10.0.0.2.5001: UDP, length 1470
00:09:02.053875 IP 10.0.0.1.37380 > 10.0.0.2.5001: UDP, length 1470
00:09:02.065983 IP 10.0.0.1.37380 > 10.0.0.2.5001: UDP, length 1470
00:09:02.078073 IP 10.0.0.1.37380 > 10.0.0.2.5001: UDP, length 1470
00:09:02.090186 IP 10.0.0.1.37380 > 10.0.0.2.5001: UDP, length 1470
00:09:02.102296 IP 10.0.0.1.37380 > 10.0.0.2.5001: UDP, length 1470
00:09:02.114367 IP 10.0.0.1.37380 > 10.0.0.2.5001: UDP, length 1470
00:09:02.127254 IP 10.0.0.1.37380 > 10.0.0.2.5001: UDP, length 1470
00:09:02.138560 IP 10.0.0.1.37380 > 10.0.0.2.5001: UDP, length 1470
00:09:02.151559 IP 10.0.0.1.37380 > 10.0.0.2.5001: UDP, length 1470
00:09:02.162748 IP 10.0.0.1.37380 > 10.0.0.2.5001: UDP, length 1470
00:09:02.174854 IP 10.0.0.1.37380 > 10.0.0.2.5001: UDP, length 1470
00:09:02.186940 IP 10.0.0.1.37380 > 10.0.0.2.5001: UDP, length 1470
00:09:02.199607 IP 10.0.0.1.37380 > 10.0.0.2.5001: UDP, length 1470
00:09:02.211155 IP 10.0.0.1.37380 > 10.0.0.2.5001: UDP, length 1470
00:09:02.223214 IP 10.0.0.1.37380 > 10.0.0.2.5001: UDP, length 1470
00:09:02.236063 IP 10.0.0.1.37380 > 10.0.0.2.5001: UDP, length 1470
00:09:02.247420 IP 10.0.0.1.37380 > 10.0.0.2.5001: UDP, length 1470
00:09:02.259517 IP 10.0.0.1.37380 > 10.0.0.2.5001: UDP, length 1470
00:09:02.272406 IP 10.0.0.1.37380 > 10.0.0.2.5001: UDP, length 1470
00:09:02.283695 IP 10.0.0.1.37380 > 10.0.0.2.5001: UDP, length 1470
00:09:02.295807 IP 10.0.0.1.37380 > 10.0.0.2.5001: UDP, length 1470
00:09:02.307901 IP 10.0.0.1.37380 > 10.0.0.2.5001: UDP, length 1470
00:09:02.319998 IP 10.0.0.1.37380 > 10.0.0.2.5001: UDP, length 1470
00:09:02.332097 IP 10.0.0.1.37380 > 10.0.0.2.5001: UDP, length 1470
00:09:02.344178 IP 10.0.0.1.37380 > 10.0.0.2.5001: UDP, length 1470
00:09:02.356280 IP 10.0.0.1.37380 > 10.0.0.2.5001: UDP, length 1470
00:09:02.368381 IP 10.0.0.1.37380 > 10.0.0.2.5001: UDP, length 1470
00:09:02.380477 IP 10.0.0.1.37380 > 10.0.0.2.5001: UDP, length 1470
00:09:02.392573 IP 10.0.0.1.37380 > 10.0.0.2.5001: UDP, length 1470
00:09:02.404690 IP 10.0.0.1.37380 > 10.0.0.2.5001: UDP, length 1470
00:09:02.416772 IP 10.0.0.1.37380 > 10.0.0.2.5001: UDP, length 1470
00:09:02.429661 IP 10.0.0.1.37380 > 10.0.0.2.5001: UDP, length 1470
00:09:02.440956 IP 10.0.0.1.37380 > 10.0.0.2.5001: UDP, length 1470
00:09:02.453044 IP 10.0.0.1.37380 > 10.0.0.2.5001: UDP, length 1470
00:09:02.465168 IP 10.0.0.1.37380 > 10.0.0.2.5001: UDP, length 1470
00:09:02.477251 IP 10.0.0.1.37380 > 10.0.0.2.5001: UDP, length 1470
00:09:02.489336 IP 10.0.0.1.37380 > 10.0.0.2.5001: UDP, length 1470
00:09:02.501455 IP 10.0.0.1.37380 > 10.0.0.2.5001: UDP, length 1470
00:09:02.513528 IP 10.0.0.1.37380 > 10.0.0.2.5001: UDP, length 1470
00:09:02.525674 IP 10.0.0.1.37380 > 10.0.0.2.5001: UDP, length 1470
00:09:02.537724 IP 10.0.0.1.37380 > 10.0.0.2.5001: UDP, length 1470
00:09:02.549824 IP 10.0.0.1.37380 > 10.0.0.2.5001: UDP, length 1470
00:09:02.561919 IP 10.0.0.1.37380 > 10.0.0.2.5001: UDP, length 1470
00:09:02.574013 IP 10.0.0.1.37380 > 10.0.0.2.5001: UDP, length 1470
00:09:02.586284 IP 10.0.0.1.37380 > 10.0.0.2.5001: UDP, length 1470
00:09:02.598191 IP 10.0.0.1.37380 > 10.0.0.2.5001: UDP, length 1470
00:09:02.610304 IP 10.0.0.1.37380 > 10.0.0.2.5001: UDP, length 1470
00:09:02.623289 IP 10.0.0.1.37380 > 10.0.0.2.5001: UDP, length 1470
00:09:02.634491 IP 10.0.0.1.37380 > 10.0.0.2.5001: UDP, length 1470
00:09:02.646583 IP 10.0.0.1.37380 > 10.0.0.2.5001: UDP, length 1470
00:09:02.659465 IP 10.0.0.1.37380 > 10.0.0.2.5001: UDP, length 1470
00:09:02.670782 IP 10.0.0.1.37380 > 10.0.0.2.5001: UDP, length 1470
00:09:02.682877 IP 10.0.0.1.37380 > 10.0.0.2.5001: UDP, length 1470
00:09:02.694985 IP 10.0.0.1.37380 > 10.0.0.2.5001: UDP, length 1470
00:09:02.707072 IP 10.0.0.1.37380 > 10.0.0.2.5001: UDP, length 1470
00:09:02.719196 IP 10.0.0.1.37380 > 10.0.0.2.5001: UDP, length 1470
00:09:02.731246 IP 10.0.0.1.37380 > 10.0.0.2.5001: UDP, length 1470
00:09:02.743362 IP 10.0.0.1.37380 > 10.0.0.2.5001: UDP, length 1470
00:09:02.755457 IP 10.0.0.1.37380 > 10.0.0.2.5001: UDP, length 1470
00:09:02.767547 IP 10.0.0.1.37380 > 10.0.0.2.5001: UDP, length 1470
00:09:02.779669 IP 10.0.0.1.37380 > 10.0.0.2.5001: UDP, length 1470
00:09:02.791749 IP 10.0.0.1.37380 > 10.0.0.2.5001: UDP, length 1470
00:09:02.803840 IP 10.0.0.1.37380 > 10.0.0.2.5001: UDP, length 1470
00:09:02.815933 IP 10.0.0.1.37380 > 10.0.0.2.5001: UDP, length 1470
00:09:02.828041 IP 10.0.0.1.37380 > 10.0.0.2.5001: UDP, length 1470
00:09:02.840599 IP 10.0.0.1.37380 > 10.0.0.2.5001: UDP, length 1470
00:09:02.852240 IP 10.0.0.1.37380 > 10.0.0.2.5001: UDP, length 1470
00:09:02.864315 IP 10.0.0.1.37380 > 10.0.0.2.5001: UDP, length 1470
00:09:02.877176 IP 10.0.0.1.37380 > 10.0.0.2.5001: UDP, length 1470
00:09:02.888508 IP 10.0.0.1.37380 > 10.0.0.2.5001: UDP, length 1470
00:09:02.900601 IP 10.0.0.1.37380 > 10.0.0.2.5001: UDP, length 1470
00:09:02.913438 IP 10.0.0.1.37380 > 10.0.0.2.5001: UDP, length 1470
00:09:02.924795 IP 10.0.0.1.37380 > 10.0.0.2.5001: UDP, length 1470
00:09:02.936893 IP 10.0.0.1.37380 > 10.0.0.2.5001: UDP, length 1470
00:09:02.948988 IP 10.0.0.1.37380 > 10.0.0.2.5001: UDP, length 1470
00:09:02.961087 IP 10.0.0.1.37380 > 10.0.0.2.5001: UDP, length 1470
00:09:02.973200 IP 10.0.0.1.37380 > 10.0.0.2.5001: UDP, length 1470
00:09:02.985262 IP 10.0.0.1.37380 > 10.0.0.2.5001: UDP, length 1470
00:09:02.997376 IP 10.0.0.1.37380 > 10.0.0.2.5001: UDP, length 1470
00:09:03.009469 IP 10.0.0.1.37380 > 10.0.0.2.5001: UDP, length 1470
00:09:03.022306 IP 10.0.0.1.37380 > 10.0.0.2.5001: UDP, length 1470
00:09:03.033657 IP 10.0.0.1.37380 > 10.0.0.2.5001: UDP, length 1470
00:09:03.045748 IP 10.0.0.1.37380 > 10.0.0.2.5001: UDP, length 1470
00:09:03.057848 IP 10.0.0.1.37380 > 10.0.0.2.5001: UDP, length 1470
00:09:03.069953 IP 10.0.0.1.37380 > 10.0.0.2.5001: UDP, length 1470
00:09:03.082047 IP 10.0.0.1.37380 > 10.0.0.2.5001: UDP, length 1470
00:09:03.094166 IP 10.0.0.1.37380 > 10.0.0.2.5001: UDP, length 1470
00:09:03.106247 IP 10.0.0.1.37380 > 10.0.0.2.5001: UDP, length 1470
00:09:03.118331 IP 10.0.0.1.37380 > 10.0.0.2.5001: UDP, length 1470
00:09:03.130429 IP 10.0.0.1.37380 > 10.0.0.2.5001: UDP, length 1470
00:09:03.142520 IP 10.0.0.1.37380 > 10.0.0.2.5001: UDP, length 1470
00:09:03.155471 IP 10.0.0.1.37380 > 10.0.0.2.5001: UDP, length 1470
00:09:03.166739 IP 10.0.0.1.37380 > 10.0.0.2.5001: UDP, length 1470
00:09:03.178827 IP 10.0.0.1.37380 > 10.0.0.2.5001: UDP, length 1470
00:09:03.190909 IP 10.0.0.1.37380 > 10.0.0.2.5001: UDP, length 1470
00:09:03.202998 IP 10.0.0.1.37380 > 10.0.0.2.5001: UDP, length 1470
00:09:03.215100 IP 10.0.0.1.37380 > 10.0.0.2.5001: UDP, length 1470
00:09:03.227225 IP 10.0.0.1.37380 > 10.0.0.2.5001: UDP, length 1470
00:09:03.239334 IP 10.0.0.1.37380 > 10.0.0.2.5001: UDP, length 1470
00:09:03.251407 IP 10.0.0.1.37380 > 10.0.0.2.5001: UDP, length 1470
00:09:03.263483 IP 10.0.0.1.37380 > 10.0.0.2.5001: UDP, length 1470
00:09:03.275575 IP 10.0.0.1.37380 > 10.0.0.2.5001: UDP, length 1470
00:09:03.287675 IP 10.0.0.1.37380 > 10.0.0.2.5001: UDP, length 1470
00:09:03.299792 IP 10.0.0.1.37380 > 10.0.0.2.5001: UDP, length 1470
00:09:03.311859 IP 10.0.0.1.37380 > 10.0.0.2.5001: UDP, length 1470
00:09:03.323965 IP 10.0.0.1.37380 > 10.0.0.2.5001: UDP, length 1470
00:09:03.336063 IP 10.0.0.1.37380 > 10.0.0.2.5001: UDP, length 1470
00:09:03.348157 IP 10.0.0.1.37380 > 10.0.0.2.5001: UDP, length 1470
00:09:03.360277 IP 10.0.0.1.37380 > 10.0.0.2.5001: UDP, length 1470
00:09:03.373107 IP 10.0.0.1.37380 > 10.0.0.2.5001: UDP, length 1470
00:09:03.384445 IP 10.0.0.1.37380 > 10.0.0.2.5001: UDP, length 1470
00:09:03.396544 IP 10.0.0.1.37380 > 10.0.0.2.5001: UDP, length 1470
00:09:03.408636 IP 10.0.0.1.37380 > 10.0.0.2.5001: UDP, length 1470
00:09:03.420748 IP 10.0.0.1.37380 > 10.0.0.2.5001: UDP, length 1470
00:09:03.432835 IP 10.0.0.1.37380 > 10.0.0.2.5001: UDP, length 1470
00:09:03.444937 IP 10.0.0.1.37380 > 10.0.0.2.5001: UDP, length 1470
00:09:03.457784 IP 10.0.0.1.37380 > 10.0.0.2.5001: UDP, length 1470
00:09:03.469161 IP 10.0.0.1.37380 > 10.0.0.2.5001: UDP, length 1470
00:09:03.481221 IP 10.0.0.1.37380 > 10.0.0.2.5001: UDP, length 1470
00:09:03.493310 IP 10.0.0.1.37380 > 10.0.0.2.5001: UDP, length 1470
00:09:03.506256 IP 10.0.0.1.37380 > 10.0.0.2.5001: UDP, length 1470
00:09:03.517501 IP 10.0.0.1.37380 > 10.0.0.2.5001: UDP, length 1470
00:09:03.529597 IP 10.0.0.1.37380 > 10.0.0.2.5001: UDP, length 1470
00:09:03.541692 IP 10.0.0.1.37380 > 10.0.0.2.5001: UDP, length 1470
00:09:03.553815 IP 10.0.0.1.37380 > 10.0.0.2.5001: UDP, length 1470
00:09:03.565875 IP 10.0.0.1.37380 > 10.0.0.2.5001: UDP, length 1470
00:09:03.577977 IP 10.0.0.1.37380 > 10.0.0.2.5001: UDP, length 1470
00:09:03.590076 IP 10.0.0.1.37380 > 10.0.0.2.5001: UDP, length 1470
00:09:03.602208 IP 10.0.0.1.37380 > 10.0.0.2.5001: UDP, length 1470
00:09:03.614292 IP 10.0.0.1.37380 > 10.0.0.2.5001: UDP, length 1470
00:09:03.626384 IP 10.0.0.1.37380 > 10.0.0.2.5001: UDP, length 1470
00:09:03.638470 IP 10.0.0.1.37380 > 10.0.0.2.5001: UDP, length 1470
00:09:03.650567 IP 10.0.0.1.37380 > 10.0.0.2.5001: UDP, length 1470
00:09:03.662652 IP 10.0.0.1.37380 > 10.0.0.2.5001: UDP, length 1470
00:09:03.674750 IP 10.0.0.1.37380 > 10.0.0.2.5001: UDP, length 1470
00:09:03.686866 IP 10.0.0.1.37380 > 10.0.0.2.5001: UDP, length 1470
00:09:03.698927 IP 10.0.0.1.37380 > 10.0.0.2.5001: UDP, length 1470
00:09:03.711043 IP 10.0.0.1.37380 > 10.0.0.2.5001: UDP, length 1470
00:09:03.723132 IP 10.0.0.1.37380 > 10.0.0.2.5001: UDP, length 1470
00:09:03.735228 IP 10.0.0.1.37380 > 10.0.0.2.5001: UDP, length 1470
00:09:03.747323 IP 10.0.0.1.37380 > 10.0.0.2.5001: UDP, length 1470
00:09:03.759430 IP 10.0.0.1.37380 > 10.0.0.2.5001: UDP, length 1470
00:09:03.771520 IP 10.0.0.1.37380 > 10.0.0.2.5001: UDP, length 1470
00:09:03.783613 IP 10.0.0.1.37380 > 10.0.0.2.5001: UDP, length 1470
00:09:03.795695 IP 10.0.0.1.37380 > 10.0.0.2.5001: UDP, length 1470
00:09:03.807803 IP 10.0.0.1.37380 > 10.0.0.2.5001: UDP, length 1470
00:09:03.819894 IP 10.0.0.1.37380 > 10.0.0.2.5001: UDP, length 1470
00:09:03.832026 IP 10.0.0.1.37380 > 10.0.0.2.5001: UDP, length 1470
00:09:03.844114 IP 10.0.0.1.37380 > 10.0.0.2.5001: UDP, length 1470
00:09:03.856189 IP 10.0.0.1.37380 > 10.0.0.2.5001: UDP, length 1470
00:09:03.868464 IP 10.0.0.1.37380 > 10.0.0.2.5001: UDP, length 1470
00:09:03.880393 IP 10.0.0.1.37380 > 10.0.0.2.5001: UDP, length 1470
00:09:03.892460 IP 10.0.0.1.37380 > 10.0.0.2.5001: UDP, length 1470
00:09:03.905450 IP 10.0.0.1.37380 > 10.0.0.2.5001: UDP, length 1470
00:09:03.916668 IP 10.0.0.1.37380 > 10.0.0.2.5001: UDP, length 1470
00:09:03.928754 IP 10.0.0.1.37380 > 10.0.0.2.5001: UDP, length 1470
00:09:03.940873 IP 10.0.0.1.37380 > 10.0.0.2.5001: UDP, length 1470
00:09:03.952955 IP 10.0.0.1.37380 > 10.0.0.2.5001: UDP, length 1470
00:09:03.965047 IP 10.0.0.1.37380 > 10.0.0.2.5001: UDP, length 1470
00:09:03.977158 IP 10.0.0.1.37380 > 10.0.0.2.5001: UDP, length 1470
00:09:03.989243 IP 10.0.0.1.37380 > 10.0.0.2.5001: UDP, length 1470
00:09:04.001354 IP 10.0.0.1.37380 > 10.0.0.2.5001: UDP, length 1470
00:09:04.013430 IP 10.0.0.1.37380 > 10.0.0.2.5001: UDP, length 1470
00:09:04.025896 IP 10.0.0.1.37380 > 10.0.0.2.5001: UDP, length 1470
00:09:04.037628 IP 10.0.0.1.37380 > 10.0.0.2.5001: UDP, length 1470
00:09:04.049724 IP 10.0.0.1.37380 > 10.0.0.2.5001: UDP, length 1470
00:09:04.061825 IP 10.0.0.1.37380 > 10.0.0.2.5001: UDP, length 1470
00:09:04.073928 IP 10.0.0.1.37380 > 10.0.0.2.5001: UDP, length 1470
00:09:04.086015 IP 10.0.0.1.37380 > 10.0.0.2.5001: UDP, length 1470
00:09:04.098109 IP 10.0.0.1.37380 > 10.0.0.2.5001: UDP, length 1470
00:09:04.110194 IP 10.0.0.1.37380 > 10.0.0.2.5001: UDP, length 1470
00:09:04.122296 IP 10.0.0.1.37380 > 10.0.0.2.5001: UDP, length 1470
00:09:04.134407 IP 10.0.0.1.37380 > 10.0.0.2.5001: UDP, length 1470
00:09:04.146482 IP 10.0.0.1.37380 > 10.0.0.2.5001: UDP, length 1470
00:09:04.158589 IP 10.0.0.1.37380 > 10.0.0.2.5001: UDP, length 1470
00:09:04.170675 IP 10.0.0.1.37380 > 10.0.0.2.5001: UDP, length 1470
00:09:04.182798 IP 10.0.0.1.37380 > 10.0.0.2.5001: UDP, length 1470
00:09:04.194890 IP 10.0.0.1.37380 > 10.0.0.2.5001: UDP, length 1470
00:09:04.206978 IP 10.0.0.1.37380 > 10.0.0.2.5001: UDP, length 1470
00:09:04.219092 IP 10.0.0.1.37380 > 10.0.0.2.5001: UDP, length 1470
00:09:04.231164 IP 10.0.0.1.37380 > 10.0.0.2.5001: UDP, length 1470
00:09:04.243479 IP 10.0.0.1.37380 > 10.0.0.2.5001: UDP, length 1470
00:09:04.255388 IP 10.0.0.1.37380 > 10.0.0.2.5001: UDP, length 1470
00:09:04.267461 IP 10.0.0.1.37380 > 10.0.0.2.5001: UDP, length 1470
00:09:04.279552 IP 10.0.0.1.37380 > 10.0.0.2.5001: UDP, length 1470
00:09:04.291647 IP 10.0.0.1.37380 > 10.0.0.2.5001: UDP, length 1470
00:09:04.303743 IP 10.0.0.1.37380 > 10.0.0.2.5001: UDP, length 1470
00:09:04.315843 IP 10.0.0.1.37380 > 10.0.0.2.5001: UDP, length 1470
00:09:04.327958 IP 10.0.0.1.37380 > 10.0.0.2.5001: UDP, length 1470
00:09:04.340034 IP 10.0.0.1.37380 > 10.0.0.2.5001: UDP, length 1470
00:09:04.352133 IP 10.0.0.1.37380 > 10.0.0.2.5001: UDP, length 1470
00:09:04.365004 IP 10.0.0.1.37380 > 10.0.0.2.5001: UDP, length 1470
00:09:04.376356 IP 10.0.0.1.37380 > 10.0.0.2.5001: UDP, length 1470
00:09:04.388440 IP 10.0.0.1.37380 > 10.0.0.2.5001: UDP, length 1470
00:09:04.400673 IP 10.0.0.1.37380 > 10.0.0.2.5001: UDP, length 1470
00:09:04.412602 IP 10.0.0.1.37380 > 10.0.0.2.5001: UDP, length 1470
00:09:04.424701 IP 10.0.0.1.37380 > 10.0.0.2.5001: UDP, length 1470
00:09:04.436793 IP 10.0.0.1.37380 > 10.0.0.2.5001: UDP, length 1470
00:09:04.448902 IP 10.0.0.1.37380 > 10.0.0.2.5001: UDP, length 1470
00:09:04.460985 IP 10.0.0.1.37380 > 10.0.0.2.5001: UDP, length 1470
00:09:04.473084 IP 10.0.0.1.37380 > 10.0.0.2.5001: UDP, length 1470
00:09:04.485950 IP 10.0.0.1.37380 > 10.0.0.2.5001: UDP, length 1470
00:09:04.497274 IP 10.0.0.1.37380 > 10.0.0.2.5001: UDP, length 1470
00:09:04.509369 IP 10.0.0.1.37380 > 10.0.0.2.5001: UDP, length 1470
00:09:04.522242 IP 10.0.0.1.37380 > 10.0.0.2.5001: UDP, length 1470
00:09:04.533571 IP 10.0.0.1.37380 > 10.0.0.2.5001: UDP, length 1470
00:09:04.546400 IP 10.0.0.1.37380 > 10.0.0.2.5001: UDP, length 1470
00:09:04.557756 IP 10.0.0.1.37380 > 10.0.0.2.5001: UDP, length 1470
00:09:04.569854 IP 10.0.0.1.37380 > 10.0.0.2.5001: UDP, length 1470
00:09:04.581972 IP 10.0.0.1.37380 > 10.0.0.2.5001: UDP, length 1470
00:09:04.594054 IP 10.0.0.1.37380 > 10.0.0.2.5001: UDP, length 1470
00:09:04.606141 IP 10.0.0.1.37380 > 10.0.0.2.5001: UDP, length 1470
00:09:04.618235 IP 10.0.0.1.37380 > 10.0.0.2.5001: UDP, length 1470
00:09:04.630333 IP 10.0.0.1.37380 > 10.0.0.2.5001: UDP, length 1470
00:09:04.642428 IP 10.0.0.1.37380 > 10.0.0.2.5001: UDP, length 1470
00:09:04.654527 IP 10.0.0.1.37380 > 10.0.0.2.5001: UDP, length 1470
00:09:04.666620 IP 10.0.0.1.37380 > 10.0.0.2.5001: UDP, length 1470
00:09:04.678717 IP 10.0.0.1.37380 > 10.0.0.2.5001: UDP, length 1470
00:09:04.690808 IP 10.0.0.1.37380 > 10.0.0.2.5001: UDP, length 1470
00:09:04.702924 IP 10.0.0.1.37380 > 10.0.0.2.5001: UDP, length 1470
00:09:04.715009 IP 10.0.0.1.37380 > 10.0.0.2.5001: UDP, length 1470
00:09:04.727107 IP 10.0.0.1.37380 > 10.0.0.2.5001: UDP, length 1470
00:09:04.739882 IP 10.0.0.1.37380 > 10.0.0.2.5001: UDP, length 1470
00:09:04.751277 IP 10.0.0.1.37380 > 10.0.0.2.5001: UDP, length 1470
00:09:04.763396 IP 10.0.0.1.37380 > 10.0.0.2.5001: UDP, length 1470
00:09:04.775956 IP 10.0.0.1.37380 > 10.0.0.2.5001: UDP, length 1470
00:09:04.787578 IP 10.0.0.1.37380 > 10.0.0.2.5001: UDP, length 1470
00:09:04.799671 IP 10.0.0.1.37380 > 10.0.0.2.5001: UDP, length 1470
00:09:04.811774 IP 10.0.0.1.37380 > 10.0.0.2.5001: UDP, length 1470
00:09:04.823885 IP 10.0.0.1.37380 > 10.0.0.2.5001: UDP, length 1470
00:09:04.835967 IP 10.0.0.1.37380 > 10.0.0.2.5001: UDP, length 1470
00:09:04.848077 IP 10.0.0.1.37380 > 10.0.0.2.5001: UDP, length 1470
00:09:04.860148 IP 10.0.0.1.37380 > 10.0.0.2.5001: UDP, length 1470
00:09:04.872255 IP 10.0.0.1.37380 > 10.0.0.2.5001: UDP, length 1470
00:09:04.884347 IP 10.0.0.1.37380 > 10.0.0.2.5001: UDP, length 1470
00:09:04.896444 IP 10.0.0.1.37380 > 10.0.0.2.5001: UDP, length 1470
00:09:04.908544 IP 10.0.0.1.37380 > 10.0.0.2.5001: UDP, length 1470
00:09:04.921453 IP 10.0.0.1.37380 > 10.0.0.2.5001: UDP, length 1470
00:09:04.932895 IP 10.0.0.1.37380 > 10.0.0.2.5001: UDP, length 1470
00:09:04.944832 IP 10.0.0.1.37380 > 10.0.0.2.5001: UDP, length 1470
00:09:04.956927 IP 10.0.0.1.37380 > 10.0.0.2.5001: UDP, length 1470
00:09:04.969020 IP 10.0.0.1.37380 > 10.0.0.2.5001: UDP, length 1470
00:09:04.981124 IP 10.0.0.1.37380 > 10.0.0.2.5001: UDP, length 1470
00:09:04.993215 IP 10.0.0.1.37380 > 10.0.0.2.5001: UDP, length 1470
00:09:05.005309 IP 10.0.0.1.37380 > 10.0.0.2.5001: UDP, length 1470
00:09:05.017422 IP 10.0.0.1.37380 > 10.0.0.2.5001: UDP, length 1470
00:09:05.029512 IP 10.0.0.1.37380 > 10.0.0.2.5001: UDP, length 1470
00:09:05.041606 IP 10.0.0.1.37380 > 10.0.0.2.5001: UDP, length 1470
00:09:05.054412 IP 10.0.0.1.37380 > 10.0.0.2.5001: UDP, length 1470
00:09:05.065790 IP 10.0.0.1.37380 > 10.0.0.2.5001: UDP, length 1470
00:09:05.077901 IP 10.0.0.1.37380 > 10.0.0.2.5001: UDP, length 1470
00:09:05.089976 IP 10.0.0.1.37380 > 10.0.0.2.5001: UDP, length 1470
00:09:05.102106 IP 10.0.0.1.37380 > 10.0.0.2.5001: UDP, length 1470
00:09:05.114177 IP 10.0.0.1.37380 > 10.0.0.2.5001: UDP, length 1470
00:09:05.126289 IP 10.0.0.1.37380 > 10.0.0.2.5001: UDP, length 1470
00:09:05.138379 IP 10.0.0.1.37380 > 10.0.0.2.5001: UDP, length 1470
00:09:05.150467 IP 10.0.0.1.37380 > 10.0.0.2.5001: UDP, length 1470
00:09:05.162568 IP 10.0.0.1.37380 > 10.0.0.2.5001: UDP, length 1470
00:09:05.174647 IP 10.0.0.1.37380 > 10.0.0.2.5001: UDP, length 1470
00:09:05.186749 IP 10.0.0.1.37380 > 10.0.0.2.5001: UDP, length 1470
00:09:05.199704 IP 10.0.0.1.37380 > 10.0.0.2.5001: UDP, length 1470
00:09:05.210971 IP 10.0.0.1.37380 > 10.0.0.2.5001: UDP, length 1470
00:09:05.223038 IP 10.0.0.1.37380 > 10.0.0.2.5001: UDP, length 1470
00:09:05.236027 IP 10.0.0.1.37380 > 10.0.0.2.5001: UDP, length 1470
00:09:05.247231 IP 10.0.0.1.37380 > 10.0.0.2.5001: UDP, length 1470
00:09:05.259326 IP 10.0.0.1.37380 > 10.0.0.2.5001: UDP, length 1470
00:09:05.271445 IP 10.0.0.1.37380 > 10.0.0.2.5001: UDP, length 1470
00:09:05.283524 IP 10.0.0.1.37380 > 10.0.0.2.5001: UDP, length 1470
00:09:05.295619 IP 10.0.0.1.37380 > 10.0.0.2.5001: UDP, length 1470
00:09:05.307712 IP 10.0.0.1.37380 > 10.0.0.2.5001: UDP, length 1470
00:09:05.319841 IP 10.0.0.1.37380 > 10.0.0.2.5001: UDP, length 1470
00:09:05.331903 IP 10.0.0.1.37380 > 10.0.0.2.5001: UDP, length 1470
00:09:05.344020 IP 10.0.0.1.37380 > 10.0.0.2.5001: UDP, length 1470
00:09:05.356116 IP 10.0.0.1.37380 > 10.0.0.2.5001: UDP, length 1470
00:09:05.368207 IP 10.0.0.1.37380 > 10.0.0.2.5001: UDP, length 1470
00:09:05.380291 IP 10.0.0.1.37380 > 10.0.0.2.5001: UDP, length 1470
00:09:05.393128 IP 10.0.0.1.37380 > 10.0.0.2.5001: UDP, length 1470
00:09:05.404502 IP 10.0.0.1.37380 > 10.0.0.2.5001: UDP, length 1470
00:09:05.416576 IP 10.0.0.1.37380 > 10.0.0.2.5001: UDP, length 1470
00:09:05.428678 IP 10.0.0.1.37380 > 10.0.0.2.5001: UDP, length 1470
00:09:05.440767 IP 10.0.0.1.37380 > 10.0.0.2.5001: UDP, length 1470
00:09:05.452862 IP 10.0.0.1.37380 > 10.0.0.2.5001: UDP, length 1470
00:09:05.464954 IP 10.0.0.1.37380 > 10.0.0.2.5001: UDP, length 1470
00:09:05.477063 IP 10.0.0.1.37380 > 10.0.0.2.5001: UDP, length 1470
00:09:05.489160 IP 10.0.0.1.37380 > 10.0.0.2.5001: UDP, length 1470
00:09:05.501266 IP 10.0.0.1.37380 > 10.0.0.2.5001: UDP, length 1470
00:09:05.513341 IP 10.0.0.1.37380 > 10.0.0.2.5001: UDP, length 1470
00:09:05.525433 IP 10.0.0.1.37380 > 10.0.0.2.5001: UDP, length 1470
00:09:05.537542 IP 10.0.0.1.37380 > 10.0.0.2.5001: UDP, length 1470
00:09:05.549631 IP 10.0.0.1.37380 > 10.0.0.2.5001: UDP, length 1470
00:09:05.561728 IP 10.0.0.1.37380 > 10.0.0.2.5001: UDP, length 1470
00:09:05.573817 IP 10.0.0.1.37380 > 10.0.0.2.5001: UDP, length 1470
00:09:05.585917 IP 10.0.0.1.37380 > 10.0.0.2.5001: UDP, length 1470
00:09:05.598793 IP 10.0.0.1.37380 > 10.0.0.2.5001: UDP, length 1470
00:09:05.610128 IP 10.0.0.1.37380 > 10.0.0.2.5001: UDP, length 1470
00:09:05.622209 IP 10.0.0.1.37380 > 10.0.0.2.5001: UDP, length 1470
00:09:05.634300 IP 10.0.0.1.37380 > 10.0.0.2.5001: UDP, length 1470
00:09:05.646400 IP 10.0.0.1.37380 > 10.0.0.2.5001: UDP, length 1470
00:09:05.658550 IP 10.0.0.1.37380 > 10.0.0.2.5001: UDP, length 1470
00:09:05.670593 IP 10.0.0.1.37380 > 10.0.0.2.5001: UDP, length 1470
00:09:05.683474 IP 10.0.0.1.37380 > 10.0.0.2.5001: UDP, length 1470
00:09:05.694787 IP 10.0.0.1.37380 > 10.0.0.2.5001: UDP, length 1470
00:09:05.706914 IP 10.0.0.1.37380 > 10.0.0.2.5001: UDP, length 1470
00:09:05.718994 IP 10.0.0.1.37380 > 10.0.0.2.5001: UDP, length 1470
00:09:05.731081 IP 10.0.0.1.37380 > 10.0.0.2.5001: UDP, length 1470
00:09:05.743161 IP 10.0.0.1.37380 > 10.0.0.2.5001: UDP, length 1470
00:09:05.755252 IP 10.0.0.1.37380 > 10.0.0.2.5001: UDP, length 1470
00:09:05.767364 IP 10.0.0.1.37380 > 10.0.0.2.5001: UDP, length 1470
00:09:05.779448 IP 10.0.0.1.37380 > 10.0.0.2.5001: UDP, length 1470
00:09:05.791549 IP 10.0.0.1.37380 > 10.0.0.2.5001: UDP, length 1470
00:09:05.803659 IP 10.0.0.1.37380 > 10.0.0.2.5001: UDP, length 1470
00:09:05.815751 IP 10.0.0.1.37380 > 10.0.0.2.5001: UDP, length 1470
00:09:05.827828 IP 10.0.0.1.37380 > 10.0.0.2.5001: UDP, length 1470
00:09:05.840648 IP 10.0.0.1.37380 > 10.0.0.2.5001: UDP, length 1470
00:09:05.852039 IP 10.0.0.1.37380 > 10.0.0.2.5001: UDP, length 1470
00:09:05.864124 IP 10.0.0.1.37380 > 10.0.0.2.5001: UDP, length 1470
00:09:05.876245 IP 10.0.0.1.37380 > 10.0.0.2.5001: UDP, length 1470
00:09:05.888321 IP 10.0.0.1.37380 > 10.0.0.2.5001: UDP, length 1470
00:09:05.900411 IP 10.0.0.1.37380 > 10.0.0.2.5001: UDP, length 1470
00:09:05.912574 IP 10.0.0.1.37380 > 10.0.0.2.5001: UDP, length 1470
00:09:05.924604 IP 10.0.0.1.37380 > 10.0.0.2.5001: UDP, length 1470
00:09:05.936716 IP 10.0.0.1.37380 > 10.0.0.2.5001: UDP, length 1470
00:09:05.948793 IP 10.0.0.1.37380 > 10.0.0.2.5001: UDP, length 1470
00:09:05.960893 IP 10.0.0.1.37380 > 10.0.0.2.5001: UDP, length 1470
00:09:05.972989 IP 10.0.0.1.37380 > 10.0.0.2.5001: UDP, length 1470
00:09:05.985126 IP 10.0.0.1.37380 > 10.0.0.2.5001: UDP, length 1470
00:09:05.997232 IP 10.0.0.1.37380 > 10.0.0.2.5001: UDP, length 1470
00:09:06.009285 IP 10.0.0.1.37380 > 10.0.0.2.5001: UDP, length 1470
00:09:06.021361 IP 10.0.0.1.37380 > 10.0.0.2.5001: UDP, length 1470
00:09:06.033468 IP 10.0.0.1.37380 > 10.0.0.2.5001: UDP, length 1470
00:09:06.045554 IP 10.0.0.1.37380 > 10.0.0.2.5001: UDP, length 1470
00:09:06.057656 IP 10.0.0.1.37380 > 10.0.0.2.5001: UDP, length 1470
00:09:06.069765 IP 10.0.0.1.37380 > 10.0.0.2.5001: UDP, length 1470
00:09:06.082664 IP 10.0.0.1.37380 > 10.0.0.2.5001: UDP, length 1470
00:09:06.093943 IP 10.0.0.1.37380 > 10.0.0.2.5001: UDP, length 1470
00:09:06.106045 IP 10.0.0.1.37380 > 10.0.0.2.5001: UDP, length 1470
00:09:06.118142 IP 10.0.0.1.37380 > 10.0.0.2.5001: UDP, length 1470
00:09:06.130251 IP 10.0.0.1.37380 > 10.0.0.2.5001: UDP, length 1470
00:09:06.142323 IP 10.0.0.1.37380 > 10.0.0.2.5001: UDP, length 1470
00:09:06.154424 IP 10.0.0.1.37380 > 10.0.0.2.5001: UDP, length 1470
00:09:06.167208 IP 10.0.0.1.37380 > 10.0.0.2.5001: UDP, length 1470
00:09:06.178626 IP 10.0.0.1.37380 > 10.0.0.2.5001: UDP, length 1470
00:09:06.190735 IP 10.0.0.1.37380 > 10.0.0.2.5001: UDP, length 1470
00:09:06.202804 IP 10.0.0.1.37380 > 10.0.0.2.5001: UDP, length 1470
00:09:06.214904 IP 10.0.0.1.37380 > 10.0.0.2.5001: UDP, length 1470
00:09:06.227012 IP 10.0.0.1.37380 > 10.0.0.2.5001: UDP, length 1470
00:09:06.239840 IP 10.0.0.1.37380 > 10.0.0.2.5001: UDP, length 1470
00:09:06.251193 IP 10.0.0.1.37380 > 10.0.0.2.5001: UDP, length 1470
00:09:06.263289 IP 10.0.0.1.37380 > 10.0.0.2.5001: UDP, length 1470
00:09:06.275387 IP 10.0.0.1.37380 > 10.0.0.2.5001: UDP, length 1470
00:09:06.287485 IP 10.0.0.1.37380 > 10.0.0.2.5001: UDP, length 1470
00:09:06.299582 IP 10.0.0.1.37380 > 10.0.0.2.5001: UDP, length 1470
00:09:06.312332 IP 10.0.0.1.37380 > 10.0.0.2.5001: UDP, length 1470
00:09:06.323793 IP 10.0.0.1.37380 > 10.0.0.2.5001: UDP, length 1470
00:09:06.335876 IP 10.0.0.1.37380 > 10.0.0.2.5001: UDP, length 1470
00:09:06.347969 IP 10.0.0.1.37380 > 10.0.0.2.5001: UDP, length 1470
00:09:06.360061 IP 10.0.0.1.37380 > 10.0.0.2.5001: UDP, length 1470
00:09:06.372160 IP 10.0.0.1.37380 > 10.0.0.2.5001: UDP, length 1470
00:09:06.384276 IP 10.0.0.1.37380 > 10.0.0.2.5001: UDP, length 1470
00:09:06.396335 IP 10.0.0.1.37380 > 10.0.0.2.5001: UDP, length 1470
00:09:06.408446 IP 10.0.0.1.37380 > 10.0.0.2.5001: UDP, length 1470
00:09:06.420535 IP 10.0.0.1.37380 > 10.0.0.2.5001: UDP, length 1470
00:09:06.432637 IP 10.0.0.1.37380 > 10.0.0.2.5001: UDP, length 1470
00:09:06.444739 IP 10.0.0.1.37380 > 10.0.0.2.5001: UDP, length 1470
00:09:06.456842 IP 10.0.0.1.37380 > 10.0.0.2.5001: UDP, length 1470
00:09:06.468955 IP 10.0.0.1.37380 > 10.0.0.2.5001: UDP, length 1470
00:09:06.481021 IP 10.0.0.1.37380 > 10.0.0.2.5001: UDP, length 1470
00:09:06.493118 IP 10.0.0.1.37380 > 10.0.0.2.5001: UDP, length 1470
00:09:06.505213 IP 10.0.0.1.37380 > 10.0.0.2.5001: UDP, length 1470
00:09:06.517521 IP 10.0.0.1.37380 > 10.0.0.2.5001: UDP, length 1470
00:09:06.529400 IP 10.0.0.1.37380 > 10.0.0.2.5001: UDP, length 1470
00:09:06.541502 IP 10.0.0.1.37380 > 10.0.0.2.5001: UDP, length 1470
00:09:06.553601 IP 10.0.0.1.37380 > 10.0.0.2.5001: UDP, length 1470
00:09:06.565691 IP 10.0.0.1.37380 > 10.0.0.2.5001: UDP, length 1470
00:09:06.577787 IP 10.0.0.1.37380 > 10.0.0.2.5001: UDP, length 1470
00:09:06.589895 IP 10.0.0.1.37380 > 10.0.0.2.5001: UDP, length 1470
00:09:06.602001 IP 10.0.0.1.37380 > 10.0.0.2.5001: UDP, length 1470
00:09:06.614077 IP 10.0.0.1.37380 > 10.0.0.2.5001: UDP, length 1470
00:09:06.626195 IP 10.0.0.1.37380 > 10.0.0.2.5001: UDP, length 1470
00:09:06.638612 IP 10.0.0.1.37380 > 10.0.0.2.5001: UDP, length 1470
00:09:06.650363 IP 10.0.0.1.37380 > 10.0.0.2.5001: UDP, length 1470
00:09:06.662448 IP 10.0.0.1.37380 > 10.0.0.2.5001: UDP, length 1470
00:09:06.674557 IP 10.0.0.1.37380 > 10.0.0.2.5001: UDP, length 1470
00:09:06.686652 IP 10.0.0.1.37380 > 10.0.0.2.5001: UDP, length 1470
00:09:06.699555 IP 10.0.0.1.37380 > 10.0.0.2.5001: UDP, length 1470
00:09:06.710894 IP 10.0.0.1.37380 > 10.0.0.2.5001: UDP, length 1470
00:09:06.722928 IP 10.0.0.1.37380 > 10.0.0.2.5001: UDP, length 1470
00:09:06.735038 IP 10.0.0.1.37380 > 10.0.0.2.5001: UDP, length 1470
00:09:06.747137 IP 10.0.0.1.37380 > 10.0.0.2.5001: UDP, length 1470
00:09:06.759222 IP 10.0.0.1.37380 > 10.0.0.2.5001: UDP, length 1470
00:09:06.771347 IP 10.0.0.1.37380 > 10.0.0.2.5001: UDP, length 1470
00:09:06.783408 IP 10.0.0.1.37380 > 10.0.0.2.5001: UDP, length 1470
00:09:06.795510 IP 10.0.0.1.37380 > 10.0.0.2.5001: UDP, length 1470
00:09:06.807610 IP 10.0.0.1.37380 > 10.0.0.2.5001: UDP, length 1470
00:09:06.819750 IP 10.0.0.1.37380 > 10.0.0.2.5001: UDP, length 1470
00:09:06.831800 IP 10.0.0.1.37380 > 10.0.0.2.5001: UDP, length 1470
00:09:06.843925 IP 10.0.0.1.37380 > 10.0.0.2.5001: UDP, length 1470
00:09:06.856000 IP 10.0.0.1.37380 > 10.0.0.2.5001: UDP, length 1470
00:09:06.868093 IP 10.0.0.1.37380 > 10.0.0.2.5001: UDP, length 1470
00:09:06.880189 IP 10.0.0.1.37380 > 10.0.0.2.5001: UDP, length 1470
00:09:06.892278 IP 10.0.0.1.37380 > 10.0.0.2.5001: UDP, length 1470
00:09:06.904388 IP 10.0.0.1.37380 > 10.0.0.2.5001: UDP, length 1470
00:09:06.916479 IP 10.0.0.1.37380 > 10.0.0.2.5001: UDP, length 1470
00:09:06.928579 IP 10.0.0.1.37380 > 10.0.0.2.5001: UDP, length 1470
00:09:06.940684 IP 10.0.0.1.37380 > 10.0.0.2.5001: UDP, length 1470
00:09:06.952762 IP 10.0.0.1.37380 > 10.0.0.2.5001: UDP, length 1470
00:09:06.964872 IP 10.0.0.1.37380 > 10.0.0.2.5001: UDP, length 1470
00:09:06.976968 IP 10.0.0.1.37380 > 10.0.0.2.5001: UDP, length 1470
00:09:06.989053 IP 10.0.0.1.37380 > 10.0.0.2.5001: UDP, length 1470
00:09:07.001172 IP 10.0.0.1.37380 > 10.0.0.2.5001: UDP, length 1470
00:09:07.013899 IP 10.0.0.1.37380 > 10.0.0.2.5001: UDP, length 1470
00:09:07.025342 IP 10.0.0.1.37380 > 10.0.0.2.5001: UDP, length 1470
00:09:07.037444 IP 10.0.0.1.37380 > 10.0.0.2.5001: UDP, length 1470
00:09:07.050254 IP 10.0.0.1.37380 > 10.0.0.2.5001: UDP, length 1470
00:09:07.061627 IP 10.0.0.1.37380 > 10.0.0.2.5001: UDP, length 1470
00:09:07.073724 IP 10.0.0.1.37380 > 10.0.0.2.5001: UDP, length 1470
00:09:07.085844 IP 10.0.0.1.37380 > 10.0.0.2.5001: UDP, length 1470
00:09:07.097910 IP 10.0.0.1.37380 > 10.0.0.2.5001: UDP, length 1470
00:09:07.110012 IP 10.0.0.1.37380 > 10.0.0.2.5001: UDP, length 1470
00:09:07.122104 IP 10.0.0.1.37380 > 10.0.0.2.5001: UDP, length 1470
00:09:07.134205 IP 10.0.0.1.37380 > 10.0.0.2.5001: UDP, length 1470
00:09:07.146298 IP 10.0.0.1.37380 > 10.0.0.2.5001: UDP, length 1470
00:09:07.158398 IP 10.0.0.1.37380 > 10.0.0.2.5001: UDP, length 1470
00:09:07.170488 IP 10.0.0.1.37380 > 10.0.0.2.5001: UDP, length 1470
00:09:07.182588 IP 10.0.0.1.37380 > 10.0.0.2.5001: UDP, length 1470
00:09:07.194710 IP 10.0.0.1.37380 > 10.0.0.2.5001: UDP, length 1470
00:09:07.206780 IP 10.0.0.1.37380 > 10.0.0.2.5001: UDP, length 1470
00:09:07.218900 IP 10.0.0.1.37380 > 10.0.0.2.5001: UDP, length 1470
00:09:07.230980 IP 10.0.0.1.37380 > 10.0.0.2.5001: UDP, length 1470
00:09:07.243087 IP 10.0.0.1.37380 > 10.0.0.2.5001: UDP, length 1470
00:09:07.255166 IP 10.0.0.1.37380 > 10.0.0.2.5001: UDP, length 1470
00:09:07.267265 IP 10.0.0.1.37380 > 10.0.0.2.5001: UDP, length 1470
00:09:07.279379 IP 10.0.0.1.37380 > 10.0.0.2.5001: UDP, length 1470
00:09:07.292179 IP 10.0.0.1.37380 > 10.0.0.2.5001: UDP, length 1470
00:09:07.303551 IP 10.0.0.1.37380 > 10.0.0.2.5001: UDP, length 1470
00:09:07.315645 IP 10.0.0.1.37380 > 10.0.0.2.5001: UDP, length 1470
00:09:07.327733 IP 10.0.0.1.37380 > 10.0.0.2.5001: UDP, length 1470
00:09:07.339870 IP 10.0.0.1.37380 > 10.0.0.2.5001: UDP, length 1470
00:09:07.351952 IP 10.0.0.1.37380 > 10.0.0.2.5001: UDP, length 1470
00:09:07.364030 IP 10.0.0.1.37380 > 10.0.0.2.5001: UDP, length 1470
00:09:07.376139 IP 10.0.0.1.37380 > 10.0.0.2.5001: UDP, length 1470
00:09:07.389031 IP 10.0.0.1.37380 > 10.0.0.2.5001: UDP, length 1470
00:09:07.400312 IP 10.0.0.1.37380 > 10.0.0.2.5001: UDP, length 1470
00:09:07.412417 IP 10.0.0.1.37380 > 10.0.0.2.5001: UDP, length 1470
00:09:07.425246 IP 10.0.0.1.37380 > 10.0.0.2.5001: UDP, length 1470
00:09:07.436621 IP 10.0.0.1.37380 > 10.0.0.2.5001: UDP, length 1470
00:09:07.448700 IP 10.0.0.1.37380 > 10.0.0.2.5001: UDP, length 1470
00:09:07.460996 IP 10.0.0.1.37380 > 10.0.0.2.5001: UDP, length 1470
00:09:07.472893 IP 10.0.0.1.37380 > 10.0.0.2.5001: UDP, length 1470
00:09:07.484991 IP 10.0.0.1.37380 > 10.0.0.2.5001: UDP, length 1470
00:09:07.497802 IP 10.0.0.1.37380 > 10.0.0.2.5001: UDP, length 1470
00:09:07.509178 IP 10.0.0.1.37380 > 10.0.0.2.5001: UDP, length 1470
00:09:07.522073 IP 10.0.0.1.37380 > 10.0.0.2.5001: UDP, length 1470
00:09:07.533401 IP 10.0.0.1.37380 > 10.0.0.2.5001: UDP, length 1470
00:09:07.545452 IP 10.0.0.1.37380 > 10.0.0.2.5001: UDP, length 1470
00:09:07.558279 IP 10.0.0.1.37380 > 10.0.0.2.5001: UDP, length 1470
00:09:07.569708 IP 10.0.0.1.37380 > 10.0.0.2.5001: UDP, length 1470
00:09:07.581758 IP 10.0.0.1.37380 > 10.0.0.2.5001: UDP, length 1470
00:09:07.593872 IP 10.0.0.1.37380 > 10.0.0.2.5001: UDP, length 1470
00:09:07.606724 IP 10.0.0.1.37380 > 10.0.0.2.5001: UDP, length 1470
00:09:07.618044 IP 10.0.0.1.37380 > 10.0.0.2.5001: UDP, length 1470
00:09:07.630140 IP 10.0.0.1.37380 > 10.0.0.2.5001: UDP, length 1470
00:09:07.642235 IP 10.0.0.1.37380 > 10.0.0.2.5001: UDP, length 1470
00:09:07.654343 IP 10.0.0.1.37380 > 10.0.0.2.5001: UDP, length 1470
00:09:07.666449 IP 10.0.0.1.37380 > 10.0.0.2.5001: UDP, length 1470
00:09:07.678532 IP 10.0.0.1.37380 > 10.0.0.2.5001: UDP, length 1470
00:09:07.690615 IP 10.0.0.1.37380 > 10.0.0.2.5001: UDP, length 1470
00:09:07.702710 IP 10.0.0.1.37380 > 10.0.0.2.5001: UDP, length 1470
00:09:07.714812 IP 10.0.0.1.37380 > 10.0.0.2.5001: UDP, length 1470
00:09:07.726909 IP 10.0.0.1.37380 > 10.0.0.2.5001: UDP, length 1470
00:09:07.739022 IP 10.0.0.1.37380 > 10.0.0.2.5001: UDP, length 1470
00:09:07.751094 IP 10.0.0.1.37380 > 10.0.0.2.5001: UDP, length 1470
00:09:07.763196 IP 10.0.0.1.37380 > 10.0.0.2.5001: UDP, length 1470
00:09:07.775288 IP 10.0.0.1.37380 > 10.0.0.2.5001: UDP, length 1470
00:09:07.787385 IP 10.0.0.1.37380 > 10.0.0.2.5001: UDP, length 1470
00:09:07.799486 IP 10.0.0.1.37380 > 10.0.0.2.5001: UDP, length 1470
00:09:07.811582 IP 10.0.0.1.37380 > 10.0.0.2.5001: UDP, length 1470
00:09:07.823676 IP 10.0.0.1.37380 > 10.0.0.2.5001: UDP, length 1470
00:09:07.836607 IP 10.0.0.1.37380 > 10.0.0.2.5001: UDP, length 1470
00:09:07.847870 IP 10.0.0.1.37380 > 10.0.0.2.5001: UDP, length 1470
00:09:07.859966 IP 10.0.0.1.37380 > 10.0.0.2.5001: UDP, length 1470
00:09:07.872887 IP 10.0.0.1.37380 > 10.0.0.2.5001: UDP, length 1470
00:09:07.884157 IP 10.0.0.1.37380 > 10.0.0.2.5001: UDP, length 1470
00:09:07.896255 IP 10.0.0.1.37380 > 10.0.0.2.5001: UDP, length 1470
00:09:07.908343 IP 10.0.0.1.37380 > 10.0.0.2.5001: UDP, length 1470
00:09:07.920445 IP 10.0.0.1.37380 > 10.0.0.2.5001: UDP, length 1470
00:09:07.932527 IP 10.0.0.1.37380 > 10.0.0.2.5001: UDP, length 1470
00:09:07.944657 IP 10.0.0.1.37380 > 10.0.0.2.5001: UDP, length 1470
00:09:07.956737 IP 10.0.0.1.37380 > 10.0.0.2.5001: UDP, length 1470
00:09:07.968854 IP 10.0.0.1.37380 > 10.0.0.2.5001: UDP, length 1470
00:09:07.981437 IP 10.0.0.1.37380 > 10.0.0.2.5001: UDP, length 1470
00:09:07.993019 IP 10.0.0.1.37380 > 10.0.0.2.5001: UDP, length 1470
00:09:08.005124 IP 10.0.0.1.37380 > 10.0.0.2.5001: UDP, length 1470
00:09:08.017212 IP 10.0.0.1.37380 > 10.0.0.2.5001: UDP, length 1470
00:09:08.029312 IP 10.0.0.1.37380 > 10.0.0.2.5001: UDP, length 1470
00:09:08.041403 IP 10.0.0.1.37380 > 10.0.0.2.5001: UDP, length 1470
00:09:08.053521 IP 10.0.0.1.37380 > 10.0.0.2.5001: UDP, length 1470
00:09:08.065587 IP 10.0.0.1.37380 > 10.0.0.2.5001: UDP, length 1470
00:09:08.077689 IP 10.0.0.1.37380 > 10.0.0.2.5001: UDP, length 1470
00:09:08.089789 IP 10.0.0.1.37380 > 10.0.0.2.5001: UDP, length 1470
00:09:08.101888 IP 10.0.0.1.37380 > 10.0.0.2.5001: UDP, length 1470
00:09:08.113977 IP 10.0.0.1.37380 > 10.0.0.2.5001: UDP, length 1470
00:09:08.126111 IP 10.0.0.1.37380 > 10.0.0.2.5001: UDP, length 1470
00:09:08.138173 IP 10.0.0.1.37380 > 10.0.0.2.5001: UDP, length 1470
00:09:08.150262 IP 10.0.0.1.37380 > 10.0.0.2.5001: UDP, length 1470
00:09:08.162362 IP 10.0.0.1.37380 > 10.0.0.2.5001: UDP, length 1470
00:09:08.174464 IP 10.0.0.1.37380 > 10.0.0.2.5001: UDP, length 1470
00:09:08.186556 IP 10.0.0.1.37380 > 10.0.0.2.5001: UDP, length 1470
00:09:08.198654 IP 10.0.0.1.37380 > 10.0.0.2.5001: UDP, length 1470
00:09:08.210748 IP 10.0.0.1.37380 > 10.0.0.2.5001: UDP, length 1470
00:09:08.222844 IP 10.0.0.1.37380 > 10.0.0.2.5001: UDP, length 1470
00:09:08.234938 IP 10.0.0.1.37380 > 10.0.0.2.5001: UDP, length 1470
00:09:08.247078 IP 10.0.0.1.37380 > 10.0.0.2.5001: UDP, length 1470
00:09:08.259117 IP 10.0.0.1.37380 > 10.0.0.2.5001: UDP, length 1470
00:09:08.271241 IP 10.0.0.1.37380 > 10.0.0.2.5001: UDP, length 1470
00:09:08.284160 IP 10.0.0.1.37380 > 10.0.0.2.5001: UDP, length 1470
00:09:08.295412 IP 10.0.0.1.37380 > 10.0.0.2.5001: UDP, length 1470
00:09:08.307539 IP 10.0.0.1.37380 > 10.0.0.2.5001: UDP, length 1470
00:09:08.319620 IP 10.0.0.1.37380 > 10.0.0.2.5001: UDP, length 1470
00:09:08.331711 IP 10.0.0.1.37380 > 10.0.0.2.5001: UDP, length 1470
00:09:08.343838 IP 10.0.0.1.37380 > 10.0.0.2.5001: UDP, length 1470
00:09:08.355901 IP 10.0.0.1.37380 > 10.0.0.2.5001: UDP, length 1470
00:09:08.367998 IP 10.0.0.1.37380 > 10.0.0.2.5001: UDP, length 1470
00:09:08.380101 IP 10.0.0.1.37380 > 10.0.0.2.5001: UDP, length 1470
00:09:08.393113 IP 10.0.0.1.37380 > 10.0.0.2.5001: UDP, length 1470
00:09:08.404293 IP 10.0.0.1.37380 > 10.0.0.2.5001: UDP, length 1470
00:09:08.416379 IP 10.0.0.1.37380 > 10.0.0.2.5001: UDP, length 1470
00:09:08.428474 IP 10.0.0.1.37380 > 10.0.0.2.5001: UDP, length 1470
00:09:08.440585 IP 10.0.0.1.37380 > 10.0.0.2.5001: UDP, length 1470
00:09:08.452666 IP 10.0.0.1.37380 > 10.0.0.2.5001: UDP, length 1470
00:09:08.465561 IP 10.0.0.1.37380 > 10.0.0.2.5001: UDP, length 1470
00:09:08.476874 IP 10.0.0.1.37380 > 10.0.0.2.5001: UDP, length 1470
00:09:08.488957 IP 10.0.0.1.37380 > 10.0.0.2.5001: UDP, length 1470
00:09:08.501076 IP 10.0.0.1.37380 > 10.0.0.2.5001: UDP, length 1470
00:09:08.513136 IP 10.0.0.1.37380 > 10.0.0.2.5001: UDP, length 1470
00:09:08.525238 IP 10.0.0.1.37380 > 10.0.0.2.5001: UDP, length 1470
00:09:08.537339 IP 10.0.0.1.37380 > 10.0.0.2.5001: UDP, length 1470
00:09:08.549435 IP 10.0.0.1.37380 > 10.0.0.2.5001: UDP, length 1470
00:09:08.561531 IP 10.0.0.1.37380 > 10.0.0.2.5001: UDP, length 1470
00:09:08.573639 IP 10.0.0.1.37380 > 10.0.0.2.5001: UDP, length 1470
00:09:08.585727 IP 10.0.0.1.37380 > 10.0.0.2.5001: UDP, length 1470
00:09:08.597826 IP 10.0.0.1.37380 > 10.0.0.2.5001: UDP, length 1470
00:09:08.609915 IP 10.0.0.1.37380 > 10.0.0.2.5001: UDP, length 1470
00:09:08.622014 IP 10.0.0.1.37380 > 10.0.0.2.5001: UDP, length 1470
00:09:08.634111 IP 10.0.0.1.37380 > 10.0.0.2.5001: UDP, length 1470
00:09:08.646210 IP 10.0.0.1.37380 > 10.0.0.2.5001: UDP, length 1470
00:09:08.658299 IP 10.0.0.1.37380 > 10.0.0.2.5001: UDP, length 1470
00:09:08.670392 IP 10.0.0.1.37380 > 10.0.0.2.5001: UDP, length 1470
00:09:08.682492 IP 10.0.0.1.37380 > 10.0.0.2.5001: UDP, length 1470
00:09:08.695378 IP 10.0.0.1.37380 > 10.0.0.2.5001: UDP, length 1470
00:09:08.706847 IP 10.0.0.1.37380 > 10.0.0.2.5001: UDP, length 1470
00:09:08.718788 IP 10.0.0.1.37380 > 10.0.0.2.5001: UDP, length 1470
00:09:08.730866 IP 10.0.0.1.37380 > 10.0.0.2.5001: UDP, length 1470
00:09:08.742966 IP 10.0.0.1.37380 > 10.0.0.2.5001: UDP, length 1470
00:09:08.755066 IP 10.0.0.1.37380 > 10.0.0.2.5001: UDP, length 1470
00:09:08.767156 IP 10.0.0.1.37380 > 10.0.0.2.5001: UDP, length 1470
00:09:08.779258 IP 10.0.0.1.37380 > 10.0.0.2.5001: UDP, length 1470
00:09:08.791355 IP 10.0.0.1.37380 > 10.0.0.2.5001: UDP, length 1470
00:09:08.803455 IP 10.0.0.1.37380 > 10.0.0.2.5001: UDP, length 1470
00:09:08.815544 IP 10.0.0.1.37380 > 10.0.0.2.5001: UDP, length 1470
00:09:08.827656 IP 10.0.0.1.37380 > 10.0.0.2.5001: UDP, length 1470
00:09:08.839744 IP 10.0.0.1.37380 > 10.0.0.2.5001: UDP, length 1470
00:09:08.851845 IP 10.0.0.1.37380 > 10.0.0.2.5001: UDP, length 1470
00:09:08.864606 IP 10.0.0.1.37380 > 10.0.0.2.5001: UDP, length 1470
00:09:08.876063 IP 10.0.0.1.37380 > 10.0.0.2.5001: UDP, length 1470
00:09:08.888147 IP 10.0.0.1.37380 > 10.0.0.2.5001: UDP, length 1470
00:09:08.900216 IP 10.0.0.1.37380 > 10.0.0.2.5001: UDP, length 1470

