00:09:09.607990 IP 10.0.0.1.36598 > 10.0.0.2.5001: UDP, length 1470
00:09:09.607991 IP 10.0.0.1.36598 > 10.0.0.2.5001: UDP, length 1470
00:09:09.621127 IP 10.0.0.1.36598 > 10.0.0.2.5001: UDP, length 1470
00:09:09.631497 IP 10.0.0.1.36598 > 10.0.0.2.5001: UDP, length 1470
00:09:09.643592 IP 10.0.0.1.36598 > 10.0.0.2.5001: UDP, length 1470
00:09:09.655704 IP 10.0.0.1.36598 > 10.0.0.2.5001: UDP, length 1470
00:09:09.667806 IP 10.0.0.1.36598 > 10.0.0.2.5001: UDP, length 1470
00:09:09.679891 IP 10.0.0.1.36598 > 10.0.0.2.5001: UDP, length 1470
00:09:09.691979 IP 10.0.0.1.36598 > 10.0.0.2.5001: UDP, length 1470
00:09:09.704078 IP 10.0.0.1.36598 > 10.0.0.2.5001: UDP, length 1470
00:09:09.716181 IP 10.0.0.1.36598 > 10.0.0.2.5001: UDP, length 1470
00:09:09.728282 IP 10.0.0.1.36598 > 10.0.0.2.5001: UDP, length 1470
00:09:09.740367 IP 10.0.0.1.36598 > 10.0.0.2.5001: UDP, length 1470
00:09:09.752466 IP 10.0.0.1.36598 > 10.0.0.2.5001: UDP, length 1470
00:09:09.764555 IP 10.0.0.1.36598 > 10.0.0.2.5001: UDP, length 1470
00:09:09.776644 IP 10.0.0.1.36598 > 10.0.0.2.5001: UDP, length 1470
00:09:09.792323 IP 10.0.0.1.36598 > 10.0.0.2.5001: UDP, length 1470
00:09:09.803629 IP 10.0.0.1.36598 > 10.0.0.2.5001: UDP, length 1470
00:09:09.816631 IP 10.0.0.1.36598 > 10.0.0.2.5001: UDP, length 1470
00:09:09.827899 IP 10.0.0.1.36598 > 10.0.0.2.5001: UDP, length 1470
00:09:09.839966 IP 10.0.0.1.36598 > 10.0.0.2.5001: UDP, length 1470
00:09:09.852891 IP 10.0.0.1.36598 > 10.0.0.2.5001: UDP, length 1470
00:09:09.864176 IP 10.0.0.1.36598 > 10.0.0.2.5001: UDP, length 1470
00:09:09.876995 IP 10.0.0.1.36598 > 10.0.0.2.5001: UDP, length 1470
00:09:09.888354 IP 10.0.0.1.36598 > 10.0.0.2.5001: UDP, length 1470
00:09:09.900409 IP 10.0.0.1.36598 > 10.0.0.2.5001: UDP, length 1470
00:09:09.912562 IP 10.0.0.1.36598 > 10.0.0.2.5001: UDP, length 1470
00:09:09.924602 IP 10.0.0.1.36598 > 10.0.0.2.5001: UDP, length 1470
00:09:09.936733 IP 10.0.0.1.36598 > 10.0.0.2.5001: UDP, length 1470
00:09:09.948856 IP 10.0.0.1.36598 > 10.0.0.2.5001: UDP, length 1470
00:09:09.960923 IP 10.0.0.1.36598 > 10.0.0.2.5001: UDP, length 1470
00:09:09.973024 IP 10.0.0.1.36598 > 10.0.0.2.5001: UDP, length 1470
00:09:09.985124 IP 10.0.0.1.36598 > 10.0.0.2.5001: UDP, length 1470
00:09:09.997187 IP 10.0.0.1.36598 > 10.0.0.2.5001: UDP, length 1470
00:09:10.009322 IP 10.0.0.1.36598 > 10.0.0.2.5001: UDP, length 1470
00:09:10.021416 IP 10.0.0.1.36598 > 10.0.0.2.5001: UDP, length 1470
00:09:10.033511 IP 10.0.0.1.36598 > 10.0.0.2.5001: UDP, length 1470
00:09:10.045629 IP 10.0.0.1.36598 > 10.0.0.2.5001: UDP, length 1470
00:09:10.057695 IP 10.0.0.1.36598 > 10.0.0.2.5001: UDP, length 1470
00:09:10.069864 IP 10.0.0.1.36598 > 10.0.0.2.5001: UDP, length 1470
00:09:10.094264 IP 10.0.0.1.36598 > 10.0.0.2.5001: UDP, length 1470
00:09:10.106088 IP 10.0.0.1.36598 > 10.0.0.2.5001: UDP, length 1470
00:09:10.130261 IP 10.0.0.1.36598 > 10.0.0.2.5001: UDP, length 1470
00:09:10.142376 IP 10.0.0.1.36598 > 10.0.0.2.5001: UDP, length 1470
00:09:10.155284 IP 10.0.0.1.36598 > 10.0.0.2.5001: UDP, length 1470
00:09:10.166563 IP 10.0.0.1.36598 > 10.0.0.2.5001: UDP, length 1470
00:09:10.178625 IP 10.0.0.1.36598 > 10.0.0.2.5001: UDP, length 1470
00:09:10.191693 IP 10.0.0.1.36598 > 10.0.0.2.5001: UDP, length 1470
00:09:10.202851 IP 10.0.0.1.36598 > 10.0.0.2.5001: UDP, length 1470
00:09:10.215744 IP 10.0.0.1.36598 > 10.0.0.2.5001: UDP, length 1470
00:09:10.227068 IP 10.0.0.1.36598 > 10.0.0.2.5001: UDP, length 1470
00:09:10.239903 IP 10.0.0.1.36598 > 10.0.0.2.5001: UDP, length 1470
00:09:10.251220 IP 10.0.0.1.36598 > 10.0.0.2.5001: UDP, length 1470
00:09:10.263336 IP 10.0.0.1.36598 > 10.0.0.2.5001: UDP, length 1470
00:09:10.276260 IP 10.0.0.1.36598 > 10.0.0.2.5001: UDP, length 1470
00:09:10.287516 IP 10.0.0.1.36598 > 10.0.0.2.5001: UDP, length 1470
00:09:10.300355 IP 10.0.0.1.36598 > 10.0.0.2.5001: UDP, length 1470
00:09:10.311709 IP 10.0.0.1.36598 > 10.0.0.2.5001: UDP, length 1470
00:09:10.324597 IP 10.0.0.1.36598 > 10.0.0.2.5001: UDP, length 1470
00:09:10.335901 IP 10.0.0.1.36598 > 10.0.0.2.5001: UDP, length 1470
00:09:10.347978 IP 10.0.0.1.36598 > 10.0.0.2.5001: UDP, length 1470
00:09:10.360092 IP 10.0.0.1.36598 > 10.0.0.2.5001: UDP, length 1470
00:09:10.372179 IP 10.0.0.1.36598 > 10.0.0.2.5001: UDP, length 1470
00:09:10.384287 IP 10.0.0.1.36598 > 10.0.0.2.5001: UDP, length 1470
00:09:10.396381 IP 10.0.0.1.36598 > 10.0.0.2.5001: UDP, length 1470
00:09:10.408493 IP 10.0.0.1.36598 > 10.0.0.2.5001: UDP, length 1470
00:09:10.420573 IP 10.0.0.1.36598 > 10.0.0.2.5001: UDP, length 1470
00:09:10.432680 IP 10.0.0.1.36598 > 10.0.0.2.5001: UDP, length 1470
00:09:10.444800 IP 10.0.0.1.36598 > 10.0.0.2.5001: UDP, length 1470
00:09:10.456868 IP 10.0.0.1.36598 > 10.0.0.2.5001: UDP, length 1470
00:09:10.468958 IP 10.0.0.1.36598 > 10.0.0.2.5001: UDP, length 1470
00:09:10.481340 IP 10.0.0.1.36598 > 10.0.0.2.5001: UDP, length 1470
00:09:10.493139 IP 10.0.0.1.36598 > 10.0.0.2.5001: UDP, length 1470
00:09:10.505262 IP 10.0.0.1.36598 > 10.0.0.2.5001: UDP, length 1470
00:09:10.517329 IP 10.0.0.1.36598 > 10.0.0.2.5001: UDP, length 1470
00:09:10.529424 IP 10.0.0.1.36598 > 10.0.0.2.5001: UDP, length 1470
00:09:10.541507 IP 10.0.0.1.36598 > 10.0.0.2.5001: UDP, length 1470
00:09:10.553650 IP 10.0.0.1.36598 > 10.0.0.2.5001: UDP, length 1470
00:09:10.565686 IP 10.0.0.1.36598 > 10.0.0.2.5001: UDP, length 1470
00:09:10.577840 IP 10.0.0.1.36598 > 10.0.0.2.5001: UDP, length 1470
00:09:10.590817 IP 10.0.0.1.36598 > 10.0.0.2.5001: UDP, length 1470
00:09:10.602001 IP 10.0.0.1.36598 > 10.0.0.2.5001: UDP, length 1470
00:09:10.614138 IP 10.0.0.1.36598 > 10.0.0.2.5001: UDP, length 1470
00:09:10.626908 IP 10.0.0.1.36598 > 10.0.0.2.5001: UDP, length 1470
00:09:10.638334 IP 10.0.0.1.36598 > 10.0.0.2.5001: UDP, length 1470
00:09:10.651173 IP 10.0.0.1.36598 > 10.0.0.2.5001: UDP, length 1470
00:09:10.662469 IP 10.0.0.1.36598 > 10.0.0.2.5001: UDP, length 1470
00:09:10.674555 IP 10.0.0.1.36598 > 10.0.0.2.5001: UDP, length 1470
00:09:10.687492 IP 10.0.0.1.36598 > 10.0.0.2.5001: UDP, length 1470
00:09:10.698809 IP 10.0.0.1.36598 > 10.0.0.2.5001: UDP, length 1470
00:09:10.710856 IP 10.0.0.1.36598 > 10.0.0.2.5001: UDP, length 1470
00:09:10.722979 IP 10.0.0.1.36598 > 10.0.0.2.5001: UDP, length 1470
00:09:10.735109 IP 10.0.0.1.36598 > 10.0.0.2.5001: UDP, length 1470
00:09:10.747157 IP 10.0.0.1.36598 > 10.0.0.2.5001: UDP, length 1470
00:09:10.759239 IP 10.0.0.1.36598 > 10.0.0.2.5001: UDP, length 1470
00:09:10.771314 IP 10.0.0.1.36598 > 10.0.0.2.5001: UDP, length 1470
00:09:10.783452 IP 10.0.0.1.36598 > 10.0.0.2.5001: UDP, length 1470
00:09:10.795537 IP 10.0.0.1.36598 > 10.0.0.2.5001: UDP, length 1470
00:09:10.807633 IP 10.0.0.1.36598 > 10.0.0.2.5001: UDP, length 1470
00:09:10.831841 IP 10.0.0.1.36598 > 10.0.0.2.5001: UDP, length 1470
00:09:10.843943 IP 10.0.0.1.36598 > 10.0.0.2.5001: UDP, length 1470
00:09:10.856030 IP 10.0.0.1.36598 > 10.0.0.2.5001: UDP, length 1470
00:09:10.868111 IP 10.0.0.1.36598 > 10.0.0.2.5001: UDP, length 1470
00:09:10.880229 IP 10.0.0.1.36598 > 10.0.0.2.5001: UDP, length 1470
00:09:10.892342 IP 10.0.0.1.36598 > 10.0.0.2.5001: UDP, length 1470
00:09:10.904405 IP 10.0.0.1.36598 > 10.0.0.2.5001: UDP, length 1470
00:09:10.916516 IP 10.0.0.1.36598 > 10.0.0.2.5001: UDP, length 1470
00:09:10.928597 IP 10.0.0.1.36598 > 10.0.0.2.5001: UDP, length 1470
00:09:10.940981 IP 10.0.0.1.36598 > 10.0.0.2.5001: UDP, length 1470
00:09:10.964898 IP 10.0.0.1.36598 > 10.0.0.2.5001: UDP, length 1470
00:09:10.977077 IP 10.0.0.1.36598 > 10.0.0.2.5001: UDP, length 1470
00:09:10.989078 IP 10.0.0.1.36598 > 10.0.0.2.5001: UDP, length 1470
00:09:11.001179 IP 10.0.0.1.36598 > 10.0.0.2.5001: UDP, length 1470
00:09:11.013247 IP 10.0.0.1.36598 > 10.0.0.2.5001: UDP, length 1470
00:09:11.038219 IP 10.0.0.1.36598 > 10.0.0.2.5001: UDP, length 1470
00:09:11.049582 IP 10.0.0.1.36598 > 10.0.0.2.5001: UDP, length 1470
00:09:11.061831 IP 10.0.0.1.36598 > 10.0.0.2.5001: UDP, length 1470
00:09:11.073741 IP 10.0.0.1.36598 > 10.0.0.2.5001: UDP, length 1470
00:09:11.085867 IP 10.0.0.1.36598 > 10.0.0.2.5001: UDP, length 1470
00:09:11.097968 IP 10.0.0.1.36598 > 10.0.0.2.5001: UDP, length 1470
00:09:11.110816 IP 10.0.0.1.36598 > 10.0.0.2.5001: UDP, length 1470
00:09:11.122139 IP 10.0.0.1.36598 > 10.0.0.2.5001: UDP, length 1470
00:09:11.135003 IP 10.0.0.1.36598 > 10.0.0.2.5001: UDP, length 1470
00:09:11.146336 IP 10.0.0.1.36598 > 10.0.0.2.5001: UDP, length 1470
00:09:11.158435 IP 10.0.0.1.36598 > 10.0.0.2.5001: UDP, length 1470
00:09:11.170556 IP 10.0.0.1.36598 > 10.0.0.2.5001: UDP, length 1470
00:09:11.182616 IP 10.0.0.1.36598 > 10.0.0.2.5001: UDP, length 1470
00:09:11.194725 IP 10.0.0.1.36598 > 10.0.0.2.5001: UDP, length 1470
00:09:11.206827 IP 10.0.0.1.36598 > 10.0.0.2.5001: UDP, length 1470
00:09:11.218940 IP 10.0.0.1.36598 > 10.0.0.2.5001: UDP, length 1470
00:09:11.243854 IP 10.0.0.1.36598 > 10.0.0.2.5001: UDP, length 1470
00:09:11.255197 IP 10.0.0.1.36598 > 10.0.0.2.5001: UDP, length 1470
00:09:11.267307 IP 10.0.0.1.36598 > 10.0.0.2.5001: UDP, length 1470
00:09:11.291490 IP 10.0.0.1.36598 > 10.0.0.2.5001: UDP, length 1470
00:09:11.303589 IP 10.0.0.1.36598 > 10.0.0.2.5001: UDP, length 1470
00:09:11.315681 IP 10.0.0.1.36598 > 10.0.0.2.5001: UDP, length 1470
00:09:11.327798 IP 10.0.0.1.36598 > 10.0.0.2.5001: UDP, length 1470
00:09:11.339876 IP 10.0.0.1.36598 > 10.0.0.2.5001: UDP, length 1470
00:09:11.351964 IP 10.0.0.1.36598 > 10.0.0.2.5001: UDP, length 1470
00:09:11.364072 IP 10.0.0.1.36598 > 10.0.0.2.5001: UDP, length 1470
00:09:11.376141 IP 10.0.0.1.36598 > 10.0.0.2.5001: UDP, length 1470
00:09:11.388242 IP 10.0.0.1.36598 > 10.0.0.2.5001: UDP, length 1470
00:09:11.400315 IP 10.0.0.1.36598 > 10.0.0.2.5001: UDP, length 1470
00:09:11.412449 IP 10.0.0.1.36598 > 10.0.0.2.5001: UDP, length 1470
00:09:11.424544 IP 10.0.0.1.36598 > 10.0.0.2.5001: UDP, length 1470
00:09:11.436642 IP 10.0.0.1.36598 > 10.0.0.2.5001: UDP, length 1470
00:09:11.449157 IP 10.0.0.1.36598 > 10.0.0.2.5001: UDP, length 1470
00:09:11.460851 IP 10.0.0.1.36598 > 10.0.0.2.5001: UDP, length 1470
00:09:11.472932 IP 10.0.0.1.36598 > 10.0.0.2.5001: UDP, length 1470
00:09:11.485010 IP 10.0.0.1.36598 > 10.0.0.2.5001: UDP, length 1470
00:09:11.509181 IP 10.0.0.1.36598 > 10.0.0.2.5001: UDP, length 1470
00:09:11.521305 IP 10.0.0.1.36598 > 10.0.0.2.5001: UDP, length 1470
00:09:11.533404 IP 10.0.0.1.36598 > 10.0.0.2.5001: UDP, length 1470
00:09:11.545519 IP 10.0.0.1.36598 > 10.0.0.2.5001: UDP, length 1470
00:09:11.557593 IP 10.0.0.1.36598 > 10.0.0.2.5001: UDP, length 1470
00:09:11.570478 IP 10.0.0.1.36598 > 10.0.0.2.5001: UDP, length 1470
00:09:11.581790 IP 10.0.0.1.36598 > 10.0.0.2.5001: UDP, length 1470
00:09:11.594060 IP 10.0.0.1.36598 > 10.0.0.2.5001: UDP, length 1470
00:09:11.605998 IP 10.0.0.1.36598 > 10.0.0.2.5001: UDP, length 1470
00:09:11.618051 IP 10.0.0.1.36598 > 10.0.0.2.5001: UDP, length 1470
00:09:11.630127 IP 10.0.0.1.36598 > 10.0.0.2.5001: UDP, length 1470
00:09:11.642282 IP 10.0.0.1.36598 > 10.0.0.2.5001: UDP, length 1470
00:09:11.654321 IP 10.0.0.1.36598 > 10.0.0.2.5001: UDP, length 1470
00:09:11.666415 IP 10.0.0.1.36598 > 10.0.0.2.5001: UDP, length 1470
00:09:11.678645 IP 10.0.0.1.36598 > 10.0.0.2.5001: UDP, length 1470
00:09:11.690657 IP 10.0.0.1.36598 > 10.0.0.2.5001: UDP, length 1470
00:09:11.703497 IP 10.0.0.1.36598 > 10.0.0.2.5001: UDP, length 1470
00:09:11.714870 IP 10.0.0.1.36598 > 10.0.0.2.5001: UDP, length 1470
00:09:11.727722 IP 10.0.0.1.36598 > 10.0.0.2.5001: UDP, length 1470
00:09:11.739005 IP 10.0.0.1.36598 > 10.0.0.2.5001: UDP, length 1470
00:09:11.751120 IP 10.0.0.1.36598 > 10.0.0.2.5001: UDP, length 1470
00:09:11.763229 IP 10.0.0.1.36598 > 10.0.0.2.5001: UDP, length 1470
00:09:11.775324 IP 10.0.0.1.36598 > 10.0.0.2.5001: UDP, length 1470
00:09:11.799546 IP 10.0.0.1.36598 > 10.0.0.2.5001: UDP, length 1470
00:09:11.811632 IP 10.0.0.1.36598 > 10.0.0.2.5001: UDP, length 1470
00:09:11.823678 IP 10.0.0.1.36598 > 10.0.0.2.5001: UDP, length 1470
00:09:11.836049 IP 10.0.0.1.36598 > 10.0.0.2.5001: UDP, length 1470
00:09:11.847920 IP 10.0.0.1.36598 > 10.0.0.2.5001: UDP, length 1470
00:09:11.859959 IP 10.0.0.1.36598 > 10.0.0.2.5001: UDP, length 1470
00:09:11.872054 IP 10.0.0.1.36598 > 10.0.0.2.5001: UDP, length 1470
00:09:11.884184 IP 10.0.0.1.36598 > 10.0.0.2.5001: UDP, length 1470
00:09:11.897160 IP 10.0.0.1.36598 > 10.0.0.2.5001: UDP, length 1470
00:09:11.908393 IP 10.0.0.1.36598 > 10.0.0.2.5001: UDP, length 1470
00:09:11.920468 IP 10.0.0.1.36598 > 10.0.0.2.5001: UDP, length 1470
00:09:11.933377 IP 10.0.0.1.36598 > 10.0.0.2.5001: UDP, length 1470
00:09:11.944702 IP 10.0.0.1.36598 > 10.0.0.2.5001: UDP, length 1470
00:09:11.957221 IP 10.0.0.1.36598 > 10.0.0.2.5001: UDP, length 1470
00:09:11.968904 IP 10.0.0.1.36598 > 10.0.0.2.5001: UDP, length 1470
00:09:11.980947 IP 10.0.0.1.36598 > 10.0.0.2.5001: UDP, length 1470
00:09:11.993846 IP 10.0.0.1.36598 > 10.0.0.2.5001: UDP, length 1470
00:09:12.005148 IP 10.0.0.1.36598 > 10.0.0.2.5001: UDP, length 1470
00:09:12.017211 IP 10.0.0.1.36598 > 10.0.0.2.5001: UDP, length 1470
00:09:12.029368 IP 10.0.0.1.36598 > 10.0.0.2.5001: UDP, length 1470
00:09:12.041406 IP 10.0.0.1.36598 > 10.0.0.2.5001: UDP, length 1470
00:09:12.054339 IP 10.0.0.1.36598 > 10.0.0.2.5001: UDP, length 1470
00:09:12.065623 IP 10.0.0.1.36598 > 10.0.0.2.5001: UDP, length 1470
00:09:12.077708 IP 10.0.0.1.36598 > 10.0.0.2.5001: UDP, length 1470
00:09:12.089849 IP 10.0.0.1.36598 > 10.0.0.2.5001: UDP, length 1470
00:09:12.101927 IP 10.0.0.1.36598 > 10.0.0.2.5001: UDP, length 1470
00:09:12.114014 IP 10.0.0.1.36598 > 10.0.0.2.5001: UDP, length 1470
00:09:12.126686 IP 10.0.0.1.36598 > 10.0.0.2.5001: UDP, length 1470
00:09:12.138202 IP 10.0.0.1.36598 > 10.0.0.2.5001: UDP, length 1470
00:09:12.150250 IP 10.0.0.1.36598 > 10.0.0.2.5001: UDP, length 1470
00:09:12.162407 IP 10.0.0.1.36598 > 10.0.0.2.5001: UDP, length 1470
00:09:12.174467 IP 10.0.0.1.36598 > 10.0.0.2.5001: UDP, length 1470
00:09:12.186568 IP 10.0.0.1.36598 > 10.0.0.2.5001: UDP, length 1470
00:09:12.198692 IP 10.0.0.1.36598 > 10.0.0.2.5001: UDP, length 1470
00:09:12.210762 IP 10.0.0.1.36598 > 10.0.0.2.5001: UDP, length 1470
00:09:12.222879 IP 10.0.0.1.36598 > 10.0.0.2.5001: UDP, length 1470
00:09:12.234969 IP 10.0.0.1.36598 > 10.0.0.2.5001: UDP, length 1470
00:09:12.247074 IP 10.0.0.1.36598 > 10.0.0.2.5001: UDP, length 1470
00:09:12.259139 IP 10.0.0.1.36598 > 10.0.0.2.5001: UDP, length 1470
00:09:12.271266 IP 10.0.0.1.36598 > 10.0.0.2.5001: UDP, length 1470
00:09:12.283351 IP 10.0.0.1.36598 > 10.0.0.2.5001: UDP, length 1470
00:09:12.296280 IP 10.0.0.1.36598 > 10.0.0.2.5001: UDP, length 1470
00:09:12.307551 IP 10.0.0.1.36598 > 10.0.0.2.5001: UDP, length 1470
00:09:12.320529 IP 10.0.0.1.36598 > 10.0.0.2.5001: UDP, length 1470
00:09:12.331714 IP 10.0.0.1.36598 > 10.0.0.2.5001: UDP, length 1470
00:09:12.343798 IP 10.0.0.1.36598 > 10.0.0.2.5001: UDP, length 1470
00:09:12.355954 IP 10.0.0.1.36598 > 10.0.0.2.5001: UDP, length 1470
00:09:12.367983 IP 10.0.0.1.36598 > 10.0.0.2.5001: UDP, length 1470
00:09:12.380144 IP 10.0.0.1.36598 > 10.0.0.2.5001: UDP, length 1470
00:09:12.393013 IP 10.0.0.1.36598 > 10.0.0.2.5001: UDP, length 1470
00:09:12.404290 IP 10.0.0.1.36598 > 10.0.0.2.5001: UDP, length 1470
00:09:12.416442 IP 10.0.0.1.36598 > 10.0.0.2.5001: UDP, length 1470
00:09:12.429426 IP 10.0.0.1.36598 > 10.0.0.2.5001: UDP, length 1470
00:09:12.440605 IP 10.0.0.1.36598 > 10.0.0.2.5001: UDP, length 1470
00:09:12.452732 IP 10.0.0.1.36598 > 10.0.0.2.5001: UDP, length 1470
00:09:12.465573 IP 10.0.0.1.36598 > 10.0.0.2.5001: UDP, length 1470
00:09:12.476943 IP 10.0.0.1.36598 > 10.0.0.2.5001: UDP, length 1470
00:09:12.488983 IP 10.0.0.1.36598 > 10.0.0.2.5001: UDP, length 1470
00:09:12.513178 IP 10.0.0.1.36598 > 10.0.0.2.5001: UDP, length 1470
00:09:12.525237 IP 10.0.0.1.36598 > 10.0.0.2.5001: UDP, length 1470
00:09:12.537351 IP 10.0.0.1.36598 > 10.0.0.2.5001: UDP, length 1470
00:09:12.549487 IP 10.0.0.1.36598 > 10.0.0.2.5001: UDP, length 1470
00:09:12.561570 IP 10.0.0.1.36598 > 10.0.0.2.5001: UDP, length 1470
00:09:12.573666 IP 10.0.0.1.36598 > 10.0.0.2.5001: UDP, length 1470
00:09:12.585777 IP 10.0.0.1.36598 > 10.0.0.2.5001: UDP, length 1470
00:09:12.597846 IP 10.0.0.1.36598 > 10.0.0.2.5001: UDP, length 1470
00:09:12.609944 IP 10.0.0.1.36598 > 10.0.0.2.5001: UDP, length 1470
00:09:12.622039 IP 10.0.0.1.36598 > 10.0.0.2.5001: UDP, length 1470
00:09:12.635110 IP 10.0.0.1.36598 > 10.0.0.2.5001: UDP, length 1470
00:09:12.646187 IP 10.0.0.1.36598 > 10.0.0.2.5001: UDP, length 1470
00:09:12.658321 IP 10.0.0.1.36598 > 10.0.0.2.5001: UDP, length 1470
00:09:12.670390 IP 10.0.0.1.36598 > 10.0.0.2.5001: UDP, length 1470
00:09:12.683301 IP 10.0.0.1.36598 > 10.0.0.2.5001: UDP, length 1470
00:09:12.694602 IP 10.0.0.1.36598 > 10.0.0.2.5001: UDP, length 1470
00:09:12.706712 IP 10.0.0.1.36598 > 10.0.0.2.5001: UDP, length 1470
00:09:12.718818 IP 10.0.0.1.36598 > 10.0.0.2.5001: UDP, length 1470
00:09:12.730879 IP 10.0.0.1.36598 > 10.0.0.2.5001: UDP, length 1470
00:09:12.742991 IP 10.0.0.1.36598 > 10.0.0.2.5001: UDP, length 1470
00:09:12.755862 IP 10.0.0.1.36598 > 10.0.0.2.5001: UDP, length 1470
00:09:12.767145 IP 10.0.0.1.36598 > 10.0.0.2.5001: UDP, length 1470
00:09:12.779282 IP 10.0.0.1.36598 > 10.0.0.2.5001: UDP, length 1470
00:09:12.791362 IP 10.0.0.1.36598 > 10.0.0.2.5001: UDP, length 1470
00:09:12.803494 IP 10.0.0.1.36598 > 10.0.0.2.5001: UDP, length 1470
00:09:12.815600 IP 10.0.0.1.36598 > 10.0.0.2.5001: UDP, length 1470
00:09:12.828561 IP 10.0.0.1.36598 > 10.0.0.2.5001: UDP, length 1470
00:09:12.839786 IP 10.0.0.1.36598 > 10.0.0.2.5001: UDP, length 1470
00:09:12.852069 IP 10.0.0.1.36598 > 10.0.0.2.5001: UDP, length 1470
00:09:12.863978 IP 10.0.0.1.36598 > 10.0.0.2.5001: UDP, length 1470
00:09:12.876051 IP 10.0.0.1.36598 > 10.0.0.2.5001: UDP, length 1470
00:09:12.888161 IP 10.0.0.1.36598 > 10.0.0.2.5001: UDP, length 1470
00:09:12.900216 IP 10.0.0.1.36598 > 10.0.0.2.5001: UDP, length 1470
00:09:12.912349 IP 10.0.0.1.36598 > 10.0.0.2.5001: UDP, length 1470
00:09:12.924450 IP 10.0.0.1.36598 > 10.0.0.2.5001: UDP, length 1470
00:09:12.936551 IP 10.0.0.1.36598 > 10.0.0.2.5001: UDP, length 1470
00:09:12.948644 IP 10.0.0.1.36598 > 10.0.0.2.5001: UDP, length 1470
00:09:12.961397 IP 10.0.0.1.36598 > 10.0.0.2.5001: UDP, length 1470
00:09:12.972836 IP 10.0.0.1.36598 > 10.0.0.2.5001: UDP, length 1470
00:09:12.984915 IP 10.0.0.1.36598 > 10.0.0.2.5001: UDP, length 1470
00:09:12.997026 IP 10.0.0.1.36598 > 10.0.0.2.5001: UDP, length 1470
00:09:13.009117 IP 10.0.0.1.36598 > 10.0.0.2.5001: UDP, length 1470
00:09:13.021974 IP 10.0.0.1.36598 > 10.0.0.2.5001: UDP, length 1470
00:09:13.033303 IP 10.0.0.1.36598 > 10.0.0.2.5001: UDP, length 1470
00:09:13.045407 IP 10.0.0.1.36598 > 10.0.0.2.5001: UDP, length 1470
00:09:13.058311 IP 10.0.0.1.36598 > 10.0.0.2.5001: UDP, length 1470
00:09:13.069599 IP 10.0.0.1.36598 > 10.0.0.2.5001: UDP, length 1470
00:09:13.093799 IP 10.0.0.1.36598 > 10.0.0.2.5001: UDP, length 1470
00:09:13.106601 IP 10.0.0.1.36598 > 10.0.0.2.5001: UDP, length 1470
00:09:13.117970 IP 10.0.0.1.36598 > 10.0.0.2.5001: UDP, length 1470
00:09:13.130064 IP 10.0.0.1.36598 > 10.0.0.2.5001: UDP, length 1470
00:09:13.142896 IP 10.0.0.1.36598 > 10.0.0.2.5001: UDP, length 1470
00:09:13.154218 IP 10.0.0.1.36598 > 10.0.0.2.5001: UDP, length 1470
00:09:13.166318 IP 10.0.0.1.36598 > 10.0.0.2.5001: UDP, length 1470
00:09:13.178467 IP 10.0.0.1.36598 > 10.0.0.2.5001: UDP, length 1470
00:09:13.190562 IP 10.0.0.1.36598 > 10.0.0.2.5001: UDP, length 1470
00:09:13.202652 IP 10.0.0.1.36598 > 10.0.0.2.5001: UDP, length 1470
00:09:13.214718 IP 10.0.0.1.36598 > 10.0.0.2.5001: UDP, length 1470
00:09:13.227621 IP 10.0.0.1.36598 > 10.0.0.2.5001: UDP, length 1470
00:09:13.238941 IP 10.0.0.1.36598 > 10.0.0.2.5001: UDP, length 1470
00:09:13.251837 IP 10.0.0.1.36598 > 10.0.0.2.5001: UDP, length 1470
00:09:13.263153 IP 10.0.0.1.36598 > 10.0.0.2.5001: UDP, length 1470
00:09:13.275208 IP 10.0.0.1.36598 > 10.0.0.2.5001: UDP, length 1470
00:09:13.287343 IP 10.0.0.1.36598 > 10.0.0.2.5001: UDP, length 1470
00:09:13.299447 IP 10.0.0.1.36598 > 10.0.0.2.5001: UDP, length 1470
00:09:13.311535 IP 10.0.0.1.36598 > 10.0.0.2.5001: UDP, length 1470
00:09:13.323623 IP 10.0.0.1.36598 > 10.0.0.2.5001: UDP, length 1470
00:09:13.336517 IP 10.0.0.1.36598 > 10.0.0.2.5001: UDP, length 1470
00:09:13.347814 IP 10.0.0.1.36598 > 10.0.0.2.5001: UDP, length 1470
00:09:13.359872 IP 10.0.0.1.36598 > 10.0.0.2.5001: UDP, length 1470
00:09:13.372015 IP 10.0.0.1.36598 > 10.0.0.2.5001: UDP, length 1470
00:09:13.384848 IP 10.0.0.1.36598 > 10.0.0.2.5001: UDP, length 1470
00:09:13.396203 IP 10.0.0.1.36598 > 10.0.0.2.5001: UDP, length 1470
00:09:13.408285 IP 10.0.0.1.36598 > 10.0.0.2.5001: UDP, length 1470
00:09:13.420369 IP 10.0.0.1.36598 > 10.0.0.2.5001: UDP, length 1470
00:09:13.432471 IP 10.0.0.1.36598 > 10.0.0.2.5001: UDP, length 1470
00:09:13.445322 IP 10.0.0.1.36598 > 10.0.0.2.5001: UDP, length 1470
00:09:13.456677 IP 10.0.0.1.36598 > 10.0.0.2.5001: UDP, length 1470
00:09:13.468762 IP 10.0.0.1.36598 > 10.0.0.2.5001: UDP, length 1470
00:09:13.480816 IP 10.0.0.1.36598 > 10.0.0.2.5001: UDP, length 1470
00:09:13.492954 IP 10.0.0.1.36598 > 10.0.0.2.5001: UDP, length 1470
00:09:13.505024 IP 10.0.0.1.36598 > 10.0.0.2.5001: UDP, length 1470
00:09:13.517140 IP 10.0.0.1.36598 > 10.0.0.2.5001: UDP, length 1470
00:09:13.529233 IP 10.0.0.1.36598 > 10.0.0.2.5001: UDP, length 1470
00:09:13.541971 IP 10.0.0.1.36598 > 10.0.0.2.5001: UDP, length 1470
00:09:13.553519 IP 10.0.0.1.36598 > 10.0.0.2.5001: UDP, length 1470
00:09:13.565536 IP 10.0.0.1.36598 > 10.0.0.2.5001: UDP, length 1470
00:09:13.577635 IP 10.0.0.1.36598 > 10.0.0.2.5001: UDP, length 1470
00:09:13.589704 IP 10.0.0.1.36598 > 10.0.0.2.5001: UDP, length 1470
00:09:13.602569 IP 10.0.0.1.36598 > 10.0.0.2.5001: UDP, length 1470
00:09:13.614003 IP 10.0.0.1.36598 > 10.0.0.2.5001: UDP, length 1470
00:09:13.626184 IP 10.0.0.1.36598 > 10.0.0.2.5001: UDP, length 1470
00:09:13.638072 IP 10.0.0.1.36598 > 10.0.0.2.5001: UDP, length 1470
00:09:13.650356 IP 10.0.0.1.36598 > 10.0.0.2.5001: UDP, length 1470
00:09:13.662269 IP 10.0.0.1.36598 > 10.0.0.2.5001: UDP, length 1470
00:09:13.674433 IP 10.0.0.1.36598 > 10.0.0.2.5001: UDP, length 1470
00:09:13.687309 IP 10.0.0.1.36598 > 10.0.0.2.5001: UDP, length 1470
00:09:13.698784 IP 10.0.0.1.36598 > 10.0.0.2.5001: UDP, length 1470
00:09:13.710679 IP 10.0.0.1.36598 > 10.0.0.2.5001: UDP, length 1470
00:09:13.722776 IP 10.0.0.1.36598 > 10.0.0.2.5001: UDP, length 1470
00:09:13.734862 IP 10.0.0.1.36598 > 10.0.0.2.5001: UDP, length 1470
00:09:13.746981 IP 10.0.0.1.36598 > 10.0.0.2.5001: UDP, length 1470
00:09:13.759781 IP 10.0.0.1.36598 > 10.0.0.2.5001: UDP, length 1470
00:09:13.771182 IP 10.0.0.1.36598 > 10.0.0.2.5001: UDP, length 1470
00:09:13.783242 IP 10.0.0.1.36598 > 10.0.0.2.5001: UDP, length 1470
00:09:13.795356 IP 10.0.0.1.36598 > 10.0.0.2.5001: UDP, length 1470
00:09:13.807453 IP 10.0.0.1.36598 > 10.0.0.2.5001: UDP, length 1470
00:09:13.819564 IP 10.0.0.1.36598 > 10.0.0.2.5001: UDP, length 1470
00:09:13.831612 IP 10.0.0.1.36598 > 10.0.0.2.5001: UDP, length 1470
00:09:13.843741 IP 10.0.0.1.36598 > 10.0.0.2.5001: UDP, length 1470
00:09:13.855836 IP 10.0.0.1.36598 > 10.0.0.2.5001: UDP, length 1470
00:09:13.867914 IP 10.0.0.1.36598 > 10.0.0.2.5001: UDP, length 1470
00:09:13.880040 IP 10.0.0.1.36598 > 10.0.0.2.5001: UDP, length 1470
00:09:13.892130 IP 10.0.0.1.36598 > 10.0.0.2.5001: UDP, length 1470
00:09:13.904176 IP 10.0.0.1.36598 > 10.0.0.2.5001: UDP, length 1470
00:09:13.916321 IP 10.0.0.1.36598 > 10.0.0.2.5001: UDP, length 1470
00:09:13.928413 IP 10.0.0.1.36598 > 10.0.0.2.5001: UDP, length 1470
00:09:13.941280 IP 10.0.0.1.36598 > 10.0.0.2.5001: UDP, length 1470
00:09:13.952630 IP 10.0.0.1.36598 > 10.0.0.2.5001: UDP, length 1470
00:09:13.964752 IP 10.0.0.1.36598 > 10.0.0.2.5001: UDP, length 1470
00:09:13.976757 IP 10.0.0.1.36598 > 10.0.0.2.5001: UDP, length 1470
00:09:13.988901 IP 10.0.0.1.36598 > 10.0.0.2.5001: UDP, length 1470
00:09:14.000995 IP 10.0.0.1.36598 > 10.0.0.2.5001: UDP, length 1470
00:09:14.013087 IP 10.0.0.1.36598 > 10.0.0.2.5001: UDP, length 1470
00:09:14.025132 IP 10.0.0.1.36598 > 10.0.0.2.5001: UDP, length 1470
00:09:14.037269 IP 10.0.0.1.36598 > 10.0.0.2.5001: UDP, length 1470
00:09:14.049341 IP 10.0.0.1.36598 > 10.0.0.2.5001: UDP, length 1470
00:09:14.061486 IP 10.0.0.1.36598 > 10.0.0.2.5001: UDP, length 1470
00:09:14.073572 IP 10.0.0.1.36598 > 10.0.0.2.5001: UDP, length 1470
00:09:14.085669 IP 10.0.0.1.36598 > 10.0.0.2.5001: UDP, length 1470
00:09:14.098590 IP 10.0.0.1.36598 > 10.0.0.2.5001: UDP, length 1470
00:09:14.109827 IP 10.0.0.1.36598 > 10.0.0.2.5001: UDP, length 1470
00:09:14.121972 IP 10.0.0.1.36598 > 10.0.0.2.5001: UDP, length 1470
00:09:14.134866 IP 10.0.0.1.36598 > 10.0.0.2.5001: UDP, length 1470
00:09:14.146148 IP 10.0.0.1.36598 > 10.0.0.2.5001: UDP, length 1470
00:09:14.158232 IP 10.0.0.1.36598 > 10.0.0.2.5001: UDP, length 1470
00:09:14.170324 IP 10.0.0.1.36598 > 10.0.0.2.5001: UDP, length 1470
00:09:14.182465 IP 10.0.0.1.36598 > 10.0.0.2.5001: UDP, length 1470
00:09:14.194816 IP 10.0.0.1.36598 > 10.0.0.2.5001: UDP, length 1470
00:09:14.206625 IP 10.0.0.1.36598 > 10.0.0.2.5001: UDP, length 1470
00:09:14.218724 IP 10.0.0.1.36598 > 10.0.0.2.5001: UDP, length 1470
00:09:14.230814 IP 10.0.0.1.36598 > 10.0.0.2.5001: UDP, length 1470
00:09:14.242888 IP 10.0.0.1.36598 > 10.0.0.2.5001: UDP, length 1470
00:09:14.255030 IP 10.0.0.1.36598 > 10.0.0.2.5001: UDP, length 1470
00:09:14.267229 IP 10.0.0.1.36598 > 10.0.0.2.5001: UDP, length 1470
00:09:14.279202 IP 10.0.0.1.36598 > 10.0.0.2.5001: UDP, length 1470
00:09:14.291302 IP 10.0.0.1.36598 > 10.0.0.2.5001: UDP, length 1470
00:09:14.304202 IP 10.0.0.1.36598 > 10.0.0.2.5001: UDP, length 1470
00:09:14.315497 IP 10.0.0.1.36598 > 10.0.0.2.5001: UDP, length 1470
00:09:14.327609 IP 10.0.0.1.36598 > 10.0.0.2.5001: UDP, length 1470
00:09:14.339677 IP 10.0.0.1.36598 > 10.0.0.2.5001: UDP, length 1470
00:09:14.351778 IP 10.0.0.1.36598 > 10.0.0.2.5001: UDP, length 1470
00:09:14.363864 IP 10.0.0.1.36598 > 10.0.0.2.5001: UDP, length 1470
00:09:14.375928 IP 10.0.0.1.36598 > 10.0.0.2.5001: UDP, length 1470
00:09:14.388083 IP 10.0.0.1.36598 > 10.0.0.2.5001: UDP, length 1470
00:09:14.400155 IP 10.0.0.1.36598 > 10.0.0.2.5001: UDP, length 1470
00:09:14.412274 IP 10.0.0.1.36598 > 10.0.0.2.5001: UDP, length 1470
00:09:14.424316 IP 10.0.0.1.36598 > 10.0.0.2.5001: UDP, length 1470
00:09:14.436463 IP 10.0.0.1.36598 > 10.0.0.2.5001: UDP, length 1470
00:09:14.448536 IP 10.0.0.1.36598 > 10.0.0.2.5001: UDP, length 1470
00:09:14.460636 IP 10.0.0.1.36598 > 10.0.0.2.5001: UDP, length 1470
00:09:14.472737 IP 10.0.0.1.36598 > 10.0.0.2.5001: UDP, length 1470
00:09:14.484841 IP 10.0.0.1.36598 > 10.0.0.2.5001: UDP, length 1470
00:09:14.497694 IP 10.0.0.1.36598 > 10.0.0.2.5001: UDP, length 1470
00:09:14.509015 IP 10.0.0.1.36598 > 10.0.0.2.5001: UDP, length 1470
00:09:14.521122 IP 10.0.0.1.36598 > 10.0.0.2.5001: UDP, length 1470
00:09:14.534032 IP 10.0.0.1.36598 > 10.0.0.2.5001: UDP, length 1470
00:09:14.545309 IP 10.0.0.1.36598 > 10.0.0.2.5001: UDP, length 1470
00:09:14.557408 IP 10.0.0.1.36598 > 10.0.0.2.5001: UDP, length 1470
00:09:14.569800 IP 10.0.0.1.36598 > 10.0.0.2.5001: UDP, length 1470
00:09:14.581599 IP 10.0.0.1.36598 > 10.0.0.2.5001: UDP, length 1470
00:09:14.593694 IP 10.0.0.1.36598 > 10.0.0.2.5001: UDP, length 1470
00:09:14.606808 IP 10.0.0.1.36598 > 10.0.0.2.5001: UDP, length 1470
00:09:14.617888 IP 10.0.0.1.36598 > 10.0.0.2.5001: UDP, length 1470
00:09:14.629988 IP 10.0.0.1.36598 > 10.0.0.2.5001: UDP, length 1470
00:09:14.642898 IP 10.0.0.1.36598 > 10.0.0.2.5001: UDP, length 1470
00:09:14.654188 IP 10.0.0.1.36598 > 10.0.0.2.5001: UDP, length 1470
00:09:14.666263 IP 10.0.0.1.36598 > 10.0.0.2.5001: UDP, length 1470
00:09:14.678340 IP 10.0.0.1.36598 > 10.0.0.2.5001: UDP, length 1470
00:09:14.690482 IP 10.0.0.1.36598 > 10.0.0.2.5001: UDP, length 1470
00:09:14.702576 IP 10.0.0.1.36598 > 10.0.0.2.5001: UDP, length 1470
00:09:14.714675 IP 10.0.0.1.36598 > 10.0.0.2.5001: UDP, length 1470
00:09:14.726735 IP 10.0.0.1.36598 > 10.0.0.2.5001: UDP, length 1470
00:09:14.738853 IP 10.0.0.1.36598 > 10.0.0.2.5001: UDP, length 1470
00:09:14.755728 IP 10.0.0.1.36598 > 10.0.0.2.5001: UDP, length 1470
00:09:14.763047 IP 10.0.0.1.36598 > 10.0.0.2.5001: UDP, length 1470
00:09:14.775117 IP 10.0.0.1.36598 > 10.0.0.2.5001: UDP, length 1470
00:09:14.787266 IP 10.0.0.1.36598 > 10.0.0.2.5001: UDP, length 1470
00:09:14.799313 IP 10.0.0.1.36598 > 10.0.0.2.5001: UDP, length 1470
00:09:14.811420 IP 10.0.0.1.36598 > 10.0.0.2.5001: UDP, length 1470
00:09:14.824291 IP 10.0.0.1.36598 > 10.0.0.2.5001: UDP, length 1470
00:09:14.835587 IP 10.0.0.1.36598 > 10.0.0.2.5001: UDP, length 1470
00:09:14.848508 IP 10.0.0.1.36598 > 10.0.0.2.5001: UDP, length 1470
00:09:14.859793 IP 10.0.0.1.36598 > 10.0.0.2.5001: UDP, length 1470
00:09:14.871863 IP 10.0.0.1.36598 > 10.0.0.2.5001: UDP, length 1470
00:09:14.884011 IP 10.0.0.1.36598 > 10.0.0.2.5001: UDP, length 1470
00:09:14.896107 IP 10.0.0.1.36598 > 10.0.0.2.5001: UDP, length 1470
00:09:14.908181 IP 10.0.0.1.36598 > 10.0.0.2.5001: UDP, length 1470
00:09:14.920288 IP 10.0.0.1.36598 > 10.0.0.2.5001: UDP, length 1470
00:09:14.932376 IP 10.0.0.1.36598 > 10.0.0.2.5001: UDP, length 1470
00:09:14.944477 IP 10.0.0.1.36598 > 10.0.0.2.5001: UDP, length 1470
00:09:14.956567 IP 10.0.0.1.36598 > 10.0.0.2.5001: UDP, length 1470
00:09:14.968629 IP 10.0.0.1.36598 > 10.0.0.2.5001: UDP, length 1470
00:09:14.980802 IP 10.0.0.1.36598 > 10.0.0.2.5001: UDP, length 1470
00:09:14.993041 IP 10.0.0.1.36598 > 10.0.0.2.5001: UDP, length 1470
00:09:15.005737 IP 10.0.0.1.36598 > 10.0.0.2.5001: UDP, length 1470
00:09:15.017026 IP 10.0.0.1.36598 > 10.0.0.2.5001: UDP, length 1470
00:09:15.029131 IP 10.0.0.1.36598 > 10.0.0.2.5001: UDP, length 1470
00:09:15.042069 IP 10.0.0.1.36598 > 10.0.0.2.5001: UDP, length 1470
00:09:15.053350 IP 10.0.0.1.36598 > 10.0.0.2.5001: UDP, length 1470
00:09:15.065441 IP 10.0.0.1.36598 > 10.0.0.2.5001: UDP, length 1470
00:09:15.077534 IP 10.0.0.1.36598 > 10.0.0.2.5001: UDP, length 1470
00:09:15.089622 IP 10.0.0.1.36598 > 10.0.0.2.5001: UDP, length 1470
00:09:15.101711 IP 10.0.0.1.36598 > 10.0.0.2.5001: UDP, length 1470
00:09:15.113836 IP 10.0.0.1.36598 > 10.0.0.2.5001: UDP, length 1470
00:09:15.125953 IP 10.0.0.1.36598 > 10.0.0.2.5001: UDP, length 1470
00:09:15.138842 IP 10.0.0.1.36598 > 10.0.0.2.5001: UDP, length 1470
00:09:15.150072 IP 10.0.0.1.36598 > 10.0.0.2.5001: UDP, length 1470
00:09:15.162968 IP 10.0.0.1.36598 > 10.0.0.2.5001: UDP, length 1470
00:09:15.174302 IP 10.0.0.1.36598 > 10.0.0.2.5001: UDP, length 1470
00:09:15.186400 IP 10.0.0.1.36598 > 10.0.0.2.5001: UDP, length 1470
00:09:15.198509 IP 10.0.0.1.36598 > 10.0.0.2.5001: UDP, length 1470
00:09:15.210574 IP 10.0.0.1.36598 > 10.0.0.2.5001: UDP, length 1470
00:09:15.222671 IP 10.0.0.1.36598 > 10.0.0.2.5001: UDP, length 1470
00:09:15.235558 IP 10.0.0.1.36598 > 10.0.0.2.5001: UDP, length 1470
00:09:15.246871 IP 10.0.0.1.36598 > 10.0.0.2.5001: UDP, length 1470
00:09:15.258956 IP 10.0.0.1.36598 > 10.0.0.2.5001: UDP, length 1470
00:09:15.271086 IP 10.0.0.1.36598 > 10.0.0.2.5001: UDP, length 1470
00:09:15.283172 IP 10.0.0.1.36598 > 10.0.0.2.5001: UDP, length 1470
00:09:15.295261 IP 10.0.0.1.36598 > 10.0.0.2.5001: UDP, length 1470
00:09:15.307376 IP 10.0.0.1.36598 > 10.0.0.2.5001: UDP, length 1470
00:09:15.319533 IP 10.0.0.1.36598 > 10.0.0.2.5001: UDP, length 1470
00:09:15.331569 IP 10.0.0.1.36598 > 10.0.0.2.5001: UDP, length 1470
00:09:15.343644 IP 10.0.0.1.36598 > 10.0.0.2.5001: UDP, length 1470
00:09:15.355737 IP 10.0.0.1.36598 > 10.0.0.2.5001: UDP, length 1470
00:09:15.367837 IP 10.0.0.1.36598 > 10.0.0.2.5001: UDP, length 1470
00:09:15.379939 IP 10.0.0.1.36598 > 10.0.0.2.5001: UDP, length 1470
00:09:15.392030 IP 10.0.0.1.36598 > 10.0.0.2.5001: UDP, length 1470
00:09:15.404960 IP 10.0.0.1.36598 > 10.0.0.2.5001: UDP, length 1470
00:09:15.416199 IP 10.0.0.1.36598 > 10.0.0.2.5001: UDP, length 1470
00:09:15.428319 IP 10.0.0.1.36598 > 10.0.0.2.5001: UDP, length 1470
00:09:15.441137 IP 10.0.0.1.36598 > 10.0.0.2.5001: UDP, length 1470
00:09:15.452525 IP 10.0.0.1.36598 > 10.0.0.2.5001: UDP, length 1470
00:09:15.464618 IP 10.0.0.1.36598 > 10.0.0.2.5001: UDP, length 1470
00:09:15.476674 IP 10.0.0.1.36598 > 10.0.0.2.5001: UDP, length 1470
00:09:15.488751 IP 10.0.0.1.36598 > 10.0.0.2.5001: UDP, length 1470
00:09:15.501074 IP 10.0.0.1.36598 > 10.0.0.2.5001: UDP, length 1470
00:09:15.513761 IP 10.0.0.1.36598 > 10.0.0.2.5001: UDP, length 1470
00:09:15.525057 IP 10.0.0.1.36598 > 10.0.0.2.5001: UDP, length 1470
00:09:15.537177 IP 10.0.0.1.36598 > 10.0.0.2.5001: UDP, length 1470
00:09:15.549879 IP 10.0.0.1.36598 > 10.0.0.2.5001: UDP, length 1470
00:09:15.561395 IP 10.0.0.1.36598 > 10.0.0.2.5001: UDP, length 1470
00:09:15.573483 IP 10.0.0.1.36598 > 10.0.0.2.5001: UDP, length 1470
00:09:15.585629 IP 10.0.0.1.36598 > 10.0.0.2.5001: UDP, length 1470
00:09:15.597673 IP 10.0.0.1.36598 > 10.0.0.2.5001: UDP, length 1470
00:09:15.609729 IP 10.0.0.1.36598 > 10.0.0.2.5001: UDP, length 1470
00:09:15.621875 IP 10.0.0.1.36598 > 10.0.0.2.5001: UDP, length 1470
00:09:15.633965 IP 10.0.0.1.36598 > 10.0.0.2.5001: UDP, length 1470
00:09:15.646056 IP 10.0.0.1.36598 > 10.0.0.2.5001: UDP, length 1470
00:09:15.658817 IP 10.0.0.1.36598 > 10.0.0.2.5001: UDP, length 1470
00:09:15.670268 IP 10.0.0.1.36598 > 10.0.0.2.5001: UDP, length 1470
00:09:15.682318 IP 10.0.0.1.36598 > 10.0.0.2.5001: UDP, length 1470
00:09:15.694423 IP 10.0.0.1.36598 > 10.0.0.2.5001: UDP, length 1470
00:09:15.706578 IP 10.0.0.1.36598 > 10.0.0.2.5001: UDP, length 1470
00:09:15.718635 IP 10.0.0.1.36598 > 10.0.0.2.5001: UDP, length 1470
00:09:15.731474 IP 10.0.0.1.36598 > 10.0.0.2.5001: UDP, length 1470
00:09:15.742806 IP 10.0.0.1.36598 > 10.0.0.2.5001: UDP, length 1470
00:09:15.754889 IP 10.0.0.1.36598 > 10.0.0.2.5001: UDP, length 1470
00:09:15.767013 IP 10.0.0.1.36598 > 10.0.0.2.5001: UDP, length 1470
00:09:15.779095 IP 10.0.0.1.36598 > 10.0.0.2.5001: UDP, length 1470
00:09:15.791190 IP 10.0.0.1.36598 > 10.0.0.2.5001: UDP, length 1470
00:09:15.803287 IP 10.0.0.1.36598 > 10.0.0.2.5001: UDP, length 1470
00:09:15.815384 IP 10.0.0.1.36598 > 10.0.0.2.5001: UDP, length 1470
00:09:15.828299 IP 10.0.0.1.36598 > 10.0.0.2.5001: UDP, length 1470
00:09:15.839558 IP 10.0.0.1.36598 > 10.0.0.2.5001: UDP, length 1470
00:09:15.851662 IP 10.0.0.1.36598 > 10.0.0.2.5001: UDP, length 1470
00:09:15.863741 IP 10.0.0.1.36598 > 10.0.0.2.5001: UDP, length 1470
00:09:15.875849 IP 10.0.0.1.36598 > 10.0.0.2.5001: UDP, length 1470
00:09:15.887964 IP 10.0.0.1.36598 > 10.0.0.2.5001: UDP, length 1470
00:09:15.900821 IP 10.0.0.1.36598 > 10.0.0.2.5001: UDP, length 1470
00:09:15.912164 IP 10.0.0.1.36598 > 10.0.0.2.5001: UDP, length 1470
00:09:15.925037 IP 10.0.0.1.36598 > 10.0.0.2.5001: UDP, length 1470
00:09:15.936346 IP 10.0.0.1.36598 > 10.0.0.2.5001: UDP, length 1470
00:09:15.948457 IP 10.0.0.1.36598 > 10.0.0.2.5001: UDP, length 1470
00:09:15.961403 IP 10.0.0.1.36598 > 10.0.0.2.5001: UDP, length 1470
00:09:15.972656 IP 10.0.0.1.36598 > 10.0.0.2.5001: UDP, length 1470
00:09:15.984739 IP 10.0.0.1.36598 > 10.0.0.2.5001: UDP, length 1470
00:09:15.996823 IP 10.0.0.1.36598 > 10.0.0.2.5001: UDP, length 1470
00:09:16.009744 IP 10.0.0.1.36598 > 10.0.0.2.5001: UDP, length 1470
00:09:16.021035 IP 10.0.0.1.36598 > 10.0.0.2.5001: UDP, length 1470
00:09:16.033149 IP 10.0.0.1.36598 > 10.0.0.2.5001: UDP, length 1470
00:09:16.045973 IP 10.0.0.1.36598 > 10.0.0.2.5001: UDP, length 1470
00:09:16.069415 IP 10.0.0.1.36598 > 10.0.0.2.5001: UDP, length 1470
00:09:16.093596 IP 10.0.0.1.36598 > 10.0.0.2.5001: UDP, length 1470
00:09:16.105695 IP 10.0.0.1.36598 > 10.0.0.2.5001: UDP, length 1470
00:09:16.117763 IP 10.0.0.1.36598 > 10.0.0.2.5001: UDP, length 1470
00:09:16.129898 IP 10.0.0.1.36598 > 10.0.0.2.5001: UDP, length 1470
00:09:16.142708 IP 10.0.0.1.36598 > 10.0.0.2.5001: UDP, length 1470
00:09:16.154070 IP 10.0.0.1.36598 > 10.0.0.2.5001: UDP, length 1470
00:09:16.166177 IP 10.0.0.1.36598 > 10.0.0.2.5001: UDP, length 1470
00:09:16.179039 IP 10.0.0.1.36598 > 10.0.0.2.5001: UDP, length 1470
00:09:16.190394 IP 10.0.0.1.36598 > 10.0.0.2.5001: UDP, length 1470
00:09:16.202455 IP 10.0.0.1.36598 > 10.0.0.2.5001: UDP, length 1470
00:09:16.214555 IP 10.0.0.1.36598 > 10.0.0.2.5001: UDP, length 1470
00:09:16.226639 IP 10.0.0.1.36598 > 10.0.0.2.5001: UDP, length 1470
00:09:16.238749 IP 10.0.0.1.36598 > 10.0.0.2.5001: UDP, length 1470
00:09:16.251657 IP 10.0.0.1.36598 > 10.0.0.2.5001: UDP, length 1470
00:09:16.262939 IP 10.0.0.1.36598 > 10.0.0.2.5001: UDP, length 1470
00:09:16.275020 IP 10.0.0.1.36598 > 10.0.0.2.5001: UDP, length 1470
00:09:16.287141 IP 10.0.0.1.36598 > 10.0.0.2.5001: UDP, length 1470
00:09:16.299205 IP 10.0.0.1.36598 > 10.0.0.2.5001: UDP, length 1470
00:09:16.311349 IP 10.0.0.1.36598 > 10.0.0.2.5001: UDP, length 1470
00:09:16.323403 IP 10.0.0.1.36598 > 10.0.0.2.5001: UDP, length 1470
00:09:16.335532 IP 10.0.0.1.36598 > 10.0.0.2.5001: UDP, length 1470
00:09:16.347614 IP 10.0.0.1.36598 > 10.0.0.2.5001: UDP, length 1470
00:09:16.359709 IP 10.0.0.1.36598 > 10.0.0.2.5001: UDP, length 1470
00:09:16.371766 IP 10.0.0.1.36598 > 10.0.0.2.5001: UDP, length 1470
00:09:16.384741 IP 10.0.0.1.36598 > 10.0.0.2.5001: UDP, length 1470
00:09:16.396005 IP 10.0.0.1.36598 > 10.0.0.2.5001: UDP, length 1470
00:09:16.408106 IP 10.0.0.1.36598 > 10.0.0.2.5001: UDP, length 1470
00:09:16.420185 IP 10.0.0.1.36598 > 10.0.0.2.5001: UDP, length 1470
00:09:16.432236 IP 10.0.0.1.36598 > 10.0.0.2.5001: UDP, length 1470
00:09:16.444383 IP 10.0.0.1.36598 > 10.0.0.2.5001: UDP, length 1470
00:09:16.456468 IP 10.0.0.1.36598 > 10.0.0.2.5001: UDP, length 1470
00:09:16.468730 IP 10.0.0.1.36598 > 10.0.0.2.5001: UDP, length 1470
00:09:16.480657 IP 10.0.0.1.36598 > 10.0.0.2.5001: UDP, length 1470
00:09:16.492765 IP 10.0.0.1.36598 > 10.0.0.2.5001: UDP, length 1470
00:09:16.504856 IP 10.0.0.1.36598 > 10.0.0.2.5001: UDP, length 1470
00:09:16.516976 IP 10.0.0.1.36598 > 10.0.0.2.5001: UDP, length 1470
00:09:16.529031 IP 10.0.0.1.36598 > 10.0.0.2.5001: UDP, length 1470
00:09:16.541178 IP 10.0.0.1.36598 > 10.0.0.2.5001: UDP, length 1470
00:09:16.553273 IP 10.0.0.1.36598 > 10.0.0.2.5001: UDP, length 1470
00:09:16.565324 IP 10.0.0.1.36598 > 10.0.0.2.5001: UDP, length 1470
00:09:16.577460 IP 10.0.0.1.36598 > 10.0.0.2.5001: UDP, length 1470
00:09:16.601585 IP 10.0.0.1.36598 > 10.0.0.2.5001: UDP, length 1470
00:09:16.613719 IP 10.0.0.1.36598 > 10.0.0.2.5001: UDP, length 1470
00:09:16.625782 IP 10.0.0.1.36598 > 10.0.0.2.5001: UDP, length 1470
00:09:16.637941 IP 10.0.0.1.36598 > 10.0.0.2.5001: UDP, length 1470
00:09:16.649987 IP 10.0.0.1.36598 > 10.0.0.2.5001: UDP, length 1470
00:09:16.662107 IP 10.0.0.1.36598 > 10.0.0.2.5001: UDP, length 1470
00:09:16.674205 IP 10.0.0.1.36598 > 10.0.0.2.5001: UDP, length 1470
00:09:16.686329 IP 10.0.0.1.36598 > 10.0.0.2.5001: UDP, length 1470
00:09:16.699277 IP 10.0.0.1.36598 > 10.0.0.2.5001: UDP, length 1470
00:09:16.710493 IP 10.0.0.1.36598 > 10.0.0.2.5001: UDP, length 1470
00:09:16.722593 IP 10.0.0.1.36598 > 10.0.0.2.5001: UDP, length 1470
00:09:16.734671 IP 10.0.0.1.36598 > 10.0.0.2.5001: UDP, length 1470
00:09:16.746774 IP 10.0.0.1.36598 > 10.0.0.2.5001: UDP, length 1470
00:09:16.758826 IP 10.0.0.1.36598 > 10.0.0.2.5001: UDP, length 1470
00:09:16.771727 IP 10.0.0.1.36598 > 10.0.0.2.5001: UDP, length 1470
00:09:16.783071 IP 10.0.0.1.36598 > 10.0.0.2.5001: UDP, length 1470
00:09:16.795120 IP 10.0.0.1.36598 > 10.0.0.2.5001: UDP, length 1470
00:09:16.807256 IP 10.0.0.1.36598 > 10.0.0.2.5001: UDP, length 1470
00:09:16.819363 IP 10.0.0.1.36598 > 10.0.0.2.5001: UDP, length 1470
00:09:16.831462 IP 10.0.0.1.36598 > 10.0.0.2.5001: UDP, length 1470
00:09:16.843541 IP 10.0.0.1.36598 > 10.0.0.2.5001: UDP, length 1470
00:09:16.855670 IP 10.0.0.1.36598 > 10.0.0.2.5001: UDP, length 1470
00:09:16.868392 IP 10.0.0.1.36598 > 10.0.0.2.5001: UDP, length 1470
00:09:16.879834 IP 10.0.0.1.36598 > 10.0.0.2.5001: UDP, length 1470
00:09:16.891969 IP 10.0.0.1.36598 > 10.0.0.2.5001: UDP, length 1470
00:09:16.904024 IP 10.0.0.1.36598 > 10.0.0.2.5001: UDP, length 1470
00:09:16.916127 IP 10.0.0.1.36598 > 10.0.0.2.5001: UDP, length 1470
00:09:16.928232 IP 10.0.0.1.36598 > 10.0.0.2.5001: UDP, length 1470
00:09:16.940975 IP 10.0.0.1.36598 > 10.0.0.2.5001: UDP, length 1470
00:09:16.952404 IP 10.0.0.1.36598 > 10.0.0.2.5001: UDP, length 1470
00:09:16.964498 IP 10.0.0.1.36598 > 10.0.0.2.5001: UDP, length 1470
00:09:16.977414 IP 10.0.0.1.36598 > 10.0.0.2.5001: UDP, length 1470
00:09:16.988693 IP 10.0.0.1.36598 > 10.0.0.2.5001: UDP, length 1470
00:09:17.000765 IP 10.0.0.1.36598 > 10.0.0.2.5001: UDP, length 1470
00:09:17.012933 IP 10.0.0.1.36598 > 10.0.0.2.5001: UDP, length 1470
00:09:17.025731 IP 10.0.0.1.36598 > 10.0.0.2.5001: UDP, length 1470
00:09:17.037085 IP 10.0.0.1.36598 > 10.0.0.2.5001: UDP, length 1470
00:09:17.049156 IP 10.0.0.1.36598 > 10.0.0.2.5001: UDP, length 1470
00:09:17.061351 IP 10.0.0.1.36598 > 10.0.0.2.5001: UDP, length 1470
00:09:17.073338 IP 10.0.0.1.36598 > 10.0.0.2.5001: UDP, length 1470
00:09:17.085456 IP 10.0.0.1.36598 > 10.0.0.2.5001: UDP, length 1470
00:09:17.097561 IP 10.0.0.1.36598 > 10.0.0.2.5001: UDP, length 1470
00:09:17.109652 IP 10.0.0.1.36598 > 10.0.0.2.5001: UDP, length 1470
00:09:17.121757 IP 10.0.0.1.36598 > 10.0.0.2.5001: UDP, length 1470
00:09:17.134493 IP 10.0.0.1.36598 > 10.0.0.2.5001: UDP, length 1470
00:09:17.145985 IP 10.0.0.1.36598 > 10.0.0.2.5001: UDP, length 1470
00:09:17.158884 IP 10.0.0.1.36598 > 10.0.0.2.5001: UDP, length 1470
00:09:17.170179 IP 10.0.0.1.36598 > 10.0.0.2.5001: UDP, length 1470
00:09:17.182195 IP 10.0.0.1.36598 > 10.0.0.2.5001: UDP, length 1470
00:09:17.194294 IP 10.0.0.1.36598 > 10.0.0.2.5001: UDP, length 1470
00:09:17.206428 IP 10.0.0.1.36598 > 10.0.0.2.5001: UDP, length 1470
00:09:17.218539 IP 10.0.0.1.36598 > 10.0.0.2.5001: UDP, length 1470
00:09:17.230623 IP 10.0.0.1.36598 > 10.0.0.2.5001: UDP, length 1470
00:09:17.243409 IP 10.0.0.1.36598 > 10.0.0.2.5001: UDP, length 1470
00:09:17.254821 IP 10.0.0.1.36598 > 10.0.0.2.5001: UDP, length 1470
00:09:17.266899 IP 10.0.0.1.36598 > 10.0.0.2.5001: UDP, length 1470
00:09:17.279024 IP 10.0.0.1.36598 > 10.0.0.2.5001: UDP, length 1470
00:09:17.291130 IP 10.0.0.1.36598 > 10.0.0.2.5001: UDP, length 1470
00:09:17.303206 IP 10.0.0.1.36598 > 10.0.0.2.5001: UDP, length 1470
00:09:17.315999 IP 10.0.0.1.36598 > 10.0.0.2.5001: UDP, length 1470
00:09:17.327593 IP 10.0.0.1.36598 > 10.0.0.2.5001: UDP, length 1470
00:09:17.339499 IP 10.0.0.1.36598 > 10.0.0.2.5001: UDP, length 1470
00:09:17.352324 IP 10.0.0.1.36598 > 10.0.0.2.5001: UDP, length 1470
00:09:17.363692 IP 10.0.0.1.36598 > 10.0.0.2.5001: UDP, length 1470
00:09:17.375743 IP 10.0.0.1.36598 > 10.0.0.2.5001: UDP, length 1470
00:09:17.387858 IP 10.0.0.1.36598 > 10.0.0.2.5001: UDP, length 1470
00:09:17.399958 IP 10.0.0.1.36598 > 10.0.0.2.5001: UDP, length 1470
00:09:17.412106 IP 10.0.0.1.36598 > 10.0.0.2.5001: UDP, length 1470
00:09:17.424164 IP 10.0.0.1.36598 > 10.0.0.2.5001: UDP, length 1470
00:09:17.436255 IP 10.0.0.1.36598 > 10.0.0.2.5001: UDP, length 1470
00:09:17.448314 IP 10.0.0.1.36598 > 10.0.0.2.5001: UDP, length 1470
00:09:17.460483 IP 10.0.0.1.36598 > 10.0.0.2.5001: UDP, length 1470
00:09:17.472563 IP 10.0.0.1.36598 > 10.0.0.2.5001: UDP, length 1470
00:09:17.484650 IP 10.0.0.1.36598 > 10.0.0.2.5001: UDP, length 1470
00:09:17.497506 IP 10.0.0.1.36598 > 10.0.0.2.5001: UDP, length 1470
00:09:17.508830 IP 10.0.0.1.36598 > 10.0.0.2.5001: UDP, length 1470
00:09:17.520963 IP 10.0.0.1.36598 > 10.0.0.2.5001: UDP, length 1470

