00:09:22.014871 IP 10.0.0.1.35974 > 10.0.0.2.5001: UDP, length 1470
00:09:22.014898 IP 10.0.0.1.35974 > 10.0.0.2.5001: UDP, length 1470
00:09:22.026341 IP 10.0.0.1.35974 > 10.0.0.2.5001: UDP, length 1470
00:09:22.038482 IP 10.0.0.1.35974 > 10.0.0.2.5001: UDP, length 1470
00:09:22.050588 IP 10.0.0.1.35974 > 10.0.0.2.5001: UDP, length 1470
00:09:22.062572 IP 10.0.0.1.35974 > 10.0.0.2.5001: UDP, length 1470
00:09:22.074679 IP 10.0.0.1.35974 > 10.0.0.2.5001: UDP, length 1470
00:09:22.086805 IP 10.0.0.1.35974 > 10.0.0.2.5001: UDP, length 1470
00:09:22.098867 IP 10.0.0.1.35974 > 10.0.0.2.5001: UDP, length 1470
00:09:22.110961 IP 10.0.0.1.35974 > 10.0.0.2.5001: UDP, length 1470
00:09:22.123071 IP 10.0.0.1.35974 > 10.0.0.2.5001: UDP, length 1470
00:09:22.135142 IP 10.0.0.1.35974 > 10.0.0.2.5001: UDP, length 1470
00:09:22.147254 IP 10.0.0.1.35974 > 10.0.0.2.5001: UDP, length 1470
00:09:22.159347 IP 10.0.0.1.35974 > 10.0.0.2.5001: UDP, length 1470
00:09:22.172648 IP 10.0.0.1.35974 > 10.0.0.2.5001: UDP, length 1470
00:09:22.184775 IP 10.0.0.1.35974 > 10.0.0.2.5001: UDP, length 1470
00:09:22.196856 IP 10.0.0.1.35974 > 10.0.0.2.5001: UDP, length 1470
00:09:22.209734 IP 10.0.0.1.35974 > 10.0.0.2.5001: UDP, length 1470
00:09:22.221047 IP 10.0.0.1.35974 > 10.0.0.2.5001: UDP, length 1470
00:09:22.233862 IP 10.0.0.1.35974 > 10.0.0.2.5001: UDP, length 1470
00:09:22.245267 IP 10.0.0.1.35974 > 10.0.0.2.5001: UDP, length 1470
00:09:22.257306 IP 10.0.0.1.35974 > 10.0.0.2.5001: UDP, length 1470
00:09:22.270159 IP 10.0.0.1.35974 > 10.0.0.2.5001: UDP, length 1470
00:09:22.281516 IP 10.0.0.1.35974 > 10.0.0.2.5001: UDP, length 1470
00:09:22.293579 IP 10.0.0.1.35974 > 10.0.0.2.5001: UDP, length 1470
00:09:22.305710 IP 10.0.0.1.35974 > 10.0.0.2.5001: UDP, length 1470
00:09:22.329943 IP 10.0.0.1.35974 > 10.0.0.2.5001: UDP, length 1470
00:09:22.342694 IP 10.0.0.1.35974 > 10.0.0.2.5001: UDP, length 1470
00:09:22.354100 IP 10.0.0.1.35974 > 10.0.0.2.5001: UDP, length 1470
00:09:22.366174 IP 10.0.0.1.35974 > 10.0.0.2.5001: UDP, length 1470
00:09:22.378317 IP 10.0.0.1.35974 > 10.0.0.2.5001: UDP, length 1470
00:09:22.390385 IP 10.0.0.1.35974 > 10.0.0.2.5001: UDP, length 1470
00:09:22.402520 IP 10.0.0.1.35974 > 10.0.0.2.5001: UDP, length 1470
00:09:22.415219 IP 10.0.0.1.35974 > 10.0.0.2.5001: UDP, length 1470
00:09:22.426654 IP 10.0.0.1.35974 > 10.0.0.2.5001: UDP, length 1470
00:09:22.438779 IP 10.0.0.1.35974 > 10.0.0.2.5001: UDP, length 1470
00:09:22.450836 IP 10.0.0.1.35974 > 10.0.0.2.5001: UDP, length 1470
00:09:22.462923 IP 10.0.0.1.35974 > 10.0.0.2.5001: UDP, length 1470
00:09:22.475023 IP 10.0.0.1.35974 > 10.0.0.2.5001: UDP, length 1470
00:09:22.487148 IP 10.0.0.1.35974 > 10.0.0.2.5001: UDP, length 1470
00:09:22.499279 IP 10.0.0.1.35974 > 10.0.0.2.5001: UDP, length 1470
00:09:22.512104 IP 10.0.0.1.35974 > 10.0.0.2.5001: UDP, length 1470
00:09:22.523438 IP 10.0.0.1.35974 > 10.0.0.2.5001: UDP, length 1470
00:09:22.535534 IP 10.0.0.1.35974 > 10.0.0.2.5001: UDP, length 1470
00:09:22.547622 IP 10.0.0.1.35974 > 10.0.0.2.5001: UDP, length 1470
00:09:22.559755 IP 10.0.0.1.35974 > 10.0.0.2.5001: UDP, length 1470
00:09:22.571792 IP 10.0.0.1.35974 > 10.0.0.2.5001: UDP, length 1470
00:09:22.583918 IP 10.0.0.1.35974 > 10.0.0.2.5001: UDP, length 1470
00:09:22.596231 IP 10.0.0.1.35974 > 10.0.0.2.5001: UDP, length 1470
00:09:22.620213 IP 10.0.0.1.35974 > 10.0.0.2.5001: UDP, length 1470
00:09:22.632316 IP 10.0.0.1.35974 > 10.0.0.2.5001: UDP, length 1470
00:09:22.644762 IP 10.0.0.1.35974 > 10.0.0.2.5001: UDP, length 1470
00:09:22.656499 IP 10.0.0.1.35974 > 10.0.0.2.5001: UDP, length 1470
00:09:22.668597 IP 10.0.0.1.35974 > 10.0.0.2.5001: UDP, length 1470
00:09:22.680634 IP 10.0.0.1.35974 > 10.0.0.2.5001: UDP, length 1470
00:09:22.692797 IP 10.0.0.1.35974 > 10.0.0.2.5001: UDP, length 1470
00:09:22.705608 IP 10.0.0.1.35974 > 10.0.0.2.5001: UDP, length 1470
00:09:22.716978 IP 10.0.0.1.35974 > 10.0.0.2.5001: UDP, length 1470
00:09:22.729028 IP 10.0.0.1.35974 > 10.0.0.2.5001: UDP, length 1470
00:09:22.753284 IP 10.0.0.1.35974 > 10.0.0.2.5001: UDP, length 1470
00:09:22.765365 IP 10.0.0.1.35974 > 10.0.0.2.5001: UDP, length 1470
00:09:22.777458 IP 10.0.0.1.35974 > 10.0.0.2.5001: UDP, length 1470
00:09:22.789546 IP 10.0.0.1.35974 > 10.0.0.2.5001: UDP, length 1470
00:09:22.801606 IP 10.0.0.1.35974 > 10.0.0.2.5001: UDP, length 1470
00:09:22.813801 IP 10.0.0.1.35974 > 10.0.0.2.5001: UDP, length 1470
00:09:22.825829 IP 10.0.0.1.35974 > 10.0.0.2.5001: UDP, length 1470
00:09:22.837935 IP 10.0.0.1.35974 > 10.0.0.2.5001: UDP, length 1470
00:09:22.849992 IP 10.0.0.1.35974 > 10.0.0.2.5001: UDP, length 1470
00:09:22.862140 IP 10.0.0.1.35974 > 10.0.0.2.5001: UDP, length 1470
00:09:22.874190 IP 10.0.0.1.35974 > 10.0.0.2.5001: UDP, length 1470
00:09:22.886349 IP 10.0.0.1.35974 > 10.0.0.2.5001: UDP, length 1470
00:09:22.898416 IP 10.0.0.1.35974 > 10.0.0.2.5001: UDP, length 1470
00:09:22.910538 IP 10.0.0.1.35974 > 10.0.0.2.5001: UDP, length 1470
00:09:22.923434 IP 10.0.0.1.35974 > 10.0.0.2.5001: UDP, length 1470
00:09:22.934674 IP 10.0.0.1.35974 > 10.0.0.2.5001: UDP, length 1470
00:09:22.946822 IP 10.0.0.1.35974 > 10.0.0.2.5001: UDP, length 1470
00:09:22.958903 IP 10.0.0.1.35974 > 10.0.0.2.5001: UDP, length 1470
00:09:22.970994 IP 10.0.0.1.35974 > 10.0.0.2.5001: UDP, length 1470
00:09:22.983076 IP 10.0.0.1.35974 > 10.0.0.2.5001: UDP, length 1470
00:09:22.995176 IP 10.0.0.1.35974 > 10.0.0.2.5001: UDP, length 1470
00:09:23.007322 IP 10.0.0.1.35974 > 10.0.0.2.5001: UDP, length 1470
00:09:23.020318 IP 10.0.0.1.35974 > 10.0.0.2.5001: UDP, length 1470
00:09:23.031473 IP 10.0.0.1.35974 > 10.0.0.2.5001: UDP, length 1470
00:09:23.043550 IP 10.0.0.1.35974 > 10.0.0.2.5001: UDP, length 1470
00:09:23.056396 IP 10.0.0.1.35974 > 10.0.0.2.5001: UDP, length 1470
00:09:23.067730 IP 10.0.0.1.35974 > 10.0.0.2.5001: UDP, length 1470
00:09:23.079854 IP 10.0.0.1.35974 > 10.0.0.2.5001: UDP, length 1470
00:09:23.091945 IP 10.0.0.1.35974 > 10.0.0.2.5001: UDP, length 1470
00:09:23.104043 IP 10.0.0.1.35974 > 10.0.0.2.5001: UDP, length 1470
00:09:23.116120 IP 10.0.0.1.35974 > 10.0.0.2.5001: UDP, length 1470
00:09:23.128290 IP 10.0.0.1.35974 > 10.0.0.2.5001: UDP, length 1470
00:09:23.140353 IP 10.0.0.1.35974 > 10.0.0.2.5001: UDP, length 1470
00:09:23.152467 IP 10.0.0.1.35974 > 10.0.0.2.5001: UDP, length 1470
00:09:23.164520 IP 10.0.0.1.35974 > 10.0.0.2.5001: UDP, length 1470
00:09:23.176623 IP 10.0.0.1.35974 > 10.0.0.2.5001: UDP, length 1470
00:09:23.188753 IP 10.0.0.1.35974 > 10.0.0.2.5001: UDP, length 1470
00:09:23.200803 IP 10.0.0.1.35974 > 10.0.0.2.5001: UDP, length 1470
00:09:23.212935 IP 10.0.0.1.35974 > 10.0.0.2.5001: UDP, length 1470
00:09:23.224987 IP 10.0.0.1.35974 > 10.0.0.2.5001: UDP, length 1470
00:09:23.237110 IP 10.0.0.1.35974 > 10.0.0.2.5001: UDP, length 1470
00:09:23.249196 IP 10.0.0.1.35974 > 10.0.0.2.5001: UDP, length 1470
00:09:23.261302 IP 10.0.0.1.35974 > 10.0.0.2.5001: UDP, length 1470
00:09:23.273373 IP 10.0.0.1.35974 > 10.0.0.2.5001: UDP, length 1470
00:09:23.285492 IP 10.0.0.1.35974 > 10.0.0.2.5001: UDP, length 1470
00:09:23.297589 IP 10.0.0.1.35974 > 10.0.0.2.5001: UDP, length 1470
00:09:23.309679 IP 10.0.0.1.35974 > 10.0.0.2.5001: UDP, length 1470
00:09:23.321767 IP 10.0.0.1.35974 > 10.0.0.2.5001: UDP, length 1470
00:09:23.333853 IP 10.0.0.1.35974 > 10.0.0.2.5001: UDP, length 1470
00:09:23.345990 IP 10.0.0.1.35974 > 10.0.0.2.5001: UDP, length 1470
00:09:23.358067 IP 10.0.0.1.35974 > 10.0.0.2.5001: UDP, length 1470
00:09:23.370185 IP 10.0.0.1.35974 > 10.0.0.2.5001: UDP, length 1470
00:09:23.382252 IP 10.0.0.1.35974 > 10.0.0.2.5001: UDP, length 1470
00:09:23.394313 IP 10.0.0.1.35974 > 10.0.0.2.5001: UDP, length 1470
00:09:23.406443 IP 10.0.0.1.35974 > 10.0.0.2.5001: UDP, length 1470
00:09:23.418515 IP 10.0.0.1.35974 > 10.0.0.2.5001: UDP, length 1470
00:09:23.430647 IP 10.0.0.1.35974 > 10.0.0.2.5001: UDP, length 1470
00:09:23.443528 IP 10.0.0.1.35974 > 10.0.0.2.5001: UDP, length 1470
00:09:23.454801 IP 10.0.0.1.35974 > 10.0.0.2.5001: UDP, length 1470
00:09:23.466951 IP 10.0.0.1.35974 > 10.0.0.2.5001: UDP, length 1470
00:09:23.479780 IP 10.0.0.1.35974 > 10.0.0.2.5001: UDP, length 1470
00:09:23.491121 IP 10.0.0.1.35974 > 10.0.0.2.5001: UDP, length 1470
00:09:23.503984 IP 10.0.0.1.35974 > 10.0.0.2.5001: UDP, length 1470
00:09:23.515319 IP 10.0.0.1.35974 > 10.0.0.2.5001: UDP, length 1470
00:09:23.527413 IP 10.0.0.1.35974 > 10.0.0.2.5001: UDP, length 1470
00:09:23.539507 IP 10.0.0.1.35974 > 10.0.0.2.5001: UDP, length 1470
00:09:23.551928 IP 10.0.0.1.35974 > 10.0.0.2.5001: UDP, length 1470
00:09:23.563702 IP 10.0.0.1.35974 > 10.0.0.2.5001: UDP, length 1470
00:09:23.587876 IP 10.0.0.1.35974 > 10.0.0.2.5001: UDP, length 1470
00:09:23.599970 IP 10.0.0.1.35974 > 10.0.0.2.5001: UDP, length 1470
00:09:23.612094 IP 10.0.0.1.35974 > 10.0.0.2.5001: UDP, length 1470
00:09:23.624176 IP 10.0.0.1.35974 > 10.0.0.2.5001: UDP, length 1470
00:09:23.636288 IP 10.0.0.1.35974 > 10.0.0.2.5001: UDP, length 1470
00:09:23.648522 IP 10.0.0.1.35974 > 10.0.0.2.5001: UDP, length 1470
00:09:23.660431 IP 10.0.0.1.35974 > 10.0.0.2.5001: UDP, length 1470
00:09:23.672572 IP 10.0.0.1.35974 > 10.0.0.2.5001: UDP, length 1470
00:09:23.684652 IP 10.0.0.1.35974 > 10.0.0.2.5001: UDP, length 1470
00:09:23.696752 IP 10.0.0.1.35974 > 10.0.0.2.5001: UDP, length 1470
00:09:23.708853 IP 10.0.0.1.35974 > 10.0.0.2.5001: UDP, length 1470
00:09:23.720928 IP 10.0.0.1.35974 > 10.0.0.2.5001: UDP, length 1470
00:09:23.733027 IP 10.0.0.1.35974 > 10.0.0.2.5001: UDP, length 1470
00:09:23.745175 IP 10.0.0.1.35974 > 10.0.0.2.5001: UDP, length 1470
00:09:23.758008 IP 10.0.0.1.35974 > 10.0.0.2.5001: UDP, length 1470
00:09:23.769318 IP 10.0.0.1.35974 > 10.0.0.2.5001: UDP, length 1470
00:09:23.781386 IP 10.0.0.1.35974 > 10.0.0.2.5001: UDP, length 1470
00:09:23.793525 IP 10.0.0.1.35974 > 10.0.0.2.5001: UDP, length 1470
00:09:23.805629 IP 10.0.0.1.35974 > 10.0.0.2.5001: UDP, length 1470
00:09:23.817718 IP 10.0.0.1.35974 > 10.0.0.2.5001: UDP, length 1470
00:09:23.841887 IP 10.0.0.1.35974 > 10.0.0.2.5001: UDP, length 1470
00:09:23.853998 IP 10.0.0.1.35974 > 10.0.0.2.5001: UDP, length 1470
00:09:23.866972 IP 10.0.0.1.35974 > 10.0.0.2.5001: UDP, length 1470
00:09:23.878217 IP 10.0.0.1.35974 > 10.0.0.2.5001: UDP, length 1470
00:09:23.890285 IP 10.0.0.1.35974 > 10.0.0.2.5001: UDP, length 1470
00:09:23.902374 IP 10.0.0.1.35974 > 10.0.0.2.5001: UDP, length 1470
00:09:23.914517 IP 10.0.0.1.35974 > 10.0.0.2.5001: UDP, length 1470
00:09:23.926758 IP 10.0.0.1.35974 > 10.0.0.2.5001: UDP, length 1470
00:09:23.938664 IP 10.0.0.1.35974 > 10.0.0.2.5001: UDP, length 1470
00:09:23.950725 IP 10.0.0.1.35974 > 10.0.0.2.5001: UDP, length 1470
00:09:23.963530 IP 10.0.0.1.35974 > 10.0.0.2.5001: UDP, length 1470
00:09:23.974942 IP 10.0.0.1.35974 > 10.0.0.2.5001: UDP, length 1470
00:09:23.987075 IP 10.0.0.1.35974 > 10.0.0.2.5001: UDP, length 1470
00:09:23.999889 IP 10.0.0.1.35974 > 10.0.0.2.5001: UDP, length 1470
00:09:24.011247 IP 10.0.0.1.35974 > 10.0.0.2.5001: UDP, length 1470
00:09:24.023342 IP 10.0.0.1.35974 > 10.0.0.2.5001: UDP, length 1470
00:09:24.036229 IP 10.0.0.1.35974 > 10.0.0.2.5001: UDP, length 1470
00:09:24.047540 IP 10.0.0.1.35974 > 10.0.0.2.5001: UDP, length 1470
00:09:24.060382 IP 10.0.0.1.35974 > 10.0.0.2.5001: UDP, length 1470
00:09:24.071754 IP 10.0.0.1.35974 > 10.0.0.2.5001: UDP, length 1470
00:09:24.083821 IP 10.0.0.1.35974 > 10.0.0.2.5001: UDP, length 1470
00:09:24.096075 IP 10.0.0.1.35974 > 10.0.0.2.5001: UDP, length 1470
00:09:24.107995 IP 10.0.0.1.35974 > 10.0.0.2.5001: UDP, length 1470
00:09:24.120140 IP 10.0.0.1.35974 > 10.0.0.2.5001: UDP, length 1470
00:09:24.132210 IP 10.0.0.1.35974 > 10.0.0.2.5001: UDP, length 1470
00:09:24.144299 IP 10.0.0.1.35974 > 10.0.0.2.5001: UDP, length 1470
00:09:24.156401 IP 10.0.0.1.35974 > 10.0.0.2.5001: UDP, length 1470
00:09:24.168549 IP 10.0.0.1.35974 > 10.0.0.2.5001: UDP, length 1470
00:09:24.180609 IP 10.0.0.1.35974 > 10.0.0.2.5001: UDP, length 1470
00:09:24.192695 IP 10.0.0.1.35974 > 10.0.0.2.5001: UDP, length 1470
00:09:24.205570 IP 10.0.0.1.35974 > 10.0.0.2.5001: UDP, length 1470
00:09:24.216874 IP 10.0.0.1.35974 > 10.0.0.2.5001: UDP, length 1470
00:09:24.228958 IP 10.0.0.1.35974 > 10.0.0.2.5001: UDP, length 1470
00:09:24.241082 IP 10.0.0.1.35974 > 10.0.0.2.5001: UDP, length 1470
00:09:24.253182 IP 10.0.0.1.35974 > 10.0.0.2.5001: UDP, length 1470
00:09:24.265257 IP 10.0.0.1.35974 > 10.0.0.2.5001: UDP, length 1470
00:09:24.277381 IP 10.0.0.1.35974 > 10.0.0.2.5001: UDP, length 1470
00:09:24.289452 IP 10.0.0.1.35974 > 10.0.0.2.5001: UDP, length 1470
00:09:24.301564 IP 10.0.0.1.35974 > 10.0.0.2.5001: UDP, length 1470
00:09:24.314274 IP 10.0.0.1.35974 > 10.0.0.2.5001: UDP, length 1470
00:09:24.325715 IP 10.0.0.1.35974 > 10.0.0.2.5001: UDP, length 1470
00:09:24.337824 IP 10.0.0.1.35974 > 10.0.0.2.5001: UDP, length 1470
00:09:24.350872 IP 10.0.0.1.35974 > 10.0.0.2.5001: UDP, length 1470
00:09:24.362020 IP 10.0.0.1.35974 > 10.0.0.2.5001: UDP, length 1470
00:09:24.374132 IP 10.0.0.1.35974 > 10.0.0.2.5001: UDP, length 1470
00:09:24.386210 IP 10.0.0.1.35974 > 10.0.0.2.5001: UDP, length 1470
00:09:24.398318 IP 10.0.0.1.35974 > 10.0.0.2.5001: UDP, length 1470
00:09:24.411052 IP 10.0.0.1.35974 > 10.0.0.2.5001: UDP, length 1470
00:09:24.422465 IP 10.0.0.1.35974 > 10.0.0.2.5001: UDP, length 1470
00:09:24.434567 IP 10.0.0.1.35974 > 10.0.0.2.5001: UDP, length 1470
00:09:24.446917 IP 10.0.0.1.35974 > 10.0.0.2.5001: UDP, length 1470
00:09:24.458760 IP 10.0.0.1.35974 > 10.0.0.2.5001: UDP, length 1470
00:09:24.470886 IP 10.0.0.1.35974 > 10.0.0.2.5001: UDP, length 1470
00:09:24.483012 IP 10.0.0.1.35974 > 10.0.0.2.5001: UDP, length 1470
00:09:24.495037 IP 10.0.0.1.35974 > 10.0.0.2.5001: UDP, length 1470
00:09:24.507175 IP 10.0.0.1.35974 > 10.0.0.2.5001: UDP, length 1470
00:09:24.519718 IP 10.0.0.1.35974 > 10.0.0.2.5001: UDP, length 1470
00:09:24.531339 IP 10.0.0.1.35974 > 10.0.0.2.5001: UDP, length 1470
00:09:24.543477 IP 10.0.0.1.35974 > 10.0.0.2.5001: UDP, length 1470
00:09:24.555574 IP 10.0.0.1.35974 > 10.0.0.2.5001: UDP, length 1470
00:09:24.567661 IP 10.0.0.1.35974 > 10.0.0.2.5001: UDP, length 1470
00:09:24.580511 IP 10.0.0.1.35974 > 10.0.0.2.5001: UDP, length 1470
00:09:24.591849 IP 10.0.0.1.35974 > 10.0.0.2.5001: UDP, length 1470
00:09:24.603952 IP 10.0.0.1.35974 > 10.0.0.2.5001: UDP, length 1470
00:09:24.616049 IP 10.0.0.1.35974 > 10.0.0.2.5001: UDP, length 1470
00:09:24.628170 IP 10.0.0.1.35974 > 10.0.0.2.5001: UDP, length 1470
00:09:24.640258 IP 10.0.0.1.35974 > 10.0.0.2.5001: UDP, length 1470
00:09:24.652365 IP 10.0.0.1.35974 > 10.0.0.2.5001: UDP, length 1470
00:09:24.664447 IP 10.0.0.1.35974 > 10.0.0.2.5001: UDP, length 1470
00:09:24.676519 IP 10.0.0.1.35974 > 10.0.0.2.5001: UDP, length 1470
00:09:24.688615 IP 10.0.0.1.35974 > 10.0.0.2.5001: UDP, length 1470
00:09:24.700681 IP 10.0.0.1.35974 > 10.0.0.2.5001: UDP, length 1470
00:09:24.712811 IP 10.0.0.1.35974 > 10.0.0.2.5001: UDP, length 1470
00:09:24.724880 IP 10.0.0.1.35974 > 10.0.0.2.5001: UDP, length 1470
00:09:24.737006 IP 10.0.0.1.35974 > 10.0.0.2.5001: UDP, length 1470
00:09:24.750774 IP 10.0.0.1.35974 > 10.0.0.2.5001: UDP, length 1470
00:09:24.761961 IP 10.0.0.1.35974 > 10.0.0.2.5001: UDP, length 1470
00:09:24.773295 IP 10.0.0.1.35974 > 10.0.0.2.5001: UDP, length 1470
00:09:24.785536 IP 10.0.0.1.35974 > 10.0.0.2.5001: UDP, length 1470
00:09:24.797492 IP 10.0.0.1.35974 > 10.0.0.2.5001: UDP, length 1470
00:09:24.809608 IP 10.0.0.1.35974 > 10.0.0.2.5001: UDP, length 1470
00:09:24.821695 IP 10.0.0.1.35974 > 10.0.0.2.5001: UDP, length 1470
00:09:24.834570 IP 10.0.0.1.35974 > 10.0.0.2.5001: UDP, length 1470
00:09:24.845890 IP 10.0.0.1.35974 > 10.0.0.2.5001: UDP, length 1470
00:09:24.858663 IP 10.0.0.1.35974 > 10.0.0.2.5001: UDP, length 1470
00:09:24.870089 IP 10.0.0.1.35974 > 10.0.0.2.5001: UDP, length 1470
00:09:24.882927 IP 10.0.0.1.35974 > 10.0.0.2.5001: UDP, length 1470
00:09:24.894248 IP 10.0.0.1.35974 > 10.0.0.2.5001: UDP, length 1470
00:09:24.906351 IP 10.0.0.1.35974 > 10.0.0.2.5001: UDP, length 1470
00:09:24.919236 IP 10.0.0.1.35974 > 10.0.0.2.5001: UDP, length 1470
00:09:24.930531 IP 10.0.0.1.35974 > 10.0.0.2.5001: UDP, length 1470
00:09:24.942665 IP 10.0.0.1.35974 > 10.0.0.2.5001: UDP, length 1470
00:09:24.954731 IP 10.0.0.1.35974 > 10.0.0.2.5001: UDP, length 1470
00:09:24.966829 IP 10.0.0.1.35974 > 10.0.0.2.5001: UDP, length 1470
00:09:24.978924 IP 10.0.0.1.35974 > 10.0.0.2.5001: UDP, length 1470
00:09:24.991764 IP 10.0.0.1.35974 > 10.0.0.2.5001: UDP, length 1470
00:09:25.003166 IP 10.0.0.1.35974 > 10.0.0.2.5001: UDP, length 1470
00:09:25.015211 IP 10.0.0.1.35974 > 10.0.0.2.5001: UDP, length 1470
00:09:25.027349 IP 10.0.0.1.35974 > 10.0.0.2.5001: UDP, length 1470
00:09:25.039407 IP 10.0.0.1.35974 > 10.0.0.2.5001: UDP, length 1470
00:09:25.052259 IP 10.0.0.1.35974 > 10.0.0.2.5001: UDP, length 1470
00:09:25.063595 IP 10.0.0.1.35974 > 10.0.0.2.5001: UDP, length 1470
00:09:25.075707 IP 10.0.0.1.35974 > 10.0.0.2.5001: UDP, length 1470
00:09:25.087806 IP 10.0.0.1.35974 > 10.0.0.2.5001: UDP, length 1470
00:09:25.099878 IP 10.0.0.1.35974 > 10.0.0.2.5001: UDP, length 1470
00:09:25.111985 IP 10.0.0.1.35974 > 10.0.0.2.5001: UDP, length 1470
00:09:25.124049 IP 10.0.0.1.35974 > 10.0.0.2.5001: UDP, length 1470
00:09:25.136197 IP 10.0.0.1.35974 > 10.0.0.2.5001: UDP, length 1470
00:09:25.148267 IP 10.0.0.1.35974 > 10.0.0.2.5001: UDP, length 1470
00:09:25.160354 IP 10.0.0.1.35974 > 10.0.0.2.5001: UDP, length 1470
00:09:25.172471 IP 10.0.0.1.35974 > 10.0.0.2.5001: UDP, length 1470
00:09:25.184573 IP 10.0.0.1.35974 > 10.0.0.2.5001: UDP, length 1470
00:09:25.196646 IP 10.0.0.1.35974 > 10.0.0.2.5001: UDP, length 1470
00:09:25.208767 IP 10.0.0.1.35974 > 10.0.0.2.5001: UDP, length 1470
00:09:25.221643 IP 10.0.0.1.35974 > 10.0.0.2.5001: UDP, length 1470
00:09:25.232941 IP 10.0.0.1.35974 > 10.0.0.2.5001: UDP, length 1470
00:09:25.245779 IP 10.0.0.1.35974 > 10.0.0.2.5001: UDP, length 1470
00:09:25.257135 IP 10.0.0.1.35974 > 10.0.0.2.5001: UDP, length 1470
00:09:25.269230 IP 10.0.0.1.35974 > 10.0.0.2.5001: UDP, length 1470
00:09:25.282221 IP 10.0.0.1.35974 > 10.0.0.2.5001: UDP, length 1470
00:09:25.293398 IP 10.0.0.1.35974 > 10.0.0.2.5001: UDP, length 1470
00:09:25.306351 IP 10.0.0.1.35974 > 10.0.0.2.5001: UDP, length 1470
00:09:25.317617 IP 10.0.0.1.35974 > 10.0.0.2.5001: UDP, length 1470
00:09:25.329719 IP 10.0.0.1.35974 > 10.0.0.2.5001: UDP, length 1470
00:09:25.341777 IP 10.0.0.1.35974 > 10.0.0.2.5001: UDP, length 1470
00:09:25.353911 IP 10.0.0.1.35974 > 10.0.0.2.5001: UDP, length 1470
00:09:25.365994 IP 10.0.0.1.35974 > 10.0.0.2.5001: UDP, length 1470
00:09:25.378081 IP 10.0.0.1.35974 > 10.0.0.2.5001: UDP, length 1470
00:09:25.390200 IP 10.0.0.1.35974 > 10.0.0.2.5001: UDP, length 1470
00:09:25.402288 IP 10.0.0.1.35974 > 10.0.0.2.5001: UDP, length 1470
00:09:25.414393 IP 10.0.0.1.35974 > 10.0.0.2.5001: UDP, length 1470
00:09:25.426466 IP 10.0.0.1.35974 > 10.0.0.2.5001: UDP, length 1470
00:09:25.438559 IP 10.0.0.1.35974 > 10.0.0.2.5001: UDP, length 1470
00:09:25.450632 IP 10.0.0.1.35974 > 10.0.0.2.5001: UDP, length 1470
00:09:25.462796 IP 10.0.0.1.35974 > 10.0.0.2.5001: UDP, length 1470
00:09:25.474874 IP 10.0.0.1.35974 > 10.0.0.2.5001: UDP, length 1470
00:09:25.486953 IP 10.0.0.1.35974 > 10.0.0.2.5001: UDP, length 1470
00:09:25.499052 IP 10.0.0.1.35974 > 10.0.0.2.5001: UDP, length 1470
00:09:25.511791 IP 10.0.0.1.35974 > 10.0.0.2.5001: UDP, length 1470
00:09:25.523268 IP 10.0.0.1.35974 > 10.0.0.2.5001: UDP, length 1470
00:09:25.536084 IP 10.0.0.1.35974 > 10.0.0.2.5001: UDP, length 1470
00:09:25.547442 IP 10.0.0.1.35974 > 10.0.0.2.5001: UDP, length 1470
00:09:25.559527 IP 10.0.0.1.35974 > 10.0.0.2.5001: UDP, length 1470
00:09:25.571632 IP 10.0.0.1.35974 > 10.0.0.2.5001: UDP, length 1470
00:09:25.583767 IP 10.0.0.1.35974 > 10.0.0.2.5001: UDP, length 1470
00:09:25.595829 IP 10.0.0.1.35974 > 10.0.0.2.5001: UDP, length 1470
00:09:25.607913 IP 10.0.0.1.35974 > 10.0.0.2.5001: UDP, length 1470
00:09:25.620012 IP 10.0.0.1.35974 > 10.0.0.2.5001: UDP, length 1470
00:09:25.632116 IP 10.0.0.1.35974 > 10.0.0.2.5001: UDP, length 1470
00:09:25.644969 IP 10.0.0.1.35974 > 10.0.0.2.5001: UDP, length 1470
00:09:25.656313 IP 10.0.0.1.35974 > 10.0.0.2.5001: UDP, length 1470
00:09:25.668367 IP 10.0.0.1.35974 > 10.0.0.2.5001: UDP, length 1470
00:09:25.681373 IP 10.0.0.1.35974 > 10.0.0.2.5001: UDP, length 1470
00:09:25.692594 IP 10.0.0.1.35974 > 10.0.0.2.5001: UDP, length 1470
00:09:25.704685 IP 10.0.0.1.35974 > 10.0.0.2.5001: UDP, length 1470
00:09:25.717519 IP 10.0.0.1.35974 > 10.0.0.2.5001: UDP, length 1470
00:09:25.728907 IP 10.0.0.1.35974 > 10.0.0.2.5001: UDP, length 1470
00:09:25.740978 IP 10.0.0.1.35974 > 10.0.0.2.5001: UDP, length 1470
00:09:25.753094 IP 10.0.0.1.35974 > 10.0.0.2.5001: UDP, length 1470
00:09:25.765191 IP 10.0.0.1.35974 > 10.0.0.2.5001: UDP, length 1470
00:09:25.778034 IP 10.0.0.1.35974 > 10.0.0.2.5001: UDP, length 1470
00:09:25.789353 IP 10.0.0.1.35974 > 10.0.0.2.5001: UDP, length 1470
00:09:25.801446 IP 10.0.0.1.35974 > 10.0.0.2.5001: UDP, length 1470
00:09:25.814277 IP 10.0.0.1.35974 > 10.0.0.2.5001: UDP, length 1470
00:09:25.825612 IP 10.0.0.1.35974 > 10.0.0.2.5001: UDP, length 1470
00:09:25.837731 IP 10.0.0.1.35974 > 10.0.0.2.5001: UDP, length 1470
00:09:25.849804 IP 10.0.0.1.35974 > 10.0.0.2.5001: UDP, length 1470
00:09:25.861946 IP 10.0.0.1.35974 > 10.0.0.2.5001: UDP, length 1470
00:09:25.874028 IP 10.0.0.1.35974 > 10.0.0.2.5001: UDP, length 1470
00:09:25.886088 IP 10.0.0.1.35974 > 10.0.0.2.5001: UDP, length 1470
00:09:25.898249 IP 10.0.0.1.35974 > 10.0.0.2.5001: UDP, length 1470
00:09:25.911151 IP 10.0.0.1.35974 > 10.0.0.2.5001: UDP, length 1470
00:09:25.922419 IP 10.0.0.1.35974 > 10.0.0.2.5001: UDP, length 1470
00:09:25.934510 IP 10.0.0.1.35974 > 10.0.0.2.5001: UDP, length 1470
00:09:25.946633 IP 10.0.0.1.35974 > 10.0.0.2.5001: UDP, length 1470
00:09:25.958724 IP 10.0.0.1.35974 > 10.0.0.2.5001: UDP, length 1470
00:09:25.970827 IP 10.0.0.1.35974 > 10.0.0.2.5001: UDP, length 1470
00:09:25.982896 IP 10.0.0.1.35974 > 10.0.0.2.5001: UDP, length 1470
00:09:25.994991 IP 10.0.0.1.35974 > 10.0.0.2.5001: UDP, length 1470
00:09:26.007100 IP 10.0.0.1.35974 > 10.0.0.2.5001: UDP, length 1470
00:09:26.019178 IP 10.0.0.1.35974 > 10.0.0.2.5001: UDP, length 1470
00:09:26.031296 IP 10.0.0.1.35974 > 10.0.0.2.5001: UDP, length 1470
00:09:26.043351 IP 10.0.0.1.35974 > 10.0.0.2.5001: UDP, length 1470
00:09:26.055473 IP 10.0.0.1.35974 > 10.0.0.2.5001: UDP, length 1470
00:09:26.067563 IP 10.0.0.1.35974 > 10.0.0.2.5001: UDP, length 1470
00:09:26.079639 IP 10.0.0.1.35974 > 10.0.0.2.5001: UDP, length 1470
00:09:26.091806 IP 10.0.0.1.35974 > 10.0.0.2.5001: UDP, length 1470
00:09:26.104647 IP 10.0.0.1.35974 > 10.0.0.2.5001: UDP, length 1470
00:09:26.115953 IP 10.0.0.1.35974 > 10.0.0.2.5001: UDP, length 1470
00:09:26.128845 IP 10.0.0.1.35974 > 10.0.0.2.5001: UDP, length 1470
00:09:26.140115 IP 10.0.0.1.35974 > 10.0.0.2.5001: UDP, length 1470
00:09:26.152276 IP 10.0.0.1.35974 > 10.0.0.2.5001: UDP, length 1470
00:09:26.164348 IP 10.0.0.1.35974 > 10.0.0.2.5001: UDP, length 1470
00:09:26.177180 IP 10.0.0.1.35974 > 10.0.0.2.5001: UDP, length 1470
00:09:26.188531 IP 10.0.0.1.35974 > 10.0.0.2.5001: UDP, length 1470
00:09:26.200589 IP 10.0.0.1.35974 > 10.0.0.2.5001: UDP, length 1470
00:09:26.212865 IP 10.0.0.1.35974 > 10.0.0.2.5001: UDP, length 1470
00:09:26.225662 IP 10.0.0.1.35974 > 10.0.0.2.5001: UDP, length 1470
00:09:26.236920 IP 10.0.0.1.35974 > 10.0.0.2.5001: UDP, length 1470
00:09:26.249022 IP 10.0.0.1.35974 > 10.0.0.2.5001: UDP, length 1470
00:09:26.261840 IP 10.0.0.1.35974 > 10.0.0.2.5001: UDP, length 1470
00:09:26.273195 IP 10.0.0.1.35974 > 10.0.0.2.5001: UDP, length 1470
00:09:26.286122 IP 10.0.0.1.35974 > 10.0.0.2.5001: UDP, length 1470
00:09:26.297382 IP 10.0.0.1.35974 > 10.0.0.2.5001: UDP, length 1470
00:09:26.309497 IP 10.0.0.1.35974 > 10.0.0.2.5001: UDP, length 1470
00:09:26.321577 IP 10.0.0.1.35974 > 10.0.0.2.5001: UDP, length 1470
00:09:26.333694 IP 10.0.0.1.35974 > 10.0.0.2.5001: UDP, length 1470
00:09:26.345801 IP 10.0.0.1.35974 > 10.0.0.2.5001: UDP, length 1470
00:09:26.357869 IP 10.0.0.1.35974 > 10.0.0.2.5001: UDP, length 1470
00:09:26.369917 IP 10.0.0.1.35974 > 10.0.0.2.5001: UDP, length 1470
00:09:26.382064 IP 10.0.0.1.35974 > 10.0.0.2.5001: UDP, length 1470
00:09:26.394160 IP 10.0.0.1.35974 > 10.0.0.2.5001: UDP, length 1470
00:09:26.406223 IP 10.0.0.1.35974 > 10.0.0.2.5001: UDP, length 1470
00:09:26.418340 IP 10.0.0.1.35974 > 10.0.0.2.5001: UDP, length 1470
00:09:26.430469 IP 10.0.0.1.35974 > 10.0.0.2.5001: UDP, length 1470
00:09:26.443346 IP 10.0.0.1.35974 > 10.0.0.2.5001: UDP, length 1470
00:09:26.454640 IP 10.0.0.1.35974 > 10.0.0.2.5001: UDP, length 1470
00:09:26.466737 IP 10.0.0.1.35974 > 10.0.0.2.5001: UDP, length 1470
00:09:26.478873 IP 10.0.0.1.35974 > 10.0.0.2.5001: UDP, length 1470
00:09:26.490923 IP 10.0.0.1.35974 > 10.0.0.2.5001: UDP, length 1470
00:09:26.503039 IP 10.0.0.1.35974 > 10.0.0.2.5001: UDP, length 1470
00:09:26.515881 IP 10.0.0.1.35974 > 10.0.0.2.5001: UDP, length 1470
00:09:26.527219 IP 10.0.0.1.35974 > 10.0.0.2.5001: UDP, length 1470
00:09:26.539312 IP 10.0.0.1.35974 > 10.0.0.2.5001: UDP, length 1470
00:09:26.551781 IP 10.0.0.1.35974 > 10.0.0.2.5001: UDP, length 1470
00:09:26.563531 IP 10.0.0.1.35974 > 10.0.0.2.5001: UDP, length 1470
00:09:26.575534 IP 10.0.0.1.35974 > 10.0.0.2.5001: UDP, length 1470
00:09:26.587703 IP 10.0.0.1.35974 > 10.0.0.2.5001: UDP, length 1470
00:09:26.611885 IP 10.0.0.1.35974 > 10.0.0.2.5001: UDP, length 1470
00:09:26.623993 IP 10.0.0.1.35974 > 10.0.0.2.5001: UDP, length 1470
00:09:26.636091 IP 10.0.0.1.35974 > 10.0.0.2.5001: UDP, length 1470
00:09:26.648184 IP 10.0.0.1.35974 > 10.0.0.2.5001: UDP, length 1470
00:09:26.660289 IP 10.0.0.1.35974 > 10.0.0.2.5001: UDP, length 1470
00:09:26.672395 IP 10.0.0.1.35974 > 10.0.0.2.5001: UDP, length 1470
00:09:26.684473 IP 10.0.0.1.35974 > 10.0.0.2.5001: UDP, length 1470
00:09:26.696763 IP 10.0.0.1.35974 > 10.0.0.2.5001: UDP, length 1470
00:09:26.708664 IP 10.0.0.1.35974 > 10.0.0.2.5001: UDP, length 1470
00:09:26.720772 IP 10.0.0.1.35974 > 10.0.0.2.5001: UDP, length 1470
00:09:26.732854 IP 10.0.0.1.35974 > 10.0.0.2.5001: UDP, length 1470
00:09:26.744959 IP 10.0.0.1.35974 > 10.0.0.2.5001: UDP, length 1470
00:09:26.757022 IP 10.0.0.1.35974 > 10.0.0.2.5001: UDP, length 1470
00:09:26.769879 IP 10.0.0.1.35974 > 10.0.0.2.5001: UDP, length 1470
00:09:26.781234 IP 10.0.0.1.35974 > 10.0.0.2.5001: UDP, length 1470
00:09:26.793279 IP 10.0.0.1.35974 > 10.0.0.2.5001: UDP, length 1470
00:09:26.805448 IP 10.0.0.1.35974 > 10.0.0.2.5001: UDP, length 1470
00:09:26.817542 IP 10.0.0.1.35974 > 10.0.0.2.5001: UDP, length 1470
00:09:26.829654 IP 10.0.0.1.35974 > 10.0.0.2.5001: UDP, length 1470
00:09:26.841700 IP 10.0.0.1.35974 > 10.0.0.2.5001: UDP, length 1470
00:09:26.853735 IP 10.0.0.1.35974 > 10.0.0.2.5001: UDP, length 1470
00:09:26.865896 IP 10.0.0.1.35974 > 10.0.0.2.5001: UDP, length 1470
00:09:26.878020 IP 10.0.0.1.35974 > 10.0.0.2.5001: UDP, length 1470
00:09:26.890099 IP 10.0.0.1.35974 > 10.0.0.2.5001: UDP, length 1470
00:09:26.902217 IP 10.0.0.1.35974 > 10.0.0.2.5001: UDP, length 1470
00:09:26.914289 IP 10.0.0.1.35974 > 10.0.0.2.5001: UDP, length 1470
00:09:26.927085 IP 10.0.0.1.35974 > 10.0.0.2.5001: UDP, length 1470
00:09:26.938482 IP 10.0.0.1.35974 > 10.0.0.2.5001: UDP, length 1470
00:09:26.950540 IP 10.0.0.1.35974 > 10.0.0.2.5001: UDP, length 1470
00:09:26.963419 IP 10.0.0.1.35974 > 10.0.0.2.5001: UDP, length 1470
00:09:26.975049 IP 10.0.0.1.35974 > 10.0.0.2.5001: UDP, length 1470
00:09:26.986864 IP 10.0.0.1.35974 > 10.0.0.2.5001: UDP, length 1470
00:09:26.998972 IP 10.0.0.1.35974 > 10.0.0.2.5001: UDP, length 1470
00:09:27.011972 IP 10.0.0.1.35974 > 10.0.0.2.5001: UDP, length 1470
00:09:27.023155 IP 10.0.0.1.35974 > 10.0.0.2.5001: UDP, length 1470
00:09:27.035252 IP 10.0.0.1.35974 > 10.0.0.2.5001: UDP, length 1470
00:09:27.047617 IP 10.0.0.1.35974 > 10.0.0.2.5001: UDP, length 1470
00:09:27.059461 IP 10.0.0.1.35974 > 10.0.0.2.5001: UDP, length 1470
00:09:27.071537 IP 10.0.0.1.35974 > 10.0.0.2.5001: UDP, length 1470
00:09:27.083630 IP 10.0.0.1.35974 > 10.0.0.2.5001: UDP, length 1470
00:09:27.095739 IP 10.0.0.1.35974 > 10.0.0.2.5001: UDP, length 1470
00:09:27.108541 IP 10.0.0.1.35974 > 10.0.0.2.5001: UDP, length 1470
00:09:27.119926 IP 10.0.0.1.35974 > 10.0.0.2.5001: UDP, length 1470
00:09:27.131994 IP 10.0.0.1.35974 > 10.0.0.2.5001: UDP, length 1470
00:09:27.144108 IP 10.0.0.1.35974 > 10.0.0.2.5001: UDP, length 1470
00:09:27.168276 IP 10.0.0.1.35974 > 10.0.0.2.5001: UDP, length 1470
00:09:27.180400 IP 10.0.0.1.35974 > 10.0.0.2.5001: UDP, length 1470
00:09:27.192507 IP 10.0.0.1.35974 > 10.0.0.2.5001: UDP, length 1470
00:09:27.204593 IP 10.0.0.1.35974 > 10.0.0.2.5001: UDP, length 1470
00:09:27.216723 IP 10.0.0.1.35974 > 10.0.0.2.5001: UDP, length 1470
00:09:27.228798 IP 10.0.0.1.35974 > 10.0.0.2.5001: UDP, length 1470
00:09:27.240857 IP 10.0.0.1.35974 > 10.0.0.2.5001: UDP, length 1470
00:09:27.252971 IP 10.0.0.1.35974 > 10.0.0.2.5001: UDP, length 1470
00:09:27.265071 IP 10.0.0.1.35974 > 10.0.0.2.5001: UDP, length 1470
00:09:27.277958 IP 10.0.0.1.35974 > 10.0.0.2.5001: UDP, length 1470
00:09:27.289234 IP 10.0.0.1.35974 > 10.0.0.2.5001: UDP, length 1470
00:09:27.301349 IP 10.0.0.1.35974 > 10.0.0.2.5001: UDP, length 1470
00:09:27.313444 IP 10.0.0.1.35974 > 10.0.0.2.5001: UDP, length 1470
00:09:27.326389 IP 10.0.0.1.35974 > 10.0.0.2.5001: UDP, length 1470
00:09:27.337648 IP 10.0.0.1.35974 > 10.0.0.2.5001: UDP, length 1470
00:09:27.349687 IP 10.0.0.1.35974 > 10.0.0.2.5001: UDP, length 1470
00:09:27.362556 IP 10.0.0.1.35974 > 10.0.0.2.5001: UDP, length 1470
00:09:27.373910 IP 10.0.0.1.35974 > 10.0.0.2.5001: UDP, length 1470
00:09:27.386182 IP 10.0.0.1.35974 > 10.0.0.2.5001: UDP, length 1470
00:09:27.398105 IP 10.0.0.1.35974 > 10.0.0.2.5001: UDP, length 1470
00:09:27.410231 IP 10.0.0.1.35974 > 10.0.0.2.5001: UDP, length 1470
00:09:27.422283 IP 10.0.0.1.35974 > 10.0.0.2.5001: UDP, length 1470
00:09:27.434374 IP 10.0.0.1.35974 > 10.0.0.2.5001: UDP, length 1470
00:09:27.446484 IP 10.0.0.1.35974 > 10.0.0.2.5001: UDP, length 1470
00:09:27.458611 IP 10.0.0.1.35974 > 10.0.0.2.5001: UDP, length 1470
00:09:27.470730 IP 10.0.0.1.35974 > 10.0.0.2.5001: UDP, length 1470
00:09:27.482800 IP 10.0.0.1.35974 > 10.0.0.2.5001: UDP, length 1470
00:09:27.494923 IP 10.0.0.1.35974 > 10.0.0.2.5001: UDP, length 1470
00:09:27.507724 IP 10.0.0.1.35974 > 10.0.0.2.5001: UDP, length 1470
00:09:27.519082 IP 10.0.0.1.35974 > 10.0.0.2.5001: UDP, length 1470
00:09:27.531190 IP 10.0.0.1.35974 > 10.0.0.2.5001: UDP, length 1470
00:09:27.543260 IP 10.0.0.1.35974 > 10.0.0.2.5001: UDP, length 1470
00:09:27.555381 IP 10.0.0.1.35974 > 10.0.0.2.5001: UDP, length 1470
00:09:27.567465 IP 10.0.0.1.35974 > 10.0.0.2.5001: UDP, length 1470
00:09:27.580320 IP 10.0.0.1.35974 > 10.0.0.2.5001: UDP, length 1470
00:09:27.591658 IP 10.0.0.1.35974 > 10.0.0.2.5001: UDP, length 1470
00:09:27.603769 IP 10.0.0.1.35974 > 10.0.0.2.5001: UDP, length 1470
00:09:27.616617 IP 10.0.0.1.35974 > 10.0.0.2.5001: UDP, length 1470
00:09:27.627965 IP 10.0.0.1.35974 > 10.0.0.2.5001: UDP, length 1470
00:09:27.640079 IP 10.0.0.1.35974 > 10.0.0.2.5001: UDP, length 1470
00:09:27.652164 IP 10.0.0.1.35974 > 10.0.0.2.5001: UDP, length 1470
00:09:27.664257 IP 10.0.0.1.35974 > 10.0.0.2.5001: UDP, length 1470
00:09:27.676326 IP 10.0.0.1.35974 > 10.0.0.2.5001: UDP, length 1470
00:09:27.688435 IP 10.0.0.1.35974 > 10.0.0.2.5001: UDP, length 1470
00:09:27.700496 IP 10.0.0.1.35974 > 10.0.0.2.5001: UDP, length 1470
00:09:27.712640 IP 10.0.0.1.35974 > 10.0.0.2.5001: UDP, length 1470
00:09:27.724727 IP 10.0.0.1.35974 > 10.0.0.2.5001: UDP, length 1470
00:09:27.736822 IP 10.0.0.1.35974 > 10.0.0.2.5001: UDP, length 1470
00:09:27.748924 IP 10.0.0.1.35974 > 10.0.0.2.5001: UDP, length 1470
00:09:27.761012 IP 10.0.0.1.35974 > 10.0.0.2.5001: UDP, length 1470
00:09:27.773918 IP 10.0.0.1.35974 > 10.0.0.2.5001: UDP, length 1470
00:09:27.785196 IP 10.0.0.1.35974 > 10.0.0.2.5001: UDP, length 1470
00:09:27.798147 IP 10.0.0.1.35974 > 10.0.0.2.5001: UDP, length 1470
00:09:27.809364 IP 10.0.0.1.35974 > 10.0.0.2.5001: UDP, length 1470
00:09:27.821484 IP 10.0.0.1.35974 > 10.0.0.2.5001: UDP, length 1470
00:09:27.834453 IP 10.0.0.1.35974 > 10.0.0.2.5001: UDP, length 1470
00:09:27.845668 IP 10.0.0.1.35974 > 10.0.0.2.5001: UDP, length 1470
00:09:27.857791 IP 10.0.0.1.35974 > 10.0.0.2.5001: UDP, length 1470
00:09:27.869904 IP 10.0.0.1.35974 > 10.0.0.2.5001: UDP, length 1470
00:09:27.882718 IP 10.0.0.1.35974 > 10.0.0.2.5001: UDP, length 1470
00:09:27.894055 IP 10.0.0.1.35974 > 10.0.0.2.5001: UDP, length 1470
00:09:27.906196 IP 10.0.0.1.35974 > 10.0.0.2.5001: UDP, length 1470
00:09:27.918226 IP 10.0.0.1.35974 > 10.0.0.2.5001: UDP, length 1470
00:09:27.931212 IP 10.0.0.1.35974 > 10.0.0.2.5001: UDP, length 1470
00:09:27.942442 IP 10.0.0.1.35974 > 10.0.0.2.5001: UDP, length 1470
00:09:27.966634 IP 10.0.0.1.35974 > 10.0.0.2.5001: UDP, length 1470
00:09:27.978752 IP 10.0.0.1.35974 > 10.0.0.2.5001: UDP, length 1470
00:09:27.990840 IP 10.0.0.1.35974 > 10.0.0.2.5001: UDP, length 1470
00:09:28.002953 IP 10.0.0.1.35974 > 10.0.0.2.5001: UDP, length 1470
00:09:28.015025 IP 10.0.0.1.35974 > 10.0.0.2.5001: UDP, length 1470
00:09:28.027115 IP 10.0.0.1.35974 > 10.0.0.2.5001: UDP, length 1470
00:09:28.039216 IP 10.0.0.1.35974 > 10.0.0.2.5001: UDP, length 1470
00:09:28.051301 IP 10.0.0.1.35974 > 10.0.0.2.5001: UDP, length 1470
00:09:28.063526 IP 10.0.0.1.35974 > 10.0.0.2.5001: UDP, length 1470
00:09:28.075468 IP 10.0.0.1.35974 > 10.0.0.2.5001: UDP, length 1470
00:09:28.087597 IP 10.0.0.1.35974 > 10.0.0.2.5001: UDP, length 1470
00:09:28.100500 IP 10.0.0.1.35974 > 10.0.0.2.5001: UDP, length 1470
00:09:28.111804 IP 10.0.0.1.35974 > 10.0.0.2.5001: UDP, length 1470
00:09:28.123893 IP 10.0.0.1.35974 > 10.0.0.2.5001: UDP, length 1470
00:09:28.135985 IP 10.0.0.1.35974 > 10.0.0.2.5001: UDP, length 1470
00:09:28.148088 IP 10.0.0.1.35974 > 10.0.0.2.5001: UDP, length 1470
00:09:28.160196 IP 10.0.0.1.35974 > 10.0.0.2.5001: UDP, length 1470
00:09:28.172275 IP 10.0.0.1.35974 > 10.0.0.2.5001: UDP, length 1470
00:09:28.184381 IP 10.0.0.1.35974 > 10.0.0.2.5001: UDP, length 1470
00:09:28.196467 IP 10.0.0.1.35974 > 10.0.0.2.5001: UDP, length 1470
00:09:28.208539 IP 10.0.0.1.35974 > 10.0.0.2.5001: UDP, length 1470
00:09:28.220687 IP 10.0.0.1.35974 > 10.0.0.2.5001: UDP, length 1470
00:09:28.233559 IP 10.0.0.1.35974 > 10.0.0.2.5001: UDP, length 1470
00:09:28.244874 IP 10.0.0.1.35974 > 10.0.0.2.5001: UDP, length 1470
00:09:28.256948 IP 10.0.0.1.35974 > 10.0.0.2.5001: UDP, length 1470
00:09:28.269028 IP 10.0.0.1.35974 > 10.0.0.2.5001: UDP, length 1470
00:09:28.281133 IP 10.0.0.1.35974 > 10.0.0.2.5001: UDP, length 1470
00:09:28.294174 IP 10.0.0.1.35974 > 10.0.0.2.5001: UDP, length 1470
00:09:28.305333 IP 10.0.0.1.35974 > 10.0.0.2.5001: UDP, length 1470
00:09:28.317420 IP 10.0.0.1.35974 > 10.0.0.2.5001: UDP, length 1470
00:09:28.330212 IP 10.0.0.1.35974 > 10.0.0.2.5001: UDP, length 1470
00:09:28.341597 IP 10.0.0.1.35974 > 10.0.0.2.5001: UDP, length 1470
00:09:28.353725 IP 10.0.0.1.35974 > 10.0.0.2.5001: UDP, length 1470
00:09:28.365813 IP 10.0.0.1.35974 > 10.0.0.2.5001: UDP, length 1470
00:09:28.378652 IP 10.0.0.1.35974 > 10.0.0.2.5001: UDP, length 1470
00:09:28.389995 IP 10.0.0.1.35974 > 10.0.0.2.5001: UDP, length 1470
00:09:28.402087 IP 10.0.0.1.35974 > 10.0.0.2.5001: UDP, length 1470
00:09:28.414191 IP 10.0.0.1.35974 > 10.0.0.2.5001: UDP, length 1470
00:09:28.426784 IP 10.0.0.1.35974 > 10.0.0.2.5001: UDP, length 1470
00:09:28.438383 IP 10.0.0.1.35974 > 10.0.0.2.5001: UDP, length 1470
00:09:28.450446 IP 10.0.0.1.35974 > 10.0.0.2.5001: UDP, length 1470
00:09:28.462566 IP 10.0.0.1.35974 > 10.0.0.2.5001: UDP, length 1470
00:09:28.474689 IP 10.0.0.1.35974 > 10.0.0.2.5001: UDP, length 1470
00:09:28.486768 IP 10.0.0.1.35974 > 10.0.0.2.5001: UDP, length 1470
00:09:28.498860 IP 10.0.0.1.35974 > 10.0.0.2.5001: UDP, length 1470
00:09:28.510963 IP 10.0.0.1.35974 > 10.0.0.2.5001: UDP, length 1470
00:09:28.523055 IP 10.0.0.1.35974 > 10.0.0.2.5001: UDP, length 1470
00:09:28.535176 IP 10.0.0.1.35974 > 10.0.0.2.5001: UDP, length 1470
00:09:28.547283 IP 10.0.0.1.35974 > 10.0.0.2.5001: UDP, length 1470
00:09:28.559328 IP 10.0.0.1.35974 > 10.0.0.2.5001: UDP, length 1470
00:09:28.572230 IP 10.0.0.1.35974 > 10.0.0.2.5001: UDP, length 1470
00:09:28.583547 IP 10.0.0.1.35974 > 10.0.0.2.5001: UDP, length 1470
00:09:28.595632 IP 10.0.0.1.35974 > 10.0.0.2.5001: UDP, length 1470
00:09:28.607729 IP 10.0.0.1.35974 > 10.0.0.2.5001: UDP, length 1470
00:09:28.619856 IP 10.0.0.1.35974 > 10.0.0.2.5001: UDP, length 1470
00:09:28.631921 IP 10.0.0.1.35974 > 10.0.0.2.5001: UDP, length 1470
00:09:28.644020 IP 10.0.0.1.35974 > 10.0.0.2.5001: UDP, length 1470
00:09:28.656078 IP 10.0.0.1.35974 > 10.0.0.2.5001: UDP, length 1470
00:09:28.668360 IP 10.0.0.1.35974 > 10.0.0.2.5001: UDP, length 1470
00:09:28.681139 IP 10.0.0.1.35974 > 10.0.0.2.5001: UDP, length 1470
00:09:28.692372 IP 10.0.0.1.35974 > 10.0.0.2.5001: UDP, length 1470
00:09:28.704523 IP 10.0.0.1.35974 > 10.0.0.2.5001: UDP, length 1470
00:09:28.716571 IP 10.0.0.1.35974 > 10.0.0.2.5001: UDP, length 1470
00:09:28.728691 IP 10.0.0.1.35974 > 10.0.0.2.5001: UDP, length 1470
00:09:28.740757 IP 10.0.0.1.35974 > 10.0.0.2.5001: UDP, length 1470
00:09:28.753642 IP 10.0.0.1.35974 > 10.0.0.2.5001: UDP, length 1470
00:09:28.764979 IP 10.0.0.1.35974 > 10.0.0.2.5001: UDP, length 1470
00:09:28.777106 IP 10.0.0.1.35974 > 10.0.0.2.5001: UDP, length 1470
00:09:28.789651 IP 10.0.0.1.35974 > 10.0.0.2.5001: UDP, length 1470
00:09:28.801251 IP 10.0.0.1.35974 > 10.0.0.2.5001: UDP, length 1470
00:09:28.813375 IP 10.0.0.1.35974 > 10.0.0.2.5001: UDP, length 1470
00:09:28.826305 IP 10.0.0.1.35974 > 10.0.0.2.5001: UDP, length 1470
00:09:28.837549 IP 10.0.0.1.35974 > 10.0.0.2.5001: UDP, length 1470
00:09:28.849609 IP 10.0.0.1.35974 > 10.0.0.2.5001: UDP, length 1470
00:09:28.861784 IP 10.0.0.1.35974 > 10.0.0.2.5001: UDP, length 1470
00:09:28.873829 IP 10.0.0.1.35974 > 10.0.0.2.5001: UDP, length 1470
00:09:28.886677 IP 10.0.0.1.35974 > 10.0.0.2.5001: UDP, length 1470
00:09:28.898012 IP 10.0.0.1.35974 > 10.0.0.2.5001: UDP, length 1470
00:09:28.910110 IP 10.0.0.1.35974 > 10.0.0.2.5001: UDP, length 1470
00:09:28.922211 IP 10.0.0.1.35974 > 10.0.0.2.5001: UDP, length 1470
00:09:28.934317 IP 10.0.0.1.35974 > 10.0.0.2.5001: UDP, length 1470
00:09:28.946415 IP 10.0.0.1.35974 > 10.0.0.2.5001: UDP, length 1470
00:09:28.958513 IP 10.0.0.1.35974 > 10.0.0.2.5001: UDP, length 1470
00:09:28.970631 IP 10.0.0.1.35974 > 10.0.0.2.5001: UDP, length 1470
00:09:28.982737 IP 10.0.0.1.35974 > 10.0.0.2.5001: UDP, length 1470
00:09:28.995610 IP 10.0.0.1.35974 > 10.0.0.2.5001: UDP, length 1470
00:09:29.006907 IP 10.0.0.1.35974 > 10.0.0.2.5001: UDP, length 1470
00:09:29.018979 IP 10.0.0.1.35974 > 10.0.0.2.5001: UDP, length 1470
00:09:29.031057 IP 10.0.0.1.35974 > 10.0.0.2.5001: UDP, length 1470
00:09:29.043178 IP 10.0.0.1.35974 > 10.0.0.2.5001: UDP, length 1470
00:09:29.067372 IP 10.0.0.1.35974 > 10.0.0.2.5001: UDP, length 1470
00:09:29.079461 IP 10.0.0.1.35974 > 10.0.0.2.5001: UDP, length 1470
00:09:29.091567 IP 10.0.0.1.35974 > 10.0.0.2.5001: UDP, length 1470
00:09:29.104475 IP 10.0.0.1.35974 > 10.0.0.2.5001: UDP, length 1470
00:09:29.115980 IP 10.0.0.1.35974 > 10.0.0.2.5001: UDP, length 1470
00:09:29.127862 IP 10.0.0.1.35974 > 10.0.0.2.5001: UDP, length 1470
00:09:29.140757 IP 10.0.0.1.35974 > 10.0.0.2.5001: UDP, length 1470
00:09:29.152053 IP 10.0.0.1.35974 > 10.0.0.2.5001: UDP, length 1470
00:09:29.164144 IP 10.0.0.1.35974 > 10.0.0.2.5001: UDP, length 1470
00:09:29.176856 IP 10.0.0.1.35974 > 10.0.0.2.5001: UDP, length 1470
00:09:29.188344 IP 10.0.0.1.35974 > 10.0.0.2.5001: UDP, length 1470
00:09:29.200402 IP 10.0.0.1.35974 > 10.0.0.2.5001: UDP, length 1470
00:09:29.213239 IP 10.0.0.1.35974 > 10.0.0.2.5001: UDP, length 1470
00:09:29.224608 IP 10.0.0.1.35974 > 10.0.0.2.5001: UDP, length 1470
00:09:29.236736 IP 10.0.0.1.35974 > 10.0.0.2.5001: UDP, length 1470
00:09:29.248818 IP 10.0.0.1.35974 > 10.0.0.2.5001: UDP, length 1470
00:09:29.260915 IP 10.0.0.1.35974 > 10.0.0.2.5001: UDP, length 1470
00:09:29.273735 IP 10.0.0.1.35974 > 10.0.0.2.5001: UDP, length 1470
00:09:29.285101 IP 10.0.0.1.35974 > 10.0.0.2.5001: UDP, length 1470
00:09:29.297239 IP 10.0.0.1.35974 > 10.0.0.2.5001: UDP, length 1470
00:09:29.309293 IP 10.0.0.1.35974 > 10.0.0.2.5001: UDP, length 1470
00:09:29.321379 IP 10.0.0.1.35974 > 10.0.0.2.5001: UDP, length 1470
00:09:29.333472 IP 10.0.0.1.35974 > 10.0.0.2.5001: UDP, length 1470
00:09:29.346343 IP 10.0.0.1.35974 > 10.0.0.2.5001: UDP, length 1470
00:09:29.357694 IP 10.0.0.1.35974 > 10.0.0.2.5001: UDP, length 1470
00:09:29.369794 IP 10.0.0.1.35974 > 10.0.0.2.5001: UDP, length 1470
00:09:29.381874 IP 10.0.0.1.35974 > 10.0.0.2.5001: UDP, length 1470
00:09:29.393928 IP 10.0.0.1.35974 > 10.0.0.2.5001: UDP, length 1470
00:09:29.406852 IP 10.0.0.1.35974 > 10.0.0.2.5001: UDP, length 1470
00:09:29.418124 IP 10.0.0.1.35974 > 10.0.0.2.5001: UDP, length 1470
00:09:29.430286 IP 10.0.0.1.35974 > 10.0.0.2.5001: UDP, length 1470
00:09:29.442395 IP 10.0.0.1.35974 > 10.0.0.2.5001: UDP, length 1470
00:09:29.454439 IP 10.0.0.1.35974 > 10.0.0.2.5001: UDP, length 1470
00:09:29.466522 IP 10.0.0.1.35974 > 10.0.0.2.5001: UDP, length 1470
00:09:29.479383 IP 10.0.0.1.35974 > 10.0.0.2.5001: UDP, length 1470
00:09:29.490734 IP 10.0.0.1.35974 > 10.0.0.2.5001: UDP, length 1470
00:09:29.502848 IP 10.0.0.1.35974 > 10.0.0.2.5001: UDP, length 1470
00:09:29.514936 IP 10.0.0.1.35974 > 10.0.0.2.5001: UDP, length 1470
00:09:29.527038 IP 10.0.0.1.35974 > 10.0.0.2.5001: UDP, length 1470
00:09:29.539147 IP 10.0.0.1.35974 > 10.0.0.2.5001: UDP, length 1470
00:09:29.551937 IP 10.0.0.1.35974 > 10.0.0.2.5001: UDP, length 1470
00:09:29.575372 IP 10.0.0.1.35974 > 10.0.0.2.5001: UDP, length 1470
00:09:29.587514 IP 10.0.0.1.35974 > 10.0.0.2.5001: UDP, length 1470
00:09:29.599779 IP 10.0.0.1.35974 > 10.0.0.2.5001: UDP, length 1470
00:09:29.611718 IP 10.0.0.1.35974 > 10.0.0.2.5001: UDP, length 1470
00:09:29.623838 IP 10.0.0.1.35974 > 10.0.0.2.5001: UDP, length 1470
00:09:29.636722 IP 10.0.0.1.35974 > 10.0.0.2.5001: UDP, length 1470
00:09:29.647981 IP 10.0.0.1.35974 > 10.0.0.2.5001: UDP, length 1470
00:09:29.660090 IP 10.0.0.1.35974 > 10.0.0.2.5001: UDP, length 1470
00:09:29.673059 IP 10.0.0.1.35974 > 10.0.0.2.5001: UDP, length 1470
00:09:29.684261 IP 10.0.0.1.35974 > 10.0.0.2.5001: UDP, length 1470
00:09:29.696347 IP 10.0.0.1.35974 > 10.0.0.2.5001: UDP, length 1470
00:09:29.708471 IP 10.0.0.1.35974 > 10.0.0.2.5001: UDP, length 1470
00:09:29.721368 IP 10.0.0.1.35974 > 10.0.0.2.5001: UDP, length 1470
00:09:29.732662 IP 10.0.0.1.35974 > 10.0.0.2.5001: UDP, length 1470
00:09:29.744748 IP 10.0.0.1.35974 > 10.0.0.2.5001: UDP, length 1470
00:09:29.757685 IP 10.0.0.1.35974 > 10.0.0.2.5001: UDP, length 1470
00:09:29.768952 IP 10.0.0.1.35974 > 10.0.0.2.5001: UDP, length 1470
00:09:29.781022 IP 10.0.0.1.35974 > 10.0.0.2.5001: UDP, length 1470
00:09:29.793940 IP 10.0.0.1.35974 > 10.0.0.2.5001: UDP, length 1470
00:09:29.805239 IP 10.0.0.1.35974 > 10.0.0.2.5001: UDP, length 1470
00:09:29.817340 IP 10.0.0.1.35974 > 10.0.0.2.5001: UDP, length 1470
00:09:29.829438 IP 10.0.0.1.35974 > 10.0.0.2.5001: UDP, length 1470
00:09:29.841532 IP 10.0.0.1.35974 > 10.0.0.2.5001: UDP, length 1470
00:09:29.853602 IP 10.0.0.1.35974 > 10.0.0.2.5001: UDP, length 1470
00:09:29.865678 IP 10.0.0.1.35974 > 10.0.0.2.5001: UDP, length 1470
00:09:29.877836 IP 10.0.0.1.35974 > 10.0.0.2.5001: UDP, length 1470
00:09:29.889902 IP 10.0.0.1.35974 > 10.0.0.2.5001: UDP, length 1470
00:09:29.902024 IP 10.0.0.1.35974 > 10.0.0.2.5001: UDP, length 1470
00:09:29.914105 IP 10.0.0.1.35974 > 10.0.0.2.5001: UDP, length 1470

