00:08:44.782681 IP 10.0.0.1.53967 > 10.0.0.2.5001: UDP, length 1470
00:08:44.782913 IP 10.0.0.1.53967 > 10.0.0.2.5001: UDP, length 1470
00:08:44.794000 IP 10.0.0.1.53967 > 10.0.0.2.5001: UDP, length 1470
00:08:44.809972 IP 10.0.0.1.53967 > 10.0.0.2.5001: UDP, length 1470
00:08:44.820646 IP 10.0.0.1.53967 > 10.0.0.2.5001: UDP, length 1470
00:08:44.830354 IP 10.0.0.1.53967 > 10.0.0.2.5001: UDP, length 1470
00:08:44.842425 IP 10.0.0.1.53967 > 10.0.0.2.5001: UDP, length 1470
00:08:44.854513 IP 10.0.0.1.53967 > 10.0.0.2.5001: UDP, length 1470
00:08:44.866617 IP 10.0.0.1.53967 > 10.0.0.2.5001: UDP, length 1470
00:08:44.878708 IP 10.0.0.1.53967 > 10.0.0.2.5001: UDP, length 1470
00:08:44.890801 IP 10.0.0.1.53967 > 10.0.0.2.5001: UDP, length 1470
00:08:44.902903 IP 10.0.0.1.53967 > 10.0.0.2.5001: UDP, length 1470
00:08:44.915014 IP 10.0.0.1.53967 > 10.0.0.2.5001: UDP, length 1470
00:08:44.927094 IP 10.0.0.1.53967 > 10.0.0.2.5001: UDP, length 1470
00:08:44.939181 IP 10.0.0.1.53967 > 10.0.0.2.5001: UDP, length 1470
00:08:44.952095 IP 10.0.0.1.53967 > 10.0.0.2.5001: UDP, length 1470
00:08:44.963377 IP 10.0.0.1.53967 > 10.0.0.2.5001: UDP, length 1470
00:08:44.975469 IP 10.0.0.1.53967 > 10.0.0.2.5001: UDP, length 1470
00:08:44.987557 IP 10.0.0.1.53967 > 10.0.0.2.5001: UDP, length 1470
00:08:44.999668 IP 10.0.0.1.53967 > 10.0.0.2.5001: UDP, length 1470
00:08:45.011761 IP 10.0.0.1.53967 > 10.0.0.2.5001: UDP, length 1470
00:08:45.023858 IP 10.0.0.1.53967 > 10.0.0.2.5001: UDP, length 1470
00:08:45.035963 IP 10.0.0.1.53967 > 10.0.0.2.5001: UDP, length 1470
00:08:45.048060 IP 10.0.0.1.53967 > 10.0.0.2.5001: UDP, length 1470
00:08:45.060148 IP 10.0.0.1.53967 > 10.0.0.2.5001: UDP, length 1470
00:08:45.072244 IP 10.0.0.1.53967 > 10.0.0.2.5001: UDP, length 1470
00:08:45.084336 IP 10.0.0.1.53967 > 10.0.0.2.5001: UDP, length 1470
00:08:45.096428 IP 10.0.0.1.53967 > 10.0.0.2.5001: UDP, length 1470
00:08:45.108552 IP 10.0.0.1.53967 > 10.0.0.2.5001: UDP, length 1470
00:08:45.120622 IP 10.0.0.1.53967 > 10.0.0.2.5001: UDP, length 1470
00:08:45.132721 IP 10.0.0.1.53967 > 10.0.0.2.5001: UDP, length 1470
00:08:45.144830 IP 10.0.0.1.53967 > 10.0.0.2.5001: UDP, length 1470
00:08:45.156913 IP 10.0.0.1.53967 > 10.0.0.2.5001: UDP, length 1470
00:08:45.169033 IP 10.0.0.1.53967 > 10.0.0.2.5001: UDP, length 1470
00:08:45.181097 IP 10.0.0.1.53967 > 10.0.0.2.5001: UDP, length 1470
00:08:45.193659 IP 10.0.0.1.53967 > 10.0.0.2.5001: UDP, length 1470
00:08:45.205301 IP 10.0.0.1.53967 > 10.0.0.2.5001: UDP, length 1470
00:08:45.217393 IP 10.0.0.1.53967 > 10.0.0.2.5001: UDP, length 1470
00:08:45.229637 IP 10.0.0.1.53967 > 10.0.0.2.5001: UDP, length 1470
00:08:45.241600 IP 10.0.0.1.53967 > 10.0.0.2.5001: UDP, length 1470
00:08:45.253679 IP 10.0.0.1.53967 > 10.0.0.2.5001: UDP, length 1470
00:08:45.265782 IP 10.0.0.1.53967 > 10.0.0.2.5001: UDP, length 1470
00:08:45.277878 IP 10.0.0.1.53967 > 10.0.0.2.5001: UDP, length 1470
00:08:45.289992 IP 10.0.0.1.53967 > 10.0.0.2.5001: UDP, length 1470
00:08:45.302082 IP 10.0.0.1.53967 > 10.0.0.2.5001: UDP, length 1470
00:08:45.314171 IP 10.0.0.1.53967 > 10.0.0.2.5001: UDP, length 1470
00:08:45.326279 IP 10.0.0.1.53967 > 10.0.0.2.5001: UDP, length 1470
00:08:45.338354 IP 10.0.0.1.53967 > 10.0.0.2.5001: UDP, length 1470
00:08:45.350446 IP 10.0.0.1.53967 > 10.0.0.2.5001: UDP, length 1470
00:08:45.362544 IP 10.0.0.1.53967 > 10.0.0.2.5001: UDP, length 1470
00:08:45.374643 IP 10.0.0.1.53967 > 10.0.0.2.5001: UDP, length 1470
00:08:45.386755 IP 10.0.0.1.53967 > 10.0.0.2.5001: UDP, length 1470
00:08:45.399599 IP 10.0.0.1.53967 > 10.0.0.2.5001: UDP, length 1470
00:08:45.410929 IP 10.0.0.1.53967 > 10.0.0.2.5001: UDP, length 1470
00:08:45.423025 IP 10.0.0.1.53967 > 10.0.0.2.5001: UDP, length 1470
00:08:45.435126 IP 10.0.0.1.53967 > 10.0.0.2.5001: UDP, length 1470
00:08:45.447236 IP 10.0.0.1.53967 > 10.0.0.2.5001: UDP, length 1470
00:08:45.459310 IP 10.0.0.1.53967 > 10.0.0.2.5001: UDP, length 1470
00:08:45.472143 IP 10.0.0.1.53967 > 10.0.0.2.5001: UDP, length 1470
00:08:45.483504 IP 10.0.0.1.53967 > 10.0.0.2.5001: UDP, length 1470
00:08:45.501265 IP 10.0.0.1.53967 > 10.0.0.2.5001: UDP, length 1470
00:08:45.512647 IP 10.0.0.1.53967 > 10.0.0.2.5001: UDP, length 1470
00:08:45.524736 IP 10.0.0.1.53967 > 10.0.0.2.5001: UDP, length 1470
00:08:45.548938 IP 10.0.0.1.53967 > 10.0.0.2.5001: UDP, length 1470
00:08:45.561786 IP 10.0.0.1.53967 > 10.0.0.2.5001: UDP, length 1470
00:08:45.573124 IP 10.0.0.1.53967 > 10.0.0.2.5001: UDP, length 1470
00:08:45.585226 IP 10.0.0.1.53967 > 10.0.0.2.5001: UDP, length 1470
00:08:45.597313 IP 10.0.0.1.53967 > 10.0.0.2.5001: UDP, length 1470
00:08:45.609401 IP 10.0.0.1.53967 > 10.0.0.2.5001: UDP, length 1470
00:08:45.621528 IP 10.0.0.1.53967 > 10.0.0.2.5001: UDP, length 1470
00:08:45.633609 IP 10.0.0.1.53967 > 10.0.0.2.5001: UDP, length 1470
00:08:45.645720 IP 10.0.0.1.53967 > 10.0.0.2.5001: UDP, length 1470
00:08:45.657802 IP 10.0.0.1.53967 > 10.0.0.2.5001: UDP, length 1470
00:08:45.670630 IP 10.0.0.1.53967 > 10.0.0.2.5001: UDP, length 1470
00:08:45.682026 IP 10.0.0.1.53967 > 10.0.0.2.5001: UDP, length 1470
00:08:45.694070 IP 10.0.0.1.53967 > 10.0.0.2.5001: UDP, length 1470
00:08:45.706189 IP 10.0.0.1.53967 > 10.0.0.2.5001: UDP, length 1470
00:08:45.718240 IP 10.0.0.1.53967 > 10.0.0.2.5001: UDP, length 1470
00:08:45.730345 IP 10.0.0.1.53967 > 10.0.0.2.5001: UDP, length 1470
00:08:45.742465 IP 10.0.0.1.53967 > 10.0.0.2.5001: UDP, length 1470
00:08:45.754584 IP 10.0.0.1.53967 > 10.0.0.2.5001: UDP, length 1470
00:08:45.767520 IP 10.0.0.1.53967 > 10.0.0.2.5001: UDP, length 1470
00:08:45.778931 IP 10.0.0.1.53967 > 10.0.0.2.5001: UDP, length 1470
00:08:45.790816 IP 10.0.0.1.53967 > 10.0.0.2.5001: UDP, length 1470
00:08:45.803748 IP 10.0.0.1.53967 > 10.0.0.2.5001: UDP, length 1470
00:08:45.815019 IP 10.0.0.1.53967 > 10.0.0.2.5001: UDP, length 1470
00:08:45.827910 IP 10.0.0.1.53967 > 10.0.0.2.5001: UDP, length 1470
00:08:45.839241 IP 10.0.0.1.53967 > 10.0.0.2.5001: UDP, length 1470
00:08:45.851312 IP 10.0.0.1.53967 > 10.0.0.2.5001: UDP, length 1470
00:08:45.863743 IP 10.0.0.1.53967 > 10.0.0.2.5001: UDP, length 1470
00:08:45.875503 IP 10.0.0.1.53967 > 10.0.0.2.5001: UDP, length 1470
00:08:45.887621 IP 10.0.0.1.53967 > 10.0.0.2.5001: UDP, length 1470
00:08:45.900396 IP 10.0.0.1.53967 > 10.0.0.2.5001: UDP, length 1470
00:08:45.911809 IP 10.0.0.1.53967 > 10.0.0.2.5001: UDP, length 1470
00:08:45.924626 IP 10.0.0.1.53967 > 10.0.0.2.5001: UDP, length 1470
00:08:45.936035 IP 10.0.0.1.53967 > 10.0.0.2.5001: UDP, length 1470
00:08:45.948066 IP 10.0.0.1.53967 > 10.0.0.2.5001: UDP, length 1470
00:08:45.960956 IP 10.0.0.1.53967 > 10.0.0.2.5001: UDP, length 1470
00:08:45.972286 IP 10.0.0.1.53967 > 10.0.0.2.5001: UDP, length 1470
00:08:45.985021 IP 10.0.0.1.53967 > 10.0.0.2.5001: UDP, length 1470
00:08:45.996507 IP 10.0.0.1.53967 > 10.0.0.2.5001: UDP, length 1470
00:08:46.009345 IP 10.0.0.1.53967 > 10.0.0.2.5001: UDP, length 1470
00:08:46.020697 IP 10.0.0.1.53967 > 10.0.0.2.5001: UDP, length 1470
00:08:46.032774 IP 10.0.0.1.53967 > 10.0.0.2.5001: UDP, length 1470
00:08:46.044840 IP 10.0.0.1.53967 > 10.0.0.2.5001: UDP, length 1470
00:08:46.056995 IP 10.0.0.1.53967 > 10.0.0.2.5001: UDP, length 1470
00:08:46.069018 IP 10.0.0.1.53967 > 10.0.0.2.5001: UDP, length 1470
00:08:46.081183 IP 10.0.0.1.53967 > 10.0.0.2.5001: UDP, length 1470
00:08:46.093219 IP 10.0.0.1.53967 > 10.0.0.2.5001: UDP, length 1470
00:08:46.105348 IP 10.0.0.1.53967 > 10.0.0.2.5001: UDP, length 1470
00:08:46.117438 IP 10.0.0.1.53967 > 10.0.0.2.5001: UDP, length 1470
00:08:46.129543 IP 10.0.0.1.53967 > 10.0.0.2.5001: UDP, length 1470
00:08:46.153677 IP 10.0.0.1.53967 > 10.0.0.2.5001: UDP, length 1470
00:08:46.165948 IP 10.0.0.1.53967 > 10.0.0.2.5001: UDP, length 1470
00:08:46.177939 IP 10.0.0.1.53967 > 10.0.0.2.5001: UDP, length 1470
00:08:46.190018 IP 10.0.0.1.53967 > 10.0.0.2.5001: UDP, length 1470
00:08:46.202998 IP 10.0.0.1.53967 > 10.0.0.2.5001: UDP, length 1470
00:08:46.214223 IP 10.0.0.1.53967 > 10.0.0.2.5001: UDP, length 1470
00:08:46.226292 IP 10.0.0.1.53967 > 10.0.0.2.5001: UDP, length 1470
00:08:46.238373 IP 10.0.0.1.53967 > 10.0.0.2.5001: UDP, length 1470
00:08:46.250467 IP 10.0.0.1.53967 > 10.0.0.2.5001: UDP, length 1470
00:08:46.262576 IP 10.0.0.1.53967 > 10.0.0.2.5001: UDP, length 1470
00:08:46.274714 IP 10.0.0.1.53967 > 10.0.0.2.5001: UDP, length 1470
00:08:46.286765 IP 10.0.0.1.53967 > 10.0.0.2.5001: UDP, length 1470
00:08:46.299679 IP 10.0.0.1.53967 > 10.0.0.2.5001: UDP, length 1470
00:08:46.310994 IP 10.0.0.1.53967 > 10.0.0.2.5001: UDP, length 1470
00:08:46.323072 IP 10.0.0.1.53967 > 10.0.0.2.5001: UDP, length 1470
00:08:46.335192 IP 10.0.0.1.53967 > 10.0.0.2.5001: UDP, length 1470
00:08:46.347279 IP 10.0.0.1.53967 > 10.0.0.2.5001: UDP, length 1470
00:08:46.360095 IP 10.0.0.1.53967 > 10.0.0.2.5001: UDP, length 1470
00:08:46.371468 IP 10.0.0.1.53967 > 10.0.0.2.5001: UDP, length 1470
00:08:46.383593 IP 10.0.0.1.53967 > 10.0.0.2.5001: UDP, length 1470
00:08:46.395659 IP 10.0.0.1.53967 > 10.0.0.2.5001: UDP, length 1470
00:08:46.407764 IP 10.0.0.1.53967 > 10.0.0.2.5001: UDP, length 1470
00:08:46.419841 IP 10.0.0.1.53967 > 10.0.0.2.5001: UDP, length 1470
00:08:46.431916 IP 10.0.0.1.53967 > 10.0.0.2.5001: UDP, length 1470
00:08:46.444024 IP 10.0.0.1.53967 > 10.0.0.2.5001: UDP, length 1470
00:08:46.456136 IP 10.0.0.1.53967 > 10.0.0.2.5001: UDP, length 1470
00:08:46.468187 IP 10.0.0.1.53967 > 10.0.0.2.5001: UDP, length 1470
00:08:46.480336 IP 10.0.0.1.53967 > 10.0.0.2.5001: UDP, length 1470
00:08:46.492425 IP 10.0.0.1.53967 > 10.0.0.2.5001: UDP, length 1470
00:08:46.504522 IP 10.0.0.1.53967 > 10.0.0.2.5001: UDP, length 1470
00:08:46.528682 IP 10.0.0.1.53967 > 10.0.0.2.5001: UDP, length 1470
00:08:46.540837 IP 10.0.0.1.53967 > 10.0.0.2.5001: UDP, length 1470
00:08:46.553699 IP 10.0.0.1.53967 > 10.0.0.2.5001: UDP, length 1470
00:08:46.564968 IP 10.0.0.1.53967 > 10.0.0.2.5001: UDP, length 1470
00:08:46.577118 IP 10.0.0.1.53967 > 10.0.0.2.5001: UDP, length 1470
00:08:46.589154 IP 10.0.0.1.53967 > 10.0.0.2.5001: UDP, length 1470
00:08:46.601276 IP 10.0.0.1.53967 > 10.0.0.2.5001: UDP, length 1470
00:08:46.613389 IP 10.0.0.1.53967 > 10.0.0.2.5001: UDP, length 1470
00:08:46.626191 IP 10.0.0.1.53967 > 10.0.0.2.5001: UDP, length 1470
00:08:46.649645 IP 10.0.0.1.53967 > 10.0.0.2.5001: UDP, length 1470
00:08:46.662586 IP 10.0.0.1.53967 > 10.0.0.2.5001: UDP, length 1470
00:08:46.673847 IP 10.0.0.1.53967 > 10.0.0.2.5001: UDP, length 1470
00:08:46.686167 IP 10.0.0.1.53967 > 10.0.0.2.5001: UDP, length 1470
00:08:46.698851 IP 10.0.0.1.53967 > 10.0.0.2.5001: UDP, length 1470
00:08:46.710110 IP 10.0.0.1.53967 > 10.0.0.2.5001: UDP, length 1470
00:08:46.722238 IP 10.0.0.1.53967 > 10.0.0.2.5001: UDP, length 1470
00:08:46.735096 IP 10.0.0.1.53967 > 10.0.0.2.5001: UDP, length 1470
00:08:46.746423 IP 10.0.0.1.53967 > 10.0.0.2.5001: UDP, length 1470
00:08:46.758529 IP 10.0.0.1.53967 > 10.0.0.2.5001: UDP, length 1470
00:08:46.770620 IP 10.0.0.1.53967 > 10.0.0.2.5001: UDP, length 1470
00:08:46.782685 IP 10.0.0.1.53967 > 10.0.0.2.5001: UDP, length 1470
00:08:46.794823 IP 10.0.0.1.53967 > 10.0.0.2.5001: UDP, length 1470
00:08:46.806877 IP 10.0.0.1.53967 > 10.0.0.2.5001: UDP, length 1470
00:08:46.819018 IP 10.0.0.1.53967 > 10.0.0.2.5001: UDP, length 1470
00:08:46.831855 IP 10.0.0.1.53967 > 10.0.0.2.5001: UDP, length 1470
00:08:46.843183 IP 10.0.0.1.53967 > 10.0.0.2.5001: UDP, length 1470
00:08:46.855545 IP 10.0.0.1.53967 > 10.0.0.2.5001: UDP, length 1470
00:08:46.867402 IP 10.0.0.1.53967 > 10.0.0.2.5001: UDP, length 1470
00:08:46.879537 IP 10.0.0.1.53967 > 10.0.0.2.5001: UDP, length 1470
00:08:46.891551 IP 10.0.0.1.53967 > 10.0.0.2.5001: UDP, length 1470
00:08:46.903677 IP 10.0.0.1.53967 > 10.0.0.2.5001: UDP, length 1470
00:08:46.915798 IP 10.0.0.1.53967 > 10.0.0.2.5001: UDP, length 1470
00:08:46.927886 IP 10.0.0.1.53967 > 10.0.0.2.5001: UDP, length 1470
00:08:46.939975 IP 10.0.0.1.53967 > 10.0.0.2.5001: UDP, length 1470
00:08:46.952087 IP 10.0.0.1.53967 > 10.0.0.2.5001: UDP, length 1470
00:08:46.964166 IP 10.0.0.1.53967 > 10.0.0.2.5001: UDP, length 1470
00:08:46.976272 IP 10.0.0.1.53967 > 10.0.0.2.5001: UDP, length 1470
00:08:46.988378 IP 10.0.0.1.53967 > 10.0.0.2.5001: UDP, length 1470
00:08:47.000423 IP 10.0.0.1.53967 > 10.0.0.2.5001: UDP, length 1470
00:08:47.013305 IP 10.0.0.1.53967 > 10.0.0.2.5001: UDP, length 1470
00:08:47.024648 IP 10.0.0.1.53967 > 10.0.0.2.5001: UDP, length 1470
00:08:47.036741 IP 10.0.0.1.53967 > 10.0.0.2.5001: UDP, length 1470
00:08:47.048849 IP 10.0.0.1.53967 > 10.0.0.2.5001: UDP, length 1470
00:08:47.060941 IP 10.0.0.1.53967 > 10.0.0.2.5001: UDP, length 1470
00:08:47.073033 IP 10.0.0.1.53967 > 10.0.0.2.5001: UDP, length 1470
00:08:47.085087 IP 10.0.0.1.53967 > 10.0.0.2.5001: UDP, length 1470
00:08:47.098044 IP 10.0.0.1.53967 > 10.0.0.2.5001: UDP, length 1470
00:08:47.109302 IP 10.0.0.1.53967 > 10.0.0.2.5001: UDP, length 1470
00:08:47.121413 IP 10.0.0.1.53967 > 10.0.0.2.5001: UDP, length 1470
00:08:47.134024 IP 10.0.0.1.53967 > 10.0.0.2.5001: UDP, length 1470
00:08:47.146375 IP 10.0.0.1.53967 > 10.0.0.2.5001: UDP, length 1470
00:08:47.157682 IP 10.0.0.1.53967 > 10.0.0.2.5001: UDP, length 1470
00:08:47.169817 IP 10.0.0.1.53967 > 10.0.0.2.5001: UDP, length 1470
00:08:47.193942 IP 10.0.0.1.53967 > 10.0.0.2.5001: UDP, length 1470
00:08:47.206079 IP 10.0.0.1.53967 > 10.0.0.2.5001: UDP, length 1470
00:08:47.218813 IP 10.0.0.1.53967 > 10.0.0.2.5001: UDP, length 1470
00:08:47.230326 IP 10.0.0.1.53967 > 10.0.0.2.5001: UDP, length 1470
00:08:47.242377 IP 10.0.0.1.53967 > 10.0.0.2.5001: UDP, length 1470
00:08:47.254468 IP 10.0.0.1.53967 > 10.0.0.2.5001: UDP, length 1470
00:08:47.266574 IP 10.0.0.1.53967 > 10.0.0.2.5001: UDP, length 1470
00:08:47.278642 IP 10.0.0.1.53967 > 10.0.0.2.5001: UDP, length 1470
00:08:47.290760 IP 10.0.0.1.53967 > 10.0.0.2.5001: UDP, length 1470
00:08:47.302878 IP 10.0.0.1.53967 > 10.0.0.2.5001: UDP, length 1470
00:08:47.315735 IP 10.0.0.1.53967 > 10.0.0.2.5001: UDP, length 1470
00:08:47.327018 IP 10.0.0.1.53967 > 10.0.0.2.5001: UDP, length 1470
00:08:47.339100 IP 10.0.0.1.53967 > 10.0.0.2.5001: UDP, length 1470
00:08:47.351187 IP 10.0.0.1.53967 > 10.0.0.2.5001: UDP, length 1470
00:08:47.363330 IP 10.0.0.1.53967 > 10.0.0.2.5001: UDP, length 1470
00:08:47.375610 IP 10.0.0.1.53967 > 10.0.0.2.5001: UDP, length 1470
00:08:47.387555 IP 10.0.0.1.53967 > 10.0.0.2.5001: UDP, length 1470
00:08:47.399629 IP 10.0.0.1.53967 > 10.0.0.2.5001: UDP, length 1470
00:08:47.411726 IP 10.0.0.1.53967 > 10.0.0.2.5001: UDP, length 1470
00:08:47.423823 IP 10.0.0.1.53967 > 10.0.0.2.5001: UDP, length 1470
00:08:47.435908 IP 10.0.0.1.53967 > 10.0.0.2.5001: UDP, length 1470
00:08:47.448008 IP 10.0.0.1.53967 > 10.0.0.2.5001: UDP, length 1470
00:08:47.460103 IP 10.0.0.1.53967 > 10.0.0.2.5001: UDP, length 1470
00:08:47.472178 IP 10.0.0.1.53967 > 10.0.0.2.5001: UDP, length 1470
00:08:47.484317 IP 10.0.0.1.53967 > 10.0.0.2.5001: UDP, length 1470
00:08:47.496393 IP 10.0.0.1.53967 > 10.0.0.2.5001: UDP, length 1470
00:08:47.509210 IP 10.0.0.1.53967 > 10.0.0.2.5001: UDP, length 1470
00:08:47.520615 IP 10.0.0.1.53967 > 10.0.0.2.5001: UDP, length 1470
00:08:47.532649 IP 10.0.0.1.53967 > 10.0.0.2.5001: UDP, length 1470
00:08:47.544775 IP 10.0.0.1.53967 > 10.0.0.2.5001: UDP, length 1470
00:08:47.556855 IP 10.0.0.1.53967 > 10.0.0.2.5001: UDP, length 1470
00:08:47.569701 IP 10.0.0.1.53967 > 10.0.0.2.5001: UDP, length 1470
00:08:47.581036 IP 10.0.0.1.53967 > 10.0.0.2.5001: UDP, length 1470
00:08:47.593133 IP 10.0.0.1.53967 > 10.0.0.2.5001: UDP, length 1470
00:08:47.605228 IP 10.0.0.1.53967 > 10.0.0.2.5001: UDP, length 1470
00:08:47.617355 IP 10.0.0.1.53967 > 10.0.0.2.5001: UDP, length 1470
00:08:47.630199 IP 10.0.0.1.53967 > 10.0.0.2.5001: UDP, length 1470
00:08:47.641528 IP 10.0.0.1.53967 > 10.0.0.2.5001: UDP, length 1470
00:08:47.653732 IP 10.0.0.1.53967 > 10.0.0.2.5001: UDP, length 1470
00:08:47.665699 IP 10.0.0.1.53967 > 10.0.0.2.5001: UDP, length 1470
00:08:47.677851 IP 10.0.0.1.53967 > 10.0.0.2.5001: UDP, length 1470
00:08:47.689937 IP 10.0.0.1.53967 > 10.0.0.2.5001: UDP, length 1470
00:08:47.702835 IP 10.0.0.1.53967 > 10.0.0.2.5001: UDP, length 1470
00:08:47.714096 IP 10.0.0.1.53967 > 10.0.0.2.5001: UDP, length 1470
00:08:47.726174 IP 10.0.0.1.53967 > 10.0.0.2.5001: UDP, length 1470
00:08:47.738318 IP 10.0.0.1.53967 > 10.0.0.2.5001: UDP, length 1470
00:08:47.750372 IP 10.0.0.1.53967 > 10.0.0.2.5001: UDP, length 1470
00:08:47.762506 IP 10.0.0.1.53967 > 10.0.0.2.5001: UDP, length 1470
00:08:47.774690 IP 10.0.0.1.53967 > 10.0.0.2.5001: UDP, length 1470
00:08:47.786687 IP 10.0.0.1.53967 > 10.0.0.2.5001: UDP, length 1470
00:08:47.798777 IP 10.0.0.1.53967 > 10.0.0.2.5001: UDP, length 1470
00:08:47.810876 IP 10.0.0.1.53967 > 10.0.0.2.5001: UDP, length 1470
00:08:47.835085 IP 10.0.0.1.53967 > 10.0.0.2.5001: UDP, length 1470
00:08:47.847168 IP 10.0.0.1.53967 > 10.0.0.2.5001: UDP, length 1470
00:08:47.859259 IP 10.0.0.1.53967 > 10.0.0.2.5001: UDP, length 1470
00:08:47.871376 IP 10.0.0.1.53967 > 10.0.0.2.5001: UDP, length 1470
00:08:47.883460 IP 10.0.0.1.53967 > 10.0.0.2.5001: UDP, length 1470
00:08:47.895572 IP 10.0.0.1.53967 > 10.0.0.2.5001: UDP, length 1470
00:08:47.907644 IP 10.0.0.1.53967 > 10.0.0.2.5001: UDP, length 1470
00:08:47.919716 IP 10.0.0.1.53967 > 10.0.0.2.5001: UDP, length 1470
00:08:47.931850 IP 10.0.0.1.53967 > 10.0.0.2.5001: UDP, length 1470
00:08:47.943961 IP 10.0.0.1.53967 > 10.0.0.2.5001: UDP, length 1470
00:08:47.956067 IP 10.0.0.1.53967 > 10.0.0.2.5001: UDP, length 1470
00:08:47.968277 IP 10.0.0.1.53967 > 10.0.0.2.5001: UDP, length 1470
00:08:47.980636 IP 10.0.0.1.53967 > 10.0.0.2.5001: UDP, length 1470
00:08:47.992315 IP 10.0.0.1.53967 > 10.0.0.2.5001: UDP, length 1470
00:08:48.004437 IP 10.0.0.1.53967 > 10.0.0.2.5001: UDP, length 1470
00:08:48.017265 IP 10.0.0.1.53967 > 10.0.0.2.5001: UDP, length 1470
00:08:48.028616 IP 10.0.0.1.53967 > 10.0.0.2.5001: UDP, length 1470
00:08:48.040711 IP 10.0.0.1.53967 > 10.0.0.2.5001: UDP, length 1470
00:08:48.052777 IP 10.0.0.1.53967 > 10.0.0.2.5001: UDP, length 1470
00:08:48.064922 IP 10.0.0.1.53967 > 10.0.0.2.5001: UDP, length 1470
00:08:48.077827 IP 10.0.0.1.53967 > 10.0.0.2.5001: UDP, length 1470
00:08:48.089090 IP 10.0.0.1.53967 > 10.0.0.2.5001: UDP, length 1470
00:08:48.101200 IP 10.0.0.1.53967 > 10.0.0.2.5001: UDP, length 1470
00:08:48.114360 IP 10.0.0.1.53967 > 10.0.0.2.5001: UDP, length 1470
00:08:48.125360 IP 10.0.0.1.53967 > 10.0.0.2.5001: UDP, length 1470
00:08:48.137455 IP 10.0.0.1.53967 > 10.0.0.2.5001: UDP, length 1470
00:08:48.150262 IP 10.0.0.1.53967 > 10.0.0.2.5001: UDP, length 1470
00:08:48.161657 IP 10.0.0.1.53967 > 10.0.0.2.5001: UDP, length 1470
00:08:48.173735 IP 10.0.0.1.53967 > 10.0.0.2.5001: UDP, length 1470
00:08:48.185912 IP 10.0.0.1.53967 > 10.0.0.2.5001: UDP, length 1470
00:08:48.197958 IP 10.0.0.1.53967 > 10.0.0.2.5001: UDP, length 1470
00:08:48.210051 IP 10.0.0.1.53967 > 10.0.0.2.5001: UDP, length 1470
00:08:48.222902 IP 10.0.0.1.53967 > 10.0.0.2.5001: UDP, length 1470
00:08:48.234247 IP 10.0.0.1.53967 > 10.0.0.2.5001: UDP, length 1470
00:08:48.246390 IP 10.0.0.1.53967 > 10.0.0.2.5001: UDP, length 1470
00:08:48.258423 IP 10.0.0.1.53967 > 10.0.0.2.5001: UDP, length 1470
00:08:48.270557 IP 10.0.0.1.53967 > 10.0.0.2.5001: UDP, length 1470
00:08:48.282631 IP 10.0.0.1.53967 > 10.0.0.2.5001: UDP, length 1470
00:08:48.294680 IP 10.0.0.1.53967 > 10.0.0.2.5001: UDP, length 1470
00:08:48.306820 IP 10.0.0.1.53967 > 10.0.0.2.5001: UDP, length 1470
00:08:48.318925 IP 10.0.0.1.53967 > 10.0.0.2.5001: UDP, length 1470
00:08:48.331024 IP 10.0.0.1.53967 > 10.0.0.2.5001: UDP, length 1470
00:08:48.343088 IP 10.0.0.1.53967 > 10.0.0.2.5001: UDP, length 1470
00:08:48.355217 IP 10.0.0.1.53967 > 10.0.0.2.5001: UDP, length 1470
00:08:48.367297 IP 10.0.0.1.53967 > 10.0.0.2.5001: UDP, length 1470
00:08:48.379399 IP 10.0.0.1.53967 > 10.0.0.2.5001: UDP, length 1470
00:08:48.392266 IP 10.0.0.1.53967 > 10.0.0.2.5001: UDP, length 1470
00:08:48.403590 IP 10.0.0.1.53967 > 10.0.0.2.5001: UDP, length 1470
00:08:48.415666 IP 10.0.0.1.53967 > 10.0.0.2.5001: UDP, length 1470
00:08:48.428591 IP 10.0.0.1.53967 > 10.0.0.2.5001: UDP, length 1470
00:08:48.439862 IP 10.0.0.1.53967 > 10.0.0.2.5001: UDP, length 1470
00:08:48.452024 IP 10.0.0.1.53967 > 10.0.0.2.5001: UDP, length 1470
00:08:48.464898 IP 10.0.0.1.53967 > 10.0.0.2.5001: UDP, length 1470
00:08:48.476158 IP 10.0.0.1.53967 > 10.0.0.2.5001: UDP, length 1470
00:08:48.488275 IP 10.0.0.1.53967 > 10.0.0.2.5001: UDP, length 1470
00:08:48.501275 IP 10.0.0.1.53967 > 10.0.0.2.5001: UDP, length 1470
00:08:48.512482 IP 10.0.0.1.53967 > 10.0.0.2.5001: UDP, length 1470
00:08:48.524552 IP 10.0.0.1.53967 > 10.0.0.2.5001: UDP, length 1470
00:08:48.548745 IP 10.0.0.1.53967 > 10.0.0.2.5001: UDP, length 1470
00:08:48.560823 IP 10.0.0.1.53967 > 10.0.0.2.5001: UDP, length 1470
00:08:48.572934 IP 10.0.0.1.53967 > 10.0.0.2.5001: UDP, length 1470
00:08:48.585046 IP 10.0.0.1.53967 > 10.0.0.2.5001: UDP, length 1470
00:08:48.597894 IP 10.0.0.1.53967 > 10.0.0.2.5001: UDP, length 1470
00:08:48.609219 IP 10.0.0.1.53967 > 10.0.0.2.5001: UDP, length 1470
00:08:48.621324 IP 10.0.0.1.53967 > 10.0.0.2.5001: UDP, length 1470
00:08:48.633389 IP 10.0.0.1.53967 > 10.0.0.2.5001: UDP, length 1470
00:08:48.645498 IP 10.0.0.1.53967 > 10.0.0.2.5001: UDP, length 1470
00:08:48.658357 IP 10.0.0.1.53967 > 10.0.0.2.5001: UDP, length 1470
00:08:48.669733 IP 10.0.0.1.53967 > 10.0.0.2.5001: UDP, length 1470
00:08:48.682563 IP 10.0.0.1.53967 > 10.0.0.2.5001: UDP, length 1470
00:08:48.693895 IP 10.0.0.1.53967 > 10.0.0.2.5001: UDP, length 1470
00:08:48.706017 IP 10.0.0.1.53967 > 10.0.0.2.5001: UDP, length 1470
00:08:48.718047 IP 10.0.0.1.53967 > 10.0.0.2.5001: UDP, length 1470
00:08:48.730193 IP 10.0.0.1.53967 > 10.0.0.2.5001: UDP, length 1470
00:08:48.742278 IP 10.0.0.1.53967 > 10.0.0.2.5001: UDP, length 1470
00:08:48.754374 IP 10.0.0.1.53967 > 10.0.0.2.5001: UDP, length 1470
00:08:48.766475 IP 10.0.0.1.53967 > 10.0.0.2.5001: UDP, length 1470
00:08:48.778551 IP 10.0.0.1.53967 > 10.0.0.2.5001: UDP, length 1470
00:08:48.790632 IP 10.0.0.1.53967 > 10.0.0.2.5001: UDP, length 1470
00:08:48.802759 IP 10.0.0.1.53967 > 10.0.0.2.5001: UDP, length 1470
00:08:48.814842 IP 10.0.0.1.53967 > 10.0.0.2.5001: UDP, length 1470
00:08:48.839041 IP 10.0.0.1.53967 > 10.0.0.2.5001: UDP, length 1470
00:08:48.851134 IP 10.0.0.1.53967 > 10.0.0.2.5001: UDP, length 1470
00:08:48.863214 IP 10.0.0.1.53967 > 10.0.0.2.5001: UDP, length 1470
00:08:48.876134 IP 10.0.0.1.53967 > 10.0.0.2.5001: UDP, length 1470
00:08:48.887432 IP 10.0.0.1.53967 > 10.0.0.2.5001: UDP, length 1470
00:08:48.899501 IP 10.0.0.1.53967 > 10.0.0.2.5001: UDP, length 1470
00:08:48.911619 IP 10.0.0.1.53967 > 10.0.0.2.5001: UDP, length 1470
00:08:48.924488 IP 10.0.0.1.53967 > 10.0.0.2.5001: UDP, length 1470
00:08:48.935806 IP 10.0.0.1.53967 > 10.0.0.2.5001: UDP, length 1470
00:08:48.947931 IP 10.0.0.1.53967 > 10.0.0.2.5001: UDP, length 1470
00:08:48.960187 IP 10.0.0.1.53967 > 10.0.0.2.5001: UDP, length 1470
00:08:48.972982 IP 10.0.0.1.53967 > 10.0.0.2.5001: UDP, length 1470
00:08:48.984200 IP 10.0.0.1.53967 > 10.0.0.2.5001: UDP, length 1470
00:08:48.996297 IP 10.0.0.1.53967 > 10.0.0.2.5001: UDP, length 1470
00:08:49.008375 IP 10.0.0.1.53967 > 10.0.0.2.5001: UDP, length 1470
00:08:49.020501 IP 10.0.0.1.53967 > 10.0.0.2.5001: UDP, length 1470
00:08:49.044703 IP 10.0.0.1.53967 > 10.0.0.2.5001: UDP, length 1470
00:08:49.057537 IP 10.0.0.1.53967 > 10.0.0.2.5001: UDP, length 1470
00:08:49.068872 IP 10.0.0.1.53967 > 10.0.0.2.5001: UDP, length 1470
00:08:49.080995 IP 10.0.0.1.53967 > 10.0.0.2.5001: UDP, length 1470
00:08:49.093782 IP 10.0.0.1.53967 > 10.0.0.2.5001: UDP, length 1470
00:08:49.105325 IP 10.0.0.1.53967 > 10.0.0.2.5001: UDP, length 1470
00:08:49.117244 IP 10.0.0.1.53967 > 10.0.0.2.5001: UDP, length 1470
00:08:49.129339 IP 10.0.0.1.53967 > 10.0.0.2.5001: UDP, length 1470
00:08:49.141456 IP 10.0.0.1.53967 > 10.0.0.2.5001: UDP, length 1470
00:08:49.153560 IP 10.0.0.1.53967 > 10.0.0.2.5001: UDP, length 1470
00:08:49.165637 IP 10.0.0.1.53967 > 10.0.0.2.5001: UDP, length 1470
00:08:49.178546 IP 10.0.0.1.53967 > 10.0.0.2.5001: UDP, length 1470
00:08:49.189822 IP 10.0.0.1.53967 > 10.0.0.2.5001: UDP, length 1470
00:08:49.201887 IP 10.0.0.1.53967 > 10.0.0.2.5001: UDP, length 1470
00:08:49.214026 IP 10.0.0.1.53967 > 10.0.0.2.5001: UDP, length 1470
00:08:49.226104 IP 10.0.0.1.53967 > 10.0.0.2.5001: UDP, length 1470
00:08:49.238210 IP 10.0.0.1.53967 > 10.0.0.2.5001: UDP, length 1470
00:08:49.250262 IP 10.0.0.1.53967 > 10.0.0.2.5001: UDP, length 1470
00:08:49.263224 IP 10.0.0.1.53967 > 10.0.0.2.5001: UDP, length 1470
00:08:49.274495 IP 10.0.0.1.53967 > 10.0.0.2.5001: UDP, length 1470
00:08:49.286603 IP 10.0.0.1.53967 > 10.0.0.2.5001: UDP, length 1470
00:08:49.298680 IP 10.0.0.1.53967 > 10.0.0.2.5001: UDP, length 1470
00:08:49.310789 IP 10.0.0.1.53967 > 10.0.0.2.5001: UDP, length 1470
00:08:49.322859 IP 10.0.0.1.53967 > 10.0.0.2.5001: UDP, length 1470
00:08:49.335837 IP 10.0.0.1.53967 > 10.0.0.2.5001: UDP, length 1470
00:08:49.347050 IP 10.0.0.1.53967 > 10.0.0.2.5001: UDP, length 1470
00:08:49.359927 IP 10.0.0.1.53967 > 10.0.0.2.5001: UDP, length 1470
00:08:49.371275 IP 10.0.0.1.53967 > 10.0.0.2.5001: UDP, length 1470
00:08:49.384080 IP 10.0.0.1.53967 > 10.0.0.2.5001: UDP, length 1470
00:08:49.395493 IP 10.0.0.1.53967 > 10.0.0.2.5001: UDP, length 1470
00:08:49.407558 IP 10.0.0.1.53967 > 10.0.0.2.5001: UDP, length 1470
00:08:49.419666 IP 10.0.0.1.53967 > 10.0.0.2.5001: UDP, length 1470
00:08:49.431760 IP 10.0.0.1.53967 > 10.0.0.2.5001: UDP, length 1470
00:08:49.443814 IP 10.0.0.1.53967 > 10.0.0.2.5001: UDP, length 1470
00:08:49.455963 IP 10.0.0.1.53967 > 10.0.0.2.5001: UDP, length 1470
00:08:49.467998 IP 10.0.0.1.53967 > 10.0.0.2.5001: UDP, length 1470
00:08:49.480130 IP 10.0.0.1.53967 > 10.0.0.2.5001: UDP, length 1470
00:08:49.492240 IP 10.0.0.1.53967 > 10.0.0.2.5001: UDP, length 1470
00:08:49.504336 IP 10.0.0.1.53967 > 10.0.0.2.5001: UDP, length 1470
00:08:49.516454 IP 10.0.0.1.53967 > 10.0.0.2.5001: UDP, length 1470
00:08:49.528501 IP 10.0.0.1.53967 > 10.0.0.2.5001: UDP, length 1470
00:08:49.540616 IP 10.0.0.1.53967 > 10.0.0.2.5001: UDP, length 1470
00:08:49.552731 IP 10.0.0.1.53967 > 10.0.0.2.5001: UDP, length 1470
00:08:49.564815 IP 10.0.0.1.53967 > 10.0.0.2.5001: UDP, length 1470
00:08:49.576894 IP 10.0.0.1.53967 > 10.0.0.2.5001: UDP, length 1470
00:08:49.588995 IP 10.0.0.1.53967 > 10.0.0.2.5001: UDP, length 1470
00:08:49.601079 IP 10.0.0.1.53967 > 10.0.0.2.5001: UDP, length 1470
00:08:49.613189 IP 10.0.0.1.53967 > 10.0.0.2.5001: UDP, length 1470
00:08:49.625250 IP 10.0.0.1.53967 > 10.0.0.2.5001: UDP, length 1470
00:08:49.637374 IP 10.0.0.1.53967 > 10.0.0.2.5001: UDP, length 1470
00:08:49.649441 IP 10.0.0.1.53967 > 10.0.0.2.5001: UDP, length 1470
00:08:49.662359 IP 10.0.0.1.53967 > 10.0.0.2.5001: UDP, length 1470
00:08:49.673663 IP 10.0.0.1.53967 > 10.0.0.2.5001: UDP, length 1470
00:08:49.685788 IP 10.0.0.1.53967 > 10.0.0.2.5001: UDP, length 1470
00:08:49.697833 IP 10.0.0.1.53967 > 10.0.0.2.5001: UDP, length 1470
00:08:49.709950 IP 10.0.0.1.53967 > 10.0.0.2.5001: UDP, length 1470
00:08:49.722932 IP 10.0.0.1.53967 > 10.0.0.2.5001: UDP, length 1470
00:08:49.734192 IP 10.0.0.1.53967 > 10.0.0.2.5001: UDP, length 1470
00:08:49.746246 IP 10.0.0.1.53967 > 10.0.0.2.5001: UDP, length 1470
00:08:49.758531 IP 10.0.0.1.53967 > 10.0.0.2.5001: UDP, length 1470
00:08:49.783249 IP 10.0.0.1.53967 > 10.0.0.2.5001: UDP, length 1470
00:08:49.794651 IP 10.0.0.1.53967 > 10.0.0.2.5001: UDP, length 1470
00:08:49.806706 IP 10.0.0.1.53967 > 10.0.0.2.5001: UDP, length 1470
00:08:49.819614 IP 10.0.0.1.53967 > 10.0.0.2.5001: UDP, length 1470
00:08:49.830956 IP 10.0.0.1.53967 > 10.0.0.2.5001: UDP, length 1470
00:08:49.842977 IP 10.0.0.1.53967 > 10.0.0.2.5001: UDP, length 1470
00:08:49.855140 IP 10.0.0.1.53967 > 10.0.0.2.5001: UDP, length 1470
00:08:49.867188 IP 10.0.0.1.53967 > 10.0.0.2.5001: UDP, length 1470
00:08:49.880048 IP 10.0.0.1.53967 > 10.0.0.2.5001: UDP, length 1470
00:08:49.891366 IP 10.0.0.1.53967 > 10.0.0.2.5001: UDP, length 1470
00:08:49.903459 IP 10.0.0.1.53967 > 10.0.0.2.5001: UDP, length 1470
00:08:49.915574 IP 10.0.0.1.53967 > 10.0.0.2.5001: UDP, length 1470
00:08:49.927710 IP 10.0.0.1.53967 > 10.0.0.2.5001: UDP, length 1470
00:08:49.939786 IP 10.0.0.1.53967 > 10.0.0.2.5001: UDP, length 1470
00:08:49.951877 IP 10.0.0.1.53967 > 10.0.0.2.5001: UDP, length 1470
00:08:49.963970 IP 10.0.0.1.53967 > 10.0.0.2.5001: UDP, length 1470
00:08:49.976028 IP 10.0.0.1.53967 > 10.0.0.2.5001: UDP, length 1470
00:08:49.988170 IP 10.0.0.1.53967 > 10.0.0.2.5001: UDP, length 1470
00:08:50.000984 IP 10.0.0.1.53967 > 10.0.0.2.5001: UDP, length 1470
00:08:50.012364 IP 10.0.0.1.53967 > 10.0.0.2.5001: UDP, length 1470
00:08:50.024457 IP 10.0.0.1.53967 > 10.0.0.2.5001: UDP, length 1470
00:08:50.036550 IP 10.0.0.1.53967 > 10.0.0.2.5001: UDP, length 1470
00:08:50.048650 IP 10.0.0.1.53967 > 10.0.0.2.5001: UDP, length 1470
00:08:50.061492 IP 10.0.0.1.53967 > 10.0.0.2.5001: UDP, length 1470
00:08:50.072845 IP 10.0.0.1.53967 > 10.0.0.2.5001: UDP, length 1470
00:08:50.085000 IP 10.0.0.1.53967 > 10.0.0.2.5001: UDP, length 1470
00:08:50.097011 IP 10.0.0.1.53967 > 10.0.0.2.5001: UDP, length 1470
00:08:50.109116 IP 10.0.0.1.53967 > 10.0.0.2.5001: UDP, length 1470
00:08:50.121963 IP 10.0.0.1.53967 > 10.0.0.2.5001: UDP, length 1470
00:08:50.133305 IP 10.0.0.1.53967 > 10.0.0.2.5001: UDP, length 1470
00:08:50.146339 IP 10.0.0.1.53967 > 10.0.0.2.5001: UDP, length 1470
00:08:50.157496 IP 10.0.0.1.53967 > 10.0.0.2.5001: UDP, length 1470
00:08:50.169563 IP 10.0.0.1.53967 > 10.0.0.2.5001: UDP, length 1470
00:08:50.182487 IP 10.0.0.1.53967 > 10.0.0.2.5001: UDP, length 1470
00:08:50.193782 IP 10.0.0.1.53967 > 10.0.0.2.5001: UDP, length 1470
00:08:50.205889 IP 10.0.0.1.53967 > 10.0.0.2.5001: UDP, length 1470
00:08:50.217966 IP 10.0.0.1.53967 > 10.0.0.2.5001: UDP, length 1470
00:08:50.230073 IP 10.0.0.1.53967 > 10.0.0.2.5001: UDP, length 1470
00:08:50.242339 IP 10.0.0.1.53967 > 10.0.0.2.5001: UDP, length 1470
00:08:50.255064 IP 10.0.0.1.53967 > 10.0.0.2.5001: UDP, length 1470
00:08:50.266365 IP 10.0.0.1.53967 > 10.0.0.2.5001: UDP, length 1470
00:08:50.279253 IP 10.0.0.1.53967 > 10.0.0.2.5001: UDP, length 1470
00:08:50.290552 IP 10.0.0.1.53967 > 10.0.0.2.5001: UDP, length 1470
00:08:50.302694 IP 10.0.0.1.53967 > 10.0.0.2.5001: UDP, length 1470
00:08:50.315524 IP 10.0.0.1.53967 > 10.0.0.2.5001: UDP, length 1470
00:08:50.338951 IP 10.0.0.1.53967 > 10.0.0.2.5001: UDP, length 1470
00:08:50.351762 IP 10.0.0.1.53967 > 10.0.0.2.5001: UDP, length 1470
00:08:50.363162 IP 10.0.0.1.53967 > 10.0.0.2.5001: UDP, length 1470
00:08:50.375186 IP 10.0.0.1.53967 > 10.0.0.2.5001: UDP, length 1470
00:08:50.387361 IP 10.0.0.1.53967 > 10.0.0.2.5001: UDP, length 1470
00:08:50.399431 IP 10.0.0.1.53967 > 10.0.0.2.5001: UDP, length 1470
00:08:50.411529 IP 10.0.0.1.53967 > 10.0.0.2.5001: UDP, length 1470
00:08:50.423612 IP 10.0.0.1.53967 > 10.0.0.2.5001: UDP, length 1470
00:08:50.435730 IP 10.0.0.1.53967 > 10.0.0.2.5001: UDP, length 1470
00:08:50.447825 IP 10.0.0.1.53967 > 10.0.0.2.5001: UDP, length 1470
00:08:50.459904 IP 10.0.0.1.53967 > 10.0.0.2.5001: UDP, length 1470
00:08:50.471992 IP 10.0.0.1.53967 > 10.0.0.2.5001: UDP, length 1470
00:08:50.484207 IP 10.0.0.1.53967 > 10.0.0.2.5001: UDP, length 1470
00:08:50.496219 IP 10.0.0.1.53967 > 10.0.0.2.5001: UDP, length 1470
00:08:50.509036 IP 10.0.0.1.53967 > 10.0.0.2.5001: UDP, length 1470
00:08:50.520410 IP 10.0.0.1.53967 > 10.0.0.2.5001: UDP, length 1470
00:08:50.533252 IP 10.0.0.1.53967 > 10.0.0.2.5001: UDP, length 1470
00:08:50.544615 IP 10.0.0.1.53967 > 10.0.0.2.5001: UDP, length 1470
00:08:50.556717 IP 10.0.0.1.53967 > 10.0.0.2.5001: UDP, length 1470
00:08:50.568766 IP 10.0.0.1.53967 > 10.0.0.2.5001: UDP, length 1470
00:08:50.580875 IP 10.0.0.1.53967 > 10.0.0.2.5001: UDP, length 1470
00:08:50.593557 IP 10.0.0.1.53967 > 10.0.0.2.5001: UDP, length 1470
00:08:50.605039 IP 10.0.0.1.53967 > 10.0.0.2.5001: UDP, length 1470
00:08:50.617137 IP 10.0.0.1.53967 > 10.0.0.2.5001: UDP, length 1470
00:08:50.629291 IP 10.0.0.1.53967 > 10.0.0.2.5001: UDP, length 1470
00:08:50.641349 IP 10.0.0.1.53967 > 10.0.0.2.5001: UDP, length 1470
00:08:50.653460 IP 10.0.0.1.53967 > 10.0.0.2.5001: UDP, length 1470
00:08:50.666290 IP 10.0.0.1.53967 > 10.0.0.2.5001: UDP, length 1470
00:08:50.677676 IP 10.0.0.1.53967 > 10.0.0.2.5001: UDP, length 1470
00:08:50.689915 IP 10.0.0.1.53967 > 10.0.0.2.5001: UDP, length 1470
00:08:50.701829 IP 10.0.0.1.53967 > 10.0.0.2.5001: UDP, length 1470
00:08:50.726007 IP 10.0.0.1.53967 > 10.0.0.2.5001: UDP, length 1470
00:08:50.738791 IP 10.0.0.1.53967 > 10.0.0.2.5001: UDP, length 1470
00:08:50.750198 IP 10.0.0.1.53967 > 10.0.0.2.5001: UDP, length 1470
00:08:50.762327 IP 10.0.0.1.53967 > 10.0.0.2.5001: UDP, length 1470
00:08:50.774390 IP 10.0.0.1.53967 > 10.0.0.2.5001: UDP, length 1470
00:08:50.786498 IP 10.0.0.1.53967 > 10.0.0.2.5001: UDP, length 1470
00:08:50.798571 IP 10.0.0.1.53967 > 10.0.0.2.5001: UDP, length 1470
00:08:50.810684 IP 10.0.0.1.53967 > 10.0.0.2.5001: UDP, length 1470
00:08:50.822778 IP 10.0.0.1.53967 > 10.0.0.2.5001: UDP, length 1470
00:08:50.834887 IP 10.0.0.1.53967 > 10.0.0.2.5001: UDP, length 1470
00:08:50.859068 IP 10.0.0.1.53967 > 10.0.0.2.5001: UDP, length 1470
00:08:50.871103 IP 10.0.0.1.53967 > 10.0.0.2.5001: UDP, length 1470
00:08:50.883191 IP 10.0.0.1.53967 > 10.0.0.2.5001: UDP, length 1470
00:08:50.895286 IP 10.0.0.1.53967 > 10.0.0.2.5001: UDP, length 1470
00:08:50.907386 IP 10.0.0.1.53967 > 10.0.0.2.5001: UDP, length 1470
00:08:50.919558 IP 10.0.0.1.53967 > 10.0.0.2.5001: UDP, length 1470
00:08:50.931688 IP 10.0.0.1.53967 > 10.0.0.2.5001: UDP, length 1470
00:08:50.943744 IP 10.0.0.1.53967 > 10.0.0.2.5001: UDP, length 1470
00:08:50.955846 IP 10.0.0.1.53967 > 10.0.0.2.5001: UDP, length 1470
00:08:50.967919 IP 10.0.0.1.53967 > 10.0.0.2.5001: UDP, length 1470
00:08:50.980001 IP 10.0.0.1.53967 > 10.0.0.2.5001: UDP, length 1470
00:08:50.992117 IP 10.0.0.1.53967 > 10.0.0.2.5001: UDP, length 1470
00:08:51.004246 IP 10.0.0.1.53967 > 10.0.0.2.5001: UDP, length 1470
00:08:51.016315 IP 10.0.0.1.53967 > 10.0.0.2.5001: UDP, length 1470
00:08:51.028415 IP 10.0.0.1.53967 > 10.0.0.2.5001: UDP, length 1470
00:08:51.040518 IP 10.0.0.1.53967 > 10.0.0.2.5001: UDP, length 1470
00:08:51.053396 IP 10.0.0.1.53967 > 10.0.0.2.5001: UDP, length 1470
00:08:51.064850 IP 10.0.0.1.53967 > 10.0.0.2.5001: UDP, length 1470
00:08:51.076797 IP 10.0.0.1.53967 > 10.0.0.2.5001: UDP, length 1470
00:08:51.088892 IP 10.0.0.1.53967 > 10.0.0.2.5001: UDP, length 1470
00:08:51.101734 IP 10.0.0.1.53967 > 10.0.0.2.5001: UDP, length 1470
00:08:51.113065 IP 10.0.0.1.53967 > 10.0.0.2.5001: UDP, length 1470
00:08:51.125170 IP 10.0.0.1.53967 > 10.0.0.2.5001: UDP, length 1470
00:08:51.138047 IP 10.0.0.1.53967 > 10.0.0.2.5001: UDP, length 1470
00:08:51.149380 IP 10.0.0.1.53967 > 10.0.0.2.5001: UDP, length 1470
00:08:51.161479 IP 10.0.0.1.53967 > 10.0.0.2.5001: UDP, length 1470
00:08:51.174369 IP 10.0.0.1.53967 > 10.0.0.2.5001: UDP, length 1470
00:08:51.185689 IP 10.0.0.1.53967 > 10.0.0.2.5001: UDP, length 1470
00:08:51.197733 IP 10.0.0.1.53967 > 10.0.0.2.5001: UDP, length 1470
00:08:51.210626 IP 10.0.0.1.53967 > 10.0.0.2.5001: UDP, length 1470
00:08:51.221938 IP 10.0.0.1.53967 > 10.0.0.2.5001: UDP, length 1470
00:08:51.234055 IP 10.0.0.1.53967 > 10.0.0.2.5001: UDP, length 1470
00:08:51.246939 IP 10.0.0.1.53967 > 10.0.0.2.5001: UDP, length 1470
00:08:51.258241 IP 10.0.0.1.53967 > 10.0.0.2.5001: UDP, length 1470
00:08:51.270374 IP 10.0.0.1.53967 > 10.0.0.2.5001: UDP, length 1470
00:08:51.282573 IP 10.0.0.1.53967 > 10.0.0.2.5001: UDP, length 1470
00:08:51.294509 IP 10.0.0.1.53967 > 10.0.0.2.5001: UDP, length 1470
00:08:51.306622 IP 10.0.0.1.53967 > 10.0.0.2.5001: UDP, length 1470
00:08:51.318734 IP 10.0.0.1.53967 > 10.0.0.2.5001: UDP, length 1470
00:08:51.330837 IP 10.0.0.1.53967 > 10.0.0.2.5001: UDP, length 1470
00:08:51.343608 IP 10.0.0.1.53967 > 10.0.0.2.5001: UDP, length 1470
00:08:51.355027 IP 10.0.0.1.53967 > 10.0.0.2.5001: UDP, length 1470
00:08:51.367103 IP 10.0.0.1.53967 > 10.0.0.2.5001: UDP, length 1470
00:08:51.379222 IP 10.0.0.1.53967 > 10.0.0.2.5001: UDP, length 1470
00:08:51.391304 IP 10.0.0.1.53967 > 10.0.0.2.5001: UDP, length 1470
00:08:51.403390 IP 10.0.0.1.53967 > 10.0.0.2.5001: UDP, length 1470
00:08:51.415493 IP 10.0.0.1.53967 > 10.0.0.2.5001: UDP, length 1470
00:08:51.427600 IP 10.0.0.1.53967 > 10.0.0.2.5001: UDP, length 1470
00:08:51.439700 IP 10.0.0.1.53967 > 10.0.0.2.5001: UDP, length 1470
00:08:51.451980 IP 10.0.0.1.53967 > 10.0.0.2.5001: UDP, length 1470
00:08:51.464012 IP 10.0.0.1.53967 > 10.0.0.2.5001: UDP, length 1470
00:08:51.475966 IP 10.0.0.1.53967 > 10.0.0.2.5001: UDP, length 1470
00:08:51.488285 IP 10.0.0.1.53967 > 10.0.0.2.5001: UDP, length 1470
00:08:51.500149 IP 10.0.0.1.53967 > 10.0.0.2.5001: UDP, length 1470
00:08:51.513024 IP 10.0.0.1.53967 > 10.0.0.2.5001: UDP, length 1470
00:08:51.524360 IP 10.0.0.1.53967 > 10.0.0.2.5001: UDP, length 1470
00:08:51.536468 IP 10.0.0.1.53967 > 10.0.0.2.5001: UDP, length 1470
00:08:51.549375 IP 10.0.0.1.53967 > 10.0.0.2.5001: UDP, length 1470
00:08:51.560636 IP 10.0.0.1.53967 > 10.0.0.2.5001: UDP, length 1470
00:08:51.573519 IP 10.0.0.1.53967 > 10.0.0.2.5001: UDP, length 1470
00:08:51.584830 IP 10.0.0.1.53967 > 10.0.0.2.5001: UDP, length 1470
00:08:51.596923 IP 10.0.0.1.53967 > 10.0.0.2.5001: UDP, length 1470
00:08:51.609051 IP 10.0.0.1.53967 > 10.0.0.2.5001: UDP, length 1470
00:08:51.621104 IP 10.0.0.1.53967 > 10.0.0.2.5001: UDP, length 1470
00:08:51.633232 IP 10.0.0.1.53967 > 10.0.0.2.5001: UDP, length 1470
00:08:51.645355 IP 10.0.0.1.53967 > 10.0.0.2.5001: UDP, length 1470
00:08:51.657411 IP 10.0.0.1.53967 > 10.0.0.2.5001: UDP, length 1470
00:08:51.669614 IP 10.0.0.1.53967 > 10.0.0.2.5001: UDP, length 1470
00:08:51.681633 IP 10.0.0.1.53967 > 10.0.0.2.5001: UDP, length 1470
00:08:51.693720 IP 10.0.0.1.53967 > 10.0.0.2.5001: UDP, length 1470
00:08:51.705797 IP 10.0.0.1.53967 > 10.0.0.2.5001: UDP, length 1470
00:08:51.717889 IP 10.0.0.1.53967 > 10.0.0.2.5001: UDP, length 1470
00:08:51.730779 IP 10.0.0.1.53967 > 10.0.0.2.5001: UDP, length 1470
00:08:51.742035 IP 10.0.0.1.53967 > 10.0.0.2.5001: UDP, length 1470
00:08:51.754123 IP 10.0.0.1.53967 > 10.0.0.2.5001: UDP, length 1470
00:08:51.766290 IP 10.0.0.1.53967 > 10.0.0.2.5001: UDP, length 1470
00:08:51.778359 IP 10.0.0.1.53967 > 10.0.0.2.5001: UDP, length 1470
00:08:51.790488 IP 10.0.0.1.53967 > 10.0.0.2.5001: UDP, length 1470
00:08:51.802583 IP 10.0.0.1.53967 > 10.0.0.2.5001: UDP, length 1470
00:08:51.815389 IP 10.0.0.1.53967 > 10.0.0.2.5001: UDP, length 1470
00:08:51.826739 IP 10.0.0.1.53967 > 10.0.0.2.5001: UDP, length 1470
00:08:51.838853 IP 10.0.0.1.53967 > 10.0.0.2.5001: UDP, length 1470
00:08:51.850945 IP 10.0.0.1.53967 > 10.0.0.2.5001: UDP, length 1470
00:08:51.863036 IP 10.0.0.1.53967 > 10.0.0.2.5001: UDP, length 1470
00:08:51.875108 IP 10.0.0.1.53967 > 10.0.0.2.5001: UDP, length 1470
00:08:51.888100 IP 10.0.0.1.53967 > 10.0.0.2.5001: UDP, length 1470
00:08:51.899340 IP 10.0.0.1.53967 > 10.0.0.2.5001: UDP, length 1470
00:08:51.911419 IP 10.0.0.1.53967 > 10.0.0.2.5001: UDP, length 1470
00:08:51.923505 IP 10.0.0.1.53967 > 10.0.0.2.5001: UDP, length 1470
00:08:51.935619 IP 10.0.0.1.53967 > 10.0.0.2.5001: UDP, length 1470
00:08:51.948106 IP 10.0.0.1.53967 > 10.0.0.2.5001: UDP, length 1470
00:08:51.960610 IP 10.0.0.1.53967 > 10.0.0.2.5001: UDP, length 1470
00:08:51.971909 IP 10.0.0.1.53967 > 10.0.0.2.5001: UDP, length 1470
00:08:51.984016 IP 10.0.0.1.53967 > 10.0.0.2.5001: UDP, length 1470
00:08:51.996914 IP 10.0.0.1.53967 > 10.0.0.2.5001: UDP, length 1470
00:08:52.008239 IP 10.0.0.1.53967 > 10.0.0.2.5001: UDP, length 1470
00:08:52.020318 IP 10.0.0.1.53967 > 10.0.0.2.5001: UDP, length 1470
00:08:52.032392 IP 10.0.0.1.53967 > 10.0.0.2.5001: UDP, length 1470
00:08:52.044476 IP 10.0.0.1.53967 > 10.0.0.2.5001: UDP, length 1470
00:08:52.057263 IP 10.0.0.1.53967 > 10.0.0.2.5001: UDP, length 1470
00:08:52.068665 IP 10.0.0.1.53967 > 10.0.0.2.5001: UDP, length 1470
00:08:52.080814 IP 10.0.0.1.53967 > 10.0.0.2.5001: UDP, length 1470
00:08:52.092839 IP 10.0.0.1.53967 > 10.0.0.2.5001: UDP, length 1470
00:08:52.104977 IP 10.0.0.1.53967 > 10.0.0.2.5001: UDP, length 1470
00:08:52.117027 IP 10.0.0.1.53967 > 10.0.0.2.5001: UDP, length 1470
00:08:52.129109 IP 10.0.0.1.53967 > 10.0.0.2.5001: UDP, length 1470
00:08:52.141195 IP 10.0.0.1.53967 > 10.0.0.2.5001: UDP, length 1470
00:08:52.153282 IP 10.0.0.1.53967 > 10.0.0.2.5001: UDP, length 1470
00:08:52.165393 IP 10.0.0.1.53967 > 10.0.0.2.5001: UDP, length 1470
00:08:52.177477 IP 10.0.0.1.53967 > 10.0.0.2.5001: UDP, length 1470
00:08:52.189619 IP 10.0.0.1.53967 > 10.0.0.2.5001: UDP, length 1470
00:08:52.201718 IP 10.0.0.1.53967 > 10.0.0.2.5001: UDP, length 1470
00:08:52.213831 IP 10.0.0.1.53967 > 10.0.0.2.5001: UDP, length 1470
00:08:52.225949 IP 10.0.0.1.53967 > 10.0.0.2.5001: UDP, length 1470
00:08:52.237964 IP 10.0.0.1.53967 > 10.0.0.2.5001: UDP, length 1470
00:08:52.250078 IP 10.0.0.1.53967 > 10.0.0.2.5001: UDP, length 1470
00:08:52.262210 IP 10.0.0.1.53967 > 10.0.0.2.5001: UDP, length 1470
00:08:52.274304 IP 10.0.0.1.53967 > 10.0.0.2.5001: UDP, length 1470
00:08:52.298495 IP 10.0.0.1.53967 > 10.0.0.2.5001: UDP, length 1470
00:08:52.311589 IP 10.0.0.1.53967 > 10.0.0.2.5001: UDP, length 1470
00:08:52.322689 IP 10.0.0.1.53967 > 10.0.0.2.5001: UDP, length 1470
00:08:52.334789 IP 10.0.0.1.53967 > 10.0.0.2.5001: UDP, length 1470
00:08:52.347740 IP 10.0.0.1.53967 > 10.0.0.2.5001: UDP, length 1470
00:08:52.358968 IP 10.0.0.1.53967 > 10.0.0.2.5001: UDP, length 1470
00:08:52.371085 IP 10.0.0.1.53967 > 10.0.0.2.5001: UDP, length 1470
00:08:52.384121 IP 10.0.0.1.53967 > 10.0.0.2.5001: UDP, length 1470
00:08:52.395245 IP 10.0.0.1.53967 > 10.0.0.2.5001: UDP, length 1470
00:08:52.407355 IP 10.0.0.1.53967 > 10.0.0.2.5001: UDP, length 1470
00:08:52.419787 IP 10.0.0.1.53967 > 10.0.0.2.5001: UDP, length 1470
00:08:52.431548 IP 10.0.0.1.53967 > 10.0.0.2.5001: UDP, length 1470
00:08:52.443611 IP 10.0.0.1.53967 > 10.0.0.2.5001: UDP, length 1470
00:08:52.455743 IP 10.0.0.1.53967 > 10.0.0.2.5001: UDP, length 1470
00:08:52.467835 IP 10.0.0.1.53967 > 10.0.0.2.5001: UDP, length 1470
00:08:52.479910 IP 10.0.0.1.53967 > 10.0.0.2.5001: UDP, length 1470
00:08:52.492028 IP 10.0.0.1.53967 > 10.0.0.2.5001: UDP, length 1470
00:08:52.504911 IP 10.0.0.1.53967 > 10.0.0.2.5001: UDP, length 1470
00:08:52.516246 IP 10.0.0.1.53967 > 10.0.0.2.5001: UDP, length 1470
00:08:52.528334 IP 10.0.0.1.53967 > 10.0.0.2.5001: UDP, length 1470
00:08:52.541160 IP 10.0.0.1.53967 > 10.0.0.2.5001: UDP, length 1470
00:08:52.552531 IP 10.0.0.1.53967 > 10.0.0.2.5001: UDP, length 1470
00:08:52.564599 IP 10.0.0.1.53967 > 10.0.0.2.5001: UDP, length 1470
00:08:52.576679 IP 10.0.0.1.53967 > 10.0.0.2.5001: UDP, length 1470
00:08:52.588808 IP 10.0.0.1.53967 > 10.0.0.2.5001: UDP, length 1470
00:08:52.600872 IP 10.0.0.1.53967 > 10.0.0.2.5001: UDP, length 1470
00:08:52.613012 IP 10.0.0.1.53967 > 10.0.0.2.5001: UDP, length 1470
00:08:52.625069 IP 10.0.0.1.53967 > 10.0.0.2.5001: UDP, length 1470
00:08:52.637174 IP 10.0.0.1.53967 > 10.0.0.2.5001: UDP, length 1470
00:08:52.649276 IP 10.0.0.1.53967 > 10.0.0.2.5001: UDP, length 1470
00:08:52.661361 IP 10.0.0.1.53967 > 10.0.0.2.5001: UDP, length 1470
00:08:52.673434 IP 10.0.0.1.53967 > 10.0.0.2.5001: UDP, length 1470
00:08:52.685576 IP 10.0.0.1.53967 > 10.0.0.2.5001: UDP, length 1470
00:08:52.698429 IP 10.0.0.1.53967 > 10.0.0.2.5001: UDP, length 1470
00:08:52.709735 IP 10.0.0.1.53967 > 10.0.0.2.5001: UDP, length 1470
00:08:52.721857 IP 10.0.0.1.53967 > 10.0.0.2.5001: UDP, length 1470
00:08:52.733972 IP 10.0.0.1.53967 > 10.0.0.2.5001: UDP, length 1470

