00:09:22.002947 IP 10.0.0.1.35974 > 10.0.0.2.5001: UDP, length 1470
00:09:22.003233 IP 10.0.0.1.35974 > 10.0.0.2.5001: UDP, length 1470
00:09:22.014876 IP 10.0.0.1.35974 > 10.0.0.2.5001: UDP, length 1470
00:09:22.026461 IP 10.0.0.1.35974 > 10.0.0.2.5001: UDP, length 1470
00:09:22.038473 IP 10.0.0.1.35974 > 10.0.0.2.5001: UDP, length 1470
00:09:22.050572 IP 10.0.0.1.35974 > 10.0.0.2.5001: UDP, length 1470
00:09:22.062687 IP 10.0.0.1.35974 > 10.0.0.2.5001: UDP, length 1470
00:09:22.074786 IP 10.0.0.1.35974 > 10.0.0.2.5001: UDP, length 1470
00:09:22.086914 IP 10.0.0.1.35974 > 10.0.0.2.5001: UDP, length 1470
00:09:22.098978 IP 10.0.0.1.35974 > 10.0.0.2.5001: UDP, length 1470
00:09:22.111074 IP 10.0.0.1.35974 > 10.0.0.2.5001: UDP, length 1470
00:09:22.123207 IP 10.0.0.1.35974 > 10.0.0.2.5001: UDP, length 1470
00:09:22.135271 IP 10.0.0.1.35974 > 10.0.0.2.5001: UDP, length 1470
00:09:22.147362 IP 10.0.0.1.35974 > 10.0.0.2.5001: UDP, length 1470
00:09:22.159459 IP 10.0.0.1.35974 > 10.0.0.2.5001: UDP, length 1470
00:09:22.171566 IP 10.0.0.1.35974 > 10.0.0.2.5001: UDP, length 1470
00:09:22.183669 IP 10.0.0.1.35974 > 10.0.0.2.5001: UDP, length 1470
00:09:22.195748 IP 10.0.0.1.35974 > 10.0.0.2.5001: UDP, length 1470
00:09:22.208647 IP 10.0.0.1.35974 > 10.0.0.2.5001: UDP, length 1470
00:09:22.219957 IP 10.0.0.1.35974 > 10.0.0.2.5001: UDP, length 1470
00:09:22.232771 IP 10.0.0.1.35974 > 10.0.0.2.5001: UDP, length 1470
00:09:22.244159 IP 10.0.0.1.35974 > 10.0.0.2.5001: UDP, length 1470
00:09:22.256218 IP 10.0.0.1.35974 > 10.0.0.2.5001: UDP, length 1470
00:09:22.268327 IP 10.0.0.1.35974 > 10.0.0.2.5001: UDP, length 1470
00:09:22.280426 IP 10.0.0.1.35974 > 10.0.0.2.5001: UDP, length 1470
00:09:22.292522 IP 10.0.0.1.35974 > 10.0.0.2.5001: UDP, length 1470
00:09:22.304622 IP 10.0.0.1.35974 > 10.0.0.2.5001: UDP, length 1470
00:09:22.316732 IP 10.0.0.1.35974 > 10.0.0.2.5001: UDP, length 1470
00:09:22.328845 IP 10.0.0.1.35974 > 10.0.0.2.5001: UDP, length 1470
00:09:22.341617 IP 10.0.0.1.35974 > 10.0.0.2.5001: UDP, length 1470
00:09:22.353007 IP 10.0.0.1.35974 > 10.0.0.2.5001: UDP, length 1470
00:09:22.365091 IP 10.0.0.1.35974 > 10.0.0.2.5001: UDP, length 1470
00:09:22.377218 IP 10.0.0.1.35974 > 10.0.0.2.5001: UDP, length 1470
00:09:22.389293 IP 10.0.0.1.35974 > 10.0.0.2.5001: UDP, length 1470
00:09:22.401415 IP 10.0.0.1.35974 > 10.0.0.2.5001: UDP, length 1470
00:09:22.414125 IP 10.0.0.1.35974 > 10.0.0.2.5001: UDP, length 1470
00:09:22.425573 IP 10.0.0.1.35974 > 10.0.0.2.5001: UDP, length 1470
00:09:22.437684 IP 10.0.0.1.35974 > 10.0.0.2.5001: UDP, length 1470
00:09:22.449761 IP 10.0.0.1.35974 > 10.0.0.2.5001: UDP, length 1470
00:09:22.461870 IP 10.0.0.1.35974 > 10.0.0.2.5001: UDP, length 1470
00:09:22.473962 IP 10.0.0.1.35974 > 10.0.0.2.5001: UDP, length 1470
00:09:22.486057 IP 10.0.0.1.35974 > 10.0.0.2.5001: UDP, length 1470
00:09:22.498178 IP 10.0.0.1.35974 > 10.0.0.2.5001: UDP, length 1470
00:09:22.510239 IP 10.0.0.1.35974 > 10.0.0.2.5001: UDP, length 1470
00:09:22.522347 IP 10.0.0.1.35974 > 10.0.0.2.5001: UDP, length 1470
00:09:22.534438 IP 10.0.0.1.35974 > 10.0.0.2.5001: UDP, length 1470
00:09:22.546525 IP 10.0.0.1.35974 > 10.0.0.2.5001: UDP, length 1470
00:09:22.558642 IP 10.0.0.1.35974 > 10.0.0.2.5001: UDP, length 1470
00:09:22.570721 IP 10.0.0.1.35974 > 10.0.0.2.5001: UDP, length 1470
00:09:22.582825 IP 10.0.0.1.35974 > 10.0.0.2.5001: UDP, length 1470
00:09:22.594951 IP 10.0.0.1.35974 > 10.0.0.2.5001: UDP, length 1470
00:09:22.607713 IP 10.0.0.1.35974 > 10.0.0.2.5001: UDP, length 1470
00:09:22.619115 IP 10.0.0.1.35974 > 10.0.0.2.5001: UDP, length 1470
00:09:22.631203 IP 10.0.0.1.35974 > 10.0.0.2.5001: UDP, length 1470
00:09:22.643639 IP 10.0.0.1.35974 > 10.0.0.2.5001: UDP, length 1470
00:09:22.655402 IP 10.0.0.1.35974 > 10.0.0.2.5001: UDP, length 1470
00:09:22.667500 IP 10.0.0.1.35974 > 10.0.0.2.5001: UDP, length 1470
00:09:22.679588 IP 10.0.0.1.35974 > 10.0.0.2.5001: UDP, length 1470
00:09:22.691685 IP 10.0.0.1.35974 > 10.0.0.2.5001: UDP, length 1470
00:09:22.704540 IP 10.0.0.1.35974 > 10.0.0.2.5001: UDP, length 1470
00:09:22.715881 IP 10.0.0.1.35974 > 10.0.0.2.5001: UDP, length 1470
00:09:22.727965 IP 10.0.0.1.35974 > 10.0.0.2.5001: UDP, length 1470
00:09:22.740466 IP 10.0.0.1.35974 > 10.0.0.2.5001: UDP, length 1470
00:09:22.752186 IP 10.0.0.1.35974 > 10.0.0.2.5001: UDP, length 1470
00:09:22.764269 IP 10.0.0.1.35974 > 10.0.0.2.5001: UDP, length 1470
00:09:22.776361 IP 10.0.0.1.35974 > 10.0.0.2.5001: UDP, length 1470
00:09:22.788457 IP 10.0.0.1.35974 > 10.0.0.2.5001: UDP, length 1470
00:09:22.800550 IP 10.0.0.1.35974 > 10.0.0.2.5001: UDP, length 1470
00:09:22.812670 IP 10.0.0.1.35974 > 10.0.0.2.5001: UDP, length 1470
00:09:22.824744 IP 10.0.0.1.35974 > 10.0.0.2.5001: UDP, length 1470
00:09:22.836843 IP 10.0.0.1.35974 > 10.0.0.2.5001: UDP, length 1470
00:09:22.848936 IP 10.0.0.1.35974 > 10.0.0.2.5001: UDP, length 1470
00:09:22.861033 IP 10.0.0.1.35974 > 10.0.0.2.5001: UDP, length 1470
00:09:22.873126 IP 10.0.0.1.35974 > 10.0.0.2.5001: UDP, length 1470
00:09:22.885242 IP 10.0.0.1.35974 > 10.0.0.2.5001: UDP, length 1470
00:09:22.897324 IP 10.0.0.1.35974 > 10.0.0.2.5001: UDP, length 1470
00:09:22.909436 IP 10.0.0.1.35974 > 10.0.0.2.5001: UDP, length 1470
00:09:22.922331 IP 10.0.0.1.35974 > 10.0.0.2.5001: UDP, length 1470
00:09:22.933608 IP 10.0.0.1.35974 > 10.0.0.2.5001: UDP, length 1470
00:09:22.945725 IP 10.0.0.1.35974 > 10.0.0.2.5001: UDP, length 1470
00:09:22.957809 IP 10.0.0.1.35974 > 10.0.0.2.5001: UDP, length 1470
00:09:22.969904 IP 10.0.0.1.35974 > 10.0.0.2.5001: UDP, length 1470
00:09:22.981993 IP 10.0.0.1.35974 > 10.0.0.2.5001: UDP, length 1470
00:09:22.994116 IP 10.0.0.1.35974 > 10.0.0.2.5001: UDP, length 1470
00:09:23.006220 IP 10.0.0.1.35974 > 10.0.0.2.5001: UDP, length 1470
00:09:23.019026 IP 10.0.0.1.35974 > 10.0.0.2.5001: UDP, length 1470
00:09:23.030378 IP 10.0.0.1.35974 > 10.0.0.2.5001: UDP, length 1470
00:09:23.042470 IP 10.0.0.1.35974 > 10.0.0.2.5001: UDP, length 1470
00:09:23.055310 IP 10.0.0.1.35974 > 10.0.0.2.5001: UDP, length 1470
00:09:23.066669 IP 10.0.0.1.35974 > 10.0.0.2.5001: UDP, length 1470
00:09:23.078756 IP 10.0.0.1.35974 > 10.0.0.2.5001: UDP, length 1470
00:09:23.090853 IP 10.0.0.1.35974 > 10.0.0.2.5001: UDP, length 1470
00:09:23.102943 IP 10.0.0.1.35974 > 10.0.0.2.5001: UDP, length 1470
00:09:23.115049 IP 10.0.0.1.35974 > 10.0.0.2.5001: UDP, length 1470
00:09:23.127191 IP 10.0.0.1.35974 > 10.0.0.2.5001: UDP, length 1470
00:09:23.139251 IP 10.0.0.1.35974 > 10.0.0.2.5001: UDP, length 1470
00:09:23.151368 IP 10.0.0.1.35974 > 10.0.0.2.5001: UDP, length 1470
00:09:23.163435 IP 10.0.0.1.35974 > 10.0.0.2.5001: UDP, length 1470
00:09:23.175525 IP 10.0.0.1.35974 > 10.0.0.2.5001: UDP, length 1470
00:09:23.187629 IP 10.0.0.1.35974 > 10.0.0.2.5001: UDP, length 1470
00:09:23.199726 IP 10.0.0.1.35974 > 10.0.0.2.5001: UDP, length 1470
00:09:23.211831 IP 10.0.0.1.35974 > 10.0.0.2.5001: UDP, length 1470
00:09:23.223917 IP 10.0.0.1.35974 > 10.0.0.2.5001: UDP, length 1470
00:09:23.236010 IP 10.0.0.1.35974 > 10.0.0.2.5001: UDP, length 1470
00:09:23.248098 IP 10.0.0.1.35974 > 10.0.0.2.5001: UDP, length 1470
00:09:23.260213 IP 10.0.0.1.35974 > 10.0.0.2.5001: UDP, length 1470
00:09:23.272309 IP 10.0.0.1.35974 > 10.0.0.2.5001: UDP, length 1470
00:09:23.284385 IP 10.0.0.1.35974 > 10.0.0.2.5001: UDP, length 1470
00:09:23.296495 IP 10.0.0.1.35974 > 10.0.0.2.5001: UDP, length 1470
00:09:23.308585 IP 10.0.0.1.35974 > 10.0.0.2.5001: UDP, length 1470
00:09:23.320674 IP 10.0.0.1.35974 > 10.0.0.2.5001: UDP, length 1470
00:09:23.332800 IP 10.0.0.1.35974 > 10.0.0.2.5001: UDP, length 1470
00:09:23.344883 IP 10.0.0.1.35974 > 10.0.0.2.5001: UDP, length 1470
00:09:23.356974 IP 10.0.0.1.35974 > 10.0.0.2.5001: UDP, length 1470
00:09:23.369087 IP 10.0.0.1.35974 > 10.0.0.2.5001: UDP, length 1470
00:09:23.381156 IP 10.0.0.1.35974 > 10.0.0.2.5001: UDP, length 1470
00:09:23.393254 IP 10.0.0.1.35974 > 10.0.0.2.5001: UDP, length 1470
00:09:23.405353 IP 10.0.0.1.35974 > 10.0.0.2.5001: UDP, length 1470
00:09:23.417436 IP 10.0.0.1.35974 > 10.0.0.2.5001: UDP, length 1470
00:09:23.429555 IP 10.0.0.1.35974 > 10.0.0.2.5001: UDP, length 1470
00:09:23.441640 IP 10.0.0.1.35974 > 10.0.0.2.5001: UDP, length 1470
00:09:23.453741 IP 10.0.0.1.35974 > 10.0.0.2.5001: UDP, length 1470
00:09:23.465857 IP 10.0.0.1.35974 > 10.0.0.2.5001: UDP, length 1470
00:09:23.478682 IP 10.0.0.1.35974 > 10.0.0.2.5001: UDP, length 1470
00:09:23.490027 IP 10.0.0.1.35974 > 10.0.0.2.5001: UDP, length 1470
00:09:23.502889 IP 10.0.0.1.35974 > 10.0.0.2.5001: UDP, length 1470
00:09:23.514219 IP 10.0.0.1.35974 > 10.0.0.2.5001: UDP, length 1470
00:09:23.526326 IP 10.0.0.1.35974 > 10.0.0.2.5001: UDP, length 1470
00:09:23.538411 IP 10.0.0.1.35974 > 10.0.0.2.5001: UDP, length 1470
00:09:23.550798 IP 10.0.0.1.35974 > 10.0.0.2.5001: UDP, length 1470
00:09:23.562604 IP 10.0.0.1.35974 > 10.0.0.2.5001: UDP, length 1470
00:09:23.574701 IP 10.0.0.1.35974 > 10.0.0.2.5001: UDP, length 1470
00:09:23.586798 IP 10.0.0.1.35974 > 10.0.0.2.5001: UDP, length 1470
00:09:23.598903 IP 10.0.0.1.35974 > 10.0.0.2.5001: UDP, length 1470
00:09:23.610991 IP 10.0.0.1.35974 > 10.0.0.2.5001: UDP, length 1470
00:09:23.623080 IP 10.0.0.1.35974 > 10.0.0.2.5001: UDP, length 1470
00:09:23.635179 IP 10.0.0.1.35974 > 10.0.0.2.5001: UDP, length 1470
00:09:23.647398 IP 10.0.0.1.35974 > 10.0.0.2.5001: UDP, length 1470
00:09:23.659372 IP 10.0.0.1.35974 > 10.0.0.2.5001: UDP, length 1470
00:09:23.671467 IP 10.0.0.1.35974 > 10.0.0.2.5001: UDP, length 1470
00:09:23.683551 IP 10.0.0.1.35974 > 10.0.0.2.5001: UDP, length 1470
00:09:23.695651 IP 10.0.0.1.35974 > 10.0.0.2.5001: UDP, length 1470
00:09:23.707753 IP 10.0.0.1.35974 > 10.0.0.2.5001: UDP, length 1470
00:09:23.719854 IP 10.0.0.1.35974 > 10.0.0.2.5001: UDP, length 1470
00:09:23.731961 IP 10.0.0.1.35974 > 10.0.0.2.5001: UDP, length 1470
00:09:23.744073 IP 10.0.0.1.35974 > 10.0.0.2.5001: UDP, length 1470
00:09:23.756137 IP 10.0.0.1.35974 > 10.0.0.2.5001: UDP, length 1470
00:09:23.768236 IP 10.0.0.1.35974 > 10.0.0.2.5001: UDP, length 1470
00:09:23.780328 IP 10.0.0.1.35974 > 10.0.0.2.5001: UDP, length 1470
00:09:23.792443 IP 10.0.0.1.35974 > 10.0.0.2.5001: UDP, length 1470
00:09:23.804528 IP 10.0.0.1.35974 > 10.0.0.2.5001: UDP, length 1470
00:09:23.816628 IP 10.0.0.1.35974 > 10.0.0.2.5001: UDP, length 1470
00:09:23.828708 IP 10.0.0.1.35974 > 10.0.0.2.5001: UDP, length 1470
00:09:23.840808 IP 10.0.0.1.35974 > 10.0.0.2.5001: UDP, length 1470
00:09:23.852928 IP 10.0.0.1.35974 > 10.0.0.2.5001: UDP, length 1470
00:09:23.864998 IP 10.0.0.1.35974 > 10.0.0.2.5001: UDP, length 1470
00:09:23.877116 IP 10.0.0.1.35974 > 10.0.0.2.5001: UDP, length 1470
00:09:23.889193 IP 10.0.0.1.35974 > 10.0.0.2.5001: UDP, length 1470
00:09:23.901304 IP 10.0.0.1.35974 > 10.0.0.2.5001: UDP, length 1470
00:09:23.913414 IP 10.0.0.1.35974 > 10.0.0.2.5001: UDP, length 1470
00:09:23.925663 IP 10.0.0.1.35974 > 10.0.0.2.5001: UDP, length 1470
00:09:23.937572 IP 10.0.0.1.35974 > 10.0.0.2.5001: UDP, length 1470
00:09:23.949667 IP 10.0.0.1.35974 > 10.0.0.2.5001: UDP, length 1470
00:09:23.962474 IP 10.0.0.1.35974 > 10.0.0.2.5001: UDP, length 1470
00:09:23.973880 IP 10.0.0.1.35974 > 10.0.0.2.5001: UDP, length 1470
00:09:23.985967 IP 10.0.0.1.35974 > 10.0.0.2.5001: UDP, length 1470
00:09:23.998789 IP 10.0.0.1.35974 > 10.0.0.2.5001: UDP, length 1470
00:09:24.010153 IP 10.0.0.1.35974 > 10.0.0.2.5001: UDP, length 1470
00:09:24.022253 IP 10.0.0.1.35974 > 10.0.0.2.5001: UDP, length 1470
00:09:24.034344 IP 10.0.0.1.35974 > 10.0.0.2.5001: UDP, length 1470
00:09:24.046442 IP 10.0.0.1.35974 > 10.0.0.2.5001: UDP, length 1470
00:09:24.058540 IP 10.0.0.1.35974 > 10.0.0.2.5001: UDP, length 1470
00:09:24.070625 IP 10.0.0.1.35974 > 10.0.0.2.5001: UDP, length 1470
00:09:24.082728 IP 10.0.0.1.35974 > 10.0.0.2.5001: UDP, length 1470
00:09:24.094917 IP 10.0.0.1.35974 > 10.0.0.2.5001: UDP, length 1470
00:09:24.106922 IP 10.0.0.1.35974 > 10.0.0.2.5001: UDP, length 1470
00:09:24.119039 IP 10.0.0.1.35974 > 10.0.0.2.5001: UDP, length 1470
00:09:24.131112 IP 10.0.0.1.35974 > 10.0.0.2.5001: UDP, length 1470
00:09:24.143209 IP 10.0.0.1.35974 > 10.0.0.2.5001: UDP, length 1470
00:09:24.155309 IP 10.0.0.1.35974 > 10.0.0.2.5001: UDP, length 1470
00:09:24.167402 IP 10.0.0.1.35974 > 10.0.0.2.5001: UDP, length 1470
00:09:24.179506 IP 10.0.0.1.35974 > 10.0.0.2.5001: UDP, length 1470
00:09:24.191597 IP 10.0.0.1.35974 > 10.0.0.2.5001: UDP, length 1470
00:09:24.203699 IP 10.0.0.1.35974 > 10.0.0.2.5001: UDP, length 1470
00:09:24.215786 IP 10.0.0.1.35974 > 10.0.0.2.5001: UDP, length 1470
00:09:24.227888 IP 10.0.0.1.35974 > 10.0.0.2.5001: UDP, length 1470
00:09:24.239983 IP 10.0.0.1.35974 > 10.0.0.2.5001: UDP, length 1470
00:09:24.252082 IP 10.0.0.1.35974 > 10.0.0.2.5001: UDP, length 1470
00:09:24.264169 IP 10.0.0.1.35974 > 10.0.0.2.5001: UDP, length 1470
00:09:24.276290 IP 10.0.0.1.35974 > 10.0.0.2.5001: UDP, length 1470
00:09:24.288359 IP 10.0.0.1.35974 > 10.0.0.2.5001: UDP, length 1470
00:09:24.300455 IP 10.0.0.1.35974 > 10.0.0.2.5001: UDP, length 1470
00:09:24.312555 IP 10.0.0.1.35974 > 10.0.0.2.5001: UDP, length 1470
00:09:24.324649 IP 10.0.0.1.35974 > 10.0.0.2.5001: UDP, length 1470
00:09:24.336745 IP 10.0.0.1.35974 > 10.0.0.2.5001: UDP, length 1470
00:09:24.349791 IP 10.0.0.1.35974 > 10.0.0.2.5001: UDP, length 1470
00:09:24.360925 IP 10.0.0.1.35974 > 10.0.0.2.5001: UDP, length 1470
00:09:24.373034 IP 10.0.0.1.35974 > 10.0.0.2.5001: UDP, length 1470
00:09:24.385131 IP 10.0.0.1.35974 > 10.0.0.2.5001: UDP, length 1470
00:09:24.397228 IP 10.0.0.1.35974 > 10.0.0.2.5001: UDP, length 1470
00:09:24.409968 IP 10.0.0.1.35974 > 10.0.0.2.5001: UDP, length 1470
00:09:24.421407 IP 10.0.0.1.35974 > 10.0.0.2.5001: UDP, length 1470
00:09:24.433499 IP 10.0.0.1.35974 > 10.0.0.2.5001: UDP, length 1470
00:09:24.445811 IP 10.0.0.1.35974 > 10.0.0.2.5001: UDP, length 1470
00:09:24.457700 IP 10.0.0.1.35974 > 10.0.0.2.5001: UDP, length 1470
00:09:24.469822 IP 10.0.0.1.35974 > 10.0.0.2.5001: UDP, length 1470
00:09:24.481910 IP 10.0.0.1.35974 > 10.0.0.2.5001: UDP, length 1470
00:09:24.493990 IP 10.0.0.1.35974 > 10.0.0.2.5001: UDP, length 1470
00:09:24.506087 IP 10.0.0.1.35974 > 10.0.0.2.5001: UDP, length 1470
00:09:24.518593 IP 10.0.0.1.35974 > 10.0.0.2.5001: UDP, length 1470
00:09:24.530283 IP 10.0.0.1.35974 > 10.0.0.2.5001: UDP, length 1470
00:09:24.542413 IP 10.0.0.1.35974 > 10.0.0.2.5001: UDP, length 1470
00:09:24.554467 IP 10.0.0.1.35974 > 10.0.0.2.5001: UDP, length 1470
00:09:24.566570 IP 10.0.0.1.35974 > 10.0.0.2.5001: UDP, length 1470
00:09:24.578669 IP 10.0.0.1.35974 > 10.0.0.2.5001: UDP, length 1470
00:09:24.590760 IP 10.0.0.1.35974 > 10.0.0.2.5001: UDP, length 1470
00:09:24.602863 IP 10.0.0.1.35974 > 10.0.0.2.5001: UDP, length 1470
00:09:24.614945 IP 10.0.0.1.35974 > 10.0.0.2.5001: UDP, length 1470
00:09:24.627065 IP 10.0.0.1.35974 > 10.0.0.2.5001: UDP, length 1470
00:09:24.639147 IP 10.0.0.1.35974 > 10.0.0.2.5001: UDP, length 1470
00:09:24.651263 IP 10.0.0.1.35974 > 10.0.0.2.5001: UDP, length 1470
00:09:24.663340 IP 10.0.0.1.35974 > 10.0.0.2.5001: UDP, length 1470
00:09:24.675430 IP 10.0.0.1.35974 > 10.0.0.2.5001: UDP, length 1470
00:09:24.687518 IP 10.0.0.1.35974 > 10.0.0.2.5001: UDP, length 1470
00:09:24.699612 IP 10.0.0.1.35974 > 10.0.0.2.5001: UDP, length 1470
00:09:24.711722 IP 10.0.0.1.35974 > 10.0.0.2.5001: UDP, length 1470
00:09:24.723813 IP 10.0.0.1.35974 > 10.0.0.2.5001: UDP, length 1470
00:09:24.735910 IP 10.0.0.1.35974 > 10.0.0.2.5001: UDP, length 1470
00:09:24.749481 IP 10.0.0.1.35974 > 10.0.0.2.5001: UDP, length 1470
00:09:24.760712 IP 10.0.0.1.35974 > 10.0.0.2.5001: UDP, length 1470
00:09:24.772204 IP 10.0.0.1.35974 > 10.0.0.2.5001: UDP, length 1470
00:09:24.784446 IP 10.0.0.1.35974 > 10.0.0.2.5001: UDP, length 1470
00:09:24.796397 IP 10.0.0.1.35974 > 10.0.0.2.5001: UDP, length 1470
00:09:24.808519 IP 10.0.0.1.35974 > 10.0.0.2.5001: UDP, length 1470
00:09:24.820597 IP 10.0.0.1.35974 > 10.0.0.2.5001: UDP, length 1470
00:09:24.832677 IP 10.0.0.1.35974 > 10.0.0.2.5001: UDP, length 1470
00:09:24.844793 IP 10.0.0.1.35974 > 10.0.0.2.5001: UDP, length 1470
00:09:24.857569 IP 10.0.0.1.35974 > 10.0.0.2.5001: UDP, length 1470
00:09:24.868993 IP 10.0.0.1.35974 > 10.0.0.2.5001: UDP, length 1470
00:09:24.881079 IP 10.0.0.1.35974 > 10.0.0.2.5001: UDP, length 1470
00:09:24.893161 IP 10.0.0.1.35974 > 10.0.0.2.5001: UDP, length 1470
00:09:24.905255 IP 10.0.0.1.35974 > 10.0.0.2.5001: UDP, length 1470
00:09:24.918111 IP 10.0.0.1.35974 > 10.0.0.2.5001: UDP, length 1470
00:09:24.929457 IP 10.0.0.1.35974 > 10.0.0.2.5001: UDP, length 1470
00:09:24.941570 IP 10.0.0.1.35974 > 10.0.0.2.5001: UDP, length 1470
00:09:24.953631 IP 10.0.0.1.35974 > 10.0.0.2.5001: UDP, length 1470
00:09:24.965739 IP 10.0.0.1.35974 > 10.0.0.2.5001: UDP, length 1470
00:09:24.977828 IP 10.0.0.1.35974 > 10.0.0.2.5001: UDP, length 1470
00:09:24.990682 IP 10.0.0.1.35974 > 10.0.0.2.5001: UDP, length 1470
00:09:25.002053 IP 10.0.0.1.35974 > 10.0.0.2.5001: UDP, length 1470
00:09:25.014112 IP 10.0.0.1.35974 > 10.0.0.2.5001: UDP, length 1470
00:09:25.026251 IP 10.0.0.1.35974 > 10.0.0.2.5001: UDP, length 1470
00:09:25.038314 IP 10.0.0.1.35974 > 10.0.0.2.5001: UDP, length 1470
00:09:25.050407 IP 10.0.0.1.35974 > 10.0.0.2.5001: UDP, length 1470
00:09:25.062503 IP 10.0.0.1.35974 > 10.0.0.2.5001: UDP, length 1470
00:09:25.074638 IP 10.0.0.1.35974 > 10.0.0.2.5001: UDP, length 1470
00:09:25.086710 IP 10.0.0.1.35974 > 10.0.0.2.5001: UDP, length 1470
00:09:25.098783 IP 10.0.0.1.35974 > 10.0.0.2.5001: UDP, length 1470
00:09:25.110892 IP 10.0.0.1.35974 > 10.0.0.2.5001: UDP, length 1470
00:09:25.122986 IP 10.0.0.1.35974 > 10.0.0.2.5001: UDP, length 1470
00:09:25.135109 IP 10.0.0.1.35974 > 10.0.0.2.5001: UDP, length 1470
00:09:25.147166 IP 10.0.0.1.35974 > 10.0.0.2.5001: UDP, length 1470
00:09:25.159273 IP 10.0.0.1.35974 > 10.0.0.2.5001: UDP, length 1470
00:09:25.171373 IP 10.0.0.1.35974 > 10.0.0.2.5001: UDP, length 1470
00:09:25.183465 IP 10.0.0.1.35974 > 10.0.0.2.5001: UDP, length 1470
00:09:25.195580 IP 10.0.0.1.35974 > 10.0.0.2.5001: UDP, length 1470
00:09:25.207665 IP 10.0.0.1.35974 > 10.0.0.2.5001: UDP, length 1470
00:09:25.220542 IP 10.0.0.1.35974 > 10.0.0.2.5001: UDP, length 1470
00:09:25.231847 IP 10.0.0.1.35974 > 10.0.0.2.5001: UDP, length 1470
00:09:25.243965 IP 10.0.0.1.35974 > 10.0.0.2.5001: UDP, length 1470
00:09:25.256043 IP 10.0.0.1.35974 > 10.0.0.2.5001: UDP, length 1470
00:09:25.268141 IP 10.0.0.1.35974 > 10.0.0.2.5001: UDP, length 1470
00:09:25.281125 IP 10.0.0.1.35974 > 10.0.0.2.5001: UDP, length 1470
00:09:25.292332 IP 10.0.0.1.35974 > 10.0.0.2.5001: UDP, length 1470
00:09:25.305247 IP 10.0.0.1.35974 > 10.0.0.2.5001: UDP, length 1470
00:09:25.316520 IP 10.0.0.1.35974 > 10.0.0.2.5001: UDP, length 1470
00:09:25.328628 IP 10.0.0.1.35974 > 10.0.0.2.5001: UDP, length 1470
00:09:25.340717 IP 10.0.0.1.35974 > 10.0.0.2.5001: UDP, length 1470
00:09:25.352815 IP 10.0.0.1.35974 > 10.0.0.2.5001: UDP, length 1470
00:09:25.364905 IP 10.0.0.1.35974 > 10.0.0.2.5001: UDP, length 1470
00:09:25.377011 IP 10.0.0.1.35974 > 10.0.0.2.5001: UDP, length 1470
00:09:25.389078 IP 10.0.0.1.35974 > 10.0.0.2.5001: UDP, length 1470
00:09:25.401187 IP 10.0.0.1.35974 > 10.0.0.2.5001: UDP, length 1470
00:09:25.413300 IP 10.0.0.1.35974 > 10.0.0.2.5001: UDP, length 1470
00:09:25.425384 IP 10.0.0.1.35974 > 10.0.0.2.5001: UDP, length 1470
00:09:25.437483 IP 10.0.0.1.35974 > 10.0.0.2.5001: UDP, length 1470
00:09:25.449577 IP 10.0.0.1.35974 > 10.0.0.2.5001: UDP, length 1470
00:09:25.461682 IP 10.0.0.1.35974 > 10.0.0.2.5001: UDP, length 1470
00:09:25.473811 IP 10.0.0.1.35974 > 10.0.0.2.5001: UDP, length 1470
00:09:25.485868 IP 10.0.0.1.35974 > 10.0.0.2.5001: UDP, length 1470
00:09:25.497962 IP 10.0.0.1.35974 > 10.0.0.2.5001: UDP, length 1470
00:09:25.510692 IP 10.0.0.1.35974 > 10.0.0.2.5001: UDP, length 1470
00:09:25.522175 IP 10.0.0.1.35974 > 10.0.0.2.5001: UDP, length 1470
00:09:25.534984 IP 10.0.0.1.35974 > 10.0.0.2.5001: UDP, length 1470
00:09:25.546348 IP 10.0.0.1.35974 > 10.0.0.2.5001: UDP, length 1470
00:09:25.558442 IP 10.0.0.1.35974 > 10.0.0.2.5001: UDP, length 1470
00:09:25.570533 IP 10.0.0.1.35974 > 10.0.0.2.5001: UDP, length 1470
00:09:25.582635 IP 10.0.0.1.35974 > 10.0.0.2.5001: UDP, length 1470
00:09:25.594735 IP 10.0.0.1.35974 > 10.0.0.2.5001: UDP, length 1470
00:09:25.606820 IP 10.0.0.1.35974 > 10.0.0.2.5001: UDP, length 1470
00:09:25.618942 IP 10.0.0.1.35974 > 10.0.0.2.5001: UDP, length 1470
00:09:25.631018 IP 10.0.0.1.35974 > 10.0.0.2.5001: UDP, length 1470
00:09:25.643113 IP 10.0.0.1.35974 > 10.0.0.2.5001: UDP, length 1470
00:09:25.655212 IP 10.0.0.1.35974 > 10.0.0.2.5001: UDP, length 1470
00:09:25.667310 IP 10.0.0.1.35974 > 10.0.0.2.5001: UDP, length 1470
00:09:25.680292 IP 10.0.0.1.35974 > 10.0.0.2.5001: UDP, length 1470
00:09:25.691492 IP 10.0.0.1.35974 > 10.0.0.2.5001: UDP, length 1470
00:09:25.703592 IP 10.0.0.1.35974 > 10.0.0.2.5001: UDP, length 1470
00:09:25.716439 IP 10.0.0.1.35974 > 10.0.0.2.5001: UDP, length 1470
00:09:25.727781 IP 10.0.0.1.35974 > 10.0.0.2.5001: UDP, length 1470
00:09:25.739880 IP 10.0.0.1.35974 > 10.0.0.2.5001: UDP, length 1470
00:09:25.751998 IP 10.0.0.1.35974 > 10.0.0.2.5001: UDP, length 1470
00:09:25.764085 IP 10.0.0.1.35974 > 10.0.0.2.5001: UDP, length 1470
00:09:25.776195 IP 10.0.0.1.35974 > 10.0.0.2.5001: UDP, length 1470
00:09:25.788250 IP 10.0.0.1.35974 > 10.0.0.2.5001: UDP, length 1470
00:09:25.800360 IP 10.0.0.1.35974 > 10.0.0.2.5001: UDP, length 1470
00:09:25.813216 IP 10.0.0.1.35974 > 10.0.0.2.5001: UDP, length 1470
00:09:25.824555 IP 10.0.0.1.35974 > 10.0.0.2.5001: UDP, length 1470
00:09:25.836661 IP 10.0.0.1.35974 > 10.0.0.2.5001: UDP, length 1470
00:09:25.848736 IP 10.0.0.1.35974 > 10.0.0.2.5001: UDP, length 1470
00:09:25.860853 IP 10.0.0.1.35974 > 10.0.0.2.5001: UDP, length 1470
00:09:25.872938 IP 10.0.0.1.35974 > 10.0.0.2.5001: UDP, length 1470
00:09:25.885032 IP 10.0.0.1.35974 > 10.0.0.2.5001: UDP, length 1470
00:09:25.897156 IP 10.0.0.1.35974 > 10.0.0.2.5001: UDP, length 1470
00:09:25.909238 IP 10.0.0.1.35974 > 10.0.0.2.5001: UDP, length 1470
00:09:25.921326 IP 10.0.0.1.35974 > 10.0.0.2.5001: UDP, length 1470
00:09:25.933417 IP 10.0.0.1.35974 > 10.0.0.2.5001: UDP, length 1470
00:09:25.945520 IP 10.0.0.1.35974 > 10.0.0.2.5001: UDP, length 1470
00:09:25.957612 IP 10.0.0.1.35974 > 10.0.0.2.5001: UDP, length 1470
00:09:25.969730 IP 10.0.0.1.35974 > 10.0.0.2.5001: UDP, length 1470
00:09:25.981803 IP 10.0.0.1.35974 > 10.0.0.2.5001: UDP, length 1470
00:09:25.993918 IP 10.0.0.1.35974 > 10.0.0.2.5001: UDP, length 1470
00:09:26.005993 IP 10.0.0.1.35974 > 10.0.0.2.5001: UDP, length 1470
00:09:26.018090 IP 10.0.0.1.35974 > 10.0.0.2.5001: UDP, length 1470
00:09:26.030200 IP 10.0.0.1.35974 > 10.0.0.2.5001: UDP, length 1470
00:09:26.042285 IP 10.0.0.1.35974 > 10.0.0.2.5001: UDP, length 1470
00:09:26.054381 IP 10.0.0.1.35974 > 10.0.0.2.5001: UDP, length 1470
00:09:26.066473 IP 10.0.0.1.35974 > 10.0.0.2.5001: UDP, length 1470
00:09:26.078576 IP 10.0.0.1.35974 > 10.0.0.2.5001: UDP, length 1470
00:09:26.090701 IP 10.0.0.1.35974 > 10.0.0.2.5001: UDP, length 1470
00:09:26.102754 IP 10.0.0.1.35974 > 10.0.0.2.5001: UDP, length 1470
00:09:26.114858 IP 10.0.0.1.35974 > 10.0.0.2.5001: UDP, length 1470
00:09:26.126962 IP 10.0.0.1.35974 > 10.0.0.2.5001: UDP, length 1470
00:09:26.139049 IP 10.0.0.1.35974 > 10.0.0.2.5001: UDP, length 1470
00:09:26.151173 IP 10.0.0.1.35974 > 10.0.0.2.5001: UDP, length 1470
00:09:26.163241 IP 10.0.0.1.35974 > 10.0.0.2.5001: UDP, length 1470
00:09:26.176092 IP 10.0.0.1.35974 > 10.0.0.2.5001: UDP, length 1470
00:09:26.187433 IP 10.0.0.1.35974 > 10.0.0.2.5001: UDP, length 1470
00:09:26.199532 IP 10.0.0.1.35974 > 10.0.0.2.5001: UDP, length 1470
00:09:26.211696 IP 10.0.0.1.35974 > 10.0.0.2.5001: UDP, length 1470
00:09:26.223733 IP 10.0.0.1.35974 > 10.0.0.2.5001: UDP, length 1470
00:09:26.235825 IP 10.0.0.1.35974 > 10.0.0.2.5001: UDP, length 1470
00:09:26.247915 IP 10.0.0.1.35974 > 10.0.0.2.5001: UDP, length 1470
00:09:26.260750 IP 10.0.0.1.35974 > 10.0.0.2.5001: UDP, length 1470
00:09:26.272108 IP 10.0.0.1.35974 > 10.0.0.2.5001: UDP, length 1470
00:09:26.284224 IP 10.0.0.1.35974 > 10.0.0.2.5001: UDP, length 1470
00:09:26.296300 IP 10.0.0.1.35974 > 10.0.0.2.5001: UDP, length 1470
00:09:26.308396 IP 10.0.0.1.35974 > 10.0.0.2.5001: UDP, length 1470
00:09:26.320484 IP 10.0.0.1.35974 > 10.0.0.2.5001: UDP, length 1470
00:09:26.332586 IP 10.0.0.1.35974 > 10.0.0.2.5001: UDP, length 1470
00:09:26.344701 IP 10.0.0.1.35974 > 10.0.0.2.5001: UDP, length 1470
00:09:26.356771 IP 10.0.0.1.35974 > 10.0.0.2.5001: UDP, length 1470
00:09:26.368854 IP 10.0.0.1.35974 > 10.0.0.2.5001: UDP, length 1470
00:09:26.380970 IP 10.0.0.1.35974 > 10.0.0.2.5001: UDP, length 1470
00:09:26.393067 IP 10.0.0.1.35974 > 10.0.0.2.5001: UDP, length 1470
00:09:26.405162 IP 10.0.0.1.35974 > 10.0.0.2.5001: UDP, length 1470
00:09:26.417282 IP 10.0.0.1.35974 > 10.0.0.2.5001: UDP, length 1470
00:09:26.429372 IP 10.0.0.1.35974 > 10.0.0.2.5001: UDP, length 1470
00:09:26.441451 IP 10.0.0.1.35974 > 10.0.0.2.5001: UDP, length 1470
00:09:26.453536 IP 10.0.0.1.35974 > 10.0.0.2.5001: UDP, length 1470
00:09:26.465641 IP 10.0.0.1.35974 > 10.0.0.2.5001: UDP, length 1470
00:09:26.477766 IP 10.0.0.1.35974 > 10.0.0.2.5001: UDP, length 1470
00:09:26.489827 IP 10.0.0.1.35974 > 10.0.0.2.5001: UDP, length 1470
00:09:26.501941 IP 10.0.0.1.35974 > 10.0.0.2.5001: UDP, length 1470
00:09:26.514026 IP 10.0.0.1.35974 > 10.0.0.2.5001: UDP, length 1470
00:09:26.526146 IP 10.0.0.1.35974 > 10.0.0.2.5001: UDP, length 1470
00:09:26.538220 IP 10.0.0.1.35974 > 10.0.0.2.5001: UDP, length 1470
00:09:26.550639 IP 10.0.0.1.35974 > 10.0.0.2.5001: UDP, length 1470
00:09:26.562404 IP 10.0.0.1.35974 > 10.0.0.2.5001: UDP, length 1470
00:09:26.574493 IP 10.0.0.1.35974 > 10.0.0.2.5001: UDP, length 1470
00:09:26.586601 IP 10.0.0.1.35974 > 10.0.0.2.5001: UDP, length 1470
00:09:26.599428 IP 10.0.0.1.35974 > 10.0.0.2.5001: UDP, length 1470
00:09:26.610787 IP 10.0.0.1.35974 > 10.0.0.2.5001: UDP, length 1470
00:09:26.622890 IP 10.0.0.1.35974 > 10.0.0.2.5001: UDP, length 1470
00:09:26.634989 IP 10.0.0.1.35974 > 10.0.0.2.5001: UDP, length 1470
00:09:26.647084 IP 10.0.0.1.35974 > 10.0.0.2.5001: UDP, length 1470
00:09:26.659184 IP 10.0.0.1.35974 > 10.0.0.2.5001: UDP, length 1470
00:09:26.671298 IP 10.0.0.1.35974 > 10.0.0.2.5001: UDP, length 1470
00:09:26.683376 IP 10.0.0.1.35974 > 10.0.0.2.5001: UDP, length 1470
00:09:26.695458 IP 10.0.0.1.35974 > 10.0.0.2.5001: UDP, length 1470
00:09:26.707565 IP 10.0.0.1.35974 > 10.0.0.2.5001: UDP, length 1470
00:09:26.719695 IP 10.0.0.1.35974 > 10.0.0.2.5001: UDP, length 1470
00:09:26.731758 IP 10.0.0.1.35974 > 10.0.0.2.5001: UDP, length 1470
00:09:26.743856 IP 10.0.0.1.35974 > 10.0.0.2.5001: UDP, length 1470
00:09:26.755949 IP 10.0.0.1.35974 > 10.0.0.2.5001: UDP, length 1470
00:09:26.768043 IP 10.0.0.1.35974 > 10.0.0.2.5001: UDP, length 1470
00:09:26.780140 IP 10.0.0.1.35974 > 10.0.0.2.5001: UDP, length 1470
00:09:26.792229 IP 10.0.0.1.35974 > 10.0.0.2.5001: UDP, length 1470
00:09:26.804339 IP 10.0.0.1.35974 > 10.0.0.2.5001: UDP, length 1470
00:09:26.816452 IP 10.0.0.1.35974 > 10.0.0.2.5001: UDP, length 1470
00:09:26.828530 IP 10.0.0.1.35974 > 10.0.0.2.5001: UDP, length 1470
00:09:26.840611 IP 10.0.0.1.35974 > 10.0.0.2.5001: UDP, length 1470
00:09:26.852699 IP 10.0.0.1.35974 > 10.0.0.2.5001: UDP, length 1470
00:09:26.864825 IP 10.0.0.1.35974 > 10.0.0.2.5001: UDP, length 1470
00:09:26.876910 IP 10.0.0.1.35974 > 10.0.0.2.5001: UDP, length 1470
00:09:26.889005 IP 10.0.0.1.35974 > 10.0.0.2.5001: UDP, length 1470
00:09:26.901123 IP 10.0.0.1.35974 > 10.0.0.2.5001: UDP, length 1470
00:09:26.913192 IP 10.0.0.1.35974 > 10.0.0.2.5001: UDP, length 1470
00:09:26.925283 IP 10.0.0.1.35974 > 10.0.0.2.5001: UDP, length 1470
00:09:26.937375 IP 10.0.0.1.35974 > 10.0.0.2.5001: UDP, length 1470
00:09:26.949481 IP 10.0.0.1.35974 > 10.0.0.2.5001: UDP, length 1470
00:09:26.962315 IP 10.0.0.1.35974 > 10.0.0.2.5001: UDP, length 1470
00:09:26.973705 IP 10.0.0.1.35974 > 10.0.0.2.5001: UDP, length 1470
00:09:26.985776 IP 10.0.0.1.35974 > 10.0.0.2.5001: UDP, length 1470
00:09:26.997873 IP 10.0.0.1.35974 > 10.0.0.2.5001: UDP, length 1470
00:09:27.010874 IP 10.0.0.1.35974 > 10.0.0.2.5001: UDP, length 1470
00:09:27.022061 IP 10.0.0.1.35974 > 10.0.0.2.5001: UDP, length 1470
00:09:27.034155 IP 10.0.0.1.35974 > 10.0.0.2.5001: UDP, length 1470
00:09:27.046526 IP 10.0.0.1.35974 > 10.0.0.2.5001: UDP, length 1470
00:09:27.058365 IP 10.0.0.1.35974 > 10.0.0.2.5001: UDP, length 1470
00:09:27.070438 IP 10.0.0.1.35974 > 10.0.0.2.5001: UDP, length 1470
00:09:27.082537 IP 10.0.0.1.35974 > 10.0.0.2.5001: UDP, length 1470
00:09:27.094642 IP 10.0.0.1.35974 > 10.0.0.2.5001: UDP, length 1470
00:09:27.107478 IP 10.0.0.1.35974 > 10.0.0.2.5001: UDP, length 1470
00:09:27.118838 IP 10.0.0.1.35974 > 10.0.0.2.5001: UDP, length 1470
00:09:27.130913 IP 10.0.0.1.35974 > 10.0.0.2.5001: UDP, length 1470
00:09:27.143015 IP 10.0.0.1.35974 > 10.0.0.2.5001: UDP, length 1470
00:09:27.155116 IP 10.0.0.1.35974 > 10.0.0.2.5001: UDP, length 1470
00:09:27.167214 IP 10.0.0.1.35974 > 10.0.0.2.5001: UDP, length 1470
00:09:27.179303 IP 10.0.0.1.35974 > 10.0.0.2.5001: UDP, length 1470
00:09:27.191400 IP 10.0.0.1.35974 > 10.0.0.2.5001: UDP, length 1470
00:09:27.203494 IP 10.0.0.1.35974 > 10.0.0.2.5001: UDP, length 1470
00:09:27.215596 IP 10.0.0.1.35974 > 10.0.0.2.5001: UDP, length 1470
00:09:27.227691 IP 10.0.0.1.35974 > 10.0.0.2.5001: UDP, length 1470
00:09:27.239789 IP 10.0.0.1.35974 > 10.0.0.2.5001: UDP, length 1470
00:09:27.251881 IP 10.0.0.1.35974 > 10.0.0.2.5001: UDP, length 1470
00:09:27.263978 IP 10.0.0.1.35974 > 10.0.0.2.5001: UDP, length 1470
00:09:27.276861 IP 10.0.0.1.35974 > 10.0.0.2.5001: UDP, length 1470
00:09:27.288162 IP 10.0.0.1.35974 > 10.0.0.2.5001: UDP, length 1470
00:09:27.300258 IP 10.0.0.1.35974 > 10.0.0.2.5001: UDP, length 1470
00:09:27.312355 IP 10.0.0.1.35974 > 10.0.0.2.5001: UDP, length 1470
00:09:27.325248 IP 10.0.0.1.35974 > 10.0.0.2.5001: UDP, length 1470
00:09:27.336553 IP 10.0.0.1.35974 > 10.0.0.2.5001: UDP, length 1470
00:09:27.348644 IP 10.0.0.1.35974 > 10.0.0.2.5001: UDP, length 1470
00:09:27.360740 IP 10.0.0.1.35974 > 10.0.0.2.5001: UDP, length 1470
00:09:27.372828 IP 10.0.0.1.35974 > 10.0.0.2.5001: UDP, length 1470
00:09:27.384945 IP 10.0.0.1.35974 > 10.0.0.2.5001: UDP, length 1470
00:09:27.397037 IP 10.0.0.1.35974 > 10.0.0.2.5001: UDP, length 1470
00:09:27.409135 IP 10.0.0.1.35974 > 10.0.0.2.5001: UDP, length 1470
00:09:27.421227 IP 10.0.0.1.35974 > 10.0.0.2.5001: UDP, length 1470
00:09:27.433316 IP 10.0.0.1.35974 > 10.0.0.2.5001: UDP, length 1470
00:09:27.445415 IP 10.0.0.1.35974 > 10.0.0.2.5001: UDP, length 1470
00:09:27.457514 IP 10.0.0.1.35974 > 10.0.0.2.5001: UDP, length 1470
00:09:27.469621 IP 10.0.0.1.35974 > 10.0.0.2.5001: UDP, length 1470
00:09:27.481707 IP 10.0.0.1.35974 > 10.0.0.2.5001: UDP, length 1470
00:09:27.493825 IP 10.0.0.1.35974 > 10.0.0.2.5001: UDP, length 1470
00:09:27.505898 IP 10.0.0.1.35974 > 10.0.0.2.5001: UDP, length 1470
00:09:27.517991 IP 10.0.0.1.35974 > 10.0.0.2.5001: UDP, length 1470
00:09:27.530093 IP 10.0.0.1.35974 > 10.0.0.2.5001: UDP, length 1470
00:09:27.542186 IP 10.0.0.1.35974 > 10.0.0.2.5001: UDP, length 1470
00:09:27.554287 IP 10.0.0.1.35974 > 10.0.0.2.5001: UDP, length 1470
00:09:27.566376 IP 10.0.0.1.35974 > 10.0.0.2.5001: UDP, length 1470
00:09:27.578479 IP 10.0.0.1.35974 > 10.0.0.2.5001: UDP, length 1470
00:09:27.590561 IP 10.0.0.1.35974 > 10.0.0.2.5001: UDP, length 1470
00:09:27.602663 IP 10.0.0.1.35974 > 10.0.0.2.5001: UDP, length 1470
00:09:27.614762 IP 10.0.0.1.35974 > 10.0.0.2.5001: UDP, length 1470
00:09:27.626864 IP 10.0.0.1.35974 > 10.0.0.2.5001: UDP, length 1470
00:09:27.638971 IP 10.0.0.1.35974 > 10.0.0.2.5001: UDP, length 1470
00:09:27.651075 IP 10.0.0.1.35974 > 10.0.0.2.5001: UDP, length 1470
00:09:27.663152 IP 10.0.0.1.35974 > 10.0.0.2.5001: UDP, length 1470
00:09:27.675235 IP 10.0.0.1.35974 > 10.0.0.2.5001: UDP, length 1470
00:09:27.687337 IP 10.0.0.1.35974 > 10.0.0.2.5001: UDP, length 1470
00:09:27.699438 IP 10.0.0.1.35974 > 10.0.0.2.5001: UDP, length 1470
00:09:27.711539 IP 10.0.0.1.35974 > 10.0.0.2.5001: UDP, length 1470
00:09:27.723629 IP 10.0.0.1.35974 > 10.0.0.2.5001: UDP, length 1470
00:09:27.735725 IP 10.0.0.1.35974 > 10.0.0.2.5001: UDP, length 1470
00:09:27.747817 IP 10.0.0.1.35974 > 10.0.0.2.5001: UDP, length 1470
00:09:27.759906 IP 10.0.0.1.35974 > 10.0.0.2.5001: UDP, length 1470
00:09:27.772038 IP 10.0.0.1.35974 > 10.0.0.2.5001: UDP, length 1470
00:09:27.784097 IP 10.0.0.1.35974 > 10.0.0.2.5001: UDP, length 1470
00:09:27.796209 IP 10.0.0.1.35974 > 10.0.0.2.5001: UDP, length 1470
00:09:27.808300 IP 10.0.0.1.35974 > 10.0.0.2.5001: UDP, length 1470
00:09:27.820391 IP 10.0.0.1.35974 > 10.0.0.2.5001: UDP, length 1470
00:09:27.833355 IP 10.0.0.1.35974 > 10.0.0.2.5001: UDP, length 1470
00:09:27.844584 IP 10.0.0.1.35974 > 10.0.0.2.5001: UDP, length 1470
00:09:27.856683 IP 10.0.0.1.35974 > 10.0.0.2.5001: UDP, length 1470
00:09:27.868786 IP 10.0.0.1.35974 > 10.0.0.2.5001: UDP, length 1470
00:09:27.881624 IP 10.0.0.1.35974 > 10.0.0.2.5001: UDP, length 1470
00:09:27.892963 IP 10.0.0.1.35974 > 10.0.0.2.5001: UDP, length 1470
00:09:27.905086 IP 10.0.0.1.35974 > 10.0.0.2.5001: UDP, length 1470
00:09:27.917164 IP 10.0.0.1.35974 > 10.0.0.2.5001: UDP, length 1470
00:09:27.930104 IP 10.0.0.1.35974 > 10.0.0.2.5001: UDP, length 1470
00:09:27.941353 IP 10.0.0.1.35974 > 10.0.0.2.5001: UDP, length 1470
00:09:27.953457 IP 10.0.0.1.35974 > 10.0.0.2.5001: UDP, length 1470
00:09:27.965570 IP 10.0.0.1.35974 > 10.0.0.2.5001: UDP, length 1470
00:09:27.977652 IP 10.0.0.1.35974 > 10.0.0.2.5001: UDP, length 1470
00:09:27.989741 IP 10.0.0.1.35974 > 10.0.0.2.5001: UDP, length 1470
00:09:28.001854 IP 10.0.0.1.35974 > 10.0.0.2.5001: UDP, length 1470
00:09:28.013928 IP 10.0.0.1.35974 > 10.0.0.2.5001: UDP, length 1470
00:09:28.026025 IP 10.0.0.1.35974 > 10.0.0.2.5001: UDP, length 1470
00:09:28.038118 IP 10.0.0.1.35974 > 10.0.0.2.5001: UDP, length 1470
00:09:28.050212 IP 10.0.0.1.35974 > 10.0.0.2.5001: UDP, length 1470
00:09:28.062429 IP 10.0.0.1.35974 > 10.0.0.2.5001: UDP, length 1470
00:09:28.074409 IP 10.0.0.1.35974 > 10.0.0.2.5001: UDP, length 1470
00:09:28.086505 IP 10.0.0.1.35974 > 10.0.0.2.5001: UDP, length 1470
00:09:28.099439 IP 10.0.0.1.35974 > 10.0.0.2.5001: UDP, length 1470
00:09:28.110706 IP 10.0.0.1.35974 > 10.0.0.2.5001: UDP, length 1470
00:09:28.122798 IP 10.0.0.1.35974 > 10.0.0.2.5001: UDP, length 1470
00:09:28.134890 IP 10.0.0.1.35974 > 10.0.0.2.5001: UDP, length 1470
00:09:28.146988 IP 10.0.0.1.35974 > 10.0.0.2.5001: UDP, length 1470
00:09:28.159093 IP 10.0.0.1.35974 > 10.0.0.2.5001: UDP, length 1470
00:09:28.171180 IP 10.0.0.1.35974 > 10.0.0.2.5001: UDP, length 1470
00:09:28.183275 IP 10.0.0.1.35974 > 10.0.0.2.5001: UDP, length 1470
00:09:28.195364 IP 10.0.0.1.35974 > 10.0.0.2.5001: UDP, length 1470
00:09:28.207469 IP 10.0.0.1.35974 > 10.0.0.2.5001: UDP, length 1470
00:09:28.219575 IP 10.0.0.1.35974 > 10.0.0.2.5001: UDP, length 1470
00:09:28.231647 IP 10.0.0.1.35974 > 10.0.0.2.5001: UDP, length 1470
00:09:28.243767 IP 10.0.0.1.35974 > 10.0.0.2.5001: UDP, length 1470
00:09:28.255851 IP 10.0.0.1.35974 > 10.0.0.2.5001: UDP, length 1470
00:09:28.267944 IP 10.0.0.1.35974 > 10.0.0.2.5001: UDP, length 1470
00:09:28.280049 IP 10.0.0.1.35974 > 10.0.0.2.5001: UDP, length 1470
00:09:28.293047 IP 10.0.0.1.35974 > 10.0.0.2.5001: UDP, length 1470
00:09:28.304237 IP 10.0.0.1.35974 > 10.0.0.2.5001: UDP, length 1470
00:09:28.316330 IP 10.0.0.1.35974 > 10.0.0.2.5001: UDP, length 1470
00:09:28.329155 IP 10.0.0.1.35974 > 10.0.0.2.5001: UDP, length 1470
00:09:28.340515 IP 10.0.0.1.35974 > 10.0.0.2.5001: UDP, length 1470
00:09:28.352616 IP 10.0.0.1.35974 > 10.0.0.2.5001: UDP, length 1470
00:09:28.364715 IP 10.0.0.1.35974 > 10.0.0.2.5001: UDP, length 1470
00:09:28.376825 IP 10.0.0.1.35974 > 10.0.0.2.5001: UDP, length 1470
00:09:28.388898 IP 10.0.0.1.35974 > 10.0.0.2.5001: UDP, length 1470
00:09:28.400996 IP 10.0.0.1.35974 > 10.0.0.2.5001: UDP, length 1470
00:09:28.413095 IP 10.0.0.1.35974 > 10.0.0.2.5001: UDP, length 1470
00:09:28.425632 IP 10.0.0.1.35974 > 10.0.0.2.5001: UDP, length 1470
00:09:28.437290 IP 10.0.0.1.35974 > 10.0.0.2.5001: UDP, length 1470
00:09:28.449386 IP 10.0.0.1.35974 > 10.0.0.2.5001: UDP, length 1470
00:09:28.461479 IP 10.0.0.1.35974 > 10.0.0.2.5001: UDP, length 1470
00:09:28.473594 IP 10.0.0.1.35974 > 10.0.0.2.5001: UDP, length 1470
00:09:28.485667 IP 10.0.0.1.35974 > 10.0.0.2.5001: UDP, length 1470
00:09:28.497771 IP 10.0.0.1.35974 > 10.0.0.2.5001: UDP, length 1470
00:09:28.509869 IP 10.0.0.1.35974 > 10.0.0.2.5001: UDP, length 1470
00:09:28.521966 IP 10.0.0.1.35974 > 10.0.0.2.5001: UDP, length 1470
00:09:28.534071 IP 10.0.0.1.35974 > 10.0.0.2.5001: UDP, length 1470
00:09:28.546150 IP 10.0.0.1.35974 > 10.0.0.2.5001: UDP, length 1470
00:09:28.558251 IP 10.0.0.1.35974 > 10.0.0.2.5001: UDP, length 1470
00:09:28.570345 IP 10.0.0.1.35974 > 10.0.0.2.5001: UDP, length 1470
00:09:28.582436 IP 10.0.0.1.35974 > 10.0.0.2.5001: UDP, length 1470
00:09:28.594540 IP 10.0.0.1.35974 > 10.0.0.2.5001: UDP, length 1470
00:09:28.606632 IP 10.0.0.1.35974 > 10.0.0.2.5001: UDP, length 1470
00:09:28.618759 IP 10.0.0.1.35974 > 10.0.0.2.5001: UDP, length 1470
00:09:28.630827 IP 10.0.0.1.35974 > 10.0.0.2.5001: UDP, length 1470
00:09:28.642920 IP 10.0.0.1.35974 > 10.0.0.2.5001: UDP, length 1470
00:09:28.655019 IP 10.0.0.1.35974 > 10.0.0.2.5001: UDP, length 1470
00:09:28.667130 IP 10.0.0.1.35974 > 10.0.0.2.5001: UDP, length 1470
00:09:28.679218 IP 10.0.0.1.35974 > 10.0.0.2.5001: UDP, length 1470
00:09:28.691307 IP 10.0.0.1.35974 > 10.0.0.2.5001: UDP, length 1470
00:09:28.703409 IP 10.0.0.1.35974 > 10.0.0.2.5001: UDP, length 1470
00:09:28.715493 IP 10.0.0.1.35974 > 10.0.0.2.5001: UDP, length 1470
00:09:28.727596 IP 10.0.0.1.35974 > 10.0.0.2.5001: UDP, length 1470
00:09:28.739687 IP 10.0.0.1.35974 > 10.0.0.2.5001: UDP, length 1470
00:09:28.752542 IP 10.0.0.1.35974 > 10.0.0.2.5001: UDP, length 1470
00:09:28.763882 IP 10.0.0.1.35974 > 10.0.0.2.5001: UDP, length 1470
00:09:28.776004 IP 10.0.0.1.35974 > 10.0.0.2.5001: UDP, length 1470
00:09:28.788557 IP 10.0.0.1.35974 > 10.0.0.2.5001: UDP, length 1470
00:09:28.800156 IP 10.0.0.1.35974 > 10.0.0.2.5001: UDP, length 1470
00:09:28.812271 IP 10.0.0.1.35974 > 10.0.0.2.5001: UDP, length 1470
00:09:28.825164 IP 10.0.0.1.35974 > 10.0.0.2.5001: UDP, length 1470
00:09:28.836459 IP 10.0.0.1.35974 > 10.0.0.2.5001: UDP, length 1470
00:09:28.848558 IP 10.0.0.1.35974 > 10.0.0.2.5001: UDP, length 1470
00:09:28.860681 IP 10.0.0.1.35974 > 10.0.0.2.5001: UDP, length 1470
00:09:28.872736 IP 10.0.0.1.35974 > 10.0.0.2.5001: UDP, length 1470
00:09:28.885580 IP 10.0.0.1.35974 > 10.0.0.2.5001: UDP, length 1470
00:09:28.896942 IP 10.0.0.1.35974 > 10.0.0.2.5001: UDP, length 1470
00:09:28.909035 IP 10.0.0.1.35974 > 10.0.0.2.5001: UDP, length 1470
00:09:28.921122 IP 10.0.0.1.35974 > 10.0.0.2.5001: UDP, length 1470
00:09:28.933216 IP 10.0.0.1.35974 > 10.0.0.2.5001: UDP, length 1470
00:09:28.945316 IP 10.0.0.1.35974 > 10.0.0.2.5001: UDP, length 1470
00:09:28.957420 IP 10.0.0.1.35974 > 10.0.0.2.5001: UDP, length 1470
00:09:28.969540 IP 10.0.0.1.35974 > 10.0.0.2.5001: UDP, length 1470
00:09:28.981641 IP 10.0.0.1.35974 > 10.0.0.2.5001: UDP, length 1470
00:09:28.994497 IP 10.0.0.1.35974 > 10.0.0.2.5001: UDP, length 1470
00:09:29.005807 IP 10.0.0.1.35974 > 10.0.0.2.5001: UDP, length 1470
00:09:29.017893 IP 10.0.0.1.35974 > 10.0.0.2.5001: UDP, length 1470
00:09:29.029996 IP 10.0.0.1.35974 > 10.0.0.2.5001: UDP, length 1470
00:09:29.042114 IP 10.0.0.1.35974 > 10.0.0.2.5001: UDP, length 1470
00:09:29.054205 IP 10.0.0.1.35974 > 10.0.0.2.5001: UDP, length 1470
00:09:29.066282 IP 10.0.0.1.35974 > 10.0.0.2.5001: UDP, length 1470
00:09:29.078363 IP 10.0.0.1.35974 > 10.0.0.2.5001: UDP, length 1470
00:09:29.090473 IP 10.0.0.1.35974 > 10.0.0.2.5001: UDP, length 1470
00:09:29.102575 IP 10.0.0.1.35974 > 10.0.0.2.5001: UDP, length 1470
00:09:29.114674 IP 10.0.0.1.35974 > 10.0.0.2.5001: UDP, length 1470
00:09:29.126774 IP 10.0.0.1.35974 > 10.0.0.2.5001: UDP, length 1470
00:09:29.139648 IP 10.0.0.1.35974 > 10.0.0.2.5001: UDP, length 1470
00:09:29.150963 IP 10.0.0.1.35974 > 10.0.0.2.5001: UDP, length 1470
00:09:29.163050 IP 10.0.0.1.35974 > 10.0.0.2.5001: UDP, length 1470
00:09:29.175715 IP 10.0.0.1.35974 > 10.0.0.2.5001: UDP, length 1470
00:09:29.187246 IP 10.0.0.1.35974 > 10.0.0.2.5001: UDP, length 1470
00:09:29.199338 IP 10.0.0.1.35974 > 10.0.0.2.5001: UDP, length 1470
00:09:29.212144 IP 10.0.0.1.35974 > 10.0.0.2.5001: UDP, length 1470
00:09:29.223530 IP 10.0.0.1.35974 > 10.0.0.2.5001: UDP, length 1470
00:09:29.235635 IP 10.0.0.1.35974 > 10.0.0.2.5001: UDP, length 1470
00:09:29.247710 IP 10.0.0.1.35974 > 10.0.0.2.5001: UDP, length 1470
00:09:29.259818 IP 10.0.0.1.35974 > 10.0.0.2.5001: UDP, length 1470
00:09:29.272653 IP 10.0.0.1.35974 > 10.0.0.2.5001: UDP, length 1470
00:09:29.284010 IP 10.0.0.1.35974 > 10.0.0.2.5001: UDP, length 1470
00:09:29.296135 IP 10.0.0.1.35974 > 10.0.0.2.5001: UDP, length 1470
00:09:29.308193 IP 10.0.0.1.35974 > 10.0.0.2.5001: UDP, length 1470
00:09:29.320316 IP 10.0.0.1.35974 > 10.0.0.2.5001: UDP, length 1470
00:09:29.332385 IP 10.0.0.1.35974 > 10.0.0.2.5001: UDP, length 1470
00:09:29.344502 IP 10.0.0.1.35974 > 10.0.0.2.5001: UDP, length 1470
00:09:29.356587 IP 10.0.0.1.35974 > 10.0.0.2.5001: UDP, length 1470
00:09:29.368696 IP 10.0.0.1.35974 > 10.0.0.2.5001: UDP, length 1470
00:09:29.380781 IP 10.0.0.1.35974 > 10.0.0.2.5001: UDP, length 1470
00:09:29.392871 IP 10.0.0.1.35974 > 10.0.0.2.5001: UDP, length 1470
00:09:29.404970 IP 10.0.0.1.35974 > 10.0.0.2.5001: UDP, length 1470
00:09:29.417064 IP 10.0.0.1.35974 > 10.0.0.2.5001: UDP, length 1470
00:09:29.429182 IP 10.0.0.1.35974 > 10.0.0.2.5001: UDP, length 1470
00:09:29.441262 IP 10.0.0.1.35974 > 10.0.0.2.5001: UDP, length 1470
00:09:29.453339 IP 10.0.0.1.35974 > 10.0.0.2.5001: UDP, length 1470
00:09:29.465449 IP 10.0.0.1.35974 > 10.0.0.2.5001: UDP, length 1470
00:09:29.477541 IP 10.0.0.1.35974 > 10.0.0.2.5001: UDP, length 1470
00:09:29.489638 IP 10.0.0.1.35974 > 10.0.0.2.5001: UDP, length 1470
00:09:29.501750 IP 10.0.0.1.35974 > 10.0.0.2.5001: UDP, length 1470
00:09:29.513836 IP 10.0.0.1.35974 > 10.0.0.2.5001: UDP, length 1470
00:09:29.525938 IP 10.0.0.1.35974 > 10.0.0.2.5001: UDP, length 1470
00:09:29.538029 IP 10.0.0.1.35974 > 10.0.0.2.5001: UDP, length 1470
00:09:29.550127 IP 10.0.0.1.35974 > 10.0.0.2.5001: UDP, length 1470
00:09:29.562223 IP 10.0.0.1.35974 > 10.0.0.2.5001: UDP, length 1470
00:09:29.574308 IP 10.0.0.1.35974 > 10.0.0.2.5001: UDP, length 1470
00:09:29.586409 IP 10.0.0.1.35974 > 10.0.0.2.5001: UDP, length 1470
00:09:29.598691 IP 10.0.0.1.35974 > 10.0.0.2.5001: UDP, length 1470
00:09:29.610613 IP 10.0.0.1.35974 > 10.0.0.2.5001: UDP, length 1470
00:09:29.622740 IP 10.0.0.1.35974 > 10.0.0.2.5001: UDP, length 1470
00:09:29.635621 IP 10.0.0.1.35974 > 10.0.0.2.5001: UDP, length 1470
00:09:29.646883 IP 10.0.0.1.35974 > 10.0.0.2.5001: UDP, length 1470
00:09:29.658988 IP 10.0.0.1.35974 > 10.0.0.2.5001: UDP, length 1470
00:09:29.671995 IP 10.0.0.1.35974 > 10.0.0.2.5001: UDP, length 1470
00:09:29.683171 IP 10.0.0.1.35974 > 10.0.0.2.5001: UDP, length 1470
00:09:29.695272 IP 10.0.0.1.35974 > 10.0.0.2.5001: UDP, length 1470
00:09:29.707372 IP 10.0.0.1.35974 > 10.0.0.2.5001: UDP, length 1470
00:09:29.720260 IP 10.0.0.1.35974 > 10.0.0.2.5001: UDP, length 1470
00:09:29.731563 IP 10.0.0.1.35974 > 10.0.0.2.5001: UDP, length 1470
00:09:29.743655 IP 10.0.0.1.35974 > 10.0.0.2.5001: UDP, length 1470
00:09:29.755753 IP 10.0.0.1.35974 > 10.0.0.2.5001: UDP, length 1470
00:09:29.767863 IP 10.0.0.1.35974 > 10.0.0.2.5001: UDP, length 1470
00:09:29.779947 IP 10.0.0.1.35974 > 10.0.0.2.5001: UDP, length 1470
00:09:29.792847 IP 10.0.0.1.35974 > 10.0.0.2.5001: UDP, length 1470
00:09:29.804138 IP 10.0.0.1.35974 > 10.0.0.2.5001: UDP, length 1470
00:09:29.816236 IP 10.0.0.1.35974 > 10.0.0.2.5001: UDP, length 1470
00:09:29.828338 IP 10.0.0.1.35974 > 10.0.0.2.5001: UDP, length 1470
00:09:29.840453 IP 10.0.0.1.35974 > 10.0.0.2.5001: UDP, length 1470
00:09:29.852524 IP 10.0.0.1.35974 > 10.0.0.2.5001: UDP, length 1470
00:09:29.864622 IP 10.0.0.1.35974 > 10.0.0.2.5001: UDP, length 1470
00:09:29.876739 IP 10.0.0.1.35974 > 10.0.0.2.5001: UDP, length 1470
00:09:29.888809 IP 10.0.0.1.35974 > 10.0.0.2.5001: UDP, length 1470
00:09:29.900916 IP 10.0.0.1.35974 > 10.0.0.2.5001: UDP, length 1470
00:09:29.913006 IP 10.0.0.1.35974 > 10.0.0.2.5001: UDP, length 1470
00:09:29.925099 IP 10.0.0.1.35974 > 10.0.0.2.5001: UDP, length 1470
00:09:29.937189 IP 10.0.0.1.35974 > 10.0.0.2.5001: UDP, length 1470
00:09:29.949299 IP 10.0.0.1.35974 > 10.0.0.2.5001: UDP, length 1470
00:09:29.961387 IP 10.0.0.1.35974 > 10.0.0.2.5001: UDP, length 1470
00:09:29.973481 IP 10.0.0.1.35974 > 10.0.0.2.5001: UDP, length 1470
00:09:29.985578 IP 10.0.0.1.35974 > 10.0.0.2.5001: UDP, length 1470
00:09:29.997684 IP 10.0.0.1.35974 > 10.0.0.2.5001: UDP, length 1470
00:09:30.009778 IP 10.0.0.1.35974 > 10.0.0.2.5001: UDP, length 1470
00:09:30.022604 IP 10.0.0.1.35974 > 10.0.0.2.5001: UDP, length 1470
00:09:30.033960 IP 10.0.0.1.35974 > 10.0.0.2.5001: UDP, length 1470
00:09:30.046056 IP 10.0.0.1.35974 > 10.0.0.2.5001: UDP, length 1470
00:09:30.058152 IP 10.0.0.1.35974 > 10.0.0.2.5001: UDP, length 1470
00:09:30.070275 IP 10.0.0.1.35974 > 10.0.0.2.5001: UDP, length 1470
00:09:30.082334 IP 10.0.0.1.35974 > 10.0.0.2.5001: UDP, length 1470
00:09:30.094474 IP 10.0.0.1.35974 > 10.0.0.2.5001: UDP, length 1470
00:09:30.106537 IP 10.0.0.1.35974 > 10.0.0.2.5001: UDP, length 1470
00:09:30.118637 IP 10.0.0.1.35974 > 10.0.0.2.5001: UDP, length 1470
00:09:30.130757 IP 10.0.0.1.35974 > 10.0.0.2.5001: UDP, length 1470
00:09:30.142812 IP 10.0.0.1.35974 > 10.0.0.2.5001: UDP, length 1470
00:09:30.154921 IP 10.0.0.1.35974 > 10.0.0.2.5001: UDP, length 1470
00:09:30.167017 IP 10.0.0.1.35974 > 10.0.0.2.5001: UDP, length 1470
00:09:30.179877 IP 10.0.0.1.35974 > 10.0.0.2.5001: UDP, length 1470
00:09:30.191220 IP 10.0.0.1.35974 > 10.0.0.2.5001: UDP, length 1470
00:09:30.203296 IP 10.0.0.1.35974 > 10.0.0.2.5001: UDP, length 1470
00:09:30.215409 IP 10.0.0.1.35974 > 10.0.0.2.5001: UDP, length 1470
00:09:30.227495 IP 10.0.0.1.35974 > 10.0.0.2.5001: UDP, length 1470
00:09:30.239591 IP 10.0.0.1.35974 > 10.0.0.2.5001: UDP, length 1470
00:09:30.251714 IP 10.0.0.1.35974 > 10.0.0.2.5001: UDP, length 1470
00:09:30.263779 IP 10.0.0.1.35974 > 10.0.0.2.5001: UDP, length 1470
00:09:30.275900 IP 10.0.0.1.35974 > 10.0.0.2.5001: UDP, length 1470
00:09:30.287966 IP 10.0.0.1.35974 > 10.0.0.2.5001: UDP, length 1470
00:09:30.300072 IP 10.0.0.1.35974 > 10.0.0.2.5001: UDP, length 1470
00:09:30.312163 IP 10.0.0.1.35974 > 10.0.0.2.5001: UDP, length 1470
00:09:30.324263 IP 10.0.0.1.35974 > 10.0.0.2.5001: UDP, length 1470
00:09:30.336363 IP 10.0.0.1.35974 > 10.0.0.2.5001: UDP, length 1470
00:09:30.348458 IP 10.0.0.1.35974 > 10.0.0.2.5001: UDP, length 1470
00:09:30.360555 IP 10.0.0.1.35974 > 10.0.0.2.5001: UDP, length 1470
00:09:30.372644 IP 10.0.0.1.35974 > 10.0.0.2.5001: UDP, length 1470
00:09:30.384753 IP 10.0.0.1.35974 > 10.0.0.2.5001: UDP, length 1470
00:09:30.396844 IP 10.0.0.1.35974 > 10.0.0.2.5001: UDP, length 1470
00:09:30.408938 IP 10.0.0.1.35974 > 10.0.0.2.5001: UDP, length 1470
00:09:30.421025 IP 10.0.0.1.35974 > 10.0.0.2.5001: UDP, length 1470
00:09:30.433152 IP 10.0.0.1.35974 > 10.0.0.2.5001: UDP, length 1470
00:09:30.445244 IP 10.0.0.1.35974 > 10.0.0.2.5001: UDP, length 1470
00:09:30.457318 IP 10.0.0.1.35974 > 10.0.0.2.5001: UDP, length 1470
00:09:30.470357 IP 10.0.0.1.35974 > 10.0.0.2.5001: UDP, length 1470
00:09:30.481533 IP 10.0.0.1.35974 > 10.0.0.2.5001: UDP, length 1470
00:09:30.493637 IP 10.0.0.1.35974 > 10.0.0.2.5001: UDP, length 1470
00:09:30.505750 IP 10.0.0.1.35974 > 10.0.0.2.5001: UDP, length 1470
00:09:30.517816 IP 10.0.0.1.35974 > 10.0.0.2.5001: UDP, length 1470
00:09:30.529906 IP 10.0.0.1.35974 > 10.0.0.2.5001: UDP, length 1470
00:09:30.542803 IP 10.0.0.1.35974 > 10.0.0.2.5001: UDP, length 1470
00:09:30.554094 IP 10.0.0.1.35974 > 10.0.0.2.5001: UDP, length 1470
00:09:30.566176 IP 10.0.0.1.35974 > 10.0.0.2.5001: UDP, length 1470
00:09:30.578307 IP 10.0.0.1.35974 > 10.0.0.2.5001: UDP, length 1470
00:09:30.590379 IP 10.0.0.1.35974 > 10.0.0.2.5001: UDP, length 1470
00:09:30.602490 IP 10.0.0.1.35974 > 10.0.0.2.5001: UDP, length 1470
00:09:30.614569 IP 10.0.0.1.35974 > 10.0.0.2.5001: UDP, length 1470
00:09:30.626677 IP 10.0.0.1.35974 > 10.0.0.2.5001: UDP, length 1470
00:09:30.638764 IP 10.0.0.1.35974 > 10.0.0.2.5001: UDP, length 1470
00:09:30.650873 IP 10.0.0.1.35974 > 10.0.0.2.5001: UDP, length 1470
00:09:30.662954 IP 10.0.0.1.35974 > 10.0.0.2.5001: UDP, length 1470
00:09:30.675051 IP 10.0.0.1.35974 > 10.0.0.2.5001: UDP, length 1470
00:09:30.687144 IP 10.0.0.1.35974 > 10.0.0.2.5001: UDP, length 1470
00:09:30.699983 IP 10.0.0.1.35974 > 10.0.0.2.5001: UDP, length 1470
00:09:30.711362 IP 10.0.0.1.35974 > 10.0.0.2.5001: UDP, length 1470
00:09:30.723424 IP 10.0.0.1.35974 > 10.0.0.2.5001: UDP, length 1470
00:09:30.735555 IP 10.0.0.1.35974 > 10.0.0.2.5001: UDP, length 1470
00:09:30.747620 IP 10.0.0.1.35974 > 10.0.0.2.5001: UDP, length 1470
00:09:30.759759 IP 10.0.0.1.35974 > 10.0.0.2.5001: UDP, length 1470
00:09:30.771827 IP 10.0.0.1.35974 > 10.0.0.2.5001: UDP, length 1470
00:09:30.783904 IP 10.0.0.1.35974 > 10.0.0.2.5001: UDP, length 1470
00:09:30.796003 IP 10.0.0.1.35974 > 10.0.0.2.5001: UDP, length 1470
00:09:30.808104 IP 10.0.0.1.35974 > 10.0.0.2.5001: UDP, length 1470
00:09:30.820205 IP 10.0.0.1.35974 > 10.0.0.2.5001: UDP, length 1470
00:09:30.832299 IP 10.0.0.1.35974 > 10.0.0.2.5001: UDP, length 1470
00:09:30.844387 IP 10.0.0.1.35974 > 10.0.0.2.5001: UDP, length 1470
00:09:30.856492 IP 10.0.0.1.35974 > 10.0.0.2.5001: UDP, length 1470
00:09:30.868590 IP 10.0.0.1.35974 > 10.0.0.2.5001: UDP, length 1470
00:09:30.880679 IP 10.0.0.1.35974 > 10.0.0.2.5001: UDP, length 1470
00:09:30.892777 IP 10.0.0.1.35974 > 10.0.0.2.5001: UDP, length 1470
00:09:30.904893 IP 10.0.0.1.35974 > 10.0.0.2.5001: UDP, length 1470
00:09:30.916974 IP 10.0.0.1.35974 > 10.0.0.2.5001: UDP, length 1470
00:09:30.929067 IP 10.0.0.1.35974 > 10.0.0.2.5001: UDP, length 1470
00:09:30.941926 IP 10.0.0.1.35974 > 10.0.0.2.5001: UDP, length 1470
00:09:30.953243 IP 10.0.0.1.35974 > 10.0.0.2.5001: UDP, length 1470
00:09:30.965375 IP 10.0.0.1.35974 > 10.0.0.2.5001: UDP, length 1470
00:09:30.977443 IP 10.0.0.1.35974 > 10.0.0.2.5001: UDP, length 1470
00:09:30.989541 IP 10.0.0.1.35974 > 10.0.0.2.5001: UDP, length 1470
00:09:31.002438 IP 10.0.0.1.35974 > 10.0.0.2.5001: UDP, length 1470
00:09:31.013735 IP 10.0.0.1.35974 > 10.0.0.2.5001: UDP, length 1470
00:09:31.025845 IP 10.0.0.1.35974 > 10.0.0.2.5001: UDP, length 1470
00:09:31.037919 IP 10.0.0.1.35974 > 10.0.0.2.5001: UDP, length 1470
00:09:31.050037 IP 10.0.0.1.35974 > 10.0.0.2.5001: UDP, length 1470
00:09:31.062121 IP 10.0.0.1.35974 > 10.0.0.2.5001: UDP, length 1470
00:09:31.074233 IP 10.0.0.1.35974 > 10.0.0.2.5001: UDP, length 1470
00:09:31.086321 IP 10.0.0.1.35974 > 10.0.0.2.5001: UDP, length 1470
00:09:31.098415 IP 10.0.0.1.35974 > 10.0.0.2.5001: UDP, length 1470
00:09:31.110507 IP 10.0.0.1.35974 > 10.0.0.2.5001: UDP, length 1470
00:09:31.122600 IP 10.0.0.1.35974 > 10.0.0.2.5001: UDP, length 1470
00:09:31.134693 IP 10.0.0.1.35974 > 10.0.0.2.5001: UDP, length 1470
00:09:31.146796 IP 10.0.0.1.35974 > 10.0.0.2.5001: UDP, length 1470
00:09:31.158879 IP 10.0.0.1.35974 > 10.0.0.2.5001: UDP, length 1470
00:09:31.170985 IP 10.0.0.1.35974 > 10.0.0.2.5001: UDP, length 1470
00:09:31.183083 IP 10.0.0.1.35974 > 10.0.0.2.5001: UDP, length 1470
00:09:31.195175 IP 10.0.0.1.35974 > 10.0.0.2.5001: UDP, length 1470
00:09:31.207272 IP 10.0.0.1.35974 > 10.0.0.2.5001: UDP, length 1470
00:09:31.219383 IP 10.0.0.1.35974 > 10.0.0.2.5001: UDP, length 1470
00:09:31.231481 IP 10.0.0.1.35974 > 10.0.0.2.5001: UDP, length 1470
00:09:31.243566 IP 10.0.0.1.35974 > 10.0.0.2.5001: UDP, length 1470
00:09:31.255659 IP 10.0.0.1.35974 > 10.0.0.2.5001: UDP, length 1470
00:09:31.267749 IP 10.0.0.1.35974 > 10.0.0.2.5001: UDP, length 1470
00:09:31.279845 IP 10.0.0.1.35974 > 10.0.0.2.5001: UDP, length 1470
00:09:31.291960 IP 10.0.0.1.35974 > 10.0.0.2.5001: UDP, length 1470
00:09:31.304038 IP 10.0.0.1.35974 > 10.0.0.2.5001: UDP, length 1470
00:09:31.316137 IP 10.0.0.1.35974 > 10.0.0.2.5001: UDP, length 1470
00:09:31.328923 IP 10.0.0.1.35974 > 10.0.0.2.5001: UDP, length 1470
00:09:31.340334 IP 10.0.0.1.35974 > 10.0.0.2.5001: UDP, length 1470
00:09:31.352426 IP 10.0.0.1.35974 > 10.0.0.2.5001: UDP, length 1470
00:09:31.364517 IP 10.0.0.1.35974 > 10.0.0.2.5001: UDP, length 1470
00:09:31.376611 IP 10.0.0.1.35974 > 10.0.0.2.5001: UDP, length 1470
00:09:31.388714 IP 10.0.0.1.35974 > 10.0.0.2.5001: UDP, length 1470
00:09:31.400821 IP 10.0.0.1.35974 > 10.0.0.2.5001: UDP, length 1470
00:09:31.412906 IP 10.0.0.1.35974 > 10.0.0.2.5001: UDP, length 1470
00:09:31.425000 IP 10.0.0.1.35974 > 10.0.0.2.5001: UDP, length 1470
00:09:31.437100 IP 10.0.0.1.35974 > 10.0.0.2.5001: UDP, length 1470
00:09:31.449926 IP 10.0.0.1.35974 > 10.0.0.2.5001: UDP, length 1470
00:09:31.461290 IP 10.0.0.1.35974 > 10.0.0.2.5001: UDP, length 1470
00:09:31.473377 IP 10.0.0.1.35974 > 10.0.0.2.5001: UDP, length 1470
00:09:31.485471 IP 10.0.0.1.35974 > 10.0.0.2.5001: UDP, length 1470
00:09:31.497564 IP 10.0.0.1.35974 > 10.0.0.2.5001: UDP, length 1470
00:09:31.509659 IP 10.0.0.1.35974 > 10.0.0.2.5001: UDP, length 1470
00:09:31.521756 IP 10.0.0.1.35974 > 10.0.0.2.5001: UDP, length 1470
00:09:31.533857 IP 10.0.0.1.35974 > 10.0.0.2.5001: UDP, length 1470
00:09:31.545986 IP 10.0.0.1.35974 > 10.0.0.2.5001: UDP, length 1470
00:09:31.558060 IP 10.0.0.1.35974 > 10.0.0.2.5001: UDP, length 1470
00:09:31.570166 IP 10.0.0.1.35974 > 10.0.0.2.5001: UDP, length 1470
00:09:31.582248 IP 10.0.0.1.35974 > 10.0.0.2.5001: UDP, length 1470
00:09:31.594373 IP 10.0.0.1.35974 > 10.0.0.2.5001: UDP, length 1470
00:09:31.606474 IP 10.0.0.1.35974 > 10.0.0.2.5001: UDP, length 1470
00:09:31.618553 IP 10.0.0.1.35974 > 10.0.0.2.5001: UDP, length 1470
00:09:31.630633 IP 10.0.0.1.35974 > 10.0.0.2.5001: UDP, length 1470
00:09:31.642728 IP 10.0.0.1.35974 > 10.0.0.2.5001: UDP, length 1470
00:09:31.654828 IP 10.0.0.1.35974 > 10.0.0.2.5001: UDP, length 1470
00:09:31.666913 IP 10.0.0.1.35974 > 10.0.0.2.5001: UDP, length 1470
00:09:31.679025 IP 10.0.0.1.35974 > 10.0.0.2.5001: UDP, length 1470
00:09:31.691113 IP 10.0.0.1.35974 > 10.0.0.2.5001: UDP, length 1470
00:09:31.703212 IP 10.0.0.1.35974 > 10.0.0.2.5001: UDP, length 1470
00:09:31.715308 IP 10.0.0.1.35974 > 10.0.0.2.5001: UDP, length 1470
00:09:31.727411 IP 10.0.0.1.35974 > 10.0.0.2.5001: UDP, length 1470
00:09:31.739517 IP 10.0.0.1.35974 > 10.0.0.2.5001: UDP, length 1470
00:09:31.751606 IP 10.0.0.1.35974 > 10.0.0.2.5001: UDP, length 1470
00:09:31.763689 IP 10.0.0.1.35974 > 10.0.0.2.5001: UDP, length 1470
00:09:31.775786 IP 10.0.0.1.35974 > 10.0.0.2.5001: UDP, length 1470
00:09:31.788514 IP 10.0.0.1.35974 > 10.0.0.2.5001: UDP, length 1470
00:09:31.799971 IP 10.0.0.1.35974 > 10.0.0.2.5001: UDP, length 1470
00:09:31.812095 IP 10.0.0.1.35974 > 10.0.0.2.5001: UDP, length 1470
00:09:31.824168 IP 10.0.0.1.35974 > 10.0.0.2.5001: UDP, length 1470
00:09:31.836264 IP 10.0.0.1.35974 > 10.0.0.2.5001: UDP, length 1470
00:09:31.848364 IP 10.0.0.1.35974 > 10.0.0.2.5001: UDP, length 1470
00:09:31.860483 IP 10.0.0.1.35974 > 10.0.0.2.5001: UDP, length 1470
00:09:31.872556 IP 10.0.0.1.35974 > 10.0.0.2.5001: UDP, length 1470
00:09:31.884649 IP 10.0.0.1.35974 > 10.0.0.2.5001: UDP, length 1470
00:09:31.896752 IP 10.0.0.1.35974 > 10.0.0.2.5001: UDP, length 1470
00:09:31.908850 IP 10.0.0.1.35974 > 10.0.0.2.5001: UDP, length 1470
00:09:31.920926 IP 10.0.0.1.35974 > 10.0.0.2.5001: UDP, length 1470
00:09:31.933044 IP 10.0.0.1.35974 > 10.0.0.2.5001: UDP, length 1470
00:09:31.945127 IP 10.0.0.1.35974 > 10.0.0.2.5001: UDP, length 1470
00:09:31.957220 IP 10.0.0.1.35974 > 10.0.0.2.5001: UDP, length 1470
00:09:31.969337 IP 10.0.0.1.35974 > 10.0.0.2.5001: UDP, length 1470
00:09:31.981417 IP 10.0.0.1.35974 > 10.0.0.2.5001: UDP, length 1470
00:09:31.993513 IP 10.0.0.1.35974 > 10.0.0.2.5001: UDP, length 1470
00:09:32.005612 IP 10.0.0.1.35974 > 10.0.0.2.5001: UDP, length 1470
00:09:32.017705 IP 10.0.0.1.35974 > 10.0.0.2.5001: UDP, length 1470
00:09:32.030510 IP 10.0.0.1.35974 > 10.0.0.2.5001: UDP, length 1470
00:09:32.041901 IP 10.0.0.1.35974 > 10.0.0.2.5001: UDP, length 1470
00:09:32.054010 IP 10.0.0.1.35974 > 10.0.0.2.5001: UDP, length 1470
00:09:32.066102 IP 10.0.0.1.35974 > 10.0.0.2.5001: UDP, length 1470
00:09:32.078173 IP 10.0.0.1.35974 > 10.0.0.2.5001: UDP, length 1470
00:09:32.090275 IP 10.0.0.1.35974 > 10.0.0.2.5001: UDP, length 1470
00:09:32.102378 IP 10.0.0.1.35974 > 10.0.0.2.5001: UDP, length 1470
00:09:32.114469 IP 10.0.0.1.35974 > 10.0.0.2.5001: UDP, length 1470
00:09:32.126584 IP 10.0.0.1.35974 > 10.0.0.2.5001: UDP, length 1470
00:09:32.138668 IP 10.0.0.1.35974 > 10.0.0.2.5001: UDP, length 1470
00:09:32.150763 IP 10.0.0.1.35974 > 10.0.0.2.5001: UDP, length 1470
00:09:32.162850 IP 10.0.0.1.35974 > 10.0.0.2.5001: UDP, length 1470
00:09:32.174949 IP 10.0.0.1.35974 > 10.0.0.2.5001: UDP, length 1470
00:09:32.187057 IP 10.0.0.1.35974 > 10.0.0.2.5001: UDP, length 1470
00:09:32.199956 IP 10.0.0.1.35974 > 10.0.0.2.5001: UDP, length 1470
00:09:32.211240 IP 10.0.0.1.35974 > 10.0.0.2.5001: UDP, length 1470
00:09:32.223336 IP 10.0.0.1.35974 > 10.0.0.2.5001: UDP, length 1470
00:09:32.235436 IP 10.0.0.1.35974 > 10.0.0.2.5001: UDP, length 1470
00:09:32.247555 IP 10.0.0.1.35974 > 10.0.0.2.5001: UDP, length 1470
00:09:32.259641 IP 10.0.0.1.35974 > 10.0.0.2.5001: UDP, length 1470
00:09:32.271711 IP 10.0.0.1.35974 > 10.0.0.2.5001: UDP, length 1470
00:09:32.283816 IP 10.0.0.1.35974 > 10.0.0.2.5001: UDP, length 1470
00:09:32.295921 IP 10.0.0.1.35974 > 10.0.0.2.5001: UDP, length 1470
00:09:32.308036 IP 10.0.0.1.35974 > 10.0.0.2.5001: UDP, length 1470
00:09:32.320122 IP 10.0.0.1.35974 > 10.0.0.2.5001: UDP, length 1470
00:09:32.332203 IP 10.0.0.1.35974 > 10.0.0.2.5001: UDP, length 1470
00:09:32.344314 IP 10.0.0.1.35974 > 10.0.0.2.5001: UDP, length 1470
00:09:32.357164 IP 10.0.0.1.35974 > 10.0.0.2.5001: UDP, length 1470
00:09:32.368497 IP 10.0.0.1.35974 > 10.0.0.2.5001: UDP, length 1470
00:09:32.380594 IP 10.0.0.1.35974 > 10.0.0.2.5001: UDP, length 1470
00:09:32.393403 IP 10.0.0.1.35974 > 10.0.0.2.5001: UDP, length 1470
00:09:32.404777 IP 10.0.0.1.35974 > 10.0.0.2.5001: UDP, length 1470
00:09:32.416872 IP 10.0.0.1.35974 > 10.0.0.2.5001: UDP, length 1470
00:09:32.428978 IP 10.0.0.1.35974 > 10.0.0.2.5001: UDP, length 1470
00:09:32.441077 IP 10.0.0.1.35974 > 10.0.0.2.5001: UDP, length 1470
00:09:32.453148 IP 10.0.0.1.35974 > 10.0.0.2.5001: UDP, length 1470
00:09:32.465257 IP 10.0.0.1.35974 > 10.0.0.2.5001: UDP, length 1470
00:09:32.477374 IP 10.0.0.1.35974 > 10.0.0.2.5001: UDP, length 1470
00:09:32.489443 IP 10.0.0.1.35974 > 10.0.0.2.5001: UDP, length 1470
00:09:32.502322 IP 10.0.0.1.35974 > 10.0.0.2.5001: UDP, length 1470
00:09:32.513643 IP 10.0.0.1.35974 > 10.0.0.2.5001: UDP, length 1470
00:09:32.525739 IP 10.0.0.1.35974 > 10.0.0.2.5001: UDP, length 1470
00:09:32.537845 IP 10.0.0.1.35974 > 10.0.0.2.5001: UDP, length 1470
00:09:32.549925 IP 10.0.0.1.35974 > 10.0.0.2.5001: UDP, length 1470
00:09:32.562027 IP 10.0.0.1.35974 > 10.0.0.2.5001: UDP, length 1470
00:09:32.574117 IP 10.0.0.1.35974 > 10.0.0.2.5001: UDP, length 1470
00:09:32.586221 IP 10.0.0.1.35974 > 10.0.0.2.5001: UDP, length 1470
00:09:32.598312 IP 10.0.0.1.35974 > 10.0.0.2.5001: UDP, length 1470
00:09:32.610413 IP 10.0.0.1.35974 > 10.0.0.2.5001: UDP, length 1470
00:09:32.622504 IP 10.0.0.1.35974 > 10.0.0.2.5001: UDP, length 1470
00:09:32.635387 IP 10.0.0.1.35974 > 10.0.0.2.5001: UDP, length 1470
00:09:32.646684 IP 10.0.0.1.35974 > 10.0.0.2.5001: UDP, length 1470
00:09:32.658793 IP 10.0.0.1.35974 > 10.0.0.2.5001: UDP, length 1470
00:09:32.671626 IP 10.0.0.1.35974 > 10.0.0.2.5001: UDP, length 1470
00:09:32.682978 IP 10.0.0.1.35974 > 10.0.0.2.5001: UDP, length 1470
00:09:32.695094 IP 10.0.0.1.35974 > 10.0.0.2.5001: UDP, length 1470
00:09:32.708051 IP 10.0.0.1.35974 > 10.0.0.2.5001: UDP, length 1470
00:09:32.719287 IP 10.0.0.1.35974 > 10.0.0.2.5001: UDP, length 1470
00:09:32.731363 IP 10.0.0.1.35974 > 10.0.0.2.5001: UDP, length 1470
00:09:32.743466 IP 10.0.0.1.35974 > 10.0.0.2.5001: UDP, length 1470
00:09:32.755570 IP 10.0.0.1.35974 > 10.0.0.2.5001: UDP, length 1470
00:09:32.767650 IP 10.0.0.1.35974 > 10.0.0.2.5001: UDP, length 1470
00:09:32.779753 IP 10.0.0.1.35974 > 10.0.0.2.5001: UDP, length 1470
00:09:32.791848 IP 10.0.0.1.35974 > 10.0.0.2.5001: UDP, length 1470
00:09:32.803928 IP 10.0.0.1.35974 > 10.0.0.2.5001: UDP, length 1470
00:09:32.816039 IP 10.0.0.1.35974 > 10.0.0.2.5001: UDP, length 1470
00:09:32.828144 IP 10.0.0.1.35974 > 10.0.0.2.5001: UDP, length 1470
00:09:32.840252 IP 10.0.0.1.35974 > 10.0.0.2.5001: UDP, length 1470
00:09:32.852334 IP 10.0.0.1.35974 > 10.0.0.2.5001: UDP, length 1470
00:09:32.864428 IP 10.0.0.1.35974 > 10.0.0.2.5001: UDP, length 1470
00:09:32.876546 IP 10.0.0.1.35974 > 10.0.0.2.5001: UDP, length 1470
00:09:32.888620 IP 10.0.0.1.35974 > 10.0.0.2.5001: UDP, length 1470
00:09:32.900716 IP 10.0.0.1.35974 > 10.0.0.2.5001: UDP, length 1470
00:09:32.912811 IP 10.0.0.1.35974 > 10.0.0.2.5001: UDP, length 1470
00:09:32.924908 IP 10.0.0.1.35974 > 10.0.0.2.5001: UDP, length 1470
00:09:32.937006 IP 10.0.0.1.35974 > 10.0.0.2.5001: UDP, length 1470
00:09:32.949119 IP 10.0.0.1.35974 > 10.0.0.2.5001: UDP, length 1470
00:09:32.961225 IP 10.0.0.1.35974 > 10.0.0.2.5001: UDP, length 1470
00:09:32.973307 IP 10.0.0.1.35974 > 10.0.0.2.5001: UDP, length 1470
00:09:32.985385 IP 10.0.0.1.35974 > 10.0.0.2.5001: UDP, length 1470
00:09:32.997471 IP 10.0.0.1.35974 > 10.0.0.2.5001: UDP, length 1470
00:09:33.009576 IP 10.0.0.1.35974 > 10.0.0.2.5001: UDP, length 1470
00:09:33.021671 IP 10.0.0.1.35974 > 10.0.0.2.5001: UDP, length 1470
00:09:33.033774 IP 10.0.0.1.35974 > 10.0.0.2.5001: UDP, length 1470
00:09:33.045853 IP 10.0.0.1.35974 > 10.0.0.2.5001: UDP, length 1470
00:09:33.057962 IP 10.0.0.1.35974 > 10.0.0.2.5001: UDP, length 1470
00:09:33.070059 IP 10.0.0.1.35974 > 10.0.0.2.5001: UDP, length 1470
00:09:33.082153 IP 10.0.0.1.35974 > 10.0.0.2.5001: UDP, length 1470
00:09:33.094263 IP 10.0.0.1.35974 > 10.0.0.2.5001: UDP, length 1470
00:09:33.106355 IP 10.0.0.1.35974 > 10.0.0.2.5001: UDP, length 1470
00:09:33.118445 IP 10.0.0.1.35974 > 10.0.0.2.5001: UDP, length 1470
00:09:33.130536 IP 10.0.0.1.35974 > 10.0.0.2.5001: UDP, length 1470
00:09:33.142632 IP 10.0.0.1.35974 > 10.0.0.2.5001: UDP, length 1470
00:09:33.155566 IP 10.0.0.1.35974 > 10.0.0.2.5001: UDP, length 1470
00:09:33.166812 IP 10.0.0.1.35974 > 10.0.0.2.5001: UDP, length 1470
00:09:33.178924 IP 10.0.0.1.35974 > 10.0.0.2.5001: UDP, length 1470
00:09:33.191016 IP 10.0.0.1.35974 > 10.0.0.2.5001: UDP, length 1470
00:09:33.203099 IP 10.0.0.1.35974 > 10.0.0.2.5001: UDP, length 1470
00:09:33.215227 IP 10.0.0.1.35974 > 10.0.0.2.5001: UDP, length 1470
00:09:33.227326 IP 10.0.0.1.35974 > 10.0.0.2.5001: UDP, length 1470
00:09:33.239398 IP 10.0.0.1.35974 > 10.0.0.2.5001: UDP, length 1470
00:09:33.251512 IP 10.0.0.1.35974 > 10.0.0.2.5001: UDP, length 1470
00:09:33.263591 IP 10.0.0.1.35974 > 10.0.0.2.5001: UDP, length 1470
00:09:33.275681 IP 10.0.0.1.35974 > 10.0.0.2.5001: UDP, length 1470
00:09:33.287807 IP 10.0.0.1.35974 > 10.0.0.2.5001: UDP, length 1470
00:09:33.299899 IP 10.0.0.1.35974 > 10.0.0.2.5001: UDP, length 1470
00:09:33.311977 IP 10.0.0.1.35974 > 10.0.0.2.5001: UDP, length 1470
00:09:33.324072 IP 10.0.0.1.35974 > 10.0.0.2.5001: UDP, length 1470
00:09:33.336168 IP 10.0.0.1.35974 > 10.0.0.2.5001: UDP, length 1470
00:09:33.348280 IP 10.0.0.1.35974 > 10.0.0.2.5001: UDP, length 1470
00:09:33.360350 IP 10.0.0.1.35974 > 10.0.0.2.5001: UDP, length 1470
00:09:33.372456 IP 10.0.0.1.35974 > 10.0.0.2.5001: UDP, length 1470
00:09:33.384568 IP 10.0.0.1.35974 > 10.0.0.2.5001: UDP, length 1470
00:09:33.396651 IP 10.0.0.1.35974 > 10.0.0.2.5001: UDP, length 1470
00:09:33.408743 IP 10.0.0.1.35974 > 10.0.0.2.5001: UDP, length 1470
00:09:33.420850 IP 10.0.0.1.35974 > 10.0.0.2.5001: UDP, length 1470
00:09:33.432944 IP 10.0.0.1.35974 > 10.0.0.2.5001: UDP, length 1470
00:09:33.445036 IP 10.0.0.1.35974 > 10.0.0.2.5001: UDP, length 1470
00:09:33.457130 IP 10.0.0.1.35974 > 10.0.0.2.5001: UDP, length 1470
00:09:33.469253 IP 10.0.0.1.35974 > 10.0.0.2.5001: UDP, length 1470
00:09:33.481347 IP 10.0.0.1.35974 > 10.0.0.2.5001: UDP, length 1470
00:09:33.493425 IP 10.0.0.1.35974 > 10.0.0.2.5001: UDP, length 1470
00:09:33.505513 IP 10.0.0.1.35974 > 10.0.0.2.5001: UDP, length 1470
00:09:33.517618 IP 10.0.0.1.35974 > 10.0.0.2.5001: UDP, length 1470
00:09:33.529705 IP 10.0.0.1.35974 > 10.0.0.2.5001: UDP, length 1470
00:09:33.541794 IP 10.0.0.1.35974 > 10.0.0.2.5001: UDP, length 1470
00:09:33.553897 IP 10.0.0.1.35974 > 10.0.0.2.5001: UDP, length 1470
00:09:33.565991 IP 10.0.0.1.35974 > 10.0.0.2.5001: UDP, length 1470
00:09:33.578079 IP 10.0.0.1.35974 > 10.0.0.2.5001: UDP, length 1470
00:09:33.590183 IP 10.0.0.1.35974 > 10.0.0.2.5001: UDP, length 1470
00:09:33.602284 IP 10.0.0.1.35974 > 10.0.0.2.5001: UDP, length 1470
00:09:33.614376 IP 10.0.0.1.35974 > 10.0.0.2.5001: UDP, length 1470
00:09:33.626489 IP 10.0.0.1.35974 > 10.0.0.2.5001: UDP, length 1470
00:09:33.638565 IP 10.0.0.1.35974 > 10.0.0.2.5001: UDP, length 1470
00:09:33.650668 IP 10.0.0.1.35974 > 10.0.0.2.5001: UDP, length 1470
00:09:33.662759 IP 10.0.0.1.35974 > 10.0.0.2.5001: UDP, length 1470
00:09:33.674894 IP 10.0.0.1.35974 > 10.0.0.2.5001: UDP, length 1470
00:09:33.686956 IP 10.0.0.1.35974 > 10.0.0.2.5001: UDP, length 1470
00:09:33.699059 IP 10.0.0.1.35974 > 10.0.0.2.5001: UDP, length 1470
00:09:33.711863 IP 10.0.0.1.35974 > 10.0.0.2.5001: UDP, length 1470
00:09:33.723395 IP 10.0.0.1.35974 > 10.0.0.2.5001: UDP, length 1470
00:09:33.735363 IP 10.0.0.1.35974 > 10.0.0.2.5001: UDP, length 1470

