00:09:34.432118 IP 10.0.0.1.46263 > 10.0.0.2.5001: UDP, length 1470
00:09:34.439819 IP 10.0.0.1.46263 > 10.0.0.2.5001: UDP, length 1470
00:09:34.451813 IP 10.0.0.1.46263 > 10.0.0.2.5001: UDP, length 1470
00:09:34.467312 IP 10.0.0.1.46263 > 10.0.0.2.5001: UDP, length 1470
00:09:34.475831 IP 10.0.0.1.46263 > 10.0.0.2.5001: UDP, length 1470
00:09:34.489831 IP 10.0.0.1.46263 > 10.0.0.2.5001: UDP, length 1470
00:09:34.500009 IP 10.0.0.1.46263 > 10.0.0.2.5001: UDP, length 1470
00:09:34.521933 IP 10.0.0.1.46263 > 10.0.0.2.5001: UDP, length 1470
00:09:34.534045 IP 10.0.0.1.46263 > 10.0.0.2.5001: UDP, length 1470
00:09:34.546215 IP 10.0.0.1.46263 > 10.0.0.2.5001: UDP, length 1470
00:09:34.558224 IP 10.0.0.1.46263 > 10.0.0.2.5001: UDP, length 1470
00:09:34.570321 IP 10.0.0.1.46263 > 10.0.0.2.5001: UDP, length 1470
00:09:34.583176 IP 10.0.0.1.46263 > 10.0.0.2.5001: UDP, length 1470
00:09:34.594510 IP 10.0.0.1.46263 > 10.0.0.2.5001: UDP, length 1470
00:09:34.606660 IP 10.0.0.1.46263 > 10.0.0.2.5001: UDP, length 1470
00:09:34.619408 IP 10.0.0.1.46263 > 10.0.0.2.5001: UDP, length 1470
00:09:34.630806 IP 10.0.0.1.46263 > 10.0.0.2.5001: UDP, length 1470
00:09:34.642896 IP 10.0.0.1.46263 > 10.0.0.2.5001: UDP, length 1470
00:09:34.667099 IP 10.0.0.1.46263 > 10.0.0.2.5001: UDP, length 1470
00:09:34.679951 IP 10.0.0.1.46263 > 10.0.0.2.5001: UDP, length 1470
00:09:34.691267 IP 10.0.0.1.46263 > 10.0.0.2.5001: UDP, length 1470
00:09:34.703439 IP 10.0.0.1.46263 > 10.0.0.2.5001: UDP, length 1470
00:09:34.727615 IP 10.0.0.1.46263 > 10.0.0.2.5001: UDP, length 1470
00:09:34.739636 IP 10.0.0.1.46263 > 10.0.0.2.5001: UDP, length 1470
00:09:34.751733 IP 10.0.0.1.46263 > 10.0.0.2.5001: UDP, length 1470
00:09:34.764693 IP 10.0.0.1.46263 > 10.0.0.2.5001: UDP, length 1470
00:09:34.775966 IP 10.0.0.1.46263 > 10.0.0.2.5001: UDP, length 1470
00:09:34.788069 IP 10.0.0.1.46263 > 10.0.0.2.5001: UDP, length 1470
00:09:34.800154 IP 10.0.0.1.46263 > 10.0.0.2.5001: UDP, length 1470
00:09:34.812265 IP 10.0.0.1.46263 > 10.0.0.2.5001: UDP, length 1470
00:09:34.824999 IP 10.0.0.1.46263 > 10.0.0.2.5001: UDP, length 1470
00:09:34.849283 IP 10.0.0.1.46263 > 10.0.0.2.5001: UDP, length 1470
00:09:34.860644 IP 10.0.0.1.46263 > 10.0.0.2.5001: UDP, length 1470
00:09:34.873500 IP 10.0.0.1.46263 > 10.0.0.2.5001: UDP, length 1470
00:09:34.884830 IP 10.0.0.1.46263 > 10.0.0.2.5001: UDP, length 1470
00:09:34.897543 IP 10.0.0.1.46263 > 10.0.0.2.5001: UDP, length 1470
00:09:34.909022 IP 10.0.0.1.46263 > 10.0.0.2.5001: UDP, length 1470
00:09:34.921098 IP 10.0.0.1.46263 > 10.0.0.2.5001: UDP, length 1470
00:09:34.934004 IP 10.0.0.1.46263 > 10.0.0.2.5001: UDP, length 1470
00:09:34.945334 IP 10.0.0.1.46263 > 10.0.0.2.5001: UDP, length 1470
00:09:34.958127 IP 10.0.0.1.46263 > 10.0.0.2.5001: UDP, length 1470
00:09:34.969467 IP 10.0.0.1.46263 > 10.0.0.2.5001: UDP, length 1470
00:09:34.981611 IP 10.0.0.1.46263 > 10.0.0.2.5001: UDP, length 1470
00:09:34.994494 IP 10.0.0.1.46263 > 10.0.0.2.5001: UDP, length 1470
00:09:35.005782 IP 10.0.0.1.46263 > 10.0.0.2.5001: UDP, length 1470
00:09:35.017866 IP 10.0.0.1.46263 > 10.0.0.2.5001: UDP, length 1470
00:09:35.029974 IP 10.0.0.1.46263 > 10.0.0.2.5001: UDP, length 1470
00:09:35.042074 IP 10.0.0.1.46263 > 10.0.0.2.5001: UDP, length 1470
00:09:35.054180 IP 10.0.0.1.46263 > 10.0.0.2.5001: UDP, length 1470
00:09:35.066263 IP 10.0.0.1.46263 > 10.0.0.2.5001: UDP, length 1470
00:09:35.078379 IP 10.0.0.1.46263 > 10.0.0.2.5001: UDP, length 1470
00:09:35.091117 IP 10.0.0.1.46263 > 10.0.0.2.5001: UDP, length 1470
00:09:35.102585 IP 10.0.0.1.46263 > 10.0.0.2.5001: UDP, length 1470
00:09:35.114650 IP 10.0.0.1.46263 > 10.0.0.2.5001: UDP, length 1470
00:09:35.126732 IP 10.0.0.1.46263 > 10.0.0.2.5001: UDP, length 1470
00:09:35.138843 IP 10.0.0.1.46263 > 10.0.0.2.5001: UDP, length 1470
00:09:35.150946 IP 10.0.0.1.46263 > 10.0.0.2.5001: UDP, length 1470
00:09:35.163039 IP 10.0.0.1.46263 > 10.0.0.2.5001: UDP, length 1470
00:09:35.175121 IP 10.0.0.1.46263 > 10.0.0.2.5001: UDP, length 1470
00:09:35.187241 IP 10.0.0.1.46263 > 10.0.0.2.5001: UDP, length 1470
00:09:35.199280 IP 10.0.0.1.46263 > 10.0.0.2.5001: UDP, length 1470
00:09:35.211380 IP 10.0.0.1.46263 > 10.0.0.2.5001: UDP, length 1470
00:09:35.223976 IP 10.0.0.1.46263 > 10.0.0.2.5001: UDP, length 1470
00:09:35.235628 IP 10.0.0.1.46263 > 10.0.0.2.5001: UDP, length 1470
00:09:35.248545 IP 10.0.0.1.46263 > 10.0.0.2.5001: UDP, length 1470
00:09:35.259794 IP 10.0.0.1.46263 > 10.0.0.2.5001: UDP, length 1470
00:09:35.271891 IP 10.0.0.1.46263 > 10.0.0.2.5001: UDP, length 1470
00:09:35.283964 IP 10.0.0.1.46263 > 10.0.0.2.5001: UDP, length 1470
00:09:35.296121 IP 10.0.0.1.46263 > 10.0.0.2.5001: UDP, length 1470
00:09:35.309115 IP 10.0.0.1.46263 > 10.0.0.2.5001: UDP, length 1470
00:09:35.320262 IP 10.0.0.1.46263 > 10.0.0.2.5001: UDP, length 1470
00:09:35.333152 IP 10.0.0.1.46263 > 10.0.0.2.5001: UDP, length 1470
00:09:35.344440 IP 10.0.0.1.46263 > 10.0.0.2.5001: UDP, length 1470
00:09:35.356606 IP 10.0.0.1.46263 > 10.0.0.2.5001: UDP, length 1470
00:09:35.369441 IP 10.0.0.1.46263 > 10.0.0.2.5001: UDP, length 1470
00:09:35.380731 IP 10.0.0.1.46263 > 10.0.0.2.5001: UDP, length 1470
00:09:35.392838 IP 10.0.0.1.46263 > 10.0.0.2.5001: UDP, length 1470
00:09:35.405785 IP 10.0.0.1.46263 > 10.0.0.2.5001: UDP, length 1470
00:09:35.417074 IP 10.0.0.1.46263 > 10.0.0.2.5001: UDP, length 1470
00:09:35.429260 IP 10.0.0.1.46263 > 10.0.0.2.5001: UDP, length 1470
00:09:35.441994 IP 10.0.0.1.46263 > 10.0.0.2.5001: UDP, length 1470
00:09:35.453337 IP 10.0.0.1.46263 > 10.0.0.2.5001: UDP, length 1470
00:09:35.465429 IP 10.0.0.1.46263 > 10.0.0.2.5001: UDP, length 1470
00:09:35.477520 IP 10.0.0.1.46263 > 10.0.0.2.5001: UDP, length 1470
00:09:35.489650 IP 10.0.0.1.46263 > 10.0.0.2.5001: UDP, length 1470
00:09:35.501709 IP 10.0.0.1.46263 > 10.0.0.2.5001: UDP, length 1470
00:09:35.513819 IP 10.0.0.1.46263 > 10.0.0.2.5001: UDP, length 1470
00:09:35.525878 IP 10.0.0.1.46263 > 10.0.0.2.5001: UDP, length 1470
00:09:35.537974 IP 10.0.0.1.46263 > 10.0.0.2.5001: UDP, length 1470
00:09:35.550633 IP 10.0.0.1.46263 > 10.0.0.2.5001: UDP, length 1470
00:09:35.562204 IP 10.0.0.1.46263 > 10.0.0.2.5001: UDP, length 1470
00:09:35.574297 IP 10.0.0.1.46263 > 10.0.0.2.5001: UDP, length 1470
00:09:35.586397 IP 10.0.0.1.46263 > 10.0.0.2.5001: UDP, length 1470
00:09:35.598490 IP 10.0.0.1.46263 > 10.0.0.2.5001: UDP, length 1470
00:09:35.610616 IP 10.0.0.1.46263 > 10.0.0.2.5001: UDP, length 1470
00:09:35.622731 IP 10.0.0.1.46263 > 10.0.0.2.5001: UDP, length 1470
00:09:35.634785 IP 10.0.0.1.46263 > 10.0.0.2.5001: UDP, length 1470
00:09:35.646880 IP 10.0.0.1.46263 > 10.0.0.2.5001: UDP, length 1470
00:09:35.658972 IP 10.0.0.1.46263 > 10.0.0.2.5001: UDP, length 1470
00:09:35.671068 IP 10.0.0.1.46263 > 10.0.0.2.5001: UDP, length 1470
00:09:35.683181 IP 10.0.0.1.46263 > 10.0.0.2.5001: UDP, length 1470
00:09:35.696265 IP 10.0.0.1.46263 > 10.0.0.2.5001: UDP, length 1470
00:09:35.707357 IP 10.0.0.1.46263 > 10.0.0.2.5001: UDP, length 1470
00:09:35.719420 IP 10.0.0.1.46263 > 10.0.0.2.5001: UDP, length 1470
00:09:35.732451 IP 10.0.0.1.46263 > 10.0.0.2.5001: UDP, length 1470
00:09:35.743657 IP 10.0.0.1.46263 > 10.0.0.2.5001: UDP, length 1470
00:09:35.755738 IP 10.0.0.1.46263 > 10.0.0.2.5001: UDP, length 1470
00:09:35.768501 IP 10.0.0.1.46263 > 10.0.0.2.5001: UDP, length 1470
00:09:35.779933 IP 10.0.0.1.46263 > 10.0.0.2.5001: UDP, length 1470
00:09:35.792798 IP 10.0.0.1.46263 > 10.0.0.2.5001: UDP, length 1470
00:09:35.804204 IP 10.0.0.1.46263 > 10.0.0.2.5001: UDP, length 1470
00:09:35.816262 IP 10.0.0.1.46263 > 10.0.0.2.5001: UDP, length 1470
00:09:35.829064 IP 10.0.0.1.46263 > 10.0.0.2.5001: UDP, length 1470
00:09:35.840427 IP 10.0.0.1.46263 > 10.0.0.2.5001: UDP, length 1470
00:09:35.852459 IP 10.0.0.1.46263 > 10.0.0.2.5001: UDP, length 1470
00:09:35.864612 IP 10.0.0.1.46263 > 10.0.0.2.5001: UDP, length 1470
00:09:35.876681 IP 10.0.0.1.46263 > 10.0.0.2.5001: UDP, length 1470
00:09:35.888790 IP 10.0.0.1.46263 > 10.0.0.2.5001: UDP, length 1470
00:09:35.900879 IP 10.0.0.1.46263 > 10.0.0.2.5001: UDP, length 1470
00:09:35.913762 IP 10.0.0.1.46263 > 10.0.0.2.5001: UDP, length 1470
00:09:35.925082 IP 10.0.0.1.46263 > 10.0.0.2.5001: UDP, length 1470
00:09:35.937180 IP 10.0.0.1.46263 > 10.0.0.2.5001: UDP, length 1470
00:09:35.949950 IP 10.0.0.1.46263 > 10.0.0.2.5001: UDP, length 1470
00:09:35.961369 IP 10.0.0.1.46263 > 10.0.0.2.5001: UDP, length 1470
00:09:35.973487 IP 10.0.0.1.46263 > 10.0.0.2.5001: UDP, length 1470
00:09:35.985580 IP 10.0.0.1.46263 > 10.0.0.2.5001: UDP, length 1470
00:09:35.997668 IP 10.0.0.1.46263 > 10.0.0.2.5001: UDP, length 1470
00:09:36.009756 IP 10.0.0.1.46263 > 10.0.0.2.5001: UDP, length 1470
00:09:36.022621 IP 10.0.0.1.46263 > 10.0.0.2.5001: UDP, length 1470
00:09:36.033962 IP 10.0.0.1.46263 > 10.0.0.2.5001: UDP, length 1470
00:09:36.046075 IP 10.0.0.1.46263 > 10.0.0.2.5001: UDP, length 1470
00:09:36.058910 IP 10.0.0.1.46263 > 10.0.0.2.5001: UDP, length 1470
00:09:36.070259 IP 10.0.0.1.46263 > 10.0.0.2.5001: UDP, length 1470
00:09:36.083080 IP 10.0.0.1.46263 > 10.0.0.2.5001: UDP, length 1470
00:09:36.094418 IP 10.0.0.1.46263 > 10.0.0.2.5001: UDP, length 1470
00:09:36.106520 IP 10.0.0.1.46263 > 10.0.0.2.5001: UDP, length 1470
00:09:36.118603 IP 10.0.0.1.46263 > 10.0.0.2.5001: UDP, length 1470
00:09:36.131432 IP 10.0.0.1.46263 > 10.0.0.2.5001: UDP, length 1470
00:09:36.142777 IP 10.0.0.1.46263 > 10.0.0.2.5001: UDP, length 1470
00:09:36.166980 IP 10.0.0.1.46263 > 10.0.0.2.5001: UDP, length 1470
00:09:36.179040 IP 10.0.0.1.46263 > 10.0.0.2.5001: UDP, length 1470
00:09:36.191176 IP 10.0.0.1.46263 > 10.0.0.2.5001: UDP, length 1470
00:09:36.204113 IP 10.0.0.1.46263 > 10.0.0.2.5001: UDP, length 1470
00:09:36.227505 IP 10.0.0.1.46263 > 10.0.0.2.5001: UDP, length 1470
00:09:36.239595 IP 10.0.0.1.46263 > 10.0.0.2.5001: UDP, length 1470
00:09:36.251872 IP 10.0.0.1.46263 > 10.0.0.2.5001: UDP, length 1470
00:09:36.263770 IP 10.0.0.1.46263 > 10.0.0.2.5001: UDP, length 1470
00:09:36.275835 IP 10.0.0.1.46263 > 10.0.0.2.5001: UDP, length 1470
00:09:36.287967 IP 10.0.0.1.46263 > 10.0.0.2.5001: UDP, length 1470
00:09:36.312180 IP 10.0.0.1.46263 > 10.0.0.2.5001: UDP, length 1470
00:09:36.324958 IP 10.0.0.1.46263 > 10.0.0.2.5001: UDP, length 1470
00:09:36.336354 IP 10.0.0.1.46263 > 10.0.0.2.5001: UDP, length 1470
00:09:36.348429 IP 10.0.0.1.46263 > 10.0.0.2.5001: UDP, length 1470
00:09:36.360567 IP 10.0.0.1.46263 > 10.0.0.2.5001: UDP, length 1470
00:09:36.372779 IP 10.0.0.1.46263 > 10.0.0.2.5001: UDP, length 1470
00:09:36.384673 IP 10.0.0.1.46263 > 10.0.0.2.5001: UDP, length 1470
00:09:36.396832 IP 10.0.0.1.46263 > 10.0.0.2.5001: UDP, length 1470
00:09:36.409671 IP 10.0.0.1.46263 > 10.0.0.2.5001: UDP, length 1470
00:09:36.421036 IP 10.0.0.1.46263 > 10.0.0.2.5001: UDP, length 1470
00:09:36.433867 IP 10.0.0.1.46263 > 10.0.0.2.5001: UDP, length 1470
00:09:36.445205 IP 10.0.0.1.46263 > 10.0.0.2.5001: UDP, length 1470
00:09:36.457301 IP 10.0.0.1.46263 > 10.0.0.2.5001: UDP, length 1470
00:09:36.469659 IP 10.0.0.1.46263 > 10.0.0.2.5001: UDP, length 1470
00:09:36.481497 IP 10.0.0.1.46263 > 10.0.0.2.5001: UDP, length 1470
00:09:36.493595 IP 10.0.0.1.46263 > 10.0.0.2.5001: UDP, length 1470
00:09:36.505684 IP 10.0.0.1.46263 > 10.0.0.2.5001: UDP, length 1470
00:09:36.517752 IP 10.0.0.1.46263 > 10.0.0.2.5001: UDP, length 1470
00:09:36.529881 IP 10.0.0.1.46263 > 10.0.0.2.5001: UDP, length 1470
00:09:36.541960 IP 10.0.0.1.46263 > 10.0.0.2.5001: UDP, length 1470
00:09:36.554856 IP 10.0.0.1.46263 > 10.0.0.2.5001: UDP, length 1470
00:09:36.566171 IP 10.0.0.1.46263 > 10.0.0.2.5001: UDP, length 1470
00:09:36.579121 IP 10.0.0.1.46263 > 10.0.0.2.5001: UDP, length 1470
00:09:36.590359 IP 10.0.0.1.46263 > 10.0.0.2.5001: UDP, length 1470
00:09:36.602442 IP 10.0.0.1.46263 > 10.0.0.2.5001: UDP, length 1470
00:09:36.615571 IP 10.0.0.1.46263 > 10.0.0.2.5001: UDP, length 1470
00:09:36.626644 IP 10.0.0.1.46263 > 10.0.0.2.5001: UDP, length 1470
00:09:36.638757 IP 10.0.0.1.46263 > 10.0.0.2.5001: UDP, length 1470
00:09:36.650837 IP 10.0.0.1.46263 > 10.0.0.2.5001: UDP, length 1470
00:09:36.662934 IP 10.0.0.1.46263 > 10.0.0.2.5001: UDP, length 1470
00:09:36.674991 IP 10.0.0.1.46263 > 10.0.0.2.5001: UDP, length 1470
00:09:36.687144 IP 10.0.0.1.46263 > 10.0.0.2.5001: UDP, length 1470
00:09:36.699215 IP 10.0.0.1.46263 > 10.0.0.2.5001: UDP, length 1470
00:09:36.712106 IP 10.0.0.1.46263 > 10.0.0.2.5001: UDP, length 1470
00:09:36.723416 IP 10.0.0.1.46263 > 10.0.0.2.5001: UDP, length 1470
00:09:36.735518 IP 10.0.0.1.46263 > 10.0.0.2.5001: UDP, length 1470
00:09:36.747587 IP 10.0.0.1.46263 > 10.0.0.2.5001: UDP, length 1470
00:09:36.759874 IP 10.0.0.1.46263 > 10.0.0.2.5001: UDP, length 1470
00:09:36.771796 IP 10.0.0.1.46263 > 10.0.0.2.5001: UDP, length 1470
00:09:36.783871 IP 10.0.0.1.46263 > 10.0.0.2.5001: UDP, length 1470
00:09:36.795982 IP 10.0.0.1.46263 > 10.0.0.2.5001: UDP, length 1470
00:09:36.808090 IP 10.0.0.1.46263 > 10.0.0.2.5001: UDP, length 1470
00:09:36.820215 IP 10.0.0.1.46263 > 10.0.0.2.5001: UDP, length 1470
00:09:36.832271 IP 10.0.0.1.46263 > 10.0.0.2.5001: UDP, length 1470
00:09:36.844391 IP 10.0.0.1.46263 > 10.0.0.2.5001: UDP, length 1470
00:09:36.856486 IP 10.0.0.1.46263 > 10.0.0.2.5001: UDP, length 1470
00:09:36.868561 IP 10.0.0.1.46263 > 10.0.0.2.5001: UDP, length 1470
00:09:36.880695 IP 10.0.0.1.46263 > 10.0.0.2.5001: UDP, length 1470
00:09:36.892803 IP 10.0.0.1.46263 > 10.0.0.2.5001: UDP, length 1470
00:09:36.904864 IP 10.0.0.1.46263 > 10.0.0.2.5001: UDP, length 1470
00:09:36.916973 IP 10.0.0.1.46263 > 10.0.0.2.5001: UDP, length 1470
00:09:36.941134 IP 10.0.0.1.46263 > 10.0.0.2.5001: UDP, length 1470
00:09:36.953252 IP 10.0.0.1.46263 > 10.0.0.2.5001: UDP, length 1470
00:09:36.965334 IP 10.0.0.1.46263 > 10.0.0.2.5001: UDP, length 1470
00:09:36.978202 IP 10.0.0.1.46263 > 10.0.0.2.5001: UDP, length 1470
00:09:36.989529 IP 10.0.0.1.46263 > 10.0.0.2.5001: UDP, length 1470
00:09:37.001590 IP 10.0.0.1.46263 > 10.0.0.2.5001: UDP, length 1470
00:09:37.013750 IP 10.0.0.1.46263 > 10.0.0.2.5001: UDP, length 1470
00:09:37.025779 IP 10.0.0.1.46263 > 10.0.0.2.5001: UDP, length 1470
00:09:37.038106 IP 10.0.0.1.46263 > 10.0.0.2.5001: UDP, length 1470
00:09:37.049985 IP 10.0.0.1.46263 > 10.0.0.2.5001: UDP, length 1470
00:09:37.062093 IP 10.0.0.1.46263 > 10.0.0.2.5001: UDP, length 1470
00:09:37.074228 IP 10.0.0.1.46263 > 10.0.0.2.5001: UDP, length 1470
00:09:37.086292 IP 10.0.0.1.46263 > 10.0.0.2.5001: UDP, length 1470
00:09:37.098386 IP 10.0.0.1.46263 > 10.0.0.2.5001: UDP, length 1470
00:09:37.111199 IP 10.0.0.1.46263 > 10.0.0.2.5001: UDP, length 1470
00:09:37.122586 IP 10.0.0.1.46263 > 10.0.0.2.5001: UDP, length 1470
00:09:37.134679 IP 10.0.0.1.46263 > 10.0.0.2.5001: UDP, length 1470
00:09:37.146801 IP 10.0.0.1.46263 > 10.0.0.2.5001: UDP, length 1470
00:09:37.158821 IP 10.0.0.1.46263 > 10.0.0.2.5001: UDP, length 1470
00:09:37.170963 IP 10.0.0.1.46263 > 10.0.0.2.5001: UDP, length 1470
00:09:37.183053 IP 10.0.0.1.46263 > 10.0.0.2.5001: UDP, length 1470
00:09:37.195151 IP 10.0.0.1.46263 > 10.0.0.2.5001: UDP, length 1470
00:09:37.208054 IP 10.0.0.1.46263 > 10.0.0.2.5001: UDP, length 1470
00:09:37.219316 IP 10.0.0.1.46263 > 10.0.0.2.5001: UDP, length 1470
00:09:37.231461 IP 10.0.0.1.46263 > 10.0.0.2.5001: UDP, length 1470
00:09:37.244229 IP 10.0.0.1.46263 > 10.0.0.2.5001: UDP, length 1470
00:09:37.255613 IP 10.0.0.1.46263 > 10.0.0.2.5001: UDP, length 1470
00:09:37.267753 IP 10.0.0.1.46263 > 10.0.0.2.5001: UDP, length 1470
00:09:37.280592 IP 10.0.0.1.46263 > 10.0.0.2.5001: UDP, length 1470
00:09:37.291921 IP 10.0.0.1.46263 > 10.0.0.2.5001: UDP, length 1470
00:09:37.304788 IP 10.0.0.1.46263 > 10.0.0.2.5001: UDP, length 1470
00:09:37.316103 IP 10.0.0.1.46263 > 10.0.0.2.5001: UDP, length 1470
00:09:37.328218 IP 10.0.0.1.46263 > 10.0.0.2.5001: UDP, length 1470
00:09:37.340301 IP 10.0.0.1.46263 > 10.0.0.2.5001: UDP, length 1470
00:09:37.352429 IP 10.0.0.1.46263 > 10.0.0.2.5001: UDP, length 1470
00:09:37.364470 IP 10.0.0.1.46263 > 10.0.0.2.5001: UDP, length 1470
00:09:37.377209 IP 10.0.0.1.46263 > 10.0.0.2.5001: UDP, length 1470
00:09:37.388704 IP 10.0.0.1.46263 > 10.0.0.2.5001: UDP, length 1470
00:09:37.400770 IP 10.0.0.1.46263 > 10.0.0.2.5001: UDP, length 1470
00:09:37.412902 IP 10.0.0.1.46263 > 10.0.0.2.5001: UDP, length 1470
00:09:37.425139 IP 10.0.0.1.46263 > 10.0.0.2.5001: UDP, length 1470
00:09:37.437793 IP 10.0.0.1.46263 > 10.0.0.2.5001: UDP, length 1470
00:09:37.449173 IP 10.0.0.1.46263 > 10.0.0.2.5001: UDP, length 1470
00:09:37.461295 IP 10.0.0.1.46263 > 10.0.0.2.5001: UDP, length 1470
00:09:37.474190 IP 10.0.0.1.46263 > 10.0.0.2.5001: UDP, length 1470
00:09:37.485430 IP 10.0.0.1.46263 > 10.0.0.2.5001: UDP, length 1470
00:09:37.497572 IP 10.0.0.1.46263 > 10.0.0.2.5001: UDP, length 1470
00:09:37.509639 IP 10.0.0.1.46263 > 10.0.0.2.5001: UDP, length 1470
00:09:37.521735 IP 10.0.0.1.46263 > 10.0.0.2.5001: UDP, length 1470
00:09:37.534646 IP 10.0.0.1.46263 > 10.0.0.2.5001: UDP, length 1470
00:09:37.545958 IP 10.0.0.1.46263 > 10.0.0.2.5001: UDP, length 1470
00:09:37.558037 IP 10.0.0.1.46263 > 10.0.0.2.5001: UDP, length 1470
00:09:37.570135 IP 10.0.0.1.46263 > 10.0.0.2.5001: UDP, length 1470
00:09:37.582261 IP 10.0.0.1.46263 > 10.0.0.2.5001: UDP, length 1470
00:09:37.595109 IP 10.0.0.1.46263 > 10.0.0.2.5001: UDP, length 1470
00:09:37.606429 IP 10.0.0.1.46263 > 10.0.0.2.5001: UDP, length 1470
00:09:37.618511 IP 10.0.0.1.46263 > 10.0.0.2.5001: UDP, length 1470
00:09:37.630630 IP 10.0.0.1.46263 > 10.0.0.2.5001: UDP, length 1470
00:09:37.642740 IP 10.0.0.1.46263 > 10.0.0.2.5001: UDP, length 1470
00:09:37.654807 IP 10.0.0.1.46263 > 10.0.0.2.5001: UDP, length 1470
00:09:37.666916 IP 10.0.0.1.46263 > 10.0.0.2.5001: UDP, length 1470
00:09:37.679002 IP 10.0.0.1.46263 > 10.0.0.2.5001: UDP, length 1470
00:09:37.691102 IP 10.0.0.1.46263 > 10.0.0.2.5001: UDP, length 1470
00:09:37.703212 IP 10.0.0.1.46263 > 10.0.0.2.5001: UDP, length 1470
00:09:37.715300 IP 10.0.0.1.46263 > 10.0.0.2.5001: UDP, length 1470
00:09:37.728232 IP 10.0.0.1.46263 > 10.0.0.2.5001: UDP, length 1470
00:09:37.739489 IP 10.0.0.1.46263 > 10.0.0.2.5001: UDP, length 1470
00:09:37.751568 IP 10.0.0.1.46263 > 10.0.0.2.5001: UDP, length 1470
00:09:37.763694 IP 10.0.0.1.46263 > 10.0.0.2.5001: UDP, length 1470
00:09:37.776733 IP 10.0.0.1.46263 > 10.0.0.2.5001: UDP, length 1470
00:09:37.787870 IP 10.0.0.1.46263 > 10.0.0.2.5001: UDP, length 1470
00:09:37.799939 IP 10.0.0.1.46263 > 10.0.0.2.5001: UDP, length 1470
00:09:37.812061 IP 10.0.0.1.46263 > 10.0.0.2.5001: UDP, length 1470
00:09:37.824171 IP 10.0.0.1.46263 > 10.0.0.2.5001: UDP, length 1470
00:09:37.836258 IP 10.0.0.1.46263 > 10.0.0.2.5001: UDP, length 1470
00:09:37.848792 IP 10.0.0.1.46263 > 10.0.0.2.5001: UDP, length 1470
00:09:37.860454 IP 10.0.0.1.46263 > 10.0.0.2.5001: UDP, length 1470
00:09:37.873307 IP 10.0.0.1.46263 > 10.0.0.2.5001: UDP, length 1470
00:09:37.884643 IP 10.0.0.1.46263 > 10.0.0.2.5001: UDP, length 1470
00:09:37.909626 IP 10.0.0.1.46263 > 10.0.0.2.5001: UDP, length 1470
00:09:37.921101 IP 10.0.0.1.46263 > 10.0.0.2.5001: UDP, length 1470
00:09:37.933019 IP 10.0.0.1.46263 > 10.0.0.2.5001: UDP, length 1470
00:09:37.945104 IP 10.0.0.1.46263 > 10.0.0.2.5001: UDP, length 1470
00:09:37.957194 IP 10.0.0.1.46263 > 10.0.0.2.5001: UDP, length 1470
00:09:37.969303 IP 10.0.0.1.46263 > 10.0.0.2.5001: UDP, length 1470
00:09:37.982152 IP 10.0.0.1.46263 > 10.0.0.2.5001: UDP, length 1470
00:09:37.993464 IP 10.0.0.1.46263 > 10.0.0.2.5001: UDP, length 1470
00:09:38.005599 IP 10.0.0.1.46263 > 10.0.0.2.5001: UDP, length 1470
00:09:38.018483 IP 10.0.0.1.46263 > 10.0.0.2.5001: UDP, length 1470
00:09:38.029799 IP 10.0.0.1.46263 > 10.0.0.2.5001: UDP, length 1470
00:09:38.041883 IP 10.0.0.1.46263 > 10.0.0.2.5001: UDP, length 1470
00:09:38.053999 IP 10.0.0.1.46263 > 10.0.0.2.5001: UDP, length 1470
00:09:38.066039 IP 10.0.0.1.46263 > 10.0.0.2.5001: UDP, length 1470
00:09:38.078162 IP 10.0.0.1.46263 > 10.0.0.2.5001: UDP, length 1470
00:09:38.090285 IP 10.0.0.1.46263 > 10.0.0.2.5001: UDP, length 1470
00:09:38.102387 IP 10.0.0.1.46263 > 10.0.0.2.5001: UDP, length 1470
00:09:38.114430 IP 10.0.0.1.46263 > 10.0.0.2.5001: UDP, length 1470
00:09:38.126549 IP 10.0.0.1.46263 > 10.0.0.2.5001: UDP, length 1470
00:09:38.138599 IP 10.0.0.1.46263 > 10.0.0.2.5001: UDP, length 1470
00:09:38.150700 IP 10.0.0.1.46263 > 10.0.0.2.5001: UDP, length 1470
00:09:38.162842 IP 10.0.0.1.46263 > 10.0.0.2.5001: UDP, length 1470
00:09:38.174936 IP 10.0.0.1.46263 > 10.0.0.2.5001: UDP, length 1470
00:09:38.187040 IP 10.0.0.1.46263 > 10.0.0.2.5001: UDP, length 1470
00:09:38.199108 IP 10.0.0.1.46263 > 10.0.0.2.5001: UDP, length 1470
00:09:38.211209 IP 10.0.0.1.46263 > 10.0.0.2.5001: UDP, length 1470
00:09:38.223363 IP 10.0.0.1.46263 > 10.0.0.2.5001: UDP, length 1470
00:09:38.235390 IP 10.0.0.1.46263 > 10.0.0.2.5001: UDP, length 1470
00:09:38.247519 IP 10.0.0.1.46263 > 10.0.0.2.5001: UDP, length 1470
00:09:38.260361 IP 10.0.0.1.46263 > 10.0.0.2.5001: UDP, length 1470
00:09:38.271663 IP 10.0.0.1.46263 > 10.0.0.2.5001: UDP, length 1470
00:09:38.283840 IP 10.0.0.1.46263 > 10.0.0.2.5001: UDP, length 1470
00:09:38.296716 IP 10.0.0.1.46263 > 10.0.0.2.5001: UDP, length 1470
00:09:38.307999 IP 10.0.0.1.46263 > 10.0.0.2.5001: UDP, length 1470
00:09:38.320092 IP 10.0.0.1.46263 > 10.0.0.2.5001: UDP, length 1470
00:09:38.332144 IP 10.0.0.1.46263 > 10.0.0.2.5001: UDP, length 1470
00:09:38.345054 IP 10.0.0.1.46263 > 10.0.0.2.5001: UDP, length 1470
00:09:38.356388 IP 10.0.0.1.46263 > 10.0.0.2.5001: UDP, length 1470
00:09:38.368447 IP 10.0.0.1.46263 > 10.0.0.2.5001: UDP, length 1470
00:09:38.381462 IP 10.0.0.1.46263 > 10.0.0.2.5001: UDP, length 1470
00:09:38.392665 IP 10.0.0.1.46263 > 10.0.0.2.5001: UDP, length 1470
00:09:38.404800 IP 10.0.0.1.46263 > 10.0.0.2.5001: UDP, length 1470
00:09:38.417610 IP 10.0.0.1.46263 > 10.0.0.2.5001: UDP, length 1470
00:09:38.428958 IP 10.0.0.1.46263 > 10.0.0.2.5001: UDP, length 1470
00:09:38.441012 IP 10.0.0.1.46263 > 10.0.0.2.5001: UDP, length 1470
00:09:38.453196 IP 10.0.0.1.46263 > 10.0.0.2.5001: UDP, length 1470
00:09:38.465278 IP 10.0.0.1.46263 > 10.0.0.2.5001: UDP, length 1470
00:09:38.477383 IP 10.0.0.1.46263 > 10.0.0.2.5001: UDP, length 1470
00:09:38.489452 IP 10.0.0.1.46263 > 10.0.0.2.5001: UDP, length 1470
00:09:38.502271 IP 10.0.0.1.46263 > 10.0.0.2.5001: UDP, length 1470
00:09:38.513626 IP 10.0.0.1.46263 > 10.0.0.2.5001: UDP, length 1470
00:09:38.525693 IP 10.0.0.1.46263 > 10.0.0.2.5001: UDP, length 1470
00:09:38.537832 IP 10.0.0.1.46263 > 10.0.0.2.5001: UDP, length 1470
00:09:38.562012 IP 10.0.0.1.46263 > 10.0.0.2.5001: UDP, length 1470
00:09:38.574098 IP 10.0.0.1.46263 > 10.0.0.2.5001: UDP, length 1470
00:09:38.586200 IP 10.0.0.1.46263 > 10.0.0.2.5001: UDP, length 1470
00:09:38.598300 IP 10.0.0.1.46263 > 10.0.0.2.5001: UDP, length 1470
00:09:38.611171 IP 10.0.0.1.46263 > 10.0.0.2.5001: UDP, length 1470
00:09:38.622463 IP 10.0.0.1.46263 > 10.0.0.2.5001: UDP, length 1470
00:09:38.634588 IP 10.0.0.1.46263 > 10.0.0.2.5001: UDP, length 1470
00:09:38.647425 IP 10.0.0.1.46263 > 10.0.0.2.5001: UDP, length 1470
00:09:38.658753 IP 10.0.0.1.46263 > 10.0.0.2.5001: UDP, length 1470
00:09:38.670886 IP 10.0.0.1.46263 > 10.0.0.2.5001: UDP, length 1470
00:09:38.682979 IP 10.0.0.1.46263 > 10.0.0.2.5001: UDP, length 1470
00:09:38.695914 IP 10.0.0.1.46263 > 10.0.0.2.5001: UDP, length 1470
00:09:38.707160 IP 10.0.0.1.46263 > 10.0.0.2.5001: UDP, length 1470
00:09:38.719255 IP 10.0.0.1.46263 > 10.0.0.2.5001: UDP, length 1470
00:09:38.732237 IP 10.0.0.1.46263 > 10.0.0.2.5001: UDP, length 1470
00:09:38.743425 IP 10.0.0.1.46263 > 10.0.0.2.5001: UDP, length 1470
00:09:38.755520 IP 10.0.0.1.46263 > 10.0.0.2.5001: UDP, length 1470
00:09:38.768425 IP 10.0.0.1.46263 > 10.0.0.2.5001: UDP, length 1470
00:09:38.779729 IP 10.0.0.1.46263 > 10.0.0.2.5001: UDP, length 1470
00:09:38.791821 IP 10.0.0.1.46263 > 10.0.0.2.5001: UDP, length 1470
00:09:38.803896 IP 10.0.0.1.46263 > 10.0.0.2.5001: UDP, length 1470
00:09:38.816040 IP 10.0.0.1.46263 > 10.0.0.2.5001: UDP, length 1470
00:09:38.828846 IP 10.0.0.1.46263 > 10.0.0.2.5001: UDP, length 1470
00:09:38.840203 IP 10.0.0.1.46263 > 10.0.0.2.5001: UDP, length 1470
00:09:38.852345 IP 10.0.0.1.46263 > 10.0.0.2.5001: UDP, length 1470
00:09:38.864421 IP 10.0.0.1.46263 > 10.0.0.2.5001: UDP, length 1470
00:09:38.876500 IP 10.0.0.1.46263 > 10.0.0.2.5001: UDP, length 1470
00:09:38.888606 IP 10.0.0.1.46263 > 10.0.0.2.5001: UDP, length 1470
00:09:38.900689 IP 10.0.0.1.46263 > 10.0.0.2.5001: UDP, length 1470
00:09:38.912839 IP 10.0.0.1.46263 > 10.0.0.2.5001: UDP, length 1470
00:09:38.924887 IP 10.0.0.1.46263 > 10.0.0.2.5001: UDP, length 1470
00:09:38.937761 IP 10.0.0.1.46263 > 10.0.0.2.5001: UDP, length 1470
00:09:38.949080 IP 10.0.0.1.46263 > 10.0.0.2.5001: UDP, length 1470
00:09:38.961140 IP 10.0.0.1.46263 > 10.0.0.2.5001: UDP, length 1470
00:09:38.974074 IP 10.0.0.1.46263 > 10.0.0.2.5001: UDP, length 1470
00:09:38.985390 IP 10.0.0.1.46263 > 10.0.0.2.5001: UDP, length 1470
00:09:38.997464 IP 10.0.0.1.46263 > 10.0.0.2.5001: UDP, length 1470
00:09:39.009554 IP 10.0.0.1.46263 > 10.0.0.2.5001: UDP, length 1470
00:09:39.021637 IP 10.0.0.1.46263 > 10.0.0.2.5001: UDP, length 1470
00:09:39.033781 IP 10.0.0.1.46263 > 10.0.0.2.5001: UDP, length 1470
00:09:39.045877 IP 10.0.0.1.46263 > 10.0.0.2.5001: UDP, length 1470
00:09:39.057955 IP 10.0.0.1.46263 > 10.0.0.2.5001: UDP, length 1470
00:09:39.070066 IP 10.0.0.1.46263 > 10.0.0.2.5001: UDP, length 1470
00:09:39.082105 IP 10.0.0.1.46263 > 10.0.0.2.5001: UDP, length 1470
00:09:39.094228 IP 10.0.0.1.46263 > 10.0.0.2.5001: UDP, length 1470
00:09:39.106341 IP 10.0.0.1.46263 > 10.0.0.2.5001: UDP, length 1470
00:09:39.119175 IP 10.0.0.1.46263 > 10.0.0.2.5001: UDP, length 1470
00:09:39.130481 IP 10.0.0.1.46263 > 10.0.0.2.5001: UDP, length 1470
00:09:39.142558 IP 10.0.0.1.46263 > 10.0.0.2.5001: UDP, length 1470
00:09:39.154705 IP 10.0.0.1.46263 > 10.0.0.2.5001: UDP, length 1470
00:09:39.167659 IP 10.0.0.1.46263 > 10.0.0.2.5001: UDP, length 1470
00:09:39.178940 IP 10.0.0.1.46263 > 10.0.0.2.5001: UDP, length 1470
00:09:39.191011 IP 10.0.0.1.46263 > 10.0.0.2.5001: UDP, length 1470
00:09:39.203809 IP 10.0.0.1.46263 > 10.0.0.2.5001: UDP, length 1470
00:09:39.215140 IP 10.0.0.1.46263 > 10.0.0.2.5001: UDP, length 1470
00:09:39.227300 IP 10.0.0.1.46263 > 10.0.0.2.5001: UDP, length 1470
00:09:39.239390 IP 10.0.0.1.46263 > 10.0.0.2.5001: UDP, length 1470
00:09:39.251464 IP 10.0.0.1.46263 > 10.0.0.2.5001: UDP, length 1470
00:09:39.263582 IP 10.0.0.1.46263 > 10.0.0.2.5001: UDP, length 1470
00:09:39.275629 IP 10.0.0.1.46263 > 10.0.0.2.5001: UDP, length 1470
00:09:39.287773 IP 10.0.0.1.46263 > 10.0.0.2.5001: UDP, length 1470
00:09:39.299874 IP 10.0.0.1.46263 > 10.0.0.2.5001: UDP, length 1470
00:09:39.312776 IP 10.0.0.1.46263 > 10.0.0.2.5001: UDP, length 1470
00:09:39.324034 IP 10.0.0.1.46263 > 10.0.0.2.5001: UDP, length 1470
00:09:39.336156 IP 10.0.0.1.46263 > 10.0.0.2.5001: UDP, length 1470
00:09:39.348258 IP 10.0.0.1.46263 > 10.0.0.2.5001: UDP, length 1470
00:09:39.360354 IP 10.0.0.1.46263 > 10.0.0.2.5001: UDP, length 1470
00:09:39.372459 IP 10.0.0.1.46263 > 10.0.0.2.5001: UDP, length 1470
00:09:39.385251 IP 10.0.0.1.46263 > 10.0.0.2.5001: UDP, length 1470
00:09:39.396628 IP 10.0.0.1.46263 > 10.0.0.2.5001: UDP, length 1470
00:09:39.408759 IP 10.0.0.1.46263 > 10.0.0.2.5001: UDP, length 1470
00:09:39.420842 IP 10.0.0.1.46263 > 10.0.0.2.5001: UDP, length 1470
00:09:39.432944 IP 10.0.0.1.46263 > 10.0.0.2.5001: UDP, length 1470
00:09:39.445004 IP 10.0.0.1.46263 > 10.0.0.2.5001: UDP, length 1470
00:09:39.457090 IP 10.0.0.1.46263 > 10.0.0.2.5001: UDP, length 1470
00:09:39.469223 IP 10.0.0.1.46263 > 10.0.0.2.5001: UDP, length 1470
00:09:39.481324 IP 10.0.0.1.46263 > 10.0.0.2.5001: UDP, length 1470
00:09:39.493389 IP 10.0.0.1.46263 > 10.0.0.2.5001: UDP, length 1470
00:09:39.505517 IP 10.0.0.1.46263 > 10.0.0.2.5001: UDP, length 1470
00:09:39.517693 IP 10.0.0.1.46263 > 10.0.0.2.5001: UDP, length 1470
00:09:39.529648 IP 10.0.0.1.46263 > 10.0.0.2.5001: UDP, length 1470
00:09:39.541802 IP 10.0.0.1.46263 > 10.0.0.2.5001: UDP, length 1470
00:09:39.553885 IP 10.0.0.1.46263 > 10.0.0.2.5001: UDP, length 1470
00:09:39.565973 IP 10.0.0.1.46263 > 10.0.0.2.5001: UDP, length 1470
00:09:39.578090 IP 10.0.0.1.46263 > 10.0.0.2.5001: UDP, length 1470
00:09:39.590135 IP 10.0.0.1.46263 > 10.0.0.2.5001: UDP, length 1470
00:09:39.602468 IP 10.0.0.1.46263 > 10.0.0.2.5001: UDP, length 1470
00:09:39.615262 IP 10.0.0.1.46263 > 10.0.0.2.5001: UDP, length 1470
00:09:39.626458 IP 10.0.0.1.46263 > 10.0.0.2.5001: UDP, length 1470
00:09:39.638541 IP 10.0.0.1.46263 > 10.0.0.2.5001: UDP, length 1470
00:09:39.651427 IP 10.0.0.1.46263 > 10.0.0.2.5001: UDP, length 1470
00:09:39.662800 IP 10.0.0.1.46263 > 10.0.0.2.5001: UDP, length 1470
00:09:39.674856 IP 10.0.0.1.46263 > 10.0.0.2.5001: UDP, length 1470
00:09:39.686934 IP 10.0.0.1.46263 > 10.0.0.2.5001: UDP, length 1470
00:09:39.699031 IP 10.0.0.1.46263 > 10.0.0.2.5001: UDP, length 1470
00:09:39.711795 IP 10.0.0.1.46263 > 10.0.0.2.5001: UDP, length 1470
00:09:39.723270 IP 10.0.0.1.46263 > 10.0.0.2.5001: UDP, length 1470
00:09:39.735311 IP 10.0.0.1.46263 > 10.0.0.2.5001: UDP, length 1470
00:09:39.748176 IP 10.0.0.1.46263 > 10.0.0.2.5001: UDP, length 1470
00:09:39.759538 IP 10.0.0.1.46263 > 10.0.0.2.5001: UDP, length 1470
00:09:39.771614 IP 10.0.0.1.46263 > 10.0.0.2.5001: UDP, length 1470
00:09:39.783743 IP 10.0.0.1.46263 > 10.0.0.2.5001: UDP, length 1470
00:09:39.795818 IP 10.0.0.1.46263 > 10.0.0.2.5001: UDP, length 1470
00:09:39.807901 IP 10.0.0.1.46263 > 10.0.0.2.5001: UDP, length 1470
00:09:39.820002 IP 10.0.0.1.46263 > 10.0.0.2.5001: UDP, length 1470
00:09:39.832085 IP 10.0.0.1.46263 > 10.0.0.2.5001: UDP, length 1470
00:09:39.844942 IP 10.0.0.1.46263 > 10.0.0.2.5001: UDP, length 1470
00:09:39.856301 IP 10.0.0.1.46263 > 10.0.0.2.5001: UDP, length 1470
00:09:39.869086 IP 10.0.0.1.46263 > 10.0.0.2.5001: UDP, length 1470
00:09:39.880483 IP 10.0.0.1.46263 > 10.0.0.2.5001: UDP, length 1470
00:09:39.892577 IP 10.0.0.1.46263 > 10.0.0.2.5001: UDP, length 1470
00:09:39.904670 IP 10.0.0.1.46263 > 10.0.0.2.5001: UDP, length 1470
00:09:39.916762 IP 10.0.0.1.46263 > 10.0.0.2.5001: UDP, length 1470
00:09:39.928859 IP 10.0.0.1.46263 > 10.0.0.2.5001: UDP, length 1470
00:09:39.940967 IP 10.0.0.1.46263 > 10.0.0.2.5001: UDP, length 1470
00:09:39.953036 IP 10.0.0.1.46263 > 10.0.0.2.5001: UDP, length 1470
00:09:39.965135 IP 10.0.0.1.46263 > 10.0.0.2.5001: UDP, length 1470
00:09:39.977271 IP 10.0.0.1.46263 > 10.0.0.2.5001: UDP, length 1470
00:09:39.989313 IP 10.0.0.1.46263 > 10.0.0.2.5001: UDP, length 1470
00:09:40.001426 IP 10.0.0.1.46263 > 10.0.0.2.5001: UDP, length 1470
00:09:40.013513 IP 10.0.0.1.46263 > 10.0.0.2.5001: UDP, length 1470
00:09:40.025593 IP 10.0.0.1.46263 > 10.0.0.2.5001: UDP, length 1470
00:09:40.037672 IP 10.0.0.1.46263 > 10.0.0.2.5001: UDP, length 1470
00:09:40.049815 IP 10.0.0.1.46263 > 10.0.0.2.5001: UDP, length 1470
00:09:40.061918 IP 10.0.0.1.46263 > 10.0.0.2.5001: UDP, length 1470
00:09:40.074807 IP 10.0.0.1.46263 > 10.0.0.2.5001: UDP, length 1470
00:09:40.086088 IP 10.0.0.1.46263 > 10.0.0.2.5001: UDP, length 1470
00:09:40.098944 IP 10.0.0.1.46263 > 10.0.0.2.5001: UDP, length 1470
00:09:40.110285 IP 10.0.0.1.46263 > 10.0.0.2.5001: UDP, length 1470
00:09:40.122357 IP 10.0.0.1.46263 > 10.0.0.2.5001: UDP, length 1470
00:09:40.134517 IP 10.0.0.1.46263 > 10.0.0.2.5001: UDP, length 1470
00:09:40.147488 IP 10.0.0.1.46263 > 10.0.0.2.5001: UDP, length 1470
00:09:40.158669 IP 10.0.0.1.46263 > 10.0.0.2.5001: UDP, length 1470
00:09:40.170807 IP 10.0.0.1.46263 > 10.0.0.2.5001: UDP, length 1470
00:09:40.183791 IP 10.0.0.1.46263 > 10.0.0.2.5001: UDP, length 1470
00:09:40.194962 IP 10.0.0.1.46263 > 10.0.0.2.5001: UDP, length 1470
00:09:40.207861 IP 10.0.0.1.46263 > 10.0.0.2.5001: UDP, length 1470
00:09:40.219163 IP 10.0.0.1.46263 > 10.0.0.2.5001: UDP, length 1470
00:09:40.231287 IP 10.0.0.1.46263 > 10.0.0.2.5001: UDP, length 1470
00:09:40.243315 IP 10.0.0.1.46263 > 10.0.0.2.5001: UDP, length 1470
00:09:40.255469 IP 10.0.0.1.46263 > 10.0.0.2.5001: UDP, length 1470
00:09:40.267554 IP 10.0.0.1.46263 > 10.0.0.2.5001: UDP, length 1470
00:09:40.280465 IP 10.0.0.1.46263 > 10.0.0.2.5001: UDP, length 1470
00:09:40.291750 IP 10.0.0.1.46263 > 10.0.0.2.5001: UDP, length 1470
00:09:40.303845 IP 10.0.0.1.46263 > 10.0.0.2.5001: UDP, length 1470
00:09:40.315940 IP 10.0.0.1.46263 > 10.0.0.2.5001: UDP, length 1470
00:09:40.340126 IP 10.0.0.1.46263 > 10.0.0.2.5001: UDP, length 1470
00:09:40.352228 IP 10.0.0.1.46263 > 10.0.0.2.5001: UDP, length 1470
00:09:40.364346 IP 10.0.0.1.46263 > 10.0.0.2.5001: UDP, length 1470
00:09:40.376986 IP 10.0.0.1.46263 > 10.0.0.2.5001: UDP, length 1470
00:09:40.388521 IP 10.0.0.1.46263 > 10.0.0.2.5001: UDP, length 1470
00:09:40.400564 IP 10.0.0.1.46263 > 10.0.0.2.5001: UDP, length 1470
00:09:40.412681 IP 10.0.0.1.46263 > 10.0.0.2.5001: UDP, length 1470
00:09:40.424793 IP 10.0.0.1.46263 > 10.0.0.2.5001: UDP, length 1470
00:09:40.436898 IP 10.0.0.1.46263 > 10.0.0.2.5001: UDP, length 1470
00:09:40.448989 IP 10.0.0.1.46263 > 10.0.0.2.5001: UDP, length 1470
00:09:40.461078 IP 10.0.0.1.46263 > 10.0.0.2.5001: UDP, length 1470
00:09:40.473176 IP 10.0.0.1.46263 > 10.0.0.2.5001: UDP, length 1470
00:09:40.485262 IP 10.0.0.1.46263 > 10.0.0.2.5001: UDP, length 1470
00:09:40.497374 IP 10.0.0.1.46263 > 10.0.0.2.5001: UDP, length 1470
00:09:40.510255 IP 10.0.0.1.46263 > 10.0.0.2.5001: UDP, length 1470
00:09:40.521543 IP 10.0.0.1.46263 > 10.0.0.2.5001: UDP, length 1470
00:09:40.533627 IP 10.0.0.1.46263 > 10.0.0.2.5001: UDP, length 1470
00:09:40.546601 IP 10.0.0.1.46263 > 10.0.0.2.5001: UDP, length 1470
00:09:40.557901 IP 10.0.0.1.46263 > 10.0.0.2.5001: UDP, length 1470
00:09:40.569955 IP 10.0.0.1.46263 > 10.0.0.2.5001: UDP, length 1470
00:09:40.582044 IP 10.0.0.1.46263 > 10.0.0.2.5001: UDP, length 1470
00:09:40.594138 IP 10.0.0.1.46263 > 10.0.0.2.5001: UDP, length 1470
00:09:40.606930 IP 10.0.0.1.46263 > 10.0.0.2.5001: UDP, length 1470
00:09:40.630422 IP 10.0.0.1.46263 > 10.0.0.2.5001: UDP, length 1470
00:09:40.642521 IP 10.0.0.1.46263 > 10.0.0.2.5001: UDP, length 1470
00:09:40.654633 IP 10.0.0.1.46263 > 10.0.0.2.5001: UDP, length 1470
00:09:40.678797 IP 10.0.0.1.46263 > 10.0.0.2.5001: UDP, length 1470
00:09:40.690920 IP 10.0.0.1.46263 > 10.0.0.2.5001: UDP, length 1470
00:09:40.703755 IP 10.0.0.1.46263 > 10.0.0.2.5001: UDP, length 1470
00:09:40.715097 IP 10.0.0.1.46263 > 10.0.0.2.5001: UDP, length 1470
00:09:40.727215 IP 10.0.0.1.46263 > 10.0.0.2.5001: UDP, length 1470
00:09:40.739269 IP 10.0.0.1.46263 > 10.0.0.2.5001: UDP, length 1470
00:09:40.751745 IP 10.0.0.1.46263 > 10.0.0.2.5001: UDP, length 1470
00:09:40.763491 IP 10.0.0.1.46263 > 10.0.0.2.5001: UDP, length 1470
00:09:40.775542 IP 10.0.0.1.46263 > 10.0.0.2.5001: UDP, length 1470
00:09:40.788384 IP 10.0.0.1.46263 > 10.0.0.2.5001: UDP, length 1470
00:09:40.799779 IP 10.0.0.1.46263 > 10.0.0.2.5001: UDP, length 1470
00:09:40.811881 IP 10.0.0.1.46263 > 10.0.0.2.5001: UDP, length 1470
00:09:40.824716 IP 10.0.0.1.46263 > 10.0.0.2.5001: UDP, length 1470
00:09:40.848130 IP 10.0.0.1.46263 > 10.0.0.2.5001: UDP, length 1470
00:09:40.860254 IP 10.0.0.1.46263 > 10.0.0.2.5001: UDP, length 1470
00:09:40.872374 IP 10.0.0.1.46263 > 10.0.0.2.5001: UDP, length 1470
00:09:40.884452 IP 10.0.0.1.46263 > 10.0.0.2.5001: UDP, length 1470
00:09:40.896553 IP 10.0.0.1.46263 > 10.0.0.2.5001: UDP, length 1470
00:09:40.908640 IP 10.0.0.1.46263 > 10.0.0.2.5001: UDP, length 1470
00:09:40.920752 IP 10.0.0.1.46263 > 10.0.0.2.5001: UDP, length 1470
00:09:40.932800 IP 10.0.0.1.46263 > 10.0.0.2.5001: UDP, length 1470
00:09:40.945248 IP 10.0.0.1.46263 > 10.0.0.2.5001: UDP, length 1470
00:09:40.969294 IP 10.0.0.1.46263 > 10.0.0.2.5001: UDP, length 1470
00:09:40.981196 IP 10.0.0.1.46263 > 10.0.0.2.5001: UDP, length 1470
00:09:40.994075 IP 10.0.0.1.46263 > 10.0.0.2.5001: UDP, length 1470
00:09:41.005622 IP 10.0.0.1.46263 > 10.0.0.2.5001: UDP, length 1470
00:09:41.017488 IP 10.0.0.1.46263 > 10.0.0.2.5001: UDP, length 1470
00:09:41.030348 IP 10.0.0.1.46263 > 10.0.0.2.5001: UDP, length 1470
00:09:41.041684 IP 10.0.0.1.46263 > 10.0.0.2.5001: UDP, length 1470
00:09:41.053784 IP 10.0.0.1.46263 > 10.0.0.2.5001: UDP, length 1470
00:09:41.066668 IP 10.0.0.1.46263 > 10.0.0.2.5001: UDP, length 1470
00:09:41.077992 IP 10.0.0.1.46263 > 10.0.0.2.5001: UDP, length 1470
00:09:41.090037 IP 10.0.0.1.46263 > 10.0.0.2.5001: UDP, length 1470
00:09:41.102199 IP 10.0.0.1.46263 > 10.0.0.2.5001: UDP, length 1470
00:09:41.114279 IP 10.0.0.1.46263 > 10.0.0.2.5001: UDP, length 1470
00:09:41.126526 IP 10.0.0.1.46263 > 10.0.0.2.5001: UDP, length 1470
00:09:41.138450 IP 10.0.0.1.46263 > 10.0.0.2.5001: UDP, length 1470
00:09:41.150521 IP 10.0.0.1.46263 > 10.0.0.2.5001: UDP, length 1470
00:09:41.162638 IP 10.0.0.1.46263 > 10.0.0.2.5001: UDP, length 1470
00:09:41.174749 IP 10.0.0.1.46263 > 10.0.0.2.5001: UDP, length 1470
00:09:41.186847 IP 10.0.0.1.46263 > 10.0.0.2.5001: UDP, length 1470
00:09:41.199739 IP 10.0.0.1.46263 > 10.0.0.2.5001: UDP, length 1470
00:09:41.211037 IP 10.0.0.1.46263 > 10.0.0.2.5001: UDP, length 1470
00:09:41.223103 IP 10.0.0.1.46263 > 10.0.0.2.5001: UDP, length 1470
00:09:41.235231 IP 10.0.0.1.46263 > 10.0.0.2.5001: UDP, length 1470
00:09:41.247317 IP 10.0.0.1.46263 > 10.0.0.2.5001: UDP, length 1470
00:09:41.259427 IP 10.0.0.1.46263 > 10.0.0.2.5001: UDP, length 1470
00:09:41.271489 IP 10.0.0.1.46263 > 10.0.0.2.5001: UDP, length 1470
00:09:41.283570 IP 10.0.0.1.46263 > 10.0.0.2.5001: UDP, length 1470
00:09:41.295688 IP 10.0.0.1.46263 > 10.0.0.2.5001: UDP, length 1470
00:09:41.307771 IP 10.0.0.1.46263 > 10.0.0.2.5001: UDP, length 1470
00:09:41.319886 IP 10.0.0.1.46263 > 10.0.0.2.5001: UDP, length 1470
00:09:41.332003 IP 10.0.0.1.46263 > 10.0.0.2.5001: UDP, length 1470
00:09:41.344060 IP 10.0.0.1.46263 > 10.0.0.2.5001: UDP, length 1470
00:09:41.356370 IP 10.0.0.1.46263 > 10.0.0.2.5001: UDP, length 1470
00:09:41.368250 IP 10.0.0.1.46263 > 10.0.0.2.5001: UDP, length 1470
00:09:41.380389 IP 10.0.0.1.46263 > 10.0.0.2.5001: UDP, length 1470
00:09:41.392767 IP 10.0.0.1.46263 > 10.0.0.2.5001: UDP, length 1470
00:09:41.404575 IP 10.0.0.1.46263 > 10.0.0.2.5001: UDP, length 1470
00:09:41.416657 IP 10.0.0.1.46263 > 10.0.0.2.5001: UDP, length 1470
00:09:41.429535 IP 10.0.0.1.46263 > 10.0.0.2.5001: UDP, length 1470
00:09:41.440872 IP 10.0.0.1.46263 > 10.0.0.2.5001: UDP, length 1470
00:09:41.452935 IP 10.0.0.1.46263 > 10.0.0.2.5001: UDP, length 1470
00:09:41.465035 IP 10.0.0.1.46263 > 10.0.0.2.5001: UDP, length 1470
00:09:41.477144 IP 10.0.0.1.46263 > 10.0.0.2.5001: UDP, length 1470
00:09:41.489244 IP 10.0.0.1.46263 > 10.0.0.2.5001: UDP, length 1470
00:09:41.501308 IP 10.0.0.1.46263 > 10.0.0.2.5001: UDP, length 1470
00:09:41.513483 IP 10.0.0.1.46263 > 10.0.0.2.5001: UDP, length 1470
00:09:41.525516 IP 10.0.0.1.46263 > 10.0.0.2.5001: UDP, length 1470
00:09:41.537613 IP 10.0.0.1.46263 > 10.0.0.2.5001: UDP, length 1470
00:09:41.549741 IP 10.0.0.1.46263 > 10.0.0.2.5001: UDP, length 1470
00:09:41.562572 IP 10.0.0.1.46263 > 10.0.0.2.5001: UDP, length 1470
00:09:41.573936 IP 10.0.0.1.46263 > 10.0.0.2.5001: UDP, length 1470
00:09:41.586003 IP 10.0.0.1.46263 > 10.0.0.2.5001: UDP, length 1470
00:09:41.598109 IP 10.0.0.1.46263 > 10.0.0.2.5001: UDP, length 1470
00:09:41.610207 IP 10.0.0.1.46263 > 10.0.0.2.5001: UDP, length 1470
00:09:41.622301 IP 10.0.0.1.46263 > 10.0.0.2.5001: UDP, length 1470
00:09:41.634375 IP 10.0.0.1.46263 > 10.0.0.2.5001: UDP, length 1470
00:09:41.646503 IP 10.0.0.1.46263 > 10.0.0.2.5001: UDP, length 1470
00:09:41.658625 IP 10.0.0.1.46263 > 10.0.0.2.5001: UDP, length 1470
00:09:41.670701 IP 10.0.0.1.46263 > 10.0.0.2.5001: UDP, length 1470
00:09:41.682787 IP 10.0.0.1.46263 > 10.0.0.2.5001: UDP, length 1470
00:09:41.694903 IP 10.0.0.1.46263 > 10.0.0.2.5001: UDP, length 1470
00:09:41.707722 IP 10.0.0.1.46263 > 10.0.0.2.5001: UDP, length 1470
00:09:41.719057 IP 10.0.0.1.46263 > 10.0.0.2.5001: UDP, length 1470
00:09:41.731173 IP 10.0.0.1.46263 > 10.0.0.2.5001: UDP, length 1470
00:09:41.743235 IP 10.0.0.1.46263 > 10.0.0.2.5001: UDP, length 1470
00:09:41.755357 IP 10.0.0.1.46263 > 10.0.0.2.5001: UDP, length 1470
00:09:41.767435 IP 10.0.0.1.46263 > 10.0.0.2.5001: UDP, length 1470
00:09:41.779553 IP 10.0.0.1.46263 > 10.0.0.2.5001: UDP, length 1470
00:09:41.792585 IP 10.0.0.1.46263 > 10.0.0.2.5001: UDP, length 1470
00:09:41.803711 IP 10.0.0.1.46263 > 10.0.0.2.5001: UDP, length 1470
00:09:41.815832 IP 10.0.0.1.46263 > 10.0.0.2.5001: UDP, length 1470
00:09:41.827917 IP 10.0.0.1.46263 > 10.0.0.2.5001: UDP, length 1470
00:09:41.840800 IP 10.0.0.1.46263 > 10.0.0.2.5001: UDP, length 1470
00:09:41.852146 IP 10.0.0.1.46263 > 10.0.0.2.5001: UDP, length 1470
00:09:41.865472 IP 10.0.0.1.46263 > 10.0.0.2.5001: UDP, length 1470
00:09:41.876306 IP 10.0.0.1.46263 > 10.0.0.2.5001: UDP, length 1470
00:09:41.888376 IP 10.0.0.1.46263 > 10.0.0.2.5001: UDP, length 1470
00:09:41.900478 IP 10.0.0.1.46263 > 10.0.0.2.5001: UDP, length 1470
00:09:41.912637 IP 10.0.0.1.46263 > 10.0.0.2.5001: UDP, length 1470
00:09:41.924707 IP 10.0.0.1.46263 > 10.0.0.2.5001: UDP, length 1470
00:09:41.936800 IP 10.0.0.1.46263 > 10.0.0.2.5001: UDP, length 1470
00:09:41.948887 IP 10.0.0.1.46263 > 10.0.0.2.5001: UDP, length 1470
00:09:41.960980 IP 10.0.0.1.46263 > 10.0.0.2.5001: UDP, length 1470
00:09:41.973105 IP 10.0.0.1.46263 > 10.0.0.2.5001: UDP, length 1470
00:09:41.985222 IP 10.0.0.1.46263 > 10.0.0.2.5001: UDP, length 1470
00:09:41.997236 IP 10.0.0.1.46263 > 10.0.0.2.5001: UDP, length 1470
00:09:42.009377 IP 10.0.0.1.46263 > 10.0.0.2.5001: UDP, length 1470
00:09:42.021442 IP 10.0.0.1.46263 > 10.0.0.2.5001: UDP, length 1470
00:09:42.033548 IP 10.0.0.1.46263 > 10.0.0.2.5001: UDP, length 1470
00:09:42.045682 IP 10.0.0.1.46263 > 10.0.0.2.5001: UDP, length 1470
00:09:42.057736 IP 10.0.0.1.46263 > 10.0.0.2.5001: UDP, length 1470
00:09:42.069950 IP 10.0.0.1.46263 > 10.0.0.2.5001: UDP, length 1470
00:09:42.081951 IP 10.0.0.1.46263 > 10.0.0.2.5001: UDP, length 1470
00:09:42.093995 IP 10.0.0.1.46263 > 10.0.0.2.5001: UDP, length 1470
00:09:42.106956 IP 10.0.0.1.46263 > 10.0.0.2.5001: UDP, length 1470
00:09:42.118211 IP 10.0.0.1.46263 > 10.0.0.2.5001: UDP, length 1470
00:09:42.131060 IP 10.0.0.1.46263 > 10.0.0.2.5001: UDP, length 1470
00:09:42.142428 IP 10.0.0.1.46263 > 10.0.0.2.5001: UDP, length 1470
00:09:42.154499 IP 10.0.0.1.46263 > 10.0.0.2.5001: UDP, length 1470
00:09:42.166662 IP 10.0.0.1.46263 > 10.0.0.2.5001: UDP, length 1470
00:09:42.178739 IP 10.0.0.1.46263 > 10.0.0.2.5001: UDP, length 1470
00:09:42.190825 IP 10.0.0.1.46263 > 10.0.0.2.5001: UDP, length 1470
00:09:42.215014 IP 10.0.0.1.46263 > 10.0.0.2.5001: UDP, length 1470
00:09:42.228016 IP 10.0.0.1.46263 > 10.0.0.2.5001: UDP, length 1470
00:09:42.239218 IP 10.0.0.1.46263 > 10.0.0.2.5001: UDP, length 1470
00:09:42.252093 IP 10.0.0.1.46263 > 10.0.0.2.5001: UDP, length 1470
00:09:42.263358 IP 10.0.0.1.46263 > 10.0.0.2.5001: UDP, length 1470
00:09:42.275614 IP 10.0.0.1.46263 > 10.0.0.2.5001: UDP, length 1470
00:09:42.287565 IP 10.0.0.1.46263 > 10.0.0.2.5001: UDP, length 1470
00:09:42.300502 IP 10.0.0.1.46263 > 10.0.0.2.5001: UDP, length 1470
00:09:42.311772 IP 10.0.0.1.46263 > 10.0.0.2.5001: UDP, length 1470
00:09:42.323867 IP 10.0.0.1.46263 > 10.0.0.2.5001: UDP, length 1470
00:09:42.335949 IP 10.0.0.1.46263 > 10.0.0.2.5001: UDP, length 1470
00:09:42.348078 IP 10.0.0.1.46263 > 10.0.0.2.5001: UDP, length 1470
00:09:42.360166 IP 10.0.0.1.46263 > 10.0.0.2.5001: UDP, length 1470
00:09:42.372288 IP 10.0.0.1.46263 > 10.0.0.2.5001: UDP, length 1470

